id,url,title,text,score,created_utc,subreddit,num_comments,upvote_ratio,over_18
1j3smm2,https://www.reddit.com/r/TrueOffMyChest/comments/1j3smm2/i_miss_my_ex_so_much_but_dont_know_what_to_do/,I Miss My Ex So Much But Don't Know What To Do,"I (M31) think I need help but I’m not sure what to do anymore. 

I had a brief relationship with a girl (F30) for about 6 months from summer 2023 onward. I loved this woman so much. She made me so happy and made me feel seen in ways I could have never fathomed. I like to think during the good times, I did the same for her. She told me repeatedly she’s never been able to be herself with someone like she had with me. However, over that brief time together, I became overworked, burnt out, depressed, and my insomnia (amongst other health issues) starting acting up again. 

A bit of background context: she had an issue with me smoking weed due to her past trauma involving the drug. I would take a few tokes off a vape before bed to unwind, and was open about this from the first time we met, so I didn’t expect to change my behaviours. Over time, she wanted me to do it less and less. Initially this was fine, but by the time my insomnia was taking over, I needed to rely on it as a sleep aid. I told her as much, and this started our downfall.

Soon, we were fight about the weed smoking every time she saw me. I naturally withdrew, not wanting to be around her cause it led to fighting and stress, and I was already burnt out. She was upset that I was withdrawing from the relationship. That led to more and more resentment. 

After 6 months, I was severely depressed, my burnout had worsened even more, and I was becoming su!c!dal. I’m not happy about how dark things got, but I knew it was bad. We mutually broke up then, as I wasn’t able to improve on my weed smoking, though we left the door open for further communication and potentially getting back together. I was so depressed at the time that I couldn’t fathom being with anyone (or continuing to live), but I know she wanted to get back together for a lot of it. We met up a few times, some resulting in more fighting, others being truly cherished moments for the two of us. 

Ultimately, 9 months after the breakup, I wasn’t doing any better. I was scared that I was holding her back, and I made it clear to her that I feared her waiting around for me while I fail at having a happy life. She took those words to heart and moved on. However, a few weeks later, after a serious medical procedure, I texted her while I was waking up from the general anesthesia. She was angry at first, really upset that I was sending her loving sentiments a few weeks after her expressing the finality of the relationship. It led to a big fight, where she ultimately spent the night. It felt so good to have her in my arms again. To hear her say she loved me again.

But after that night, I reminded her I was still smoking pot in the evenings and she blew up at me. Told me she didn’t want to date me because of it. I told her I could stop, but she was past that. I was crushed. Two weeks later, I reached out pleading to be with her again, and she reamed me out. I cried and begged for her to take me back. It got ugly, and she was vocal that I was acting like a pathetic mess. Told me to never talk to her again, told me that in the span of those two weeks, she was already in a new relationship, told me she didn’t want to be with me, and said some piercing insults. She told me to delete her number.

I ultimately had a lot of failures on my end in this relationship. I didn’t compromise on the weed, I withdrew, and often wasn’t able to listen to her to the degree a boyfriend should. I recognize I fucked up. But it’s been two months since the last time we spoke and all I can think about day-in/day-out is her. I dream about her, wake up thinking of her, and spend all day every day missing her. It’s been 2.5 months since we last spoke, and almost a year since the official breakup. 

I miss her so much, and love her so much. Especially now that I'm less depressed and can feel the extent of my feelings. I write her letters every day, though I would never send them so as not to bother her. I miss her so much. She was the light of my life; in those brief moments with her, I truly felt like I had a soulmate, and I miss that. But I also know many people would look at that much fighting and say otherwise.

Ultimately, I’m struggling moving on. I quit weed the day we last spoke, and spent the last 2.5 months really working on myself. My burnout is gone, my depression is better and I have the tools to better manage it, and I am really living in accordance with my values. 

Here’s the issue: I really want to reach out to ask her to go for coffee to catch up. Yes I’d love to be with her again, but I don’t have that expectation. I just want to see her again, see her smile and laugh, and be in her presence once more. And get closure, so that if we truly can’t be together, my last memory of her isn’t her spewing insults at me. But I worry it would be an intrusion. If she’s actually with someone new, I don’t want to mess with her head. If she’s not, she may still hate me and not want to hear from me. 

Is there any world in which reaching out would not be a bad idea?",1,1741141614.0,TrueOffMyChest,4,1.0,False
1j3sm75,https://www.reddit.com/r/MakeNewFriendsHere/comments/1j3sm75/32m_seeking_fellow_tattoobookmetalhorror_nerds/,32M seeking fellow tattoo/book/metal/horror nerds,"
Howdy howdy. I’m a simple man. An all around nerd. I read a lot, code for a living, get tattoos, go to metal concerts, collect indoor plants, former barista/roaster (so massive coffee nerd), dog dad, do some indoor rock climbing. Bit of an existentialist and elder emo. Been isolating and allowing my introvert tendencies control me a bit too much lately. Hit me up if you think we could vibe! ",1,1741141581.0,MakeNewFriendsHere,1,1.0,False
1j3sm4e,https://www.reddit.com/r/work/comments/1j3sm4e/i_feel_like_a_zombie_at_work_and_im_not_sure_why/,I feel like a zombie at work and I’m not sure why,"I just started a job at a smoothie and coffee place. Everyday after work I feel so drained and cranky. Even if it’s only a 3 hour shift. I would work a 13-15 hour shift at my old job and would be kinda tired but not like this. 

For context i’m frustrated that the pay is $14 plus shared tips. But it’s showing for 30 hours I made $300 pre tax without the tips added yet. Plus the work is exhausting. If we are prepping frozen pineapple and mango you literally have to stab it with a knife a million times because it’s frozen solid together. After you will only get like 5-10 pieces off. So you have to just keep doing it forever. There’s other things that suck but that’s one example. Plus the managers and employees put on a fake smile because the company wants to look positive to guests and staff. But they get to a point where I honestly worry about them because they look like zombies. They barely talk and seem so drained. I guess I feel dramatic but also confused on why i’m so miserable after these shifts. ",4,1741141574.0,work,0,1.0,False
1j3sl5g,https://www.reddit.com/r/wedding/comments/1j3sl5g/customised_coffee_mugs_as_favours_yesno/,Customised Coffee Mugs as Favours?  Yes/No?,"I am thinking of customizing coffee cups to be similar to the SB Been There mugs as I am having a destination wedding.  The mug would have the name of the destination and then a whole bunch of fun images pertaining to lives and adventures of the bride and groom.  I would like something useful, so interested to know if this would appeal to our guests.  My fiancé and I collect these wherever we go... So was thinking of something like that for our guests seeing as though majority are travelling...",0,1741141495.0,wedding,11,0.25,False
1j3sl4p,https://www.reddit.com/r/CasualPH/comments/1j3sl4p/im_the_one_who_asked_previously_if_dating_app_is/,I’m the one who asked previously if Dating App is effective? So here’s my thoughts.,"M(27) I asked everyone’s thoughts on my previous post about dating app

I installed the Yellow dating app back in February what can I say? It’s both overwhelming and underwhelming at the same time.

What do I mean by that? nakakoverwhelm na I matched 20+ women which is cool but I don’t have a lot of time in a day to reply right away. Underwhelming kase umabot ako ng ganon kadaming matches yet sobrang bland majority ng response nila, I always try to be engaging and interactive how I construct my questions and approach naman.
(Pero parang nafefeel ko most of the women sa dating app had a recent break up or still trying to move on, pero ending di pa talaga sila fully healed) IDK I might be wrong or baka ako talaga ung problema hahaha.

I dated 3 women out of those numbers naman kahit papaano. Typical fine dine date, coffee and get to know more. They were all great, stable profession, good-looking, may value. Pero andun ung feeling ko na parang pilit lang lahat.

Iba padin talaga ung feeling na organically mo na meet ung tao at dumaan kayo sa due process lol. Ung tipong hindi mo hinahanap pero dumating na lang. Ganon ko kase nakilala ung dati ko eh, parang gut feeling mo na lang magsasabi na ahh ayan na yun.

Masaya naman ako right now lalo na sa achievements ko sa career and finances. Pero ibang iba talaga ang feeling na may kasama ka sa journey mo habang nagsusucceed ka noh?You get to share your wins with someone you love.

It’s probably gonna take some time din talaga to find that someone. Date to marry naman ang mindset ko I’m not into playing mind games at urong sulong. But I guess I’m gonna be single for a while or worst just be a cool single tito na lang din hahays.

PS: Dinelete ko na ung yellow dating app. Lord ikaw na bahala sakin, strongest soldier mo kaya ako…
",9,1741141493.0,CasualPH,9,1.0,False
1j3skit,https://www.reddit.com/r/travel/comments/1j3skit/do_you_need_to_tip_in_a_youth_hostel_in_the/,Do you need to tip in a youth hostel in the United States?," I stayed in a youth hostel for long time, but suddenly one day I suspected that the cleaning staff took away the clothes I put on the bed, and then I told the staff that the clothes were missing. He didn't admit that someone took them at first but promised to help me find them. He found them for me in the evening, and then asked me to buy him a coffee the next day. He didn't tell me how he found the clothes, but just said that he had worked hard to find them. I suspected that he was asking for a tip, which I thought was funny.",6,1741141440.0,travel,9,0.75,False
1j3sk01,https://www.reddit.com/r/relationship_advice/comments/1j3sk01/i_37f_think_my_gf_29f_is_going_to_break_up_with_me/,I (37f) think my Gf (29f) is going to break up with me,"I (37F) have been dating my GF (29F) for a couple of months now. I was worried about the age gap so have been taking it slow, but could see something building here. It's still new, but going well, interesting and varied dates both going out and about, events, for dinner, and we've spent time at our respective houses.

We spent all day Saturday together, I stayed at hers and we were making plans for this Thursday. She's now asked me to get coffee after work at a chain place (impersonal and low effort), we have never had a coffee date and this seems like a big step back in the type of dates we've had previously. To me this seems like she is going to break up with me, am I reading too much into it?

This is my first time dating after having my heart broken last year - I took some time to really work on myself after that but I guess I'm feeling insecure. My ex blindsided me and I just don't want go into another situation like that so want to be prepared for the conversation. ",1,1741141395.0,relationship_advice,5,0.67,False
1j3sjpy,https://www.reddit.com/r/UFOsModlogs/comments/1j3sjpy/uletstalkufos_approved_a_post_in_rufos/,u/LetsTalkUFOs approved a post in r/UFOs,"u/LetsTalkUFOs approved a post in r/UFOs

Author: ryannelsn

Moderator: LetsTalkUFOs

Action: approvelink

Context:

```
Title: Blinking Lights Above Los Angeles on January 1st

**Time:** January 1, 2025, around 12:50 PM PST  
**Location:** Echo Park, Los Angeles, California

*Processing video jm8d2yj4wkhe1...*

I was walking home with a coffee in hand, passing through an alley behind my apartment, when I noticed a large flock of birds circling above my apartment building. As I looked up to check them out, I immediately saw three *very* bright lights high above them, just hanging there in the sky.

As soon as I spotted the lights, the birds scattered.

The lights didn’t make any sense. They were in sort of a triangle formation and moving slowly but definitely weren’t helicopters or airplanes. All three were blinking—very noticeably.

After watching for a while, I headed inside, grabbed my binoculars, and went back out. Through the binoculars, it seemed like they had some sort of shape, sorta pointy. My first thought was something shaped like the *lunar lander*—bright, shiny, and with angles and points.

I was trying to see if maybe they were objects that were rotating and reflecting the sun's light as they did so, but through the binoculars the blinking was even more intense. It was a distinct *ON / OFF / ON / OFF* like a blinker. And extremely bright.

I watched for maybe five minutes? Mostly with my naked eye or through binoculars. At some point, I decided to try filming, but because of the bright daylight, I couldn’t see my phone screen at all—so I had no idea if I was actually capturing anything. I just pointed the camera in the general direction and hoped for the best.

These lights continued to move around slowly. Eventually, two of them started to move away while one remained, and I just stopped watching and went inside.

I checked flight trackers and didn’t see any activity in the area, but maybe I converted to UTC incorrectly? Still, they obviously weren't planes or helicopters. I had no idea what I was looking at.
```

Permalink:

https://reddit.com/r/UFOs/comments/1ijctio/blinking_lights_above_los_angeles_on_january_1st/



^(This content was automatically generated, and correct as of the time of posting. Changes to the content, such as edits or deletions, may not be reflected here.)",1,1741141373.0,UFOsModlogs,0,1.0,False
1j3sjp3,https://www.reddit.com/r/pourover/comments/1j3sjp3/i_need_your_opinion/,I need your opinion,"Ive been using my 1zpresso Jmax hand grinder for the past 6 months for my V60 and aeropress, its espresso focused and i like the coffee it makes,  would somthing like the comendante or the ode 2 offer something new to the taste or is just another trap

I want to know from people who have both grinders if they are worth it ",1,1741141371.0,pourover,0,1.0,False
1j3sjmw,https://www.reddit.com/r/AskNYC/comments/1j3sjmw/café_downtown_that_wouldnt_mind_us_bringing/,Café Downtown that wouldn't mind us bringing boardgames?,"Looking for a café ideally in midtown/downtown that has a nice vibe and wouldn't mind a small group playing a boardgame. Bonus points if it feels like a living room. 

Yes, I know about Hex & Co and other boardgame cafes but its not really what im looking for. Just want to get a coffee/snack and play Catan.

Thanks!",0,1741141367.0,AskNYC,2,0.33,False
1j3sjkp,https://www.reddit.com/r/BuyCanadian/comments/1j3sjkp/please_recommend_a_coffee_option/,Please recommend a coffee option,"I don’t have a very refined palette for coffee. I used to buy Starbucks Pike place to make at home in my French press. Can anyone please recommend an alternative as I don’t want to buy US products anymore? 
Something simple, not too elaborate or super bitter?",1,1741141362.0,BuyCanadian,7,1.0,False
1j3sj0a,https://i.redd.it/k80mc3827sme1.jpeg,Week 9 - Mashup - Revolving Manhattan,"Revolver + Manhattan 

1 oz Bourbon  
1 oz Rye  
1/2 oz Sweet Vermouth  
1/2 oz Coffee Liqueur  
1 dash orange bitters  
1 dash angostura bitters

Stir with ice in a mixing glass, strain into a chilled coupe

Drop a maraschino cherry in, express an orange peel over and garnish with it

Really pleased how this came it, it’s fantastic!",1,1741141316.0,52WeeksOfCocktails,0,1.0,False
1j3sirj,https://www.reddit.com/r/Coffee_Shop/comments/1j3sirj/aussies_which_is_the_most_popular_brand_of/,"Aussies, which is the most popular brand of commercial coffee machines in cafés or restaurants in Australia?",,1,1741141297.0,Coffee_Shop,1,1.0,False
1j3sh61,https://www.reddit.com/r/ActualLesbiansOver25/comments/1j3sh61/making_friends_in_queer_spaces/,Making friends in queer spaces,"I’m curious on your experiences in making friends in queer spaces… there’s a coffee shop in my area that is queer owned and most, if not all of the baristas are lesbians. This place runs events and their calendar has a Lesbian Game Night this week. I’m sure everyone can join, but I’m anxious about it and generally over thinking it… sooo I would love to hear some input from y’all.  

If it matters back when I was in college I would go to a queer game night at a Pride Center, but it just seems like it was easier back then. 

",3,1741141171.0,ActualLesbiansOver25,0,1.0,False
1j3sfgg,https://i.redd.it/y4jgei166sme1.jpeg,"""The Great Pretender""","---


Reen was known for her radiant smile. At work, she laughed at every joke, always had a kind word to say, and made everyone feel important. Her presence was warm, comforting—like a flickering candle in a dark room. People gravitated toward her energy, admiring her ability to always see the bright side.


Her social media told the same story. Bright photos of coffee dates, sunsets, and joyful moments filled her feed, each caption carefully crafted to show a life of happiness and gratitude. She often received messages from friends and acquaintances saying, “You’re such a positive person!” or “I wish I had your happiness.”


But none of them knew the truth.


Behind the smile was a woman who felt nothing.


At home, in the quiet of her small apartment, the facade crumbled. The warmth in her eyes faded as she stared at the ceiling, listening to the ticking of the clock. The world outside continued to move, but inside, she felt frozen in place. She wasn’t unhappy because of one specific tragedy—there was no great heartbreak, no devastating loss. It was just the exhaustion of pretending. The pressure to always be okay.


Some nights, she would sit in front of the mirror, forcing a smile, watching as her own reflection became unrecognizable. The act had become second nature, but there was no joy behind it—only muscle memory.


She had fooled everyone, even herself at times. But at night, when there was no one to perform for, the loneliness crept in.


It wasn’t that she didn’t have people who cared. She had friends, coworkers, and a best friend, Blam, who always checked in on her. But Reen was good at deflecting, turning conversations away from herself, redirecting them with jokes and compliments. No one ever pried too much—except Blam.


One evening, after another long day of forced smiles and empty conversations, Reen sat across from Blam at their favorite café. The hum of background chatter and the clinking of cups filled the air. Blam studied her closely, stirring her coffee absentmindedly before saying, “You don’t have to be happy all the time, you know.”


The words hit her harder than she expected.


Reen froze, her fingers tightening around her cup. She wanted to brush it off, to laugh and say something witty, but no words came. Her throat felt tight, and before she could stop herself, her eyes burned with tears.


Blam didn’t press her. She simply reached across the table, placing a hand over Reen’s, grounding her in that moment.


For once, she didn’t fight it.


That night, she allowed herself to feel. To acknowledge the sadness, the exhaustion, the truth. She sat on her bed with the lights off, letting the weight she had carried for so long settle in her chest. It wasn’t easy—she had spent years building this image, convincing herself and everyone around her that she was okay.


But in that small moment of honesty, something inside her shifted.


Maybe she didn’t have to pretend forever. Maybe, just maybe, real happiness would come—not as a performance, but as something real.


She didn’t have all the answers yet. She didn’t know how long it would take or what healing would even look like. But for the first time in a long time, she let herself breathe.


And in that breath, there was hope.


﻿

""It's okay to not be okay. Pretending to be happy won’t heal you, but allowing yourself to feel will.""

""You don’t have to carry the weight of the world alone. Sometimes, letting someone see your pain is the first step toward healing.""",4,1741141029.0,mentalhealth,0,1.0,False
1j3sfbu,https://www.reddit.com/r/NameThatSong/comments/1j3sfbu/lofi_song_with_female_singer_kinda_like_clairo_or/,"lofi song with female singer, kinda like clairo or beabadoobee","The song mentions something about coffee is waiting or something, cover art is of a girl in a hoodie taking a mirror selfie in green tint.",1,1741141019.0,NameThatSong,3,1.0,False
1j3sez3,https://www.reddit.com/r/vtubers/comments/1j3sez3/the_vtuber_industry_is_nothing_but_a_fish_market/,The Vtuber Industry is nothing but a Fish Market.,"Idk if this is just me but isnt it funny how the peak of Vtubing are all aquatic creatures? Top Streamers? Shyly, Bao the Whale, GawrGura, Ninomae Ina. Top CEOs of Vtubers? Fishman, Sakana and Vedal. Top Female Streamer? Vedal. Top one independent Vtuber recently? Vedal. Vtubing Company that has the least restrictive rules? Fishmans Company. Top Coffee Brand Vtuber? Fishmans Company.

Like this is actually crazy.. or.. is this a plot by Atlantis to slowly but surely indoctrinate us into their propaganda of Vtuber? I think so! So wake up people! The Fish Market is slowly by surely winning and they absolutely dominating our beloved oshis!",3,1741140988.0,vtubers,2,0.71,False
1j3sevq,https://www.reddit.com/r/greysanatomy/comments/1j3sevq/i_dont_think_george_loves_or_has_ever_loved_callie/,I don’t think George loves or has ever loved Callie,"I think he just settled because obviously the person whom he wanted (Meredith) didn’t want him. The way he treats Callie isn’t just it, she was never his first choice, he never chooses her its always Izzie this, Izzie that, Meredith Meredith that. I am about to finish season three right now and on that episode they had a fight that included Izzie and Callie told him she loved him he went on to run to her, spent the night together and slept together. The audacity! I couldn’t believe it. After that he promised Callie that they were gonna go on a coffee date and then he went to support Izzie on that surgery for donating bone marrow. Its like he doesn’t even think about Callie, she isn’t his priority, she is the last thing on his mind. There are a lot of things that happened during these seasons that made me come to this conclusion. 

Am i wrong to think this way? Do you guys think he loves her?",4,1741140980.0,greysanatomy,3,1.0,False
1j3set8,https://www.reddit.com/r/firefightersuk/comments/1j3set8/drug_testing/,Drug testing,"For those trainee firefighters within the LFB who have began their training. After your pre-employment medical, have you or anyone else on the apprenticeship been drug tested again at any point? And what would be the likelihood?

Asking because I was exposed to second hand smoke on a trip to Amsterdam. Silly I know, but at the time I didn’t want to separate from the rest of the group whilst everyone else sat inside a coffee shop. Didn’t smoke at all, but ended up inhaling a lot of second hand smoke which I regret since now I’m paranoid I could fail a random drug test. 

Any insight would be greatly appreciated. ",1,1741140974.0,firefightersuk,0,1.0,False
1j3seh2,https://www.reddit.com/r/Fishdom/comments/1j3seh2/why_are_all_lactose_intolerants_like_this_to/,"why are all lactose intolerants like this?: (to machine gun by slowdive) shotgun 4 boss coffees now gotta blast on that toilet like nasty brown (yeah) gotta give some of that hazel whip (uh!) drowning in that sumptuous bronze  (lil John WHAT? sample) sittin on my ivory gorge, my palatial trough (arb","Itrarily-selected slur) rectal plight my porcelain privilege… and so on so forth  

#moodge ",1,1741140946.0,Fishdom,0,1.0,False
