id,url,title,text,score,created_utc,subreddit,num_comments,upvote_ratio,over_18
1idtdf5,https://v.redd.it/imdimdjn96ge1,Bought used La Marzocco. Loud contractor noise,"Hi folks,

I just bought La Marzocco Linea Classic AV 3 group used.
Upon the installation, I could hear this heavy clicking contractor noise twice per minute. 

The seller says I can do nothing about this but would like to know anyone who experienced this and solved this issue.

This is too loud that the whole coffee shop can hear this and it’s frustrating.

If you have anything to share, I would appreciate it!

Thanks",1,1738260763.0,Coffee_Shop,0,1.0,False
1idtd91,https://i.redd.it/q23q2ojn96ge1.jpeg,Kapp’n and fam,"I invited Kapp’n to coffee, and he brought the whole family. 🐢 🐢 🐢 🐢 ",1,1738260748.0,AnimalCrossingNewHor,0,1.0,False
1idtct9,https://i.redd.it/k2uuw5hk96ge1.jpeg,"✨🐾~• If I can visualize it, I can recreate it; Costume Design Rendering 💕 •~🐾✨",✨🐾~• Never underestimate my power as a costume designer •~🐾✨,1,1738260719.0,scene,0,1.0,False
1idtcm3,https://www.reddit.com/r/Wellbutrin_Bupropion/comments/1idtcm3/cold_turkey_15_weeks/,Cold turkey 1.5 weeks,"I just stopped Wellbutrin cold turkey after 1.5 weeks. The first couple days I noticed a difference but then the only difference I noticed was waking up every night in the middle of the night with this thudding sensation in my chest. Every night. During the day I noticed no difference at all except that I couldn’t drink a coffee without getting really jittery and uncomfortable. 

No side effects aside from the thudding at night and no side effects whatsoever today after going cold turkey. 

I dunno, this was pretty disappointing. Aside from the likely higher blood pressure, this eventually felt like a sugar pill. ",1,1738260705.0,Wellbutrin_Bupropion,0,1.0,False
1idtcdf,https://www.reddit.com/r/SierraCollege/comments/1idtcdf/international_student_looking_for_friends/,International student looking for friends,"
Hey everyone!

I’m an international student in my first year here and still getting used to everything. I’d love to meet new people, practice my English, and just have some good conversations.

Haven’t made friends yet, so if you’re up for grabbing coffee, studying together, or just chatting, send me a message!",1,1738260688.0,SierraCollege,0,1.0,False
1idtbkd,https://www.reddit.com/r/lactoseintolerant/comments/1idtbkd/milk_substitute/,Milk substitute,Hi hi! Normally when I go to Starbucks or just get coffee in general I get a peppermint mocha but I've noticed it's been KILLING my stomach afterwards and I am assuming as I've aged my lactose intolerance has gotten worse. I don't want to swap drinks I just wanted to know what y'all use as a milk substitute? I personally hate oat milk and I can tolerate almond milk but it's not my favorite. I want smt that tastes like 2% milk but is dairy free. Any ideas?,1,1738260631.0,lactoseintolerant,0,1.0,False
1idtbdc,https://www.reddit.com/r/TwinCities/comments/1idtbdc/coffee_shop_spacesbaby_shower/,Coffee Shop Spaces/Baby Shower,"Hi all! My husband and I are coffee aficionados and are expecting this Summer. We had the idea of doing our baby shower at a coffee shop. Looking for recommendations for
coffee shops that have a large ish space for events! Does this exist? We are local to the twin cities area. Thanks for all and any insight! ",1,1738260619.0,TwinCities,0,1.0,False
1idtb8t,https://www.reddit.com/r/longisland/comments/1idtb8t/my_halo_bolt_was_stolen_in_uniondale_this_morning/,My halo bolt was stolen in Uniondale this morning 1/30,"I parked in front of the Uniondale 7/11 on Oak Street to run in and grab a coffee on my way to work around 9:30 this morning. Low tire pressure light was on so I decided to use my Halo Bolt while I ran in the store. I was in 7/11 for no more than 5 minutes and walk out to my Halo Bolt stolen. It's a longshot but if anyone saw someone steal it off my car, please message me. Thank you. Unfortunately I would have been parked out of sight of any 7/11 cameras, but I was on Oak Street.",3,1738260610.0,longisland,0,1.0,False
1idtb0w,https://www.reddit.com/r/emetophobia/comments/1idtb0w/am_i_at_risk/,Am i at risk ?,I work at a coffee place. I haven’t worked since tuesday and I came in today at 6:30. My boss’s son was here and he’s been here all morning. Around 9:30 my boss came in and said “ I’m not gonna have coffee today because I was sick to my stomach last night “ I asked her what she meant and she said “ it was coming out of both ends “ WHY WHY WHY she would come in today is beyond me as last night was only a few hours ago. I haven’t physically been near her since tuesday but she does function as a regular employee and makes drinks and is often behind the counter. I have washed everything in the entire shop and the counter in bleach . How at risk am I ? I’m also worried my bosses son will get it and it will just go through all the employees. she hasn’t came out of her office yet but i’m also scared for her to get near me. ,1,1738260596.0,emetophobia,1,1.0,False
1idtayq,https://lbabi.nz/bPGOti,"[Amazon] Two Rivers Coffee Flavored Coffee Pods, K Cup Brewers, Assorted Flavored Coffee, 40 Count is $38.60",,1,1738260593.0,TopDealsCanada,0,1.0,False
1idtamu,https://www.reddit.com/gallery/1idtamu,Pixel 8 Pro photos,Some photos from today on my walk in local area from early morning to evening ,1,1738260570.0,pixelography,0,1.0,False
1idtadf,https://www.reddit.com/r/lawschooladmissions/comments/1idtadf/love_letter_to_northwestern/,Love letter to Northwestern,"Since this worked for me for Fordham, I’m remixing for Northwestern. Hit me baby!! (Dean Lee I will bring u coffee every morning for a month if that’ll get me in)

Please please please accept me this wave Please please please welcome me with open arms when i just wanna wear purple so badd heartbreak is one thing waiting is another i beg you please call me today with the A Wave haiiiiii plz plz plz
 -Lawbrina Lawrpenter",15,1738260552.0,lawschooladmissions,1,0.89,False
1idt9zd,https://www.reddit.com/r/couponsjet/comments/1idt9zd/16299_hibrew_h14_espresso_coffee_machine/,(€162.99) >> #HiBREW H14 Espresso Coffee Machine Geekbuying Coupon (Geekbuying Europe),(€162.99) >> #HiBREW H14 Espresso Coffee Machine Geekbuying Coupon (Geekbuying Europe) [https://opcoupon.com/e159-00-hibrew-h14-espresso-coffee-machine-geekbuying-coupon-geekbuying-europe/](https://opcoupon.com/e159-00-hibrew-h14-espresso-coffee-machine-geekbuying-coupon-geekbuying-europe/) ,1,1738260524.0,couponsjet,0,1.0,False
1idt96k,https://www.reddit.com/r/r4r/comments/1idt96k/26_m4f_tampa_looking_for_love/,26 [M4F] #Tampa Looking for love,"Hey, I’m looking for a serious relationship that I’d like to result in marriage. I’m a 26 year old man who works in software engineering. I’m 5’10”, 260 lbs, but working on it. It would be nice to eventually have a family and all of that.

I like to try out coffee shops, play guitar, sing, play video games, and go to events. I’m an extroverted introvert, so I love to socialize, but not with strangers so much. I’m looking for a partner that I can do these things with and more.

I’m liberal, college educated (BS and MS in computer science), with no kids, and never married. I do have one cat and one dog (chihuahua mix).

The not so good stuff about me is that I was engaged, I’ve experimented with men a couple of times, I’m a little desperate, and I’m in debt because I made the poor decision to buy a house and more that I couldn’t yet afford, then proceeded to quit my job. I’m in Pittsburgh, PA at the moment, but am relocating to Palm Harbor, FL in the coming week to be closer to family for a much needed support system. I will be living with my parents while I clear my debts and sell the house.

I’d like to meet somebody who can fall hopelessly in love with me so that I can do the same. If you’re interested, send me a message 😊 ",1,1738260465.0,r4r,1,1.0,False
1idt8od,https://www.reddit.com/r/AskIreland/comments/1idt8od/can_you_recommend_a_new_coffee_mechine/,Can you recommend a new coffee mechine?,"Okay so, I need a new coffee mechine. My old one was cheap as, and surprise surprise it has stopped working after less than two years. 

This time I'm open to spending a bit of cash. Can anyone recommend a good coffee mechine for me? (Old one was a Bosh Tassimo)

Thanks ",1,1738260427.0,AskIreland,4,1.0,False
1idt8jl,https://i.redd.it/zcnhv1ao86ge1.jpeg,What is this spike and where did it come from?,Just went for a coffee break at work and checked my portfolio on cmc. It had this crazy spike but I can't trace where it came from. Not any of my assets have pumped that much in the last 24 hours. Is this just a bug or is there some kind of explanation for this?,1,1738260418.0,CoinMarketCap,0,1.0,False
1idt8i7,https://www.reddit.com/r/Jokes/comments/1idt8i7/so_a_philosopher_a_mathematician_and_a_physicist/,"So a philosopher, a mathematician, and a physicist were at Starbucks.","So a philosopher, a mathematician, and a physicist were at Starbucks.

The mathematician turns to the physicist sitting next to him and says ""You know, physics is just applied mathematics!""

They all have a good laugh, at which point the philosopher interjects from across the table. ""And mathematics is just applied philosophy!""

The laughter roars even louder, and then the physicist turns to the philosopher.

""Shut the fuck up and make my coffee.""",2,1738260416.0,Jokes,0,0.67,False
1idt82c,https://i.redd.it/751yufek86ge1.jpeg,SGP -> Specialita = giggling,"My first post 🫡

I wouldn't have believed it before...

Today I received my Eureka Mignon Specialita coffee grinder.
So first I put my Sage/Breville Smart Grinder Pro grinder to one side and put the new boss, the Specialita, in its place.
So far, the espresso my wife and I have made with the SGP in conjunction with the Dedica 685 has actually tasted quite good. 

Then I shredded about 100g of beans in the Eureka to find the right grind level and then suddenly...THE PERFECT SHOT.
16.5g of fresh, dark roasted beans in, 41g out in 27 seconds.

The espresso in the cup tasted like it was prepared by God himself and suddenly I can taste ""dark chocolate"" and ""nut"" - as it says on the bean packet.
Perfect balance between acidity and bitterness.
How often have I heard in videos that the particle distribution of the Specialita is really good (blah blah blah) compared to the SGP coffee grinder, but that it can make such a difference - unbelievable. 

My wife came back with the kids and asked me why I was grinning ear to ear.

Sometimes you have to be happy about the little things in life 😁",1,1738260383.0,espresso,0,1.0,False
1idt806,https://i.redd.it/apbazfqj86ge1.png,Stain or cavity?,"None of my teeth feel pain or sensitivity 
(I drink a lot of coffee and tea)",1,1738260377.0,askdentists,1,1.0,False
1idt7ce,https://www.reddit.com/r/USC/comments/1idt7ce/where_is_the_best_hot_chocolate_onaround_campus/,Where is the best hot chocolate on/around campus?,"I am on a journey to find the best hot chocolate on USC campus/a walking distance away from it. So far, I've tried Dulce (which tastes like flavored water) and Ministry of Coffee (which is actually really good). To me, that's already a lot of places considering how much it costs to buy anything in this city. So, is there any hot chocolate better than Ministry of Coffee, or is it the 🐐?  ",1,1738260331.0,USC,2,1.0,False
1idt76m,https://www.reddit.com/r/eupersonalfinance/comments/1idt76m/anyone_here_investing_in_ecof/,Anyone here investing in ECOF?,"Hello! Anyone investing in ECOF ( wisdomtree coffee EUR)? I would like to know what's your strategy . 
I'm winning 17% today and I'm not sure if I should just sell or leave it , because it will go down for sure before grow again. ",1,1738260321.0,eupersonalfinance,0,1.0,False
1idt68i,https://i.redd.it/9gkhhtw686ge1.jpeg,"Yeah, sorry...I'm not listening to bought and paid for senators claim they're looking out for thr health of Americans. People like Warren and Sanders are give big money to push big pharma and big food agents. Keep speaking the truth RFK Jr.",,1,1738260256.0,u_Peakayo,0,1.0,False
1idt53q,https://www.reddit.com/r/SOProgressives/comments/1idt53q/local_magaowned_businesses/,Local MAGA-owned businesses,"Sharing so people are informed. 

Cartwright's, Parkside Cafe, Rooster's, Debby's Diner, Rosario's, Sweet Tea Cafe, Hawaiian Hut, Rogue Burgers, Punky's Diner, American Mercantile, Mamosa's, The Chicken Shanty, MAGA Plumber, Southern Oregon Signs, LLC, Davis Roofing, Ground Control, Brotherton Pipeline, Forage Coffee

This information comes from employees, patrons, and personal experiences with management. 
I will continue adding to this list as people share more locations.",1,1738260179.0,SOProgressives,1,0.67,False
