id,url,title,text,score,created_utc,subreddit,num_comments,upvote_ratio,over_18
1hkyj6a,https://www.reddit.com/r/discordfriends/comments/1hkyj6a/23_year_old_irish_guy_looking_for_peeps_to_talk_to/,23 year old Irish guy looking for peeps to talk to !!,"

































































































































































Salutations everyone !
How are we all ? 
We better be good !!

Here’s my discord : wigwamlad


I’m here today on the look for friends!  (short term / long term) 
Here’s some interesting stuff about me !

Well I’m from Ireland and I’m in uni ! And I’m 23
I’m nerdy, heavily enjoy fantasy and grimdark settings, so massive LOTR, elder scrolls, GOT/HOTD and Warhammer fan.
I play on PC (total war, arma 3, Hoi4, stellaris and many more ) and ps5 (Elden ring, battlefield) 
Im also big into history, specifically military history!! 

I’m a pagan, and I believe in ghosts and the supernatural!
Have had a few Creepy encounters

My fav food is a toastie and I love coffee n tea! 

I hope to hear from someone soon and if you have read this far, no hey, hi or hellos, write an introduction!",1,1734991197.0,discordfriends,0,1.0,False
1hkyis0,https://i.redd.it/qwp1tpdi7o8e1.jpeg,Yuh,,2,1734991166.0,roaringkitty,0,1.0,False
1hkyi4w,https://www.reddit.com/r/MakeNewFriendsHere/comments/1hkyi4w/hey_you_im_a_24m_from_ireland_on_the_hunt_for/,"HEY YOU, I’m a 24M from Ireland, on the hunt for weird and fun people! COME TALK!!","







































































































































































































































































































































































































































































































































































































































































































































































































































































































































































































































































































































































 






















 









































































































































































































































































































































Salutations everyone !
How are we all ? 
We better be good !!

I’m here today on the look for friends!  (short term / long term) 
Here’s some interesting stuff about me !

Well I’m from Ireland and I’m in uni ! And I’m 23
I’m nerdy, heavily enjoy fantasy and grimdark settings, so massive LOTR, elder scrolls, GOT/HOTD and Warhammer fan.
I play on PC (total war, arma 3, Hoi4, stellaris and many more ) and ps5 (Elden ring, battlefield) 


Im also big into history, specifically military history!! I’m a history student in fact , my areas of study are Roman/Greek, military, Irish and archaeology! 
I’m a pagan, Norse pagan 

My fav food is a toastie and I love coffee n tea! 

I hope to hear from someone soon and if you have read this far, no hey, hi or hellos, write an introduction!!",1,1734991116.0,MakeNewFriendsHere,2,1.0,False
1hkyi24,https://www.reddit.com/r/povertyfinancecanada/comments/1hkyi24/unemployed_ei_ran_out_in_a_bad_spot_any_advice/,"Unemployed, EI ran out, in a bad spot. Any advice appreciated.","Hello,

I'm attempting to help out a friend who's in a bit of a bind. He's unemployed, EI has run out and has no family support. He had roommates, but they were unable to continue the upkeep on the place and have left. He has found some family willing to put him up, but they live about 4 hours out of town and he has no money to rent a truck or move their things.

I suggested opening a line of credit or credit card (they're with RBC) as I don't believe he updated his employment status with them and figured since his credit was good he could apply online. He believes he'd have to go into a branch in person to apply. I'm not really sure as I don't bank with RBC; I know he doesn't have a credit card or line of credit with them already, so I don't know if they would just let him open a line of credit out of the blue. 

I know he still has an EI cheque coming in, but it's been delayed with the Canada Post strikes. This is unlikely to be enough on its own to pay all the upcoming moving expenses on its own. 

I don't really have any money to lend this person. I've been trying to help out with coffee and conversation but I don't know what else to do. As you can imagine, my friend is in a very stressful bind and finding money to help get them out in these current circumstances feels impossible. 

Any advice would be appreciated. ",2,1734991110.0,povertyfinancecanada,3,1.0,False
1hkyhz6,https://www.reddit.com/r/AskDocs/comments/1hkyhz6/30m_if_ive_become_dependent_on_caffeine_will_i/,"30m - if ive become dependent on caffeine, will i feel “better” after stopping?","Right now im in the situation where i have caffeine in the morning and feel good for 4-5 hours, than start feeling like garbage; depressed, anxious, frustrated; it’s real bad and it borders on suicidal ideation. It goes away 90% of the time if i have some more coffee/energy drink etc.

I want to know if once i ween off the caffeine completely, will i still feel like shit all the time now that im not having the caffeine? I don’t know if the neurotransmitter’s will recover to that point or if at best i might only feel slightly less awful once the direct withdrawal symptoms stop.

Idk how long ive had regular caffeine, probably like 7 ish years. Probably between 150-400mg a day. Started cause after college i had trouble adjusting to the 8-5 work schedule",1,1734991104.0,AskDocs,1,1.0,False
1hkyhds,https://www.reddit.com/r/CrazyIdeas/comments/1hkyhds/caffeine_infused_body_wash_soap_shampoo/,"Caffeine infused body wash, soap, shampoo & conditioner","For those that shower in the morning, just use these in the shower and get your dose of morning caffeine. Don’t need to stop for coffee on the way to work or run late and unable to make some/pick some up. 

You’ll get your morning fix first thing and you’ll be ready to go immediately after the shower. 

The company can figure out recommended safe amounts use and their legal department can worry about out liability. ",2,1734991056.0,CrazyIdeas,1,1.0,False
1hkyhc4,https://i.redd.it/5a8mjg157o8e1.png,From one of my regulars 🥺,"Gift card was $15, what a wholesome surprise 🥰",2,1734991052.0,AmazonDSPDrivers,1,1.0,False
1hkygcz,https://www.reddit.com/gallery/1hkygcz,Drinking coffee while viewing the North Korea at Starbucks,"Starbucks has opened at the Aegibong Peace Ecological Park Observatory in Haeseong-myeon, Gimpo-si, Gyeonggi-do, which offers a view of North Korea. 

As the first Starbucks store located near the Demilitarized Zone (DMZ), it is expected to provide a unique experience at the border with North Korea. 

'Starbucks Gimpo Aegibong Ecological Park' is located just 1.4km away from Gaepung-gun, North Korea. This cafe is located near the DMZ, where civilian access is restricted, so customers have to go through a security check before entering, creating a special experience. 

Starbucks explained that they decided to open this store because they highly valued Aegibong's historical significance and tourism potential. This suggests that Starbucks made a strategic decision that took into account the local culture and history, not just the simple sale of coffee. 

The opening ceremony held in December was attended by about 200 media and citizens from around the world, including Korea, the United States, Japan, and the United Kingdom, showing great interest. Despite the sub-zero cold weather, many people waited in line to order coffee before the store opened.




Add: 289, Pyeonghwa Park, Wolgot-myeon, Gimpo-si, Gyeonggi-do, Republic of Korea",1,1734990973.0,KoreaSeoul,0,1.0,False
1hkyf8r,https://www.reddit.com/r/dating_advice/comments/1hkyf8r/lots_of_girlfriends_but_no_girlfriend/,Lots of girl-friends but no girlfriend,"A little counter-intuitive, i know, but that's my situation at the moment.

What's bugging me (20m) is that i have lots of girl-friends, and for some of them i had developed feelings, but i still managed to get 0 romantic interest from them, so that got me thinking, what's wrong?

I feel like i get a decent amount of attention from girls, they like to talk with me, they often get quite touchy, i'm generally viewed as a funny light-hearted guy and i get some compliments for my appearence and physique from time to time. You know, things that would generally make you confident about your appeal to the other sex. 

Where it all falls apart is trying to date those girls. It typically goes like this: i get to know a girl, talk to her, get along with her, see if i like her, then when i feel sure that there is some interest from her, i subtly try to make a move, (like suggesting a quick coffee after lessons or things like that) and that's when things go wrong, because the girl would start acting quite ""uncomfortable"".

-Like you know when you're in your car, you find a deer on the road and it just gets blocked while staring at your headlights? i get THAT look.- Like my approach totally caught them offguard and was totally unexpected, all that is followed by either uncomfortable laughter, rushed excuses, or outright rejection. 

At that point i just let the conversation die off naturally and sink in my embarassment like the titanic, obviously.

I must admit i'm not the best at dating, so that's why i'm asking if you have any clue on this. Why girls just really want to be friends but refuse to date me? 

Maybe i should mention that i'm 5'3"", since i know most girls have strong opinions about height. ",2,1734990881.0,dating_advice,4,1.0,False
1hkyeys,https://www.reddit.com/gallery/1hkyeys,DIY coffee filter roses update: they were great and I had plenty for every table and decoration with more to spare! ,,16,1734990856.0,Weddingsunder10k,2,1.0,False
1hkyeh7,https://www.reddit.com/r/Market76/comments/1hkyeh7/h_65k_caps_w_junk_leaders_coffee/,"H: 65k caps W: Junk, Leaders, Coffee",,1,1734990813.0,Market76,3,1.0,False
1hkye89,https://www.reddit.com/r/Market76/comments/1hkye89/h_know_all_mods_for_gat_plasma_for_modding_or_new/,"H: know all mods for gat plasma for modding or new craft w: leaders, 4 star mods, LnL8s, canned coffee, uncooked possum",,1,1734990793.0,Market76,5,1.0,False
1hkydys,https://www.reddit.com/r/EntitledPeople/comments/1hkydys/karen_screamed_at_me_and_called_me_crazy_for/,Karen screamed at me and called me crazy for daring to be on her road,"Hello all you happy people! 

I will start by saying, I am a wheelchair user.  Even though I am confined to a chair when I leave my apt, I treasure what little independence I have and strive to do as much as I can on my own. 

This morning, being smack dab in between a snowstorm and Christmas , I had to venture out for a few last minute things. We had a blizzard on Saturday so I don't think I have to say how very much our sidewalks suck right now even though  I know the crews are doing their best to clear things up.  Between snowbanks blocking the entrances, huge pools of ice covering the whole sidewalk in places, and piles of slush, its a fun filled  navigation nightmare lol. So I was forced to give up and use the roads and try and stick to the bike lanes. Trust me, if I could have stayed home I would have! 

So, there I  was, making my way down the road . Trust me, I  am easy to spot lol. I was doing my thing, and some random bitch decided to lean out her car window and scream at me, asking if I were fucking crazy. Like bitch, I'm just trying to get home without dying, I don't need you piling on with your ignorance of the situation. Maybe try and look atound and notice whats happening before you scream at a rando in a wheelchair. Merry fucking Christmas to you too, Karen! 

I need more coffee",16,1734990773.0,EntitledPeople,4,1.0,False
1hkydtk,https://www.reddit.com/r/superautomatic/comments/1hkydtk/overwhelmed_with_options/,Overwhelmed With Options ,"I’ve spent hours reading reviews and this sub between the pregnancy brain fog and Christmas chaos I am even more confused than when I started. Can anyone help me pick a machine? 🙏🏼

Budget: $1,000 but bonus points if closer to $600

What I want to make:
-Espresso
-Americano 
-Lattes

 I wouldn’t say we are coffee experts by any means. Currently I drink Nespresso machine or Starbucks. Currently my husband drinks coffee from a chemex pour over but would be happy to replace with americanos.  A foam wand would be nice but I would consider continuing to use my separate steamer. Don’t really want a  milk reservoir if it has to be cleaned.

Important factors: 
-If at all possible would like to minimize the plastic pieces. Not worried about a plastic water reservoir or anything but would love the water heating part to have minimal/no plastic 
-Would like to spend less than 10 min a week cleaning/maintaining 
-Ideally not a crazy amount of counter space 
-Not a deal breaker but bonus if it could brew half-caf or decaf easily along with normal espresso ",1,1734990759.0,superautomatic,3,1.0,False
1hkydof,https://i.redd.it/gf7u4wn86o8e1.jpeg,Marvel Spiderman Symbiote One more cup of Coffee.. by denism79 ,,1,1734990746.0,Trailerclub,0,1.0,False
1hkydff,https://www.reddit.com/r/findommes/comments/1hkydff/i_think_i_found_the_best_domme/,I think I found the best domme 🥳😊 ,"
I found and submitted to @fair_ad_1355  and it's been the greatest experience of my finsub life she knows how to bully me just enough and she's hot smart and cares about your life outside of findom she charges fair prices and she is just overall the best domme I have met and I have been doing this for 1 year now she made me feel excited to send her a tribute I am super happy to buy her coffee everyday",1,1734990725.0,findommes,1,0.67,False
1hkyckk,https://www.reddit.com/r/TheAbsoluteSolver/comments/1hkyckk/recording_256_of_jaspers_personal_log_a_morning/,Recording #256 of Jasper's personal log: A morning with a twist.,"\-Start of recording-

Location: Jasper's master bedroom in the mansion where N, Jasper, L, Uzi, J and previously V, live.

Time: 08:00 local time

[Jasper's bedroom](https://preview.redd.it/ojh3lwkqsn8e1.jpg?width=1280&format=pjpg&auto=webp&s=e5a627f185355891e199143b2eaf3e0e54789933)

I slowly woke up to the sound of my alarm clock with the music of the morning radio. Still tired, I quickly pressed the button to shut it down and layed back into the cushions of the bed. Looking to my left, I saw the empty spot where just a few weeks ago, V lay. I felt a sting of hurt in my core but quickly pushed the thought aside. Nothing can change the past, the only thing we can change is the future.

With a groan, I pushed away the covers, stood up and put on my clothes. Just as I was done, I heard a yawn and smiled as I looked at the floor on the edge of my bed. Loyd, my corgi, had just woken up too.

As soon as he noticed me, he barked happily and walked over towards me on his short paws. I crouched down and petted him, earning another few happy barks in the process. After a few minutes, I stood up and we walked out of the bedroom and down the hall, walking by the bedrooms of the other in the process, hearing them waking up too.

While walking down the stairs down to the ground floor, I remebered the funny process of how we came to living together in a mansion. At first, when we started expanding onto the surface of the planet all those years ago, I wanted to live in a decent sized house on my own, but N realy wanted us all to live together as a firned group, and long story short, it happend. We were careful though that even with it being an older design, it didn't look like the manor where J, V and N lived back when they were still worker drones. To avoid causing PTSD.

As I entered the kitchen, I took some bread, some nutella and made a sandwich. Leaning against the counter, I started the coffe machine and it was not much later that a grumpy and still very sleepy L walked in.

""Good morning bro."" I said, still munching on my sandwich.

""No talk, coffee first."" L said, grabbing a mug and fillingnit with coffee, chugging the first one in 1 gulp before drinking the second one at a much calmer pace while turning to me.

""Good morning commander. Slept well?"" He asked.

""Dide, you know that we're off duty we don't call each other by-"" I stopped mid sentence when I saw his grin.

""Oh you asshole! You were messing with me!"" I said, while playfully smacking him on his shoulder. After which we had a good laugh about it.

""Oh, right, almost forgot."" L said before changing one of his hands into a holgram projector and showed a projection of...a starfighter?

He continued talking. ""Some of our spies in the remnants of the Republic, that corrupt faction who's capitol system we destroyed with Starkiller base, reported to me yesterday that they found these starfighter designs. Apparently the Republic had designed them but wasn't really using them. I thought you should know before we head to work today.""

I looked at the description next to the image of the starfighter, my digital eyes growing bigger with each word.

""You're telling me they had desinged THAT BEAST  and weren't using it?! Why?!"" I asked, seeing the sheer power of the fighter, it far outclassing the best fighter jets of our own.

""Cost."" L answered. ""Apparently they costed 400.000 credits to produce per unit, and maintenance was way more complicated and more expensive than their regular fighters. But they were building them at a small scale in only 1 factory using custom mad-parts. If they had been producing them at a bigger scale they would have cost a lot less. Plus there are probably other ways to make it cheaper without weakening the fighter.""

I thought deep for a few seconds before speaking again. ""You know what? Let's give this task to J. Let her see how we could begin making this our new main starfighter while reducing the cost to a more manageble level. Even with our military budget having more room with Starkiller base being completed, it still is pretty damn expensive. Both the fighters themselves and the refits that the hangars in our carrier ships will have to undergo if we use these things. Given how she so much into this whole corporate thing it should not be too difficult for her to figure it out.""

L nodded. ""I'll let her known once she is awake and we depart for work.""

""Oh btw, what did the Republic call this fighter?"" I asked while looking at the hologram again.

It took him only a second to answer.

""The TIE defender.""

https://preview.redd.it/nta50way5o8e1.jpg?width=800&format=pjpg&auto=webp&s=fa73556d360854854d2f57da37e16ee84252130d

\-End of recording-",1,1734990650.0,TheAbsoluteSolver,0,1.0,False
1hkycia,https://www.reddit.com/r/Anxiety/comments/1hkycia/spiraling_spoiled_surprise_christmas_present/,Spiraling: Spoiled Surprise Christmas Present,"Hey everyone! 

Literally my first time posting something like this ever, so bear with me. 

TL:DR I think I spoiled a really serious gift that my (M 24) partner’s (M 25) family got me. I don’t know for sure, but there’s a good chance. What do I do?

So, I wake up this morning and go to the kitchen to make coffee and start the day. For background, I live in an old townhouse community with a parking lot for all of the residents, i.e. many units directly connected but with separate entrances from the outside. I look out my kitchen window and see, directly parked right by the entrance to our house, a black Jeep with a green bow on the dashboard. My first thought immediately is woah whoever got that is very lucky because that would be awesome! I took a picture and sent it to my partner and said something to that effect and joking asked if he bought me a car, and I got an “lol” in response. Usually he would give me shit for saying something like that, but his response made me think more about the whole scenario.

Now, I am almost sure his family bought it for me. When I last saw his parents, my future in-laws, over Thanksgiving they gave us an advent calendar (a traditional gift) and another gift they send not to open until Christmas with them on FaceTime. Therefore, I know that there is some kind of surprise planned. Even logistics-wise, the act of buying a car over the phone in another state and my partner picking the car up without me knowing and parking it seems really plausible for me. 

All of this thinking happened and I started to get really upset because I feel like I ruined something that could’ve been awesome.

How do I move forward? Do I ask my partner about it? I don’t foresee being able to stop stressing about it, which is just going to ruin it more. ",1,1734990644.0,Anxiety,0,1.0,False
1hkych9,https://i.redd.it/ipkir6ay5o8e1.jpeg,Decorated my Weeks in preparation for the new year ,"I didn’t stick the other stickers down so I can change them out throughout the year, but did stick down the inside stickers. I have some snaps for sewing that I used to make a flap to close. Remember to not punch through both of the back pieces so you can get your book in. I added some cute charms to the spine for some extra trinkets.",7,1734990642.0,hobonichi,0,1.0,False
1hkycg7,https://i.redd.it/ckfe9rwx5o8e1.jpeg,Caption,"No because how can you be upset with a salon for setting boundaries around their appointment times? The real issue is that she has no respect for other people’s time, which is likely why she and her sister are always late. This situation is a direct result of her own poor habits and lack of accountability",6,1734990639.0,Mananamariee,6,1.0,False
1hkycfw,https://i.redd.it/cc2mjunx5o8e1.jpeg,Vintage Melia papers in my parents house… made in..,"On the reverse, made in West Germany. So what, at least 40 years old?",4,1734990639.0,pourover,1,1.0,False
1hkyc4g,https://www.reddit.com/r/paypigsupportgroup/comments/1hkyc4g/i_think_i_found_the_best_domme/,I think I found the best domme 🥳😊 ,"
I found and submitted to @fair_ad_1355  and it's been the greatest experience of my finsub life she knows how to bully me just enough and she's hot smart and cares about your life outside of findom she charges fair prices and she is just overall the best domme I have met and I have been doing this for 1 year now she made me feel excited to send her a tribute I am super happy to buy her coffee everyday",0,1734990613.0,paypigsupportgroup,8,0.4,False
1hkybvm,https://www.reddit.com/gallery/1hkybvm,"Work hard, party harder!",,8,1734990594.0,WolfQuestGame,3,1.0,False
