id,url,title,text,score,created_utc,subreddit,num_comments,upvote_ratio,over_18
1horx1j,https://www.reddit.com/r/UnsentLetters/comments/1horx1j/a_thought_that_lingers/,A Thought That Lingers ,"Dear Centauri,

Some days, words come easily, as if my thoughts about you have been waiting, neatly lined up, for their chance to be written. Other days, like today, it’s harder to find the right way to say what’s in my heart. Not because my feelings are any less—they’re constant, like the steady rhythm of my breath—but because it feels impossible to capture something as vast as this love I carry for you in something as small as words.

What I keep coming back to today is this: you linger. In the quiet moments, the in-between spaces of my day, you’re always there. It’s not loud or overwhelming; it’s like a faint melody in the background of everything I do. Whether I’m making coffee in the stillness of the morning or watching the sunset fade into night, there’s always a part of me thinking of you, wondering what your day has been like, what thoughts you might be carrying, what dreams you might be chasing.

It’s strange how someone can feel so present in your life even when they’re far away. You’ve woven yourself into the fabric of my days without even trying, and I don’t think I could untangle you from them even if I wanted to. Not that I ever would. You’ve become a part of me, Centauri, in the way a star becomes part of the night sky—not the whole of it, but the brightest point, the one my eyes always search for first.

I think about what it would be like to tell you these things out loud, to let you see what you mean to me without the safety of these written words. But then I remember that some things are more beautiful in their quietness, in their unspoken truth. Maybe it’s enough that you’ve inspired this part of me, that you’ve awakened something I didn’t know I had—the capacity to feel so deeply, to love so purely, even from a distance.

You’ve taught me that love doesn’t always need to be spoken to be real. It can live in the spaces between words, in the quiet moments of thought, in the way someone becomes the light you look to when everything else feels dark. That’s what you are to me—my light. My constant. My reason to keep writing, to keep dreaming, to keep hoping.

I don’t know what tomorrow will bring, but I know one thing with certainty: you’ll be there, in my thoughts, just as you are now. And that’s enough for me.

Yours, always,

Castor

",6,1735461612.0,UnsentLetters,1,1.0,False
1horwdk,https://www.reddit.com/r/IndiaCoffee/comments/1horwdk/getting_into_specialty_coffee_need_advice_on/,Getting Into Specialty Coffee; Need Advice on Channi and Moka Pot!,"Hey everyone,

I’m planning to dive into the world of specialty coffee and could really use some advice. I want to start with the channi (strainer) method and eventually transition to a moka pot.

Here’s what I need help with:

1. Channi Method:

What are the do’s and don’ts for brewing with a channi?

Any tips for achieving a smooth milk-based coffee like lattes or cappuccinos?



2. Coffee Grounds:

Which coffee grounds would you recommend for the channi method?

I’m on a budget and do have access to Credit store, so affordable options would be great.

Any specific roast level or grind size I should look for?



3. Moka Pot Transition:

What should I keep in mind when switching to a moka pot?




I mostly enjoy milk-based coffees, so suggestions tailored to that would be perfect. Looking forward to your insights!

Thanks in advance!

",3,1735461524.0,IndiaCoffee,1,1.0,False
1horw38,https://www.reddit.com/r/AutismInWomen/comments/1horw38/dilemma_with_friends_and_family_staying_at_my/,Dilemma with friends and family staying at my house from out of town...,"Essentially I live very far away, in an extremely high cost of living and desire tourist destination. So, for most friends and family staying at my house is a necessity or they'd never be able to afford to visit. 

I understand that they can't afford it, and so I do allow people to stay with me even though I hate it, because they wouldn't be able to visit ever otherwise and while I do hate people staying IN my house, I do like seeing people I care about and being able to give them the opportunity to visit paradise at a price they can afford. So I'm willing to make sacrifices for those I love. 

The issue is, people really can't comprehend what a sacrifice I'm making and they can't empathize with my needs. 

The thing is, I typically only socialize for a few hours at a time and only maybe twice a month. I have very strict routines, a very low social and sensory battery, and live a quiet simple solitary life. 

I also live in a very small house with my husband and 4 pets, I do not have a guest bedroom, there's only 1 bathroom. 

I try very hard to explain my situation and my boundaries and yet it almost just never works out.

It seems like everyone just needs so much more for me than I have to give and honestly takes my neurodivergence way way to fucking personally. 

Apparently, you're supposed to at least somewhat enjoy hosting, but honestly why the fuck would I enjoy never being able to properly decompress, constantly having to be perceived, having zero control over my only safe place in the world, people constantly making a mess and having clutter, having to wait to use my own bathroom, having to mask whether I feel like it or not, not being able to use my space the way I'd like to, my indoor cat being let out multiple times a day, having to tip-toe around other people's feelings, and struggle to accommodate others needs in my own home when I already struggle to meet my own... 

Mornings and evenings are exceptionally difficult - typically I need a few hours before and after socializing to prepare myself mentally and decompress respectfully. With company there is no ability to do that, you can't even pour a cup of coffee without having to socialize.

I personally feel like a prisoner in my own home when I have guests, save for a few who REALLY understand me and I really can just go about my life with VERY minimal impact - these people tend to be independent, introverted themselves, and possibly some version of neurodivergent. 

Today was my first day waking up without company after 5 days of company. When I first woke up I had this horrible feeling of anxiety and dread and then I remembered ""oh yeah no one is here"" I went to my kitchen in my underwear, hair a mess, sat at my table and had a warm cup of coffee, watched the colorful sunrise out my window, the only sound was that of birds chirping, grabbed a blanket and laid on my couch and read for a while.. Was the most peace I'd felt in days. 

I also notice my pets and my husband are noticeably happier, 2 of my pets are shy and my husband is also an introvert. 

I feel terrible, but the hardest part is the lack of appreciation and consideration. Because they just can't fathom that having to socialize when your social battery is drained, or having your routines and lifestyle totally upended might be, i dont know stressful?? 

",1,1735461485.0,AutismInWomen,6,1.0,False
1horw1r,https://www.reddit.com/r/decaf/comments/1horw1r/why_do_academics_suddenly_feel_blunt_without/,Why do Academics suddenly feel blunt without coffee?,"Anyone studying feel like content is less interesting?

How do you curb this off 

It?",2,1735461480.0,decaf,6,1.0,False
1horw1k,https://www.reddit.com/r/MakeNewFriendsHere/comments/1horw1k/hey_you_im_a_24m_from_ireland_on_the_hunt_for/,"HEY YOU, I’m a 24M from Ireland, on the hunt for weird and fun people! COME TALK!!","































































































































































































































































































































































































































































































































































































































































































































































































































































































































































































































































































































































































 






















 









































































































































































































































































































































Salutations everyone !
How are we all ? 
We better be good !!

I’m here today on the look for friends!  (short term / long term) 
Here’s some interesting stuff about me !

Well I’m from Ireland and I’m in uni ! And I’m 23
I’m nerdy, heavily enjoy fantasy and grimdark settings, so massive LOTR, elder scrolls, GOT/HOTD and Warhammer fan.
I play on PC (total war, arma 3, Hoi4, stellaris and many more ) and ps5 (Elden ring, battlefield) 


Im also big into history, specifically military history!! I’m a history student in fact , my areas of study are Roman/Greek, military, Irish and archaeology! 
I’m a pagan, Norse pagan 

My fav food is a toastie and I love coffee n tea! 

I hope to hear from someone soon and if you have read this far, no hey, hi or hellos, write an introduction!!",0,1735461479.0,MakeNewFriendsHere,1,0.5,False
1horvfy,https://www.reddit.com/r/PulsaFutura/comments/1horvfy/influencer_marketing_culture_calculator_build/,Influencer Marketing Culture Calculator: Build Brand Trust & Showcase Company Values,"
Are you trying to resonate your brand’s ethos through influencer marketing? The Influencer Marketing Culture Calculator could be the game changer you need. 

This nifty web tool elevates your marketing approach by crafting tailored strategies that reflect your brand's unique culture and values. Imagine aligning your company's message of sustainability or innovation seamlessly with the right influencer's voice, reaching the perfect audience without missteps.

Consider a local artisan coffee shop with strong community ties and ethical sourcing practices. The tool could suggest partnering with influencers passionate about fair trade or community events, thereby not just marketing a product but telling a story that fits the brand’s narrative.

Solving the common dilemma of authenticity versus reach, the calculator simplifies establishing resonant and resource-optimized influencer partnerships. It doesn't just matchmake; it's your digital marketing strategist saving you time and guesswork.


Ever stumbled upon a similar tool that’s transformed your marketing strategy? Let’s make this thread a treasure trove of resources by sharing your top picks! And if questions are brewing about the Influencer Marketing Culture Calculator, drop them below – let’s chat strategies and success stories.

Try it out and let the ideas roll in: [Influencer Marketing Culture Calculator](https://www.pulsafutura.com/influencer-marketing-culture-calculator/)",1,1735461403.0,PulsaFutura,0,1.0,False
1horvf7,https://i.redd.it/8hnwvx9r1r9e1.png,fun police exist on reddit,never seen bigger losers in my entire life (games fanbase has always been trash anyways) ,3,1735461400.0,TeenagersButBetter,2,1.0,False
1horuk6,https://www.reddit.com/r/DogAdvice/comments/1horuk6/i_think_my_11_year_old_pug_is_getting_dementia/,I think my 11 year old pug is getting dementia,"Gonna try not to cry while I write this.

My pug is turning 11 in a couple months. She and I are coming up on our 10 year anniversary together in October 2025. I adopted her from my dad.

I fear that she's getting dementia because of the following changes:

• Less responsive to her name and commands. I know her hearing is fine, because I can whisper ""treats"" or ""hungry"" and she can hear her favorite words being whispered

• Frequent poops in the house

• Random barks at nothing

• Grown more clingy. I can not have a moment sitting alone in my house anymore. She constantly wants to be in my lap. (I do welcome this, I want her to be happy and comfortable, but sometimes I do roll my eyes because I just want a moment sitting alone without being touched sometimes. I miss when she used to feel content just laying in her giant dog bed on her own sometimes)

• Lastly, this is the most alarming to me: she just randomly wanders off by herself sometimes. She NEVER used to do this. Sometimes by a rare chance, sit down to watch a movie or something, and she DOESN'T immediately climb into my lap, I find her sitting alone on my dark hallway, or sitting alone under my dining room table, hanging her head low and just...staring. I'll usually go pick her up and carry her to where I'm sitting and she'll settle in my lap.

(All of these symptoms are met with patience. I understand she's getting older and I don't scold her for any of these behaviors. Sometimes I get a little impatient when I have to call her a million times to get her out of a room, but that's about it. I try to stay patient and I never scold)

I plan to talk to my vet about this very soon. Does this sound like dementia though? Is it worth asking about selegiline at this point in the process?

I also adopted a second dog 2 years ago, and I worry so much and have so much guilt over splitting my attention between 2 dogs, when my pug used to be an only child and got ALL the attention. These feelings are flaring up again as I watch my elderly pug go through these changes. Is this rational??

On the bright side, there's a lot of things that are still normal! My elderly pug still gets SUPER excited for food, treats and car rides. She still gets excited when I come home from work most of the time (sometimes I catch her right out of a nap, like she doesn't hear my car coming up the driveway. Then she just seems shocked when I come in lol). She still loves a squeaky toy. Still occasionally gets into trouble, like occasionally jumping onto the coffee table looking for snacks. She still recognizes me, my partner, my family, and dogs she's met before.",1,1735461281.0,DogAdvice,1,1.0,False
1horug7,https://www.reddit.com/r/Market76/comments/1horug7/h_1200_mire_2_maps_w_coffee_or_tesla_9/,"H: 1,200 mire 2 maps W: Coffee or Tesla 9 ",,1,1735461267.0,Market76,1,1.0,False
1hortqn,https://i.imgur.com/ZWz4yn5.jpeg,Ants got into my coffee machine and began to sprout into some kind of mushroom/fungus,,0,1735461179.0,espressocirclejerk,0,0.5,False
1hortlb,https://i.redd.it/uq2v72e11r9e1.jpeg,Fick das System,,30,1735461159.0,einfach_posten,6,0.92,False
1horsrt,https://i.imgur.com/ZWz4yn5.jpeg,Ants got into my coffee machine and began to sprout into some kind of mushroom/fungus,,1,1735461058.0,anJoDelCo,0,1.0,False
1horrx3,https://www.reddit.com/r/r4r/comments/1horrx3/25_f4m_relationship_waor_manifesting_the_friend/,25 F4M #relationship #WA/OR manifesting the friend to lover of my dreams :),"Hi there! 

My name is Samantha, and I recently moved to the PNW (Portland area) for a new job. I am looking to meet my best friend turned boyfriend :)

Fun Facts About Me:

🎵🎷 I graduated with my music ed degree, play saxophone and sing!

☕️🍣 I love sushi, chain restaurants, and coffee. My go-to order is an iced vanilla dirty chai latte.

🍿📺 I like watching movies (thrillers/romcoms) and the same tv shows over and over (dance moms, glee, good girls, etc.) 

👩🏻‍💻🩵 I work full time for a small business in inventory and fulfillment.

I am 5’1” on a good day and plus sized. I am looking for a serious relationship, so if you’re are only looking for NSFW chats, I am not for you. I am interested in chatting online for a bit (on Reddit only) and then meeting up in person once comfortable. 

I do believe that my love languages are quality time, words of affirmation, and physical touch (which I rarely share because I feel that leads to sexual pressures!)

I am trying something new and scary by trying to find people to talk to, but I also want to be upfront about my own relationship hindrances. I come from a place with a lot of family baggage and trauma that causes a lot of self esteem issues. I experience a lot of anxiety in relationships and am treated for depression. I also have very little dating experience and no sexual experience due to my religious upbringing.

About you:
* Preferably between 23-32 years old and in the area (within reason)
* Masculine leaning or male. I tend to go for mountain men (tall, dad bod/bulky build and beard), but I’m open to all figures and ethnicities :) 
* Kind, PATIENT, and a good communicator
* Please have your own form of transportation (I have a car, but have always preferred being passenger)

If you feel like you vibe with me, message me a little about yourself, including your age, location, and a little selfie. I look forward to meeting you 😊

A few photos of me :)
https://imgur.com/a/5YnJm5u ",0,1735460954.0,r4r,1,0.5,False
1horrsq,https://i.redd.it/mbjdazjd0r9e1.jpeg,Bu aralar içtiğim en güzel kahve. Çekirdeğini kendiniz alıp öğütüp filtre kahve yapın. İlahi bir tat.,,5,1735460938.0,KGBTR,5,0.86,False
