id,url,title,text,score,created_utc,subreddit,num_comments,upvote_ratio,over_18
1mw4dca,https://www.reddit.com/r/NevilleGoddard/comments/1mw4dca/looking_for_insight_why_do_good_things_seem_to/,Looking for insight. Why do good things seem to disappear after I appreciate them?,"
Hello, 

There is a recurring pattern in my life that I can’t seem to shake, and I’m hoping someone here might relate or have insight.

Every time I genuinely appreciate something, it tends to vanish or go wrong shortly afterward. It doesn’t matter how small the thing is. For example:

~ If I admire how well a plant is doing in my garden, it just shrivels and dies.

~ Just recently, I switched to a new brand of coffee and thought, ‘Wow, this is amazing’. Later I made the same coffee the exact same way and it tasted terrible.

~ Products I fall in love with get discontinued.

~ Whenever I look forward to something, something goes wrong or it gets cancelled. 

~ People in my life who I have felt I could truly rely on, have withdrawn for no apparent reason.

~ A few days ago, I sat with my son while he slept and thought loving affirmations over him. Shortly after, he had a major setback in school. 

These are just more surface level examples. There are deeper, more personal instances that follow the same pattern. What’s confusing is I don’t walk around expecting bad things to happen. I don’t believe I’m undeserving of good things. I genuinely try to live with gratitude. Yet, this pattern has persisted for years.  

Has anyone else experienced something similar and been able to shift it? Is there something deeper I might not be seeing? I appreciate any perspectives or experiences you are willing to share. 

Thank you.



",2,1755761581.0,NevilleGoddard,4,0.75,False
1mw4ces,https://www.reddit.com/r/AeroPress/comments/1mw4ces/first_aeropress_xl_how_do_you_make_34_cups_of/,"First Aeropress XL, how do you make 3-4 cups of coffee? What's a good recipe without a scale?",First Aeropress ever and very excited to try it out. Planning on brewing in a Yeti 30oz for daily use. ,1,1755761486.0,AeroPress,0,0.67,False
1mw4bli,https://www.reddit.com/r/selfhosted/comments/1mw4bli/followup_self_hosted_mac_app_for_analyzing_years/,Follow-up: Self hosted Mac app for analyzing years of Apple Health data using Ollama locally (85 upvotes from selfhosted),"6 months ago, I shared my Apple Health data analysis using local Llama here and was blown away by the response: [https://www.reddit.com/r/selfhosted/comments/1i7wgqo/comment/m8xa2gz/?context=3](https://www.reddit.com/r/selfhosted/comments/1i7wgqo/comment/m8xa2gz/?context=3)

I open sourced it and it analyses years of your Apple health data privately, self hosted of course! You can check it out here: [https://github.com/krumjahn/applehealth](https://github.com/krumjahn/applehealth)

But it's a pain to run docker, open the terminal and run python code. So I turned it into a Mac app for those that want to just USE it. It runs locally on your Mac and you can use A.I. to analyze the data locally using Ollama. Since then a bunch of new local LLM's have come out and I think it'll be cool to use the new GPT-OSS if your system is powerful enough.

The app is $4.99 on the Mac App Store (think of it as buying me a coffee for the effort 😊): [**https://apps.apple.com/app/health-data-ai-analyzer/id6749297170**](https://apps.apple.com/app/health-data-ai-analyzer/id6749297170)",0,1755761404.0,selfhosted,0,0.33,False
1mw4agh,https://www.reddit.com/r/vegan/comments/1mw4agh/trying_to_be_vegan/,Trying to be vegan,"Hi! I am really trying to be vegan and I need some advices from those who struggled with the transition. I ve been vegetarian for one month and it was preetty okay until I got home to my parents and the food was so different compared with what I eat when I prepare it myself. I come from a country wich traditional food is related a lot with meat (wich it applies to a lot of other countries ofc but I feel here it comes in more other shapes) and I grew up with it and it’s really hard to not eat it. When it comes to milk I tried everything, oat, rice, coconut, wheat, almond - I just can’t like it. I drink my coffee with milk and I can’t like it with other kind of milk. If i make pancakes it works with almond milk. 

I want to be vegan for justice of the animals but it’s really really hard. I wish someone could give me some tips and tricks that are really helpful, maybe something that’s niche or helped you. Thank you 🙏 ",2,1755761286.0,vegan,4,1.0,False
1mw499q,https://www.reddit.com/r/wallstreet/comments/1mw499q/from_coffee_to_money_thats_how_my_day_started/,"From coffee to money, that's how my day started","Just a few days ago, I had no idea how to close my mortgage - I was fired and had no income. Looking for a way to make money, I came across a post that caused a stir on Reddit and shared it ([u/emanuel91x](https://www.reddit.com/user/emanuel91x/))

I was skeptical at first, but decided to give it a try. The method turned out to be simple, took only a couple of hours/day, and didn’t feel like work at all

In just a short time, I was able to partially close my financial obligations. Judging by other people’s reviews, some people earn even more simply by continuing to use this method

If you find yourself in a difficult financial situation, I recommend taking a look at his post - it might be useful",18,1755761166.0,wallstreet,0,0.95,False
1mw48dd,https://www.reddit.com/r/Arrangedmarriage/comments/1mw48dd/onesided_love/,One-sided love,"Hi Redditors, this is trippy and trippy is really high.
Let me tell you a secret. Between me and you.
I love a girl in my office. We recently joined this company last month. I first saw her in the HR area of company and there I just saw another simple beauty. Just like a typical guys I admire her, admired her beauty and then just told my self, she is aukat ke bahr.
And luckily we’re in the same batch. Our group consists of 6-7 members out of which 3 are females. Beside her, other both girl are very nice and sweet, and we usually enjoy time altogether.
Now, let me tell you something. Just like my name I’m always trippy. Always high during work hours. And everyone in my group knows. I even made few other guys go high. Sometimes on their approval. 
First just like everyone, it was the attraction, and soon that attraction led me to fall for her. She is very gorgeous, very very gorgeous. I love everything about her, her tucking of hairs behind the ear, her dressing sense, I love her vibing over song. And she is very extremely extrovert. 
And I told you I’m always high, so I made obvious that I like her and she probably knows that I like her. You know what I love dark circles too. Imagine a girl with clear milky skin, and there’s dark circles complimenting her. She always welcomed me when I want conversation. But the truth is she hates these type of guys that do stuff like smoking, going high. And I’m just average in terms of looks.
And in fact, the day I joined that company I had only 6 outfits that I’m repeating from last 1.5 months coz I’m unable to go back to home. 
And one more thing she is very aukat ke bahr, you know when she’s using her phone, I like her that innocent face while scrolling insta. And btw she is a sort of influencer.
She once said she doesn’t have any boyfriend or in any relationship with anyone for the last 10 years. Even she is just 22.
I tried to go office without any stuff or high, but I get too nervous and simply ignore her. That’s why I only talk to her when I’m high. 
I’m sure she hates me… let’s say she doesn’t hate me but she doesn’t want to be friends with me either. 
And frankly speaking I don’t want to be friend with her coz I’m very insecure about her. Whenever she talk with other guys I feel something in my stomach.
She had also given me a tag “creep”.
Now we rarely talk outside of office stuff. I really miss those days, when she suddenly put hand on table and says let’s play truth and dare or dumb charades or atlas or stone paper scissors or guess the actor or spin the wheel. 
She likes classic cold coffee.
Ohh I forgot, there was an incident when I lost a bet with my friend in stone paper scissors and I had to buy chai for everyone so I ordered 6 chai. But she said I don’t drink chai. Then I go back and ordered a classic cold coffee for her. Btw I was really at that time. 
And from that day, I guess she hates me.
She usually talk normally with other guys, while with me she went silent or don’t want to engage in the convo with me.",1,1755761067.0,Arrangedmarriage,2,1.0,False
1mw481k,https://www.reddit.com/r/Keychron/comments/1mw481k/keychron_q6_max_250_amazing_board_but_no_tilt_feet/,Keychron Q6 Max (€250) — amazing board but… no tilt feet?,"I just picked up the Keychron Q6 Max (100% wireless, PT layout, Gateron Jupiter Brown tactile) and while it’s a beautiful, premium keyboard, I was honestly a bit disappointed: it doesn’t come with simple tilt feet to raise the back. For a €250 board, I kind of expected that — at this price it should almost make coffee for me.

Don’t get me wrong: the board is fantastic in many ways. It’s solid, heavy, the sound is really nice (the metal base helps absorb noise, making the browns sound very pleasant), and the overall build quality feels great. But I’ve always used my keyboards slightly inclined, probably because my desk is a bit high, and I just can’t get comfortable typing flat. Right now I literally have a controller propping up the back as a temporary fix.

Does anyone here use stands or any accessory to add some incline to the Q6 Max?
I came from an Epomaker Aula 75 and a Ducky 3 — both had those little flip-out legs — so I guess I got too used to them.",0,1755761032.0,Keychron,6,0.5,False
1mw47tl,https://www.reddit.com/r/newinberlin/comments/1mw47tl/flutterings_5_fresh_starts_in_berlin/,Flutterings #5 – Fresh starts in Berlin,"On the very day of our Social Butterfly Anniversary, I decided to quit smoking. Maybe it was the symbolism of a fresh start, maybe it was the thought: *if not now, when?*

Quitting has been rough — shaky hands, no focus, and the strongest physical withdrawal I’ve ever experienced. My main symptom? Nausea, all day long. 🤢 Even coffee tastes wrong.

But today, as this post goes online, I’ve made it through **one full week smoke-free**. My body still feels upside down, but my mind is oddly clear, as if a fog has lifted.

Moving to a new city can feel the same: exhausting, disorienting, even a little sickening at first. But sometimes that’s exactly the beginning of something better.

👉 What’s the boldest fresh start you’ve made since coming to Berlin?",1,1755761010.0,newinberlin,0,1.0,False
1mw46oo,https://www.reddit.com/r/GamblingRecovery/comments/1mw46oo/hear_me_out/,Hear me out,"So you only gamble because you are stressed or going through some stuff. Your life sucks and you are just trying to find that next dopamine hit.

Instead of gambling, use the same gambling money to make your life a more enjoyable. 

Order the best steak when you go out, take a weekend vacation with that gambling money, buy a new car, get a bike, order a large coffee instead of the small, etc

Make your life so good that you don’t want to gamble. You are just using that gambling money for something else 🤷🏻‍♂️",1,1755760888.0,GamblingRecovery,0,1.0,False
1mw46kq,https://www.reddit.com/r/snapinsight/comments/1mw46kq/they_say_the_smallest_moments_can_spark_big/,They say the smallest moments can spark big insights,"So, there I was, sitting in my usual cozy corner with my morning coffee, soaking in the quiet of my little apartment. I've done this a million times before, same comfy chair, same warm mug... but today felt digferent. Maybe it was the way the light hit my plants, or the perfect sip temperature of my coffee, but suddenly, something clicked in my head. 

I realized, like a bulb lighting up 💡, self-care isn't just agout bubble bths or yoga classes or fancy retreats. Rgiht now, for me, it's about these pecaeful mornings where I can just sit, breathe, and listen to my thoughts. It's finding that inner calm and balace in the simplest of routines. It might sound cliche, but this small moment of clarrity showed me how these everyday rituals are my little sanctuary...

Might be a simple thing, but it got me thinking about what truly brings peace and happiness. I guess soemtimes it's all about pausing and svaoring the moment right in front of us. 🌿",6,1755760877.0,snapinsight,1,1.0,False
1mw46eh,https://www.reddit.com/r/Iloilo/comments/1mw46eh/cafecoffee_shops_for_work/,Cafe/Coffee shops for work,"Hi everyone! Need your help if you could recommend any cafes or coffee shops within the city where I can work for at least 4 hours, please. 

Ang not super crowded para hindi ako maka istorbo students or cafe goers. 

Thank you so much!",1,1755760857.0,Iloilo,0,1.0,False
1mw45y6,https://www.reddit.com/r/MakeNewFriendsHere/comments/1mw45y6/41_m_scottish_guy_having_a_slow_day_working_from/,41 M Scottish guy having a slow day working from home and wondered if anyone wanted to chat?,"Hello. Hope anyone reading this is having a good day or night. I wondered if anyone is looking for a long term chat friend? I only really use Instagram or discord to chat, I just find them the easiest and means I can send you a selfie when we first say hey. My username is edinburghguy on discord if anyone wants to message. I'm doing a lot of home working at the moment and it would be cool to have someone to talk random nonsense to and just talk about random things. Think about it like random chat at the office kitchen / coffee area. I've posted a few time and I've spoken to a few cool people before but looking for long term so i can build some sort of friendship with. Its rare i get replies so I'll definitely respond if you message me. Someone to help break up the days and make me smile. Random sense of humour encouraged! Any age, and country, I'm a male on reddit looking for friends, I cant be too choosy! Haha. A little about me..... I'm 41, 6ft 1 brown hair and eyes, likes to keep fit etc. I play a few instruments and paint. I have a dark sense of humour, don't take myself too seriously and love to laugh. I've rambled on enough.... Look forward to hearing from from someone.",1,1755760813.0,MakeNewFriendsHere,1,1.0,False
1mw45gk,https://www.reddit.com/r/CPTSD/comments/1mw45gk/was_i_love_bombed_and_how_to_handle_perceived/,Was I love bombed and how to handle perceived rejection?,"I started talking to this guy a couple weeks ago (both late 20s) and we were talking nonstop, he was complimenting me, messaging me a lot, being really lovely and seemed so genuinely into me. We met for a coffee date and he was so nice and respectful and came across so into me. He flirted a lot over text as well and we had a lot of sexual chats. He then came to mine a few days later and we had sex. He's the first guy I've met in over a year and the him being so nice made me fall for him quite a lot. 

The morning after he left, it was like he did a total 180. I get maybe 5 messages a day and they're so plain. I gave the same amount of effort I was previously towards him for a few days but now I'm just matching his effort which I find really hard to do. Wtf happened? He's coming again this weekend so I know he still wants to have sex (I do too) but he doesn't say it anymore and his entire demeanor has changed towards me. 

I don't know if he's busy or if he's just not into me beyond sex, because despite him saying he values communication, he isn't communicating wtf is going on. He said it feeling weird is ""just bad timing"". If it was to be a purely sexual thing from the start that would've been fine but he was acting so interested in me beyond sex. 

Advice on how to navigate this? The situation has triggered me so badly with feelings of rejection, worthlessness, and reinforcing that I'll never be good enough for someone. Every time he doesn't message me back for hours or sends me one word answers I spiral and break down. The fact he changed so much after sleeping with me is making me think I did something wrong. I know the feelings of rejection are less to do with him and more to do with the abuse I faced as a child but it's so hard to not put these bad feelings in the past. Am I right in thinking he lovebombed me? Can someone still be into you after lovebombing you?",2,1755760764.0,CPTSD,3,1.0,False
1mw450i,https://i.redd.it/t63ox191qbkf1.jpeg,2 in 599. 3 in 799,"Hey guys!!

Have an amazing deal for you 💯 

Selling these 180gsm super soft single jersey cotton t shirts. 

Im sure you are going to love them. 
I'm offering them at a heavy discounted price as i really want you guys to try this and share the feedback .

Available in total 6 colors ✨️ 

Do check it out guys
https://www.themetaphor.co.in/products/the-essential-three
https://www.themetaphor.co.in/products/metallic-rose
https://www.themetaphor.co.in/products/dark-coffee
",16,1755760714.0,smallbusinessindia,9,0.94,False
1mw44wj,https://www.reddit.com/r/Slovenia/comments/1mw44wj/barcaffè_most_artisanal_hipster_coffees_ive_tried/,Barcaffè > most artisanal hipster coffees I’ve tried,"I’m Indian, living in Germany, dating a Slovenian. I own way too much coffee gear and consider myself a snob… but somehow nothing hits like a Barcaffè. Even the petrol station coffee in Slovenia tastes elite.

Meanwhile my bf is loyal to džezva + Barcaffè stash, because you can’t even find proper džezva coffee in Germany.

Also, y’all think Slovenians are uptight? 😂 My bf told me that, and I was like: bruh, I live in Northern Europe, I know what actual cold & uptightness feels like.

Conclusion: Barcaffè supremacy. ",48,1755760702.0,Slovenia,26,0.94,False
1mw44ub,https://www.reddit.com/r/u_UnchainedSkeptic/comments/1mw44ub/welcome_to_my_reddit_profile/,Welcome to my Reddit profile!,"Hello, and thanks for stopping by my Reddit profile! I'm Unchained Skeptic, a streamer and content creator. I primarily make content talking about religion from a formerly religious/ critical point of view. I figured if my discussion of my lack of religious beliefs, critiques of religious nationalism, and counter-apologetics was going to have people calling me a ""Reddit atheist,"" I might as well actually start using the site lol. 

Anyway, this profile is primarily going to be used as my personal blog, where I plan to discuss things such as the evolution of my personal beliefs based on the new information I receive, critique of religious arguments, and things going on in my personal life (whenever something actually worth talking about happens). I also plan to use this as a place to receive feedback on my content and for ideas for content in the future, both related and unrelated to religion. Ultimately, I plan to make a variety of content that all kinds of audiences can enjoy and to veer away from anti-religious discussion dominating my channels, both because I value entertaining people over debate grandstanding, and also because people who are uninterested in getting to the truth, whatever it may be, are exhausting to deal with on a consistent basis. 

I do have a [subreddit](https://reddit.com/r/UnchainedSkeptic), where I plan to react to submissions on my streams and in my videos. However, it's currently private, as I'm a small creator and don't want to have a subreddit hanging around without a community interested in adding to it, or to help moderate it. I'll be opening it to the public once my channels take off a bit more, so stay tuned! 

In the meantime, check out my links! 

I stream to [YouTube](https://youtube.com/@UnchainedSkeptic) in both portrait and landscape mode, so make sure to subscribe if you want to keep up with my streams, videos, and posts. 

I also stream to [TikTok](https://tiktok.com/@UnchainedSkeptic), [Twitter](https://twitter.com/UnchaindSkeptic), [Facebook](https://facebook.com/UnchainedSkeptic), and [Instagram](https://instagram.com/UnchainedSkeptic) in portrait mode, as well as [Twitch](https://twitch.tv/UnchaindSkeptic), [Kick](https://kick.com/UnchainedSkeptic), [Trovo](https://trovo.live/s/UnchainedSkeptic/233483684), [DLive](https://dlive.tv/UnchainedSkeptic), and [Nimo TV](https://nimo.tv/live/1437163532) in landscape mode, so make sure to follow those if you want to keep up with my streams, videos, and posts on those platforms. 

If you want to hang out with the community, then check out my [Discord](https://discord.gg/6k8vBXpmq7) server. 

If you want to add to the community music playlist for me to listen to on stream, or if you want to check out the playlist of my songs, then visit my [Spotify](https://open.spotify.com/user/31375fqxv2us3sl5muu2ldqkea5m) profile. 

If you want to game with me when I'm available to, then add me on [Steam](https://steamcommunity.com/id/UnchainedSkeptic). 

If you want to message me in private, then the quickest way to reach me is on Telegram, where my username is UnchainedSkeptic. I also try my best to at least read messages on other platforms, however I can't guarantee that I'll respond or read them, since they usually get caught in the requests folder and also because I have so many platforms. 

If you want an alternative to TikTok, then consider following me on [Snapchat](https://snapchat.com/add/UnchaindSkeptic) or [Clapper](https://clapperapp.com/UnchainedSkeptic). 

If you want an alternative to Twitter, then consider following me on [Threads](https://threads.net/@UnchainedSkeptic) or [Bluesky](https://bsky.app/profile/UnchainedSkeptic.bsky.social). 

If you want an alternative to Instagram, then consider following me on [Xiaohongshu](https://xiaohongshu.com/user/profile/6786142d000000000801e68b).

If you'd like to send text-to-speech while I'm live, then the cheapest ways to do so are by sending a $2 or more super chat in YouTube chat, sending 200 bits or more in Twitch chat, or sending 200 stars or more in Facebook chat. If you don't plan to watch me on those platforms, then you can also send text-to-speech by tipping $2 or more on my [Streamlabs](https://streamlabs.com/UnchainedSkeptic/tip) tip page. If you want to do some good, you can also send text-to-speech by donating $2 or more to the Crisis Text Line through my [Streamlabs Charity](https://streamlabscharity.com/@UnchainedSkeptic/crisis-text-line) link. 

If you'd like to support me directly, then you can instead tip me on [Cash App](https://cash.app/$UnchaindSkeptic), [Venmo](https://venmo.com/UnchaindSkeptic), or [PayPal](https://paypal.com/paypalme/TheUnchainedSkeptic). 

If you'd like to support me monthly, you can also consider becoming a member on [Patreon](https://patreon.com/UnchainedSkeptic), [Ko-fi](https://ko-fi.com/UnchainedSkeptic), or [Buy Me a Coffee](https://buymeacoffee.com/UnchainedSkeptic). 

If you'd like to grab some merch, such as shirts, hoodies, or stickers, then check out my [Streamlabs Merch](https://streamlabs.com/UnchainedSkeptic/merch) store. 

If you'd like to send me some food while I'm live, then you can do so via my [Treatstream](https://treatstream.com/t/treat/UnchainedSkeptic). 

If you'd like to send me a gift from my wishlist, then you can do so via [Throne](https://throne.com/UnchainedSkeptic). 

If you want to send some crypto, then you can send me Bitcoin using either the [Bitcoin](https://coinsend.to/@UnchaindSkepticBTC) network or a [Lightning](https://strike.me/UnchaindSkeptic) invoice. I also accept [Ethereum](https://coinsend.to/@UnchaindSkepticETH), [Solana](https://coinsend.to/@UnchaindSkepticSOL), [Litecoin](https://coinsend.to/@UnchaindSkepticLTC), [Bitcoin Cash](https://coinsend.to/@UnchaindSkepticBCH), [Chainlink](https://coinsend.to/@UnchainedSkepticLINK), and [PayPal USD](https://coinsend.to/@UnchainedSkepticPYUSD). 

Lastly, if you want to reach out with any business inquiries, then you can email me at unchainedskepticbiz@gmail.com, or text me at +1-810-295-1842. 

Thank you for reading, and I hope to see you in one of my streams. Take care!",1,1755760696.0,u_UnchainedSkeptic,0,1.0,False
1mw44ir,https://www.reddit.com/r/chat/comments/1mw44ir/41_m_scottish_guy_working_from_home_anyone_around/,41 M Scottish guy working from home. Anyone around and wanna chat?,"Hello. Hope anyone reading this is having a good day or night. I wondered if anyone is looking for a long term chat friend? I only really use Instagram or discord to chat, I just find them the easiest and means I can send you a selfie when we first say hey. My username is edinburghguy on discord if anyone wants to message. I'm doing a lot of home working at the moment and it would be cool to have someone to talk random nonsense to and just talk about random things. Think about it like random chat at the office kitchen / coffee area. I've posted a few time and I've spoken to a few cool people before but looking for long term so i can build some sort of friendship with. Its rare i get replies so I'll definitely respond if you message me. Someone to help break up the days and make me smile. Random sense of humour encouraged! Any age, and country, I'm a male on reddit looking for friends, I cant be too choosy! Haha. A little about me..... I'm 41, 6ft 1 brown hair and eyes, likes to keep fit etc. I play a few instruments and paint. I have a dark sense of humour, don't take myself too seriously and love to laugh. I've rambled on enough.... Look forward to hearing from from someone.",3,1755760664.0,chat,1,1.0,False
