id,url,title,text,score,created_utc,subreddit,num_comments,upvote_ratio,over_18
1i8b077,https://www.reddit.com/r/gallbladders/comments/1i8b077/coffee_problems/,Coffee problems,"Has anyone had problems where they could drink synthetic caffeine but the minute natural caffeine hits your body you gotta go every 5 seconds? 

I really am debating on trying to find a way to cut caffeine out completely but I suffer from terrible headaches without it 🥺",2,1737658803.0,gallbladders,0,1.0,False
1i8azu4,https://www.reddit.com/r/CostcoCanada/comments/1i8azu4/hot_drinks_question/,Hot drinks question.,"Is there a reason why Costco does not serve hot coffee or hot tea in the food courts? Hot beverages would go really well with grease heavy items, i.e. pizza.",0,1737658781.0,CostcoCanada,12,0.2,False
1i8azn6,https://www.reddit.com/r/MakeNewFriendsHere/comments/1i8azn6/wondering_if_anyone_would_be_interested_in_trying/,"Wondering if anyone would be interested in trying to make a go of this (M40, UK)","Hey guys, I wanted to post here in case anyone out there feels we might click. I’m looking for platonic connections, ideally in the UK, and if you live locally (North West), that would be even better, as I would love to be able to meet up irl eventually. Im an introvert and outdoorsy, enjoy music and coffee, love animals and hold down a professional career. I identify as a member of the LGBTQ+ community. I’ve struggled with social anxiety in the past but feel I’m well on my way to beating it. If you’re dealing with anxiety too, maybe we can be a source of support for each other. 

Please let me know if any of this might resonate with you ☺️",1,1737658767.0,MakeNewFriendsHere,1,1.0,False
1i8ayk4,https://www.reddit.com/r/MakeNewFriendsHere/comments/1i8ayk4/32m_columbus_ohio_looking_for_a_cool_girly_to_be/,"32M Columbus, Ohio; looking for a cool girly to be friends with!","



































































































































Hi! I’m in Columbus Ohio and I’m looking for cool women to be friends with! I’ve realized I’m ace for a few years now.

About me: I’m 32, live in Columbus, Ohio, and I’m into all things horror and spooky. I like watching things about Bigfoot and aliens and ghost and unexplained mysteries. I also enjoy playing traditional card games and board games. I like football and I’m 420 friendly. I also am interested in religion and spirituality and I like watching and listening to things about those topics too. 

I’m looking for a friend to get coffee with, hang out with, have movie nights or game nights with, and maybe have some late night smoke sesh philosophical conversations with. 

If you want to message me, please be in central Ohio! ",1,1737658694.0,MakeNewFriendsHere,1,1.0,False
1i8ay6x,https://www.reddit.com/r/UCD/comments/1i8ay6x/the_ucd_library_where_time_goes_to_die_and_wifi/,The UCD Library Where Time Goes to Die and Wi-Fi Goes to Hide,"Ever notice how the UCD library is less about studying and more about pretending to study while your phone desperately tries to find Wi-Fi in the abyss? It’s like the building itself sucks the energy out of you. Meanwhile, the randoms who walk in act like they’re in a coffee shop, NOT a place where your soul is slowly withering away.",2,1737658669.0,UCD,3,0.63,False
1i8axx1,https://www.reddit.com/gallery/1i8axx1,Let’s see your mugs,"coffee or face, please


I’ll share both and a bonus of my cute outfit today.

Love you reddit 😘 ",7,1737658649.0,tesdcares,6,0.82,False
1i8axl8,https://www.reddit.com/gallery/1i8axl8,Some photos I’ve taken these last few days during the cold snap. ❄️,"Observations: the night sky seems to be far more blue and star-filled when it’s cold than when it’s not, and it was so cold that the cup of coffee that I was holding while walking froze into slush after some time. 🥶",46,1737658626.0,Pennsylvania,6,0.97,False
1i8ax2v,https://www.reddit.com/r/energydrinks/comments/1i8ax2v/am_i_an_anomaly/,Am I an anomaly??,"First post here. I see lots of people going wild about drinking 2-3 cans of monster a day. I wake up, have 2 cups of devil mountain black label coffee (1500mg each) followed by a Java monster. Then I drink around 3 more monsters or red bulls during my shift at work. Come home, have a cup of death wish coffee, a monster or Rockstar with dinner, and another one before bed. My heart is in good condition as evidenced by my last appointment. I actually have bradycardia, which is a slow heart rate. No jitters, no anxiety, no sleep issues. Kidney and liver function is perfect. Normal to low blood glucose. Possible ADHD dx, just waiting to see a psych about it (waiting lists are awful near me) so...am I an anomaly, or what??",0,1737658592.0,energydrinks,5,0.17,False
1i8awnh,https://youtube.com/shorts/RlTrMxh0h7w?si=uuXX3DfCYlRLOFJa,Coffee Person waking up. #comedy #700subs #800subs #fyp #coffee  #youtubeshorts #youtube,,1,1737658560.0,YouTubeShorts,1,1.0,False
1i8aw8f,https://www.reddit.com/gallery/1i8aw8f,Most costly gift I’ve received,"Got married recently and was gifted a BBE… I went from a few instant coffees a week to now obsessing over puck prep, chasing the perfect shot and falling asleep to James Hoffman and Lance Hendrick. Anyway, I’m happy to be here and wanted to share my station, cheers! 

",96,1737658531.0,espresso,18,1.0,False
1i8avxs,https://www.reddit.com/r/gayrelationships/comments/1i8avxs/9yrs_going_on_10/,9yrs going on 10,"I tried posting this a few times.
So we have been together since fall 2015, he was 18 i was 24 or 5, don't get me wrong we've grown in so many ways together. We've gone through alot absalutly alot. From me having cancer to him loosing family and myself loosing family. To issues with my family and even me going homeless when we first met. We cheated on each other way back two times each and that was the end of it. 
All the wile supporting each other. We've grown financially significantly, and matured quiet a bit.
Or so I thaught. Wile spending the time together driving over 2500 miles and back we had many conversations. But the one that hit and was talked about was our excursions. Come to find out over the 9 or 10 yr span he didn't just cheat 2 times as I thaught. That number is closer to 28...and that number was not even a count but off the top.
See this hurts me because if he ever wanted to go to the bath house, or have threesums or just have sex with me I was always down. And he knew this.hell I even let him have sex with my older brother once.  And I would constantly ask to have sex or make love. And we would go weeks with nothing. 
I feel less than adequate, ugly, fat, not endowed enough. Not old enough. Too old. 
But I know I'm attractive, 6ft sandy blind, Bright ice turquoise Blue eyes,  175 lbs fit sorta look like if Alan Jackson and malcmore had a child. 7.5"" endowment. Vers. Smart well kept and clean. Not afraid to get dirty but clean up prettier than a new penny. 
I feel stupid, because ive done everything he's ever wanted, and I've given him everything, if he needed art supplies for his new gallery peices he got it. He wanted an Italian sports car he got it. 
New dogs, new home, moved 3 times across the country. I cook dinner from scratch every night, I make his coffee in the morning putting it into his cup and adding the creamer for him. If he wanted a couch from a magazine from the 1950s I bloody built it from scratch myself for him. You want a new fur coat boom which one do you want.
It hurts.. I work 46 hours a week, come home take care of the dogs, start dinner do a load of laundry and ask for sex beer and to go fishing twice a month.thats it.
I have no family anymore to go with. Rents are crazy here in az. Don't get me wrong I make 80k.
And I havnt been alone since 2015... he wouldn't be able to pay for anything and would most likely claim bankruptcy and loose it all.



",0,1737658512.0,gayrelationships,2,0.5,False
1i8avw4,https://www.reddit.com/r/celebritycruises/comments/1i8avw4/included_drinks_not_packages/,Included Drinks (Not Packages),"Sailing on the Apex

I understand how the drink packages work. Trying to understand:

1. What if any NA drinks are included (free) and where on the ship. 

Like can I get iced tea or coffee in a dining room or at the buffet? Can my kids get milk or juice with breakfast?

Or are we stuck with just water if I don't buy a drink package?

2. Is the tap water safe to drink on board or do I need to bring bottles of water? Are there places other than a dining room or buffet to refill water bottles? 

Thank you!!

",2,1737658509.0,celebritycruises,11,0.75,False
1i8avux,https://www.reddit.com/r/NoStupidQuestions/comments/1i8avux/does_starbucks_sell_regular_coffee_or_do_they/,"Does Starbucks sell regular coffee, or do they only sell lattes and fancy drinks?",,0,1737658506.0,NoStupidQuestions,9,0.5,False
1i8avjz,https://www.reddit.com/r/Constipation/comments/1i8avjz/its_been_2_weeks/,It’s been 2 weeks 😩,"It’s been a couple weeks now since I’ve had regular BMs. Here and there I’ve had a little bit of very soft thin stool around the time in the morning I would normally go, but nothing beyond that. Most days I never get the urge to go. I have an appointment with GI doc on the 28th but I can’t wait another 5 days for relief. I’ve upped my water, veggies, coffee, oatmeal and fruit and cut back on fats, sugars, and carbs. I took a cap of miralax yesterday morning and took a dulcolax around 6pm last night. I felt really nauseous last night but still no relief. Took another cap of miralax this morning. What should I try next?

I have a history of CIC that hasn’t been very responsive to meds. I’ve never noticed much help from miralax. Linzess worked great for like 6 months and then stopped. I got pregnant and went off meds and had been ok enough to not return to the doctor. Now two years later I’m back with the same significant constipation. Ive had luck with Senna tea before but I’m nervous about using that or other stimulants because I feel like my biggest issue is never having the urge to go and I’m worried that’ll make it worse. 😞 

Any help would be greatly appreciated! ",3,1737658487.0,Constipation,0,1.0,False
1i8ausm,https://www.reddit.com/r/Market76/comments/1i8ausm/h_enclave_calibrated_capacitor_mod_w_any_offers/,H: enclave calibrated capacitor mod W: any offers,"Interested in coffee, cola, sugar, and 4 star mods ",0,1737658433.0,Market76,3,0.5,False
1i8atsp,https://www.reddit.com/r/u_rohits30041987/comments/1i8atsp/23_jan_2025_2nd_day_of_being_informed_of_being/,23 Jan 2025. 2nd day of being informed of being laid off,"Yesterday when in the afternoon Gopa told me April 2025 is my last in Mindfire my head got so heavy I could not work. I message Rajeev and Sumit that I am not feeling well and am leaving for home. I reached home i think at 6. After some time I took the courage and broke the news to mummy and ritu. They were shocked but supportive. The children still smiled and all i could do was smile back. What is going to happen to them now ?

Today was school holiday of Shrinika so I got to take the Ather with me. I started office before 11. Continued with OPS Admin module testing. at 1 30 pm went for lunch. But didn't want to go back to office immediately. So went to Sikharchandi. Looked at teh view from top for 10 mins. Went back to office. 

After sometime gathered courage to talk to Sumit Dhal of DTR. He said they released me and Omprakash and Sujitha for budgeting reasons and didn't know Mindfire will lay me off. I made a request that daily office commute by bus is taking alot of time and even when i reach home I don't get enough time to study. So if I can work from home. He said he will talk to Rajeev Kumar of STR. 

Continued working. Then in evening Sumit confirmed I can work from home and work for 6 hrs so that I can give rest time to study. I Thanked him. After sometime it hit me that this could be my last day in office.

Suddenly a regret came over me that I am going to be out of corporate life soon. A guilt came that why I did not study for automation more sincerely. Now suddenly I found myself caring for the office space. I actually started to touch and feel the table, I looked around my office of what is where. I had the coffee from the machine even though i hate it. Had to add extra sugar. The 2nd time I actually threw it half way through. I went to bathroom more often than needed. These silly things that i had taken for granted in a corporate office space I felt like now I am going to miss them. 

On Jan 7 when Sumit asked me stop WFH and come to office I was aghast. Because of Shrinika's school the Ather had to remain at home while the bike is not working anymore. So I had to take Bus to office. Which was infrequent, crowded and so frustrating. There was no fixed time when a bus will arrive, so you just wait there. And there is no direct bus route from Infocity to Rasulgarh. So I have to change bus or take auto. I have rarely travelled by bus and even Auto fares are too expensive for me. The least hassle seems to be take the infocity bus that goes direct to railway station. Then cross the station to Puri Cuttack road and take a auto to ICICI bank square. While this allows least change of bus and auto but wastes a lot of time. It takes at least 1 hour 30 mins or even 2 hrs to reach home. I started hating going to office

Now I can work from home but today suddenly I felt a strange loneliness. I took sometime to go around the office, even went to top floor to see the view from there (it had already gotten dark so could see very little).

I think I am going delusional of being so attached to an office space that actually I was not fond of. I think it is the regret of missing out corporate life that is bugging me.",1,1737658364.0,u_rohits30041987,0,1.0,False
1i8ati8,https://v.redd.it/myov3psdisee1,Vocês gostam de drinks com café?,"Cold brew tônica cítrico (cold brew, água tônica, limão e raspas de limão). Super refrescante, ótima 
pedida para dias quentes.

No inverno vai bem o famoso o irish coffee, com whisky. Esse confesso que não me agrada pois não curto whisky. 

Quais outras bebidas feitas com café você já provou e curtiu (ou não)?",11,1737658344.0,cafebrasil,8,1.0,False
1i8asit,https://www.reddit.com/r/adventuringmomsnark2/comments/1i8asit/live_123/,Live 1/23,Miss richness is live with her starbucks coffee and shes suddenly sick again.. ,2,1737658279.0,adventuringmomsnark2,7,1.0,False
1i8ascq,https://www.reddit.com/gallery/1i8ascq,Green Day,Sometimes you feel like dressing up just to go out and get coffee ☺️This green velvet dress with high black boots makes me feel cozy and chic. Sparkly black cardigan for extra warmth on this cold day.,7,1737658266.0,OUTFITS,1,1.0,False
1i8as71,https://www.reddit.com/r/u_KurtGoetzinger/comments/1i8as71/community_seed_share_in_omaha/,Community Seed Share in Omaha,"# Join the First-Ever RiverFront Community Seed Share on February 8th!

Mark your calendars for a one-of-a-kind event celebrating gardening, sustainability, and community connection! The **RiverFront Community Seed Share** will take place on **Saturday, February 8, 2025, from 12 PM to 2 PM** at the Greenhouse Apartments community space in downtown Omaha. This exciting event is free and open to the public, offering a unique opportunity to exchange seeds, discover gardening tips, and connect with local organizations that make Omaha’s green spaces thrive.

Attendees will have the chance to meet representatives from a variety of local gardening and urban agriculture groups, including:

* Benson Community Garden
* The RiverFront Horticulture Team
* Blazing Star Seed Cooperative
* Douglas-Sarpy County Extension Master Gardeners
* Omaha Public Library
* DeSoto National Wildlife Refuge – U.S. Fish and Wildlife Service

The event will feature seed exchanges, helpful resources, and plenty of inspiration for gardeners of all levels. Plus, coffee, water, and pastries will be provided, creating a cozy space for learning and connection.

**Event Details:**

* **Date:** Saturday, February 8, 2025
* **Time:** 12 PM – 2 PM
* **Location:** Greenhouse Apartments community space, Downtown Omaha
* **Parking:** Metered parking is available on Farnam Street between 8th and 10th Streets. For larger items, use the parking cutout lanes on 8th Street between Douglas and Farnam.

While this event is hosted by the RiverFront Horticulture Team, the **Benson Community Garden** is thrilled to be participating alongside other local organizations. We invite everyone—from experienced gardeners to those just getting started—to come and be a part of this celebration of growth and sustainability.

**For Urban Agriculture Organizations:**  
There’s still time to get involved! If your organization would like to participate, complete the sign-up form at [https://forms.office.com/r/SQXLsBBbrw](https://forms.office.com/r/SQXLsBBbrw).

“We’re so excited to support this event and see it as a wonderful opportunity for the community to connect, share resources, and celebrate the amazing work being done in Omaha’s gardens and urban agriculture spaces,” said Kurt Goetzinger, founder of the Benson Community Garden.

Help us spread the word by sharing this event with your networks. For questions or to share details about your own seed swap events, contact Delia at [**drhill@omahameca.com** ]()

We can’t wait to see you there and grow our community connections together!

[https://bensongardens.org/join-the-first-ever-riverfront-community-seed-share-on-february-8th/](https://bensongardens.org/join-the-first-ever-riverfront-community-seed-share-on-february-8th/)",1,1737658255.0,u_KurtGoetzinger,0,1.0,False
1i8arjn,https://www.reddit.com/r/AskDocs/comments/1i8arjn/green_coffee_enema_excretion/,Green Coffee Enema Excretion,"Age : 40.
Height : 5'7"".
Weight : 175lbs.
Medications : Nystatin.
Smoker : No.

I have been suffering from neurological/psychological issues for twenty years (nervous system disregulation, unending hypnic jerks, depression, and a whole list of other related symptoms.) I developed a sort of MCS where my symptoms would spike after being exposed to certain environments or objects. I would sometimes get some short term relief from Nystatin, but not for long. To this day I believed/believe I had mold poisoning(I know this is a controversial diagnosis), as symptoms began when I was 19 and moved into a basement that would regularly get water when it rained.
Anyways today I went to a spa for a Green coffee enema, and 2 minutes in my symptoms lessened greatly, but some weird stuff came out. I'm thinking I may have had parasites all along. Can anyone identify anything they see in this pic? Or have any ideas/suggestions?",1,1737658208.0,AskDocs,2,1.0,False
1i8aqt9,https://i.redd.it/ato4eo2uhsee1.jpeg,Buti nalang. They’re such a 👎,"Honestly their drinks are absolutely terrible. The overpriced frappe tastes like sugar, the crazily priced coffee tastes like those 39-49 pesos. The charging ports not being available on all seats but only on those unergonomic seats were poorly organized. The inavailability of 2nd floor til the 1st floor be fully occupied is irrational. The wifi-voucher- hourly policy is a letdown for the customers. The staffs being not that accomodating are poorly trained. Basta, wala pa kong kilalang nasatisfy sa beanleaf na to . Hope they improve their overall service.",1,1737658155.0,zamboanga,0,1.0,False
1i8aqco,https://www.reddit.com/gallery/1i8aqco,"Junk food, but make it ✨organic✨","First photo: Whole Foods Organic Cheddar Squares nutritional information and ingredient list

Second photo: Cheez-it nutritional information 

Third Photo: Cheez-it ingredient list 


I thought it would be interesting to look into the differences between the organic cheddar squares (gosh what a mouthful lol) and regular cheez-it crackers. And wouldn’t you know it, one is highly processed junk and the other is highly processed ✨organic✨ junk.

But wait, the organic cheddar squares are less calories per serving!

Yes… by 10 calories. And I don’t know who’s weighing or counting out crackers. Besides, they’re healthy right? Which means I can eat half the box right??

And the Whole Foods Cheddar Squares are MORE EXPENSIVE while giving LESS product. Whole Food’s squares are listed on Amazon for $4.29 for 9.4 oz of product vs. a 12.4 oz box of Cheez-it’s being sold for $3.99 at Target. 

Sure, they are organic, but is buying organic cheddar squares going to make up for ice cream dates, lunch at the Cheesecake Factory, or daily whipped cream topped ice coffee filled with sweetened creamer?

People can buy and eat what they want, but it drives me up the wall that so many people don’t critically consume, whether it be through buying or eating food. 

If you want some cheez-its, just go buy some cheez-its. Or if you want organic cheddar squares, go ahead, but don’t think they are in any way healthy when it’s just greenwashed junk food. ",9,1737658124.0,alexandrarodriguez,4,1.0,False
1i8aqbv,https://www.reddit.com/r/Biloxi/comments/1i8aqbv/help_me_build_a_little_weekend_itinerary/,Help me build a little weekend itinerary!,"Hi friends! I moved out of Ocean Springs back to Baton Rouge in 2019 and haven’t been back in a couple of years. I miss it so much! 

I’m bringing my husband tomorrow for the weekend to celebrate our 1 year wedding anniversary and know it’s changed a bit. We’re staying right on government street so trying not to use the car if we can avoid it. 

I definitely want to bring him to Walter Anderson, Government Street Grocery, Tato nuts for a bite and frozen cappuccino, Lady May, hopefully glory bound will have some live music. Of course we’ll walk Washington and government to shop a little. Walk down to the beach. 

Looking for some local coffee, breakfast/brunch, somewhere nice and fancy to celebrate Saturday night! Or any other fun suggestions we could get in to! 

Thank you! ",0,1737658123.0,Biloxi,0,0.5,False
1i8apff,https://www.reddit.com/r/quittingsmoking/comments/1i8apff/1_month_in_and_something_i_wish_someone_would/,1 month in and something I wish someone would have told me.,"17 years of nicotine abuse from smoking to vaping to chewing and back to smoking.  I've tried in the past to no success because the urges would never let up.  One month in and am at peace that they don't let up and are ever present.  I miss smoking and some days after a morning coffee I almost go back.  It's not the first thought of the day anymore but still always there.  To all the people struggling, follow your head and heart and find peace with the cravings.  ",7,1737658060.0,quittingsmoking,3,0.9,False
1i8aoso,https://www.reddit.com/r/askgaybros/comments/1i8aoso/feeling_empty_after_hookups_getting_emotionally/,Feeling Empty After Hookups - Getting Emotionally Attached,"Hey everyone,  
this isn’t really a question, per se, more just me sharing my thoughts and feelings since I don’t have many gay friends who can relate. Also, I’m not here to judge anyone who enjoys hookup culture—these are just my personal experiences and how I’ve been feeling lately.

So, I lost my virginity last fall, and since then, I’ve been hooking up with guys through dating apps. The thing is, right from the start, I noticed that even when everything seems perfect, I always feel kind of… empty afterward. I can’t shake the feeling that there should be something *more* than just a one-night thing. And, honestly, it's really been bothering me.

I realize this might be more of a *me* thing—I've always been someone who connects with people quickly, maybe even too quickly, and I tend to open up a lot. It’s just how I am. I never really thought much about this until I realized how easily it can backfire, even when I try to build just friendships. I've been trying to control my feelings, but nothing I try really works.

A big part of what gets to me is that, after sex, guys often stop responding or disappear completely. I try not to take it personally because I know it’s just part of the hookup culture, but it still hits me hard every time. Even though I know it’s ""normal behavior"" I can’t help but feel like it reflects something wrong with me.

What really bothers me is that I actually enjoy the intimacy that comes before or after sex—simple things like grabbing a coffee, talking about life, or just walking in the park. For me, those moments feel meaningful. But once the “sex” part is over, it seems like the connection evaporates, and it feels like all the conversations we had didn’t matter. Which, in the end, probably didn’t.

I’ve come to terms with the fact that what I’m really looking for is something deeper, more stable, and intimate than just a casual hookup, but, especially where I live, it feels like that's nearly impossible to find.

Anyway I don't know where I'm going with this...but hey if anyone has found a way to balance the desire for physical connection with the need for something more meaningful don't be shy. Would love to hear your thoughts or advice. ",1,1737658018.0,askgaybros,3,1.0,False
1i8aole,https://i.redd.it/tcvd2ypdhsee1.jpeg,“Mornings are for coffee and contemplation” 🔦🚓,,1,1737658004.0,funkopop,0,1.0,False
