id,url,title,text,score,created_utc,subreddit,num_comments,upvote_ratio,over_18
1jos2ul,https://www.reddit.com/r/dreamingspanish/comments/1jos2ul/level_7_1500_hours_update_yes_another_person_has/,"Level 7 - 1500 hours update - yes, another person has arrived.","1500 hours progress report

**TLDR**

1494 hours of listening / watching  
6 hours speaking with AI Bot  
180,000 book words read   
Started in earnest 01 Feb 2023

**I know this is going to work, now I need to carry on carrying on.**



**Why I’m learning Spanish**

I’m 55 years old this week, I’m an English bloke who has had very little contact with foreign languages.  I failed my French exams twice when I was 16, and only just passed my English exams.

Through a combination of hard work and huge amounts of luck I was able to retire when I was 47 with just enough money to get by for as long as I expect to live, this gives me the time to learn Spanish but only if I can do it cheaply.

I live in the North of England where I have never heard Spanish spoken by a native in my city.

I stopped telling people I was learning Spanish last year, because it was a waste of breath, but if asked I will say I do it because I try to spend 3-5 months a year in Spain and speaking Spanish would be useful.  But in reality I don’t need Spanish where I stay in Spain, nobody wants to talk Spanish there, they all want to practice their perfect English.

The REAL reason I am learning Spanish isn’t at all acceptable to say out loud, so don’t tell anyone…

Most English people are entirely ignorant of other languages, I can hardly blame them, when other Europeans learn a second language it’s almost always English, because it’s a world language.

Whereas aged 12 when I was sat down and asked if I wanted to learn French, Italian or Spanish I hadn’t even left my country and had zero contact with any foreign people, so it didn’t matter which I chose, they were all useless to me!  

A French person who speaks English can add 50% to their salary, and English person who speaks French can order a coffee in a bar in France.

So I’m learning Spanish for two reasons, firstly because I want to prove to any Spanish people that I meet that not all Brits are ignorant oafs. Secondly to prove to myself and others who told me I couldn’t do it, that I can, and then speak badly of them behind their backs in Spanish.

I know, my reasons hardly sound like an acceptance speech for a Nobel Peace Prize, but we can be honest here.  In fact number 3 has just popped into my head, speaking Spanish will make me look cool and more sexy, the ultimate motivation trifecta, embarrassment, revenge and vanity….



**Materials I’m using now**

YouTube videos on science / fitness / cycling / language learning

Reading Level B1 books ok, struggling with B2

Very recently started talking with AI - Languatalk - amazing

Started writing today, just short sentences



**What I can do**

Listening - I am doing very well with YouTube videos, where usually there is one person talking to the camera, only the fast or most mumbled natives, such as for some reason car reviewers, drop my comprehension to such a level that I have to abandon the video.

Reading - I’m probably at level B1 of reading, if Juan’s graded readers are accurate, I’m finding his B2 work too difficult.

Writing - Not really tried.

Speaking - Get’s it’s own section



**What I can’t do**

I can’t watch TV YET, I try about once a month, but it still hasn’t clicked with me. I can’t watch Bluey or Peppa Pig as I hate them, I actually didn’t even like cartoons like this as a child, I preferred Tom and Jerry or Science programs.

I find it difficult to read the titles of YouTube videos even though I can understand the whole video, I think it may be the style in which the titles are written, to grab attention rather than be “traditionally correct”.



**THE BIG QUESTION - CAN YOU TALK WITH PEOPLE**

I have practiced around 6 hours of talking with an excellent AI bot on level Intermediate.

So the short answer is no, I don’t think I can talk to people fluently, but I can understand them when they speak to me and if absolutely necessary I can get them to understand mostly.

Before you all throw your hands up in despair, I can still remember the first few hours of speaking (as it was only last month) and I was appalling. But in the space of 6 hours practice I can say without doubt that my improvement rate is exponential.  I really can’t believe it myself.   

They key improvement is that words seem to be appearing in my head with little effort, don’t get me wrong, I am still very much struggling for all the words I want to use, and I haven’t even started to think about how bad I sound, but most of the words are coming from nowhere.

In a sentence I may struggle for precise tense, “connector words” or vocab, but I can feel that coming.  In the first everything was a mess, by the fifth hour I was looking up connector words and managing with better accuracy the present tenses and some of the past tenses. I can feel the improvements each hour, but it is mentally exhausting.



**Going forward**

Mission - Become conversationally fluent in Spanish but with a sexy English accent

Overall Plan - Continue to log listening / speaking and reading until I have 2000 hours listening, 100 hours speaking and 1 million words reading, then just continue.

Method - Average 100 minutes per day over each month of listening / speaking, then read for half an hour.  Days off are allowed… but not many

When I have 50 hours or so of AI talking in the bag, I’ll look to a local language group for an language exchange.

Expected completion April 2026 for above objectives and then continue forever

  
**Summary** 

This is the first update I've written where I am confident that INPUT is turning into OUTPUT and now I know that this will work, where as every other update I was hopeful it would work.",1,1743502354.0,dreamingspanish,0,1.0,False
1jos0zp,https://www.reddit.com/r/EDAnonymous/comments/1jos0zp/help_kinda_long_sorry/,help? kinda long sorry,"i feel sick to my stomach bro today i was out getting coffee with my mom and we were just chatting and she brings up food and eating disorders randomly, she knows i struggle with food btw however im not diagnosed with any ed but i restrict/purge/over exercise as well as my brain being fucked up, thinking of food and my weight 24/7 and i have been like this for years so im obviously struggling, she said to me “i dont think you have an eating disorder, i think you have disordered eating, people with an eating disorder physically cant pick up food and eat it” my stomach DROPPED, i feel fucking disgusting and i want to starve myself even more now to prove to her that i AM sick. she also said “fasting for a few days to lose weight is unhealthy but not an eating disorder” i feel so invalid and gross and upset with her tbh. like??? pls tell me i’m not over reacting, i wish i was taken serious and now i just want to get worse to prove to her im not okay. i’m struggling so much atm like more than ever and now im being invalidated i honestly feel ashamed that im not doing ‘good enough’ in her eyes which is bad of me to even think that. before she’s talked about how i haven’t lost much weird before and is always comparing me to this woman she works with who is anorexic, she said today “ (name) literally couldn’t pick up and eat food even if she wanted to, that’s a real eating disorder” okay rant over thanks for reading mwah:)",1,1743502145.0,EDAnonymous,0,1.0,False
1jorzzh,https://www.reddit.com/r/BangaloreSocial/comments/1jorzzh/how_do_you_even_date_in_bangalore_as_a_woman_in/,How do you even date in Bangalore as a woman in her late 20s with a full-time job and very little patience for nonsense?,"
Okay hear me out — I’m 29, living in Bangalore, and trying very hard to “put myself out there” (whatever that means in 2025).
Now let’s set the bar right here:

I’m not conventionally attractive — not the girl you double tap for her selfie. But I’m smart. Really smart. Witty things just fall out of my mouth. I’m funny, sharp, can talk about gaming, superheroes, politics, geopolitics, and occasionally cry over a good finance spreadsheet. I drink, I smoke, I smoke up — I’m honest about it. So there’s that.

I’ve tried dating apps. Made the effort. Wrote a good bio. Still — crickets. Or worse, creepy one-liners.

What I’m looking for is super simple:
I’d love to meet men (preferably 30+) with sorted careers and a sorted life. Not here for one-night stands or messy situationships. I’m more of a “let’s meet and see where it goes” kinda person. The slow burn, the coffee dates, the banter — that’s my jam.

But HOW does one even meet people organically in this city?

We’re all working 9-10 hours a day, and by the time the weekend hits, we’re buried under laundry, groceries, or recovering from the existential crisis that is adulting. I’ve tried stepping out more, but I don’t even know where to go or what to attend to find people who are also looking to date with intention.

So —
Where are the good men in Bangalore hiding?
Are there any events, spaces, communities that help people meet each other without pressure but with the possibility of something meaningful?

I’d love to hear your thoughts, suggestions, or even just stories about how you met someone without relying on the usual swipes. Let’s romanticize reality again, please?

Also, if you’re a decent, emotionally available man reading this… say hi?
",1,1743502022.0,BangaloreSocial,0,1.0,False
1jory4p,https://i.redd.it/4z85wurz57se1.jpeg,What can I do for my translucent and yellow teeth,"So I have translucent teeth that are yellow ni matter what I do. 
I’m not sure if they were always translucent (when I was a kid) or if I messed them up with baking soda, lemon and using other abrasive thing. What I do know is that they have always been yellow.

- I had braces for 3 years, took them off 2 years ago
- ocasionaly I would smoke but stopped alltogether this year (haven’t had a cig for about 4 months now)
- I brush my teeth with el. Toothbrush (sonic)
- I drink coffee",1,1743501806.0,askdentists,1,1.0,False
1jory4a,https://www.reddit.com/r/BPDlovedones/comments/1jory4a/my_best_friend_with_borderline_personality/,My best friend with borderline personality disorder broke up with me. I feel empty now...,"I'm posting again because there was an update.

Starting from the beginning...

I'm 20 years old, and a few months ago, I started seeing a 23-year-old woman. I'll call her J.

J and I had an instant strong connection, but things have been really difficult between us.

From the start, it was already hard to go out with J (it took about 2–3 attempts before we finally went out), and even after we did, things didn't get any easier.

J has borderline personality disorder, trauma from her ex-boyfriends, and from the beginning, she said she didn’t want a relationship.

The problem is that, at the same time J acted this way, she also showed signs of wanting something serious—being romantic, giving gifts to me and my family, wanting me to go out with her and her family, and, believe it or not, getting jealous.

Anyway, despite the good moments we had, these past months have been a constant cycle of her wanting to distance herself during crises and me always being patient, trying to talk to her and make her feel better.

Things went on like this until mid-November, when we broke up for good. She said we should just be friends and wouldn’t be together anymore.

Around that time, I randomly met a girl on Instagram (I’ll call her N). N ended up helping me during that time and even gave me advice about my situation.

J and I had some fights before, but I consider this one the worst.

It was December, and I was on my way home from work when J messaged me saying she had woken up wanting to have sex and was going to do it because someone had invited her (she said it was a guy she had been with before her last ex).

I tried to talk to her at the moment because I was upset, but instead of replying, she went to play League of Legends.

The next night, after things had cooled down, I brought it up again. J said she didn’t actually do it but also didn’t admit she was lying. She just said she lost interest.

Then, I decided to tell her that N had invited me to hang out (which was true). I told her that this girl didn’t seem to have any romantic interest in me—it really seemed like just friendship. She had invited me twice for coffee and once to a book club she was organizing at her house with her friends.

I told J and asked if I could go. I even said that if she wanted, we could date, and I wouldn’t go. That I was only considering it because she didn’t want to be in a relationship with me.

J said it was fine, but from her tone, I could tell it wasn’t.

The next day, J teamed up with her cousin and pretended to be on a date to make me jealous. That’s when she finally admitted she had said all that just to test me. She also compared me to her ex-boyfriends.

She blocked me on the messaging app, and in desperation, I ran out of my house to go to hers, bringing a bouquet and some things she liked (energy drinks and chocolate) to try to fix things. I also messaged N, told her we couldn’t talk anymore, and blocked her.

In the end, J and I made up, but now things have gotten even worse.

Some time after the fight, J said I messed up by blocking N, and even though she told me to unblock her, I remained firm in my decision to keep N blocked.

However, after thinking about it for a while, I realized I had been really unfair to N, and it didn’t make sense to keep her blocked because of J.

J had been honest with me from the start and always said she didn’t want anything serious (even though I felt otherwise). She always made it clear that I was her best friend.

Because of that, a few days ago, I ended up unblocking N and apologizing to her. She accepted, but she told me not to drag her into this again.

But here’s the thing—I didn’t tell J that I was going to unblock N.

On Saturday, J and I went out for coffee and were talking when we got to the topic of our last (now second-to-last) fight.

She wanted to see the girl’s profile, and since she insisted, I ended up telling her that I had unblocked N.

From that moment, her mood changed, and she wanted to go home. That night, we were supposed to watch a reality show together, but she didn’t want to anymore. Just after midnight, she sent me a video of her crying. I tried to talk to her, but she said I hadn’t been honest with her.

Yesterday, things only got worse. She said all she wanted was honesty and told me I was never honest with her, that I always lied, and that she didn’t want to have a friend who was a liar.

I kept trying to talk and calm her down, but it just got worse. She called me, cried harder than she ever had before because of me, and asked for N’s profile.

She followed N, N messaged me, and I explained the situation to her. N got mad at me, said that J and I were crazy and immature, and that she had bigger problems than this. She said she never had any romantic interest in me and that our friendship was dead. Then, she blocked both me and J.

I told J what happened, and she asked for screenshots, which I showed her. That made her feel even worse. She sent me a long message saying she forgave me but that it would be better if we went our separate ways. That she couldn’t pretend nothing had happened.

I insisted and insisted until she got angry and blocked me (something she had said she wouldn’t do).

I was blocked on Facebook, Instagram, TikTok, WhatsApp, and even on several fake accounts I made on Facebook to try to talk to her.

I even went to her house with chocolate and a letter, saying I was at the park near her house, but she didn’t come out or unblock me. Only after I started sending her 1-cent bank transfers with messages did she unblock me—being extremely rude and telling me to leave her alone. Then, she blocked me again.

Today, I found out she spoke to my mom… She told her I was harassing her and that if I continued, she would call the police and file a report.

I sent a few more 1-cent transfers to try to talk to her, but she said the same thing. That she forgives me but doesn’t want any more contact, and that if I keep going, I’ll have to deal with the law.

I sent a few more transfers apologizing and saying it would be the last time, but she refunded everything, and that was it…

I haven’t showered, I’ve been crying non-stop, and I feel completely devastated. The doubt still lingers—was I the asshole in all of this? But in the end, it’s all my fault… I wish I had been a better friend to J.

",1,1743501805.0,BPDlovedones,0,1.0,False
1jorxgu,https://v.redd.it/g24pcbme57se1,$314.64 | HiBREW 20Bar Semi Automatic Espresso Coffee Machine Temperature Adjustable Cold/Hot Super Slim Coffee Maker Cappuccino H10B,,1,1743501741.0,HiBrewCoffeeMechines,1,1.0,False
1jorx65,https://www.reddit.com/r/brew/comments/1jorx65/good_morning_brew_enthusiasts_join_todays_daily/,"Good morning, Brew Enthusiasts! Join today's Daily Brew Chat to share your coffee moments, ask questions, and discuss anything related to the world of coffee.","Good morning, Brew Enthusiasts!

Welcome to today's Daily Brew Chat – your daily rendezvous with fellow coffee lovers. This thread is the perfect place to share those special moments from your daily coffee routine, be it a freshly brewed espresso at dawn, a latte art attempt, or a quiet cup of joe that sets your day right.

🌟 **Today's Discussion Points**:

* **Morning Rituals**: What's your go-to coffee preparation method in the morning? Do you stick to a favorite brew, or do you like to experiment?
* **Ask the Community**: Have a brewing question or need a recommendation? This is the place to ask!
* **Coffee Insights**: Share any interesting facts or experiences. Tried a new coffee shop? Found a rare bean? Let's hear about it!

📸 **Photo Sharing**: We love to see your brews! Share photos of your coffee, setups, or brewing processes.

🔍 **Learning Corner**: Share any tips, tricks, or advice you've learned about brewing a great cup. Newbies and veterans alike, let's learn together!

Remember, whether you're a seasoned barista, a home brewing enthusiast, or just beginning your coffee journey, your contributions make this community vibrant and diverse. Let's keep our discussions respectful, supportive, and as warm as a freshly brewed pot of coffee.",1,1743501710.0,brew,0,1.0,False
1jorwa8,https://www.reddit.com/r/Coffee/comments/1jorwa8/mod_the_daily_question_thread/,[MOD] The Daily Question Thread," 

Welcome to the daily [/r/Coffee](https://www.reddit.com/r/Coffee) question thread!

There are no stupid questions here, ask a question and get an answer! We all have to start somewhere and sometimes it is hard to figure out just what you are doing right or doing wrong. Luckily, the [/r/Coffee](https://www.reddit.com/r/Coffee) community loves to help out.

Do you have a question about how to use a specific piece of gear or what gear you should be buying? Want to know how much coffee you should use or how you should grind it? Not sure about how much water you should use or how hot it should be? Wondering about your coffee's shelf life?

Don't forget to use the resources in our [wiki](http://www.reddit.com/r/Coffee/wiki)! We have some great starter guides on our [wiki ""Guides"" page](https://www.reddit.com/r/Coffee/wiki/guides) and [here is the wiki ""Gear By Price"" page](http://www.reddit.com/r/Coffee/wiki/gear#wiki_coffee_gear_suggestions) if you'd like to see coffee gear that [/r/Coffee](https://www.reddit.com/r/Coffee) members recommend.

As always, be nice!",1,1743501630.0,Coffee,0,1.0,False
1jorvg0,https://i.redd.it/y6nwxddh47se1.png,Interesting App! Automatically convert your daily tasks into a Ghibli style at the end of each day,,2,1743501541.0,ChatGPT,1,1.0,False
1jorva8,https://www.reddit.com/r/SIBO/comments/1jorva8/my_experience_so_far_a_question_about_s_boulardii/,My experience so far + a question about S. Boulardii :),"I've been working to target, what I believe, is my underlying conditions with SIBO and Candida/SIFO. Artichoke (1000mg) & Ginger (1000mg) have helped tremendously, Apple Cider Vinegar helped too but I noticed it made me flare up a bit, so I started taking probiotics, specifically S. Boulardii. I think this has been quite helpful, but I've been getting a big flare up in my rosacea after I take it now and I've been wondering if anyone has been in a similar situation.

For background, my symptoms are :

* Rosacea (type 1 & 2) - sulfur washes & Azelaic Acid helped with this a lot, as well as Vit C
* Brain Fog - the artichoke helped with this
* diarrhoea - the boulardii helped with this, however, it's now making my rosacea worse
* Bad dandruff/psoriasis - 99% gone with everything + Ketoconazole
* Insomnia - didn't realise this was HIT/SIBO related! Still somewhat there
* Food intolerances - the Ginger and Artichoke have been amazing for this. For some reason I would break out in cystic acne if I drank unfiltered coffee, ate chocolate, drank matcha... as well as this, anything would break me out so I started waiting an hour after eating before drinking which worked for 2 years before something changed in my gut and I realised I needed to address the underlying issue.

  
So, with all of this laid out, does anyone have any idea why the S. Boulardii - for which I've only heard amazing things - is causing my rosacea to flare up fairly immediately? 

Thank you very much taking the time to read this and I also want to say that I'm grateful for this community. I think I've had this for condition for 15+ years, figured out how to manage symptoms along the way but have only recently started looking towards curing my gut dysbiosis. Thank you!",2,1743501522.0,SIBO,0,1.0,False
1joru9u,https://i.redd.it/dvdk6ydt47se1.jpeg,Draw my friends celebrating the first episode of the One Piece live action on Netflix,"I don’t know why but I find this picture really adorable. The way my friend dressed up for the first episode when everyone else is in regular clothes, the snacks on the coffee table, their facial expression.

I would love to have a stylized drawing of this moment hanging on my wall. If anyone of you talanted artist can help me draw this I will post the printed painting hanging on my wall🏴‍☠️",2,1743501404.0,drawme,1,1.0,False
1jortl6,https://i.redd.it/ht0nqm0j47se1.jpeg,Daily Angel Beats 4/1/25 - Key Coffee!,,5,1743501326.0,AngelBeats,1,1.0,False
1jortcq,https://www.reddit.com/gallery/1jortcq,What does my fridge say about my boyfriend and I,,1,1743501298.0,FridgeDetective,0,1.0,False
1jorsem,https://i.redd.it/dgbumeb647se1.jpeg,Little doodles in a coffee shop,⭐️⭐️,1,1743501190.0,sketchbooks,0,1.0,False
1jorr4q,https://i.redd.it/xmdv07kq37se1.jpeg,Little doodles,Did these in a coffee shop ,1,1743501043.0,doodles,0,1.0,False
1jorr1p,https://www.reddit.com/r/peloton/comments/1jorr1p/pelotonplus/,PelotonPlus,"
# PELOTONPLUS(TM)

Dear Pelotonians, over the last years, repeated efforts have been made to buy the subreddit right from under you. We have always stalwarthly defended you, but as times get harder, we have taken a good look at our business model and found a way to make it work better - for you and us. 

Data providers such as PCS, FC, Sanluca etc are insisiting we pay to link their content, and mods have so far covered the growing costs of hosting our popular fantasy games.

By introducing the new PelotonPlus membership, we will add extra perks and ways of interacting with the sport you love, for an astonishing low monthly sum, less than then a cup of coffee* (*In Dubai Airport, with whisky in it). All of your favourite games will be upgraded and even better for you to play in this new exclusive deal. With this action, we hope to finally be able to pay the moderators a decent living wage and not the pittance they have been existing on so far, as well as actually sponsoring a lucky UCI rider of your choice. Yes, YOUR choice. All paying members can vote for which rider they want us to sponsor, and we will reach out and see if that is possible, and then we will pay Daan Houle to have a little sticker with reddit on tacked to his TT helmet. 

Participation in some of the race threads will only be for paid members - but fear not, popular races like Fléche Ardenaise,  Elfstedenronde Brugge and Tour of Guangxhi will still be entirely free for everyone. 

## Examples of PelotonPlus(TM) content: 

* Live Race footage
* Interviews with Riders
* Live Strava Data
* Drones stationed at the finish line and mountain passes
* Interviews with crying family members tangentially related to a rider in todays race
* Exclusive previews of leaked team tactics
* Subscribers will get a free beer next time a Grand Tour starts in the Netherlands",21,1743501033.0,peloton,15,0.92,False
1jorr0w,https://i.redd.it/qvu1kbap37se1.jpeg,Roastery coffee house,"Espresso martini 
These people serve the best coffees in Hyderabad…
",5,1743501031.0,hyderabad,1,0.86,False
