id,url,title,text,score,created_utc,subreddit,num_comments,upvote_ratio,over_18
1u5iyoh,https://i.redd.it/5h9k5mdzj87h1.jpeg,"I see no hope or future, wondering what I'm even alive for","In my early 30s. Well educated and well read, have an ok job as a beginner truck dispatcher, have 4 apartments I'm gonna inherit one day. Reasonably attractive, somewhat fit and well groomed constantly, have at least a year's worth of wages backed up in savings, have some investment in stocks, good cook (when I'm in the living mood)....have no will to live anymore. You'd think I should be grateful, I know I have it better than maybe most on the planet. But I spent my 20s working to get there and building a life. 

I didn't listen to my parents to get married ASAP after high school. Instead I travelled and worked abroad to make money because my country's economy is a dumpster fire. Came back to no social life, no possibility to meet new people or find a girlfriend. Everyone my age is either married, left the country or looks at you in disgust because you're 30 something and still not married and no kids like there's something wrong with you. 

Most of my coworkers are gen z and alpha and don't even wanna have coffee with you at work or have a normal conversation, makes me feel like I'm 80 sometimes about to be buried. I've had a few relationships that didn't lead anywhere because I was constantly on the move focused on money but I know I'd make a good partner. Was rarely single in my 20s and mostly in multi year relationships.

 I go to a club and feel like it's impossible to communicate with anyone. Go to a bar, movie theater and feel alone, I sometimes drive around for hours on the weekends just not to feel the crippling loneliness and melancholic giving me existential panic attacks. 0 friends, no girlfriend, family sees me as a failure cause I didn't follow in their footsteps.

 Today I woke up and spent an hour eating this and looking at the wall in silence wondering why did I even wake up on a beautiful sunny Sunday like this. I live to work and sleep basically. Feels like a wasted life, regretting being born. 

Tomato salad with olive oil, onion and black pepper. About 150 calorie meal and I'm 6'6"" (2 meters for the non-americans) tall. And still thinking I deserve less",3,1781437392.0,BoyDinnerDiaries,2,1.0,False
1u5iy8p,https://www.reddit.com/r/horrorwriters/comments/1u5iy8p/seeking_feedback_2k_words_approx/,Seeking feedback - 2k words approx.,"I’d lived in Spokane my entire life and heard rumors about the Great Northern Clocktower now for years – that it was haunted by a ghost. Yes, that clocktower, the one that’s stood like a protector, watching over all of the city for over a century.    
It was one of those things that faded into the recesses of the mind if you’ve lived here as long as I did. Passing through, being filed away, only to be extracted during a random conversation here or there.    
I was fascinated by the supernatural, probably more than most people. I read horror books, loved horror films, but I wasn’t sure if I believed in any of it. Could ghosts exist? Maybe. I suppose their existence couldn’t be disproven, so it was possible.     
My best friend Grace, however, was a complete believer. She had a full ghost hunter setup. EMF meter – check! EVP recorder – check! She had so much that I didn’t even know what half of it was. She invited me to a couple of séances before, but I always passed on them. Who wants to drive to an abandoned house in the middle of nowhere late on a weeknight? Not me.     
One Saturday afternoon in early October, we sat in the park, sharing theories about horror, urban legends, and debating the writings of Stephen King. Grace then shared a particular urban legend she heard about the clocktower in Spokane. One we had to try.    
“So we’re supposed to chant the words 'We Serve the Darkness' in unison in the belfry three times on Halloween between three and four a.m. If we do the ritual successfully, we’ll see a ghost,” Grace declared. “The height of the witching hour is what gives the words power.”    
“Oh, and you're supposed to draw these symbols on the floor with chalk,” Grace said, showing me three symbols she drew in the notes app on her phone. They seemed to be a variance of a moon, a star, and a sun with a little bit of demon mixed in.    
“You know this can’t be real, right?” I replied, sipping my coffee. “This is a variation of the Candyman urban legend, seriously.”     
“Okay, maybe it’s close, but come on, you have to admit, this is the most particular rumor we’ve heard about the tower.”She said. “It’s totally worth trying.”     
“I mean, it may be the most specific, but it's also the hardest to execute.” I countered. “We also need to be in the tower at three a.m. on Halloween night.”    
“Yeah, so…” she replied, raising her eyebrow. Her voice intoned with sarcasm and a bit of annoyance.    
“We’d have to break in,” I said. “Not that I don’t want to try it, but I don’t really want to be doing that. Also, where did you hear this one?”    
“Oh, from Larry!” she said.    
“The homeless guy who breaks into the tunnels?” I asked.“How could I have known…”    
“Yeah - did you know that guy used to be a professor?,” she replied.     
“Had no idea. Look, the cops will also be out in full force that night, I replied, shifting back to her idea.    
“Technically, it’s the night before, since it’s the morning of Halloween!” said Grace sarcastically. ‘We’re doing it, and we’ve done way crazier stuff.”    
“That’s true,” I said.    
“And I have a lock pick kit now,” Grace replied.    
“Okay. Fine,” I said, reluctantly agreeing. Part of the reason I did agree was that Grace had been having a hard fall—her mother was seriously ill—and it was obvious she was looking for a distraction.    
A couple of weeks passed, and I heard little more from Grace about her supposed Great Northern Clocktower plan. I thought maybe, just maybe, she forgot. This was ok by me as I thought it was nonsense.    
October 30th arrived, and I didn’t hear anything from her all day. We had our usual hangouts, obviously, during the week, but she hadn’t mentioned it. I thought maybe it was a passing interest. A lot of the time, these things happened with her; she got into something, a story, or something we should do, and then she dropped it.     
My phone buzzed. It was Grace.    
\*Grace: We’re still doing this tonight, right? Are you ready to see a ghost?\*    
I rolled my eyes, glancing at the phone and put it down. My breathing quickened, and my heart rate picked up. Crap. I did not want to do this, but I already agreed. Ugh.    
\*Me: I’m in. Pick me up at 2:30? I just want to sleep beforehand.\*    
\*Grace: Sounds good.\*     
\*Me: Maybe we can go to the diner after for breakfast…You can treat.\*    
\*Grace: Yes!!!\*    
\*#\*    
A hard rapping sound woke me up. I sat up, my mind in a hazy fog from sleep. I looked at the clock – 2:31 a.m.    
“Yeah, I’m up! One second. I’m coming!” I called out, moving across the room. I opened the door - it was Grace.    
“I called you three times, but you didn’t answer. Are you ready?” Grace said excitedly. “Let’s do this!”    
I hurriedly threw on a jacket, and we headed out. Entering the car, club music blasted through the speakers.    
“I thought a little club music might hype you up!” Gracesaid.    
“It’s working,” I replied, smirking.     
Grace punched the gas – we were off to the clocktower.    
“You know nothing might happen, right?” I said.    
“You don’t know that anything won’t,” she retorted, pullinginto the parking lot. The clocktower came into view, rising in the distance.    
“Come on!” Grace said, getting out. She slammed the car door.    
As I stepped out of the car, a crisp chill crept up my neck. The air thickened, and everything seemed to slow down. The ghost stories I heard about the clocktower resurfaced in my mind now that we were here.     
I hurried past the other cars, cutting through the park. Gracewas nearly to the clocktower door. She glanced back, looking towards me. I lengthened my stride, picking up the pace to catch up to her.    
“I’ll just get my lock-pick kit!” Grace said, reaching into her pocket. She pulled out a wallet-sized card full of thin metal tools.    
“Where do you get things like that?” I asked. “You’re wild.”    
“I mean, basically anywhere on the internet,” she replied. The lock clicked. Grace turned the knob, and the door creaked open.    
Inside was pitch black. Struggling, I fumbled for my flashlight. Finally, I found it and popped the switch. A beam of light erupted from it – illuminating the spiral staircase in front of us. I just remembered – there was no elevator. It had been years since I’d been here.    
We had to walk.    
\\#    
     
“We have to hurry,” Grace said. It’s almost the witching hour.”    
I glanced at my watch – 2:51 a.m. Before I could respond to her, the stairs thundered ahead of me. Grace began jogging upward.    
I moved through the tower entryway, then up the stairs. They creaked softly as I moved up them. My pace quickened.    
“Ignore the light switches on the walls! We can’t turn the lights on; they have to stay off!” I yelled ahead to Grace. “The police or security could see them.” Looking back at me, Gracenodded.    
The spiral staircase was unending, or it seemed that way at least. Glancing out the window about halfway up, I saw Spokane. The lights of the city gleamed brightly.    
The sound of the Graces' footsteps echoed far ahead. I shined the beam of the flashlight down the staircase and walls below us. It vanished into the concrete floor, far beneath us. We were high, almost to the top. Two more curves to go. I started jogging, and Grace came into view.    
“Finally!” “You took forever!” Grace said.     
I reached the top, and in front of us stood an old oak door. It was simple, yet beautiful. Stunning really. Intricate grains were woven throughout it. Maybe original to the tower’s construction in 1902.    
We both stood in silence in front of the door for a good ten seconds. Then I cut through it. “Well, do your lock-pick magic!” I said to Grace with a smile.     
Grace took out her lockpick, knelt in front of the door, and worked the lock with her tools. It clicked. I opened the door, and together we walked into the belfry.    
As we took our first steps into the belfry, the floor groaned under our weight. The belfry was clearly under some sort of construction. Tools were littered throughout it.     
I clicked the flashlight off. The bright lights of Spokane glowed through the stained-glass windows in the belfry, brightening the room ever so slightly.     
Directly across from us were the gears of the clock, their teeth interlinked tightly and beautifully. A small, miniature gear turned quickly and inaudibly nearby, appearing to measure seconds.     
“Okay, let's do this!” Grace said, reaching into her pocket. She pulled out the chalk, knelt, and drew the three symbols in front of us, parallel to the gears. I checked my watch, it was now 3 a.m.    
“Okay, on three,” I said, grabbing Grace’s hand.    
“One.”    
“Two.”    
“Three.”    
“We serve the Darkness! We serve the Darkness! We serve the Darkness!” we chanted at once. The ritual was complete.    
Nothing happened. Thirty seconds passed, and we both sort of looked around the room, smirking at each other. Then all sound started falling off, it was indescribable. Car horns, random voices on the street, and everything that had been making noise died. An uneasy, unnatural quiet settled over the room.    
As I turned towards the clock gears, I saw it. A wave of light, as you might see on a copying machine, passed through the air from one side of the room to the other. Reality began to warp. The air thickened, and the temperature dropped, as if you had immediately entered a refrigerator at a restaurant.    
I turned to Grace and noticed her eyes.    
They were bleeding.    
This wasn’t lightly bleeding either; they were streaming blood. It was getting all over her shirt, jacket and even the floor below.    
“Your eyes are bleeding!” she yelled, pointing at me.    
I touched my face and noticed blood was running all over me. My hands and body began shaking, and heat shot through my body. It felt like electricity was running through my limbs.    
Before I had time to react, Grace let out a horrific scream. It tore through the air like shattered glass, splitting through me.    
Grace ran to me, screaming, and reached for my hand but froze in place. I wanted to reach back, but I couldn’t. Nor could I speak. A force was stopping me. Grace’s scream swiftlyceased.     
I turned in the other direction. A shadowy black figure stood in front of us with eyes like golden half-moons. It was tall, maybe ten feet. I could only catch its outline, which appeared to be changing. My eyes burned from looking at it. Terror ripped through me, but I could not react. There was only silence.    
“Do you wish to serve? Or do you have an offering? the figure said. “This gateway has not been opened in many eons.”    
Paralyzed with fear, neither Grace nor I could respond. Then, just as suddenly as it had taken hold, the force released us.     
“Who are you?” I asked.     
“My name isn’t relevant. I am from the city of Carcosa, ituttered. “Will you serve, or are you providing an offering?”    
While the being spoke, its voice did not reach me through my ears. Instead, it thundered through my mind like a freight train. I looked again at the creature, and it appeared to be growing in size. We were mere becoming mere rodents compared to it.    
Grace and I stared at each other across the room. Neither of us in belief of what was happening. My mind began to fade, and I started to become non-responsive observer to what was going on around me.    
“A decision has been made,” the entity declared.    
The creature reached out its arm towards Grace. The arm was half insect, half octopus, covered in tentacles. The entity lifted Grace into the air. Then time seemed to slow down. I tried yelling out but couldn’t; my voice was locked.    
A huge, hazy, back mass tore from Grace, shooting high into the air. She screamed in agony. It was as if her soul was being separated from her body. The black mass shot across the room into the entity’s body. The creature's golden eyes glowed brighter.    
The creature’s tentacle turned in a different direction andGrace’s face vanished. As her mouth disappeared her screaming stopped. A portal opened above us and Grace’s body was shredded apart, every piece of her disappearing into the portal, bit by bit. I closed my eyes in terror and did not open them for some time.    
Time passed; maybe minutes, maybe hours. I opened my eyes, and the entity was gone. I tried to stand up but fell to the floor.    
Darkness.    
\\#    
I woke up the next morning on the floor of the belfry. Grace was gone. I almost expected her to be next to me while I stood up the next morning, because how could any of this be real? It was surely a dream, right?    
It wasn’t.    
It was past 7 a.m., and I had to make my escape before security and staff came through. I hurried down the stairs; my mind was fractured. I wasn’t dead, but I wanted to be.    
Weeks passed by, and it was clear Grace wasn’t coming back. I didn’t even understand how I could think that, after what I had seen. How could pursuing a stupid urban legend go so wrong?    
For a long time, I just stayed in my room, unable to sleep. Unable to do anything but think about the way Grace died and the shadow with the golden eyes. Sometimes, I just lay in my bed restless and in terror, thinking about what happened that Halloween night.    
Now, months later, I’ve been obsessed with what the entity told us: “The decision has been made.” Who made the decision? I don’t believe Grace would choose to be an offering. I didn’t choose, at least not willingly, perhaps on subconscious level one of us did and the entity picked up on it. I suppose I’ll never know for certain. I’m not quite there yet, but I know I have tomake peace with not knowing.    
The only certainty I found out in this whole ordeal is that, despite what rumors are out there, there is no ghost in the clocktower. Only something far worse.    
 ",1,1781437354.0,horrorwriters,0,1.0,False
1u5iy79,https://www.reddit.com/r/CampHalfBloodRP/comments/1u5iy79/a_properly_portioned_bento_meal_hosted_by_shion/,A Properly Portioned Bento Meal Hosted by Shion,"Shion had learned very early in life that food did not need to be extravagant in order to be worthwhile. It needed to be filling. It needed to be balanced. It needed to be prepared with care and distributed in a way that ensured everyone received what they required.

Therefore, in the estimation of Shion, bento boxes were one of the most logical meals in existence.

The Counselor of the Horai cabin had arrived at the dining pavilion early, as was proper. He had arranged several long tables into neat stations, each one labeled with handwritten signs in careful block lettering. One table held rice and onigiri. Another held proteins. Another held vegetables. The final table held small desserts and drinks. Every item had its proper place. Every serving utensil had been arranged parallel to the edge of the table. Every stack of bento boxes had been placed at a mathematically pleasing angle.

Shion stood at the front of the setup, hands folded neatly behind his back, looking over the arrangement with the serious expression of someone preparing for a military inspection rather than dinner.

The meal itself was simple, but carefully selected. There was white rice, furikake rice, and plain onigiri for those who preferred portable food. There was karaage, grilled salmon, teriyaki chicken, and tofu for those who did not consume meat products. There were cucumber salads, edamame, steamed broccoli, carrots, and pickled radish. For fruit, there were orange slices, grapes, strawberries, and apple slices that Shion had attempted to cut into rabbit shapes. Some of them looked more like anxious triangles with ears, but the effort had been made.

For dessert, he had set out mochi, dorayaki, taiyaki, and a small tray of cookies for campers whose preferences were less aligned with Japanese sweets. There were also all the drinks anyone could ever want, including coffee. Shion did not personally understand why anyone would consume coffee with dinner, but he had learned that people were attached to their habits and that it was usually easier to accommodate them than question them.

Once campers began to gather, Shion waited until enough of them had arrived before stepping forward.

“Slautations and greetings, my camp comrades.” Shion began, his tone as even and formal as ever. “Today I have prepared a bento dinner for camp. A bento is a meal arranged in a compact and balanced manner. It allows one to receive rice, protein, vegetables, fruit, and additional items in a single container. In my opinion, this is an efficient and aesthetically reasonable way to consume the needed caloric intake for the day.”

He then gestured stiffly to the neatly arranged tables.

“You may assemble your own bento box according to your personal preferences. However, I must ask that you proceed in an orderly fashion. Please do not place dessert directly on top of your rice. Please do not create structural instability by stacking every item vertically. Please do not take every piece of karaage before other of our comrades have been given an opportunity to acquire some. That would be inconsiderate.”

He paused for a moment, as if allowing the seriousness of his warnings to settle over the crowd.

“The recommended arrangement is as follows. Rice or onigiri is to be placed in the largest section. Protein beside it. Vegetables in the remaining space. Fruit and dessert should be separated when possible, as moisture transfer may negatively affect the quality of both items in turn.”

Shion then reached down and picked up one of the empty bento boxes, demonstrating as he spoke. He placed rice into the largest compartment first, then added a piece of karaage, a small portion of cucumber salad, several pieces of edamame, and two orange slices. Last, he placed a piece of mochi in the smallest section.

“This is an example of an acceptable bento,” he said, holding it up for the campers to observe. “It is balanced. It is not overcrowded. It does not contain any obvious logistical failures.”

The son of Eirene placed the box back down with care.

“This has concluded my prepared remarks. You may now begin assembling your meals. If you require my assistance with proper bento organization, I shall provide guidance. If you ignore my guidance and your meal becomes difficult to consume, I shall not say I informed you as such, but please understand that I will be thinking it.”

With that, Shion stepped aside, allowing the campers to begin. He remained near the tables, ready to answer questions, refill trays, correct poor utensil placement, and quietly suffer through any bento boxes that violated the principles of balance, order, or basic common sense.

---

---

###The Menu:

* **The Base:** Your choice of either white rice, furikake rice, or onigiri.

* **The Protein:** Karaage, grilled salmon, tofu, or teriyaki chicken.

* **Eggs**: The only option is [tamagoyaki.](https://maple.kitchen/wp-content/uploads/2025/03/Tamagoyaki.webp)

* **Vegetables:** Cucumber salad, edamame, pickled radish, steamed broccoli, and carrots.

* **Fruits:** Orange slices, grapes, strawberries, and apple slices.

* **Dessert/snack:** Mochi, dorayaki, taiyaki, or small cookies.

---

* **And all the drinks you could ever desire**

---

---

OOC: Hope everyone enjoys this meal and if you want to talk to Shion feel free to at me /u/theaquasofhiseyes",1,1781437352.0,CampHalfBloodRP,0,1.0,False
1u5ixqo,https://www.reddit.com/r/mumbaimeetups/comments/1u5ixqo/m_22_looking_for_f_for_a_movie/,"M, 22 Looking for F for a Movie","Planning to watch a movie this weekend and would love some company.

We can grab a coffee or food before the show and enjoy the movie together.

Not a dating post. Just looking for a fellow movie enthusiast.

Feel free to DM if interested.",1,1781437312.0,mumbaimeetups,2,1.0,False
1u5ixou,https://i.redd.it/uqn7cpaqj87h1.jpeg,Soo soo good,I hide these in my special cupboard and give myself a max of 3 a day because I know unrestricted I would eat the entire package with so much shame but utter satisfaction. Today Im having them with my morning coffee. Advice eat slow and savor every crumb,7,1781437308.0,aldi,2,1.0,False
1u5ixex,https://www.reddit.com/gallery/1u5ixex,What am i doing wrong ? [Dedica Duo & Kingrinder P2],"I don't know what I'm doing wrong with this single shot. I've attached the basket photo too in case it has a weird geometry maybe, it holds 9 grams with puck screen, didn't try without. 15 clicks on the p2 with this coffee *(this is my first time with a coffee from outside of India, and it was really hard to grind even tho its like medium light, closer to medium).* And shots are gushing. 

&#x200B;

9in/27 out in 18 seconds. I'm doing rdt, tamping hard and even. I put the temp setting on the dedica at max too since i noticed this is a lighter roast. I can't really diagnose the puck, it looks even to me

&#x200B;

I'm reasonably dialed in for a medium roast in a double basket that holds 16 grams with puck screen, and 17.5 without. At 16 clicks on the p2. Which already bothered me because i saw in James Hoffman's video that he got a successful shot at like 28 clicks?! I had to go down to 16.

&#x200B;

Made it into a cortado so that i can chug it down which tasted okay. Smelled amazing though.

&#x200B;

**P.s- roast date is 8 june. And 20 may on that medium roast. 51mm baskets.**",1,1781437285.0,espresso,3,1.0,False
1u5ix03,https://www.reddit.com/r/IndiaCoffee/comments/1u5ix03/need_suggestions_for_good_darkmedium_roast_coffee/,Need Suggestions for good dark/medium roast coffee.,"Hey There, i am looking for a good coffee suggestion preferably Dark to Medium Dark Roast. Been trying making coffee using my moka pot and using vienna roast by blue tokai, but it tastes horrible. Any suggestions or maybe a way how to brew it and mix it with milk. ",1,1781437249.0,IndiaCoffee,1,1.0,False
1u5iwzb,https://v.redd.it/r1q6p7zjj87h1,"Good morning and Happy Sunday, y'all! Today is the day that the Lord has made, and I shall rejoice and be glad in it! We've got coffee & donuts ready for you before we start Cowboy Church. Enjoy your Sunday, everyone!",,4,1781437248.0,TheCowboyBunkhouse,0,1.0,False
