id,url,title,text,score,created_utc,subreddit,num_comments,upvote_ratio,over_18
1m6ylyo,https://i.redd.it/gv5cowalljef1.jpeg,A new friend,Not sure about his purpose but he has one row of inventory slot. Further study is required-and coffee ,1,1753240987.0,AbioticFactor,0,1.0,False
1m6ylsw,https://www.reddit.com/r/KeepWriting/comments/1m6ylsw/i_just_came_to_say_goodbye/,I Just Came To Say Goodbye,"The coffee shop smells the same, but you’re a stranger now
A ghost in the corner, etched deep somehow
I trace the lines of the table, remember faded smiles
A story whispered in echoes, stretching miles and miles

My heart still remembers the way you used to be
Before the cracks appeared, before the silence set us free

I just came to say goodbye, a whisper in the wind
To the dreams we built and watched them fall, until the bitter end
No more chasing shadows, no more wishing you were mine
Just a tear-stained lullaby, as we let go of what was kind

The rain outside mirrors the drops that fall inside my heart
Each memory a stinging reminder of how we fell apart
I see your face in every crowd, a bittersweet, fleeting view
And my laughter, it feels empty, trying hard to forget you

My heart still remembers the way you used to be
Before the cracks appeared, before the silence set us free

I just came to say goodbye, a whisper in the wind
To the dreams we built and watched them fall, until the bitter end
No more chasing shadows, no more wishing you were mine
Just a tear-stained lullaby, as we let go of what was kind

Maybe in another life, our paths would truly intertwine
But the chapters closed, the story done, etched in a fragile line
I'll walk away with my broken pieces, scattered on the floor
And finally lock the door to a love that's here no more

I just came to say goodbye, a whisper in the wind
To the dreams we built and watched them fall, until the bitter end
No more chasing shadows, no more wishing you were mine
Just a tear-stained lullaby, as we let go of what was kind

Goodbye to love, goodbye to us...
The echoes fade, and turn to dust...",1,1753240975.0,KeepWriting,0,1.0,False
1m6ykqf,https://i.redd.it/9du15hjaljef1.jpeg,Today’s haul after huge Haagen Dazs sale 🍦,,2,1753240885.0,icecream,0,1.0,False
1m6ykkg,https://www.reddit.com/r/ScentedMoments/comments/1m6ykkg/riverview_coffee_best_local_spots_in_2025_find/,Riverview Coffee: Best Local Spots in 2025 - Find Your Fix!,"[[Check Latest Arrivals riverview coffee on Amazon.]](https://blogs.perfectshome.com/clearance-inventory/?kw=riverview coffee)
    
# riverview Coffee: Best Local Spots in 2025 - Find Your Fix!

Riverview, with its charming streets and vibrant community, is rapidly becoming a haven for coffee aficionados. The local coffee scene is booming, offering everything from meticulously crafted espresso drinks to cozy atmospheres perfect for a relaxing afternoon.This article explores the best Riverview coffee spots in 2025, highlighting their unique features and why they deserve a spot on your must-visit list.

[[Explore Top Rated riverview coffee on Amazon.]](https://blogs.perfectshome.com/clearance-inventory/?kw=riverview coffee)

## Key Features Analysis

The riverview coffee scene thrives on a few essential elements that set its best spots apart.

**Locally Sourced Beans:** Many of the top Riverview coffee shops pride themselves on using beans sourced from local or regional roasters. this ensures freshness, supports the local economy, and often results in unique and complex flavor profiles.

**Artisan Brewing Methods:** Beyond standard drip coffee, Riverview's best coffee shops embrace artisan brewing methods like pour-over, French press, and cold brew. These methods allow baristas to carefully control the brewing process, extracting the best flavors from the beans and offering a customized coffee experience.

**Cozy and Inviting Ambiance:** A welcoming atmosphere is crucial for any successful coffee shop. The best Riverview spots offer pleasant seating, warm lighting, and frequently enough feature local art, creating a space where customers can relax, work, or socialize.

**Community Engagement:** Riverview's top coffee shops are more than just places to grab a caffeine fix; they are community hubs. Many host events like open mic nights, live music performances, and art exhibitions, fostering a sense of connection among locals.

Key features of Riverview's best coffee spots include:

* Locally roasted coffee beans
* Skilled and amiable baristas
* Comfortable seating options
* A selection of pastries and light bites

[[explore Top Rated riverview coffee on Amazon.]](https://blogs.perfectshome.com/clearance-inventory/?kw=riverview coffee)

## Core Benefits

Visiting the best Riverview coffee spots offers numerous benefits beyond just a caffeine boost.

**Exceptional Coffee Quality:** The commitment to quality beans and brewing methods ensures that you're getting a truly exceptional cup of coffee. Forget the bland chain store brews; Riverview coffee shops deliver rich, flavorful, and expertly crafted drinks.

**Supporting Local Businesses:** By choosing local coffee shops over national chains, you're directly supporting the Riverview economy and helping small businesses thrive. Your patronage enables them to continue providing unique products and services to the community.

**Experiencing the community:** Riverview's coffee shops serve as gathering places,providing opportunities to connect with neighbors,meet new people,and experience the unique character of the community.They often host events and offer a space for people to come together and share ideas.

[[Explore Top Rated riverview coffee on Amazon.]](https://blogs.perfectshome.com/clearance-inventory/?kw=riverview coffee)

## FAQs Section

**What makes Riverview coffee shops different from chain stores?**
Riverview coffee shops emphasize quality, community, and unique experiences. They often use locally sourced beans, offer artisan brewing methods, and foster a welcoming atmosphere that reflects the character of the town. chain stores, on the other hand, typically prioritize consistency and efficiency over individuality and community involvement.

**Are there options for non-coffee drinkers?**
Yes, most Riverview coffee shops offer a variety of non-coffee beverages, including teas, lattes, smoothies, and other specialty drinks. They usually have a selection of pastries and light bites to complement your beverage choice as well.

**Do these coffee shops offer Wi-Fi?**
Most Riverview coffee shops provide free Wi-fi, making them ideal places to work remotely or catch up on emails. However, it is always a good idea to confirm Wi-Fi availability beforehand, especially if you're planning to rely on it for an extended period.

[[Explore top Rated riverview coffee on Amazon.]](https://blogs.perfectshome.com/clearance-inventory/?kw=riverview coffee)

## Competitor Comparison

Comparing some of the major up and coming coffee shops for 2025.

### Product Comparison Overview

#### Riverview Roastery
- **Bean Origin:** Focus on single-origin beans sourced from South America.
- **Brewing Methods:** Offers a full range including pour-over, espresso, and cold brew.
- **Atmosphere:** Modern industrial chic with abundant natural light.

#### The Daily Grind Riverview
- **Bean Origin:** Blend of beans from Africa and Asia.
- **Brewing Methods:** Primarily espresso based drinks and batch brew.
- **Atmosphere:** Cozy, rustic feel with comfy seating and a fireplace.

#### Brew & books Riverview
- **Bean origin:** Primarily decaffeinated beans from all reaches of the globe.
- **Brewing Methods:** Offers mostly filtered methods,although espresso is on offer.
- **Atmosphere:** Quiet and reading-focused, stacks of books and tables.### Key Differences Summary

Riverview Roastery excels in the quality and variety of single-origin coffee, while The Daily Grind focuses on creating a cozy and welcoming atmosphere. Brew & Books Riverview focuses on caffeine free options for those that seek it. For users prioritizing a high-quality coffee experience and a lively atmosphere, Riverview Roastery likely provides better value.

[[Explore Top Rated riverview coffee on Amazon.]](https://blogs.perfectshome.com/clearance-inventory/?kw=riverview coffee)

## Ideal User Profile

The Riverview coffee scene caters to a diverse range of users.

**Remote Workers and Students:** With their free wi-Fi, comfortable seating, and energizing coffee, Riverview coffee shops are ideal for remote workers and students seeking a change of scenery from their home or office. They provide a productive and inspiring environment for work or study.

**Coffee Enthusiasts:** Those who appreciate high-quality coffee and artisan brewing methods will find plenty to love in Riverview's coffee shops. They can explore single-origin beans, experiment with different brewing techniques, and learn from informed baristas.

**Community Members:** Riverview coffee shops are perfect for anyone looking to connect with their community. They offer a welcoming space to meet friends, attend local events, and experience the unique character of the town.

[[Explore Top Rated riverview coffee on Amazon.]](https://blogs.perfectshome.com/clearance-inventory/?kw=riverview coffee)

## Buying Recommendations & Conclusion

When choosing a Riverview coffee spot, consider your personal preferences and priorities. Do you value high-quality coffee, a cozy atmosphere, or a vibrant community? Each coffee shop offers a unique experience, so it's worth exploring a few to find your favourite.the Riverview coffee scene is thriving, offering a diverse range of options for coffee lovers and community members alike. Whether you're seeking a caffeine boost, a place to work, or a way to connect with neighbors, you're sure to find a coffee shop that meets your needs in Riverview. While new spots will open in 2025, keep checking around for new shops and roasters.

[[Shop Budget-Friendly riverview coffee on Amazon.]](https://blogs.perfectshome.com/clearance-inventory/?kw=riverview coffee)",1,1753240871.0,ScentedMoments,0,1.0,False
1m6ykbd,https://www.reddit.com/r/PhotoshopRequest/comments/1m6ykbd/family_friend_father_passed_and_looking_to/,Family Friend Father passed and looking to memorialize his collection before its all sold.  Would like to have all black backgrounds and some of the glare/reflections removed.   $15 tip for best set of 4. $5tip for number 2 and 3.  Further opportunity.,Looking for an opportunity for paid work for editing a whole series of a collection of over 35 cars.  I would like to make a book for them.   Not all will need heavy editing but top three will get a chance to bid a job for commerating the whole collection and turn into a coffee table book with full editor credit.  I have a decent camera and bonus points for someone who edits thats a good photographer that can help me do better.,1,1753240850.0,PhotoshopRequest,4,1.0,False
1m6yjut,https://www.reddit.com/r/WannaGoPlaces/comments/1m6yjut/what_is_the_most_beautiful_street_in/,What is the most beautiful street in Carmel-by-the-Sea?,"I just got back from an incredible day trip exploring Carmel-by-the-Sea, and I have to share my experience on Ocean Avenue, which is hands down the most enchanting street in this charming coastal town. The street runs from Highway 1 right down to Carmel Beach, offering a perfect blend of shopping, dining, and pure California coastal beauty.

Walking down Ocean Avenue feels like stepping into a fairytale. The street is lined with unique Cypress trees and dotted with Tudor-style architecture that gives it this distinct European village vibe. What really caught my attention were the hidden courtyards and secret passages between buildings – there's literally something interesting around every corner.

I was lucky enough to visit as part of a guided tour from San Francisco (more on that later), and our guide shared some fascinating history about the street. Apparently, Ocean Avenue has been the heart of Carmel since the early 1900s, when artists and writers first started settling in the area. You can still feel that creative spirit today in the numerous art galleries and boutiques that line the street.

Some highlights you absolutely can't miss:
- The iconic Pine Inn at the corner of Ocean and Monte Verde
- Carmel Plaza's upscale shopping
- The charming coffee shops with outdoor seating
- Local art galleries featuring California artists
- The breathtaking ocean view at the bottom of the street

Pro tip: The best time to visit is early morning or late afternoon when the lighting is perfect for photos and the crowds are thinner. I visited as part of a full-day tour from San Francisco (you can book it here: https://athometouch.com/Monterey), which was perfect because it included stops at other must-see spots like the 17-Mile Drive and Monterey.

What makes Ocean Avenue truly special is how it captures everything that makes Carmel unique – the architecture, the artistic heritage, the natural beauty, and the small-town charm. It's not just a street; it's an experience that represents the heart and soul of Carmel-by-the-Sea.

If you're planning to visit, I highly recommend taking a guided tour. Our guide shared so many interesting details about the architecture and history that I would have missed on my own. Plus, having transportation taken care of meant I could fully focus on enjoying the experience rather than worrying about parking (which can be tricky in Carmel).

The street is particularly magical during sunset when the ocean view at the bottom of Ocean Avenue creates this incredible golden glow. Make sure to walk all the way down to Carmel Beach – the view of the sunset over the Pacific is absolutely worth it.

For anyone interested in experiencing Ocean Avenue and the rest of Carmel's charm, I used this tour service: https://athometouch.com/Monterey. It's a great way to see everything in one day without the hassle of driving or parking, and you get tons of interesting background information from the guides.",1,1753240811.0,WannaGoPlaces,0,1.0,False
1m6yjhf,https://www.reddit.com/r/UnsentLetters/comments/1m6yjhf/coffee/,Coffee,"I had hoped when you saw me today, you would be overcome with desire and need.

Then I though about it and it was not desire and need I wanted you to feel.

I would prefer you felt guilt and remorse for how you treated me.

The blood drained from my face,  I felt weak at my knees.

It was hard to breath, I thought I was over the hurt. I wanted to take my time, to just stare at you, but I had to behave, I was with company. 

Your parting look did not go noticed.

I miss you, but I'm still angry with you. You treated me badly, I know this now.
I deserve better and you can't give me that.
You should try and match my amazing. Maybe then we could be friends.


💛",1,1753240780.0,UnsentLetters,1,1.0,False
1m6yj76,https://www.reddit.com/r/24hoursupport/comments/1m6yj76/spilled_coffee_i_turned_my_laptop_off_came_back/,"Spilled coffee, I turned my laptop off, came back and it won't turn back on:","Additional information:

\-it was plugged in

\-It is now plugged off sitting on my bed and the bottom of it is still warm",1,1753240755.0,24hoursupport,0,1.0,False
1m6yhc1,https://www.reddit.com/r/tipofmytongue/comments/1m6yhc1/tomt_chant_or_song_that_my_soccer_team_did_about/,[TOMT] Chant or song that my soccer team did about coffee,"This somehow popped into my head tonight, as it has done at random for years. 

I was the new kid on the team, and it seemed that most of the others knew this song. I never asked about the origin because I wanted to fit in, so I went along with it. I can't imagine that they came up with it on their own. This was somewhere between 2006-2010. After some googling, I came up with nothing. I feel like this will be fruitless, but if someone knows this, I'll be extremely grateful.

From memory, these words are >90% accurate. 

https://voca.ro/1aFl8B1YX1Pq",2,1753240597.0,tipofmytongue,2,1.0,False
1m6yg9d,https://www.reddit.com/gallery/1m6yg9d,What do I use to Clean the Wood Countertops at my New Apartment?,"I just moved to a new apartment, and they completely remodeled the kitchen before I moved in. They put in these wooden countertops, and I have no clue how to clean them. I'm not even sure if they are fully sealed? I don't know much about wood, but if I drag my finger over it it feels like I could get a splinter. At my old apartment I used the purple fabuloso to clean them, but they were also like a cheap laminate countertop. The photo I included is after wiping my new counter with fabuloso. 

I put a wet bowl on the counter for like a minute before putting it in the dishwasher, and it left this ring of water on the counter top which can't be wiped away and is definitely soaked into the wood, I'm sure it will dry, but I'm worried about what other liquids would be soaked up (like raw chicken juice) if they touch the counter. I'm not gonna like cut raw chicken directly on my counter, but I'm sure I'll accidentally drop a piece off my cutting board at some point. I'm not much of a clean freak and don't really care about the wet circle as long as it dries, but I just don't wanna accidentally get salmonella from my counter soaking it up. 

What is my best option for keeping these counters nice, but also making sure they are fully disinfected? I have this wood spray I use on my hardwood coffee table, but that doesn't seem to be a disinfectant. 

I have an extreme reaction to any exposure to ammonia, even if wearing gloves and goggles, so absolutely nothing ammonia based please!!!",1,1753240505.0,CleaningTips,0,1.0,False
