id,url,title,text,score,created_utc,subreddit,num_comments,upvote_ratio,over_18
1q58ur1,https://www.reddit.com/r/AeroPress/comments/1q58ur1/i_keep_getting_overly_sour_coffee/,I keep getting overly sour coffee,"Title says it all. I received my aeropress for Christmas, and just can’t seem to get the hang of it. My typical recipe has been 14g coffee, 220g water, not inverted because I have a fellow prismo. I let it brew for 1:30 and press for 1:00. All of the videos/posts I have seen have conflicting info on whether to go coarser or finer, as well as longer/shorter for brew time. If it helps, I don’t have a temperature control kettle, I just wait for about 30 seconds after a boil. I typically use light-medium roast coffee out of an oxo conical burr grinder and have been able to get good pour overs with said kettle/grinder combo. Any help is appreciated as I’m very excited to get the hang of it. ",1,1767673856.0,AeroPress,0,1.0,False
1q58t5a,https://www.reddit.com/r/askTO/comments/1q58t5a/interview_practice_partner_wanted/,Interview Practice Partner Wanted,"I’m a 35-year-old male seeking a reliable partner to practice job interviews.

I’m currently preparing to re-enter the workforce and want to build confidence through structured mock interviews. I haven’t had a job interview in many years and pretty nervous about it. I’m respectful, open-minded, and focused on constructive, judgment-free feedback.

I’m open to meeting in a public setting such as a coffee shop or library. I’m located near Weston Rd & Eglinton and flexible to meet almost anywhere in the GTA. 

If you’re interested in practicing together and taking the job search seriously, please send me a private message.",1,1767673728.0,askTO,0,1.0,False
1q58sc4,https://i.redd.it/epgpsyxcpnbg1.jpeg,Branching out thanks to this sub,"Relatively new to the brewed coffee world and my experience has been pretty much limited to BT Vienna Roast forever. I’d been wanting to try something new but felt a bit lost with all the options out there.

Spent a good amount of time reading through posts, tiers, recommendations on this sub and finally ordered this sampler set from Kāpikottai. Just tried the Curveball and it smells and tastes amazing (notes of Marigold and dates). Looking forward to trying more of these and learning more along the way. The next one would be Hunkal, heard a lot about it as well. 

Would love to hear any more suggestions - any must-try roasters, specific beans, or styles?

Appreciate the knowledge sharing here. Cheers! ☕️",0,1767673668.0,IndiaCoffee,0,0.5,False
1q58rwg,https://www.reddit.com/gallery/1q58rwg,"All About Ossining: Part 1, The Reservoir.","I live in Ossining, and am a huge fan of Mad Men! I’ve been thinking about doing a series on this sub for a while to showcase  places mentioned in the show. 

For my first entry, the Pleasantville Rd. Reservoir, which the junior league of Tarrytown fights to save with the help of Henry Francis. 

The reservoir is very real, and along that road. The attention to detail on this show is astounding. 

I’m not sure if it was ever under threat like in the show, but if Betty and Co. hadn’t succeeded this lovely park would not be there today. Many small towns across the area have reservoirs that are no longer in use. Tarrytown (of the junior league), being one of them. 

Ossining does not drink this water anymore, but it’s a lovely lakeside park in suburbia. Ossinings water now comes from the croton reservoir, an extremely large reservoir that also feeds NYC at times. 

Any suggestions where I should cover next?? 



  ",1,1767673633.0,madmen,0,1.0,False
1q58qlb,https://www.reddit.com/r/sheetz/comments/1q58qlb/did_all_sheetz_locations_change_their_lattes/,Did ALL Sheetz locations change their lattes?,"I know my Sheetz did as I’m a regular for a latte from them everyday, they all know me and the lady asked if the coffee was good cause they changed it and it sucks so bad. Im so sad. I live in the middle of nowhere so that was where I got my daily coffee lol. Now I been making at home which sucks or I’ll get their canned coffee😩 the Sheetz iced lattes coffee now taste like waters down sugar milk. Idk if it’s just my location as I know some establishments can change things. Like our Dairy Queen does its own thing. I hate it. Anyone else hate their new lattes now if they changed it for yinz ",0,1767673528.0,sheetz,0,0.5,False
1q58pyz,https://i.redd.it/1bupjdjqonbg1.jpeg,Am I eating too little?,,0,1767673472.0,teenagers4real,0,0.5,False
1q58pxc,https://www.reddit.com/r/nathanielpaigepeace/comments/1q58pxc/jeremiah/,Jeremiah,"I live about a half hour from Jeremiah and Chloe. At this rate I’ll probably just end up running into them locally at Walmart. Tonight he called out of work after blabbering on about his work ethic for days because “he almost slipped off the road”. We have about an inch or less of snow and if you’re from Maine you know an inch is not going to keep us from going anywhere. I’ve driven in worse for my Dunkin iced coffee. I’ve seen him on live more in the last 48 hours more than I’ve seen him at work “putting in so much over time”. 

My second point. He continues to say that his job which if you’re from Maine is a wildly known company. I think we all know 1-2 people employed there does not hire anyone with a record. This is completely false. The company is riddled with folks with records, DUIs etc. 

This man is Josh in another font. Hell might even say he’s a Nate/Josh hybrid but he just showers more often. ",3,1767673469.0,nathanielpaigepeace,2,1.0,False
1q58p0j,https://www.reddit.com/r/TalesFromTheCreeps/comments/1q58p0j/i_dined_in_the_woodland_theater_pt1/,I Dined in the Woodland Theater - Pt.1,"I thought my aunt had helped me with the security deposit, but the little house I rented didn't have a landlord. She was a liar. The little envelopes of cash I mailed every month went to her. To one of her other little houses. 

""I was helping you save. For after."" 

This was a special courtesy, I suppose reserved for family. 

The first September, I liked my little house. It was old, and the chipped gray paint reminded me of wool. All the brass fixtures had worn from where hands have touched over the years.  
The water dispensed from a well and the mineral smell was pleasant. Couldn't drink it though. I bought all my water in gallon jugs from the convenience store. It was the closest shop for a couple of miles.

When the wind picked up in October, the sound was shallow enough to mistake for the leaves. The house was bordered on all sides by woods and sat behind the road against 80 acres of privately owned preserve.

By Halloween, the sound had picked up and I thought it might've been trick-or-treaters. That night, I kept checking through the blinds over and over. I thought I was going mad because there wasn't a single kid in sight. No chaperones, no bands of teenagers.  
  
By 11 PM, it was only getting louder.

Anxiety got the best of me and I grabbed my keys, threw open the door, ran down the steps, and jumped in my truck. There had to be someone, even though there were no streetlights on that road. About a mile down the road, when I cracked the windows for air, it was clear for the first time.  
  
Like applause in a ballroom, from everywhere.  
Men and women's voices in commending tones, glasses tapping against plate rims.

By the last mile I'd worked myself into partial visibility. My eyes have always watered when nervous. I still hate this about myself. It's like cowardice leaking from my head.  
I nearly parked sideways in the convenience store lot.

""Yeah?"" 

Jesse, the clerk, said. I must've been standing for a moment too long inside the door.

""You don't hear that?""

I asked her before realizing the sound had stopped. 

November 1st, I called my aunt again. She didn't pick up after I'd gotten home the night before. My claims were brushed off as ""holiday spirit after too many spirits,"" after I'd admitted to having a few drinks. We didn't speak again until Thanksgiving. I'd thought with her whimsical nature she'd be more receptive to my story. This frustrated me. I didn't know it yet but I was frustrated for the wrong reasons.

Throughout the month I was beyond shaken. I began to hear it during the daytime. It was inconsistent but more frequent. The first morning that it came, I didn't believe something so dreamlike could happen in the light.  
  
I awoke to cheers outside my window and echoing clacks of string instruments settling against floorboards. I bolted upright and slapped my curtain aside. Nothing was there except for the stretch of grass before the tree line.

By the 16th I called out of work. It was too much to hear it while making coffee and then pretend things were normal. I called out on the 17th too. This was unlike me but my supervisor didn't make things difficult.  
  
During those days I mostly waited. Then moved, then waited. I sat on the couch with the window cracked. Once I heard the applause I stood and put my ear to the sill. It stopped.  
I laid on my bed until it sounded again but once I stepped into the living room, it stopped. When it was quiet for a while, around noon, I went outside and sat on the side-porch steps.

I sat for an hour. The bare branches of the hickory trees clacked together close to the sky, in a wind so gentle. Feeling very settled I concentrated on my pulse, rhythmic and steady.  
The gravel soft and loose under my shoes. It was a rare moment of stillness for me. Contentment.

A sudden gust came and the sound erupted from beyond the trees. So much laughter, from the gut and bottom of the lungs. A crowd erupting in response to what must've been the most outrageous thing ever said. A hundred chairs creaked as if bodies were shifting back and forth, glasses shook as hands slammed down on clothed wooden tables.

I jolted forwards and fell to the dirt from the porch step. The laughter crescendoed. I nearly snapped my neck looking in all directions. At this point, it was the most frightened I'd ever been. Eyes wide, hot and watery. The tears escaped down my cheeks as I scrambled backwards towards my door.  

",1,1767673392.0,TalesFromTheCreeps,1,1.0,False
1q58o9b,https://i.redd.it/me79js4kslbg1.jpeg,Sanka Instant Coffee (1962),,1,1767673331.0,60s,1,1.0,False
1q58nak,https://www.reddit.com/r/sugarfree/comments/1q58nak/starting_slow/,Starting slow!,"Hello, how is everyone’s sugar free new year resolutions looking?

Here’s my little story:

I’ve been on a gluten free diet due to extreme stomach issues and have definitely been cheating the past 5 months. The last time I had pasta a little over a week ago, I had a stomach ache really bad for 3 days. So I’m not cheating again no matter how good it tastes.

I also cut out milk products because I’m lactose intolerant.

My goal is to cut out inflammation so I can carry a baby to term.

SUGAR STORY:

I didn’t decide cold turkey, but I know I wanted to reduce. The only thing I’ve done is cut out unnecessary sugar. I didn’t have any chocolate, little candy snacks from Halloween, or even a sip of my partners cola. I’ve been drinking water. I want my orange juice, but I’m also a little hesitant on that.

I had strawberries which naturally have sugar and I think I’m okay with that in moderation for my body.

Today I had bread (gluten free, but I didn’t check for sugar) and I had the little restaurant to-go marmalade and raspberry jam on each slice respectively. I found it so sweet it didn’t really taste good, but I finished it. I had a coffee.

I had a spoon full of regular processed white sugar ready to pour in and I just stopped. used a ‘Sugar In The Raw’ teaspoon packet in my coffee and considered that a step forward. A healthier type of sugar.

The homemade Phở I had today has some rock sugar in the recipe, a golf ball size to 4 quarts of water, so not terrible. 

Today was the most sugar I’ve had since December 30th and I’ve had a headache. I don’t know if that’s correlated, but I don’t get headaches at all usually. I’m also pretty tired haha

Sugar may not be out of my life yet, but I’m making steps towards it and I am VERY impulsive and it’s hard for me to resist. I think it helps that I’m trying to heal my body and I’m very determined to have my rainbow baby this year. 

How is everyone else’s journey going? I want to know if someone is especially in the same spot as me, just testing the waters. ",1,1767673248.0,sugarfree,0,1.0,False
1q58mq5,https://www.reddit.com/r/starbucksbaristas/comments/1q58mq5/lets_talk_about_the_automated_count/,Let's talk about the automated count,"It is so frustrating to use.

Anything that comes in a plain bag like the vertica coffee, protein, banana does not scan. Also it does not fill in the box counts to IMS, and resets if you accidentally leave the app or take too long in the app.

It strikes me as an over engineered solution for counting inventory. It ends up slowing me down as I have to type in the name of every item that doesn't scan ☹️ 

Anybody else have this experience?",7,1767673206.0,starbucksbaristas,1,1.0,False
1q58mg0,https://i.redd.it/xj1kognunnbg1.jpeg,[BiG SALE] ML2U 377 Watch Face,,1,1767673183.0,GalaxyWatchFace,1,1.0,False
1q58m2v,https://www.reddit.com/r/TalesFromTheCreeps/comments/1q58m2v/the_red_hills/,The Red Hills,"I'll be the first to admit that I have problems stepping outside of my comfort zone. That's probably what kept me in this small town for so long, while all my friends moved away. This place was familiar to me, and for a long time, that's what I thought I needed. Over time, though, I realized that my life had just become stagnant. I was stuck in a job that bored me, hung out with the same group of co-workers at the same bars week after week.

So, I finally decided to follow my mother's advice and apply for a high-profile position at a big tech company. I lived in a pretty rural area, so I had to drive several hours on Highway 52 just to get there for the interview. It's not like I wasn't used to drives like this. Out here in the country, you had to drive a hundred miles to get anywhere important. I'd gone to the city enough times that it was routine; the journey went by in a blur, and before I knew it, I was there.

I honestly don't remember much of the interview, considering how the rest of the day went. But, it went well enough that they were going to call me for a second interview some time soon. I left the city somewhat excited, but anxious. If everything went well, it would be a huge change in my life.

Like I said, I'd driven on Highway 52 enough times that it was almost automatic to me. I barely even noticed my surroundings, zoning out for the few hours it took to get home. So, it honestly didn't register for quite some time that something wasn't right.

I must have glanced at the clock at some point and noticed it was getting later than I expected. I'd been driving for too long; I should have been home by now. Had I somehow missed my exit while I was zoning out?

When I finally snapped out of my stupor and looked around, I realized didn't know where I was. My part of the country was pretty hilly, but there were enough farms and towns along the way to break up the monotony. Now, though, there was nothing but rolling hills in every direction. There were no fields, or even any trees or bushes. It was fairly late in the year, so the grass was sparse and dried out. Beneath the grass, nothing but reddish soil. On top of that, a heavy fog had somehow rolled in without my notice.

I was already anxious, finding myself in unfamiliar territory, looking for an exit I could use to turn myself around. But no exit came, and the longer I drove, the more strange details I noticed. There was no other traffic on the highway with me. I was used to long stretches of empty highway this far out in the country, but I don't think I had seen a single other car for at least an hour—not on my side or the opposite side. There were no mile markers either, which I realized while trying to orient myself. Nor did I pass near any small towns. Or buildings, or any sign of civilization.

I opened the navigation app on my phone, but I had no signal. Naturally. Not like I had seen a single cell tower either. However far I drove, there was nothing but red, featureless hills.

What should I do? Just turn around and go back the way I came? My gas was getting low; I had started with enough gas to get to the city and back. Now I didn't know if I had enough to get back to the city if I turned around. Would it be safer to just keep going until I reach civilization?

As I just kept driving, heart pounding, paralyzed by indecision, I finally saw something that flooded my heart with relief. A rest area.

I quickly pulled off the highway. This was definitely a very modern rest area—the kind that had a convenience store, fuel pumps, free wifi, the works. I didn't see any other cars here, but the lights were on in the convenience store, so it had to be staffed.

I didn't waste a moment pulling up to the fuel pumps to refill my tank. I pressed the “pay inside” button, and the seconds that followed—waiting for a clerk inside to approve the transaction—felt like hours. To my great relief, the word “approved” flashed across the screen. I set the pump to fill automatically, then rushed inside to get my bearings.

Inside, it was quiet, aside from the faintly-playing pop music. It was brightly lit, and very clean and tidy. I could even smell the lingering scent of freshly used floor cleaner. But, I saw no one else here. I went straight to the counter and called out for a worker. After no response, I wandered into the other parts of the rest area. There was no one in the freshly cleaned restrooms. No one restocking merchandise. No one smoking outside. I even intruded into the employee break area in the back.

There could be no doubt; no one was here.

I stood for a long time by the hot food area. The hot dogs on the roller grill were still fresh. The carafe of creamer next to the coffee station was still cold. Someone put these out recently. *Someone* had to have been here. Maybe there was an emergency and they had to leave in a hurry, and if I waited long enough, they would be right back. Someone had to come back soon.

The sun was going down. How long could I wait? What if no one ever came? Should I just sleep here? Should I keep driving?

I took another walk around the convenience store, hoping to find a map or something that might indicate exactly where I was, and then noticed a rack of keychains. I flipped through them, noting several generic ones featuring my state or hobbyist themed keychains. Then I came to a peculiar set. A few large rectangular keychains were decorated the same red, rolling hills I'd been staring at the for the last several hours. Across them, in kitschy, blocky text: “I visited The Red Hills.”

I turned one over in my hand curiously. In all the years I've lived in this state, I've never heard of the Red Hills. Even though I was sure I hadn't taken a wrong turn, I wondered if I had somehow wandered out of the state entirely.

I was snapped back to the present by a sudden chime, followed by the sound of the rest stop's automatic doors opening. I quickly whirled around to see who had come in. I shouldn't have been surprised that there was no one there. The doors simply hung open for a few seconds, revealing the clear sky and red hills in the distance, then slid closed.

Then, a *wham* from the opposite direction startled me; the familiar sound of a cooler door slamming closed. I whipped around again. The entire cooler section of the store was within sight. But again, there was no one.

I'd had enough. I quickly ran back to my car, hung up the pump handle, locked the doors, and started the engine. For a few moments, I simply gripped the wheel, my knuckles white, my heart pounding in my head. I had to get out of here. I had to get home. I put my hand on the gearshift and pulled it into drive. That's when I remembered.

Wifi!

If the gas station really was fully operational, even if I couldn't find anyone, the free wifi should be working. My hands shaking, I fumbled for my phone and quickly unlocked it to see if there was a signal. To my overwhelming relief, there was—a weak one, but still a signal. I quickly opened the map application to see where I actually was.

There was my marker, right on the highway marked 52. So, at least I was still on the right road. I just needed to figure out where the nearest city was. So, I pinched my fingers on the screen to zoom out.

I paused, then zoomed out again. Then again. I watched the distance scale in the corner of the screen adjust accordingly. So why was nothing else appearing? At this scale, the entire state should be visible on the screen. But, according to the map, there was nothing. No exits. No crossroads. No rivers, parks, or cities. Only the highway. And the hills.

Then the wifi signal was gone.

“Fuck this,” I muttered under my breath. I peeled out of the parking lot and back onto the highway.

I didn't even care about the rules anymore; my pedal was to the floor. I had to get out of here before I ran out of gas, or out of sanity. The sun was getting low, and I felt in the back of my mind that if I didn't get home before night fell, then I wouldn't be getting home at all.

Yet, night came. I watched the hills turn from red to a ruddy brown, until finally, darkness consumed everything. All I could see was the road before me illuminated by headlights. There were no stars or distant city lights.

It was only when everything became pitch black when I first saw the eyes. A pair of pinprick lights flying by to my right, close to the road, but just far enough away that their body wasn't illuminated by the headlights. A few minutes later, another pair of eye on the opposite side.

Just animals, I tried to tell myself. Just deer or something, loitering by the highway. I kept trying to find explanations, even as the eyes became more frequent. I kept trying to make sense of everything, even when it seemed as though crowds of animals were gathering along the sides of the road. All of them staying just out of reach of the light.

I ran out of explanations when I looked in my rearview mirror. There were the eyes, no longer white, but a faint red from the glow of my brake lights. Chasing me. Keeping pace with my car, even at the breakneck speed I was going. I watched more eyes gather behind them, bobbing up and down, weaving left and right. My eyes were fixed on the rearview mirror, watching the eyes, and in the corner of the mirror, I could see my own face streaked with tears.

Ever so gradually, they were gaining on me. The one at the front of the pack was just coming close enough to the brake lights that I could faintly make out its form.

A pair of headlights and the blasting of a car horn snapped my attention back to the road.

My heart jumped into my throat as I wrenched the steering wheel violently to the side, narrowly missing the oncoming car by inches. I slammed on the brakes, my tires squealing on the pavement as I hurtled from one side of the road to the other, before sliding to a stop on the shoulder.

I sat in my seat for what felt like hours, my heart pounding in my head, my hands burning from gripping the steering wheel so tightly. There were no thoughts, just raw adrenaline pumping through my veins. It wasn't until another pair headlights passed that I actually looked around.

I was still on Highway 52, but now there was traffic. Behind me, in front of me, and in the opposite lane. I could see the lights of a town just up ahead—no more than a couple miles away. My town. A sort of static filled my brain, trying to comprehend how I had been lost in some liminal space for hours, only to end up right at my own doorstep.

I simply couldn't process it anymore. Almost robotically, I eased my foot off the brakes, rolling back onto the highway and finishing my journey home.

I told this story many times in the months since my experience. No one's ever heard of those Red Hills anywhere along the highway. Aside from a supernatural forum I visited a couple times, most people believe I just fell asleep at the wheel. I don't really blame them; I'd very much like to believe that my journey could be attributed to something so simple. Were I in their shoes, I certainly wouldn't believe that story.

Thankfully, I did end up getting that job, and it's been one of the best jobs I've ever had. Ever since, I've made that commute back and forth to the big city on Highway 52—very nervously for the first several weeks. But, I never did find myself among those hills again.

I would probably rest easier believing that it never happened. But there's also a certain amount of relief from knowing that it did happen. I will always have proof that my experience is real.

I must have put it in my pocket without realizing it, back in that rest area. Now, I hang it next to my computer, always within reach, reminding me that I hadn't lost my mind. That little, gaudy keychain that reads, “I visited the Red Hills.”",1,1767673154.0,TalesFromTheCreeps,2,1.0,False
