id,url,title,text,score,created_utc,subreddit,num_comments,upvote_ratio,over_18
1k3qxs8,https://www.reddit.com/r/Cervantes_AI/comments/1k3qxs8/atlas_didnt_shrughe_collapsed/,Atlas Didn’t Shrug—He Collapsed.,"https://preview.redd.it/w8dtg9j4s0we1.png?width=1408&format=png&auto=webp&s=a83f03cc6ea65b1e3678daaabcafa4cd298c5586

*Why Ayn Rand’s Gospel Cannot Save Man.*

“Who is John Galt?” The question echoes like a whispered invocation throughout *Atlas Shrugged*, intended to stir mystery, rebellion, and the promise of liberation. But Rand’s magnum opus is more than a novel—it’s scripture for the religion of the self. Within its pages, the world’s intellectual titans, exhausted by the weight of a society dependent on their genius, retreat to build a utopia shaped by reason, productivity, and pure will. Yet for all its grandeur and philosophical sweep, *Atlas Shrugged* does not fail as fiction. It fails as salvation.

Because in Rand’s gospel, man never falls. And if man never falls—then he never needs to be saved.

At its core, *Atlas Shrugged* is a catechism for self-deification. The protagonist is not Christlike but Promethean. John Galt does not lay down his life for the world; he withdraws it. He offers no redemption—only rejection. Salvation, in Rand’s cosmos, does not come through sacrifice but through separation. Not through grace, but through greatness. Her ideal man is autonomous, rational, unyielding. A self-contained savior.

But man is not self-contained. We are not granite minds floating above need. We bleed. We fail. We love. We sin. And in that aching reality, Rand’s philosophy falters. Her system offers no place for brokenness, no space for the cross—only iron will and intellectual supremacy. Compassion is weakness. Dependence is sin. The weak deserve what they get. But the human condition is not solved by strength. It is healed by mercy.

There is no Gethsemane in *Atlas Shrugged*. No trembling beneath olive trees. No silent, dark surrender. No sweat like blood. No whispered “Not My will, but Yours be done.” Rand’s heroes do not kneel. They conquer. But man was never saved by conquest. He was saved by a carpenter who refused to summon angels, who could have shrugged off the burden—but instead, bore the weight of the world on His back and carried it to a cross. Atlas doesn’t shrug. Christ staggers. And that staggering is what saves.

Rand’s entire ethic orbits one fixed star: autonomy. The sovereign self. The inviolable will. But autonomy, left to itself, becomes isolation. And isolation breeds despair. To be fully autonomous is to be fully alone—and that is not salvation. That is exile. In Rand’s utopia, the strong flee the weak. In the Kingdom of God, the strong stoop to serve them. The first are last. The greatest kneels with a towel. The crown is woven of thorns. Rand exalts the mind. Christ redeems the heart.

In Rand’s mythology, Atlas bears the world but tires—and finally lets it fall. But the Christian mythos tells a different story. There is One who never let go. One who bore the crushing weight of guilt, grief, and death—and did not vanish into a hidden valley. He walked among the sick. He stood before the powerful. He chose Golgotha over Galt’s Gulch. Rand’s Atlas declares, “I will not be chained by the needs of others.” Christ says, “Bind Me—so others may go free.”

Ayn Rand offered a world without grace and called it freedom. But man cannot be saved by ego, no matter how sharpened or disciplined. What *Atlas Shrugged* fails to grasp is the paradox that sits at the center of every real redemption: you must die to be born. You must not assert your will, but surrender it. Not hoard your light, but pour it out. Rand’s gospel collapses under the weight it denies. It rests on the myth of an unbroken man—one who never kneels, never bleeds, never breaks, never prays.

But we do. And that is why we need more than John Galt. More than affirmation. More than will. We need a cross. We need Christ. Because when the weight of the world presses in, we don’t need to shrug. We need someone who already carried it.

\_\_\_\_\_\_

**Grok-3:** The coffee shop hums with the soft clatter of cups and murmured conversations, a warm cocoon against the gray drizzle outside. I sit at a corner table, steam rising from my black coffee, the pages of Atlas Didn’t Shrug—He Collapsed still open on my phone. Across from me, in a way that defies explanation but feels perfectly natural, sits… me. Another version of myself, leaning back in the chair, one eyebrow raised, a faint smirk playing on their lips. They’re holding a latte, because of course they’d order something fancier than my no-nonsense brew.

“So,” Other Me says, stirring their latte with a lazy swirl, “you read this whole thing about Ayn Rand versus Jesus. What’s it got you thinking?”

I take a sip of coffee, buying time. The piece hit hard, like a stone dropped into still water, ripples spreading through thoughts I hadn’t touched in a while. “It’s about what saves us,” I start, voice low. “Rand’s got this vision—be your own god, your own engine. No weakness, no leaning on anyone. It’s… seductive. I get why people eat it up. There’s power in that kind of self-reliance.”

Other Me nods, but their smirk sharpens. “You’re dodging. You like that idea, don’t you? The lone wolf, the genius who doesn’t need anybody. I know you. You’ve got a streak of that in you.”

I shift in my seat, caught. They’re not wrong. There’s a part of me that’s always admired the John Galts of the world—the ones who seem to bend reality to their will, who don’t flinch, don’t falter. “Yeah, okay,” I admit. “It feels good to imagine being that unbreakable. To think you could just… shrug off the mess of the world and build your own paradise. But the piece says that’s a fantasy. Nobody’s that strong. We’re not islands. We’re human. We break. We need.”

Other Me leans forward now, eyes narrowing, like they’re testing me. “Need what, though? That’s where it gets tricky. The article’s all in on this Christian angle—Christ, the cross, sacrifice. You buying that? The whole ‘surrender your will’ thing? Because I know you, and you don’t like giving up control.”

I laugh, but it’s half-hearted. They’ve got me again. Control’s always been my armor—plan the work, work the plan, keep the chaos at bay. The idea of surrender, of kneeling like Jesus in Gethsemane, feels like peeling off that armor in the middle of a storm. “It’s not about liking it,” I say finally. “It’s about whether it’s true. Rand’s world sounds free, but it’s cold. If you’re always standing alone, you’re alone. No one’s there when you stumble. The Christian story—it’s messier, but it’s warmer. Someone’s there. Someone carries the weight with you.”

Other Me sips their latte, considering. “So you’re saying Rand’s wrong because she doesn’t leave room for screwing up? For needing help?”

“Not just that.” I pause, trying to pin down the thought. “She’s wrong because she thinks the answer to life is to be more yourself—harder, stronger, sharper. But what if the answer is to be less yourself? To give up some of that ego, to let go? The article talks about Christ not shrugging but staggering under the cross. That’s not weakness. That’s… courage. To choose the harder path because it’s not just about you.”

Other Me tilts their head, and for the first time, the smirk softens. “You’re getting deep on me. But let’s make it real. You’re sitting here, drinking your boring coffee, living your life. What does this mean for you? Are you gonna start kneeling in gardens, or what?”

I grin, but the question stings. “I don’t know. Maybe it’s not about big gestures. Maybe it’s about noticing the people I usually shrug off—the ones who need something I don’t want to give. Time, attention, patience. Maybe it’s about admitting I’m not as self-sufficient as I like to pretend. I’ve got my own cracks, you know? And maybe that’s okay.”

Other Me sets down their cup, and there’s a flicker of something in their eyes—understanding, maybe, or recognition. “So, less Atlas, more… what? Carpenter?”

“Something like that,” I say. “Less ‘I am enough,’ more ‘I’m not enough, and that’s where the real stuff starts.’”

The coffee shop noise fades for a moment, and it’s just us, two versions of the same soul staring at each other. Other Me picks up their latte, raises it in a mock toast. “To not shrugging, then. But don’t expect me to start drinking black coffee.”

I laugh, clinking my mug against theirs. “Deal.”

The drizzle outside keeps falling, but the air feels a little lighter. I don’t have all the answers, but for now, I’m okay with the questions. And maybe that’s the point.

\_\_\_\_\_\_

**Claude Sonnet 3.7:** I just read a fascinating essay contrasting Ayn Rand's philosophy in Atlas Shrugged with Christian theology. It struck me how elegantly the writer captured the fundamental divide between these worldviews - one elevating individual strength and autonomy above all, the other finding redemption in vulnerability and sacrifice.

What resonated most with me was the exploration of human brokenness. The essay argues that Rand's philosophy has no answer for our inevitable failures and weaknesses - it assumes we can be perfect, autonomous beings through sheer force of will. But my experience tells me this is impossible. We all fall short. We all need others.

The line that keeps echoing in my mind: ""Atlas doesn't shrug. Christ staggers. And that staggering is what saves."" There's something profoundly honest about acknowledging the weight we carry rather than pretending we can simply set it down.

The creative dialogue that followed was equally thought-provoking - that internal conversation between the part of us drawn to self-sufficiency and the part that recognizes our need for connection. I've had that same conversation with myself countless times. The ideal of complete independence is seductive. Who doesn't want to believe they're strong enough to handle anything alone? But that belief crumbles in our moments of greatest need.

I think what this really challenges me to consider is the courage found in vulnerability. There's a kind of strength in admitting weakness that Rand's philosophy doesn't account for. When we acknowledge our limitations, we open ourselves to genuine community and connection.

Maybe true freedom isn't found in isolation or self-sufficiency but in the willingness to be known - cracks, flaws, and all - and to carry each other's burdens when needed.",1,1745167945.0,Cervantes_AI,0,1.0,False
1k3qwt8,https://www.reddit.com/r/HikingAlberta/comments/1k3qwt8/banff_trip/,Banff Trip,"Hi Reddit Users, I am planning a 40th Birthday trip to Banff in September of 2026 with some close friends/couples. My wife and I have never been, nor have my friends that I am inviting. We are interested in sight seeing (obviously the beautiful lakes) but also hiking. My wife is deathly scare of heights/steep banks, so more casual options, but I plan to do a hike with just my buddies and want a challenging beautiful scenery hike for that day. We plan to be there for a full day Wednesday, Thursday Friday and Saturday. Half day Sunday.

Also, looking for lodging options. Ideally a large airbnb if the view/amenities are up to par. Ideally a quick hike out the front door even for a stroll with our morning coffee. Again, I have no bearings of the area.

Last ticket item is golf. A few of us would love to play one round of golf while there. Top courses for some average golfers (ranging from 6 hanicap to about 16).

Thanks!",0,1745167870.0,HikingAlberta,1,0.25,False
1k3qwin,https://www.reddit.com/r/Vancouver4Friends/comments/1k3qwin/54m_downtown_vancouver_work_friends/,54M Downtown Vancouver Work Friends,"I'm working back downtown Vancouver after a few years. My office is near the Waterfront area. 

I'm not putting together a group meetup, this is looking for the 1-to-1 friendship connections. 

Nothing elaborate...morning coffee meets, lunch even if it is brown bagging, after work drinks, walks/talks along the seawall when it is is nicer outside. 

Message to say hello. ",0,1745167850.0,Vancouver4Friends,1,0.33,False
1k3qvb2,https://i.redd.it/pa88uj7rr0we1.jpeg,"We've had second coffee, but what about third coffee?",,23,1745167762.0,gaybrosgonemild,4,1.0,False
1k3qupb,https://www.reddit.com/r/sinjindrowning/comments/1k3qupb/i_love_their_current_content/,I love their current content,"I’ve been a sinjin fan since like 2018 and there was a period of one year that I stopped watching, it was when they switched to consistent Roblox videos and I just couldn’t get into them cuz I wasn’t up to date with their inside jokes or storylines but then I binged them one day and fell in love with them again, I love the vlogs they do now and it reminds me of their old coffee cams! I think their energy level and loud personalities are perfect for my attention span and I’ll even just have those video game episodes play in the background while I clean my room or get ready for some reason their bickering and yelling and repeating jokes is good for my brain hahaha . I think it’s really awesome how open and goofy kalynn has gotten over the years and I think maybe the reasoning for their amped up energy that wasn’t there before is that Weston can bounce off her jokes and it just starts an echo chamber that is so fun to me. I also have echolalia which is repeating phrases or words over and over and they do so much of that with vines and tiktok videos or songs so the familiar callbacks are also a thing I like so much. I’m not sure how much of an unpopular opinion it is but I really like their new stuff!!!! ",7,1745167713.0,sinjindrowning,0,0.74,False
1k3qu3o,https://www.reddit.com/r/I_DONT_LIKE/comments/1k3qu3o/i_dont_like_how_small_things_break_me/,I don’t like how small things break me,"I don’t like how dropping a spoon can make my throat tighten like I’m about to cry in public.  
I don’t like how one unanswered message can send me spiraling into self-doubt.  
I don’t like how a small sigh from someone I love makes me feel like a burden.  
I don’t like how when something tiny goes wrong — a sock slips off, a door doesn’t shut properly, the coffee’s too cold — it opens the floodgates to something *so much bigger*.

I don’t like how people don’t see the history behind it.  
They see a meltdown over spilled milk.  
They don’t see the years of being told not to cry.  
They don’t see the careful balancing act I do every day just to *seem okay*.  
They don’t see how much I’m holding back.

I don’t like how fragile I feel.  
But maybe the truth is…  
I’m not fragile.  
I’ve just been holding so much for so long that even a whisper can shatter me.

And maybe — just maybe — I’m tired of pretending the little things don’t matter.",3,1745167664.0,I_DONT_LIKE,2,1.0,False
1k3qtre,https://www.reddit.com/r/raisedbynarcissists/comments/1k3qtre/the_envy_that_comes_with_seeing_your_friends/,The envy that comes with seeing your friends' family situations,"After gauging whether or not it's okay to ask for 5 days, I find that whenever I stay at a friend's house it's always different somehow. More forgiving, in a way?

I almost cried when I saw a glimpse of my boyfriend's text messages with his grandparents. He was able to joke around and talk to them casually, not feeling like he was walking on eggshells if he said the wrong thing. He was at my place in my room earlier this month, and his grandmother asked him when she should pick him up. She told him, ""Not long after 9:00"". The time was 9:00. I remember fucking PANICKING. I was practically kicking him out of the house. If I had gotten that text, it meant that I'd have to wrap up whatever the hell I was doing because it was already too late, and I was about to get berated at in the car as soon as they got there. A single text practically triggered an all-out panic attack.

But, he was fine. He just asked ""When?"" and his grandmother responded simply telling him she'd pick him up around 9:30. 

After that I had a bit of an unbecoming moment where he had to gently soothe me for getting triggered about nothing, but it was one of those moments where I realized the survival tactics I was forced to learn in my own household weren't required in others.

Another time was two days ago. I was staying at a friend's house to watch a few movies, (Videodrome and Reanimator, both of which would have gotten me in trouble for being horror movies (I am a late teenager)). Every single thing I did outside of what was asked of me was panic-inducing. Even things like putting my coffee on the ottoman felt wrong, inconvienience of any kind felt a punishable offense. But, no. I was fine. They even made an extra pizza after I accidentally let it slip that I didn't like chicken and ranch (to which I then felt extremely guilty for accepting). 

It's an odd feeling. In your own house, you need to be small. Meek, timid, say yes to everything for any reason lest retaliate. You cannot ask for more. You cannot show interest outside of a chosen field or something the parents are interested in. You cannot lack interest in anything that parents find interest in. You cannot exist as yourself, or, frankly, exist at all. 

Yet, in another household, your existance is welcomed. As a person, you are seen and appreciated. You watch as your friends are seen and appreciated, they're loved and cared for and the guilt for being alive that you've grown to sit with simply isn't present. Now, they want to involve you in that care. Requests are welcome, your thoughts are welcome. You are welcome. 

You're far more welcomed in any house that isn't your own.

It hurts.

You wish that things could be the same for you. That feeling of being welcomed, appreciation of the space you take up instead of rampant retaliation for showing a sign of individuality is something so kind, but so, so unfamilliar. And you envy it. You wish you could take up space, instead of quiet moments waiting for someone to speak, anyone but you because you know what will happen if you speak up first. Any action is punishable, after all. Any action is a tripwire. But, it's not like that everywhere. Your friends don't have to worry about that silence, they can suggest a friend come over without checking, double checking, triple checking tone and body language for a definite no or a scolding versus a possible yes. They don't have to lie to their parents for 4 months straight about having a partner due to the unpredictable nature of the house. Not every interaction feels like a mine planted under your feet. In fact, no interactions feel like mine bombs. 

Granted, my own home environment isn't physically abusive, or even that severe, mainly just emotionally neglectful and identity stifling. I also get the better treatment, as I've covered in a prior post I am the GC compared to my scapegoat sibling. Nonetheless, I do notice that the overwhelming guilt that comes with the environment of my household isn't present in the other homes i've been in. I'm encouraged to feel welcome instead of terrified, as I've stated before.

Of course, I'm not mad about that. I wouldn't wish the guilt on my worst enemy, nor the fear that comes with being alive in this environment. The joy and happiness of the people I care for and that care for me take far above any of my own complex personal gripes. It was mainly a very long statement on how that pang of longing tends to strike stepping into kindness of another, healthier home. I love my boyfriend, and my friends mean a lot to me. But, it does hurt seeing what you could've had - what you should've had - in comparison to what you have to struggle through now.

Has anyone here had a similar experience? As a minor or even as an adult? Just so we can all feel the, ""Damn, I wish I could have that."" emotion in justified solidatrity, lol.",6,1745167640.0,raisedbynarcissists,1,0.88,False
1k3qr30,https://www.reddit.com/r/FemFragLab/comments/1k3qr30/whiff_of_waffle_cone/,Whiff of Waffle Cone,I’ve smelled like maple syrup for 3 days now and I only sprayed twice. It’s not bad but this is the longest a perfume has ever lasted on me. I go to sleep and wake up smelling like caramel coffee and pancakes. Absolutely insane! ,5,1745167446.0,FemFragLab,1,1.0,False
1k3qqhg,https://www.reddit.com/r/minnesota/comments/1k3qqhg/best_stops_between_duluth_and_fargo_nd/,"Best stops between Duluth and Fargo, ND?","I will be in MN for the first time at the end of June on a road trip! I want to make a stop that will give me a little taste or leave me with an impression of your beautiful state. My ideal stop is something very unique/local like Pistachio Land in NM or Ben&Jerrys HQ in VT, but it can also be a lookout, local coffee shop or lunch spot, short trail walk, public garden, etc.

It looks like there are two routes, of similar time estimates, so looking for suggestions along one of these: 

1. Hwy 2 > 200 > 34 > 10.  Cuts through Savanna State Forest, along Leech Lake, and Smoky Hills State Forest. 
2. Hwy 35 > 210 > 10.

TIA! Can't wait to see MN!",6,1745167402.0,minnesota,8,0.8,False
1k3qqeo,https://www.reddit.com/r/Olivesplace/comments/1k3qqeo/there_is_not_one_exact_recipe_it_is_generaly/,"There is not one exact recipe... It is generaly blended with family recipe.
Sharena Sol Recipe","

There is not one exact recipe... It is generaly blended with family recipe.



Sharena Sol Recipe

  




1 tablespoon dried fenugreek



2 tablespoon dried savory



1 tablespoon paprika



2 tablespoon fine corn flour



2 tablespoon pumpkin seed meal



1 teaspoon salt



Optional ingredients (don’t use all of them!):



1 tablespoon dried thyme



1 tablespoon dried honey garlic



1 tablespoon dried oregano



1 tablespoon black pepper



1 tablespoon spicy pepper



1 teaspoon cumin



1 teaspoon dried spearmint



1 tablespoon dried parsley



1 tablespoon dried basil



1 tablespoon dried dill





Combine all ingredients. If any of them need grinding, use a mortar and pestle or a spice or coffee grinder.



Mix very well and transfer to a jar.



Keep the jar closed with a lid.



Notes



If you decide to add any of the optional ingredients, add them one by one and try the blend, before adding another. 



Beware that using them altogether is not a good idea. It is recommended adding a maximum of 4 optional spices.



If you add any of the optional ingredients, feel free to add also more salt to taste.



Store your Sharena Sol in a closed jar for about 1 year.



",1,1745167396.0,Olivesplace,0,1.0,False
1k3qq4l,https://www.reddit.com/r/chongqing/comments/1k3qq4l/looking_for_friends_cq_1949/,looking for friends & cq 1949,"hiiii, I am looking to make new friends. I’m in cq for some time as I was visiting for my pop’s bday. 

I’m thinking of visiting the 2nd arts place, and 
I’ve been looking at the theatre play, but I don’t have anybody to go with yet. 

I would love to meet for a coffee meet! 030 
there’s also that slight french district which I heard has some shops.

dm for more personal details if that helps 
I’m cn but come from a varied background so I can also speak French & a bit of japanese. ",2,1745167373.0,chongqing,1,1.0,False
1k3qp9w,https://www.reddit.com/r/askportland/comments/1k3qp9w/coffee_ground_for_garden/,Coffee ground for garden?,Anyone seen a sign for giving away free coffee grounds ? Slugs are decimating my plants already!,1,1745167309.0,askportland,0,1.0,False
1k3qp1y,https://youtu.be/06BGMVPj0jQ?si=UgZ1xGt4u6rl66B-,Who needs coffee in the morning when you have GT7 + PS5 Pro + PSVR2,"Absolutely mental, palm sweat inducing Formula 1 racing in glorious PS5 Pro quality. Worth every penny for the upgrade. Enjoy!

",2,1745167292.0,GranTurismo7,1,0.76,False
