id,url,title,text,score,created_utc,subreddit,num_comments,upvote_ratio,over_18
1n9nwzn,https://www.reddit.com/r/SaaS/comments/1n9nwzn/i_built_a_photofirst_calorie_tracker_marketing/,I built a photo-first calorie tracker. Marketing tips?,"It's late, probably way too late, and my coffee's gone cold again. Just finished up fixing a weird edge case in the photo scanner for my new iOS app. Been thinking a lot about why most food tracking apps feel like such a chore. I mean, after a long day of coding or bouldering, opening MyFitnessPal or something similar felt like homework, every single time. It's the biggest reason I'd ditch calorie tracking eventually, even though I knew it helped me stay on top of things. I just needed something easier, something that didn't break my flow.

So, I started building my own solution, an app focused on the smallest possible action to log a meal. Think snap a photo, confirm, done. The AI actually works surprisingly well; it nails most common meals and gets the calorie count surprisingly accurate when you learn how to take a decent pic. Even estimates olive oil in the pan. The ""invisible"" calories everyone argues about, telling if something looks pan-fried versus grilled. I spent way too long on the UI/UX, probably a classic mistake for a solo founder, but I really wanted the experience to be smooth. Of course, AI isn't perfect, especially with super mixed-up foods, so I built in quick fallbacks like database search, manual input, and barcode scanning. But most of the time, the photo capture works, and it’s genuinely the easiest way I've found to keep up with my diet.

My question for you all, especially fellow iOS developers who've thought about this space: When it comes to everyday apps like this, what matters more to you as a user? 



Also, if you have made consumer apps how did you go about marketing?",2,1757125133.0,SaaS,0,1.0,False
1n9nwp8,https://www.reddit.com/r/HistamineIntolerance/comments/1n9nwp8/the_worst_body_aches_in_my_life_after_starting/,The worst body aches in my life AFTER starting low histamine diet,"Ok, a bit of a long back story but I’m hoping someone can help… 

35 year old female in BC Canada 

-History of migraines every 6-8 weeks, preceded by cluster headaches 

-History of severe motion sickness. I cannot be a passenger on a vehicle at all ever. Seems to be related to my migraines. A migraine triggers the worst dizziness and I am pretty much comatose with a puke bowl nearby for 12-20 hours 

-History of severe PMDD, and heavy/prolonged menstrual bleeding. Currently I am bleeding heavily upwards of 12 days per month, and spotting for an additional 5-10. So mostly bleeding more often than not. 

-History of unexplained bruising 

-History of restless legs syndrome 

-Mental health history of PTSD from childhood trauma, as well as generalized anxiety and depression 

Current medications:
30mg Mirtazipine 
100mg gabapentin 
.35 mg Norethindrone
100mg reddy-progesterone 
Multivitamin 
Magnesium 
Iron supplement 

So here’s the backstory. I finally got referred to a hematologist and a gynaecologist to try to figure out this bleeding. It has been going on for years. All lab work and endometrial biopsy came back normal. Gynaecologist started me on the mini pill and progesterone about 6 months ago. No change in my bleeding whatsoever. Previously I tried the mirena IUD which also did not change the bleeding. But in terms of medical diagnosis, I’m all clear and there’s no pinpointed reason why I’m bleeding all the time. But I am, and I subsequently feel like shit all the time. 

I also know that my nervous system is in overdrive/constant fight or flight from the PTSD and just general life stress (I have a lot of it). I feel like I’m always “wired.” Add in a bit of depression and the bleeding issues and I just feel exhausted, depleted, sluggish, and awful most days. 

So eventually I decided to try seeing a different doctor because my GP basically shrugs her shoulders and isn’t doing anything to help me feel better. 

New doctor took a very thorough history and had some interesting theories. He thinks it’s possible that I am somewhat histamine intolerant and told me to try a low-histamine diet for a few weeks. He also sent for further lab work which I have not been able to do yet (just due to scheduling conflicts). Notably he is testing my thyroid, homocysteine, and testosterone. He also informed me that I may be somewhat gluten sensitive - my tissue transglutaminase ab was tested years ago and was 5.5 one time and 6.5 another time. My GP never brought this up to me at all. So he also recommended I cut out gluten as a trial to see if anything changes. The underlying reason he thinks I am histamine intolerant is because it can be linked to many of my symptoms such as headaches/dizziness, PMDD and menstrual irregularities, anxiety/mood disorder, and I had a severe case of cold urticaria that lasted for about 2 years and then went away. He said something about methylation and a build up of estrogen in my body which I didn’t fully understand. 

I am now on day 7 of a strict low histamine gluten free diet. I am also on day 5 of having a very mild head cold (slight sniffles and scratchy throat). No fever. But I have THE ABSOLUTE WORST BODY ACHES OF MY LIFE. It feels like every muscle is tense and aching from the top of my spine all the way down and around both hips and into my upper legs. I am in agony. I barely slept last night. I have tried a hot bath, heating pad, voltaren topical gel, and Tylenol (no nsaids due to the low histamine diet). 

Do you think the body aches could have to do with the diet change? Or just a random coincidence? I neeeeeed it to go away it is so painful I am tempted to go to ER. 

Previous to this low histamine and gluten free diet I ate pretty healthy in my opinion. Lots of protein and veggies. The main things I have cut out that were dietary staples for me are coffee, spinach, red and yellow peppers, yogurt, oat milk, occasionally whole grain toast or a granola bar, and peanut butter. ",4,1757125107.0,HistamineIntolerance,2,1.0,False
1n9nwp3,https://i.redd.it/hljig7s2fgnf1.jpeg,stop for a coffee ☕️,,1,1757125107.0,diecastcarcameraclub,0,1.0,False
1n9nwnr,https://www.reddit.com/r/ThisAintAdderall/comments/1n9nwnr/to_those_of_you_struggling_with_granules_vyvanse/,To those of you struggling with Granules vyvanse.,"Try dissolving the contents of the capsule in water, then running the solution through a coffee filter to remove all of the insoluble materials (lisdexamfetamine *is* water soluble so you’re not losing any potency). In a pinch you can just drink the water while avoiding the shit at the bottom. Doing this made the medication actually work for me rather than making me feel violently ill and like I just had a stroke. My theory is that whatever substance is responsible for Granules vyvanse’s weird side effects is part of the binder or something, and isn’t soluble in water. ",1,1757125104.0,ThisAintAdderall,0,1.0,False
1n9nwhk,https://www.reddit.com/gallery/1jo2e4h,Coffee haul from trip to Chikkamagaluru,,1,1757125088.0,Chikkamagaluru,0,1.0,False
1n9nwe8,https://i.redd.it/7ap5os00fgnf1.jpeg,stop for a coffee ☕️,,2,1757125082.0,Diecast,0,1.0,False
