id,url,title,text,score,created_utc,subreddit,num_comments,upvote_ratio,over_18
1g746h0,https://www.reddit.com/r/ExNoContact/comments/1g746h0/a_reflection_on_blocking_cutting_someone_out_of/,"A reflection on blocking, cutting someone out of your life without closure.","Very recently I've just been dumped by my ex, she didn't give me closure, and she flipped on me like a switch. Maybe I was blind to it, maybe she's avoidant, and maybe things were never meant to be, but I've been through many breakups with objectively worse or bad people, and nothing has hurt me like she has.

As to how it happened, I can't say what it was in her perspective and I understand that people tend to be biased. I am not perfect. I was tired from work and lack of sleep, and that same morning I was just done bouldering with her running on 3 hours of sleep, and nothing seemed out of the ordinary, later after we split I received news of my dad's illness (dementia) which put me into a major depressive mood so I asked her if I could come by to her place and crash for a bit. All I wanted to do was be around her in single moment of emotional vulnerability, she let me in but as I stayed there longer and was napping, she was clearly growing annoyed, and then told me to leave. I was dragging my foot telling her I just want to be around her for a little more, but I eventually obliged and left. During my trip home, she told me she never wanted to see me ever again and I broke her boundaries. Just 3 hours before this she sent me a text about how she enjoyed my company today. It was emotional whiplash on a scale I've never encountered before.

I've never raised my voice against her, I've never threatened her, and I've never argued with her, and on our first argument ever, she threatened to call the cops on me, she was so loving just the days before, and the same morning we were talking about vacationing to Bali together, it was like I was suddenly transported into an alternate reality.

I am aware that this is highly unusual, and normal people don't act like this, so perhaps it's a good thing, but I still can't get myself to hate her.

I know she has trauma over her previous relationship stalking her, and I try my best to respect her and not remind her of her previous issues, and unfortunately it looks like I couldn't do enough to stop that person from being projected on me. From what I get told, she may be an avoidant, but I guess I won't really know.

She blocked me on everything, and got her friends to block me. It doesn't help of course, and maybe only made it worse, because **I work literally next to her**. I have to see her everyday, and pretend as if I don't know her, I feel like a stalker when I catch a glimpse of her while getting coffee at work, my entire daily routine now feels unusual, every moment her coworker makes eye contact with me, I can only wonder what she's saying about me to them.

I'm still processing the grief, and I understand now that maybe it's just not meant to be. I still love her with all my heart, and I still can't find any bitterness or resentment towards her, except maybe for the act of blocking, cutting someone out of your life without proper communication. It hurts my soul not knowing what I may have been blind to. It hurts to speculate on whether or not I was just being played. It hurts to sometimes think that all of it has simply been a lie. It hurts to think I was simply being taken advantage of, or whether or not I am a genuine monster.

Sure, some people may be monsters, and cutting them off without any closure in a snap may be the closest thing to the correct answer, but I believe that people are good, in contrast of what the internet may lead you to believe. Please don't let your trauma or grief be the reason to hurt others.",1,1729325304.0,ExNoContact,0,1.0,False
1g7454k,https://www.reddit.com/r/relationships/comments/1g7454k/my_boyfriend_hasnt_texted_me/,My boyfriend hasn't texted me,"I (26F) and my Boyfriend (34M) have been in a relationship for going on 4 years now. Our anniversary is coming up. We met just before COVID started and talked all through it and started going on dates after quarantine was lifted. He has a son (11M) and I treat the boy as if he were my own. Our relationship is a very sweet one, as he always would tell me that he didn't want to be the teenager him of the past, so he made sure to bring me hot chocolate and a donut after I told him I hated the taste of coffee when he came by my place of work when we were still in the talking phase before COVID started. He always pays attention to what I say and remembers it. The last 4 years have been amazing and I truly love him. However, earlier this year he went 4 months without answering any of my texts. He would read them but not respond. It wasn't until I got concerned enough to ask if his son and grandmother were alright that he finally answered me. He had lost his job and his apartment and was going through a bout of depression and felt he didn't deserve me. I talked to him about how relationships are about leaning on each other and helping each other even if he didn't want help financially I was there emotionally and always there if he needed to vent or talk. He told me he got a new apartment and a new job and he was talking to me again. That lasted a while 2 months before he ghosted me again. This time I'm being left on delivered. He's not even looking at the texts. I can't drive out to him because he didn't tell me where his new place is. It's been a while 2 and a half months of no texts. Half of me is so angry and the other half is worried. 

(For those who are wondering about the sons mother she gave up parental rights when the boy was 4 and she left my boyfriend to change her gender and date another woman)

**TL;DR. So to sum up. My boyfriend hasn't texted me for a grand total of six and a half months and I want to know what I should do? Should I just assume we're broken up?**",2,1729325119.0,relationships,3,1.0,False
1g744so,https://www.reddit.com/r/UnsentLettersRaw/comments/1g744so/wheres_the_winter/,Where's the winter?,"Where’s the winter?
That once was yours and mine 
Your arm my arm
Your leg my leg 
Where’s the winter? 
That was cold but very warm 
Crunch of fallen leaves
late night coffees 
Where’s the winter?
Spent watching movies
In my smelly blue Levi’s 
as you took off my Tees 

The winter’s gone, summer’s here
The sun shines again. ",1,1729325075.0,UnsentLettersRaw,1,1.0,False
1g744jr,https://www.reddit.com/r/phclassifieds/comments/1g744jr/puma_speedcat/,Puma Speedcat,"Hello! Saan po may sellers ng Puma Speedcat Coffee? Not too overpriced po sana, I’m seeing lots of resellers na masyadong mataas patong nila sa srp. I’ll go for 8,500 max po since 7,100 lang naman srp pero sold out kasi sa app 😢 TIA! ",1,1729325044.0,phclassifieds,0,1.0,False
1g744he,https://www.reddit.com/r/VisitingHawaii/comments/1g744he/wifi_in_and_around_oahu_mainly_waikiki/,Wifi in and around Oahu (mainly Waikiki),"Hey everyone,

Visiting from Canada in a little over a week.  I'm trying to figure out what eSim plan to get - whether I can get away with 1gig and just wifi hop, or if I should get more data. 

Mainly curious how much wifi there is around Waikiki?  Like besides hotels and coffee shops.  I figure I'll need data when I drive out to visit places like North Beach.",1,1729325035.0,VisitingHawaii,1,1.0,False
1g74452,https://i.redd.it/v4k5iiw17ovd1.jpeg,Moccamaster ‚Channeling‘,Made my first brew using 32g of coffee for 0.5l of water with a medium grind and after about 1min of brewing it‘s finished and i have watery coffee. What do i need to do differently?,1,1729324989.0,Moccamaster,0,1.0,False
1g74439,https://i.redd.it/k03l0gg17ovd1.jpeg,General advice on lightening/mixing,"I know there's lots of advice online but it's all a bit confusing and I was wondering what people find the most affective activator is for henna? I used to use coffee when I was doing a henna/indigo mix for a really dark auburn colour. But I've grown out for about 6 months and I want to go for as bright a red as I can. I want orange really but due to build up over 10 uears I think I'd have to bleach my hair to achieve that now. 

What would everyone reccomend? Is lemon juice a bit too harsh? My hair is super dry and frizy so I do worry about that.

Picture: from last time I dyed it with the combo. Any tips on going a lot lighter? ",1,1729324984.0,henna,1,1.0,False
1g742ik,https://www.reddit.com/r/Dublin/comments/1g742ik/mental_health_coffee_chats/,Mental health coffee chats,"Hi guys,

I’m planning to host well-being coffee chats through the month of November in the city center, why November? November is the month for Prostate Cancer and men’s health awareness. I have struggled in the past with mental health and I know how much we need to speak out all our issues and this is what the coffee chats are going to be about, meet new people, chat and have a good craic.

Is it something some of yous would be interested?",2,1729324798.0,Dublin,0,1.0,False
1g742du,https://i.redd.it/7mu64wlf6ovd1.jpeg,Caffe Monster Coffee ,Got a memory on Snapchat from years ago with a picture of one of these coffees. Anyone remember them? They were good and I miss them ,1,1729324780.0,monsterenergy,0,1.0,False
1g741yu,https://www.reddit.com/r/BreakUps/comments/1g741yu/a_reflection_on_blocking_cutting_someone_out_of/,"A reflection on blocking, cutting someone out of your life without closure.","Very recently I've just been dumped by my ex, she didn't give me closure, and she flipped on me like a switch. Maybe I was blind to it, maybe she's avoidant, and maybe things were never meant to be, but I've been through many breakups with objectively worse or bad people, and nothing has hurt me like she has.

  
As to how it happened, I can't say what it was in her perspective and I understand that people tend to be biased. I am not perfect. I was tired from work and lack of sleep, and that same morning I was just done bouldering with her running on 3 hours of sleep, and nothing seemed out of the ordinary, later after we split I received news of my dad's illness (dementia) which put me into a major depressive mood so I asked her if I could come by to her place and crash for a bit. All I wanted to do was be around her in single moment of emotional vulnerability, she let me in but as I stayed there longer and was napping, she was clearly growing annoyed, and then told me to leave. I was dragging my foot telling her I just want to be around her for a little more, but I eventually obliged and left. During my trip home, she told me she never wanted to see me ever again and I broke her boundaries. Just 3 hours before this she sent me a text about how she enjoyed my company today. It was emotional whiplash on a scale I've never encountered before. 

I've never raised my voice against her, I've never threatened her, and I've never argued with her, and on our first argument ever, she threatened to call the cops on me, she was so loving just the days before, and the same morning we were talking about vacationing to Bali together, it was like I was suddenly transported into an alternate reality. 

I am aware that this is highly unusual, and normal people don't act like this, so perhaps it's a good thing, but I still can't get myself to hate her.

I know she has trauma over her previous relationship stalking her, and I try my best to respect her and not remind her of her previous issues, and unfortunately it looks like I couldn't do enough to stop that person from being projected on me. From what I get told, she may be an avoidant, but I guess I won't really know.

She blocked me on everything, and got her friends to block me. It doesn't help of course, and maybe only made it worse, because **I work literally next to her**. I have to see her everyday, and pretend as if I don't know her, I feel like a stalker when I catch a glimpse of her while getting coffee at work, my entire daily routine now feels unusual, every moment her coworker makes eye contact with me, I can only wonder what she's saying about me to them. 

I'm still processing the grief, and I understand now that maybe it's just not meant to be. I still love her with all my heart, and I still can't find any bitterness or resentment towards her, except maybe for the act of blocking, cutting someone out of your life without proper communication. It hurts my soul not knowing what I may have been blind to. It hurts to speculate on whether or not I was just being played. It hurts to sometimes think that all of it has simply been a lie. It hurts to think I was simply being taken advantage of, or whether or not I am a genuine monster.

Sure, some people may be monsters, and cutting them off without any closure in a snap may be the closest thing to the correct answer, but I believe that people are good, in contrast of what the internet may lead you to believe. Please don't let your trauma or grief be the reason to hurt others. ",1,1729324725.0,BreakUps,0,1.0,False
1g741ql,https://www.reddit.com/gallery/1g741ql,Bought my first camera three weeks ago and took it on my trip to Vietnam ,,2,1729324693.0,AmateurPhotography,0,1.0,False
1g741je,https://www.reddit.com/r/SVU/comments/1g741je/rewatching_seasons_717/,Re-watching seasons 7-17,"So, as the title would suggest, I just happened to be catching the end of a season seven episode, which then had me intrigued by a couple of little moments that I needed to look into. Which then led me to more interesting snippets from the season, which then led to me watching that season and now where I slipped and watched through to season 13, it happens.  
I know a lot of people or critics will point out how frustrating Olivia becomes. And I was trying to take the tact of, I love the show, I shouldn't complain so much about something that I am choosing to watch and clearly enjoy. However, I wouldn't be me if I didn't mention that I now realise one of the main reasons I started to turn on Olivia's character.... More and more, she does that weird whispering voice when interviewing or interrogating or trying to soothe a victim. I'm pretty sure she does her coffee orders like that, and sings.. I do remember now that, that was one of the things that really started to irk me.  
Anyways, sorry, had to get it off my chest.",1,1729324665.0,SVU,0,1.0,False
1g7414b,https://www.reddit.com/r/MyEasyRecipes/comments/1g7414b/tiramisu_cookies_a_delicious_twist_on_a_classic/,Tiramisu Cookies: A Delicious Twist on a Classic!,"https://preview.redd.it/up3guqvt5ovd1.png?width=736&format=png&auto=webp&s=d9153ffd73f24f24a86b0cd9e74fc7956fce772d

  


Craving a tiramisu-inspired treat? These cookies combine the rich flavors of espresso, cocoa, and mascarpone frosting.

**Ingredients:**

* **Cookie dough:** Flour, baking soda, baking powder, espresso powder, salt, butter, sugar, eggs, vanilla
* **Mascarpone frosting:** Mascarpone cheese, heavy whipping cream, powdered sugar, vanilla
* **Cocoa powder** for dusting

Full Recipe & Step-by-Step with Images and Video: [Tiramisu Cookies](https://appsthatdeliver.com/recipes/tiramisu-cookies/)  


**Instructions:**

1. Make cookie dough, bake.
2. Whip up mascarpone frosting.
3. Frost cookies, dust with cocoa powder.

**Tips:**

* Use high-quality espresso powder.
* Let cookies cool completely before frosting.
* Add chocolate chips or cocoa powder to the dough for extra chocolate flavor.

**These cookies are perfect for a coffee break or a special occasion1**",1,1729324608.0,MyEasyRecipes,0,1.0,False
1g7409h,https://www.reddit.com/r/AskDocs/comments/1g7409h/stomach_issues_help/,Stomach Issues Help,"Hi everybody. I really need some advice. 

So I've been having bad stomach issues for a few weeks, and I have gained 11lbs in weight in the space of 3 weeks. 

I'm suffering from constipation. I normally poop several times a day, but I had been doing once for a few weeks, and they were not properly formed. Type 5-6. I was in pain where I needed to poo more, but it wasn't coming out

For a couple of weeks, I have been drinking green tea, espresso coffee shots, having gut cleanse tablets, dgl liquorice tablets, chewing ginger, drinking apple cider vinegar etc to try and help, and it has been helping me. I've also taken laxatives a couple of times too. 

On Monday this week, I decided to cut out wheat and dairy temporarily to see if it made a difference. 

I've suffered with bloating since I was a teenager, and have issues with IBS, but I also have two forms of kidney disease too, and have been on a number of tablets over the years. I know that this is nothing to do with my kidney condition. 

But for the last few weeks, I have had the bloating worse than ever, blinding headaches, severe dizziness, constipation, diarrhea, my stomach feels lumpy, feeling the cold even more than usual, nausea, appetite is lower etc.  

I'm still going to the gym, and exercising as much as I was before. I've cut my portions, and it's not helping with the weight issue. I've been exercising when I've been dizzy, which I know is not sensible. 

I should mention that I have previously lost nearly 11 stone in weight naturally too. 

I'm just posting asking for advice, because I'm scared. ",1,1729324491.0,AskDocs,1,1.0,False
1g73vop,https://www.reddit.com/gallery/1g73vop,A peaceful Saturday afternoon ,"Amazing coffee, amazing book, amazing place and amazing weather.🥰",2,1729323873.0,gurgaon,0,1.0,False
1g73v3i,https://www.reddit.com/r/HenryZhang/comments/1g73v3i/my_55000_forex_profit_achieved_in_just_one_week/,"My $55,000 Forex profit achieved in just ONE week! 📈💰","My $55,000 Forex Profit Achieved in Just ONE Week! 📈💰

In the thrilling world of trading, the promise of quick profits can be akin to fool's gold—enticing but often elusive. Yet, with the right strategy and mindset, reaching a remarkable milestone is not just a dream. Just last week, I made a staggering $55,000 trading Forex, and today, I’m peeling back the curtain to share exactly how this was achieved. Grab your coffee, settle into your chair, and let’s dive into the exhilarating ride that led to this high-reward outcome.

THE INITIAL SPARK: WHERE STRATEGY MEETS OPPORTUNITY
Let’s start by addressing the elephant in the room: luck vs. skill. While luck plays a role in the world of trading, equipping yourself with the right tools and knowledge dramatically tilts the odds in your favor. My journey this week was the result of strategic precision, leveraging insights gained from years of analyzing market trends and movements.

BUILDING THE BLUEPRINT
 1. Deep Market Research:
    Forex trading hinges on understanding market behaviors. I dedicated hours each day to analyzing economic indicators, currency correlations, and geopolitical risks. This foundational work laid the ground for informed decisions.
    
    
 2. Leveraging Technology:
    Using advanced trading platforms and algorithms, I tailored trades to align with market shifts. These technologies enhanced my decision-making, allowed for pinpoint entries, and optimized exits.
    
    
 3. Risk Management:
    
    

 Every trade carries risk. I employed a robust risk management framework by setting stop losses and diversifying currency pair investments. This strategy minimized potential losses while maximizing gains.

HIGH-IMPACT STRATEGIES FOR NOVICE & VETERAN TRADERS ALIKE
THE POWER OF KNOW-HOW
For those eager to replicate this success, understanding Forex strategies and market behaviors cannot be overstated. Whether you're a seasoned trader or a novice on your trading journey, here are some actionable tips that made all the difference:

 * Educate Continuously:
   Broaden your knowledge base with resources like our premium newsletter on Substack [https://henryzhang.substack.com/]. This resource provides timely insights and expert analysis to keep you ahead of the curve.
   
   
 * Engage with a Community:
   Join discussions with like-minded individuals in our exclusive Discord community for traders [https://whop.com/trading-entrepreneur]. Learn from peers, share strategies, and receive real-time support.
   
   
 * Master Specific Techniques:
   
   

 Specialized knowledge can offer an edge. Enroll in our advanced 0DTE trading course on Thinkific [https://henryzhang.thinkific.com/pages/mastering-0dte-options-course]. It’s designed to provide you with detailed guidance and techniques that I used during my week-long trading success.

REAL-LIFE IMPACT: TRUST THE PROCESS
Success in trading comes down to resilience and learning from every experience. Here’s a snapshot of another success story from our community:

Maria's Milestone:
After enrolling in our 0DTE course, Maria reported an 80% increase in her trading success within just three months. Her insights, gleaned from the community and our targeted content, helped her navigate the market with newfound confidence.

READY TO TRANSFORM YOUR TRADING JOURNEY?
Trading is not just about crunching numbers—it's about nurturing a mindset focused on growth and sustained success. Take the leap today and subscribe to our premium newsletter [https://henryzhang.substack.com/], join our trading community on Discord [https://whop.com/trading-entrepreneur], or dive into our advanced trading courses [https://henryzhang.thinkific.com/pages/mastering-0dte-options-course] to unlock your potential.

FINAL THOUGHTS
My one-week, $55,000 success is more than a testament to strategic trading—it's an invitation for you to take charge of your financial future. The road is paved with knowledge, smart risk-taking, and continuous learning. Share this post with anyone hungry for trading success and ignite your journey towards financial mastery. Let's conquer the Forex market together!




Call to Action: Ready to take your trading to the next level? 📈 Subscribe to our newsletter [https://henryzhang.substack.com/] for expert insights, connect with like-minded traders on Discord [https://whop.com/trading-entrepreneur], and enhance your trading skills with our Thinkific course [https://henryzhang.thinkific.com/pages/mastering-0dte-options-course]. The next big win could be yours!",1,1729323788.0,HenryZhang,0,1.0,False
1g73v0c,https://www.reddit.com/r/BipolarReddit/comments/1g73v0c/can_caffeine_trigger_hypomania/,Can caffeine trigger hypomania? ,"I don’t normally drink caffeine, but I had a couple cups of coffee today and I feel a little *too good.* Has this happened to anyone else?",3,1729323777.0,BipolarReddit,2,1.0,False
1g73ul6,https://www.reddit.com/gallery/1g73ul6,My Coffee Stations,"ECM Synchronika-Anthocite with Walnut Accents and Flow Control, Eureka Atom W65 Grinder, Eureka Disko Automatic Tamper, Acaia Lunar Scale, Fellow Aiden Precision Coffee Brewer, Fellow Ode Brew Grinder, Maestri House Scale. 
",6,1729323722.0,coffeestations,1,1.0,False
1g73u9v,https://www.reddit.com/r/Brazil/comments/1g73u9v/brazilian_coffee/,Brazilian coffee,"Hi r/brazil, 

As a coffee lover I only have one question:

Which Brazilian coffee is the best? ",2,1729323679.0,Brazil,0,1.0,False
1g73u2k,https://i.redd.it/v792mrt23ovd1.jpeg,"Siliguri Redditors Meet up + Football Screening tomorrow 20th Oct Sunday @Vega Mall, 7-7 30pm ","Siliguri Redditors Meet up + Football Screening tomorrow 20th Oct Sunday @Vega Mall, 7-7 30pm

Hi so some of us are meeting tomorrow at  Vega Mall around 7- 7 30 pm. The plan is to meet up there, and there head to Coffee Shop to watch the Liverpool vs Chelsea game which is from 9 pm. Already had a talk with the venue, everything will be arranged.

Anybody interested just in the meet up or to watch the game of football over some food/beer  feel free to let me know over DM. You can bring your friends/family also if they are interested. 



",3,1729323652.0,siliguri,1,1.0,False
1g73sa7,https://www.reddit.com/r/BipolarReddit/comments/1g73sa7/i_refuse_to_take_seroquel_anymore_its_poison/,I refuse to take seroquel anymore its poison ,I just cannot take seroquel anymore. Its a poison for me. I take 300 and every morning I wake up in dread with nightmares and I feel tired after sleeping 12 hours. I do not even feel rested at all and I feel sedated all day. Please Tell me that abilify or other meds are better. I could take depakote as a mood stabilizer or abilify but I cannot put this poison in my body anymore . I woke up this morning drank 3 COFFEES AND STILL FEEL LIKE SLEEPING. THIS IS A POISON FOR ME .,1,1729323412.0,BipolarReddit,3,1.0,False
1g73s7v,https://www.reddit.com/r/loveafterporn/comments/1g73s7v/right_next_to_me/,Right next to me!,"My guy likes to watch tv in the bedroom late into the night in his swivel chair. I happened to wake up as he was watching his tablet servicing himself! When I moved he immediately stopped and pretended to be watching the TV... So I pretended to still be sleeping and so he finished himself off -- as soon as he was done I got up and locked myself in the bathroom and CRIED. 
When I came back, still not able to hold back the tears I told him I can't do this anymore. 
He claims to want better mental health, stay sober from alcohol, be better to me, blah blah blah but it's all just empty words. He's doing just the bare minimum all for show, and I. Am. Done. 

I've wasted four years trying to help and support him but he's doing n-o-t-h-i-n-g but pretending. 

In the morning, he can get his own coffee ready. He can make his own smoothie for breakfast. He can start doing his own laundry. The convenient, comfortable in-house maid has QUIT. 

I have better things to do and better people to hang out with. ",6,1729323404.0,loveafterporn,1,1.0,False
