id,url,title,text,score,created_utc,subreddit,num_comments,upvote_ratio,over_18
1k360ge,https://www.reddit.com/r/u_Brotatochip411/comments/1k360ge/salt_in_the_wound/,Salt In The Wound,"
Chapter 10: Luxury 

I stood there staring at the freezer, the door hanging open, the cold air kissing my face like it could wash away the sickness curling in my stomach. Plastic-wrapped slabs of meat, sealed tight and labeled in thin, neat handwriting. Names, not cuts. Real names. Names I recognized. Names I didn’t. One in particular burned through my skull.

Carrie.

I shut the door before the kids noticed I hadn’t moved. My hands were shaking. My throat felt raw.

I turned back toward the stove, swallowing hard, and forced my voice to steady.
“Why don’t I make something a little different tonight?”

The oldest girl didn’t answer. She stood there stiff, watching me the way a wolf might watch its next meal. Not angry. Not confused. Just waiting for me to fail.

I used what I could scrounge from the cabinets and fridge. Old cans with faded labels. Some pasta. A jar of something that might have been tomatoes. Anything but what was in that freezer. Thank God the fridge had normal contents. The kids sat at the table, whispering to each other, casting glances at the clock like little wind-up toys running down on batteries.

“He’s late,” the freckled girl muttered after a long stretch of silence.

The red-headed boy’s face twisted. “You made him mad,” he said, like a verdict. “Now he won’t come for a long time.”

The littlest one didn’t say a word. She just picked at her food, eyes empty and hollow like a doll that’s been left out in the rain.

“Voila! Pasta for dinner!” I said, trying to force some life into my voice. “Isn’t this a nice change for once?”

They all stared at the plates like I’d set down something foreign.

“Where’s the meat?” the oldest asked flatly.

“Yeah,” the red-haired one chimed in, frowning, “how are we supposed to get big and strong like Daddy if we don’t eat meat?”

“Daddy says meat has to be in every meal,” the youngest added quietly, “or it doesn’t count.”

I swallowed hard and kept my smile glued in place. “Meat’s important, sure. But I don’t like it much, so tonight we’re having this instead. It’s good — just try it.”

I took the first bite myself, mostly to prove it wouldn’t kill them. It wasn’t bad. In fact, it was the best thing I’d eaten in a long time. I nearly cried.

The kids ate in complete silence, mechanically, like little machines refueling. No complaints. No small talk. And for me, that was a win.

When the plates were clean, they stood, carried their dishes to the sink, and then just… stared at me. Eyes blank. Waiting.

“Yes?” I asked, the smile long gone now. “Do you need something?”

“Aren’t you going to tell us what to do?” the oldest asked.

I hesitated, that familiar chill creeping up my spine.

“Oh, uh… I guess go in your room and find something to play with.”

They nodded as one, almost too in-sync, and padded off toward the bedroom without another word.

“Before you head back to your room—can you tell me your names?” I asked, surprising even myself.

The oldest girl tilted her head, eyes narrowing like she was weighing whether to answer.

“Jessa,” she said at last, voice soft but firm.

The red‑headed boy bounced on his toes. “I’m Milo,” he piped up, grinning as if proud to finally use a real name.

The littlest girl pressed her thumb to her lips, then sniffled. “I… I’m Lila,” she whispered, her gaze dropping to her feet.

“Jessa, Milo, Lila,” I repeated, letting each name settle. “Thanks for telling me. You can go now. It’s alright.” 

They filed past me in silence, their bare feet indistinct on the metal floor. Jessa paused at the door and glanced back.

“Goodnight, Mommy,” she said,then disappeared into the darkness beyond the bedroom door. 

Milo gave a quick wave without looking, and Lila clutched a doll close to her chest before slipping inside.

I stayed by the table for a long moment, listening to the soft scrape of toys being sorted and quiet whispers behind the closed door. Their names echoed in my head—reminders that they’re more than just extensions of him, as much as he’s tried to mold them into perfect little soldiers.

With their names in hand, I felt I had a bit more ground to stand on. Now to see if the front door really was locked…

The second they were gone, I tried the front door. I rattled the handle, pressed my shoulder against it, even dropped to my knees and checked the hinges — locked tight. Deadbolted from the outside, most likely. No key in sight. No way out.

I stood there, forehead pressed against the cool metal, letting the quiet swallow me whole.
The girl’s words circled back, louder now.
We can’t get out. We never get out.

I pulled myself away from the door and forced my focus onto the walls, tracing the edges where metal met plaster, where screws held scraps of this place together. Then I saw it — a vent. Narrow, but not impossible.

I couldn’t risk it now, not with the kids awake. I’d have to wait until they fell asleep, and when they did, I’d climb through that vent, find a way back to the hallway, and keep searching. I still needed a weapon and a plan. Now that there are three other lives involved I had to figure it out and quickly. 

I glanced back toward the kids’ room, where the soft murmur of their voices still drifted out beneath the crack of the door. They weren’t like me. They were just children. Small. Hungry. Tired. Programmed to expect the worst and survive it.

But that’s what gnawed at me most.
They’d been raised by him.

I didn’t know what they’d seen, or what they’d been taught, or what part of him lived inside their heads now, curled up and quiet, waiting for its turn to speak.

So no, I wasn’t afraid of the children.
I was afraid of what they might become.

I turned back to the vent and traced its edge with my fingers. 

Whatever this place was — whatever he had planned — I wasn’t going to be another forgotten photograph on that wall.

I waited for hours looking around, cleaning the kitchen and then finally…silence. 

I hooked my boot under the grille and tugged it free. The metal panel clattered against the floor as I knelt and tested the opening. It yawned just wide enough to force my shoulders through. I swallowed past the tightness in my throat, swung one leg up, and slid inside.

Dark swallowed me. I lay flat on the dusty floor of the duct, every breath echoing back at me. The air was stale, tinged with rust and something else—an oily, chemical tang that set my stomach roiling. I paused, listening. Faint creaks and distant thumps marked the bunker’s living machinery, but no footsteps. For now, at least, I was alone.

I wriggled forward, arms scraping the riveted metal sides. There were joints above me where the duct turned—sections bolted together, each one a promise of another tunnel. I counted them as I went: one, two, three turns. My heart kept pace with my crawls.

At the third bend, I felt a draft. Hope flared. I pressed my face into the gap and peered into a small chamber—a maintenance access above what looked like a supply room. Light filtered in from a cracked ceiling panel, and I could see shapes below: crates, tools, maybe the weapons cache I’d been hunting.

I inched toward the opening, arm extended until my fingers brushed the edge of the panel. It gave way under pressure, and I dropped silently into a dusty storeroom.

Concrete floors, shelves of hardware, coils of wire, and a workbench lined with old tools. My throat tightened with relief and dread in equal measure. I was inside the belly of the place, closer to the heart of its secrets—and maybe close enough to arm myself.

I scanned the bench: a heavy pipe wrench, a crowbar with a splintered handle, a length of chain. I grabbed the wrench first—it was solid, cold in my hand, like a promise of protection. Then I bent to inspect the crates. One was stocked with canned rations—useful. Another was labeled MAINTENANCE. I pried it open and found a rolled tarp, a coil of nylon rope, and a flashlight with half-dead batteries.

A soft click sounded behind me. My blood froze. I pressed my back to the shelves and gripped the wrench tight. The door to the supply room creaked on its hinges.

A rat darted into view and vanished through a crack in the wall. I exhaled in relief.

I crouched and rifled through the crates until my fingers closed on something hard and cold. Pulling it free, I found a pistol—small, semi‑automatic, empty one chamber but a half‑loaded magazine still seated. A lifeline. I tucked it into the top of my boot, careful not to snag the trigger.

Flashlight hung around my neck, wrench at my waist, gun in my boot, I slipped out of the supply room and found my way back to that weird living room that welcomed me into this place. 

With a grunt, I shoved the couch in front of the door. Wheels caught on the metal floor, but I heaved it into place. Then I grabbed the coffee table and dragged it next to the couch. A stack of crates from the corner came next, piled high until the door was completely blocked.

Satisfied, I slipped back through the  hallway toward the apartment. My heart stuttered as I approached the door, fearing they’d woken. I pressed my ear to the door but heard nothing but silence. 

I slid the wrench between the knob and the frame of the door and found what made the door lock from the outside. It took everything I had, but I forced it backward until it snapped free. The deadbolt fell with a clatter

I stood back and tested it: the door swung open easily now. No lock. No cage.

I now closed it with confidence behind me and found a door directly across from the children’s bedroom, its frame painted in a soft fading rose. My pulse thudded as I stepped in. Inside was a bedroom I could only describe as sincerely feminine. Lace curtains, a delicate vanity, a bed draped in quilts of muted florals. This had to be the room the moms stay in. 

It felt wrong to be here—an intruder in someone else’s sanctuary—but I hadn’t showered or slept in a real bed in who-knows-how-long. Guilt fluttered in my chest, then vanished as the memory of cold floors and metal walls swept over me. I shut the door behind me and clicked the lock.

The bathroom was just beyond the bedroom, pristine white tile glinting under a single bulb. Countertops were lined with glass bottles of perfume, soaps carved into roses, and jars of creams I couldn’t name. My skin crawled with impurity and—against all reason—thrilled at the luxury.

I peeled off my grimy clothes, put the weapons on the sink, and stepped under the shower. The water was scalding at first, then washed over me like a release. I let the heat fall heavy until the walls blurred and tears tracked down my cheeks. I couldn’t remember ever feeling so unwanted and, paradoxically, so relieved.

When I finally turned off the water, I toweled off and noticed the walk‑in closet door swinging slightly open. Inside, rows of silk blouses, cashmere sweaters, and tailored trousers in every shade gleamed back at me. My fingers itched to try something on.

I pulled out a pair of silk pajamas—soft ivory with delicate piping—and slid into them. In the corner, I found a toothbrush and a tube of toothpaste. As I brushed my teeth, I caught my reflection in the mirror: eyes still rimmed red, skin flushed, and I had lost a good 30 pounds. For the first time in months, I felt more than just a survivor. I felt almost…safe.

Tomorrow, I’d return this guise to its solitude. But tonight, I would sleep in a real bed, cloaked in silk, with weapons by my side.",1,1745095819.0,u_Brotatochip411,0,1.0,False
1k360c9,https://www.reddit.com/r/Water_flosser_systems/comments/1k360c9/philips_baristina_review_2025_worth_the_hype_pros/,"Philips Baristina Review (2025): Worth the Hype? Pros, Cons & Alternatives Compared!","[[Explore Top Rated philips baristina review on Amazon.]](https://storeins.com/led-mask/?kw=philips baristina review)
    
# Philips Baristina Review (2025): Worth the Hype? Pros, Cons & Alternatives Compared!

Are you a coffee lover searching for the perfect at-home espresso experience without breaking the bank or sacrificing precious counter space? The Philips Baristina automatic espresso machine has been generating quite a buzz, promising barista-style coffee at the touch of a button. But does it live up to the hype? In this in-depth Philips Baristina review,we'll dissect its features,performance,and value to help you decide if its the right machine for your needs. Considering a Philips espresso machine review comparison is vital before dedicating yourself to one model!

[[Explore Top Rated philips baristina review on Amazon.]](https://storeins.com/led-mask/?kw=philips baristina review)
## What is the Philips Baristina?

The Philips Baristina is a compact bean-to-cup espresso machine designed for ease of use and convenience. It aims to bridge the gap between expensive, complex espresso machines and simpler pod-based systems. Its appeal lies in its ability to deliver fresh, flavorful espresso from whole beans with minimal effort. many are scoping out a Philips Baristina unboxing to see the machine and what all it involves.

[[Explore Top Rated philips baristina review on Amazon.]](https://storeins.com/led-mask/?kw=philips baristina review)
## Who is the Philips baristina For?

This machine is targeted towards busy individuals and families aged 25-55 who appreciate quality coffee but don't have the time or expertise for traditional espresso-making. It especially appeals to:

*   **Homeowners/Renters:** Seeking a convenient and space-saving coffee solution.
*   **Middle to Upper-Middle-Class Individuals:** Willing to invest in a quality appliance for a premium coffee experience at home.
*   **Tech-Savvy Individuals:** Pleasant with automated systems and appreciate the convenience of push-button operation.
*   **Coffee Lovers:** Who want to enjoy fresh espresso without the steep learning curve of manual espresso machines.
*   **Those Considering Value:** Individuals looking for the best bean to cup coffee machine under $500 or those wondering ""is the Philips Baristina worth it?"".

[[Explore Top Rated philips baristina review on amazon.]](https://storeins.com/led-mask/?kw=philips baristina review)
## Key Features and Benefits

The Philips Baristina boasts several features that make it an appealing option for many coffee enthusiasts:

*   **Compact Design:** Its small footprint makes it ideal for kitchens with limited counter space. If you are in the market for a compact espresso machine review articles will be very helpful.
*   **Fully Automatic Operation:** Simple one-touch operation for espresso, coffee, and lungo.
*   **Integrated Milk Frother (on some models):** Allows you to create cappuccinos and lattes with ease. Some units come with a Philips LatteGo system review details online.
*   **Ceramic Grinder:** Provides consistent grinding without overheating the beans, preserving their aroma and flavor.*   **Easy Cleaning:** Designed for easy maintenance with dishwasher-safe parts and automatic cleaning cycles. Check online for ""Philips Baristina cleaning"" guides if you have questions.
*   **Customization Options:** Adjustable coffee strength and volume settings to personalize your brew.

[[Explore Top Rated philips baristina review on Amazon.]](https://storeins.com/led-mask/?kw=philips baristina review)
## Philips Baristina: Pros

*   **Convenience:** The fully automatic operation makes it incredibly easy to brew espresso at home.
*   **Consistent Results:** Delivers consistent coffee quality with minimal effort.
*   **Space-Saving Design:** Its compact size makes it ideal for small kitchens.
*   **Relatively Affordable:** Offers a more accessible entry point into bean-to-cup espresso compared to higher-end machines. Before buying check online for 'Philips baristina Price'.
*   **Easy to Clean:** Streamlined cleaning process. For more information check for 'Philips Baristina descaling' online.

[[Explore Top Rated philips baristina review on Amazon.]](https://storeins.com/led-mask/?kw=philips baristina review)
## Philips Baristina: Cons

*   **Limited Customization:** offers less control over brewing parameters compared to manual espresso machines.
*   **Plastic Construction:** Some users may find the plastic housing less premium compared to stainless steel alternatives.
*   **Grinder Limitations:** The ceramic grinder, while durable, may not offer the same level of precision as higher-end burr grinders. Some users have found no manual adjustments for grind size or coffee quantity.*   **Milk Frother Performance (on some models):** The integrated milk frother might not produce the same microfoam as professional-grade frothers.Be sure to read a Philips Baristina milk frother review if you are interested in this particular function.
*   **Potential for Issues:** as with any appliance, there can be hiccups. Online search for 'Philips Baristina common problems' can help.

[[Explore Top Rated philips baristina review on Amazon.]](https://storeins.com/led-mask/?kw=philips baristina review)
## Model Variations: Philips Baristina EP2220/10, EP2224, and EP3146

The Philips Baristina line includes several models with slight variations in features. Here's a brief overview of some of the popular options:

*   **Philips Baristina EP2220/10:** A basic model offering essential features like automatic espresso brewing and a classic milk frother.
*   **Philips Baristina EP2224:** similar to the EP2220/10, but may include additional customization options or a slightly different design.*   **Philips Baristina EP3146:** Often features a more advanced milk frothing system,such as the LatteGo,and potentially more programmable settings.

When considering wich model is best for you, compare their specifications and read reviews specific to each version.Check some 'Philips ep2220 review' articles if you are interested.

[[Explore Top Rated philips baristina review on Amazon.]](https://storeins.com/led-mask/?kw=philips baristina review)
## Coffee Quality: Does the Baristina Deliver?

The ultimate test of any coffee machine is the quality of the coffee it produces. The Philips baristina generally receives positive feedback for its coffee quality, especially when using fresh, high-quality beans. Many users praise the machine's ability to extract rich, flavorful espresso with good crema. Though, some purists may find the taste slightly less nuanced compared to espresso brewed on professional-grade equipment due to the limitations in customization. a Philips Baristina coffee quality review will reveal that the concensus is good if you're seeking a balance between convenience and quality.

[[Explore Top Rated philips baristina review on Amazon.]](https://storeins.com/led-mask/?kw=philips baristina review)
## Philips Baristina vs. Saeco, vs. DeLonghi: Competitor Comparison

When researching espresso machines, it's essential to compare the Philips Baristina against competitors like saeco and DeLonghi. These brands offer similar machines in terms of price and features, but there are key differences to consider. If you are looking for a Philips Baristina vs Saeco comparison, here are some items. Saeco machines often have more customization options for grind size and coffee strength but can be pricier. DeLonghi machines are known for their user-kind interfaces and efficient heating systems,but some models might lack the compact design of the Baristina. always do your research into Philips Baristina vs DeLonghi before purchasing.

[[Explore Top Rated philips baristina review on Amazon.]](https://storeins.com/led-mask/?kw=philips baristina review)
## Cleaning and Maintenance: keeping Your Baristina in Top Shape

Maintaining your Philips Baristina is crucial for optimal performance and longevity. Fortunately, the machine is designed for easy cleaning. Regular descaling is essential to prevent mineral buildup,and most models have automatic descaling programs. The brew group is typically accessible for cleaning, and many parts are dishwasher-safe. Make sure to consult the Philips Baristina user manual for specific instructions on cleaning and maintenance procedures.[[Explore Top Rated philips baristina review on Amazon.]](https://storeins.com/led-mask/?kw=philips baristina review)
## Where to Buy the Philips Baristina and Finding the Best Deals

The Philips Baristina is available at major retailers like Amazon, Best Buy, and directly from the Philips website. To find the best deals, compare prices across different retailers and keep an eye out for sales and promotions. Check for refurbished models or open-box deals for even greater savings.Remember to factor in shipping costs and warranty options when making your purchase.Keep an eye out for places ""where to buy philips baristina"" as inventory can vary.

[[Explore Top Rated philips baristina review on Amazon.]](https://storeins.com/led-mask/?kw=philips baristina review)
## User Reviews and Feedback: What Others Are Saying

Before making a final decision, it's always wise to read user reviews and feedback from other baristina owners. Online platforms like Reddit, Amazon, and best Buy offer a wealth of customer reviews. Pay attention to both positive and negative feedback to get a well-rounded perspective. Look for common themes and address any concerns that align with your personal preferences and needs. Take a look at a 'Philips Baristina review reddit"" post to see what others have said.

[[Explore Top Rated philips baristina review on Amazon.]](https://storeins.com/led-mask/?kw=philips baristina review)
## Philips Baristina Alternatives

If the Philips Baristina isn't quite the right fit, consider these alternatives:

*   **Nespresso Machines:** Offer unparalleled convenience and consistency, but rely on pre-packaged pods.
*   **DeLonghi Espresso Machines:** A range of options from basic to more advanced, frequently enough with user-friendly interfaces.*   **Saeco Espresso Machines:** Known for their customization options and durable construction.
*   **Other Bean-to-Cup Machines:** Explore other brands like Gaggia or Jura for higher-end features and performance. Make sure to compare Philips Baristina alternatives before purchasing.

[[Explore Top Rated philips baristina review on Amazon.]](https://storeins.com/led-mask/?kw=philips baristina review)
## Expert Tip: Optimizing Your Philips Baristina Experience

To get the most out of your Philips Baristina, consider these tips:

*   **Use fresh, high-quality coffee beans:** The quality of your beans directly impacts the taste of your espresso.
*   **Experiment with grind settings:** Adjust the grind size to fine-tune the extraction and flavor. Use the manual to know 'philips baristina how to use' this setting.
*   **Descale regularly:** Follow the manufacturer's recommendations for descaling to prevent mineral buildup and maintain performance.*   **Clean the machine frequently:** Regular cleaning ensures consistent coffee quality and prevents clogs.*   **Consider accessories:** Philips Baristina accessories like milk pitchers and tampers can enhance your coffee-making experience.
*   **Consult the user manual:** Familiarize yourself with all the machine's features and settings to optimize its performance. If you lost the manual it can most likely be found online, just search “Philips Baristina user manual”.

[[Explore top Rated philips baristina review on Amazon.]](https://storeins.com/led-mask/?kw=philips baristina review)
## philips 2200 series review

It's essential to understand the relationship between the Baristina and other similar models. The Philips 2200 series, for example, contains some of the same technology as the Baristina. Reviewing customer reviews of the 2200 series might give you insight into the reliability and performance of relevant components.

[[Explore Top Rated philips baristina review on Amazon.]](https://storeins.com/led-mask/?kw=philips baristina review)
## Final Verdict: Is the Philips Baristina Worth It?

The Philips Baristina automatic espresso machine offers an excellent balance of convenience, quality, and affordability. It's a grate option for coffee lovers who want to enjoy fresh espresso at home without the hassle of manual espresso machines. While it may not offer the same level of customization as higher-end models, its ease of use, compact design, and consistent results make it a worthwhile investment for many.

Whether its superiority over pod machines or the Philips' LatteGo System, the baristina presents itself highly.

Ultimately, the decision of whether the Philips Baristina is worth the hype depends on your individual needs and preferences. Consider your budget,coffee-making experience,and desired level of control before making your final choice. But if you're looking for an easy-to-use, compact, and affordable bean-to-cup espresso machine, the Philips Baristina is definitely worth considering.

[[Explore Top Rated philips baristina review on Amazon.]](https://storeins.com/led-mask/?kw=philips baristina review)",1,1745095810.0,Water_flosser_systems,0,1.0,False
1k35zeh,https://i.redd.it/ko888fcktuve1.jpeg,Embrace – My New Coffee Painting. Would Love Your Thoughts!,,8,1745095734.0,ARTIST,4,1.0,False
