id,url,title,text,score,created_utc,subreddit,num_comments,upvote_ratio,over_18
1pj6pr6,https://www.reddit.com/r/midinmod/comments/1pj6pr6/a_cozy_christmas_home_mid_in_mods_holiday_sale_up/,A Cozy Christmas Home: Mid in Mod’s Holiday Sale Up to 65% Off,"https://preview.redd.it/h5zfp8foie6g1.png?width=1920&format=png&auto=webp&s=563b059fb1ba4395c2582a40b7f004d1abbd4aff

The holidays always carry a special kind of feeling. The lights, the cold air, the quiet evenings, and the slow moments at home. This time of year naturally makes us want warmth, softness, and comfort in every room. If you have been thinking about refreshing your space, the Christmas Sale at Mid in Mod is the perfect moment. With discounts up to 65%, it is easy to bring home pieces that look good, feel good, and make the season brighter.

Mid in Mod is loved for its clean, simple, and timeless [mid century modern furniture. ](http://www.midinmod.com)These pieces fit into most homes without effort. They feel modern but familiar, stylish but cozy. If you enjoy soft lines, real wood tones, bold colors, or classic shapes, you will find something that speaks to you. And with Christmas just around the corner, it’s comforting to know you can update your space without stretching your budget.

The sale includes everything from sofas to lamps, bed frames, accent chairs, tables, and more. Whether you want an **l shaped couch**, a warm **mid century coffee table**, or a new piece for your bedroom, you will find options that blend style and comfort. This season is about creating calm and making room for joy, and your home deserves that feeling too.

# The Heart of the Home

The living room becomes a gathering space during the holidays. It’s where people talk, watch movies, rest after a long day, or open gifts on Christmas morning. Mid in Mod has many pieces that fit beautifully into this season of togetherness.

The Floyd Cognac Vegan Leather Modular Sofa brings a warm tone and a strong presence to the room. Its modular design lets you create the shape you need, and the cognac color adds a rich layer to any space. It’s simple, modern, and perfect for rooms that need a warm anchor.

If you like big seating areas, the Dexter U-Shape Corner Sofa in Cream Corduroy is soft, spacious, and designed for comfort. It fits well in open living rooms and makes everyone feel welcome. It brings softness and a calm tone to the home, which is exactly what the holidays often call for.

For a touch of color, the Kyle Linen Lounge Chair in Teal is a beautiful choice. It adds personality without overpowering the room. Accent chairs like this transform quiet corners and make them feel special.

A **midcentury modern TV stand** or a simple wooden table can help pull everything together. Clean lines and charming wood tones are easy to pair with many design styles. That is why mid-century pieces continue to blend so well into modern homes.

[Floyd Cognac Vegan Leather Modular Sofa From Mid in Mod](https://preview.redd.it/g6y1as6qie6g1.jpg?width=800&format=pjpg&auto=webp&s=3bccfad31941e2daa5a0db82a5372dc68c36e5d2)

# Calm Nights and Soft Mornings

The bedroom is the place where you end long days and start slow mornings. During winter, a quiet and cozy bedroom feels even more important. Mid in Mod has many pieces that support rest and calm living.

The Divani Platform Bed in King is a strong and simple frame that adds balance to the room.  
 Its clean look works with many bedding textures and colors, making it easy to create a peaceful retreat.

To add soft lighting, the Aura Black Table Lamp brings a gentle glow and a simple design. Warm lighting can change the whole feeling of a room, especially in winter.

For everyday storage, the Noak Solid Wood Night Stand adds neat organization and natural charm. The wood tone blends beautifully with mid-century decor and helps keep your space clean and grounded.

These pieces support a calmer daily rhythm, especially during the busy holiday season.

[Dexter U Shape Corner Sofa From Mid in Mod](https://preview.redd.it/df5kv9l4je6g1.png?width=1920&format=png&auto=webp&s=40050e4b1d80df94bd1e40059517153d6ad1380c)

# A Table for Gatherings

Meals are a big part of the holidays. Breakfast with family, warm dinners, long conversations over dessert. A good table helps create moments people remember for years.

The Abbott Dining Table offers a simple, timeless shape.[](https://midinmod.com/products/abbott-dining-table) It’s spacious enough for holiday meals and practical enough for everyday use.

To complete the look, the Abbott Solid Wood Bench provides comfortable seating and a warm, natural feel. Benches are great for hosting because they offer flexible seating for both small and large groups.

With mid-century design, dining areas feel open, relaxed, and ready for celebration.

# Simple Holiday Comforts

Shopping for Christmas can be stressful, but Mid in Mod makes it easier. The brand offers **FREE SHIPPING**, which helps keep the holiday budget under control. For people who want a smooth, hands-off setup, the **White Glove Delivery Service** is available. And the **satisfaction guarantee** offers peace of mind while choosing pieces that will stay in your home for a long time.

[Abbott Mid Century Modern Dining Table and Dining Chair From Mid in Mod](https://preview.redd.it/wmw7v7rwie6g1.jpg?width=800&format=pjpg&auto=webp&s=d7ba6d4b91de0b6fbd077199ac7d5bc7ad38dc9e)

# Making Space for the Season

There is something special about refreshing your home during the holidays. New pieces bring new energy. A comfortable sofa invites long movie nights. A new chair makes a reading corner feel alive. A warm lamp softens the whole room. A new bed frame helps you rest better during cold winter nights.

Every space you update becomes a small gift to yourself.

This Christmas Sale is a chance to bring comfort, style, and calm into your home. With up to 65% off, you can choose pieces that last beyond the season and grow with you through the years. Mid-century design has a way of staying beautiful over time. Its lines are simple, its materials feel natural, and its shapes blend easily with changing styles.

Whether you are decorating your first apartment, updating a family home, or gifting furniture to someone special, Mid in Mod has thoughtful options. From an **l shaped couch** to a **mid century modern couch**, from lamps to benches, from tables to chairs, each piece can help you build a home that feels true to you.

Let the season inspire you. Let your home feel warm, calm, and ready for the moments you want to create. Explore the Christmas Sale, take your time, and choose pieces that make your home feel loved.

",1,1765383413.0,midinmod,0,1.0,False
1pj6p7h,https://www.reddit.com/r/DotA2/comments/1pj6p7h/guy_serving_coffee_text_emoticon/,Guy serving coffee text emoticon?,"Sometimes when I watch high level pubs, players will all chat this all-text emoticon of a smug guy serving or holding a hot drink/coffee. Does anyone know what I'm talking about and can share? Thanks!",1,1765383380.0,DotA2,0,1.0,False
1pj6oxh,https://www.reddit.com/r/waterloo/comments/1pj6oxh/snow_photowalk/,Snow photowalk,"Hey, anyone up for a photowalk today? Ideally in Waterloo park? The fresh snow and warm weather is making it a perfect opportunity, would be cool to make friends along or grab some coffee afterwards!
Lmk/ DM",1,1765383364.0,waterloo,0,1.0,False
1pj6oky,https://www.reddit.com/gallery/1pj6oky,Delulu is the only solulu for OP! Out,"I sat in the corner of the cafe, holding a mug of caffe mocha, waiting. The place was warm and quiet, filled with the soft hum of conversation and the smell of fresh coffee. I wasn’t sure why I felt so nervous, but there was a flutter in my stomach as I waited for her, t***he girl in the black dress***. Any moment now, I thought, glancing at the door again. I took a sip of my coffee, trying to calm my nerves.

Then, she walked in.

Her dress was simple but perfect. She looked around the room, and when our eyes met, she smiled. Something about that smile made my heart skip. ***""Are you the one I'm meeting?""*** she asked softly. I stood up, a little surprised at how easily the words came out. ""***Yeah, that's me. I ordered a caffe mocha.***""

We sat down and started talking. At first, it was just small talk about the weather and the coffee, but soon the conversation flowed easily. She had a way of making everything feel natural, like we had known each other for a long time. The more we talked, the more I felt like I was floating. There was something about her that made everything else fade away, like my worries didn’t exist anymore.

Then, as we were talking, she reached out her hand, like she wanted to shake hands or maybe something more. Just as I was about to take it, the waiter’s voice broke the moment. ***“Excuse me, your order is ready.”*** I blinked, confused. The girl in the black dress was gone. The table was empty, and the cafe was just as it was before. I looked around, but she wasn’t there.

Okie okiee stawwpp thittifying me!!!!! Oka 3-4 days nundi vipareethamaina pani valla stress barinchaleka me and my frnd decided to visit a cafe and take a break for a while. Ala cafe ki velli rendu cappuccino tiskunam, vadiki cappuccino nacchale, lotus biscoff order cheskoni thagesadu, nen fritters tinesi kurchoni ala muchata eskoni ochesam idhi sangathi.",1,1765383342.0,MaaOoriVanta,0,1.0,False
1pj6ojy,https://www.reddit.com/r/LibraryScience/comments/1pj6ojy/best_receipt_organizer_apps_that_scan_and_manage/,Best receipt organizer apps that scan and manage receipts?,"I asked on Reddit a while ago: “What’s the best app to scan and manage receipts — so I
don’t lose paper receipts, and I can easily track my spending and expenses?”


One user recommended an app called [Receipt Scanner Track Expense](https://secure-acs2ui-b4-indmum-munmdc.wibmo.com/v1/acs/services/browser/creq/L/8198/aa4b0468-c23a-11f0-8a8f-7336fe43c7ad), and I thought:
“Hmm, too good to be true — but I gave it a try.”


Turns out… it **really works**.
I snapped a picture of a crumpled grocery receipt. The app detected the total amount, date,
vendor name — all automatically. I didn’t have to input anything manually. Boom — the
receipt was saved forever, safe in the cloud, no more shoebox full of paper.


Since then, every purchase — groceries, work‑related expenses, even a random coffee —
goes through the app. It organizes them by category (food, tools, bills, etc.), and after a few
weeks it started giving me cool analytics — charts showing where my money goes, how
much I spend per month, and which categories are bleeding funds.


Now I have a neat little dashboard of my spending habits for this year. I use it for my
freelance projects to track business expenses vs personal ones. It’s a game‑changer —
saves time, stress, and helps me see exactly where my money is going.


If you hate keeping paper receipts and want a simple, painless way to track expenses, I
highly recommend trying [Receipt Scanner Track Expense](https://secure-acs2ui-b4-indmum-munmdc.wibmo.com/v1/acs/services/browser/creq/L/8198/aa4b0468-c23a-11f0-8a8f-7336fe43c7ad).",1,1765383340.0,LibraryScience,0,1.0,False
1pj6nor,https://www.reddit.com/r/CoffeeWatch/comments/1pj6nor/welcome_to_rcoffeewatch_introduce_yourself_and/,👋Welcome to r/CoffeeWatch - Introduce Yourself and Read First!,"Hey everyone! I'm u/SlimHedgehog, founding moderator of r/CoffeeWatch.
This is our new home for all things related to watches & coffee. We're excited to have you join us!

What to Post
Post anything that you think the community would find interesting, helpful, or inspiring. Feel free to share your thoughts, photos, or questions about watches & coffee.

Community Vibe
We're all about being friendly, constructive, and inclusive. Let's build a space where everyone feels comfortable sharing and connecting.

How to Get Started
1) Introduce yourself in the comments below.
2) Post something today! Even a simple question can spark a great conversation.
3) If you know someone who would love this community, invite them to join.
4) Interested in helping out? We're always looking for new moderators, so feel free to reach out to me to apply.

Thanks for being part of the very first wave. Together, let's make r/CoffeeWatch amazing.",1,1765383287.0,CoffeeWatch,0,1.0,False
1pj6n0x,https://www.reddit.com/r/ConvertingtoJudaism/comments/1pj6n0x/when_were_you_expected_to_become_a_paying_member/,When were you expected to become a paying member of the temple you were converting into?,"In US, planning to convert with a rabbi of a nondenominational liberal congregation. Very early in the conversion process -- I know I want to become Jewish and convert and have enjoyed talking to this rabbi of a temple that is close to me and I enjoy their services.

 However, this rabbi said I need to become a paying member before we move forward, and I think the timing of her bringing it up really rubbed me the wrong way (we've only met once for coffee), so I would like to know what is ""normal"" for this kind of thing. It's a significant amount of money, which would be hard to swing for me right now. She did say they could be flexible, but said that a little bit as an afterthought. She also said I would have to talk to a committee about financial flexibility, which feels icky and vulnerable. 

I really love this shul, but I haven't explored other synagogues in the area yet at all, so committing $1500+ to this one just so I could start my conversion feels like too much too soon. I'm not opposed to one day becoming a paying member, but I haven't met many people beyond the rabbi and don't know if this is my home yet. But I also don't want to postpone my conversion process because I'm nervous to put my money down on one shul. 

I would love to hear when you were expected to become a paying member (if at all) while converting, or any advice for me!",1,1765383243.0,ConvertingtoJudaism,0,1.0,False
1pj6m5j,https://i.redd.it/rnh7qr1kie6g1.jpeg,At my school fuck,,1,1765383189.0,Fuck67,0,1.0,False
1pj6m4y,https://www.reddit.com/r/Divorce_Women/comments/1pj6m4y/questions_about_divorce_costs_in_colorado_seeking/,Questions about divorce costs in Colorado. Seeking advice on keeping it affordable.,"I'm based in Colorado Springs and just beginning the divorce proceedings after a rocky 11-year marriage to my husband, and I'm trying to get a handle on what this is all going to cost without it spiraling out of control. We tied the knot back in 2014 in a simple courthouse ceremony in Pueblo, both of us in our late 20s and excited about starting a life together—he was working as a mechanic at a local auto shop, and I had a job as a teacher at an elementary school nearby. Things were good at first; we rented a small apartment in the Springs, saved up for a down payment on a modest two-bedroom house in Fountain with a monthly mortgage of about $1,900, and even adopted a rescue dog named Max who became like our first kid. But over time, the cracks started showing—little arguments turned into big ones, like when he'd forget to pick up groceries after work, leaving me to scramble for dinner with whatever was in the pantry, such as canned soup and crackers, or when I'd get frustrated about him leaving oily tools scattered in the garage, making it hard to park my car without tripping over wrenches.

The bigger issues built up around money and our lifestyles drifting apart. He got a promotion a few years ago that had him working longer hours, pulling in about $55,000 a year, while my salary as a teacher hovered around $48,000, and we started clashing over bills—like who'd pay the $150 monthly utility or the $300 car insurance premium. We'd have these tense evenings sitting at the kitchen table, going over bank statements on my laptop, arguing about why there was an extra $50 charge for his lunch runs to fast food places. Then came the parenting disagreements after our son was born five years ago; he's now in kindergarten at the school where I teach, and we'd fight about discipline, like whether it was okay for him to watch cartoons on the tablet before bed or if I was too strict about bedtime routines, reading him stories from his favorite dinosaur books until he fell asleep. There was a particularly bad incident last winter when we planned a family ski trip to Breckenridge—I'd packed the car with snacks like granola bars and thermoses of hot chocolate, plus our son's little skis—but we ended up bickering the whole drive about navigation because the GPS rerouted us due to snow, and we turned back home frustrated, with our son upset in the back seat asking why we couldn't go play in the snow.

Emotional distance grew too; I noticed he was spending more time at the bar with coworkers after shifts, coming home smelling like beer and barely talking, while I'd be left handling the household alone, folding laundry in the living room late at night or prepping lesson plans for my class. I confronted him about some flirty messages I saw on his phone from a woman at work, nothing proven but enough to shatter trust, and we attempted marriage counseling three times at a clinic in downtown Colorado Springs, in a plain room with motivational posters on the walls, but it felt pointless—he'd promise to communicate better, but then we'd revert to silence during meals, eating simple things like grilled cheese sandwiches without much conversation. Eventually, we agreed to separate; he's moved into a rental apartment about 10 miles away in Security-Widefield, and we're sharing custody of our son on a week-on, week-off basis, but it's logistically tough, like coordinating who takes him to soccer practice on Wednesdays at the community field or handles his dentist appointments for check-ups every six months.

Asset-wise, it's getting complicated under Colorado's equitable distribution rules—we have the house with roughly $120,000 in equity built up, a joint savings account down to about $6,500 after recent withdrawals for repairs like fixing the leaky roof that cost $2,000, his truck with a remaining loan of $8,000, my sedan that's paid off but needs new tires soon at around $400, and smaller items like the living room set we bought on sale—a comfy blue couch and matching chairs that the dog loves to nap on—plus kitchen stuff such as our blender for making smoothies and the coffee pot I use every morning for my black coffee ritual. We're also splitting retirement accounts; he has a 401(k) worth about $35,000 from his job, and I have a pension starting to accrue through the school district.

To prepare, I dove into researching divorce costs in Colorado online, hoping to avoid the financial pitfalls I've read about. From what I found, the average here is around $11,500, which is a bit lower than the national average of $15,000, probably due to differences in living costs across states. But it can vary wildly depending on how contentious things get—I've seen examples of people paying $10,000 just for an initial retainer, then racking up bills over $200,000 in drawn-out battles with aggressive lawyers who bill by the hour and drag things out. On the flip side, super cheap options like a $500 do-it-yourself divorce can backfire, leading to mistakes that cost tens of thousands to fix later. Factors like the number of disputes, how heated the arguments are, and whether you go the litigation route (which amps up the conflict and hours billed) versus something more collaborative really impact the total. One approach that caught my eye avoids the traditional billable hour mess, which apparently incentivizes prolonging cases; instead, it starts with a low opening fee (way less than those big retainers) and then a fixed monthly rate based on the service level you pick, and that rate stays the same no matter how long it takes, stopping once the divorce is final. They even offer add-ons like coaching or parenting coordination at flat fees, and you can keep using resources afterward for life changes without surprise costs. It sounds predictable and less stressful, especially since our case might involve some disputes over the house and custody details, like who gets primary parenting time during school holidays or how we handle extracurricular costs for our son's activities, which run about $100 a month.

Has anyone in Colorado gone through this and can break down what you actually ended up paying, maybe with tips on mediation versus court to keep expenses down? What red flags should I look for in lawyer agreements to prevent hidden fees, and is it worth exploring fixed-rate options over hourly billing? Any advice on handling the paperwork for things like child support calculations, based on our incomes and the standard guidelines here?",1,1765383188.0,Divorce_Women,1,1.0,False
1pj6lgp,https://i.redd.it/3o4xd8saie6g1.png,I Have 5 Credits in Fineshare Vora,,2,1765383144.0,SoraAi,5,1.0,False
1pj6kpo,https://www.reddit.com/r/cabincrew/comments/1pj6kpo/item_that_saved_my_sanity_during_three_connecting/,Item that saved my sanity during three connecting flights and a very long conference,"Let me tell you about the worst travel day of my life and the one thing that saved me. I had a conference in Singapore with three connecting flights. Chicago to Los Angeles. Los Angeles to Tokyo. Tokyo to Singapore. Twenty-three hours of total travel time. And naturally everything that could go wrong did.

My first flight got delayed. Which made me miss my connection. Which meant scrambling to get rebooked. Which meant my checked bag ended up somewhere in the Pacific while I ended up at a hotel near LAX at midnight with nothing but my cabin luggage.

Thank God for that cabin luggage. I'd packed it smart. Change of clothes. Toiletries. Phone chargers. My laptop and all my conference materials. Medication. Even a small towel because you never know. While everyone else at the airline counter was panicking about their checked bags I just shrugged and went to find coffee.

The next morning I made my rebooked flight. I arrived in Singapore twelve hours later than planned but with everything I actually needed. My presentation went fine. My clients never knew the chaos. And I learned that packing light isn't about having less. It's about having exactly what matters.

That bag came with me on every trip after that. It forced me to think about what I really needed versus what I thought I might need. Turns out you need a lot less than you think. I'd bought it years ago during a random shopping session on Alibaba and it became my most valued travel companion. Sometimes the practical purchases are the ones that matter most.",1,1765383099.0,cabincrew,0,1.0,False
1pj6jzv,https://www.reddit.com/gallery/1pj6jzv,Zepto just killed itself,"Zepto just shot itself in the foot

The latest UI update is a massive step backward.

One of Zepto’s biggest advantages was its exciting, feature-rich but intuitive interface. Categories like Fresh, Sales, Cafe and Price Drops made browsing genuinely fun and effortless. That edge is now gone.

What really set Zepto apart was that it showed product prices directly on the front pages. You didn’t have to tap into multiple screens just to see prices. That convenience alone is why I preferred it over Blinkit and Instamart.

Now the UI feels too fckin generic, pricing visibility is worse, and there’s no proper filtering either. Instead of doubling down on what made them different, they’ve regressed into a more frustrating shopping experience.
",1,1765383056.0,FuckZepto,2,0.67,False
