id,url,title,text,score,created_utc,subreddit,num_comments,upvote_ratio,over_18
1i8cpnu,https://www.reddit.com/r/HummerEV/comments/1i8cpnu/v2l_adapter/,V2L Adapter,"Has anyone used a V2L adapter? 
You can’t run a coffee maker off the outlets provided. I see that the H EV has bi-directional charging. The idea is using the charging port to power things that draw a good amount of power. I’ve seen pics of one hummer charging another. I’m just looking for a power strip that will work. ",1,1737663064.0,HummerEV,0,1.0,False
1i8coc2,https://www.reddit.com/r/IndiaCoffee/comments/1i8coc2/grinder/,Grinder,So I'm a newbie in coffee and am looking to buy a coffee grinder under 2500-3000 any recommendations?,1,1737662970.0,IndiaCoffee,0,1.0,False
1i8co6u,https://www.reddit.com/r/QuitVaping/comments/1i8co6u/21_days_clean_feeling_alive/,21 days clean - Feeling alive,"
I’m early 30s and picked this habit up during the pandemic. I’d normally use disposable vapes. A standard geekbar would last me anywhere between 15 - 20 days. It originally started as hitting someone’s vape during drinking, then hitting it even when not drinking, then got my own, and finally started vaping during the day.

Working from home made vaping even easier.

I’m 21 days clean. First week was pretty terrible. I was irritable, had brain fog, wasn’t really feeling like myself. Sleep quality at night was also terrible. 

Now, sleep quality at night has shot up. Cravings are at a bare minimum. My cardio recovery improved as per my Apple Watch from from 25 to 32 in the last 3 weeks.

Things that are working for me:
1. Long walks to clear my mind
2. Lots of water
3. Coffee during the day
4. Some sweets here and there

Hoping to stay clean from now on. Nicotine is one hell-uva drug. ",1,1737662959.0,QuitVaping,0,1.0,False
1i8cnam,https://www.reddit.com/r/espresso/comments/1i8cnam/question_daily_moka_pot_user_here_wondering_if_i/,[Question] Daily Moka Pot user here. Wondering If I should start my espresso journey or not.,"Hello All,

As the title states, I believe I am being heavily influenced by instagram and am interested in starting my espresso journey (Probably with a Breville Bambino Plus). I currently use a Moka Pot each morning since I no longer own a coffee machine. I also have a percolator which I havent dialed in yet and mostly collects dust. 

While I enjoy a cup of coffee, I drink it more out of a necessity than a love for it (or maybe I do love it?). I do own a grinder and do seek out high quality beans. I am the only coffee drinker in my household. I drink it black and make it americano style after brewing in the moka. 

If I were to start an espresso journey I would be making espresso 70 percent of the time Americano Style, 20 Percent straight up and 10 percent latte. Now this sounds like I have already made my decision but I am wondering if in the long run Ill get sucked in and enjoy the espresso journey or realize I didnt need to go there and maybe could have made my coffee a different way based on how I consume it. I am very undecided on this matter and wanted to know this communities thoughts. 

Thanks!
",1,1737662896.0,espresso,0,1.0,False
1i8cmm4,https://www.reddit.com/r/Indianlaw/comments/1i8cmm4/your_rights_simplified_indian_law_for_a_common_man/,"Your Rights, Simplified: Indian Law for a Common Man","Let’s be honest—legal jargon has always left most people utterly baffled. To most Indians, the entire Indian legal system appears to be a maze, filled with complex terms and processes hardly comprehensible except to lawyers. That's where **Indian Law for a Common Man by Sree Krishna Seelam** steps in. The book is reminiscent of a friend helping you through mental roadblocks, offering a step-by-step tutorial on the basics of Indian law.

With this book, you can learn the core principles of Indian law in three hours flat! From constitutional interpretation to criminal, civil, property, and cyberspace law, readers are presented with all the essentials explained in lucid, conversational language.

But the journey doesn’t end there. It also discusses what you owe society—an essential balance to cultivate in a society that often adopts a ""look but don’t touch"" attitude when precedence clashes with personal interests.

One of the book's greatest strengths is its conversational tone. Sree Krishna Seelam unravels intricate topics of law in such a manner that it feels like a conversation with a friend over coffee. He simplifies fundamental rights into digestible concepts with clarity and precision.

It’s not just theoretical either. The author provides practical advice on how to navigate legal challenges, such as filing a case, settling disputes, and protecting oneself from cybercrime. Given his approach to such a complex subject—breaking it down into relatable, coffee chat-like discussions—it’s hard not to applaud this book.

For instance, Sree Krishna Seelam condenses complex legal concepts, like the Right to Equality and the Right to Freedom, into clear, easily absorbed ideas. Furthermore, the book imparts essential knowledge about applying the law, from initiating a suit or grievance to protecting oneself against cybercrime.

What makes this book truly stand out is its accessibility. It’s not just for students or legal enthusiasts; it’s for everyone. A homemaker, a professional, an activist, or anyone curious about their rights can benefit from it. If you’ve ever been intimidated by the legal system, this book will change that. It empowers you with knowledge and demonstrates that the law isn’t something to fear but a shield to protect you.

Finally, **Indian Law for a Common Man** is not just a book; it’s a source of empowerment and awareness. In a world where ignorance often leads to exploitation, this book provides knowledge and actionable information to help individuals protect themselves and others.

If you’ve ever thought, “I wish I understood my rights better,” this book is the perfect starting point. Its insights may be straightforward, but their impact will stay with you for a lifetime. Highly recommended! **Grab your copy here:** [**https://amzn.in/d/fa4ZgL2**](https://amzn.in/d/fa4ZgL2) **.**

",1,1737662848.0,Indianlaw,0,1.0,False
1i8cmft,https://i.redd.it/lf73bx5rvsee1.jpeg,"Ray is the biggest jerk on the show, constantly putting down Donna and pouting because she didn't make his coffee. His temper goes from zero to 60 gritting his teeth anytime she talks to him. Ugh",,2,1737662835.0,Dallas_TV_Show,1,1.0,False
1i8cm5w,https://www.reddit.com/r/loseit/comments/1i8cm5w/my_success_story_and_the_video_that_started_my/,my success story and the video that started my journey,"Here's the video that changed the way I think about the body and metabolic health:
* https://www.youtube.com/watch?v=4DWKf5RqU-s

**DISCLAIMER**

I am not a doctor.  Below is what worked for me.  Always partner with your doctor before doing something like this.

**PREMISE**

Everything here is centered around controlling/reducing insulin, and elimination of insulin resistance.  Insulin dysfunction is at the center of most ailments nowadays, including obesity, diabetes, heart conditions, Alzheimer’s and even cancer.  The body produces insulin in response to the presence of glucose in the blood, so that’s the primary mechanism we’ll use below to control insulin.  For more information on this search for podcasts/articles by Jason Fung and Robert Lustig.  Their interviews on Diary of a CEO are literally life changing.



This routine has three components: diet, fasting, and exercise.   Hands down fasting is most important, diet second, and exercise third.



**FASTING**

Fasting gives your body a break from processing macronutrients.  One the carb side, the reduction in glucose will give you long periods without insulin.  Insulin is a storage horomone used to store glucose into fat.  Your body cannot burn fat while insulin is high, so fasts allow your body to be able to pull energy from fat.



Additionally, fasting gives you a break from protein ingestion, which forces your body to recycle malformed cells/tissue internally, a process known as autophagy.



There are several types of fasts.  Many people refer to “intermittent fasting” with notation as 16:8, 18:6, 20:4.  The first number is how long you go without food, the second is your eating window.  Some people refer to these schemes as “time restricted eating” and will reserve the term “fasting” for extended fasts of 24 hours or more.



There’s also OMAD (one meal a day) which is basically a 23:1 fast.  And there’s ADF where you fast completely every other day, which looks a lot like 36:12.  And you can do one-off 24, 36, 48, or 72 hour fasts.



On a fast, you can consume water, carbonated water, black coffee, or green tea.  And that’s it.  For fasts longer than 24 hours you may feel cramping, heart palpitations, headaches, or faint.  This is a sign of low electrolytes.  You need to consume electrolytes during a long fast (every 12-18 hours).  I use LMNT brand.


You will feel hungry during these fasts, but hunger isn't pain.  You can often eliminate hunger by going for a walk, having some electrolytes, or having some carbonated water.  Or just wait a few hours and it'll fade.  


**My Scheme:** I did a modified ADF, fasting for 36 hours, 2-3 times a week.  Usually Friday, Sunday, and Wednesday, but sometimes that varied.  On non fasting days, I ate during a 12:12 window, usually from 7:30a to 7:30p.



I had to build up to this.  I started by doing a 16 hour fast just on Sundays, and 12:12 every other day.  Every Sunday, I added an hour to the fast until I was at a full 24 hours.  After 4 weeks of that, I jumped to my first 36 hour fast.  It was super hard.  The following week I did it again, and it was less hard, and continued to get easier.  After a couple months of a weekly 36 hour fast I started to add a second day (Wednesday), by first doing a 16 hour fast that day, then the next week doing an OMAD that day, then the next week making it a 36 hour fast.


In general I’ve found the easiest fasts are sleep-to-sleep fasts where I stop eating before bed, fast the entire next day, go to bed fasted, and eat again after waking up.  This matches a 36 hour and 60 hour pattern.  Anything where I stop eating early in the day, or I have to wait most of the day before breaking my fast… just doesn’t work for me.  That matches 24, 48, and 72 hours.



I break the fast easy, with either an avocado, kimchi, some kefir, or scrambled eggs.  You’ll want to be near a toilet for a few hours your first few times.


I’ve done two longer fasts at 60 hours, about 3 months apart, to kick me out of a plateau.  Those were crazy hard but it worked and I felt amazing for days after.  I’m going to reserve these to every 3-4 months.



**DIET**

I do a healthy keto diet.  I avoid sugar (including fruit), most starches (including bread, pasta, rice, and potatoes), seed oils (canola, safflower, sunflower, cottonseed, corn, peanut, soybean, “vegetable”), and ultra processed foods (all the chemicals).  I will eat some beans/lentils in moderation, infinite vegetables, and meat/egg/cheese.  You can put olive oil on things, but I don’t heat it up.  I cook with either tallow, ghee, coconut oil, or algae oil.



I don’t count calories ever.  I eat until I’m full.  I try not to snack too much and instead carbonate water helps me feel full if I want a snack.  My typical breakfast is steak and 4 eggs or a 6 egg omelette with cheese and bacon.  My typical lunch is a large salad with about a pound of salmon and no dressing, or pulled port on a pile of broccoli (no sugary sauces).  My usual dinner is a half a chicken (one breast, thigh, leg, and wing) with a bunch of sautéed veggies.  If I ever have a snack, its once in a day and it’s a small amount of jerky, some cheese, some peanuts/macadamia/pistachios, or celery with peanut butter (real stuff, no additives).



I will have a cheat meat every couple weeks or so: go out for pasta or have ice cream with my daughter.  This isn’t a cheat day, just a meal.  And I usually position it the day before a fast.



**EXERCISE**

Two types here: walking and weight training.



Walking, I do 4 miles 1-2 times a week with the dogs, usually on a weekend and almost always on a fasting day.  Additionally, go for a short 10 minute walk after dinner whenever you can.



I do weight training 3-4 times a week. I never weight lift on a fasting day, but I will always workout fasted (e.g. before the 7:30am meal on an eating day).  I do the typical thing here: leg day, back/bi day, chest/tri day.  My workouts are usually 60 minutes with about 15 of that reserved for warmups before and stretching after.  I found time for this by getting up at 5am, 90 minutes earlier than normal.  Only thing I could make work.


**MEDICAL TESTS**

In addition to losing the weight, I did hydro static testing.  Only 15 pounds was lean mass loss, and I even think that’s high since my baseline tests were after eating, and my follow ups were fasted.  The guy running the test says this ratio is slightly better than he usually sees for fat loss.  He sees 25% lean reduction where I’m only 20% (and again I think that’s inflated by at least 5 pounds because of how I ate before the first test).

My triglycerides are down 40%, my cholesterol dropped to 160 with my HDL increasing, cardiac inflammation markers down 50%, and kidney/liver/gallbladder function improved.  Liver fat isn’t an issue anymore (ALT went from 55 to 20) and my A1C went from 5.7 to 5.5 as of 4 months ago (retesting next week).


**MAINTENANCE**

Not sure what’s gonna work for me for maintenance, so what I’m planning is to drop to a single 36 hour fast per week (turning it into a 60 3-4 times a year), introduce berries and possibly sweet potatoes into my diet, and then change nothing else.


**NOTE ON ALCOHOL**

I mostly quit drinking.  I don’t think there’s a way really make it work.  Theoretically your body can process up to a drink a day without causing harm, but that will occupy your liver from doing other work for your body.  Since I’ve started a year ago I’ve drank maybe 8 times, and when I do I’ve maxed out at 2 drinks, but was mainly just one drink.  Non-alcoholic beer tastes good nowadays and seems pretty socially acceptable, so you can always nurse one of those on occasion (though they have carbs).",1,1737662817.0,loseit,0,1.0,False
1i8cl8s,https://www.reddit.com/r/Jersey/comments/1i8cl8s/recommendations_for_food/,Recommendations for food,"Apologies, if my posts have (or are) becoming a bit annoying but need suggestions for:
1.  Best desert/brownie/cupcakes in the jersey
2. Best coffee in the jersey 
3. Best crispy chicken burger (asking for kids, like kfc and McDonalds. Yes i know they are here)
4. Best pizza in jersey (good pizza not something with tomato paste :( ) 
5. Best pasta
6. Anything that is must try in jersey.


Thanks in advance",1,1737662751.0,Jersey,1,1.0,False
