id,url,title,text,score,created_utc,subreddit,num_comments,upvote_ratio,over_18
1idrp0m,https://www.reddit.com/r/amazoneero/comments/1idrp0m/will_my_older_devices_work_with_the_max_7/,Will my older devices work with the Max 7?,"I am planning to buy the Max 7 in the near future.  I have upgraded through several versions of Wi-Fi and never had an issue with backwards compatibility with older devices/clients.  From what I'm reading Wi-Fi 7 is backwards compatible with previous versions of Wi-Fi.  I also read though that due to the enhanced security of it Wi-Fi 5 devices and up work but Wi-Fi 4 (802.11n I believe) do not work.  Is this true?  It seems conflicting.

My main devices such as laptops, smartphones, streaming boxes, etc. all are either Wi-Fi 5 and up.  When going through my devices I saw a few device I have are just 802.11n.  These include a Vizio Smart TV, an Ecobee 3 Lite Smart Thermostat, a HomePod mini, Govee Christmas Lights, Govee Strip Lights, Nanoleaf Shapes, an Atomi Smart Coffee Maker which I have not found the specs but believe it may be 802.11n, Google Nest Protect Smoke/Co Alarms, Twinkly Lights that don't show in specs but may be 802.11n, plus a couple Meross smart lights that I suspect are 802.11n.  Also an Epson Wi-Fi Printer.  

I have a lot of smart devices but fortunately the others are mostly either connected via hubs directed to my switch with Ethernet cables or via Thread protocol which is what I'm trying to go towards.  Again my computers, Apple TV streaming boxes, iPhones, etc are all WiFi 6 or above.  I think my Apple Watch Series 10 is actually 802.11n.  Yet I have so many 802.11 devices. Are these going to be an issue with a Max 7?  I would hate to upgrade only to find a bunch of my devices will no longer work.",2,1738256623.0,amazoneero,3,1.0,False
1idrony,https://www.reddit.com/r/ShittyLifeProTips/comments/1idrony/slpt_solving_your_outfit_dilemmas_by_permanently/,SLPT: Solving your outfit dilemmas by permanently wearing a clown suit!,"Why struggle every morning to match your clothes when a flamboyant clown suit makes all your wardrobe decisions for you? Plus, you'll never have to explain your life choices again—just juggle your problems away at the nearest coffee shop!",8,1738256598.0,ShittyLifeProTips,2,0.9,False
1idrnef,https://www.reddit.com/r/PhotoshopRequest/comments/1idrnef/remove_the_broken_glass_lines_from_my/,Remove the broken glass lines from my mother-in-law's photo with her best friend,"Edit- SOLVED. Thank you all - I picked u/Brief-Assumption4131 



Hi everyone,

My mother in law is now in a nursing home and wants to display this photo of her and her best friend, BUT, it was stuck to the glass frame which got broken in the move. So, I'm hoping someone way more talented than I am can retouch it to remove the lines from the glass, the flare from my camera on the upper left, and any distorted spots so I can reprint and give to her to display.

Happy to buy you coffee, Monster or whatever else in exchange!

https://preview.redd.it/i2hhhsvrw5ge1.jpg?width=3024&format=pjpg&auto=webp&s=454e2d718d0219e0eeb153aaeffa9efdd33c2625",1,1738256520.0,PhotoshopRequest,14,1.0,False
1idrn7r,https://www.reddit.com/r/TheValleyAnimeClub/comments/1idrn7r/old_newstopics_live_action_atla_welcome_to_derry/,"Old News:(Topics: Live Action ATLA, Welcome to Derry, Star Wars, Spiderman, Gremlins/Goonies)","[https://nerdist.com/article/everything-we-know-about-live-action-avatar-the-last-airbender-season-2/](https://nerdist.com/article/everything-we-know-about-live-action-avatar-the-last-airbender-season-2/)

[https://nerdist.com/article/it-welcome-to-derry-everything-we-know/](https://nerdist.com/article/it-welcome-to-derry-everything-we-know/)

[https://nerdist.com/article/deluxe-star-wars-tables-coffee-table-end-table/](https://nerdist.com/article/deluxe-star-wars-tables-coffee-table-end-table/)

[https://nerdist.com/article/marvel-animation-your-friendly-neighborhood-spiderman-trailer/](https://nerdist.com/article/marvel-animation-your-friendly-neighborhood-spiderman-trailer/)

[https://nerdist.com/article/new-gremlins-goonies-sequels-development-warner-bros/](https://nerdist.com/article/new-gremlins-goonies-sequels-development-warner-bros/)",1,1738256507.0,TheValleyAnimeClub,0,1.0,False
1idrmmj,https://i.redd.it/xwly04jxw5ge1.jpeg,My experience going from swasticar to Air Pure,"I wasn’t sure if I was going to like the Lucid Air Pure coming from a model Y but my god the car is so much quieter and rides better.  It actually feels like a luxury car. I’m 6’ 4” and I fit in the back seat with room to spare. 

I have some gripes about the experience being in the car.  I’m tall so it can be difficult to see the speedometer because the steering wheel is in the way but it’s not critical.  I wish the driving mode I prefer, swift, would stay registered with my profile instead of me having to pick it every time I start the car.  The mobile key can be hit or miss. A few times I’ve had to open the app and wake up the car just to unlock the doors.  This feels like a software fix.  I think these things are very minor. 

On the plus side, my buying experience has been amazing.  Saw the car in studio and began talking  with associates.  I was interested in the Gravity, and still am, but not the Grand Touring model.  Everyone has been super responsive with texts and emails.  I forgot what basic customer service is like because Tesla had none!  The car I wanted (and got), a quantum grey stealth package, was at another studio and they were even helpful to get the car closer. Excellent service all around. 

I just got this car yesterday, and already had to bring it back to be serviced the very next day.  That is a sucky feeling.  The door handle broke. The door stayed locked but you couldn’t open it from the outside.  Lesson learned, don’t accidentally press down on the door handle. I feel like this handle shouldn’t be this fragile.  I’m going to chalk it up to minor bad luck. 

The service center I’m at is super nice and helpful. I arrived before they opened and they ushered me in and directed me to the comfy studio with coffee.  I’ve had no less than three people check on me and offer me things. Wow, basic hospitality too. 

Despite having to bring the car back I still feel like this is the best car and best driving experience you can have for a luxury electric sedan.  

My view while waiting for my car to be fixed. 
",73,1738256469.0,LUCID,23,0.88,False
1idrlrv,https://www.reddit.com/r/barista/comments/1idrlrv/coworker_says_they_dont_want_to_be_scheduled_with/,Coworker says they don’t want to be scheduled with me otherwise they WILL QUIT,"I recently switched to morning opens as of December. I work with my coworker who got hired after me and who always works morning. Well I recently learned that they have been sending rants to the scheduling manager and pushing to meet with the owner all because they dislike working with me. 

Background: this coworker has had multiple spats with other coworkers. The last person they worked with regularly was their “friend” but really the coworker just used them. This person has regularly called out at 4 and 5 am for their open shift causing strain on the owner and the other opener. 

I have worked here for a year or more, I have 4 years in coffee, and I love what I do. During my shifts, I make sure to open properly, make syrups (we make our own in house), restock, clean, and any other necessary things. 

My coworker chooses to make drinks and then sit. She’ll regularly go to the bathroom without notice for 5-7 minutes leaving me to manage customers, drinks, and food. When I happen to be sitting, I may have my iPad open, or scrolling my phone. My coworker will have one drink to make and one customer and will yell at me to “come take their order”. 

I am fine to help where I can but when I am able to manage a line of 3 people, 3 breakfast sandwiches, and drinks it seems a bit annoying that she can’t handle a third of that. 

I found out two days ago she ranted to the scheduling manager saying “I don’t want to be scheduled with her. I’ll work the other locations. Or I’ll quit. She doesn’t listen, she doesn’t talk. She ignores me.” This is very different from what my owner told me later. As he told me she stated that I ignore customers and am always on my iPad. 

Her complaints are interpersonal and could have been solved with chatting with me. Also I don’t talk to her because she typically has a book or during conversation  she makes everything about herself. I am there to work. Not be besties. 

Talking to the owner I explained what I manage to do. How my coworker is often in the bathroom. And they seemed to recognize that this coworker is more of a problem than I am. ",15,1738256416.0,barista,4,0.89,False
1idrlpk,https://www.reddit.com/gallery/1idrlpk,David Lynch coffee by Brandywine Roasters,“Damn Good Coffee”,4,1738256412.0,twinpeaks,2,0.83,False
1idrlm3,https://www.reddit.com/r/CleaningTips/comments/1idrlm3/how_many_times_do_i_run_my_clothes_in_the_washer/,How many times do I run my clothes in the washer?,"

Noticed poop stains on my Uber ride’s seat earlier and had no choice but to sit on it (I was in the passenger seat in front). Would one wash suffice? No idea who and where that was from but it was brown and definitely didn’t look like coffee.

Edit: Wasnt just skid marks, looked like stains from someone having diarrhea ",3,1738256407.0,CleaningTips,3,0.8,False
1idrl3j,https://www.reddit.com/r/laundry/comments/1idrl3j/how_many_times_do_i_run_my_clothes_in_the_washer/,How many times do I run my clothes in the washer?,"
Noticed poop stains on my Uber ride’s seat earlier and had no choice but to sit on it (I was in the passenger seat in front). Would one wash suffice? No idea who and where that was from but it was brown and definitely didn’t look like coffee.

Edit: Wasnt just skid marks, looked like stains from someone having diarrhea ",2,1738256372.0,laundry,4,1.0,False
1idrks2,https://www.reddit.com/r/Gastroparesis/comments/1idrks2/whats_your_emergency_solution_for_constipation/,What’s your emergency solution for constipation?,"I’ve had my fair share of constipation but as of lately nothing seems to work. I feel like I’ve tried everything in the book (even things that usually get me to go like coffee, chai, juices, and warm lemon water) but I haven’t even had a gurgle. I’m already taking a prescribed double laxative and softener daily, but even that’s not doing the trick. Walking a lot every day as well, keeping my diet pretty consistent, and even doing yoga in the mornings.

Nearing the 6 day mark, so any suggestions are greatly welcomed. 🙏",8,1738256348.0,Gastroparesis,22,1.0,False
1idrknv,https://www.reddit.com/r/NoStupidQuestions/comments/1idrknv/how_many_times_do_i_run_my_clothes_in_the_washer/,How many times do I run my clothes in the washer?,"Noticed poop stains on my Uber ride’s seat earlier and had no choice but to sit on it (I was in the passenger seat in front). Would one wash suffice? No idea who and where that was from but it was brown and definitely didn’t look like coffee.

Edit: Wasnt just skid marks, looked like stains from someone having diarrhea ",2,1738256339.0,NoStupidQuestions,3,1.0,False
1idrke9,https://www.reddit.com/gallery/1idrke9,Today's send outs,I love when I have stickers and decorations that match my recipients hobbies. The first one loves traveling and skylines and the second one bicycles and yoga ^^,17,1738256321.0,postcrossing,0,1.0,False
1idrj2e,https://www.reddit.com/r/UnsentLetters/comments/1idrj2e/reminiscing/,Reminiscing,"As the dark clouds linger and the bitterness of the air settles in, I sip my coffee warm and deep and remember how it all began. 

I walk the paths we used to know, where summer makes our skin a cherry glow. I rest upon our bench so cold and bare. Quiet in silent reverie wishing you were there. 

The scent of ozone lingers near me, a fleeting trace of love’s sincerity. It swirls around and calls your name, but without you it’s not quite the same. I miss you more every passing day, as distance creeps and pulls away, the hugs, the laughs, the steady grace. In which I wish to see upon your face. 

So come back soon as my heart is worn. Your absence leaves the night sky torn. Yet even though there are miles between, you’re still my thoughts and every dream. 

As I wait for you, I grow with care. Knowing one day you’ll be right here. ",6,1738256226.0,UnsentLetters,3,1.0,False
1idritj,https://www.youtube.com/watch?v=ebyGUMTpfcU,Coffee Break EP. 11 La brecha de habilidades en México,,1,1738256209.0,Mexico_Videos,0,1.0,False
1idri7w,https://i.redd.it/oje2p4rwv5ge1.png,Overlap between r/espresso and r/photography. It certainly shows in the posts.,,30,1738256168.0,espresso,31,0.88,False
1idrhxk,https://www.reddit.com/gallery/1idrhxk,Late Christmas post,"I just found this sub. I’ve been in a group on Facebook and they loved my Christmas decorations so I wanted to show y’all a few parts that I was proud of before I get rid of all of my Christmas! I made an ice rink, a spot to take pictures with the fireplace as Santa, and I did the little cut outs so that when people came over, they could do a whole photo shoot 💚 if y’all like these I’ll post pictures of my bakery and boutique as well as my coffee shop",3,1738256147.0,AnimalCrossingNewHor,2,1.0,False
1idrhva,https://i.redd.it/nkch1ghvv5ge1.png,Cardio & Strength Training Classes Tonight,,4,1738256143.0,Modesto,1,1.0,False
1idrhf9,https://i.redd.it/hwqokizuv5ge1.jpeg,(comic) Direct and clear feedback,,75,1738256109.0,workchronicles,0,1.0,False
1idrhd7,https://i.redd.it/2hp9qlkuv5ge1.jpeg,Overdone but want to keep them in order. Review #2 RR15; slightly controversial,"Review # 2 -  Russell’s Reserve 15 year (RR15) 

TLDR: 7.5- a very solid pour, that in my opinion is underwhelming for the MSRP and secondary ask. 

Nose : prominent cherry, with brown sugar, honey and toasted vanilla undertones ends with that classic turkey “funk”

Palate : drinks hot for 117.2 proof. spiced fruits (cherries, figs, maybe some peach) deep oak, earthiness, hints of coffee 

$ : MRSP - $250 ; Secondary: $~550

Score: 7.5 an overall enjoyable pour, but overhyped at the price point. I’ve had younger RRSPs that have been better 

Scale:
1: Disgusting - Drain Pour
2: Poor - Forced myself to drink it
3: Bad -  Heavily flawed
4: Sub-par - Many things I’d rather have.
5: Good - Good, enjoyable, ordinary
6: Very Good - Better than average
7: Great - Well above average
8: Excellent - Exceptional
9: Incredible - Extraordinary
10: Unsurpassable - Perfect/Nothing else is close




Author note - I did this the week the bottle was released, I’ve tasted it a few times since it was released and I’m still relatively underwhelmed for this being a “top turkey” product. Fight me. ",34,1738256105.0,bourbon,64,0.76,False
1idrh8x,https://www.reddit.com/r/espresso/comments/1idrh8x/passenger_coffee/,Passenger Coffee,"Hello, 

I was wondering if anyone have any experience with using Passenger coffee beans for espresso? We recently got a oracle touch and also suscribed to the reserve/education line for coffee beans but unsure if theyll make a good shot of espresso. 

Any advice and tips would be appreciated 🙂‍↕️",1,1738256096.0,espresso,2,1.0,False
1idrgo6,https://www.reddit.com/r/AITAH/comments/1idrgo6/aitah_for_going_nc_with_my_mom/,AITAH For going NC with my mom?,"Hi Reddit, I really don’t know how to handle this situation so any advice would be greatly appreciated.
So all of this started when I was a kid, my parents got divorced when I was 3yo and I stayed with my mom. Then my mother started telling me that my dad wouldn’t pay child support. That he doesn’t care if I eat or even live, mind I was 4yo. She started a lawsuit against him for child support. I’ve been taken out of school for a couple of hours many time to testify against my father, but at the same time my mom was very aggressive towards me. She used to hit me with belts, flip flops, her own hands, a bath brush, you name it. She used phrases like “you are no more than a problem in my life” or the classic phrases an abusive parent use with their kids. Not always she had a reason to hit me, sometimes could be my low grades but some others she was just pissed bc she has a rough day. I one of my visits to my dad at his house, I took a shower and while I was getting dressed, he got into the room thinking I was already dressed up. He saw my body full of bruises and scratches. He instantly told me to put on my underwear and then he will take a better look to those wounds. He was clearly mad at my mom and he cried (he always loved me, the most “hurtful” thing he did at me was raising his voice once bc I got to go to summer school, but that’s it) he took me to a doctor and started a lawsuit against my mom for child abuse. And there was me, testifying against each other every now and then, my father always telling me to tell the truth and my mother manipulating me saying If I don’t say that her hitting me is not truth, I would be taken with my dad and I wouldn’t be able to see again my family (for her side, grandparents, uncles, aunts, cousins, etc…) which I didn’t want. By this time I was 8yo. My brother was born and by this time my mom started telling my dad that If he doesn’t pay, she wouldn’t let me see him. When she had any appointment or needed to see the jury I told her to told my dad I miss him, if he can call me or anything. Apparently she did, but he never wanted to call, she also told me my aunts, cousins, grandmother, every person in my father’s side hated me bc they think I don’t need the money, that my father doesn’t deserve to go to jail for just not paying child support and I was responsible for that (a 9yo girl). Time passed and when I was 15yo I called my father to ask about my school supplies, he got mad at me telling me my mother was behind me forcing me to ask for money, and my stepmom told me my dad was not my wallet. (I want to clarify, my stepmom was NEVER a bad person or the “Cinderella” type, she is the most lovely and pure person you could ever know, she is a fair person with so much understanding and empathy) so my mom took the opportunity and told me “you know what, we don’t need him, I’m gonna buy you everything as always”. He went NC with me and I wouldn’t stop crying for 2 years, I felt manipulated, gaslighted, not loved, idk I was really lost. I tried to un alive myself not only once, I went to the point I sat on the edge of a building testing myself if I was brave enough to jump. Spoiler alert, I wasn’t. So years later I am married with a great man, I love him more than anything but my mom wasn’t having it. She prohibited me living with him during my pregnancy, she told my husband she will “train” me to be a good wife and being pregnant she made me mop the floor, clean the house, the bathrooms, make breakfast, wash all the dishes… Her excuse was always “you are pregnant, not sick”. Even though I was not comfortable, I accepted it bc I always lived with fear of her and in a (stupid) way, I thought it was the correct thing to do. My husband saw all of this and the same day texted me saying “get your stuff ready, tomorrow I’ll go for you with bags” and he did, she was beyond surprised and mad at him, so she started telling him I was extremely lazy, that I don’t clean, wash, pick up my stuff, fold my clothes, nothing, so he was taking with him a burden. He answered “that’s my problem, I never looked for a maid, but for a wife” when she realized he won’t let me be there a single day more, she started crying telling me to at least hug her bc she would miss me. I hug her but it felt empty for both of us. Living with my husband was difficult at the beginning bc I was used to a different lifestyle, they shared the table, eating all together, we didn’t. They say I love you many times a day, we were lucky If we say that once a month. It was overwhelming for me when he was insisting on me merging with his family. I got some problems with them bc of my resting bitch face, which I don’t do on purpose, so explain how difficult it was for me seeing all of this love, unity and loyalty. They understood and helped me giving me my time. My BIL asked me for my father (he is a psychologist) and recommended me to get in contact with him bc of more time passes I will regret not clarifying things. So I did. A year ago I texted my cousin by my fathers side and told her I wanted to talk to my dad. She told me not to talk to her If what I wanted was money. I was shocked, I told her the least I care about is money which she responded telling me that I was moving documents and the lawyers to claim more and more money to my dad and the was so ill that he almost didn’t make it. I cried a lot. The only person who can do that was my mom, I told her to stop since he is hospitalized and with a deadly illness. She stopped for a few months, months when I convinced my cousin I didn’t wanted money, but to recover my relationship with my dad. She trusted me until my mother again asked for more money which my cousin told me it was a mistake trusting me, I asked why and when she told me about the request, I told her very firmly “Gaby (fake name), I HAVE A NEW BORN, I need to take care of my baby and my new family. I have my own money, the one doing that is my mother” and I sent her screenshots where I told my mother to stop, when I contacted a lawyer to ask him how I can finish this, etc. She believed me and gave me my stepmom’s phone number. I spoke with her and as I thought all of them used to think I was trying to contact for money. I told them the truth. I was never after the money and the one getting and spending the money was my mother, she forced me into giving her every single penny he used to pay. We discovered many things. When she used to tell me everyone hated me (I was 5 or 6yo) she was not telling them I wanted contact, she told my dad she won’t stop until taking all from him and swing him in jail, then she would come home and tell me she hug my dad and ask very kindly to call me by he declined. He showed me proof that he payed my school, my supplies, he told me he payed child support to her but he didn’t saved the receipts bc he never imagined she would be that mean. She told them that I didn’t want to see them bc they were poor ignorant people who don’t mean anything to me (complete bullshit) we clarify everything and now more things are coming up. Now I have a very good relationship with them, but I stopped talking to my mother, I didn’t confronted her, I just desapeared from her life. She texted me in the beginning even sent me a 25 minute audio trying to manipulate me saying I was the one betraying her, I am ungrateful and she always took good care of me, she cried and asked me to talk to her and ask her how many time she suffered alone bc of my dad. Many things I won’t put bc this is long enough. Now I want to be honest, I miss her but I think I only miss the wish of having a mother, of being able to say “hey mom, let’s go eat something, my treat” or “hi mom, let meet and drink some coffee” idk. I don’t k ow If it is the manipulated child inside me talking or what, but I really want a mom. I don’t want HER, I would never forgive what she did to my dad, all the lies, manipulation, gaslighting, how she was mean and racist with my husband (we are not white, but she behaves like a white rich lady), how she treated me since I was a little kid and how she victimizes her now saying I betrayed and abandoned her. My stepfather tells me she will always be my mother and one way or another I will speak with her one day, so it would be better for me to speak with her now. My brother is very neutral, he just don’t want to get involved. I feel if I speak with her (which I don’t want to) would be a betrayal to my husband who protected me so much, my dad and my in laws who supported me. As I mentioned, I don’t need HER, I just feel sad and depressed bc I don’t have a mom, even if I try to, she knows how to manipulate me and I know If I get back to her, I will believe her and fall into her lies. I have a very weak heart and mind. I want to keep NC with her, but I don’t know what to do, please help.",2,1738256054.0,AITAH,3,1.0,False
1idrgmr,https://www.reddit.com/gallery/1idp8ui,Join me for coffee and donuts? 450 grams sterling coffee pot for $7.99 at the thrift store,,1,1738256052.0,MetalsOnReddit,0,1.0,False
