id,url,title,text,score,created_utc,subreddit,num_comments,upvote_ratio,over_18
1td24ka,https://www.reddit.com/r/loseit/comments/1td24ka/is_there_a_good_app_that_learns_based_upon_input/,"Is there a good app that ""learns"" based upon input as to what works and what doesn't work for weight loss?","I've tracked calories pretty religiously for a while but I'm wondering if there is an app where you can enter inputs (calories, type of food, time of day you ate, how long between meals, sleep, etc.) and then starts to learn what works best.

For example, I know if I have a really bad night's sleep, I tend to be extra hungry and lean more into junk,comfort food then if I'm really well-rested. 

I use the Whoop tracker to work on my sleep habits, and it's been great in identifying things I do during the day (afternoon coffee, evening workouts, alcohol) that impact my sleep. I'd love to find something similar for weight loss.

I use the Loseit app which tries but doesn't do great. For example, it once told me that it noticed a positive trend when I eat donuts. ",0,1778773557.0,loseit,2,0.5,False
1td24ge,https://i.redd.it/fka81ia0j41h1.jpeg,In love with my Gaggia Classic UP,"I am new to the topic, but i must say i enjoy it so much so far. Got the new Gaggia Classic Up for a fair price of 600EUR and i literally love it. 

Coffee is amazing. It also has an ASMR moment when brewing. ",8,1778773550.0,gaggiaclassic,2,1.0,False
1td24fw,https://www.reddit.com/r/AskProfessors/comments/1td24fw/former_student_asking_out_his_former_professor/,Former Student Asking Out His Former Professor,"First off I am a 32 year old former college student, I had this professor for the sake of the story/question we will call her “Sally” she is single and older during my time in college I had 2 separate classes with her. She took a liking to me almost immediately every day i’d walk in she'd smile at me and say there he is ect.

I stayed after Class a few times to talk with her sometimes the conversations lasting a couple hours. We would walk together until a certain point then we would part ways and these conversations continued right up until the very last day of college.

We exchanged numbers and have each other on Facebook and Instagram now that college is done I made a bold move and send her a text asking her out for a coffee ☕ her response was “Hey! I would love to meet up for a coffee. Suggest some date options - and let's caffinate!”

I've been on many dates in the years but I'm not sure how i should go into this situation but I really like Sally but I feel like I have what the youngster say now a day's is Zero Game because I can't decipher if this is a date or not. So to my question now how should I go about this? Should I take the leap and treat this as a date and what else shell I do since feelings are involved. These past few weeks she has been running through my mind",0,1778773550.0,AskProfessors,3,0.25,False
1td24e8,https://www.reddit.com/r/LisbonPortugalTravel/comments/1td24e8/lisbon_airport_report/,Lisbon Airport Report,"Just posting for reference/data as I scoured Reddit for actual info before our trip to Lisbon to combat the fear mongering out there and found it invaluable. Hope this helps someone with their own planning! 

**Tuesday, 5/4 5:20PM - Departing flight on AirFrance from ORD with 1 hour 20 min connection at CDG Wednesday, 5/5 (8:15AM)**  
\- I was worried about the tight connection time at CDG, and turned out to be rightfully so. Thankfully we landed slightly early and were in the front section of the plane. We had to be shuttled to the terminal from the tarmac, which took forever. Passport control was backed up with the electronic scanners taking multiple tries to register. A few kind fellow travelers with no connections let us skip them in line because our gate was closing in 15 mins after we had already been standing in line for about 20 mins after the long shuttle experience. We got through, ran a good distance to the gate and got there as our group was boarding. Had to take another shuttle to that plane, so it was departing slightly late, which worked out in our favor. Another traveler from the US said she flies through CDG all the time and that this is common and doesn’t get too anxious about tight connection times anymore. I was just happy we made it, even if we were sweaty! 

**Arrival in Lisbon - Wednesday, 5/5 - landed around 11:00AM**  
Since we already did passport control we walked right to baggage claim. We weren’t checking bags initially  but ended up having to as our flight out of ORD was full. Was pretty quick, bags came in about 10 mins and we were on our way. We requested a Bolt to our hotel (tip - use the discount codes you’ll see on the ads at the airport!). The waiting area was chaotic. We ended up going to stand away from the crowd to the right side pickup area to better find our driver. That was the longest and most hectic part of the airport experience. 

**Flight to Funchal Sunday, 5/10, 6:30AM**  
Security was pretty quick and the line wasn’t bad when we arrived around 4:45AM. We sailed through and had plenty of time for coffee and breakfast. Definitely could have arrived later, but the airport filled up quickly after we got a spot at a cafe, and was pretty full by 5:30AM.

**Funchal airport**  
**-** Had no issues either way in our out, simple, small easy to navigate. 

**Arrival in Lisbon Tuesday, 5/12 at 6:30PM**  
\- Airport was busy, we didn’t check bags so went straight to Bolt area. Trouble locating a driver so went and grabbed a taxi in that section and it was easy and actually cheaper than the Bolt I had scheduled. 

**Departure from Lisbon Wednesday, 5/13 for 10:00AM flight**   
\- Arrived around 6:45AM. Our Bolt driver dropped us off downstairs vs at the departures area so he didn’t have to pay to enter that area, but he showed us where to go up the escalator. Was fine by us and we headed up to the check-in area. It opened at 7, but we  were already checked in with no bags to drop.

\- Proceeded to security and it was starting to fill a bit, but not too bad. Waited maybe 10 mins. I did purchase duty free items (including alcohol) while in Maderia. They were great about it, just took the liquids out, tested them and resealed the bag. Lines after we got through were definitely beginning to get longer.

\- Headed right to passport control and it was really quiet. Walked right up to the machines. Mine would not scan my passport and said go to manual check. After about 4 attempts, since there were open machines and nobody waiting in line behind us, I moved to the machine my husband used, as he was already through. Scanned on the first try. Fingerprints took about 4/5 times to register correctly, but then I was good to go. I can see how this area can easily get backed up super quickly with the machines not working, going down and taking multiple tries for scans. The agents weren’t really monitoring them either and nobody was right next to them to ask questions. 

\- Overall it took us a bit over an hour to get to our gate. We had plenty of time for some breakfast, coffee and drinks before our flight. Grab a table quickly, as the airport seems to gets busier the later in the morning it gets. By 8:30/9 it was a zoo.

\- The airport was pretty chaotic, but we didn’t have a terrible experience. Things went smoothly, flights were on time and we had no issues. My recommendation is to just err on the side of caution and get there early so you’re not sweating things. 

**JFK connection additional info**   
\- We entered back into the US through JFK and just a note for anyone else doing so. You will have to go through both passport control AND security to get to your connecting flights. If you checked luggage you have to collect that first before going through security. We didn’t check anything and sailed through both, as it wasn’t busy. Passport control took about a literal minute and security maybe another 15, even with them having to check and reseal my duty free items again. 

Good luck to everyone traveling this spring and summer! Lisbon/Portugal was incredible and worth the trip. Wanted to let everyone know a good story with no long lines or issues to combat all the crazy reports out there. Hope this helps someone that loves to have all the info they can before traveling like I do! 

Happy travels!! ✈️🇵🇹",1,1778773547.0,LisbonPortugalTravel,1,1.0,False
1td23du,https://www.reddit.com/gallery/1td23du,photo taken by sj7 star (my brother’s 10 year old action cam),"pretty decent out! ft. waves coffee // liwliwa, zambales, ph ",2,1778773494.0,toycameras,0,1.0,False
1td233j,https://www.reddit.com/r/prose/comments/1td233j/shifting_sands/,Shifting Sands,"Declan Roe stands at the window. In the glass, the lawn floats over his chest and the ocean pools where his heart should be. He watches himself watching. The stillness is the kind only money can afford, and he has paid for it, and it is still, and he is still inside it. The house sits on a bluff above the Atlantic. Three stories of reclaimed oak and Swedish glass, cantilevered over the rocks like a dare. He bought the land seven years ago from a family that had owned it for four generations and could no longer afford the taxes. The patriarch wept at the closing. Declan remembers the sound. He does not remember the man's name.

§

The accountant calls on Tuesday.

*Portfolio*, she says, and the word hangs there between them, leather-soft. A folder for holding what cannot be held. She is talking about rebalancing. She is talking about exposure. He watches a gull knife through the grey above the water and says *fine* and says *whatever you think* and she pauses the way she always pauses when he says this, because she thinks it means trust and it does not. It means he has discovered that money past a certain volume becomes weather. It moves. It gathers. It erodes what it touches. You do not direct weather. You survive it or you build something it cannot reach.

He has built and built. The building had been the point, and now the point was behind him and ahead of him was the house and the lawn and the ocean and the placidity veneered as tranquility.

§

The house that heat built. That was the joke he never made, though the fact of it lived in every room. Oil futures, natural gas, the burning that happened elsewhere to someone else's air. He had been good at finding things underground and pulling them into the light and selling the light back to the people who needed it to see. There was a word for this. Several words. *Entrepreneur* was the one he preferred. The others he heard at dinner parties, spoken by people who arrived in cars that ran on what he sold.

The hallway from the kitchen to the study is forty-two feet long. He measured it once, drunk, with a tape measure from the contractor's kit that was left behind. Forty-two feet of Venetian plaster the color of old linen. His portrait hangs at the midpoint, oil on canvas, commissioned when he was thirty-seven and still believed in the word *imperishable*. The painter having caught that particular tilt of chin men learn from magazines about men. Jaw forward. Eyes leveled at a horizon that isn't there.

The frame cost more than the art. He cannot remember which bothered him, at the time.

He passes it now the way you pass a photograph of someone you once knew. There is recognition. There is distance. There is the faint vertigo of watching a self you've already vacated continue to smile.

§

His children visit on the schedule litigation clarified. Ava is eleven. Junior is eight. They arrive on the second and fourth weekends with overnight bags that match, a detail their mother orchestrates to remind him she is organized and he is not. They are so careful with his things. They have been told about his things. Ava lifts a glass of water with both hands. Junior asks before he sits on the couch. His son has begun to hold his silences the way he held his own, which meant the boy was already building the rooms he would one day stand in alone. Strange, the way children learn that love has terms and conditions.

He wants to say, *break something*. He wants to say, *run, put your hands on everything, leave prints on the glass where the ocean is*.

He says, *who wants pizza*?

§

The doctor finds nothing wrong, again. She palpates the coastline of his ribs. She listens for what the tide brings in. She says, *you're healthy*, the way one says the soil tests fine above a sinkhole.

He dresses behind the curtain and stares at his own hands. Forty-four years of use and they look like someone else's. He flexes them. They obey, which should be reassuring.

§

The wine has a name longer than some prayers and rests in a cellar kept at the precise temperature of indifference. Sixty-two degrees. Optimal. Waiting. He goes down there sometimes, alone, searching for the remedy the doctor cannot provide and stands among the bottles with their labels facing out, their years ascending, their silence the silence of things that improve by not being touched.

He does not drink them often. He is waiting for the right occasion. He has been waiting for three years. The occasions keep arriving and none of them are right, and this is a sentence he cannot finish because the end of it would tell him something he already knows.

§

Somewhere in the city a man with less wakes without the small stone lodged behind his sternum. That pebble of *whatwhatwhat* that starts each of Declan's mornings before the first market opens, before the window's pewter light assigns him back his shape. He envies this man. He does not know his name or his face. He has imagined him in a studio apartment in Allston or Dorchester, a place where the radiator clanks and the walls are thin enough to hear a neighbor's television. The man wakes and the morning is just morning. No weight. Nothing amiss beneath the breastbone. Just coffee and a coat and a door that opens onto a street where nobody knows what he's worth.

Declan has never been that man. Even before the money he was calculating, even then the pebble was forming, microscopic, calcium or grief or ambition, which are the same mineral given different names.

§

He has a trainer. He has a chef. His body is maintained like a German car. Scheduled, oil-changed, the dashboard warning lights addressed before they can mean anything.

*German engineering*, his father called it once, gesturing at his own chest. Months before the cardiac arrest that took him in the shower on an uneventful day in November. *Built to last.* Built to hide the moment it decides it won't.

Still the engine idles rough at certain hours. Still something knocks. Declan runs the treadmill at 5 a.m. and monitors his heart rate on a watch that cost as much as the radiator apartment he imagines for the man in Dorchester. The numbers stay in range. The numbers are always in range. He wishes he could trust the numbers.

§

The therapist's office, on the fourteenth floor of a building in Back Bay, smells like leather and discretion. The chairs are Eames. The clock on the wall has red numerals that do not move with the conversation, only through it.

*The problem*, says the therapist he pays to be this honest, *is that you built a self the way you built the rest. Expecting ROI.*

Declan laughs. The therapist laughs. The clock's red numerals do not.

He writes the check afterward and tips well, the way you tip a surgeon. For the cut. For the seeing.

§

Here is what money cannot buy. The way his mother said his name before she knew what he'd become. *Declan*, she used to say, and the word in her mouth was a small room, warm, with the door open. Back when it was only a name and not a brand, not a signature on a check, not the thing strangers recognized at fundraisers. Now when she says it there is furniture in the room. Expensive furniture. The door is closed and the air conditioning runs and the room is perfectly climate-controlled and no one would ever call it warm.

Money cannot buy the dumb courage of twenty-two. That year he drove to New York with eleven hundred dollars and a duffel bag and slept on a floor in Bushwick for a month and was so completely unimportant that no one asked him anything and this was freedom, though he didn't know it yet.

Money cannot buy a single night he can't recall because nothing happened. Because he was simply there with someone, being ordinary. He could not remember her name. He remembered the window had been open and the air smelled like rain and they had talked about nothing and nothing had been enough.

§

He collects. This is what's done. The Rothko in the dining room hangs above the walnut table where he eats alone most nights, and he has told people it made him weep the first time he saw it. The colors, he says. That luminosity. He touches his chest when he says this. He has practiced the gesture.

The Rothko has never made him weep.

The lie is its own kind of looking. *Here* is where feeling should go. *Here* is the expensive shape of it. He stands before the painting some evenings with a glass of the wine that is almost never right and waits for something to move behind his sternum, some proof that the capacity for awe has not been paved over by acquisition. The painting remains. The feeling does not come. He tells himself it is a question of light.

Still he waits for the red and black to do whatever red and black were supposed to do to a man who had paid enough to deserve the doing. Still nothing happens. Still the painting held its silence and still he held his. Between them, the room was full of holding.

§

In the master bath the mirror holds more of him each year and less. Strange math. The reflection accumulates while the thing behind it thins to foam, to spindrift, to the weight of water remembering it was rain.

He brushes his teeth. He examines his gums. He does the things a man does at a mirror without looking at himself, which is a skill he perfected so gradually he cannot say when it began. He had built everything a man was supposed to build. He had acquired everything a man was supposed to acquire. He had even acquired the appropriate dissatisfaction, which he wore the way he wore his watch, with the face turned inward so only he could read it.

§

The architect warned him.

Years ago, in that office in Cambridge where the models of unbuilt buildings lined the shelves like futures that would never arrive. A woman named Adora Song, grey-haired, plain-spoken, with hands that moved like someone accustomed to building things that outlast her.

*You can't fight littoral drift*, she said. She pressed a finger to the site map, to the land, to the body of land where the house would rise. *The coast's slow hunger to become the sea again. What's underneath wants back what's underneath.*

She said *bedrock* the way a father says *no*.

Declan signed the check. The premium paid to turn a prophecy into a permit. He thanked her. She looked at him the way the doctor would look at him years later, reading the coastline of his ribs. Then she rolled up the blueprints and he never saw her again.

§

Now the foundation settles. Now the grout cracks in the ensuite, in the kitchen, hairline fractures mapping something the house knows and cannot say. Water finds its way to water. It seeps through the basement wall in February. It darkens the ceiling of the guest room where his children sleep on second and fourth weekends. It leaves a mineral residue on the tiles that the housekeeper scrubs and that returns, patiently, the way the truth returns to a conversation that tried to leave it out.

The plumber shakes his head at pipes that run to code and still refuse their purpose.

*Sometimes*, he says. *A house just doesn't want to carry what you're asking it to hold.*

Declan pays him double. The plumber takes the money and looks at the walls and does not promise anything. He watches the man drive away and stands in the kitchen where the floor has shifted a quarter inch toward the sea. He could feel it, that quarter inch. The whole house leaning like a body leans toward sleep, toward surrender, toward whatever comes after the effort of standing.

§

He tells this story at parties now. The beach house that's becoming beach. He has perfected the ironic wince, the self-deprecating shrug that says, *what can you do, the sea wants what it wants*. Everyone laughs. Even him.

What no one asks. When he turns from the mirror, does the mirror keep looking? Does it hold his shape a moment longer, the way water remembers the stone?

What no one asks, because to ask would be to admit they have stood at their own windows, in their own houses, on their own bluffs above their own oceans, and seen the lawn floating over their chests, and the water pooling where the heart should be, and the tranquility they paid for holding them in place like a frame around a painting that will never make them weep.

§

He has learned to enter rooms as if he owns them. Often, he does. The entering is the same.

§

Tonight the housekeeper has left the mail fanned on the credenza. Invitations, solicitations, the alphabet of being known by strangers. He touches nothing. The paper might as well be some archaic kindling, messages in a language no one living speaks.

*Rich in flesh.* The old phrase surfaces from somewhere. Scripture or Shakespeare, and either way it meant a man like him. All that plenty, all that meat on the bone, all that coastline and no country.

He pours a glass of water instead of wine. He sits in the chair by the window. The chair is Italian. The window faces east. Tomorrow the light will find him here if he stays long enough, will press its grey hands to the glass and give him back his outline, and he will rise and shower and call the accountant and call the trainer and call whoever it is that a man calls when the morning arrives and the pebble is already spinning behind his sternum and the word he cannot say is *enough*.

He cannot say it because the word has come unmoored, a boat slipped from its cleat, drifting out past the breakers where the architect was right, where the land keeps giving itself back to the wave.

§

What breaks is never dramatic. There is no shatter, no satisfying crack. Just the slow unbraiding of a rope that was only ever tension pretending to be a thing.

The lawn was perfect. The gardeners had gone. Outside, the Atlantic worked its patient hunger on the cliff face, on the shore, on the land he had bought and built upon and called his own. The land did not know his name. Water did not care about his portfolio. Drift moved at its own geological, implacable pace.

§

Near dawn the house ticks and settles. Wood remembering the tree. Pipes remembering the mountain they were pulled from, the cold vein they carried before they were made to carry something else.

Declan is awake. He is always awake.

Outside, a bird he cannot name says one clear thing into the dark. Pauses. Says it again. As if the first time didn't take. As if even the bird has learned that some messages must be sent twice to be believed, even by the sender",1,1778773477.0,prose,0,1.0,False
1td22rv,https://www.reddit.com/r/AskMenRelationships/comments/1td22rv/is_this_an_affair_or_am_i_overreacting/,Is this an affair or am I overreacting?,"My bf of 9+ years (we have lived together for 6+ years, both 47 yo) is (imo) pursuing a connection with a woman he used to interest with at his previous job. He is dropping by her office and taking her coffee, lunch, etc. He’s never mentioned her and I only know this is happening bc I’ve seen messages on his phone. I desperately don’t want to blow up my life with him, but my gut feels sick about what looks to me like he is actively pursuing someone else. What do I do?",1,1778773456.0,AskMenRelationships,2,0.67,False
