id,url,title,text,score,created_utc,subreddit,num_comments,upvote_ratio,over_18
1mw4xw8,https://i.redd.it/xj99zsn3zbkf1.jpeg,Daily coffee in office,,0,1755763787.0,ENGLISH,0,0.33,False
1mw4xez,https://i.redd.it/bkdkxhm0zbkf1.jpeg,Whyy is zepto cafe unavailable only in meadows / Vasant vihar area its working in every other areas but mine,,1,1755763735.0,thane,1,1.0,False
1mw4vr1,https://i.redd.it/o214aoifybkf1.jpeg,My makeshift Melodrip,"Just watched Brian Quan brew some coffee using the Melodrip and I thought it was interesting but didn't want to spend money.  Ground my Ethiopian a little finer than usual on my ZP6 (actually it's called the Ks, an earlier incarnation).  Brewed it on a V60, holding the seive closer to the surface like Brian does. The flow was pretty close to the Melodrip. End result, I definitely got a smoother, sweeter brew with nice peach tea, fruity notes.  Very pleasant.  Give it a try with something lying around your kitchen.",4,1755763543.0,pourover,2,0.83,False
1mw4uv1,https://www.reddit.com/r/GardeningUK/comments/1mw4uv1/coffee_grounds_and_tea_leaves_spread_or_compost/,Coffee Grounds and Tea Leaves - spread or compost? (and cold black tea?),"Hi all,

As an avid tea and coffee drinker who has recently taken on a somewhat larger garden than I am used to I was wondering what makes most sense regarding my coffee grounds and tea leaves. Should I compost them (I have a compost bin which is doing a lovely job as far as I can tell) or should I put them directly onto my raised beds/borders?

I use an Aeropress for my coffee so there is a small thin paper filter with the coffee grounds - which would obviously be fine being composted, but not sure how it would be in the beds. Happy to separate if I need to but if I don't thats even better.

I also have some tea that goes cold in my pot which I currently pour onto my beds - I spread it around so its not one area which gets it. Assume this won't do any harm as long as it isn't gallons of the stuff?

  
Any thoughts/advice appreciated!",1,1755763453.0,GardeningUK,2,1.0,False
1mw4ue1,https://www.reddit.com/gallery/1mw4ue1,Creating coffee talk characters in the sims: Freya,If anyone knows the game who should i create next,4,1755763397.0,LowSodiumSimmers,0,1.0,False
1mw4u3z,https://www.reddit.com/r/TwoXChromosomes/comments/1mw4u3z/my_positive_colposcopy_experience/,My Positive Colposcopy Experience,"Hi everyone. I’m on my phone sitting at the doctors office so apologize for formatting! 
I wanted to share my colposcopy experience this morning as I’ve read so many horror stories and I went into the office thinking I was going to be down for the count and in worse pain than when I got my IUD placed five months ago. 

So I got my PAP a couple months ago at my six week IUD check up. I’ve had a history of normal PAPs and have never been tested/tested positive for HPV. Well I tested positive. Not for 16/18/45 but another high risk strain. The doctor recommended a Colposcopy with a possible biopsy since my PAP results were ASCUS. 

I went in, did a urine test, and the nurse took my vitals and made sure to make me feel at ease! The doctor came in and explained what was going to happen. She first inserted a speculum with a light on it, then used the acedic solution on a pap smear sized cotton swab on my cervix. She then used the colposcope(?) and noticed three spots where the cells turned white, but noted they looked low abnormal. She told me she would like to proceed with the biopsy because seeing any change at all and not taking one would make her feel like she isn’t doing what is necessary, and I agreed. 

I didn’t look at the tools she was using as I was by myself and didn’t want to freak myself out, but I caught a glimpse of it. It looked like a big hole punch. That immediately freaked me out but I stayed calm.  The first two samples were not bad at all. I barely felt the first one and the second two were near “12 o’clock” in terms of my cervix. The last hurt a bit, but it was less painful than getting my IUD placed! She then did the “aggressive PAP smear” and it looked kind of like a big spoolie. It was uncomfortable, but again not painful. Then she put something on my cervix to help the bleeding, told me when I would receive results, handed me a diaper of a pad and explained that because of the clotting solution I may see coffee ground like discharge. 

I am now waiting to get a vaccine! I feel pretty okay, just a little warm down there. I feel uncomfortable but I think it’s simply because I know what just happened and I tend to overthink. 

I just wanted to share my experience because for the past two weeks I have been freaking out reading horrible stories on reddit of people passing out and pain being 10/10. I am not shaming or discrediting these women at all because I know everyone reacts differently and has different pain tolerances. I personally have NO pain tolerance and was horrified for this experience but overall it was not bad. Would I do it again if I didn’t have to? Probably not, but hopefully this positive experience helps some of you! 

The doctor told me to squeeze and wiggle my toes while taking the biopsies and I honestly think the movement helped distract me. 

Good luck to anyone who may be getting one!!",2,1755763368.0,TwoXChromosomes,2,1.0,False
1mw4tfs,https://www.reddit.com/r/onionheadlines/comments/1mw4tfs/starbucks_coffee_now_officially_90_dirt_company/,"Starbucks Coffee Now Officially 90% Dirt, Company Says Customers “Won’t Notice”","SEATTLE—In a bold cost-cutting move, Starbucks announced today that its signature beverages will now be made with 90% high-quality, ethically sourced dirt, a sharp increase from the traditional 25% dirt that has long given the brand its “earthy” character.

“Rising coffee prices have forced us to innovate,” said Starbucks Vice President of Customer Taste Experience, Linda Mulch, while unveiling a new promotional slogan: ‘Ground to Perfection.’ “Frankly, most of our drinks already have so much caramel, whipped cream, and syrup in them that we could brew them with potting soil from Home Depot and no one would know the difference.”

The new formula, dubbed Terra Roast™, is already being rolled out nationwide. Early customer reactions have been mixed.

“I ordered a Pumpkin Spice Latte and yeah, it tasted a little grittier than usual,” said loyal customer Jessica Hernandez of Portland. “But honestly, it’s October, and I’ll drink literally anything with pumpkin spice in it, even if it’s just a fistful of dirt in hot milk.”

Health experts have raised concerns that replacing coffee with soil may cause long-term issues. “We really don’t recommend people consuming several cups of topsoil per day,” said Dr. Harold Kent of the FDA. “Unless you’re a worm. In which case, congrats, you’ve found your Mecca.”

Starbucks defended the change by pointing to its Artisanal Soil Blend, which combines sustainably harvested dirt from the Pacific Northwest with premium mulch from exclusive partners. “We’re not just shoveling in any dirt,” Mulch clarified. “This is handcrafted, small-batch, locally foraged dirt. The kind of dirt your grandparents would’ve wanted you to drink.”

Meanwhile, Starbucks investors are enthusiastic about the move. Company projections show that replacing beans with dirt could save up to $4 billion annually and open new markets among toddlers and dogs.

In a leaked internal memo, CEO Howard Schultz reassured employees: “Coffee may be scarce, but dirt is forever.”

At press time, Starbucks confirmed plans to release a Limited Edition Organic Gravel Cold Brew for summer 2026.",1,1755763294.0,onionheadlines,0,1.0,False
1mw4tag,https://www.reddit.com/r/roleplaying/comments/1mw4tag/f4a_apocalyptic_roleplay/,[F4A] Apocalyptic Roleplay,"Hello! I have decided to extend back out into the reddit channels in hopes for a new partner or two. I am specifically looking for an apocalyptic setting, starting at the beginning of said outbreak/virus, etc (details can be discussed in DMs)
**About me:** I am F/25+ and I am located in PST. 
I have been writing for about 15 years now, I usually match my partner and prefer the usual quality over quantity. I tend to write anywhere’s from 3 paragraphs to 5+ 
I play both male and female characters and tend to include side characters, also. 
I also like ooc chatter. I like to make new friends. 
A few extra points...

My literacy often reflects my partner’s. However, I consider myself adv.literate/novella. I adore lengthy posts. Quality over quantity.

I write both males and females, but only MxF pairings. I double, triple and use side characters. 

I prefer my partners to be 21+, but 18+ is also acceptable. I do write NSFW themes that don’t revolve around smut. 

That being said, I also love romance. Love/hate, forbidden, slow burn, all the cliches. 

If you need a day or two (or three!) to get out a response, then I’m fine with that. Sometimes I may take a day or two to think of a response. Other times, it comes naturally and only takes me 20 minutes. 

If I’m not interested, I will let you know. I expect the same. 

My only writing mediums currently are Discord and gdocs. 

I don’t care if you have faceclaims or not. I don’t care if they’re real life or not. I have a few claims for my characters, but I usually give descriptors in my writing. 

I like drama, angst, dark themes, anything and everything that can go wrong. I love torturing my characters for little reward. Let’s get into trouble.

Still here? Great! 
Below is something I've put together to set the tone. Details can be tweaked or changed, this only provides an idea of what I'm looking for.


~•~

Squinting at the bright screen that read ‘Eddy’, Lyla swiped right.

“...Hello?”

“Lyla, we need you at the office. Now.”

She took a moment to pull the phone away from her ear and tapped the screen to register the time.

“At four?” She questioned, “In the morning?”
“I can explain more when you get here. See you in ten minutes.”

“It takes ten minutes-” click.

-to get ready died on her lips and she sighed. So, no shower.


Setting the phone back on her bedside table, she glanced over at the figure next to her that had turned over, still asleep.

Whoever needed a lawyer at four in the morning was going to get an earful.


Lyla put on the first outfit she saw and managed to brush her teeth while trying to save her hair with some mousse.

She gave her husband a quick kiss on the cheek, who remained fast asleep.

Some coffee to go, and Lyla was on her way.


She was five minutes late in getting to the office, but Eddy didn’t seem to notice as he started talking a mile a minute the moment she stepped into the building.

“Woah, stop. I haven’t had my coffee and it’s early. Really. Early. Eddy.”

“There’s going to be a bulletin airing at eight this morning. I need you to pull everything we have on Actoflexiria. There’s been an outbreak. A big one. And we need to have our facts straight, plus the development process that was passed before we get hit with numerous lawsuits.”

Ah, so that’s why she was called in the early hours. She had to cover their ass.

“How do we know this is linked to Flex?”

“The sick ones are patients on Flex. Turn the news on at eight.”

Then I suppose I’ll be in my office. And Eddy, I expect breakfast.”


As Lyla went through her files, she wasn’t sure why this would be CDC business. The FDA approved of the drug; the CDC just made it.

It was quickly evident that her desk wasn’t sufficient enough to withstand all the files she had to pull and she was sitting in the middle of her office, surrounded by paper, when there was a knock on her door.

Lyla took the pen she held from between her teeth to answer, “Not now.” She answered, her brow furrowed.

The door opened anyways, admitting Daniel. He looked like he was going to say something and changed his mind, “So, you’ve heard.”

“No shit. Eddy thinks it’s Flex related. Except everything looks… fine. Even the clinical patients reported more pro side effects than the cons. No one minds a little nausea when they feel fit enough to run a marathon. And stress tests not only confirmed the newfound energy, they were able to follow through. So why are people getting sick?”

“I’m not sure.”
Lyla narrowed her eyes in annoyance, then softened her features, “At least Eddy will be pleased. I guess. Oh, it’s nearly eight.”
Four hours already? Damn.


Lyla extracted herself from her office floor and grabbed the remote to the television sitting in the corner of her office. Hitting the power button, the bulletin cut right in.

“Authorities have reported a significant rise in the death toll amid ongoing unrest, now reaching 300 confirmed fatalities. In response, local officials have implemented a strict curfew from 6:00pm to 6:00am in an effort to restore order and ensure public safety.

The curfew will take effect immediately and is expected to remain in place until further notice. Residents are urged to stay indoors during these hours, and law enforcement will be patrolling neighborhoods to enforce compliance. Authorities stress the importance of adhering to the curfew to allow emergency services to operate effectively and ensure the safety of all citizens. Updates will be provided as more information becomes available.”

“Death toll?” She questioned almost immediately, “Eddy said of an outbreak. I was confused enough about an outbreak through Flex, but… what?”

She clearly didn’t have all the facts, and data records weren’t going to help.


“Lyla-” Daniel tried, but she was already out the door.

The original goal of locating Eddy was short lived as the news seemed to cause a stir everywhere. If people weren’t going to demand answers from the hospitals, the CDC would be next on the list.


Nothing was normal about the day. Lyla had returned to her office, but work was the furthest from her mind. She scowled at the papers on her floor, figuring her early morning effort had proved worthless.

She stared out the window of her office, leaning her head against her arm. It took her a few minutes to realize that it wasn’t the usual ongoings in the street below. There was a heavier enforcement presence, but it was the people that caused her to lift her head in realization. Some looked fearful, others angry or upset. There was the odd person who kept to themselves. Anything but casual. Sirens had been heard wailing all day long.


Lyla stood straight, rubbing her eyes in a tired manner. It was nearing the newly placed curfew, though she was one of the few exempt. CDC perks, but her position didn’t seem like it would help too much at the moment. No one was currently thinking about suing the CDC, they were all too busy trying to wrap their head around what was happening. Lyla didn’t blame them, she was trying to do the same thing.


It was not knowing the exact circumstance. She had started pacing her office without realizing, running her hand through her hair multiple times.

Finally, she decided that Daniel might have some answers. He had the science knowledge that she lacked.

The building seemed relatively empty. Most had adhered to the curfew, probably thinking that it would be a temporary thing. Lyla hoped for the same, but she couldn’t decide on what she believed.

She scrubbed the back of her head as she waited for the elevator, figuring a good night’s sleep would do her some good after she spoke to Daniel. It had been a long day, to say the least.


She hit the button for Sector Seven, not prepared for what the elevator opened up to.

She was slow to step out of the elevator. Most of the glass lined lab cubicles had been smashed out and the entire sector seemed void of people.

“Daniel?” She called out tentatively. There was no answer, but an odd, wet sound greeted her instead.


Glass crunched under her shoes as she rounded a corner and could only react by clasping a hand over her mouth. Her eyes wide, she stared at an unimaginable scene. There was a lab rat, but it was the size of an average cat. Perhaps a bit bigger. But what she focused on was that the rat was intestine deep in a body. It had pieces in its’ large rodent hands, gnawing on it.

A sound escaped her and she had obtained the focus of the rat. It looked at her with a bloody face and she ran.


Lyla pressed the elevator button as fast as she could, hearing the animal behind her, but not daring to look. The doors opened and she slammed the lobby button, and repeatedly hit the button to close the doors. As the doors closed, the rat slammed into them, causing Lyla to jump back and she sank to the floor as the elevator started to move.

Her hands shook as she drew her knees up, putting her hands over her face. She only looked up when she reached the lobby and the doors opened.

Before she could move, something fell through the doors and it took a solid moment to register it was another body. She kicked it out of the way of the elevator sensors and hit whatever floor button she could reach and the close doors button once again. This time, when the elevator started to move, she hit the emergency stop button.


Still trembling, she slid her phone out of her pocket and dialed Daniel.

“Lyla?”
“Daniel! Are you okay? Where are you?”

“At home, where are you?”

“Stuck in the elevator at work. Daniel, what’s happening?” She could hear her voice crack.

“Stuck-? Nevermind. Look, you need to get home. I’m just not sure-”

“I’ll be there,” She promised, “Daniel, I love you.”

“I love you, too.”


Lyla hung up before anymore could be said and she took a shaky breath, wiping her cheeks. She dialed the only other number she could think of.

“9-1-1, what’s your emergency? Please note that we are assisting callers with needs that are directly affected by the situation currently going on.”
“I’m at the CDC, stuck in the elevator. There’s bodies and-” Lyla stopped herself, wondering if giant rats would make her sound crazy.

“Are you hurt?”
“No.”

“Alright, hang tight. We’ll send someone over. Are there any hostiles?”

“I- I don’t know.”

“Just a precaution. We have no estimated times, but we will get you out.”


She hung up and dropped her phone beside her, placing her face back in her hands, resting her arms on her legs. She took in a sharp breath, letting her body react, which included uncontrollable tears while she waited for someone, anyone to show up.


After the panic and adrenaline seemed to subside, Lyla removed her face from her hands. She couldn’t help but to replay what she saw down in Sector Seven. Every time she recalled the scene, she had to take several deep breaths so she wouldn’t physically react.

Her phone vibrated beside her and she took the distraction to look at it. An emergency notification had come out, reminding the people of the curfew. There was a mention of a danger to the ones who didn’t abide, but no specifics were given.

“Do giant, man-eating rats count?” She spoke to herself quite bitterly.


Lyla took a chance to look at the Nevada Appeal website for any articles that might shed some light on what was actually happening.

Rage takes control

Police struggle to keep up with calls

Conspirators claim The Purge is here.

A sound resounded from underneath her and she dropped her phone with a start. Her immediate thought was a gunshot. A voice followed, but it wasn’t clear. Was it help, or *something else*?


The elevator moved with a jerk and Lyla scrambled up, shoving her phone back in her pocket. Perhaps it was help, but she didn’t want to take any chances in case she had to run, again. Her brief research didn’t ease her fear.

The elevator doors opened and Lyla stared in turn at the four people standing before her. She felt compelled to mention the rat again, but instead, “I’m authorized to be out.., past curfew.”

She half fumbled for her clipped badge that was handed out earlier in the day that exempted her from curfew.

Whether they cared or not, she wasn’t sure. They all looked tired, more tired than herself. She probably didn’t look too great with disheveled hair and possible red, swollen eyes.

Lyla looked past the four, not seeing the body she had previously kicked out of the elevator.

“Does… Does anyone know what’s going on?”

The question sounded stupid in her own ears, but between what she saw in Sector Seven, the now-missing body and the news headlines, Lyla couldn’t connect anything. Enforcement had to know something.

",1,1755763280.0,roleplaying,0,1.0,False
1mw4sjv,https://www.reddit.com/r/nathalycuevas_snark/comments/1mw4sjv/coffee_shop/,coffee shop,nat posted a tik tok video visiting her shop. it's officially coming soon. anyone have any guesses where her coffee will be located.?,1,1755763214.0,nathalycuevas_snark,0,1.0,False
1mw4roo,https://www.reddit.com/r/Entrepreneurs/comments/1mw4roo/solution_that_will_enable_chatgpt_to_connect_to/,Solution that will enable ChatGPT to connect to the real world. What do you think?,"Have you heard that ChatGPT already supports Remote MCP connections?! You probably haven't noticed it yet, because it is only supported for **Pro, Team, Enterprise, and Edu plan** only. It’s not yet for everyone, but the signs are clear: this is coming to all users soon, and it will be a **game changer**.

Trust me (a random dude from the Internet) — when it does, it’s going to blow the doors wide open. 🚀

# ⚡ What MCP Is (Plain English):

>

MCP stands for **Model Context Protocol** — a new standard that lets AI models like ChatGPT connect to **external tools, APIs, and data sources** in real time.

**MCP** is Like **USB-C for ChatGPT**. One common plug to safely connects ChatGPT to *any tool or data, any website, cloud application, service*.... anything! Need to order pizza? Schedule a ride home? Send email, pay for grocery, rent a car, buy a flight ticket, submit tax declaration, send flowers with a gift card to your sweethart - all done by chatting with ChatGPT!

***If this is not a Brave New World, I don't know what it is ...***

# 💡 What is Remote MCP?

Remote MCP is MCP server that you run somewhere, which has your credentials to connect to all of these tools and is a code that translates ChatGPT commands into the API calls to a respective service.

***THERE ARE THOUSANDS OF MCP SERVERS IN GITHUB ALREADY!*** ANd this number is growing every single day!!!

# But there is a BUT...

**Remote MCP** means those tools don’t have to live on your computer — they can be running somewhere out there in the cloud, ready for ChatGPT to call whenever you need them.

**And here is a CATCH:**

Here’s the thing… MCP isn’t just something you *download*.  
You actually have to **run** it somewhere. And unless you have:

* A PhD in Computer Science
* 10+ years of software development under your belt
* Or a license in certified *black magic programming*

…you probably won’t get it working without a few tears, a gallon of coffee, and maybe a minor existential crisis.

# Enter: MCP Cloud ☁️✨

We are building [MCP Cloud](https://mcp-cloud.io/) is here to save the day!

**MCP Cloud is a new Platform that will help you to:**

* Run MCP tools without setting up scary servers
* Share them with other people instantly
* Even make a little money if you want to offer your tool to others

*When Remote MCP becomes available to all ChatGPT users, you won’t need to know how it works under the hood — you’ll just click “connect” and boom: ChatGPT can use your favorite tool, fetch your data, or automate your work.*

# But wait. There is even more!

***MCP Cloud is the first platform that lets you earn from your MCP servers!***

We integrate payments into our MCP gateway.

*Are you an aspiring software developer, data scientist, or domain expert who developed a useful MCP server? Whether it does stock-price forecasting, fraud/anomaly detection, credit scoring, legal advicing, contract review, web data extraction, SEO audits, demand forecasting, AI agent personalization, code analysis or compliance checks, list it on MCP Cloud and monetize. Set your price and license terms, get built-in analytics and billing, make your MCP server discoverable and turn your expertise into recurring revenue.*

# Where do we stand now

We are a small team working relentlessly on the [MCP Cloud](https://mcp-cloud.io/). Our **Beta release** has happened only a few days ago, ***but we already serve our first users!!!***

We are actively testing and improving our yet small platform.

**What are the next steps**

We are building community. We are looking for anyone who feels MCP is the future of an Agentic AI, and who wants to become part of it:

\- collaborators

\- business developers

\- promoters

\- partners

\- testers

And of course, future users!

**SignUp with your Google Account in a single click.**

***Happy to hear any feedbak, thoughts, ideas. Let's start a discussion. I’m especially keen on feedback from founders/ops/PMs who’ve tried to roll AI beyond a single champion. Thanks!***",1,1755763121.0,Entrepreneurs,0,1.0,False
