id,url,title,text,score,created_utc,subreddit,num_comments,upvote_ratio,over_18
1k3d2u3,https://www.reddit.com/r/Market76/comments/1k3d2u3/h_offerz_w_planz_or_leaderz/,H: Offerz W: Planz or Leaderz,"Planz Wanted:
Blue Ridge Caravan Flag
Pink Sprinkles Paint

I probably need other plans similar to these but not sure exactly which ones.  If you have any plans that I might need and we can meet up and I can check to see if i have them learned, please lmk.

Offerz:
* Anti Armor, Bolstering, Furious, Unyielding, ** Intelligence, Rapid, Vital, *** Belted, Endurance, Luck, Swift, Vats Optimized (atleast 1 of each mod), Audrey's Book, Serum Alpha, Upgraded Motor, Motorized Butter Churn, Sacred Mothman Tome, Vintage Water Cooler Plans, Canned Coffee x200, Glowing Big Gun, Caps, Endurance, Lock Picking, & Strength Bobbleheads, 13k caps",0,1745118085.0,Market76,1,0.5,False
1k3d22j,https://www.reddit.com/r/biglaw/comments/1k3d22j/help_me_decide_simpson_or_gibson_both_palo_alto/,help me decide: simpson or gibson? (both palo alto offices),"hi all! I'm a 1L interviewing for 2026 summer positions rn and have these two rapidly approaching offer deadlines and no clue what to pick. I know the obvious answer would be to choose GDC if I want to do litigation and STB for transactional, but I'm unfortunately not too sure what I'd want to pursue at the moment. I do hope to lateral in-house in the future and know corporate is definitely better for that, but GDC's free market system is appealing in that I wouldn't have to make the choice right away, vs STB let me know I'd pretty much be locked in to corp for life. some other factors i'm considering, as I realize this would probably define where I work post-grad:

Gibson: 

* good connections to bay area tech companies if I want to lateral there in the future
* would allow me to explore different practice areas, also do ecvc work in their trans groups
* 50 person office (pretty small, but I could prob work in their SF office if I really wanted down the line- note STB's office is 80 people so not too different)
* 1950 hour billable target (I've heard having a set target is helpful for being on-track and not working yourself tooooo much)
* remote friendly, but their ""unlimited"" vacation time means they pretty much expect you to be available remotely on vacation

Simpson

* more female partners
* corporate work does have a more unpredictable work-life balance? but better to lateral
* do ""hard"" transactional work and was told they act more like a satellite office for NY, not thattt many close connections with bay area companies
* no billable hours target (uncertainty) but 4 hours PTO (app this encourages people to take more time off which is good)
* lockstep bonus
* summer would be split between palo alto and their new sf office, but they have less of a california presence as compared to gibson (founded in LA)
* less ""evil"" reputation than GDC?

Overall, I'm super torn. I really liked the people I talked to at both offices, would say GDC gave a more ""nerdy"" vibe and STB was more ""bro-y"" but I can't say I view either of those as inherently negative. STB was kind enough to fly me out and offer lots of coffee chats to help me decide, which is nice, but not sure how much the wooing will matter when I start working. I like that both firms allow you to bill unlimited pro bono hours, and I don't care about prestige. Definitely know I want to stay in the Bay Area, just think I won't be able to stick around toooo long in big law as I want to prioritize having a family later in life, and also getting more sleep once I've saved money. this decision is super stressful and would greatly appreciate any insight/advice people have to offer! thank you :)",1,1745118019.0,biglaw,1,1.0,False
1k3d1rb,https://www.reddit.com/r/backpain/comments/1k3d1rb/i_think_i_threw_out_my_back/,I think I threw out my back?,"I (22yr) think I threw out my back?
I have a few chronic issues that involve tightness in my abdomen and hip and leg pain
At around 11am I was downstairs talking with some friends on the phone and bent over super slightly to grab my coffee off the foot stool I had been using as a table
I got a very sudden and sharp pain, it felt like my spine had changed positions and completely realigned itself and my muscle felt like it snapped like a rubber band, I felt the pain into my hips and knees and I almost completely fell
My legs went numb for a little while but came back within 20 minutes of the initial injury
I eventually was able to make it to my bed and lay down, I got into a position that was comfortable and didn't put pressure on my tail bone or lower back
For the last 12 hours I was just really really sore and stuff so I was taking a lot of precautions to lessen the amount of pressure and movement in the area, but now the pain is getting worse, if I make a slight adjustment it's a very sharp and deep pain
My legs keep going numb on and off and I'm afraid of when I get up that I'm going to fall

I was wondering if this is something that could just be slept off? If I should go to the ER? Or if I just threw out my back
My friends said it sounds like I threw out my back but I also wanted an outsiders opinion before deciding to go to the ER
Or even if anyone has any recommendations on how to lessen the amount of pain or the most comfortable position to be in with lower back pain would be greatly appreciated!",1,1745117990.0,backpain,1,1.0,False
1k3d1kp,https://www.reddit.com/r/Simpsons/comments/1k3d1kp/whats_a_moment_from_the_simpsons_where_you_hated/,What’s a moment from the Simpsons where you hated them going back to the status quo?,"For me I thought of one episode, and that is:

Bart gets an Z. {The idea of the newest teacher spiking his own coffee just so Mrs Krapabble gets her job back, is really stupid.}",1,1745117970.0,Simpsons,2,1.0,False
1k3d1eh,https://v.redd.it/z7gwaf5lnwve1,CoverCraft.com Review,"10% Off With Coupon Code SHOWCASE At [www.covercraft.com](http://www.covercraft.com)



\#Covercraft #DriveProtected #Ad #AI #VehicleUpgrade #CustomSeatCovers #CarCovers #DashCovers #SunshadeSolutions #AutoCare #CarEnthusiast #WeekendWarrior #AdventureReady #CarProtection #DrivingJoy #TravelInStyle #RoadTripReady #FYP #Coupons #Discounts #SHOWCASE



\*\*\*

Transcript:



Picture this. It's a bright, sunny Saturday morning. Birds are chirping, coffee is freshly brewed, and I’m ready for a perfect weekend adventure. That’s when it happened. The dreaded coffee spill. As I reached for my sunglasses, my elbow bumped my cup, and coffee splattered all over my pristine car seats. My heart sank as quickly as the coffee seeped into the upholstery. Clearly, it was time for an intervention.



Enter Covercraft.com. The automotive savior I didn’t know I desperately needed. Scrolling through their website felt like strolling through a candy store for car enthusiasts. They have an amazing range of custom-fit car seat covers, protective car covers, dash protectors, sunshades, and even RV covers. Whether you drive a family minivan, a sleek sports car, or a rugged off-roader, Covercraft has the tailored protection your beloved vehicle deserves.



I chose seat covers designed specifically for my car model, and it felt like adding a custom-tailored suit to my vehicle. Not only did they instantly revive the look of my car’s interior, but they also offered practical protection against future coffee-related calamities and daily wear and tear.



Covercraft isn’t just about preventing messes, though. It’s about enhancing your entire driving experience. Their stylish and durable dash covers protect against the sun’s harsh rays, keeping your dashboard looking brand new, while their reflective sunshades dramatically reduce interior heat, making summertime driving infinitely more comfortable.



I loved my newfound automotive confidence so much that I decided to extend the upgrade to my vehicle’s exterior as well. A custom car cover became my next purchase, protecting my car from dust, dirt, harsh weather, and the occasional bird overhead with questionable intentions. Now my car looks showroom-ready anytime I hit the road.



And guess what? You can easily experience this same transformation. Right now, use my exclusive discount code SHOWCASE at [Covercraft.com](http://Covercraft.com) to enjoy 10% off your entire purchase. Trust me, your vehicle will thank you, and your future self, armed with coffee cups and snacks, will appreciate this smart investment even more.



With Covercraft, you’re not just protecting your car. You're boosting your driving joy and enhancing every journey you take. Whether it’s daily commutes, weekend getaways, or epic road trips, your vehicle deserves the ultimate protection and style upgrade that Covercraft delivers. So, what are you waiting for? Gear up, cover up, and elevate your driving experience today at [covercraft.com](http://covercraft.com)",1,1745117951.0,ProductShowcase,0,1.0,False
1k3d0b4,https://www.reddit.com/r/makingfriends/comments/1k3d0b4/25f_looking_for_friends/,25F looking for friends :-),"
Hi everyone! I currently live just outside of Seattle and I’m going to be starting medical school in a few short months.

I’m married, have cats, and I enjoy reading, traveling, and coffee quite a bit. I’m looking to make purely platonic friends (ideally in the region) but open to anywhere in the US or in Canada :) 
",2,1745117835.0,makingfriends,3,1.0,False
1k3d013,https://www.reddit.com/r/AITAH/comments/1k3d013/i_cant_deal_is_she_toxic_or_not_am_i_an_asshole/,"I can't deal, is she toxic or not?, am I an asshole?","From the beginning, my ex avoided video calls, always claiming her hair was a mess. Eventually, she told me she was autistic. Our conversations were mostly one-sided, and she frequently canceled our plans — like the time she said she had injured her leg.

She once mentioned her ex had replaced her with another guy and accused me of changing the way I treated her after I found out about her autism. When I got mugged and nearly lost her contact, I noticed she didn’t seem to care and would only reply if I messaged her first.

She would often talk about her cats and got upset when a cousin brought up that she used to go drinking with her ex. When I invited her to watch a movie, she initially declined, saying she was too shy, but later agreed. We kissed and spent the afternoon together, but soon after, she started acting distant, kept her phone hidden, and only gave me her Instagram after we had broken up.

One time, her sister dropped her off at my place, and when I commented that she wasn’t going out with me because she was “being complicated,” she got really angry. On another occasion, I criticized a game we were playing and she immediately stopped playing. Even after sweet moments, like when she gave me chocolate, she would soon bring up the idea of breaking up.

She invited me to a party, later said she wasn’t going anymore, but changed her mind again. I asked if I could come earlier, but she insisted I should only arrive at 6 PM. I went earlier anyway, and her sister saw me and invited me upstairs. At the party, she introduced me as her boyfriend, but later made a joke: “Let’s download an app to help you find a hot girl.”

After an argument, I ended the relationship, she cried and blocked me. Later on, she texted me saying she missed me. We started talking again until I found her profile on a dating app. When I confronted her, she claimed she was searching for a friend’s ex.

Even after that, I told her I loved her. She invited me to her mother’s birthday, but I didn’t go. Her mom later called me, asked if I loved her daughter, and even invited me for coffee. Later, my ex told me her father was upset with me. I felt bad, vented about it online, and she saw the post. She accused me of lying and using her, said the only reason she acted the way she did was because she was autistic and felt insecure, that she had prayed for me every day, and then blocked me for good....",1,1745117805.0,AITAH,3,0.67,False
1k3czkc,https://www.reddit.com/r/askTO/comments/1k3czkc/best_canadian_exclusive_snackscandiesgoodies/,best canadian exclusive snacks/candies/goodies?,"i’m not sure if this is the right sub for it, so i’m so sorry if it’s not!

i’m visiting from the u.s. and tomorrow is my last day. if i have the opportunity to pick anything up, are there any snacks or candies that are exclusive to canada that i should bring back to the u.s.? i’ve gotten coffee crisp for loved ones and they enjoyed it, and i’ve considered getting one of those tourist-y maple lollipops or bonbons/chocolates but didn’t know if they were worth it or just a gimmick. 

open to any and all suggestions, thanks!",1,1745117754.0,askTO,2,1.0,False
1k3czfi,https://www.reddit.com/r/harrypotter/comments/1k3czfi/hermiones_first_memory_charm/,Hermione's First Memory Charm,"In The Deathly Hallows, Hermione states that's she's modified her parents memories to think they are different people who do not have a daughter, right? Then not even 100 pages later, when the trio is attacked by Dolohov in the coffee shop, she says that she's never done a memory charm before, but knows the theory. Why would she lie, or how did such an inconsistency make it past the editors? ",0,1745117739.0,harrypotter,2,0.5,False
1k3cza3,https://www.reddit.com/r/TrueOffMyChest/comments/1k3cza3/im_tired_of_this_life/,I’m tired of this life,"I hate 2025, it reminded me again after 4 years that I am not enough for any women. It might sound harsh and pessimistic but I can’t take it anymore when it keeps happening again and again. I know this women whom I never had any feelings for until early this year. I asked her out for coffee and she rejected but slowly started getting closer until I realized that it’s not going anywhere and that she wants me as a friend only. This is not the first time this has happened to me, but every single time after my last breakup which was a decade ago. I had place hope in myself last year that I am capable of being someone’s romantic interest but God slapped back at my face again. This feels like hell, every time I go through this feeling. I can’t imagine if hell is going to be any worse. I’m tired being alone through out of my life. At this rate I don’t think I’ll ever have a romantic partner or dare I say even a wife. I’ve started thinking practically that if I need to plan my life financially I have to keep to consideration of a family out of it. I am broken at this point, I didn’t expect in 2025, when all was going so good, that I would be thrown into this shit pile all over again. I am done trying. With this women I had keep all my anxiety and come out of comfort zone of trust, thinking maybe this time it might work. How foolish can I be to keep hope again. I am not blaming her obviously but if there’s any comfort which I don’t think there is, I am just blaming God for playing around with my life like this, maybe he just wants a sad plot and he got it. ",2,1745117723.0,TrueOffMyChest,0,1.0,False
1k3cyoh,https://www.reddit.com/r/TransMasc/comments/1k3cyoh/trans_masc_nb_erasure/,Trans masc NB erasure,"This is a vent post about some of the issues I've been having but have no one to speak to about regarding my identity. Pls skip reading if you're not in a good headspace 

I have realized recently that I'm having a hard time with others and my identity. I am trans masc nonbinary. I use they/them pronouns but present mostly masculine and am male passing. I thought being on the shorter side would give me away but people are very unaware of the trans masc community. It doesn't feel good to be so erased bc it's hard to find a sense of belonging.

I find that the queer community really hates men/masculinity. Nonbinary people often are lumped in or assumed as being femmine lite* Queer groups for women often include nonbinary people but they dont want me there. What I mean by that is the 'woman alternative' narrative ie coffee shop barista, septum piercing, green hair character type (No offense intended towards anyone who fits that description) is not what nonbinary people are but is what is acceptable in those spaces.There is no norm or standard. That's the whole point. ""Non binary people don't owe you androgny."" A person who is 6'5 290lbs with a full beard could show up who is nonbinary. I fr doubt a space full of queer women would be welcoming to them. 

I have seen a lot of posts about the trans masculine erasure regarding bathrooms. It really upsets me that ppl expect us to endanger our lives to prove a point. My life matters. I am very alone in the world in terms of close connections and no one checks in on me but I care that I'm here. 

Lately my cis friends have been getting too comfortable with the trans masc part. I've petered out some friends who would introduce me as he/him for their convenience. Or some of them will complement me in ways that I find insulting. Like ""ugh your such a little man for having so much cash on you""
I'm not a man :/ I get MISGENDERED as male instead of female now but I'm too scared to correct people. I don't want to die bc I'm living a life where I want to be alive. 
I don't have many trans friends irl despite living in one of the most blue cities in the US. It's hard to make new friends as an adult but I've been trying 

Also, fuck dating apps. 

I am nonbinary. Yes I transitioned medically to present more masculine. No I'm not a trans man. No I'm not a woman. Yes I'm sure I'm not a trans man. No I don't regret transitioning medically, it was one of the best decisions I've made. No I'm not this idea of a person you made up in your head. No, I'm not a mentally ill see pervert trying to corrupt children. I'm just trying to exist and pay my rent. I would like to struggle as the rest of Americans do. I'm not this weird abstract thing. I'm literally just a dude in my mid 20s trying to navigate through life. ",2,1745117664.0,TransMasc,0,1.0,False
1k3cyh3,https://www.reddit.com/gallery/1k3cyh3,"I've had these for years, curious about their worth","A customer bought some coffee with these where I was working about thirty years ago. I'm sure they're just normal ""collectibles,"" but I wasn't sure if anyone knew anything about them. ",1,1745117642.0,CanadianCoins,0,1.0,False
1k3cxy1,https://www.reddit.com/r/AskRealEstateInvestor/comments/1k3cxy1/7_ways_to_stay_informed_on_offmarket_real_estate/,7 Ways to Stay Informed on Off-Market Real Estate Trends,"Off-market real estate deals are like hidden gems — they’re not always easy to find, but when you do, the payoff can be huge. Here are 7 Ways to Stay Informed on Off-Market Real Estate Trends that’ll help you uncover those secret opportunities.



Number 1, build relationships with local real estate agents and brokers. These folks often hear about properties before they ever hit the public listings, so getting to know them means you get the scoop early. Grab coffee or hit up networking events — just be genuine and clear about what you’re looking for.



Number 2, join local real estate investment groups. These groups are packed with investors sharing tips and leads on off-market properties. Plus, it’s a great way to meet potential partners and learn from people who’ve been around the block.



Number 3, try a direct mail campaign. Sending personalized letters to homeowners in your target neighborhoods can really pay off, especially if you focus on folks who might be motivated to sell but haven’t listed yet. Follow up with calls to keep the conversation going.



Number 4, use online platforms like [OffMarket.com](http://OffMarket.com) or Zillow’s “Make Me Move.” These sites let you spot listings that aren’t mainstream yet and set alerts for new opportunities. Don’t forget social media — following local pros can put you in the loop on deals before anyone else.



Number 5, monitor public records for signs of distress like tax liens or foreclosure notices. These clues often point to sellers who need to move fast and might be willing to negotiate off-market deals.



Number 6, leverage social media by following real estate pros and groups on LinkedIn, Facebook, or Instagram. Engaging with their posts can boost your visibility and help you stay top of mind when off-market deals pop up.



Number 7, subscribe to real estate newsletters and publications focused on your area. Staying informed about market trends and economic shifts gives you an edge to spot motivated sellers before the general market catches on.



Want a shortcut? Check out [GrowthCents.com](http://GrowthCents.com) — it’s a platform dedicated to connecting investors with off-market properties, making it easier than ever to find motivated sellers and hidden deals.



Recommended Links:



Real Estate Directory Website: [https://www.growthcents.com/](https://www.growthcents.com/)

Join the Community: [https://www.facebook.com/groups/growthcents](https://www.facebook.com/groups/growthcents)

Visit Article to Learn More: [https://growthcents.com/7-ways-to-stay-informed-on-off-market-real-estate-trends/](https://growthcents.com/7-ways-to-stay-informed-on-off-market-real-estate-trends/)",1,1745117587.0,AskRealEstateInvestor,0,1.0,False
1k3ctxc,https://www.reddit.com/r/Kombucha/comments/1k3ctxc/kombucha_and_coffee/,Kombucha and coffee,"Guys do you You advise me to mix kombucha with coffee or espresso?, and if yes, what flavor do you recommend?",1,1745117173.0,Kombucha,1,1.0,False
1k3ctus,https://i.redd.it/lc2c4ryalwve1.jpeg,Found a Juggernog fridge in a coffee shop,,18,1745117165.0,CODZombies,1,1.0,False
1k3ctep,https://www.reddit.com/r/PhR4Friends/comments/1k3ctep/28_m4f_coffeetambay/,28 [M4F] Coffee/Tambay?,"Anyone free later this afternoon? Coffee or tambay tayo SM North or around the area. I’m free 4 or 5pm
I have a car din so kung gusto mo lumibot we can do that also.

About you:
Easy sa eyes
Normal BMI
Yapper
Adventurous 

About me:
6ft tall
Former athlete
From big 4🐯
Semi chinito",4,1745117120.0,PhR4Friends,0,1.0,False
1k3ctb1,https://www.reddit.com/r/Twitch/comments/1k3ctb1/a_little_confused/,A Little Confused,"Does anyone know how to integrate other bots to the stream instead of purely stream elements? 

Also, some streamers have a pocky redeem and they get a random pocky, how could I implement that? I am so lost on how to do that - even just like a Iced Coffee redeem and they like continue to redeem one each stream that their count grows?

I have been out of the streaming game for the last few months and I am so lost haha I am sorry to ask, I am trying to google, but I am honestly so lost",1,1745117111.0,Twitch,0,1.0,False
1k3cta8,https://www.reddit.com/r/MeetNewPeopleHere/comments/1k3cta8/58m_chill_funny_wild_spirtual_seeker_for/,"[58/M] chill funny wild spirtual seeker for meditation, coffee, smiles, exploration #Austin #Texas","hi all...

older easy going mostly SFW haha dude in austin texas. looking for a soul connection or someone to chill with that enjoys coffee and laughing at inappropriate humor, planning the next adventure.  age not that important.  

https://imgur.com/a/ELXjiUh
https://imgur.com/a/MbEs827

anyway, reach out if you like to find out more.  c/s...

spiritual spelled down here correctly 🤩",1,1745117108.0,MeetNewPeopleHere,0,1.0,False
1k3csuh,https://www.reddit.com/r/Kefir/comments/1k3csuh/water_kefir_and_coffee/,Water kefir and coffee,"Guys do you You advise me to mix water kefir with coffee or espresso?, and if yes, what flavor do you recommend?",1,1745117062.0,Kefir,0,1.0,False
