id,url,title,text,score,created_utc,subreddit,num_comments,upvote_ratio,over_18
1gp8z5u,https://www.reddit.com/r/StardustCrusaders/comments/1gp8z5u/jojos_bizarre_oc_tournament_7_r5m3_blake_smith/,JoJo's Bizarre OC Tournament #7: R5M3 - Blake Smith with Marali Whales vs Gioia Arancini with Ichi Ni San Go,"**The results are in for Match 2. The winner is…**

Rice stalks curled and billowed through the air, catching the lanternlight. The burning mustard oil illuminated two brave warriors, the brooding antihero and his sage mentor, staring each other down across the rice paddy. 

> *”Then this is your final lesson, young grasshopper. I will offer you ten more seconds of my time; after that, I will come at you with everything I have.”*

This was supposed to be a game for Din’s sake–Vasil knew that. All this time, he was just playing a part, trying to entertain the kid. He assumed that’s what Vasant was doing too, but… something about the man’s actions, his words, they felt more significant as well. His final lesson.

> *...if you wish to be strong, then what you must do… Is survive!”*

Ten seconds. He couldn’t waste a single one. Heart beating, Vasil felt his constructs rise around him, pests and predators and walls, as the trojan naga reared its head back with a mighty hiss. Finally, the clock struck zero, and Vasil commanded his army forward-

It felt like time stood still, there amidst the raining rice stalks. Then, with a roar from the battered but unbroken Silver Dollar, Vasant sped forwards. Lotuses exploded across the paddy like fireworks, shining like lanterns as they Rumbled, Struck, Heated, Reaped his constructs one by one. Undeterred, Vasant charged at him like a meteor, a smile on his face.

It felt like time stood still. For a moment, Vasil was struck with the memory of Shalin Akshaya, of that monstrous stand, dead gemstone eyes staring as it slit his neck. Instinctively, something in him tried to yell, but the sound got caught in his throat. All he could do was brace for-

-a warm basket of rice being pressed into his hands.

**The results are in for Match 2. The winner is…**

## [Vasant Verve, with a score of 70 to Vasil Grace's 60!](https://www.youtube.com/watch?v=aqxywPYRCbI)

Category|Winner|Point Totals|Comments
:--|:--|:--|:--
Popularity|Vasant Verve|**16 (4+2.5+2)** - 14 (3+2.5+2)|It was a close back and forth with Vasant eeking ahead!
Quality|Vasant Verve|**21 (7 7 7)** - 19 (6 7 6)|[Reasoning](https://pastebin.com/iM2Qv4nA)
JoJolity|Vasant Verve|**23 (7 8 8)** - 17 (6 6 5)|[Reasoning](https://pastebin.com/hixxS8xj)
Conduct|Tie|10-10|Nothing to report!

For a moment, Vasil stood there in shock, just staring at Midnight Rider as it offered its gift. He turned to Vasant, hoping that he would explain, or perhaps just hit him–that would make more sense, right?

Vasant just offered Vasil a smile to go along with his meal.

*“And, of course, it goes without saying, that if you wish to survive, you must remember to eat well, young grasshopper! Ho ho… This is the final lesson: if you wish to be strong, you must never forget: fill your mind with knowledge and discipline, fill your heart with laughter and love, and fill your belly with rice! Certainly, in all my years, I’ve never found a better way to live.”*

Vasil blinked once, before his grip curled around the basket’s handle, holding it tight to his chest. There was a pause, and then…

“THAT WAS TOTALLY WICKED!”

Din, watching transfixed from dry land, suddenly bursting into life. He nearly charged right into the water before Vasant stepped out to intercept, guiding Vasil alongside him.

“Yes, it was, wasn’t it?” Vasant chuckled. “My pupil has learned quite well,” he paused, before offering Din a wink. “Both of them.” 

Din giggled, running circles around them in excitement as he yelled ‘HIYAH!’ and chopped the air. Guiding them both towards the farm, Vasant glanced at Vasil as he turned back to him, looking as if he had something to say. He hesitated for a moment, and then…


“I’ll try.”

“Hm?” 

“To survive, I mean. I’ll try to…I want to survive. I just don’t want to be the only one.”

“There are a lot of ways to do right by this city, and by the people in it–including you. Sometimes you step up and defeat a great evil, and sometimes you eat some rice with the family she left behind.” He looked out to the distance, watching Muuru talking with Jyoti and Chandi, before the three noticed them and waved. “You boys have done a service to this city, but you’re both still growing. In our own ways, we all are. So take care of yourselves, alright?”

Vasil looked out at the lantern, flickering with light. From behind him, [Kaycee Sharp] placed both her hands on his shoulders, laying down her sword for just a moment, just for now.

Slowly, he dug a hand into the warm rice, and took a bite.

---

> [If you’d like more matches outside the city, follow the river and watch a dragon, a detective, a virus, and a coin spirit reclaim unfinished buildings for Parapollah!](https://www.reddit.com/r/StardustCrusaders/comments/1gmysu3/)

---

(Shoutouts to u/Sh0tgunLlama for the match!)

**Scenario: A Rooftop, Port Konwar Docks — 1:00 AM**

The smell of salt and grime wafted over Titan Patel as he looked out over the docks, idly scratching at the cone of shame around his neck. While his battle against the agents of G.A.L.L.E.R.Y. had ended in ice cream it had also dislodged the scrabble piece that was embedded in his tummy, resulting in complications. 

A trip to the vet and a few thousand rupees later, he was no longer in mortal danger. However, he had been solidly out of action for the last several weeks. His best attempts to prematurely remove his stitches with his teeth had been thwarted by the cone. Even his stand had refused to help him remove it. Titan looked over to [Pasta Masta] and sulked.

“Traitor.”

The Stand shrugged in response.

A few moments later, the sound of several pairs of pattering feet broke the relative silence as three cats jumped up on the rooftop. The first, a grungy looking black and white street cat spoke, his eyes narrowing as he viewed the tabby.
 
“Well, well, well, Titan. I would never have imagined that the day would come when you would be subjected to The Cone of Shame! I hope that it hasn’t prevented you from proceeding with paying back your debt. I would be devastated if our efforts during the riots and beyond went… unappreciated.”

Titan stood with as much dignity as he could manage before responding. 

“Don’t think that I have forgotten our deal, Ganesha, or that I have not paid much of it in full already. Do you think convincing Vikram to leave the trash cans unlocked and leave the juice in the tuna cans when he throws them out was easy?”

The second cat, a rugged but luscious orange maine coon with a bedazzled collar that read “Princess Zora” then advanced, butting in between Titan and Ganesha as she stuck her nose up at the former. 

“And what of the cats of the mountains and fields? We have been keeping our part of the deal, tracking down members of this so-called “Metropolis Suite” hiding on the outskirts of the city and keeping an eye on the cabin they keep their “Middleman” in. We have no trash cans to feed on like the cats of the city do. where is *our* just compensation?”

The third cat, a moody gray and brown tabby, sat back just out of the moonlight in the shadows staring off into the distance. While Titan thought it was a slightly absurd pose, it wasn't worth the effort to confront Samosa on it.

“Listen, we’ve done a lot for the humans of this city, but they’re not the only ones living here. The people at the cafe talk about justice, but where’s the justice for us, Titan?!”

Titan gave a moment for the other cat’s demands to hang in the air before responding.

“Stop being dramatic, Samosa, you aren’t some sort of Caped Crusader. Do you think I invited you here so that you could grill me on where your reward is for your hard work? It is right in front of you. Look over there.”

As Titan gestured down the docks, the wind caught the scent of a medley of a most delicious prize: Fresh fish, caught straight from the sea.

“I asked a lawyer friend of mine to go through a bunch of the documents from the Suite investigation and look for anything they owed that had to do with fish.” The other cats seemed a bit confused on what a “Lawyer” was, but perked up at the mention of fish again. 

“It turns out that the train lady that The Middleman killed had a controlling stake in a fishing and canning business that catches some of the best fish in the area. We are currently on the roof of a warehouse right next to the Yu Wright Cannery. In and around that cannery is all the fish that all of the cats in the city could possibly want!” An embellishment for sure, but Titan knew he had to really sell it to the others.

Titan beamed at the other cats as he paced around proudly. After a few moments, Samosa stepped out of the darkness.

“Not bad for being illiterate, Titan, but how are *we* supposed to pull this off? The four of us alone are not enough to accomplish this mission. What if the humans call for backup? How are we supposed to transport the fish? It seems that you can barely read this situation at all.”

Titan visibly deflated as he slumped down as far as the cone of shame would allow. After a moment, Zora piped up. 

“Why so sour, Samosa? Can’t you see the effort our friend has put in already? Assuming you have some humans that we can rope in, I am sure that there are enough hungry mouths in our network to rustle up enough additional paws to handle this mission.”

Ganesha walked over and pawed at Titan with friendly fervor, forcing him to get up out of his slump.

“Friend Titan, do not let the words of one sourpuss dim your spirits. I appreciate your ambition, boy. You might make something of yourself yet! Now why don’t you give the princess and our, uh, “Catman” as it were, over there rustling up some humans while I start to get the port cats organized and set?” Samosa shot Ganesha a dirty look, but seemed to let the comment slide out of mutual respect

Titan took a moment to think before perking back up excitedly at the approval of enough of the council to get things off the ground.

“Alright guys, one of the humans I live around has talked about some promising marks in passing. There is a man out on the mountain who has worked with several of my humans, and even sold one of them a powerful sword! I feel like you can track him down pretty easily, Zora. And if memory serves, that same human told me about a thief that beat them up that hangs around at the mall. Why don’t you do a little investigation and see if you can convince her to join our cause Samosa?”

Zora nodded thoughtfully at the idea of tracking down some mysterious craftsman in the mountains. A worthy mission for someone as prestigious as her. Samosa, on the other hand, sulked.

“Fine, Titan. I will track down this thief of yours. Hopefully they have more good sense than you do.”

After a raucous round of hissing and swatting between Titan and Samosa, which was promptly broken up by the other cats all of them ran off into the night. They all had work to do. The heist was on! 

---

**Scenario: Somewhere on Mount Parapollah — 11:30 AM**

A good ways up the mountain, a blacksmith sat watching over the city he’d poured far more of himself into than he’d ever imagined. When he first came to Rakin, [he’d thought little about how his weapons might be used](https://www.reddit.com/r/StardustCrusaders/comments/1e4abah/), he cared only for getting his sales. But things had changed, this city had changed, *he* had changed. Blake Smith knew not just the difference between a sword that cuts and a sword that kills; [he knew what it meant for a sword to *dream*.](https://www.reddit.com/r/StardustCrusaders/comments/1fhr1mv/) His hands that forged weapons had now forged a brighter future, one free of the Metropolis Suite, one with room for the heroes the city had cried out for.

And so he sat, content, looking out over Rakinnagarh.

But not quite in the peace and solitude one might imagine.

“So, Blake, what’s next?” the voice of ｢Rich Girl｣ asked for the umpteenth time, once again breaking him from his thoughts. The spear, as usual, had not stopped speaking the entire walk, despite Blake’s own attempts at quiet. “You’ve still got more of us to sell, can’t let that fancy sword have all the fun! Or maybe another adventure, like the one we went on in that Nightbloom Trial?”

“The Metropolis Suite is done for,” Blake said. “Can’t I have a moment to breathe before we jump back into everything?”

“No, no, she’s right,” ｢Guessing Games｣ rattled in discordant harmony. “We can’t shake the feeling there’s another shoe about to drop. It’s not over yet, we have to keep doing… something! Besides, Sulka could still be out there, we gotta be prepared. Sometimes we can still hear their voice…”

“See, these guys get it!” beamed the spear. “I dunno about all the paranoia, but we can’t just sit around and wait.”

“That cat’s been looking at you for a while.” [Out of Touch] chimed in suddenly, breaking the flow of the conversation.

“A cat?” the three prior members of the conversation asked, bemused.

[Guessing Games] shrieked out in addition, “I knew we were being watched! They’re over there! It’s enormous!”

Sure enough, a large orange Maine Coon strolled out of the treeline, confidently making its way right to Blake and his living armory.

“Ooh, she seems friendly,” said ｢Rich Girl｣. “Who’s a good kitty, do you want skritches? Blake, you gotta pet the cat for me, I don’t have arms!”

Personally, Blake felt like more of a dog person, but he obliged the spear’s desire to pet the cat. Honestly, he didn't take much convincing. As far as he was concerned, Maine Coons really were about as good as cats got. The bigger the better. As the cat purred at his side, Blake finally noticed a strange device on its collar. As he touched it, a recorded voice began playing back from it.

“Hello friend! My name is Titan Patel. If you are hearing this message, my associate Princess Zora has successfully tracked you down. You may not know me, but I am a friend of Jim Peckle and Angelino Caballero, and I need your help. I have an important project, and only someone as skilled as you can help. Meet me at Bonnie’s Bar tonight, and myself and my comrades will explain everything.”

Princess Zora regarded Blake expectantly. The look in her eyes was more intense than he had expected from a cat. 

“Ooh, exciting,” the spear vibrated. “We gotta go check it out! Come on, ｢Guessing Games｣, tell him!”

“This sounds like it could be important,” the knives jingled. “The whispers tell us to meet our destined fate.”

“Sure,” Blake said. If nothing else, he was curious as to what exactly he was being sought out for.

Clearly understanding Blake’s interest, Princess Zora gave a mighty rumbling purr of approval before striding away. A moment later, a stand body in the shape of a large unicorn made of a cloud-like material, presumably the cat’s own, materialized and whisked her down the mountain. 

While his weapons oohed and ahhed at the majesty of a Maine Coon gracefully floating down a mountain on a unicorn, Blake stared out with a mixture of disbelief and curiosity. What had he gotten himself into?

---

**Scenario: Bonnie’s Bar — 7:30 PM**

Marali slid into Bonnie’s Bar through the back, nobody noticing her entrance — just the way she liked it. She slunk through the kitchen pocketing a few utensils here or there before walking out into the main room. She thought back to the events that had led her here as she took in the space. Being away from her precious mall was… uncomfortable to say the least, but the offer she had received was too interesting to not look further into.

It was one thing to have a cat following you around in the mall. It was another to have ten of them tracking you around. Eventually a tabby had come out of the shadows with several pictures of her shoplifting and a piece of paper that read simply “U hElp Wit heIst, Go tOO BonNy Bar ToonIght”.

The blackmail effort was solid and the threatening note was the cutest she had ever read. Beyond that, such an opportunity piqued Marali’s interest, if only in the mechanics. She was personally more of a petty thief, but if she was able to score something for herself out of this, she’d be more than happy to take part. And hey, the cats must’ve seen something in her to pull out those pictures.

Focusing on the room, the first thing she noticed was a group of cats pawing at a large sheet of paper on the table, meowing at each other. They meowed in a cadence almost like speaking, and it looked like an orange cat in a harness and boots and the blackmail tabby were on the edge of a full blown fight. All the while a guy she didn’t recognize sat at the table, polishing the tip of a spear. Figuring that this was the meetup spot, and seeing the cat from earlier being part of the group, she walked over to the man and decided to take a seat.

“Hey! Name’s Marali; you’re the one taking care of these guys?” She turned to the man seated next to her to ask.

He gave a small chuckle before speaking “Nope. I’m as clueless as you. I’ve been sitting here for the better part of an hour and other than a break to chase a fly around the bar and knock over a few glasses, those four have been hard at work. Name’s Blake, by the way. I’m a blacksmith.”

Mirali tilted her head as she processed the situation “So it's the cats that are planning this whole thing?”

Blake stowed his spear and began honing a few of his throwing knives. “Seems to be the case. Titan there, the tabby, is the ringleader here, but he hasn’t been spilling the details.”

Seemingly shocked out of his focus by the sound of his own name, Titan leapt off of the bartop and ran over to the pair.

“Sorry for the wait and thank you for showing up! I suppose I owe you an explanation about what is going on. Nearby is a cannery and warehouse that used to be owned by the train lady from the Suite. It is full of fish. We are going to steal all of the fish from the cannery so the other cats can have a fish feast!”

Mirali and Blake stared blankly at the cat for a second. Blake found his words first. 

“Why is this fish feast so important that it was worth getting all of us involved? Don't you have owners that feed you?”

Titan pawed dismissively at the comment “Many of the city cats don't have formal owners, and all of them have been helping me keep an eye on things since the riots. You would be surprised what incriminating things people will say in the presence of a cat!”

While Blake processed what he had just learned, Mirali leaned back in her chair “Why bring us in specifically for this, Titan? A mall rat and a blacksmith aren’t exactly the dream team for most heisters.”

Titan paused for a moment, trying to find the right words before deflating a bit “Honestly, I just heard about you from Angelino in passing and assumed I could rope you in. Looks like I was right, though!”

The smug grin on Titan’s face at the end of his statement got a solid chuckle out of Marali as she shrugged. “I can’t argue that it worked.”

The door to Bonnie’s Bar opened, revealing a group of four people; all pretty well known in the stand-using world of Rakin at this point, although some of them had faded into the background for good reason: Vasant Verve was the one to open the door, ushering the other three in. He seemed about as on edge as the man could be. Next, was Gioia Arancini, as fabulous as ever and never caught without a to-go cup of something caffeinated in her hand. 

The pair that entered next, however, was quite the surprise.

Mirali gasped, “It can’t be!”

Blake readied his throwing knives. “I thought you were finished.”

Titan shrugged “You know, me from a few days ago wouldn't believe this, either.”

The Buppet, Windy, was being carried piggyback by Ichi Ni San Go, formerly known to the world as The Middleman.

---

**Scenario: Vasant Verve’s Cabin — 2:00 PM**

The cozy cabin had become a frequent visitation place to many of the Moonbeam Riders. In recent days, some had felt they had spent more time there than at Soma’s Cup. Windy pursed her lips as she considered it, kicking her legs off the edge of one of Verve’s finely carved wooden tables. Maybe it was a sign of change! Without a Suite to push against, were the Moonbeam Riders needed? Just the thought put a long sharp needle of anxiety through the cloth of her chest. She couldn’t let them just fall apart! She… She…

“Windyyyyy~!” A high-pitched voice cried out in a whining tone. “You’re spacing out again!”

The voice shocked Windy out of her stupor, bringing her back to reality. “A-Ah! Sorry, sugarcube. I’ve just… Had a lot on my mind.” For a moment, she had been so wrapped up in her nervous fantasies that she had forgotten where she even was. She was spending time with Ichi, helping her adjust the best she could to a normal life. Verve was idly reading some magazines nearby, keeping an eye on things.

“Like what?” Ichi asked innocently.

“I…” She mumbled. She didn’t want to elaborate on the actual reason, so she quickly rooted around in her mind for an alternative. “I was thinking about how Titan was gonna gather up a bunch’a his fellow kitty cats to pull some mischief. Stealin’ fish from a warehouse, I think? Prob’ly dragging a few friends along…” She didn’t have the heart to outright lie to Ichi, but she figured the anecdote would at least entertain her.

Ichi immediately shot to full attention. “So, you are telling me that there are going to be a bunch of cute kitty cats all together running around with a bunch of fishies?

For a moment Ichi sat still and processed the information. She then slowly began vibrating faster and faster before she finally exploded. “IwannahelpIwannahelpIwannahelp!” She practically shouted. “Pleeeeaaaasepleasepleasepleasepleaseplease!”

“I-Ichi…” Verve’s brow furrowed as he was startled up from his magazine. “I’m not sure you’re ready to… Go out again. Especially if it’s to start trouble.”

Windy, on the other hand, beamed, quite literally waving off Verve’s worries with a wave of her felt hand. “Nawwww, it’ll be fine~! It’s good she wants to help, I think. Besides, this could be a real breakthrough, I reckon! We haven't seen Ichi this excited in.. ever!”

Verve scratched at his beard as he pondered it. It took him a solid twenty seconds, the brass gears of his mind crunching the situation down into its component parts.

“...Alright,” he said. Suddenly, his expression grew firm. “But I want Ichi with someone who we know can keep up with her. I don’t want anything going wrong if it doesn’t have to.”

Windy was almost intimidated for a moment. Verve had a soft touch, but he could occasionally give her a reminder that Rasna inherited her throne from *him.* “No worries, cap’n!” She said, giving a mock salute. “I know just the guy!”

Verve took a moment before both literally and figuratively putting his foot down. “No, if we’re going to send someone to be Ichi’s chaperone, then they have to be someone who’s proven that they’re able to handle her if things get rough.”

Verve pulled out his phone and shot out a quick message. After a few moments, the ping of a response and a soft smile from Verve all but confirmed that the chaperone had agreed. He turned to Ichi and Windy with a mixture of worry and acceptance on his face. 

“Alright, our…mutual friend said yes. How about you put me in contact with the,” he chuckled to himself in disbelief, “the cat that’s putting on this “fish heist”, so we can make this whole thing as safe as possible for everyone.”

The squeal that erupted from both Windy and Ichi was as ear piercing as it was joyful.

---

**Scenario: Yu Wright Cannery, Port Konwar — 11:45 PM**

Gioia took a brief sip of coffee from her thermos as she looked across at the group’s target: the cannery that the cats wanted to raid was right next to a dock, with security moving to and from the docks and the buildings—the graffiti on the side of the wall showed this was not the first time someone had snuck into the cannery.

The plan was to have two groups, each containing a pair of Stand Users and a small horde of cats, to go in and steal as much fish as they could. Even now she could still hear the yowls of the cats sitting along with Titan at a high vantage point, appearing to be giving commands out to the cats gathered for this heist. Elsewhere around the outskirts of this area of the docks, Vasant (Verve) and Windy were helping by convincing anyone passing by to avoid the area—Gioia had also convinced her roommates Lou and Violet to help with the same as well.

She looked back at the strike teams that were made: Blake and Marali were paired up, while she would be working with Ichi. Gioia mused on that fact: a few months ago this woman had been [trying to kill her](https://www.reddit.com/r/StardustCrusaders/comments/1ed2z4u/), and now? Here the two of them were, trying to steal some fish, with 20 or so cats waiting in the shadows right behind them.

“...This shouldn’t be too hard,” Marali spoke first, Gioia noticing while turning back from the cats behind them. “I could easily have done this myself, but if we’re not careful the guards might spot you three.”

Gioia could only smirk at that. “Well, [I’ve snuck into places with better security than this](https://www.reddit.com/r/StardustCrusaders/comments/djw3rp/jojos_bizarre_adventure_oc_tournament_4_r4m6/?)—we’ll be fine!”

“So have I!” Ichi shot up, causing Blake to hide his face as he winced at the context.

Marali turned to the other pair, looking them up and down. “Hmm…if you’re that confident, perhaps you’d be up for a little competition?”

The blacksmith looked up. “So, something like whoever gets the most fish wins?”

The knives at his sides shook. “A challenge of destiny…this was written in the stars.”

Ichi beamed with joy. “A contest! Yes, yes, yes, yes, Yes!”

Gioia turned back to the dockyard. This sort of thing always turned into a contest when Stand Users were involved, and if it’d help with Ichi in any way it was worth a shot.

The groups heard from behind them a distinct combination of cat yells—the signal to start. Titan had said that it would be cat for a certain phrase:

**Open the Game!**

---

**Location:** Yu Wright Cannery and Docks, as depicted [here](https://imgur.com/a/rJhJzAE). Each square is 1x1 meter. The cannery contains several crates of tinned fish and several bins filled with small and medium fish, along with a massive prize fish located in the locked upper office upstairs.The warehouse is filled with several bins all filled with mixed fish, along with a few racks of larger fish. The fishing boats all have 2 bins of fish and fishing gear on them. 

**Goal:** Steal more fish than your opponents within 10 minutes! The amount of fish that you have stolen is measured in weight. There are four sizes of fish, being small, medium, large, and massive. Small fish weigh five pounds and can easily be carried by a cat. Medium fish weigh 10 pounds and can be dragged by two cats working together. Large fish weigh 20 pounds and can be best carried in two hands, and are found in pairs on the blue tables. The only massive fish on the map is the prize fish, which weighs 80 lbs and is worth 200 lbs due to its superior quality! 

Live fish can also be caught during the match using fishing rods on the boats, small nets, or by hand! Each live caught fish is 10 pounds, and worth 20 lbs due to their superior freshness! There are also large, 5 pound tin cans of fish on the map and pack 10 to a crate in the orange crates around the cannery. These can be scored for 5 pounds by opening the cans and dumping the fish into your team's bin. An unopened can or any fish left in an open can will not count for scoring. The fish must be fully free from the cans to count.

There are 200 pounds worth of tinned fish, 200 pounds of heavy fish, 200 effective pounds of huge fish, and 50 pounds of small and medium fish per bin for a grand total of 1700 pounds of fish on the map. Also there is a total of 20 fish that can be caught in the water for an effective 400 pounds of fish. This means that 2100 lbs of fish total are in play.

Fish are scored by running them to a pair of bins with doors connected to Soma’s Cup in them. A fish is only counted as scored when it enters your team’s bin and goes through the door, and can be stolen at any point during the match. Preventing your opponents from scoring by blocking their bin or obnoxiously guarding their bin will reduce the amount of fish from the heist and result in a loss for your team.

There are also 16 security guards on the map, with 2 in the office, 3 in the cannery, 2 in the warehouse, one on each boat, and 7 outside scattered around the map. They have 3/3/3 physicals, 4 security guard and 1 animal lover. They refuse to do anything to interfere with the cats, but will attempt to intercept and arrest any non-cat that they see. They are armed with a baton, a taser, and a set of handcuffs and can see stands for the purposes of the match. Harming them is not an instant retirement, but severely injuring a security guard will freak out your cats, leading to four of them running off for the remainder of the match. Killing a security guard is murder, wrong, and will result in the scathing judgment of the cats and an instant loss.

**Additional Information:** During the match both teams have a dedicated band of 25 cats. These cats have 2/2/2 physicals, a 2 in Cat and a 2 in Translator Devices. They are, for all intents and purposes, normal cats that have the ability to understand relatively simple commands. They generally can follow one sentence orders, and otherwise revert to running to the nearest small fish, grabbing it, and running it back to their team’s bin. Harming any cat is an instant loss condition, though they can be intercepted and have their fish stolen or otherwise hindered as long as it does not cause lasting injury.

Catching fresh fish is also no simple task; the darkness of the water and their natural speed makes them challenging to catch. The tools on board the fishing boats are perfect for catching them, but the fish take some time to get caught in the net or bite a hook.

Blake has access to ｢Rich Girl｣ and ｢Guessing Games｣ for this match.

Team|Combatant|JoJolity
:--|:--|:--
Heart of the Rose|[Blake Smith](https://www.reddit.com/r/StardustCrusaders/comments/15xoqn6/jojos_bizarre_oc_tournament_7_registration/jx7f74y/) with [Marali Whales](https://docs.google.com/document/d/1tlKrATKa4DsA5X6auN53kFOj2chhyftbciCHCKJN30k/edit#heading=h.lhnyiqexoztc)| **“Got him! He took the bait!”** While you have some feline assistance you have to keep your eye on your mark if you want to win the day. Perhaps it takes one to steal one? **Be as fishy as possible in how you go about winning the match!**
Evergreen|[Gioia Arancini](https://www.reddit.com/r/StardustCrusaders/comments/15xoqn6/comment/jx7gp9f/) with [Ichi Ni San Go](https://pastebin.com/sQk2R6J1)| **“Wow, the sun is really warm and relaxing today. Let's start the morning off with some grooming! My coat is my pride, after all.
”** When on a heist the team is everything, and it just happens that your team is a bunch of cats. Perhaps taking some inspiration will help you win the day! **Be as catty as possible in how you go about winning the match!**

---

[Link to Official Player Spreadsheet](https://docs.google.com/spreadsheets/d/1qxcfjACBuAndRWJX6gubgLWci9EqpAJtV4sDHtO5L50/edit#gid=0)

[Link to Match Schedule](https://docs.google.com/spreadsheets/d/1pttP0gD1QbAgQ7q0mqohoLBsYOdujEhAyJ3l4pD55CE/edit#gid=2080577313)

---

*As always, if you would like to interact with the tournament community and be among the first to get updates for the tournament, please feel free to PM a member of our Judge staff for an invite to our Official Discord Server!*",2,1731374384.0,StardustCrusaders,0,1.0,False
