id,url,title,text,score,created_utc,subreddit,num_comments,upvote_ratio,over_18
1mj5ino,https://www.reddit.com/r/crossfit/comments/1mj5ino/crossfit_games_2025_my_first_experience/,CrossFit Games 2025: My first experience,"Few disclaimers before we begin:

* I've been doing CrossFit for about 12 years on and off
* Had never had a major interest in watching or attending the Games, aside from following the big names from the 2012-2015 era (the Dottirs, Mat Fraser, Brooke, Camille, etc.)
* I don't like DC and the way everything around Lazar's death has evolved

Here is my experience:

I was not planning on attending the Games this year, but once I found out they were in Albany and a 4-hour drive away, I thought we could make a day-trip for Saturday since my wife is a major Tia fan and is very heavily into CrossFit (4x week and competing semi-regularly). Cut to two days after making the decision and looking to buy the tickets. My wife wins two all-weekend tickets at the gym, so that settles it. Pay for the hotel with some points we had, and my MIL was to take care of our daughter, and we were off to Albany Thursday after work, arriving there a little after 11 pm.

Day 1:

We wake up bright and early to catch event 1 at Jenning's landing. Met up with a friend who has gone to the Games almost every year since 2014 at a cafe across the street around 7:15 am, it's packed with people going to watch the games, supposedly DC's assistant was there and had ordered a coffe with *six* espresso shots in it, even the barista was a bit freaked out. After being in line for about 5 minutes, Sydney Wells walks in with her mom and some friends, and we look around, and Scott Panchik is there as well. My wife starts getting excited as we weren't expecting this kind of closeness to people who were big in the CrossFit world. People gave them their space and didn't really bother them at all. Scott and his wife chatted with a couple that had a toddler in a stroller, and that was it. Around 8:00, we finally get our coffee and start walking over to the event space. The workout had already begun when we got there. After the first lap, we stand on the sideline and catch the leaders running by, Adler, Roman, Tia, Medeiros, Brandon, and Brooke. My wife started getting tears in her eyes from how overwhelmed she was watching these people that she idolizes, a mere 6 feet away. 

The individual event wraps up, and we start heading over to park at the arena before starting to look around for somewhere to get breakfast before the rest of the events. We ended up having to walk back to the original cafe about 1 km away for a bagel since everything else was packed with people attending the Games. Made it back in time to catch heat 2 of the individual women's event and made our way to our seats, third row, right in front of the rig, great seats! 

After event 2 finished, we headed to the vendor village in a separate building to see what was available. The athlete's warm-up area, lounge, and rallying point were right underneath the vendor village and you had to walk through it to get to the village. I was not expecting such closeness with the athletes during competition; fans were chatting with them, and some were taking pictures and selfies. We ended up spending more money than I thought we would. My wife got some lifters and trainers, I got a pair of trainers, and some t-shirts. Great time to be getting back into CrossFit as I bought everything I needed there, we sacrificed the Teams event in order to get shopping done for the weekend, and be able to fully focus on the Games. 

Once we finished, we headed back to our seats and settled in for the rest of the day, only leaving to get lunch at one of the stalls outside the arena. My wife managed to grab a pic with Arielle Lowen, who she's also a huge fan of, in between events and not inside the arena or a regular athlete area, which also highlights the closeness that some athletes had with the fans. The day finished, and we headed out to dinner before going back to our hotel. Overall, 9/10 day for us, everything was well organized, clean, the vibe was great, and being around like-minded people was amazing. No complaints today, other than not being able to grab a selfie with Tia.

Day 2:

Once again, up bright and early, this time we grabbed breakfast at the hotel to avoid the packed places downtown, and saw Callum Clements and Bronislaw Olenkowicz were also staying at our hotel. We headed back to the arena, enjoyed a full day of events, and managed to watch some team events as well. I enjoyed the team events, seeing the chaos unfold, and how they have to work together was as impressive as any individual event. Although the arena was not sold out, I feel the ambiance was good, and people were very involved in what was going on. To say that the place erupted when Mertens nailed the 570# backsquat is an understatement. We ran into Alex Gazan a few times; she was a sweetheart and recorded a video for our three-year-old daughter back home. We also met and chatted with Gustavo Errico, of TTT CrossFit, after we found out he was also from Venezuela. I got a pic with Dani Speegle. It was a great day, and really drove home the point of how accessible the athletes were and how down-to-earth some of them are. We ate exactly the same food we ate on Friday, that's a negative, more variety would have been great, there was stadium food, but that was not really what we wanted. At the end of the day, still no pic with Tia.

Day 3:

You know the drill by now: up early, breakfast at the hotel, and off to the arena for the day, after checking out. At the arena, we were treated to a full day of almost all events being on our end of the floor, so we got to see the action up close. The men's and team's heats were electric. Tia was dominant as usual. It was an emotional moment with Brooke's last event, and overall, the place was upbeat and vibrant, although still not sold out. For the final event, they allowed everybody to move to the lower bowl (although security was very lax the entire weekend with seat assignment), probably to try and make it look more packed for the cameras. Watching Hopper win was exciting, and seeing Tia crowned for the 8th time was as impressive as always. Seeing the athletes interact with each other during the awards ceremony was just like watching the people at my gym. After that, we packed into the car for the 4 hour drive back home after an amazing weekend, although sadly, no pic with Tia.

Takeaways:

* The Games this year were very basic and simple. After last year and Lazar's death, I think that's what they needed and wanted, something that can go off without a major hitch and to provide a solid base for a rebuild.

* I don't know if it's been this way in the past, but having the athletes be as approachable and open to interacting with the fans is a huge positive and does wonders for fan interest. It paints the athletes in a different light and makes us more invested in the outcome.

* More vendor variety, both in food and shopping opportunities, would've been appreciated; maybe it was due to a lack of interest, or just because of how small a city Albany is. This is an improvement that I think can be made. Also, having vendors pick up before the final event is done, I believe, is detrimental and misses out on last-minute sales when people are at their most emotional and probably more willing to buy something; however, this is something that happens at almost all sporting events.

* After 11 years of not really caring about the Games, I am now very interested in attending again next year, and even bringing our daughter (we facetimed her during a heat where we had Tia very close and she was over the moon watching her and cheering her on). And this goes not just for the CrossFit Games, but also any other event (Rogue, Wodapalooza, etc.) I am more invested now.

* If you left CrossFit and you're looking to return, I strongly recommend going to the Games just before; the high you get and mental state does wonders for that return.

Hoping things improve for next year, and looking forward to attending as well!",9,1754488952.0,crossfit,0,1.0,False
1mj5i6x,https://www.reddit.com/gallery/1mj5i6x,What could be the ingredients in this cookie?,I ordered this from a local coffee shop. They claim it has no oil and flour. It tastes straight up  baked chocolate to me. Maybe a mix of cocoa powder and dark chocolate? Idk. Any idea? ,1,1754488921.0,Baking,4,1.0,False
1mj5i64,https://www.reddit.com/r/WaysToMakeMoneyOnline/comments/1mj5i64/simplii_financial_referral_code_reddit_2025_50/,Simplii Financial Referral Code Reddit 2025 - $50 Refer A Friend Signup bonus + potential for a $300 direct deposit bonus,"*These offers are exclusive to Canadians (who are new customers to Simplii), excluding residents of Quebec.*

The link - [Simplii Financial Signup Link](https://invitation.codes/go/685d57f3bdfffa09e929801f)

Simplii Financial is a trademark and division of CIBC. Banking products and services branded Simplii Financial are offered by CIBC. You can access your money from any CIBC ATM in Canada without a fee. You can also withdraw money from any non-CIBC ATM displaying the Interac® or PLUS\* signs. Additional costs may apply, including any fees from the owner of the other machine.

To get started with a No Fee Chequing Account, High Interest Savings Account, Cash Back Visa Card or Personal Line of Credit please apply through the [Simplii Financial Refer-A-Friend link](https://invitation.codes/go/685d57f3bdfffa09e929801f), otherwise you will not receive the $50 welcome bonus.

When using this Simplii Financial refer a friend referral link (or referral code for mortgages), you must follow all the instructions to set up your new Simplii account and complete the eligible activities:

* If you open a No Fee Chequing Account or High Interest Savings Account, you must make a deposit of at least $100 within 6 months after account opening, and maintain a minimum balance of $100 for at least 30 days.
* If you open a Personal Line of Credit or a Cash Back Visa Card, you must use or spend a minimum of $100 from the selected account within 6 months of opening.
* As a bonus, earn up to an additional $80 in your first 3 months with 8% cash back on eligible restaurant, bar and coffee shop purchases with your new Simplii Cash Back Visa\* Card.
* If you open a Simplii mortgage, you must fund your mortgage within 120 days. 

To get started with a Simplii Financial Mortgage please use referral code: **0009294970**

If you open a No Fee Chequing Account by October 31, 2025 at 11:59 pm (ET) and add an eligible direct deposit of at least $100 a month for 3 straight months you'll earn an additional $300 direct deposit bonus!",1,1754488920.0,WaysToMakeMoneyOnline,4,1.0,False
1mj5hxc,https://www.reddit.com/r/Empaths/comments/1mj5hxc/empaths_in_la/,Empaths in LA,"Hey guys this post is from my friend summer who is unable to post this on reddit because she doesn't have enough activity history.

Any empaths in LA? It is so hard to find other empaths. I would love to start a meetup or coffee group. Feel free to message me! https://www.reddit.com/user/Summer_36/

",1,1754488904.0,Empaths,0,1.0,False
1mj5hci,https://i.redd.it/ojtwy3o6oehf1.jpeg,H: 600 coffee + 100 canned tasty squirrel stew W: glow pig or glow bot,,3,1754488867.0,Market76,1,1.0,False
1mj5h8a,https://www.reddit.com/r/PromoCodeShare/comments/1mj5h8a/simplii_financial_referral_code_reddit_2025_50/,Simplii Financial Referral Code Reddit 2025 - $50 Refer A Friend Signup bonus + potential for a $300 direct deposit bonus,"*These offers are exclusive to Canadians (who are new customers to Simplii), excluding residents of Quebec.*

The link - [Simplii Financial Signup Link](https://invitation.codes/go/685d57f3bdfffa09e929801f)

Simplii Financial is a trademark and division of CIBC. Banking products and services branded Simplii Financial are offered by CIBC. You can access your money from any CIBC ATM in Canada without a fee. You can also withdraw money from any non-CIBC ATM displaying the Interac® or PLUS\* signs. Additional costs may apply, including any fees from the owner of the other machine.

To get started with a No Fee Chequing Account, High Interest Savings Account, Cash Back Visa Card or Personal Line of Credit please apply through the [Simplii Financial Refer-A-Friend link](https://invitation.codes/go/685d57f3bdfffa09e929801f), otherwise you will not receive the $50 welcome bonus.

When using this Simplii Financial refer a friend referral link (or referral code for mortgages), you must follow all the instructions to set up your new Simplii account and complete the eligible activities:

* If you open a No Fee Chequing Account or High Interest Savings Account, you must make a deposit of at least $100 within 6 months after account opening, and maintain a minimum balance of $100 for at least 30 days.
* If you open a Personal Line of Credit or a Cash Back Visa Card, you must use or spend a minimum of $100 from the selected account within 6 months of opening.
* As a bonus, earn up to an additional $80 in your first 3 months with 8% cash back on eligible restaurant, bar and coffee shop purchases with your new Simplii Cash Back Visa\* Card.
* If you open a Simplii mortgage, you must fund your mortgage within 120 days. 

To get started with a Simplii Financial Mortgage please use referral code: **0009294970**

If you open a No Fee Chequing Account by October 31, 2025 at 11:59 pm (ET) and add an eligible direct deposit of at least $100 a month for 3 straight months you'll earn an additional $300 direct deposit bonus!",1,1754488860.0,PromoCodeShare,3,1.0,False
1mj5h4z,https://www.reddit.com/r/BigBrother/comments/1mj5h4z/big_brother_us_27_morning_feed_discussion_august/,Big Brother US 27 - Morning Feed Discussion - August 06 2025,"Good Morning Houseguests!

A new day is starting in the Big Brother house! Grab your coffee, tea or beverage of choice and join us as we talk about the feeds!

**Few Ground Rules:**

1. Have fun and respect each other!
2. Before asking for an update, please read the thread first.  Updates are frequently posted and you can get an idea of what is happening from the thread.  Please at least try! 
3. **As this is Feed Discussion, keep the conversation focused on the feeds.**",5,1754488855.0,BigBrother,54,1.0,False
1mj5gyq,https://www.reddit.com/r/nosleep/comments/1mj5gyq/you_have_to_find_her/,You Have to Find Her,"Half past eight, Carolee shuffled into the corner bodega, pieces of her tattered sneakers slithering around her feet. Seven minutes later, she reemerged. Like clockwork. She scurried down the sidewalk, canvas bag sagging off her shoulder.

“It’s just little stuff,” the cashier had told me a few weeks before. “Protein bars, chips. A can of soda here and there. The Rodriguez’ would kill me if they knew, but shit. I just feel bad for her.”

I slipped from my car and across the street. Naked without my camera, the evening's thick humidity still weighed on me. Clung to me. Entering the alley felt akin to being swallowed.

Carolee's mass of messily threaded braids bobbed around a corner.

The alley spread out like veins, opening into narrow pathways scattered throughout the beating heart of the city. Turn here. Turn there. Mind the unforgiving brick closing in. The deepening shades of rot to either side served as a roadmap.

Though the final dregs of murky daylight still dripped from the sky above, a burst of fluorescence up ahead left me reeling. Just last week, that fixture had been barren, the door beneath it equally lonely. Paint peeling, knob missing; the city might’ve boarded it up had an official been bothered to wander this far.

As my hand met flimsy plywood, something in my belly clenched tight as a fist. I pushed ahead.

Dust danced before me, softly illuminated. Nests of moth-eaten blankets and cracked syringes crowded the periphery of the abandoned living space. No audience, as far as I could tell, but a distinct image of desiccated bodies pulling themselves from cloth-covered graves flashed through my mind. 

There was no room for doubt. I wouldn’t get a second chance.

I cleared my throat.

“Carolee Mick? Are you in here?” The words crawled their way through corners and cracks before bouncing back to me. They were met with silence. I pulled the door closed behind me and slipped my phone from my pocket.

“I just need to speak with you. And then I’ll leave, if you like. Just fifteen minutes of your time.”

Shining my flashlight made it worse, the pure squalor of the surroundings. Scattered wrappers, molded styrofoam. I pushed forward into what was once a dining room to find a bucket in the corner overflowing with human waste.

“Your parents just want to know that you’re okay. They’re very worried about you.”

Shrill laughter pierced the air. I couldn’t tell where it came from. Another door in the corner led me to the kitchen.

“Look, I’m not here to make you do anything you don’t want to. You're an adult now, it's your decision. But your family deserves some closure, don't you think?”

A cabinet door shot open, wobbling on its single hinge. A shadow scuttled inside, sending shivers radiating down my spine.

Technically, my job was finished. It'd been finished days ago when I'd sat across from Mr. and Mrs. Mick, slid glossy photos across their marbled countertop and confirmed that the grimy street urchin captured within was, in fact, their missing daughter. I offered hope less often than I dashed it, but it wasn't my responsibility to bring her home.

Yet this case had burrowed into me like a thistle.

The back exit was blocked by an overturned refrigerator. A half bath to my right was empty save for its share of apocalyptic debris. One darkened archway remained, my light just barely cutting through to reveal a descending stairwell. 

“I'm coming down, Carolee. I'm not here to hurt you. I promise. Just stay where you are.”

It was her picture that’d grabbed ahold of me, erupted into my mind in the dead of night, or while in line at the coffee shop. Not the ones that I’d taken, but the photo that her parents had provided: Carolee at twelve years old, wild-haired and fierce, elbows buried in the dirt. She must’ve looked up just as the camera flashed, glaring eyes displaying her eternal frustration at the intrusion.

It’d been charming at first, her parents claimed, back when she was younger. At around six, their daughter had started to dig, ripping holes through their yard with single-minded determination. She’d shove her toys in and cover them up, then spend the day sitting cross-legged in the lawn as though waiting for them to sprout. 

They never did.

As she grew, so did her obsession. Instead of knick knacks, she was soon burying more valuable objects. Her father’s car keys. Her mother’s wedding ring. Their home became a war zone when her offerings were unearthed. She'd bash her head against the walls, tear the carpet to shreds. A severe and unusual form of OCD was the official diagnosis, but no amount of treatment dulled her compulsion. By the time she’d reached her teens, her parents would’ve been relieved to fret over older boyfriends or drugs. Instead, they were locking her in her room at night to keep her out of the dirt.

Yet the dirt was right where she’d found herself. The basement that I emerged into was not only unfinished - it was demolished. Concrete had been ground to rubble, mixed with the loose earth beneath. The floor was pockmarked with wells a half-foot deep. I dared a couple measured steps onto the treacherous terrain, scanning the cavern with the beam from my phone.

“It’s been awhile,” Carolee said, the words enveloping me like a rushing wave. They may have been a whisper. They may have been a scream.

“It’s been eight years,” I confirmed. Eight years, almost to the day, since Carolee had gone missing. She’d slipped out of school between classes. The alarm was raised after her second absence. A neighbor boy who’d been home sick that day had sworn he’d seen her out in her yard. Digging and digging. 

He’d sworn he’d seen her crawl into the hole she’d dug. Sworn it’d closed right up behind her.

“It’s been awhile,” Carolee said. “Since someone’s heard her calling.”

There, in the corner! I jerked my light to the left but found nothing save for some flickering shadows. They stretched and contracted, teasing me from my periphery. The tightness in my stomach turned to stone.

“Carolee?”

“But it’s not enough to hear her, Max. Anyone can hear her, if they try to. Anyone can hope.”

A groan echoed down the staircase. I spun around, yelping at a shadowed figure now crouched on the bottom step. This one didn’t wane. It elongated. Carolee Mick was a slight woman, all skin and bones and draping cloth. Yet there in the doorway her presence felt nigh impenetrable. 

“What do you hope for, Max?”

I scrambled backward, heel sinking into a ditch. Fragmented rock tore into my back and my phone clattered across the floor. It landed prone a yard or so away, beam pointed skyward and offering the smallest hint of illumination.

Carolee loomed over me, grimly cheeks pulled into a grin. Those eyes were fierce as ever, reminiscent of the young girl she’d once been; tow-headed and stubbornly streaked in dirt. Yet when her lips parted to reveal blackened teeth, graveyard breath, the pressure building in my gut erupted into a scream.

She dropped to her knees and forced a fistful of rocky earth into my mouth. 

“It’s not enough to hope, either. Hearing and hoping, that’s what they all do. Because they’re afraid. Because they’re cowards.”

I rolled to my belly, gagging and clawing at my lips. The feral creature at my side skittered a few feet in front of me and perched on the edge of another crater. 

“If you want her, Max,” she said, “if you want everything, you’re going to have to find her.”

I pushed up on my elbows, struggled to find purchase with my knees. The hole before me was black as night, black as death. Even as my body fought to run, my gaze caught on that hideous well. It wasn’t a trick of the light; the darkness was moving.

Carolee caught my collar, lurched me forward. 

No, Carolee hadn’t moved.

Another scream tore from my throat and was swallowed moments later by the warm embrace of her.

I awoke days later, half buried in a field several towns over. The early morning sun felt like fire on my skin. I gasped for breath and then gagged until a torrent of black soil seeped from my mouth onto the dewy,  torn grass below.

A hiker found me a few hours later, still mewling and weak.

I never told the Micks what happened.

I keep close to my apartment in the city. I steer clear of parks, never venture out of town. It's enough for now. 

It won't be forever. 

My dreams of Carolee have shifted to dreams of soft, pliant dirt. A maternal embrace, enveloping me in endless darkness. I feel it in my gut, shifting in my veins. 

It feels like home.

And each night as I close my eyes I hear a gentle whisper, coaxing me further into the ground. 

You have to find her.



",2,1754488845.0,nosleep,0,1.0,False
1mj5gxx,https://www.reddit.com/r/careerguidance/comments/1mj5gxx/would_this_be_helpful/,Would this be helpful?,"Every time I’ve searched for a job, I’ve wished I could “shop” through openings the way you browse houses on Zillow.

Imagine zooming in and out on a map to explore job opportunities, not just by radius, but by neighborhood, commute, and lifestyle fit (maybe you want to see what jobs are available in the same plaza as your kid's daycare, or on the same block as their school). Then, instead of just reading a bland job post, you could actually see photos of the building, your potential office space, amenities like the break room or coffee bar, and even team or management photos.

This would help candidates visualize themselves in the role before applying, likely leading to more confident interviews and better fits overall.

For employers, it’s a chance to stand out visually and attract the kind of candidates who *choose* them, not just apply at random.

No need to google the company and find their location on google maps. No need to go to the company website or google images to try and get the ""vibe"". I know for some job hunters this won't make much of a difference, but for others, I think it really will.

Curious to know everyone's thoughts on this because I'm in the early stages of creating it. TIA.",2,1754488843.0,careerguidance,2,1.0,False
1mj5grx,https://www.reddit.com/r/Santeria/comments/1mj5grx/birth_day_wish/,Birth Day Wish,"Good day all, I’m a 27 (just turned today) year old Bi male living in NYC. I’m Afro-Latino. Today I was asked by my sister, what I wanted for my birthday. I couldn’t think of anything as I’m not one for materialistic things. And she lives far away. I asked her for a painting since she is an artist. I’ve been giving it a lot of thought and although she can’t help me with what I really would like I’m hoping some one here can. I’m looking to get more involved in the practice. My family was deep in it until my grandmother passed away and my family kinda of went there separate ways. I was hoping to find some people I can sit down bye a coffee/tea and ask some questions. I’m also looking to learn more about this. I went to an Awo Ochun recently in the Bronx and it was beautiful. I would like to take it slow but I’m not finding anyone outside of those events and when I’m there I find it hard to speak to people due to my own social anxiety. If any one would help a fellow person out I would be really grateful. ",0,1754488835.0,Santeria,1,0.5,False
