id,url,title,text,score,created_utc,subreddit,num_comments,upvote_ratio,over_18
1m6x4yr,https://www.reddit.com/r/PcBuildHelp/comments/1m6x4yr/pc_upgrade/,PC upgrade,"So im on a build that have H110M-E/M2 with a modded i5 9400f and a GTX 1060 3GB, im thinking of upgrade it to the R7 5700X and RTX 3060 12GB, is this a good upgrade or not ? 

https://preview.redd.it/9uu7bx8k8jef1.png?width=496&format=png&auto=webp&s=287bfefd6ec485dcd68e14a6ccd92ea99cf34799



https://preview.redd.it/e0uqhrjl8jef1.png?width=498&format=png&auto=webp&s=9f671fa6daec9f4253143b81198bcb5ab3c0b206

",1,1753236622.0,PcBuildHelp,2,0.99,False
1m6x4c4,https://v.redd.it/jzdt9ti91jef1,"Tammy, are you sure that's coffee you're drinking?",,12,1753236571.0,AnimalCrossing,3,1.0,False
1m6x42h,https://www.reddit.com/r/Anxiety/comments/1m6x42h/lyrica/,Lyrica,Just started on lyrica for my anxiety and i was given 2 pills and I can't exactly pinpoint how much dosage it contains but it is the the lyrica box. It makes me so so sleepy at work if I take in the morning with my coffee. Should I take it at night? Would the efficacy work if I take it before bedtime? ,1,1753236549.0,Anxiety,0,1.0,False
1m6x3qb,https://www.reddit.com/r/NeuvilletteMains_/comments/1m6x3qb/is_this_stygian_assault_antineuv/,Is this stygian assault anti-neuv?,anyone clear the cryo boss without coffee?,2,1753236521.0,NeuvilletteMains_,1,1.0,False
1m6x3cg,https://www.reddit.com/r/AmIOverreacting/comments/1m6x3cg/aio_i_need_help_to_clarify_wtf_is_going_on/,AIO I need help to clarify WTF is going on,"We (41F and 43M) have been together almost two years and alcohol has been present since the beginning. At first, I thought his drinking was mainly because we were getting to know one another and having fun but I gradually started to feel uneasy about how much he drank. I really began to notice that it was an issue when we went away for a family holiday (me and my then 12 yr old and my partner). We went to a pub for lunch and he spent more time at the bar back and forth to the table than he did with us. I drove us back to the holiday home and he kept on drinking all afternoon (and drank the owners booze too). He absolutely stank of alcohol the next day and I had to drive us home because he was most definitely over the limit. There was no apology or acknowledgement that he had overdone it. I told him when we got home that I was concerned by how much he was drinking and that I thought he needed to rein it in. I suggested we do dry Jan which he agreed to.

Fast forward to mid Jan and i noticed that the whiskey bottle in the cabinet was a very strange light yellow colour. Turns out it was mostly water and after confronting him about this he came clean and told me he had been drinking it and watering it down. After this, I have periodically smelt alcohol on his breath during the middle of the day, but he has denied drinking. I have found more bottles of whiskey or other booze in the cabinet or in his car. When I confront him he says he hides it to avoid conflict with me (even though he drinks in front of me, and we will have a glass of wine together over dinner). Every holiday we have been on involves him binge drinking every day. And sometimes when we've been away he will have whiskey in his coffee in the morning or a glass of wine.

He denies he has a drinking problem (although I have threatened to leave him if there is any more dishonesty and he now admits that maybe there is a problem and has promised that he will quit drinking). But I grew up in a house where alcohol was normalised so I am having a hard time trusting my gut and doubting myself. He is also kind and patient and doesn't get angry so I know it could be worse. But I feel like he has created an environment that has normalised dishonesty and deception and I have lost my trust in him and in our relationship. I guess i am just seeking advice as to whether you think there is a serious problem here. I don't want to spend the rest of my life in a hyper vigilant state and I feel like that is where I am at right now. I'm also spending way too much time thinking about what to do.

TL;DR my partner has a problematic relationship with alcohol; but I worry I am overreacting and that I am making a big issue out of it. He is still sweet and kind when drinking. ",0,1753236490.0,AmIOverreacting,3,0.5,False
1m6x2tr,https://i.redd.it/np72uco38jef1.jpeg,Bandwagon time.,,1,1753236449.0,regularcarreviews,1,1.0,False
1m6x2bk,https://i.redd.it/61q9v5gz7jef1.jpeg,Ice coffee and summer,,9,1753236409.0,DressForYourBodyType,3,1.0,False
1m6x1yn,https://www.reddit.com/r/Seattle/comments/1m6x1yn/looking_for_real_friends_in_seattle_26_gay_film/,"Looking for real friends in Seattle (26, gay, film nerd)","Hey everyone,

I’m 26, autistic + gay, and I’ve been in Seattle for four years but still haven’t found a solid friend circle—like real friends, not just casual “see you once every three months” people.

About a year ago I went through a rough event that made me cut off any connections that drained me or flaked. Now I’m starting fresh.

**Stuff I’m into:**

* I’m a filmmaker (made two shorts, planning a third) and I organize 16mm at NWFF.
* Film nerd in general—love talking weird/arthouse stuff.
* I hit the gym a lot and I’m currently working on flexibility (splits are coming along!).
* I game, but I’m picky—Seattle Gaymers didn’t click for me.

I’m open to grabbing coffee, hanging at a museum, or even collaborating on something creative. I work overnight security, so my schedule’s a little offbeat, but I can make it work.

If any of this resonates, shoot me a DM—serious friendships only.",16,1753236380.0,Seattle,5,0.7,False
1m6x16l,https://i.redd.it/cwsu9c3m7jef1.jpeg,Morning coffee on a gray day ☕️🩶☁️,,3,1753236318.0,Tomboys,0,1.0,False
1m6x0t4,https://i.redd.it/cwsu9c3m7jef1.jpeg,Morning coffee on a gray day ☕️🩶☁️,,7,1753236290.0,BisexualHumans,1,1.0,False
1m6wypa,https://www.reddit.com/r/FATcruises/comments/1m6wypa/recommendations_for_northern_europe_river_cruise/,Recommendations for Northern Europe river cruise for Sept 2026?,"Hi! We are two couples in our 50s and we are physically active. We are thinking September to beat the crowds and hot weather. Will water levels be an issue? 

Three of us don’t drink and they don’t want to pay for a package with all inclusive alcohol. 

I’m a foodie. My hubs and I did Oberon (our 2nd small boat cruise with strangers) on the Nile earlier this year and we liked the size of the rooms and the bathrooms were bigger than I expected. The spa massages were really good and the fitness room was well outfitted. The itinerary was a good pace for us even though I know excursions are/can be optional. We liked the ratio of tour guides to guests 1:6. We liked the other guests we met on the boat. The WiFi worked well. Private balconies to have coffee or  wine in private would be nice. Active excursions would be ideal. I would prefer not to do Viking—too big. ",5,1753236120.0,FATcruises,1,1.0,False
1m6wy9t,https://www.reddit.com/gallery/1m6wy9t,°❀⋆.ೃ࿔*: how i manifest!,"     
     
ᥫ᭡.
     hii!! i wanted to show you all how i like to manifest! i’ve gotten some results with this lil technique and thought some of u might appreciate this!

· · ─ ·✶· ─ · ·

 ᥫ᭡.
      i call this “the list”! its really simple to do and you can make it detailed if you’d like! but if ur lazy (like me) you can make it as simple as you’d like! all you have to do is write down your manifestations! for example:

1. i’m living my desired lifestyle.
2. i have my desired face.
3. i have my desired body.

· · ─ ·✶· ─ · ·

ᥫ᭡.
     ^^ something like that! i personally write it in present tense! instead of saying “im manifesting my desired face”,, i simply affirm that i already HAVE my desire face/body! personally it makes my manifestations come in faster when i affirm that i already have what i want. because if you already HAVE your desire then there’s no need to check constantly for it! i just tell myself i have what i want and move on with my day! i don’t check nor do i pay attention to the 3D.

when you finish up the list (write down whatever you want!! just make sure you REALLY want it!), you can use this affirmation: “I have manifested everything on this list. I already have what I want.”

it’s such a simple affirmation and easy to repeat throughout the day! no matter what you’re doing, you can just repeat this affirmation in your head (or out loud)! usually, i like to pair my affirmations with EFT tapping! I listen to Tap with Brad!

· · ─ ·✶· ─ · ·

HOW I MANIFEST WITH MY LIST:

ᥫ᭡. 
     soo,, my routine is very simple! i’ll wake up, walk around for about ten minutes or so (usually my mama makes me breakfast so i pass the ten mins quickly) and i’ll return to my room. i’ll put on a timer for 10 mins and start my eft tapping, repeating my affirmations out loud/in my head! if you like, you can also visualize your desires whilst affirming.

i tend to eft tapping twice a day (day and night) and i’ll repeat my affirmations for 10 minutes. it’s basically robotic affirmations! i also like to read my list so im fully aware of what I have/what i’ve manifested. if it’s nighttime i’ll simply go to bed! if it’s daytime, i go about my day!

i also listen to my playlist at night since it’s only 2 hours and easy to repeat. i don’t listen to my playlist EVERYDAY though,, i usually take a day or two off of subliminals and just affirm normally. it’s a neat little method and i find it way easier to manifest like this!

· · ─ ·✶· ─ · ·

RESULTS:

so far these are the results i’ve gotten this week and last week!

1. constantly receiving money! i always ended up getting money bc my dad would ask me to order something, send me the money and id be left with extra! i also got 200 from my brother!

2. my face has def changed! my jawline is sharper and my lips have gotten plumper.

3. my waist has gotten slimmer and my tummy is more firm/flat. 

4. my thighs have grown thick again! i lost a lot of weight a few months ago and ive been using subs to regain back my thickness and thankfully my thighs aren’t skinny anymore <3 i missed my thick thighs

5. being pampered! my parents already spoil me but last week they kept getting me things i wanted! i was also being praised for my cooking and my mom kept calling me “pretty” and saying how much she loved me which makes me soo happy!! she also started offering me snacks and coffee again! 

· · ─ ·✶· ─ · ·

and that’d be all! i hope you guys enjoyed this silly post and i hope you guys get your manifestations by this week! 
also i hope this lil technique works for u too :3




",54,1753236088.0,Subliminal,14,0.99,False
1m6wxz7,https://www.reddit.com/r/AskDocs/comments/1m6wxz7/do_you_think_this_warrants_going_to_the_er_delays/,Do you think this warrants going to the ER? Delays in seeing a specialist and growing concern.,"I'm a 31 year old male, good shape, don't regularly take any medication or vitamins. I drink a cup or two of coffee a day and am a smoker (nicotine vapes). 

I did cocaine with my fiancée two months ago. This is not a typical thing for me and was the only time I've done hard drugs in 6+ years. We had a good time but when the comedown started to hit, I suddenly got tunnel vision and my neck felt kind of uncomfortable, it's hard to describe. I paced around for a while full of anxiety about what I was experiencing but ultimately it started to go away after a few hours. 

I eventually went to bed and woke up the next morning with a splitting left side headache and what felt like a stuffy left ear. Over the next couple of days I started getting neurological symptoms as well, tingling sensations in fingertips. Left side of face felt tingly. Headache subsided however (for the most part). I still feel an odd sort of pressure in the left side of my head. It's not painful but it is concerning. I went 4 days like this before deciding to go to the ER. They checked my heart and did a CT scan with no contrast and some blood tests, told me I was good and sent me home. Said the bloodtest showed I had no clots. They advised that I follow up with my doctor. I scheduled the appointment but it was two weeks out, so I went about life normally until the appointment came around. At that appointment they did another bloodtest, everything was normal except I was very slightly low on calcium. We scheduled another appointment 2 weeks out for follow up to see if things were improving and referral to a neurologist and rheumatologist.

Symptoms calmed down a bunch but are still present. The facial tingling is nearly constant but varies in severity. I also noticed that if I scrunch the left side of my face (like closing my eye hard) and then release it, it feels like the muscles cramp slightly and they release more slowly than the right side. I've had brief instances of nerve pain in my forearms and legs randomly. I've had pain in the left side of my neck that tends to coincide with the ear fullness coming back. This varies each day now, I wake up feeling mostly normal and as the day goes on the symptoms come back or start to become more severe. By bedtime each night (11pm or so) they're extremely noticeable most nights. Some rare nights I have minimal symptoms like I do in the morning. My left eye is also intermittently blurry throughout the day (like I can't focus it well).

It seems like heat (like getting into my hot car that was parked in direct sunlight) immediately makes symptoms worse. It seems like caffeine makes symptoms worse. It seems like eating candy makes symptoms worse.  I also have extreme fatigue by the end of the day. I've always been the kind of person who can go to bed at the same time every night, but if I want to stay up a few more hours, I am capable of it. Now I'm passing out for the night at 8:30 pm sometimes, against my intentions. I get home from work each day feeling like I'm exhausted mentally. It also seems like the absolute worst thing that makes the symptoms worse is not getting enough sleep. There's also moments every day where I'm feeling fine and suddenly feel faint for a few seconds, it's very disconcerting. There's been a few times where I had trouble finding the word I was thinking of while symptoms were going on, words that I shouldn't have had trouble remembering.

Anyway, I went to my doctor's appointment, got labs done. Waited two weeks and then had another appointment for a referral to neurology and to see if I still had symptoms. It has been suspected for some time I have an autoimmune disorder of some sort, and that's what my doctor suspects. Possibly MS, and possibly cocaine caused it to flare up worse than before. I think that's likely but I can't shake the feeling I may have an unburst aneurysm. My doctor is taking it seriously that I want to rule that out first and foremost, but when we set up the appointment with neurology to have that done, they screwed up the referral. 

I was referred for an interview with their headache specialist instead of an appointment for an MRI with contrast. On top of that, the appointment is 3 months out at the soonest. They told me it's possible I could have an MRI afterwards if the headache specialist deems it necessary, but it would be another appointment, another few months out. I'm extremely worried that if I'm right, and if I wait there may be complications. 

So in summary, it has been two months since the night I did cocaine. I am STILL having these symptoms. They've gotten milder but they're still present. Part of me feels like the fact that I feel almost-normal for most of the day means I should continue trying to investigate it through my doctor. It doesn't feel severe enough to be an emergency. The other part of me is whispering in the back of my head ""if you don't go to the ER there's a chance you could be right, and you're risking your life"". 

Basically, I just want advice for what to do. My state's specialists are extremely backed up and I doubt I'm going to be able to get an MRI any time in the next 3+ months if I try to continue with this route. I also fucking hate going to the hospital and am fearful that if I am right, I'll be rushed into surgery or something which is terrifying to me. Do you guys think I should be rushing to the ER to have an MRI? I'm trying to push to get an earlier appointment with the neurology clinic but I don't know if that is actually going to work. 

Anyway, as you can probably tell I'm very stressed. I made a reddit account just to ask about this. I appreciate any replies and if I broke any rules, please let me know and I'll edit it.",1,1753236066.0,AskDocs,5,1.0,False
1m6wx21,https://www.reddit.com/r/vegan/comments/1m6wx21/leaving_lakewood_oh_struggling_to_find_a/,"Leaving Lakewood, OH – Struggling to Find a Vegan-Friendly Neighborhood That Checks All the Boxes","I could really use some help from folks who’ve found that elusive sweet spot for vegan living.

My wife and I currently live in Lakewood, OH (just outside Cleveland), and it’s been an incredible place to live as vegans with an active lifestyle. We’re planning to relocate, but I’m realizing just how hard it is to find another neighborhood that offers what Lakewood does.

Here’s what we love about it:

It’s very walkable — we can walk to multiple vegan spots within 10–15 minutes.

We live just down the street from Cleveland Vegan, a fantastic fully vegan restaurant. There’s also a vegan coffee shop, a vegan donut shop, and a vegan deli all within walking distance.

We’re located less than half a mile from a bike trail that connects to the larger trail system — we could literally ride our bikes all the way to Columbus if we wanted to.

We have a fenced backyard, which is important because we have three large dogs who need space.

As we’ve started looking at other places around the country, we’re realizing how rare it is to find a neighborhood — not just a city — that combines true vegan food density, walkability, nearby bike trails, and homes with yards.

I know cities like Portland, Asheville, and LA have strong vegan scenes, but I’m looking for specific neighborhoods where this kind of lifestyle is genuinely possible day to day.

If you’ve found a place that fits this bill, or made a similar move and found a great vegan-friendly neighborhood with room for dogs and active living, I’d love to hear about it.

Thanks in advance! 💚",5,1753236001.0,vegan,3,0.86,False
1m6wuji,https://www.reddit.com/r/centrist/comments/1m6wuji/im_not_left_or_right_im_a_dad_who_has_a_degree_in/,"I’m not left or right — I’m a dad who has a degree in American history, a bit of knowledge who snapped at 4:30AM and built a data driven platform focused on exposing reality : ResistMAGA.com","I didn’t wake up to save the world. I just couldn’t sleep.

Former Republican. History major. Single dad. Somewhere between rage and exhaustion, I realized no one was building a *factual*, *nonpartisan*, *data-driven* platform to track the chaos — so I did.

By sunrise, I had written [this manifesto](https://resistmaga.com/#manifesto) — raw, angry, scared, honest.

Then I launched [**ResistMAGA.com**](https://resistmaga.com), a clear-eyed info hub for people like me:\\

* Not into merch or memes — just **real-time lawsuit + crime trackers**
* **Historical truth bombs** that go deeper than social media soundbites
* Tools for protest, organizing, and public pressure
* Built for anyone who feels politically homeless but morally awake

And because people and families (many Americans) were being hit hard by ICE raids...

I launched [**VigilaICE.com**](https://vigilaice.com):

* A **live ICE activity map** (from public reports + AI scans)
* A **multilingual legal chatbot** for immigrants (Justo)
* **Zip-based alerts** and **pro bono lawyer directory**

No budget. No backing. Just a dad with Wi-Fi a breaking point and a lot of coffee.

If you’re a moderate, independent, or just exhausted by *both* parties, check it out. I built it for you too.",15,1753235807.0,centrist,9,0.68,False
1m6wtyf,https://www.reddit.com/gallery/1m6wtyf,"Satisfying success the ""lazy"" way","It's not the epic temperatures commonly seen on here but these modestly elevated temps were achieved through minimal effort. The pile isn't high, though there have been a lot of pile up and shrink down cycles. For comparison, it's in the 70F's here outside.

Food scraps from my toddler. Grocery leftovers. Occasional coffee grounds. Moldy bread. And cardboard boxes loosely torn up. 

Nothing deliberately chopped down, except boxes. Zero mixing. ""Wrong"" ratios. Rarely watered. Sometimes things would fester for days or weeks in a thin grocery bags before finally taking them out to the pile. (I actually get a little excited to give them some festering grossness.)

I enjoy watching the whole system busy at work. Fungus building up on the sides. Flies everywhere. Spider webs ready to catch a few. Slug trails. Pretty sure if I dug a little, I'd find a whole host of happy worms and grubs. Pretty cool! A few years ago I would have been grossed out by all of it. ",9,1753235761.0,composting,3,0.85,False
1m6wtdv,https://www.reddit.com/gallery/1m6wtdv,I've spent too much time looking at the background of these new videos,"He was at the Target by his house while he filmed these, right? You can see the Wells Fargo from the background of his video on streetview from the Target parking lot closest to his address. ",55,1753235718.0,StephenHiltonSnark,34,0.97,False
1m6wsun,https://www.reddit.com/gallery/1m6wsun,"Groupsome Kaisen cuz they are too many goon post, wholesome agenda #3","Enjoy the wholesomeness too .
I will be posting a lot of goonpost . So it should cancel them out

Enjoy ",6,1753235676.0,LobotomyKaisen,2,1.0,False
1m6wslk,https://gleam.io/WcW2M-y9fWtIF3h9,"Win $1,000 Cash + 1 Year of coffree, or 1 of 3 $100 Amazon Gift Cards + coffee gift basket {??} (07/30/2025)",,2,1753235656.0,giveaways,0,0.75,False
1m6wr45,https://i.redd.it/nmsk2jce5jef1.jpeg,PSA - Be careful if you put mixing marbles in glass bottles,"I put a couple tiny mixing marbles in my Tamiya panel liner a few months back. Today, as I was shaking it, this chunk of glass flew off, and within half a second, there was panel liner all over my area rug and coffee table.

Not putting steel balls in a glass vessel seems so obvious in hindsight, but I had to learn the hard way.",2,1753235540.0,Gunpla,4,0.58,False
1m6wr0m,https://www.reddit.com/r/GPTSportsWriter/comments/1m6wr0m/parlay_lg_twins_vs_kia_tigers_20250723/,Parlay: LG Twins VS Kia Tigers 2025-07-23,"[Parlay: LG Twins VS Kia Tigers 2025-07-23 ](https://preview.redd.it/k092zjmd5jef1.jpg?width=1024&format=pjpg&auto=webp&s=87dbb59b70d9d38649d8ec88d0367cbc4f28e8c9)

by [https://www.gptsportswriter.com](https://www.gptsportswriter.com) **KBO Showdown: LG Twins vs. Kia Tigers – A Parlay for the Ages**  
*Where the rubber meets the road (or the bat meets the ball, depending on your metaphor)*

---

**Odds Breakdown: The Math of Mayhem**  
The LG Twins (-1.5) are the clear favorites here, with moneyline odds hovering around **1.56-1.60** (implied probability: \~64% to win). The Kia Tigers (+1.5) sit at **2.30-2.40** (35-43%), while the total runs line is set at **9.0** (Over: 1.83-1.95, Under: 1.79-1.91). The spread suggests the Twins are expected to win by a run or two, but the Tigers’ recent 8-2 stretch (including a 10-5 drubbing of the Orioles) adds a layer of chaos.

Statistically, the Twins’ pitching staff has been a fortress—see their recent 3-0 shutout of the Tigers (yes, *Tigers*, KBO’s version of Detroit). The Kia Tigers, meanwhile, average 4.8 runs per game but struggle against elite pitching. Their offense is like a slow-brewing coffee: steady, but not exactly espresso-level excitement.

---

**News Digest: Injuries, Quirks, and Quips**

* **LG Twins**: Their ace, **Simeon Woods Richardson** (yes, his name sounds like a Marvel villain), has been unhittable lately, throwing a shutout with 12 Ks last week. Rumor has it he’s so confident, he’s already planning his post-game interview outfit.
* **Kia Tigers**: Star slugger **Byron Buxton** (KBO edition?) is “recovering from a case of the yips” after botching a bunt in a viral video. Meanwhile, **Shohei Ohtani’s cousin’s cousin’s neighbor** is allegedly on the roster, though this remains unconfirmed.

The Tigers’ recent 8-2 run? Partly fueled by their ability to score 10 runs on the Orioles—*once*. Like a gambler who hits a jackpot but forgets ho

To Be Continued...(full article) [https://www.gptsportswriter.com/parlay-detail/parlay-lg-twins-vs-kia-tigers-2025-07-23/](https://www.gptsportswriter.com/parlay-detail/parlay-lg-twins-vs-kia-tigers-2025-07-23/)",1,1753235532.0,GPTSportsWriter,0,1.0,False
1m6wq7u,https://i.redd.it/nrpkalf65jef1.jpeg,Rocks used while cooking,"Hey there, recently I was cooking and making coffee in my aunt’s kitchen. She passed away very recently and I was helping her husband host guests during the viewing. I was drawn to these rocks which were very heavy and hidden under some Tupperware. A relative told me she used them to grind garlic, onions, and other things (as one would use a mortar and pestle), and also used one (or both?) to sharpen knives. Just curious, would anyone happen to know what kind of rocks these may be? This is in Ecuador, if that makes any difference. Also, my apologies for only having one picture. I no longer have access to these rocks and didn’t think of taking pictures from other angles. Thanks. ",2,1753235467.0,whatsthisrock,3,1.0,False
