id,url,title,text,score,created_utc,subreddit,num_comments,upvote_ratio,over_18
1pj4fkb,https://www.reddit.com/gallery/1pj4fkb,"I don’t know what to do, i need some guidance","hey everyone i don’t know what to do, my dog is about to be 12 years old, a yorkie and i’ve never gone to the vet so consistently in a year in my entire life of having him and i’m dreadfully worried all the time. my dog has been dealing with these chronic GI issues for just about a year now, episodes every other week to every week a few times a week sometimes, symptoms recurring of loud stomach noises first thing i hear when i wake up (as the day goes on they get quieter but still there), i’ll take him outside to use the restroom and will eat grass, i take him inside and for the rest of the day he’ll act sick and tired, usually won’t want his breakfast and is lethargic for rest of day but he’ll never want to miss his dinner and by the next day he’ll acts completely fine again. now these are the MAIN reoccurring symptoms, sometimes with these episodes NOT often only been a few times in a year where along with these episodes he’ll throw up stomach bile (yellow) but then there were probably in total of 4 times where the vomit (stomach bile) was light red (shown in photos) 2 times and the last time a dark red and coffee ground looking (shown in photos), along with loose stools pudding like texture looks especially mucousy at times even when his poop is normal and firm but never completely liquid and sometimes up to 4 times as well the stools would have blood. now the bloody vomit and stool symptoms happened every COUPLE months about 4 maybe 5 times throughout a year. as of right now the last vomit which was the dark red was in august he hasn’t thrown up like that since. i’ve taken him to the vet continuously for a year now especially with the bloody vomit and loose/bloody stools, he’s been treated for all these symptoms, tried different medication, gotten stool tests for parasites, blood work multiple times and the first 3 MAIN symptoms remain reoccurring despite treatment, last week he had loose stools (it’s been a while since any diarrhea) these photos are old except the last one was from last week, i just don’t know what to do i would take him to a different vet since his current one and his treatments have been ineffective but his current vet is the only affordable one even directly near me, any other vet has a charge minimum of $400+ per visit and his current one at most of $250 ish but typically pay way less for his visits, i cannot afford to take him anywhere else right now, i’m behind on my care credit bills i just don’t know what to do for my sweet baby. and to top it all off he has a heart murmur😭 with enlarged prostate all of which he has been getting treatment for, the prostate treatment has been ineffective and he probably needs to get neutered, i had him scheduled for it but the surgery has been postponed as we don’t know if he can even be put under due to his heart, i’m not even comfortable with his vet handling his surgeries or anyone from his current vet. he has a check up tomorrow and we’ll discuss his treatment plans for the near future yet again, practically all i’ve been doing this past year with this vet, talking, some ineffective treatment and running in circles, always going back out of desperation. if i don’t take him anywhere else (i can’t afford anywhere else) i’d feel like a neglectful owner, in my opinion it’s better to go to his vet then to go no where. i just need some guidance on what i can better do to help my baby’s situations and if anyone knows what he might have (the GI issues) please share, any suggestions and advice please.",2,1765378086.0,DogAdvice,0,1.0,False
1pj4fi2,https://i.redd.it/cuagii9e3e6g1.png,Has anyone tried these cakes 🍰🍰🍰🍰 I want bento carrot cake 🍰🍰,,1,1765378082.0,IslamabadSocial,1,1.0,False
1pj4ffz,https://i.redd.it/r3sdgnee3e6g1.jpeg,SG-161,"SG-161 Watch Face Sale & BOGO!
Highly customizable digital watch face. Power efficient, modern design.

Get it on Google Play
https://play.google.com/store/apps/details?id=com.watchfacestudio.sg_161&pli=1",1,1765378079.0,wearosfaces,0,0.67,False
1pj4f6f,https://www.reddit.com/gallery/1pj4f6f,"Okay Greysoul, let's see why everyone won't shut up about your Strawberry in loop !","After trying Caffeine Baar's most-hyped fermentations, I kept seeing Greysoul ""Strawberry in loop"" getting praised on repeat. So I finally gave in and grabbed a pack.

I’ll probably taste it around the 10th Dec just to set a taste anchor, but I’m giving it a proper 15–20 day rest since half of you warned me not to rush it. I’ll trust the collective wisdom this time.”

If you've figured out a sweet spot for this on V60, South Indian filter, or French press, drop your recipes. I'm happy to borrow wisdom from people who've already battled this bean :)",15,1765378061.0,IndiaCoffee,9,0.94,False
1pj4egm,https://www.reddit.com/r/waterloo/comments/1pj4egm/new_apartments_on_coldstream/,New Apartments on Coldstream,"I know people frequent this sub when apartment hunting and I live down the road from these new builds. I got a sponsored ad for them yesterday and had a nosy little look through their website and boy oh boy, I’d say avoid. 


1) The ad was targeting students and talked about how we’re close to campus and how you can get a coffee at your favourite nearby cafe. Tim Horton’s is a 25 minute walk if that’s what they mean. UofW is also probably a 25 minute bike ride away.


2) they completely made up an intersection! They say there is a bus stop nearby at Coldstream and Bridge. Bridge is no where near this area and we don’t have bus stops close by. The nearest one is a few blocks away and certainly not on coldstream. This is a heavily car dependant area. We’re on the edge of the city in a suburb. There are no conveniences without a car.


3) they describe the neighbourhood as ‘vibrant’ and talk about how high end restaurants and bars are a ‘stones throw away’. Again, we’re very much a suburb with nothing in it haha. State and Main is a 30 minute walk if that’s what they’re saying is a high end restaurant/bar?!


4) My personal opinion: these units are way uglier than I expected and do not reflect the price tag. 


I just don’t know who they made these for. The appearance of the units screams shitty student apartment, but a one bedroom is $2k a month and there are no amenities in the building or nearby.

",6,1765378013.0,waterloo,1,0.88,False
1pj4eg7,https://i.redd.it/8xeubgc73e6g1.jpeg,Friday Night Speed Date Show,"As Mariah Carey puts it, “I’m BAAAACKKK”… to let yall know of this months upcoming Speed Date show at the Congregation. Check my
Previous history posts, and feel free to message me questions or just drop a comment. 

This isn’t your typical speed fate event. First this is a three hour event, starting the night off with a happy hour at 6pm. Great for those that want to start their weekend with great drink deals and socialize with others while scoping out our interactive activities before the main event. 

Right at 7pm we open the doors for our Speed Date show, this is a ticketed event and spectating is always welcomed while audience participation is highly encouraged. Enjoy a fun, unexpected and hilarious hour as we randomly select two strangers to hit the stage on a quick first date as Cupid and our Co-Host for the night ask each one questions really getting as much out of them as possible. While also giving the chance for the audience to ask questions and even an opportunity to steal the date! This is a fun way for people to learn about someone either if you’re on the stage or off. Don’t worry each date is super quick and you’ll be wanting to do it over again. 

Finally we cap the night off by opening the floor to our Mix and Mingle. This is a free hour where you can meet those you saw on stage and shoot your shot, or just socialize with locals and enjoy listening to their lives, sharing experiences together. 

I typically host this show but gave birth to my first baby back in October, so we have a new Cupid running the show and from what I hear, last month had the audience craving for more! 

Grab tickets on eventbrite by searching Match Made, or just drop a comment if you’d like me to provide a direct link (I don’t want Reddit mods to flag my post). 

Age range varies but I’d say average is 30-40. Again spectating is always welcomed so even if you’re in the fence, come enjoy a good laugh on a Friday night and if you see what you like you can sign up to participate anytime during the show! 

Ok back to lurking I gooooo 🙃",1,1765378012.0,Detroit,7,0.6,False
1pj4eae,https://www.reddit.com/gallery/1pj4eae,I may have gone a little lumber happy… but I dig it. Any suggestions on a nice stain to finish this off??,"I built these shelves, ladder, couch and coffee table table using klin dry wood. I tried to go for an industrial pallet look to match the 80’s/90’s aesthetic that I have going on. There are certainly a few things I would have done differently (this being my first woodworking project), but overall I am happy with how everything turned out. It’s sturdy as hell and meets my needs.

Any suggestions on a nice stain that could finish this all off??",517,1765378003.0,woodworking,219,0.93,False
1pj4e8u,https://i.redd.it/5kb8u7w53e6g1.jpeg,Christmas Coffee,,6,1765377999.0,animeavatartrading,3,1.0,False
1pj4dwa,https://www.reddit.com/r/socialskills/comments/1pj4dwa/how_to_stop_fear_of_unwanted_attention_hold_me/,How to stop fear of unwanted attention hold me back from joining new things?,"I’m a relatively attractive Asian female and I find myself being really scared to join sports teams, groups, or other fun activities because I feel really uncomfortable when men become interested in me romantically off of just one mere meeting.

It’s the constant stares and weird energy and I just get the chills. I love to dress up, wear makeup, and look good but at the expense of being a target of attention? I’m not wearing anything revealing btw. 

I look through pages/photos to see the demographic of people already at said social groups and determine that some may be interested in me, and IM ALWAYS RIGHT. I always have people following up with me afterwards to get a coffee, or just nonstop staring throughout said social event. It makes me want to crawl out of my skin.

The problem is is this is stopping me from joining sports and other social groups.

I’ve read lots of threads online on how I have to be assertive that I’m not interested, but I’m there to socialize and build community?? 

I either stare with a deer in headlights look and ignore men when they’re super interested in me, or because I’m generally friendly, bubbly, outgoing, and easy to speak to, I converse with them and everyone (because I’m there to build connection and *community*) 

What the hell do I do? ",3,1765377976.0,socialskills,2,1.0,False
1pj4db6,https://i.redd.it/v65n3jil2e6g1.png,Made a website to wrap up your 2025 dating,"Made a little thing.It’s called Dating Wrapped,a fun way to recap your 2025 dating year.

Try it out, I’d love to hear your feedback…  
and I *definitely* want to see your results too (if you dare 😈)

[https://www.mydatingwrapped.com/](https://www.mydatingwrapped.com/)",2,1765377938.0,SideProject,0,1.0,False
1pj4d8l,https://www.reddit.com/r/adhdwomen/comments/1pj4d8l/combined_adhd_girlie_29/,Combined ADHD Girlie 29,"Hey All,

I have been recently diagnosed with ""Severe"" Combined ADHD (interventive & Hyperactive).

**Grief / My Reaction:**

I see many people felt ""relieved"" when they had their diagnosis as it confirmed why they were way they were throughout their lives .. However, i felt like i have known all my life, my people around me knew.. So when i got my diagnosis last Weekend, it felt like

""FINALLY I can say i have ADHD and not feel like a con.. because i have had a professional confirm it"" I also felt grief for my younger self. The way she struggled all the way through, thinking she was the total problem when really it was peoples lack of understanding.

Like i feel like i am at a stage where i want to now figure out who i am... and grieving..

Did anyone else experience that??

**Medication Fears:**

There is a fear of medication in this too. My Physiatrist said to me ""You need to take Elvance daily to heal from your mind. it will quieten it..""  
This sounds like a dream boat to me, and i defiantly want that however, the side effects i see people experience on these meds, it brings out terrible fear.

I suffer with panic attacks, and i have trouble sleeping most days.. and i have finally got into a nice sleep hygiene... I dont want this tablet to mess it all up because its taken me WEEKS to finally feel that peace with sleep again..

**Me, and My ADHD, Living with partner:**

Since moving out with a partner who doesn't clean the house (or pick up his things), i find myself naturally cleaning? It has almost become therapeutic for me.. Don't get me wrong, there are so many days where i just want to live my ADHD self, and not clean.. however i feel this god awful guilt of

**""We have been home all Saturday, he doesn't deserve to live in a shithole...""**

So i guess i've kinda' trained my head to find cleaning therapeutic.. It helps me release hyperactivity..  
I just wack on a pair of headphones, with the right music and off i go to ""focus"" on cleaning our home.. Although i divver off doing random tasks whilst trying to do one thing at a time.. I would clean the kitchen, find something and go ""OOOO I need to clean the bathroom window.."" so i leave the kitchen half done.. focus on the bathroom window.. walk into the kitchen for something then go ""Oooooohh f&ck i didn't finish the sink.."" then i left the damn bathroom tap running..

If anyone saw how i am, they wouldn't think i suffer truly with ADHD because im ""functioning"" up and about cleaning.. not being too late to appointments.. (I do forget things still). He is super messy, and i feel if i don't do it, our home would be such a mess, and i couldn't live like that as he came from a super messy, unhealthy house share before moving into our home..

**Me, and My ADHD, Living with Family**:

This is where things are different..  
When i lived at my Mum in her home, my ADHD and cleaning was not a thing.  
I had clothing that was pilled up on a chair in my room, the bathroom was a state, i had mouldy cups from where i've left half drunk coffee in them; I would be so late for work, id tell myself ""Ill move them when i get home"" and never do..  
I was always late to appointments..  
When i got home from work , so many times i would just drop and not want to move because my day at work would have been super busy.. and i would be in a paralysis..

You just could see my ADHD a mile off..

**So Many Questions:**

So, why is it my ADHD isn't functioning in my Mums home, but soon as i am in my own place.. i have this form of ""structure"" and my traits aren't so vivid?? At work they are, i cant sit still, i don't focus enough and i get bored out of my mind so easily.. (desk job)",2,1765377934.0,adhdwomen,1,0.75,False
1pj4cwg,https://www.reddit.com/r/voidpet/comments/1pj4cwg/what_is_a_good_team_item_loadout_for_what_i_have/,What is a good team & item loadout for what I have?,"I’m trying to understand the tierlist and stuff & seeking some feedback.

I have most of the non-legendary, non-uber pets (I am missing the Epics Paranoia, Sanctimony & Cringe) with my only Legendary being Pride.

I have the non-legendary & non-uber items, my only legendary ones are Golden Halo and Rainbow Party Hat.

Lately I’ve been using Pride, Sadge, Determination & Merry (sometimes swapping in Resistance for Determination if I’m getting wrecked by a leaf boss) with items as follows:

Pride: Golden Halo, Black Spiked Collar, Soft Dumbbell, Espresso Shot

Sadge: Spider Hat, Aqua Spiked Collar, Skinny Vanilla Latte, Leather Journal

Determination/Resistance: Cowboy Hat, Cowboy Scarf, Fuzzy Mittens, Fluffy Pillow

Merry: Yellow Palm Cap, Hibiscus Chain, Iced Coffee, Nail Buffers

I have NOT been using the Golden Party Hat after I found out it disabled some attacks. People also seem to be saying that Sadge is very mid (I haven’t been terribly impressed either) and Pride got ranked only as A tier. Should I dump Sadge for Sad and I guess replace Pride with Panic? And what item loadout would work better, should I be using the party hat or putting the halo on some more deserving pet?

Thanks for any help.

  
edit: also I am on floor \~580 if that matters",1,1765377911.0,voidpet,3,1.0,False
1pj4cty,https://www.reddit.com/r/msu/comments/1pj4cty/grad_student_history_visiting_this_week_looking/,Grad student (history) visiting this week - looking for people to hang/connect with!,"Hey all! I'm a historian from Chicago who's in East Lansing this week to use the MSU archives. This is probably a terrible time to ask, between the unseasonable chill and finals week going on, but I'd like my time here to be more than just the library! If anyone wants to get a coffee or drink over the next few days, I'd love to learn more about you/the university/talk about whatever. 

I work on environmental/urban/economic history, but am interested in a huge variety of things - cities, food, sport\* (with a terrible weakness for soccer), and am just generally curious to know more!",3,1765377907.0,msu,0,1.0,False
1pj4cse,https://i.redd.it/n5t0hphv2e6g1.jpeg,Any Aeropress recipe for Koraput Coffee?,"Got this from ongoing book fair. I never made coffe from this, so need some suggestions. If anyone have used or know best way to make good cup of coffee. ",6,1765377904.0,Bhubaneswar,1,1.0,False
1pj4cn3,https://i.redd.it/9s4fbw0n2e6g1.png,34M 6 Months Of Dedication 213lbs to 163lbs,"**TL;DR:** I was exhibiting self-destructive behavior and tendencies and decided to take my life back with IF (Intermittent Fasting) and consistent gym-going being a facet in doing so.

Hello,

***I originally posted this to the IF board because that's where I originally got most of my inspiration to go on this journey, however I thought it'd be helpful to also post this here for anyone who may need some motivation to keep pushing.***

The beginning of this year cut me deep & made something in me snap. I'd always been the skinny guy in the group. However, I realized I was sliding hard into bad habits and was slowly but surely heading towards a negative cardiovascular event of some kind.

I decided to make a change for the better 6 months ago, and I feel better for having done so. I can run faster than I did in HS & lift harder than I did in my service.

*For reference I am 5'11 (180cm) & my starting weight was 213lbs (96kg) I am now 163lbs (73kg).*

**What I did/am doing:**

***- For the first 3-4 months I did 18:6 IF*** eating between 12pm & 6pm. I was at roughly a 500-600 calorie deficit for most of this time. At 6 months, I sort of still stick to this but not as stringently. I am now at my maintenance calories most days with some days in a deficit as it's hard to meet maintenance in an IF window sometimes.

\- I ate my goal body weight in protein every single day & am still doing so now. I usually eat low fat, low carb high in protein meals.

\- I completely removed processed sugar from my diet which was extremely soul crushing & eye opening at first on how much I depended on sugar. I learned that the morning coffee wasn't what I was addicted to, but the sugar and creamer I was putting in it.

\- I have never missed a day walking 10-15k steps, I have truly found a love for walking. Since June I have walked a distance roughly akin to walking from Miami to Boston (around 9.5 miles a day)

\- 7-8 hours of uninterrupted sleep, no excuses

**My exercise routine:**

Monday: Chest Day, 10k steps

Tuesday: Rest/HIIT/10k steps

Wednesday: Leg Day, 10k steps

Thursday: Rest/HIIT/10k steps

Friday: Arm Day, 10k steps

Saturday: Rest/HIIT/10k steps

Sunday: 10k steps (Full Rest)

I don't recommend going cold turkey into the working out if this is something you'd like to mirror unless you know what you're getting yourself into. This is not my first rodeo when it comes to exercise and I was well aware of what it'd take to maintain this kind of consistency fitness wise.

**Some inspirations that got me here:**

The book ""Atomic Habits"" by James Clear. This book helped change the way I look at my goals and also myself. I **HIGHLY** recommend it. Learning that it's the PROCESS to your goals that matters and the foundations in which you build them upon really pushed me forward.

David Goggins

\------

Hope this helps and inspires others to keep working at it and apply healthy fundamentals and a foundation in doing so! I'll be commenting with a more in-depth look of what my routine looks like.",30,1765377895.0,fit,4,0.98,False
1pj4c5c,https://www.reddit.com/r/FedEx/comments/1pj4c5c/how_to_thank_fedex_driver/,How to thank FedEx driver,"My FedEx driver has been coming to the house almost every day this week!!!! He places packages well and doesn't break stuff. I have a tiny porch and nowhere to put out coffee or snacks. I don't know what time he's coming because the delivery window is unpredictable, likely because of the holiday. I don't even know if it's the same driver all week, though I live in a smaller town and suspect it's the same or same few driver(s). 

Would leaving out a thank you card with cash or a coffee shop gift card be reasonable? Acceptable? Other ideas? I hate to leave a few cookies every day if it's the same driver, but I also don't know if I should give a single gift at the end of the week? 

I know they get paid quite well. But they get paid whether they rush or take time to do it right. My driver(s) taking the time to do well, and I appreciate that! ",5,1765377861.0,FedEx,1,1.0,False
1pj4b91,https://www.reddit.com/r/ottawa/comments/1pj4b91/super_automatic_espresso_machine_repair_shops/,Super automatic espresso machine - repair shops?,My Saeco Xelsis has been having trouble making hot coffee. Don't exactly know what the problem is. Can anyone recommend a repair shop and/or a parts store? ,2,1765377801.0,ottawa,2,1.0,False
