id,url,title,text,score,created_utc,subreddit,num_comments,upvote_ratio,over_18
1j3t0tz,https://www.reddit.com/r/nespresso/comments/1j3t0tz/new_coffees_for_the_us/,New Coffees for the US,I am in the US and I am not seeing the new coffees in the app.  Any idea when the new flavors are coming out?,1,1741142811.0,nespresso,0,1.0,False
1j3t0lr,https://fatlossstrategie.blogspot.com/2025/02/scientists-discover-simple-coffee-hack.html,Fat Loss Strategies: Scientists Discover Simple ‘Coffee Hack’ To Help Boost Metabolism And Release Belly Fat,,1,1741142791.0,weightlosscom,0,1.0,False
1j3t017,https://www.reddit.com/r/Realsee/comments/1j3t017/matterport_is_a_pyramid_scheme_for_masochists/,Matterport is a Pyramid Scheme for Masochists. Realsee is Free. Fight Me.,"**BREAKING NEWS:** Matterport’s entire business model is a Ponzi scheme for people who enjoy being punched in the throat. Meanwhile, Realsee’s team is out here doing backflips over Matterport’s grave *while handing out free shit*. Let’s get toxic.

# Matterport’s Business Plan: A Hate Crime Against Your Wallet

1. **The Camera:**
   * A $5,500 doorstop that scans slower than a sloth with arthritis. Pro tip: Use it as a boat anchor. It’s more useful underwater.
   * Scans so blurry, your clients will think they’re having a stroke. **“4K?”** More like *“4K pixels total.”*
2. **The Subscriptions:**
   * Pay $99/month to unlock **THE PRIVILEGE OF USING YOUR OWN DATA**. Imagine Netflix charging you to watch your own home videos. That’s Matterport.
   * Cancel? Cool. They’ll delete your life’s work and send you a PDF titled *“How to Cry in 5 Languages.”*
3. **The “Support” Team:**
   * A rotating cast of AI bots trained to say *“Please hold… forever.”*
   * Matterport’s HQ is just a burning trash can with a LinkedIn page.

# Realsee: The Unapologetic War Machine

The [Realsee Galois](https://realsee.com/) isn’t a camera. **It’s a war crime against mediocrity.** Here’s the carnage:

* **Scans so fast, Matterport’s engineers weep into their stock options.** LiDAR + AI = done before you finish your coffee.
* **Free. Manual. Everything.** Realsee’s team will Photoshop your cat into virtual tours, edit out your ex’s ghost, or hand-write apology letters to your clients. *Matterport’s “support” can’t even spell your name.*
* **8K tours so sharp, they’ll expose your client’s secret affair with the neighbor.** Matterport’s “HD” looks like a potato filmed it. In 2003.

# FREE REALSEE CREDITS FOR WAR CRIMES AGAINST MATTERPORT 💣

Realsee is **PAYING YOU TO COMMIT FELONIOUS Slander**. Here’s your mission:

1. **Film a TikTok** of you drop-kicking a Matterport camera into a dumpster. Soundtrack: *“Another One Bites the Dust.”*
2. **Write a Yelp review** titled *“Matterport Gave Me Trust Issues and Debt.”*
3. **Tag Matterport** in a tweet: *“Your CEO’s yacht runs on my tears. Congrats, parasite.”*

**Most chaotic entry wins $500 in Realsee credits + a virtual high-five from their CEO.** Go full *Joker* on these clowns.

# Why You Should Care

Matterport is the **Enron of 3D scanning**—built on lies, fueled by greed, and destined to collapse. Realsee? They’re the **meth-lab genius** burning it all down to build something better. **For free.**

**TL;DR:**

* Matterport: *“We’ll bankrupt you and ghost your emails.”*
* Realsee: *“We’ll rebuild your career while you nap.”*
* You: **Profit.**",1,1741142739.0,Realsee,0,1.0,False
1j3sztk,https://www.reddit.com/r/LetsReadOfficial/comments/1j3sztk/my_disturbing_waking_dream_became_an_unsettling/,My disturbing waking dream became an unsettling reality... that day.,"-I would like to pose a question to those of you who believe that Human Beings are creatures of free will:

What if you saw a disturbing glimpse of your future in a dream, and no matter how hard you tried to avoid it, you ended up causing it to happen?

Well, It happened to me. And I'd like to share it with you.

First a little background:
I was just a 12 year old kid, before the advent of cell phones, streaming media, or even the internet for that matter, I didn’t know much about ‘precognition’ and things of that nature. No, my biggest pursuits were comic books, collecting Hot Wheels cars, and supporting my video game addiction over at the local arcade.
  
The year was 1978.
  
Anyway, so I got this little weekend job down at the swap meet (about two blocks from my house) helping out this old Chinese vendor named Chung. The job was simple; meet Chung at the Drive-in theater early Saturday and Sunday morning to help set up his vendor stall with merchandise consisting of knock-off Gucci bags, pocketbooks, and assorted women’s shoes, then assisting him throughout the day. At the end of the day Chung would hand me a nice crispy $10.00 bill. 
  
I was making 20 bucks a week, which in 1978 afforded me the latest issues of Mad Magazine and collectible Hot Wheels, as well as a shot at that new video game over at the arcade called ‘Space Invaders’.
  
On one Friday night I sat on the edge of my bed, reached over to my nightstand and picked up my little alarm clock to set it for work the next morning. Swap meet vendors had to be there early so that they could set up and be ready to meet the throngs of shoppers coming in at 7:00 when the ticket gates opened.
  
My alarm clock was an old vintage wind-up handed down to me from my grandmother. It had a round face and two little bells on top that would ring when the hour hand reached the third hand, (also known as the ‘alarm hand’). I set the alarm hand for 5:30, wound the clock spring, and placed it back on my nightstand. I prided myself on being on time…a characteristic that was instilled in me from the time I learned to work for my own money.
  
I was an industrious young man of morals and integrity. I had the world by the horns… or so I thought.
  
I put my pajamas on and laid my work clothes out on a chair, then tucked myself in for the night. I must have slept extremely well that night. We’re talking deep R.E.M. sleep. The kind where time seems to no longer exist. Then I had a lucid dream. A very unsettling lucid dream. It went something like this:
  
I’m walking through a door, and there, about 30 to 35 feet in front of me was my boss, Chung, squatting down in front of his vendor stall that was completely set up, with purses and handbags hanging from hooks on the shade structure. His display tables were adorned with colorful tablecloths, loaded with pocketbooks, coin purses and other accessories. 
  
He was straightening a pair of red shoes he had arranged on the tarmac up front. I had missed setup. I was suddenly flushed with the realization that I was late for work. That feeling of pure anxiety washed over me like a bucket of ice cold water.
  
I stood shocked and dumbfounded as Chung looked over his shoulder and spotted me. He nodded his head with a grin and started to speak. But the sound that came out was not that of his voice, but a loud, steady ringing sound. The sound of a bell.
  
Suddenly I was ripped from my dream, and I bolted upright in bed to the sound of my alarm clock going off. It was 5:30 and time to get ready for work. I reached over and turned it off, then rubbed my eyes, anxious with that feeling of being late that lingered with repeating visions from that stupid dream. 
  
I felt like I had just closed my eyes only to be rudely awakened again. I shrugged it off and went to the bathroom to begin my morning ritual for work. 
  
But the dream kept replaying itself over and over in my head like a 10-second video clip stuck on a loop. The finished displays. The red shoes. The grin on Chung’s face. The feeling of being late. And what the hell was he about to say just before my alarm clock jolted me out of it? I just couldn’t shake it despite the fact that I had gotten up on time and there was nothing keeping me from getting to work on time that morning. 
  
Nonetheless, I picked up my pace a little bit just to make sure that dream playing out over and over again, and that feeling of dread that comes with showing up late for work, would just go away.
  
I felt a bit silly as I donned my clothes a little quicker, and tied my old suede wallabies a little faster than I normally would. I slipped my wrist watch on and checked the time against my alarm clock for a match. “This is ludicrous”, I thought to myself. “There’s no way I can be late. If anything I’ll be super early.”
  
I cut the time I would normally spend getting ready to go to work in half by skipping breakfast, and set out on foot at 10 minutes to 6 in the chilly morning darkness toward the Drive-in theater that waited for me about a block and a half away from my house. 
  
The light of dawn wouldn’t break for another half-hour or so. And, as it has been all season, my job was to show up around 6:30 a.m., meet Chung at our usual spot, and we would knock out the setup by 7:00…just in time for the shoppers to be allowed in. 
  
But this time it would be “a little bit different” I thought to myself as I shuffled down my empty street toward the quiet four lane thoroughfare.  Ignoring the crosswalk, I jogged across the thoroughfare toward the main gate of the Drive-in theater with its landmark forty-foot screen looming in the distance. 
  
The dream quickened my pace. I scoffed and fought the urge to break into a run. 
  
It was unusually foggy that morning too. As I made my way through the shadows I couldn’t help but notice the ominous looking halos of swirling mist surrounding each street lamp. The theme song from ‘The Twilight Zone’ kept trying to seep into the cracks in my overactive imagination. 
  
And that damn dream. That dream was still fresh on my mind as I entered the gate and waved at the security guard leaning in the door frame of his guard shack. He recognized me with a nod of his head, his face half-lit by one single incandescent light bulb from within. He pulled the cigarette from his lips with thumb and forefinger and let out a puff of thick, gray smoke. “Here a little early, arencha?” 
  
I shook my head and shoved my hands in my pockets as I thought about how ridiculous it was for me to be here at this hour. There was literally no one there except for the snack bar/café crew in the center of the Drive-in  lot. I headed straight for it. I needed to get my head on straight. I needed a cup of coffee and an old-fashioned glazed donut. 
  
I walked into the café and up to the service counter. The place was completely empty  except for those bleary-eyed workers who were busy doing their morning prep for the coming rush of customers. “Their day starts a lot earlier than mine”, I reckoned as I took in the aroma of fresh coffee and baked goods. 
  
I ordered my cup of coffee and an old-fashioned glazed with a $2 bill, and got two quarters change. I grabbed an Auto Trader magazine from a rack by the entrance and scanned the area for a good place to sit.
  
Through large windows I could see a panoramic view of the outside area. I spotted a booth and sat down from where I had an unobstructed view of our spot. I wanted to see Chung the moment he arrived so I could go out to greet him early. 
  
I felt so foolish as I stirred the sugar and powdered creamer into my cup, and chuckled to myself as I thumbed through the magazine. The dream faded for now, my mind preoccupied by the taste of fresh coffee and the flavor of that old fashioned glazed delicacy. 
  
About halfway through my cup of coffee I glanced at my watch. It was 6:35 (about the time I would normally show up). By now the light of dawn was just beginning to illuminate the cloudless sky, and the fog that had invaded the early morning was gone. 
  
Vendors were rapidly arriving en masse, claiming their spots. The clinking and clanking of their shade structure poles reverberated throughout the Drive-in as the they got busy unloading their vehicles and setting up their vending stalls. 
  
Vendors began filing into the café to get their morning caffeine and sugar fix. I stared blankly at our spot. Empty. Was Chung running late? I knew that his commute was considerably longer. His old cargo van had seen better days. 
  
Something was not right. The spaces on either side of ours were already busy with vendors and their helpers skillfully fastening leg poles to corner pieces, and stretching canvas tarps with bungee cords for shade.
  
I stepped outside to use the payphone that was mounted on the wall next to the restrooms. I figured I’d call Chung at home to see if he was there. But the pay phone had an ‘Out of Order’ sign written in black marker taped across the coin slots. Go figure.
  
Back inside, I bought another cup of coffee with my last 50 cents. “Why not?” If Chung didn’t show up by the time I finished the second cup, I reasoned, then I guess he’d be considered a no-show. 
  
Heck, I could just go home and crawl back into bed for a couple more hours before the rest of my family started to rouse. Godzilla and Kung Fu reruns on Saturday morning. Yes, just what the doctor ordered. 
  
I looked over to our spot again. It was completely vacant, surrounded by a sea of shade structures, tarps, goods, with cargo vans, box trucks, and just about anything you could haul stuff in that had materialized across the tarmac of the Drive-in theater as far as the eye could see. 
  
If you’ve ever been to a swap meet you know what I’m talking about. It was now 7:00. It’s Showtime!
  
“Well, I guess that’s it”, I thought to myself as I stood up and drank the last sip from my coffee cup. Chung is a no-show. That whole dream was such a… well, it was just that…a dream. I was now free to go home and catch some shut eye, and to decompress from an otherwise stressful episode.
  
I headed for the exit on the other side of the now crowded café. Beyond it was my home less than 10 minutes away. 
  
Through the windows on that side I could see the shoppers starting to flow in from the ticket line and fan out through the isles of waiting vendors. 
  
I grabbed the doorknob and pushed it outward, and then I felt a strange rush kind of like 'deja vu' come over me. 
  
“This can’t be…”, I struggled to reason, as I walked out the door and saw…him. It was the dream. Only this time, for real.
  
I gazed in existential horror at Chung who squatted about 30 feet right in front of me. He was straightening a pair of brightly polished red pumps on display on the tarmac…and I was late.
  
My jaw went slack as my coffee cup fell from numb fingers. “Chung?”
  
Chung looked over his shoulder in my direction. He had just finished setting up his stall. Every detail was there from the hanging handbags to the accessory tables and, well…you know the rest.
  
Chung’s gaze met mine; “Oh there you are!” He said with a sheepish grin, “Sorry, I forgot to tell you…I switched spots!”


",1,1741142722.0,LetsReadOfficial,0,1.0,False
1j3szgb,https://www.reddit.com/r/travel/comments/1j3szgb/portugal_itinerary/,Portugal Itinerary,"Hi everyone!

My partner and I are travelling to Portugal April 5th to 18th. We land in Lisbon on the 5th and we're there until the 8th when we fly to Madeira. We'll be in Madeira until the 12th, when we fly to Porto.

Now, this is where I need your help. The original plan was to stay in Porto the 12th-15th and then Lagos the 15th-17th. Is that crazy rushed? We already have our flight booked to Porto so that's set in stone. Should we stay in the Porto area 12th-17th instead?

A little about us - we don't drink, we're foodies, we love exploring cities, shops, restaurants, coffee, etc. we love beaches as well. We're also go go so we don't mind being on the move.

Thanks in advance!
",1,1741142688.0,travel,1,1.0,False
1j3szbd,https://www.youtube.com/watch?v=qQgW9UpeUEc,STARBUCKS COFFEE | NEW SPRING 2025 TUMBLERS | NEW FLOORSET | STORE WALK THRU,,1,1741142676.0,mesarastarr,0,1.0,False
1j3sytm,https://www.reddit.com/r/premed/comments/1j3sytm/should_i_quit_my_clinical_job/,Should I quit my clinical job??,"I have been working as an EMT/MA for 4 years and have over 5,000 clinical hours as a non traditional applicant. I am applying to medical school this upcoming cycle pending my MCAT score, but I quite literally cannot afford to live on my current salary and I’m getting extremely burnt out from getting screamed at every shift. 

I live in a suburban area, so I do not have access to any research assistant/lab jobs without driving 1.5 hours to our city hospital. 

I guess I have 2 major questions:
1. Would it look really bad to quit my clinical job? I still would volunteer as an EMT.
2. Does anyone have any recommendations for jobs that are low-key, non-clinical but still medical? Or should I just work at a coffee shop at this point?? I’m also studying for the MCAT currently, so would love extra time to do. 

Any & all recommendations would be greatly appreciated!!",1,1741142634.0,premed,1,1.0,False
1j3syn9,https://www.reddit.com/r/MakeNewFriendsHere/comments/1j3syn9/24f_hope_to_make_more_online_friends/,24F - hope to make more online friends,"Hii everyone

I'm into YT/shows, reading, walks, shopping, coffee

Please be around my age

Just looking to meet some more/new online friends, hmu if you're interested",1,1741142620.0,MakeNewFriendsHere,1,1.0,False
1j3syd3,https://www.reddit.com/r/portugal/comments/1j3syd3/itinerary_porto_or_porto_lagos/,Itinerary: Porto? Or Porto & Lagos?,"Hi everyone!

My partner and I are travelling to Portugal April 5th to 18th. We land in Lisbon on the 5th and we're there until the 8th when we fly to Madeira. We'll be in Madeira until the 12th, when we fly to Porto.

Now, this is where I need your help. The original plan was to stay in Porto the 12th-15th and then Lagos the 15th-17th. Is that crazy rushed? We already have our flight booked to Porto so that's set in stone. Should we stay in the Porto area 12th-17th instead?

A little about us - we don't drink, we're foodies, we love exploring cities, shops, restaurants, coffee, etc. we love beaches as well. We're also very go go go so we don't mind being on the move.

Thanks in advance!",0,1741142594.0,portugal,1,0.5,False
1j3sy24,https://www.reddit.com/r/LifeAfterNarcissism/comments/1j3sy24/the_venomous_vivian/,The Venomous Vivian,"The air in the café was thick with the aroma of coffee and the low hum of conversation. Marcus stirred his cappuccino absentmindedly, watching the rain drizzle against the window. Across from him, Elaine sat, her fingers curled around her mug, her expression a mix of sympathy and frustration.

“So, what now?” she asked, breaking the silence.

Marcus sighed, shaking his head. “I don’t know. I just wish I had seen through her sooner.”

Elaine didn’t have to ask who ‘her’ was. The specter of Vivian hung over their group like an unshakable shadow, a presence that Marcus had tolerated for far too long.

### **The First Betrayal**

It wasn’t always like this. Ten years ago, when Marcus first met Vivian, she had seemed warm, intelligent, and charming. She had a way of drawing people in, of making them feel special—until they no longer served a purpose.

The first real sign came when Marcus was going through a rough breakup. He had confided in their friend group, and while most were supportive, Vivian had reacted differently. At first, she played the role of the caring friend, offering advice and checking in on him. But soon after, Marcus learned that she had been spreading rumors behind his back—suggesting that he was emotionally unstable, that he had driven his ex away, that he was, in her words, ‘a wreck that no one should date.’

When Marcus confronted her, she laughed it off. “Oh, come on, Marcus. You know I’m just joking. Don’t be so sensitive.”

That was the first time he excused her behavior. It wouldn’t be the last.

### **The Ghosting Game**

Over the years, Vivian made a habit of disappearing whenever she pleased. She would engage in deep conversations, making Marcus feel valued—only to ignore his messages for weeks, even months, at a time. Then, just when he thought he had finally moved on, she would reappear with a casual “Hey! How have you been?” as if nothing had happened.

Marcus wasn’t the only one subjected to this treatment. She did it to others in their circle, but he was the only one who ever questioned it. Everyone else seemed to accept it, chalking it up to her ‘free spirit.’ But Marcus knew better. It was control. She wanted to dictate when and how she interacted with people, keeping them at arm’s length yet never truly letting them go.

### **The Wedding Sabotage**

When Marcus met Lydia, he knew she was the one. Their relationship moved fast, but it was real. When they decided to marry, Marcus extended an invitation to the entire friend group. Everyone responded with excitement—except for Vivian.

“I won’t be attending,” she had said bluntly.

Marcus was taken aback. “You don’t have to come if you’re busy, but—”

“Oh, it’s not that,” she interrupted. “I just don’t think you should invite me. It wouldn’t feel right.”

He should have let it go. But instead, he asked, “Why?”

Her response was chilling. “You know why.”

That was all she said before turning away. The next day, Marcus discovered that she had been privately messaging members of the group, insinuating that he was still seeing other women on dating apps—six months before his wedding. It was a lie, a complete fabrication. But it planted seeds of doubt. People started asking questions, whispering behind his back. Even Lydia, confident as she was in their relationship, was hurt that such rumors had even reached her ears.

Marcus had never felt more betrayed.

### **The Silent Resentment**

It dawned on Marcus then: this wasn’t about friendship. Vivian resented him. Perhaps it was because he had missed her wedding years ago due to work, despite his generous gift. Or perhaps she simply couldn’t stand to see him happy. Either way, her manipulation had reached its peak.

After the wedding, Marcus knew he had to cut ties. He blocked her on Facebook and WhatsApp—not in anger, but in self-preservation. He needed to be free from the toxicity she thrived on.

### **The Fallout**

The group’s reaction was mixed. Some understood, while others tried to dismiss it as a ‘misunderstanding.’

“She’s always been like this, Marcus,” one friend said. “You’ve just taken it too personally.”

Elaine was one of the few who saw the truth. “You’ve done the right thing,” she assured him. “You don’t owe her anything.”

Marcus nodded, staring out at the rain. He had lost years trying to maintain peace, excusing her behavior, pretending that the hurt she caused was accidental. But now, finally, he had clarity.

Vivian had spent years weaving a web of manipulation, but he was no longer caught in it. He was free.

### **A Marriage of Convenience**

Years later, Marcus heard whispers about Vivian’s life. She had married an average man—someone safe, reliable, but unremarkable. Some mutual friends speculated that she had done it out of love, but Marcus knew better. Vivian had spent years prioritizing control, her social image, and wielding influence over others. Deep down, she feared something more than anything else: being left behind.

As she approached her mid-thirties, the pressure of time became unbearable. The fear of growing old alone, of losing her perceived social value, had driven her to settle. It was a fate she had long mocked in others, but in the end, she had succumbed to it herself.

Marcus couldn’t help but feel a twinge of pity. Not because she had married someone she didn’t truly love, but because, for the first time in her life, she was the one who had compromised. And for someone like Vivian, that was the worst fate of all.

",1,1741142565.0,LifeAfterNarcissism,1,1.0,False
