id,url,title,text,score,created_utc,subreddit,num_comments,upvote_ratio,over_18
1ss9sp2,https://www.reddit.com/r/BelleBetting/comments/1ss9sp2/april_21_2026_todays_pick_of_the_day_cashes/,"April 21, 2026: Today's Pick of the Day Cashes 🎉💰","**Let's gooo – today's Pick of the Day is a hit, friends!** A massive congrats to everyone that tailed, and for those curious, here's what we had:

**-CHI Cubs -1.5 (+170) ✅**

Not gonna lie, I love that we cashed FOR A WHOPPING +170!!! Love to see it, friends 😉 Plus money just hits different. Enjoy the win, on to the next we go…

X

Belle

\----

[Belle's Pick of the Day](https://bellespicks.com/) *in April: 14-7 (14 wins, 7 losses)*

\---

**🫙** [Belle's Tip Jar](https://buymeacoffee.com/coffeeforb)

\----

**🛎️ Looking for all of my Picks, Props & Parlays?**  
[Visit my Website](https://bellespicks.com/)

⏳ **Want Belle’s Pick of the Day — Before Anyone Else?**  
[Join Belle’s Free Tier](https://bellespicks.com/picks) & get it first!

☕ **Appreciate the Picks?**  
[Buy Belle a Coffee](https://buymeacoffee.com/coffeeforb) ❤️‍",1,1776828304.0,BelleBetting,0,1.0,False
1ss9rh4,https://i.redd.it/piqfdi8iunwg1.jpeg,Deadwood Dominicano Buenos Noche,"Smoke shop hooked me up with a free sample. They said the noche hasnt officially been released yet. Its light-medium body, lightly sweetend ( compared to others is the Deadwood line). So far the strongest notes are coffee and wood, slightly earthy. Picking up a hint of pepper on the retrohale.",1,1776828209.0,cigar,0,1.0,False
1ss9qdv,https://www.reddit.com/r/latteart/comments/1ss9qdv/how_long_does_it_take/,How long does it take?,I have tried latte art for the past couple years. I try for a couple weeks then give up. Recently I purchased a course through My Liquid Canvas which was great but I’m still stuck. I make three coffees a day and they are absolutely delicious. It’s just for me so no big deal but I would love to perfect it or even get a semi decent design. What was your technique for improving and how long did it take you? I feel like I am trying to improve but making the same mistakes as very day.,2,1776828121.0,latteart,2,1.0,False
1ss9pkp,https://www.reddit.com/r/futurecodersdotai/comments/1ss9pkp/parent_dashboard_understand_what_your_kid_is_doing/,Parent Dashboard  - Understand what your kid is doing.,"Sunday, 9:14am. The coffee is still hot. And on my phone, my daughter's week as a coder is unfolding in front of me. ☕

This is the quiet moment we built Code Hatchery's Parent Dashboard for.

Every Sunday, parents receive a beautifully clear recap of their child's week:

🌱 The coding concepts they practiced — loops, sequences, debugging 🐣 The animal companion they're raising, evolving as their skills grow 🗺️ The quests they completed, and the real-world thinking behind each one.

And it doesn't end on Sunday.   
Parents can sign in anytime to watch their child's journey unfold in real time.

Because when a child's imagination becomes something a parent can witness, learning transforms into a story the whole family gets to share.   
This isn't just a Ai and STEM app. It's a window into who your child is becoming.

👉 Start the adventure at [https://futurecoders.ai/](https://futurecoders.ai/)

[\#WorkingParents](https://www.instagram.com/explore/tags/workingparents/) [\#RaisingKids](https://www.instagram.com/explore/tags/raisingkids/) [\#CodingForKids](https://www.instagram.com/explore/tags/codingforkids/)[\#PlayBasedLearning](https://www.instagram.com/explore/tags/playbasedlearning/)

https://reddit.com/link/1ss9pkp/video/4qh8o2p1unwg1/player",1,1776828056.0,futurecodersdotai,0,1.0,False
1ss9o8v,https://www.reddit.com/gallery/1ss9o8v,Why it’s harder to start your Chinese study than it should be,"I got some feedback on the ""HSK 1-6 Companion App"" that honestly made me rethink something I didn’t expect.

You know when you open your Chinese app, pause for a second, and don’t start right away?

Not because it’s hard, it's just because it feels like the same thing again.

Same layout, same look, same flow every time. It’s a small moment, but over time, that’s where consistency starts to slip.

A lot of people mentioned that after a few weeks of studying, it wasn’t the content; it was that everything started to feel repetitive and easier to put off, even if they knew what to do.

So I took that feedback and changed that part.

I added a light mode, not as a design tweak, but to add some variation so it doesn’t feel identical every time you open it.

The goal is just to make it easier to keep coming back over time, without changing the structure itself.

Still refining things as more feedback comes in.

If you’ve ever skipped a session even though you knew exactly what to do, that’s not random; that’s where most people fall off.

That’s the part this is built to fix.

It’s in the ""HSK 1-6 Companion App""; the first 14 weeks are free to try.

Do you think small things like this actually affect consistency, or is it something else that usually breaks it for you?",1,1776827955.0,learnmandarin,0,0.67,False
1ss9nmx,https://www.reddit.com/r/premed/comments/1ss9nmx/worried_about_my_chances_basic_ahh_post/,Worried about my chances (basic ahh post),"3.65 cGPA, 3.5sGPA. I decided to go pre med halfway through college and took some hard classes first and got a C in physics II. I have had a strong upward trend As, A- in  BCPM classes. Getting ready to graduate and I’m nervous if I should complete a post bacc. I am perfectly okay with applying to any MD or DO schools. 

I’m a public health major and don’t have that many hard science classes so that one C hits hard. I do have a strong upward trend IMO, but I’m worried many schools are statsmaxxing like crazy and care less about upward trends. 

 \~500 hours as volunteer EMT + still going 

\~ 600 hours as a patient care associate (HCE) 

\~ 350 hours working resettling refugee as a volunteer. 

Thousands on non clinical work experience in coffee and food service.

\~2,000 hours in a running club and competing. Ran multiple half and full marathons. 

Working getting on some clinical research during my gap year. 

Taking the MCAR next year really wanna score a 510+, but questioning that too lolllll ",1,1776827908.0,premed,3,1.0,False
1ss9mty,https://www.reddit.com/r/DailyDoseCoolFinds/comments/1ss9mty/spent_weeks_sifting_through_the_noise_to_find/,Spent weeks sifting through the noise to find *actual* savings: My proven process for spotting legitimate online deals that don't require a PhD 💸,"Ever feel like every ""deal"" you see online is just a fancy way to make you pay full price? Like those ""70% off!"" sales where the original price was hiked up just for the 'sale'? Yeah, me too. It's frustrating to wade through endless marketing fluff trying to find something genuinely worth your hard-earned money.

My goal isn't to chase every tiny discount, but to find *real* value – products that perform well *and* come at a price that isn't just a marketing illusion. It takes a bit of digging, but the savings add up.

Here are a few actual recent finds and what it took:

*   **Coffee Pods (XYZ Brand, 12-pack):** Snagged these for **$8.99**. They consistently retail for $15-16 at my local grocery store, and even on Amazon, they rarely drop below $12. That's a solid **40% off** their regular selling price, not some imaginary MSRP. This was a lightning deal I spotted after about 5 minutes of checking a couple of trusted deal aggregate sites.
*   **Wireless Earbuds (Generic, but well-reviewed):** Found a pair with surprisingly good audio for **$35**. Their usual price hovers around $60-70. This wasn't a major advertised event, but a smaller retailer clearing stock. It took about **15-20 minutes** of comparing a few lesser-known brands and checking user reviews on multiple platforms to ensure quality.
*   **""PowerMix 5000"" Blender:** I'd been tracking this specific model for a couple of months. While it's often around $90-100, I knew its historical low was about $65. When it hit that **$65 mark** during an un-hyped flash sale, I grabbed it. This required patience and using a price history tracker, but the **$25-35 savings** were based on real, verifiable data, not an inflated ""original"" price.

Now, let's be real: this isn't always easy. Some deals are gone in minutes, stock can be incredibly limited, and regional availability is a real thing. What's a great price for me in one state might be standard for someone else. It's also not about getting *everything* cheap; it's about being informed and strategic when you need something. There's effort involved, and you'll miss out on deals sometimes. That's just part of it.

If you're tired of fake discounts and want vetted finds, follow r/DailyDoseCoolFinds—we test products, compare prices, and share what's actually worth it.",1,1776827846.0,DailyDoseCoolFinds,0,1.0,False
1ss9mck,https://www.reddit.com/r/starbucksbaristas/comments/1ss9mck/starbucks_hot_take_clopens/,Starbucks Hot Take: Clopens,"People who schedule clopens are fucking selfish abd dont give a fuck abput their employees. If you are a ssv or coffee house leader, and you do that regulary, you are a piece of shit and your shift probably fucking hates you. Another way Starbucks breaks your spirit to take all your time and force you to devote all ypur energy to work. 

My deepest apologies to the strays caught by SSVs, you are also victims, shout out to my fellow survivors ",19,1776827812.0,starbucksbaristas,9,1.0,False
1ss9lu6,https://www.reddit.com/r/mets/comments/1ss9lu6/guys_im_getting_made_fun_of_everywhere_in_la_when/,Guys I’m getting made fun of everywhere in LA when I choose to rock the Mets.,"I bought a coffee and a burrito on Sunday and the guys said to me, “ yo man what’s up with the Mets “ I did what any met fan would do, “ did you see Nolan McClain pitch, he’s amazing !!? “ turned out the guy works at dodger stadium- imagine what it feels like to root for a team that wins games. That must be a great feeling ",5,1776827774.0,mets,1,1.0,False
1ss9l9u,https://www.reddit.com/gallery/1ss9l9u,Coffee puck review,"I think I could have filled it a bit more 🤔 

Perhaps 25 grams of grounded coffee is not enough for the six cup pot.

Also if it looks really dark almost black, it’s because it’s dark roasted pure robusta beans.",0,1776827728.0,mokapot,1,0.5,False
1ss9jc7,https://www.reddit.com/r/MaticRobots/comments/1ss9jc7/features_i_think_would_be_great/,Features I think would be great,"Hi Matic team,

Feature: Al-based mess detection using existing camera.

Use case: My kitchen gets coffee drips and cereal crumbs. I want it to:

1. Detect mess type with on-device Al while cleaning.

2. Auto-adjust: more water + slow passes for sticky stains, high suction for crumbs.

3. Show before/after photo in app so I know it handled it.

4. Let me flag ""still dirty"" to improve model.

5. “Auto” mode where I had 2 ideas one would be it auto detects how much to clean automatically you pick the rooms it figures it out. The second idea would be like a surveillance mode where it will casually drive around and  when it detects a spill or new crumbs it will pick it up accordingly. This would be cool for dinner parties or something imo. 

Why: Saves time, water, battery. Other bots do partial versions - Roborock dirt-detect, Ecovacs obstacle Al. Matic could lead by adding the photo feedback loop.",4,1776827576.0,MaticRobots,0,1.0,False
1ss9j5p,https://www.reddit.com/gallery/1ss9j5p,UFS/T (USA only),"Hi! Lots of guys up for sale/trade! All are brand new (except Popcorn), just dupes or not ones that I wanted to add to my collection. None have obvious flaws to me but I’m a very novice collector so I am happy to send more pics of any you’re interested in! They are $10 each (plus cost to mail), except the following:

\-Strawberry Love - Lop Eared Rabbit: $15

\-Dog Time - Beagle: $15

\-Sweets - Popcorn: $7 (I traded for this guy, and he’s in great shape but just doesn’t feel right to resell for same price as others!)

\-Animal ver. 4 - Gorilla: $7 (his head keeps popping off, but otherwise brand new)

Will offer a discount for buying 3 or more!

Open to all offers for trades, but ISO: Coffee, Dog Time - French Bulldog/Chihuahua, Shark, Penguin, Starfish, Rose, Cactus, Frog, Owl, Peacock, Carrot, Radish, Watermelon, Strawberry, Pineapple, Pig, and literally ANY CAT LIFE 😭 also willing to trade multiples for specific ones

DM if interested!",3,1776827563.0,SonnyAngel,1,1.0,False
1ss9ilj,https://www.reddit.com/r/Advice/comments/1ss9ilj/finding_friends_as_an_adult/,finding friends as an adult,"i don’t really make posts often but i am not sure where else to go. i am a 21 y/o trans guy who recently had a baby. the past few months have been the loneliest i’ve ever felt. i have tried reaching out to and making plans with friends, but they are usually too busy or don’t get back to me. my best friend doesn’t drive, and my other closest friend lives in a different state. i even reached out to my childhood best friend, whom i haven’t spoken to since we were about 12. she unfortunately did not even answer me. i am an introverted and ‘weird’ person with uncommon interests. i have been planning on going to a story time group at the library with my son in hopes of meeting other new parents. since i’ve had my baby i have only really seen my partner, my mom, and my grandma. i had 2 friends from work and a friend from high school come visit but that’s been about it. i work at a popular local coffee shop so i am used to quite a bit of social interaction. i just don’t really know how to reach out to people and connect with them, it has always been very hard for me, and its even harder now.",2,1776827520.0,Advice,2,1.0,False
1ss9iga,https://www.reddit.com/r/askportland/comments/1ss9iga/what_are_your_favorite_activity_dates/,What are your favorite activity dates?,"I have come to the conclusion that I don't especially like coffee/sit and talk type dates. I'm too awkward with new people, and while I'm okay with silence when it's people I have some familiarity with, having it occur during a first date is... pain.

So I kindof just want to exclusively do activity dates from now on, and I'm seeking suggestions. I know there's a mini-golf place in... St Johns? I think? And I consider wandering around antique malls a kind of activity. But what else? Is bowling too much of a commitment? Arcades sound fun, but I only really know Ground Kontrol, and I stopped going there years ago because it was always STUPID busy.

I know there's STUFF. Portland has like seventy ZILLION things to do at all times, it seems. So what are some you like, or would at least recommend as options?",17,1776827509.0,askportland,17,0.91,False
1ss9i5l,https://i.redd.it/1sq9bobdsnwg1.png,Damn that shit to hell,,1,1776827487.0,u_bokuwa420,0,1.0,False
1ss9i3n,https://www.reddit.com/gallery/1ss9i3n,First Time ko sumakay sa Philippine Airlines,"As someone from humble beginnings, kala ko impossible makasakay ako sa airplane. Nung nagaapply ako sa Airforce 5 years ago, tanaw tanaw ko lang yung airport, amaze na amaze ako to see up close ang mga airplane while saying a silent prayer na sana makasakay rin ako sa airplane. God is good all the time. I am so happy I was able to experience PAL with the love. Ang sarap pala talaga ng free biscuit nila tapos ipartner mo pa sa coffee nila. The experience was really smooth even sa booking pa lang. I got to choose seats and also checkin baggage allowance ay included na sa fare. Unlike back then, sa other airlines, sa check in baggage allowance kami napamahal. Flight was on time also. We had bad experience with delayed flights sa other airlines. As someone who is matangkad, I am so happy may leg space pa rin ako. Maybe next travel, I will invest na flying with premium airlines. Next time kasama naman ang fam. To more travels! Back to work na again para may pangtravel ulit. 💕",1,1776827482.0,FirstTimeKo,1,1.0,False
1ss9hxx,https://www.reddit.com/r/Needafriend/comments/1ss9hxx/26_f_looking_for_a_friend/,26 F looking for a friend,"Hi Reddit 

I am going through a terrible patch. I have had issues with a lot in my life. I looking to expand my friend circle. I currently have mostly a few friends. I want to have more friends. I like to cook and read. I currently am finishing a few new authors. I also enjoy listening to country music. My favorite country artist is Garth Brooks. I also enjoy rap music a lot. I enjoy going to outdoor concerts and I also enjoy coffee shops a lot. I would love to chat. Looking forward to our conversation ",9,1776827469.0,Needafriend,9,1.0,False
1ss9hxl,https://www.reddit.com/r/u_Trick_Gate_3432/comments/1ss9hxl/breaking_the_cycle_of_algorithmfirst_content/,"Breaking the Cycle of ""Algorithm-First"" Content","We’ve all been there—obsessing over hashtags, posting times, and SEO keywords. But when was the last time a piece of content actually made you *feel* something?

I was thinking about why we go to our favorite coffee shops or pick certain restaurants. It’s rarely because they topped a Google search. It’s because of how they make us feel—the warm lighting, the handwritten thank-you note on the receipt, the ""human"" touch.

In 2026, we’re drowning in AI-generated ""numbness."" Big brands like Apple are actually moving *away* from pure digital perfection to show behind-the-scenes, handcrafted work.

**Key Takeaway:** Image matters more than vanity metrics. If you focus on the relationship rather than the reach, you’re not just building a following; you’re building an identity.

**Watch the full breakdown:**[https://www.youtube.com/watch?v=P01OwyGUY\_8](https://www.google.com/search?q=https://www.youtube.com/watch%3Fv%3DP01OwyGUY_8)",1,1776827468.0,u_Trick_Gate_3432,0,1.0,False
1ss9hmq,https://i.redd.it/9nxoxbr6snwg1.jpeg,La Palina Red Label,"It was ok, got quite a bit of cedar and a little bit of spice. It was a good cigar but I feel like it would have been a better later in the day cigar than a morning coffee cigar. ",2,1776827445.0,cigar,0,1.0,False
1ss9gs2,https://www.reddit.com/gallery/1ss9gs2,I will draw your cat drinking coffee ☕️ | drawmypets | catdrawing | catart | catlover | drawmycat,,1,1776827381.0,AwwCat,0,1.0,False
1ss9g0v,https://www.reddit.com/gallery/1ss9g0v,I will draw your cat drinking coffee ☕️ | drawmypets | catdrawing | catart | catlover | drawmycat,,1,1776827324.0,AwwCat,0,1.0,False
1ss9f8h,https://www.reddit.com/gallery/1ss9f8h,I will draw your cat drinking coffee ☕️ | drawmypets | catdrawing | catart | catlover | drawmycat,,1,1776827263.0,DrawMyPets,0,1.0,False
1ss9dvh,https://www.reddit.com/gallery/1ss9dvh,"EDMUND LEIGHTON - THE ACCOLADE, 1901","This scene unfolds inside the grand, stone walls of a medieval hall, where a ritual is taking place. The heart of the painting is the young woman at its center. She’s a queen, and she’s the one in charge here. She stands tall, dressed in a long, white gown, with a golden crown on her red hair. In her hands, she holds a sword, its blade pointing toward the floor. But it's not a weapon for battle right now. She is about to use it to create a knight.

Kneeling before her on a simple leather cushion is a young warrior. He’s dressed in a tunic of red, bearing the insignia of a black eagle and a crescent, over a full suit of shining chain mail. His helmet is on the stone floor beside him, and his hands are clasped together, a gesture of absolute devotion and fealty. He has bowed his head as he awaits his fate. This act of the queen touching the flat of the sword to his shoulder is the core of the ceremony, a ritual known as the ""accolade"". It is the final, sacred gesture that elevates him from a warrior to a knight. An audience has gathered to witness the event, standing to the left of the queen. Among them, you can see an old man holding the knight's standard, a page boy with his shield, and even a monk. 

What I find so special about the painting is that Leighton placed a woman in the role of power, a choice that was not historically common but feels incredibly right. She is the arbiter of his new life, the one who bestows upon him a code of chivalry he will be bound to for the rest of his days. When you step back and look at the whole thing, ""The Accolade"" is more than a painting of a ceremony. It's a window into a romanticized past, a world of honor and beauty that Leighton captured perfectly on canvas.

""The Accolade"" was part of a series of works on the theme of chivalry that Leighton created in the early 1900s. This painting, completed in 1901, was actually the second in a trilogy. It followed ""God Speed"" from 1900, which shows a knight leaving his lady for a war, and was later followed by ""The Dedication"" in 1908. This period was the peak of Leighton's career, and these three paintings together form a romantic tale about knighthood. 

Despite its immense popularity, the original oil painting of ""The Accolade"" has almost never been seen by the public. The work has remained in a private collection since it left Leighton's studio in 1901. It is not hanging in a major museum like the Tate or the National Gallery where you could walk up and see it. Its existence is known almost entirely through high-quality photographic prints and reproductions. For over a century, the actual canvas has resided in someone's home, making it a ghostly icon that is famous around the world while its physical self remains mostly hidden from view. 

Love what you are seeing? A small coffee donation helps me stay inspired and create more for you.  https://buymeacoffee.com/pmamtraveller.",104,1776827157.0,ArtConnoisseur,1,1.0,False
1ss9dup,https://www.reddit.com/r/R4R30Plus/comments/1ss9dup/m4f_37_silent_soliloquies_cold_shoulders_coffee/,"[m4f] 37 silent soliloquies, cold shoulders, coffee comforts and sad sad songs about us","little joy, big sleep and midnight moon soliloquy exchanges

got the tism but it's okay i've got it under control

I think

it's all weather and windows and sun glow and day glo and hyper color.

Soft windows and soft sunshine and a valley's worth of sleep

you wake up just to turn out the light.

I'm fake as i can be, my tears are soft and so are my knees

I'll say it in as few words as possible

these dreams have had their fun with me. there's a place you find in your sleep

I had a weird experience the first time i posted here so i thought i'd try again but preface it by saying:

please come as you are let be yourself, i'm big on honesty up front and

move your body like a time machine

it's raining in the room we're in

I wanna know about the books you cant let go of

i wanna know what haunts you

who are you when no one is around?

whats your biggest hot take?

Whats your biggest green flag?

your brightest red flag?",0,1776827156.0,R4R30Plus,0,0.33,False
1ss9drc,https://i.redd.it/shp6httcrnwg1.jpeg,Forgotten coffee,,6,1776827149.0,MoldlyInteresting,0,1.0,False
1ss9bq1,https://www.reddit.com/r/Tiki/comments/1ss9bq1/custom_home_tiki_menu_v2/,Custom Home Tiki Menu V2!,"Hello all! Round 2 of asking you all for opinions and advice on my tiki menu for my upcoming Tiki birthday party (I own a small sign/print company and these cost me pennies). As noted previously, this is still a work in progress. Spacing, colors, etc etc I still need to finalize. The NA punch is still TBD. 

If you haven't seen my first post, you can check it out [HERE](https://www.reddit.com/r/Tiki/comments/1solb4l/custom_tiki_menu/).

  
Taking in some of your advice from r/Tiki, I've reduced the menu. My thought is, the shareables I will be making one early in the night and presenting to everyone (estimated some 30 people - I have a ton of straws), then halfway through the night for the second, and just putting it on the table. I will warn that it is very boozy, but if everyone has a sip or two it will be gone quick. People will want to try it because it will have a flaming crouton lol. I did a little test run with 5 friends, and we cleared a Volcano in a few sips. 

  
I wanted to include more options/variety in the first section as some people may not like or know rum, so there's tiki cocktails with alcohols other than rum. I did notice during my little test that I was ""stuck"" behind the bar, but I wasn't set up to host (though they were all hanging out with me at my bar). I plan to have all the ingredients in a cooler next to the bar so I can quickly make any of these. 

  
The 3 items with the strange names are inspiration from Hell or High Water in Denver. I have not yet worked out the recipe for ""Gaytanic Panic"" just yet.

  
Yes, it's more of a California/tourist Tiki style, but I currently do not have the funds to hire someone to make me something custom. This is what was available on the stock website I use for work (except for the headstone which I drew). 

  
I plan to finish up the ""full"" menu in the original post too just for funsies, and will also post that when it's completed.

https://preview.redd.it/5hx2ep8xnnwg1.png?width=1872&format=png&auto=webp&s=dea744c4d08eaaa4e095daac56925b15cbf65daf

  
",1,1776827002.0,Tiki,3,0.67,False
1ss9bpx,https://www.reddit.com/gallery/1ss9bpx,Dali April 24-26 Flyer,,5,1776827002.0,DaliPH,1,0.86,False
