id,url,title,text,score,created_utc,subreddit,num_comments,upvote_ratio,over_18
1n9oi5p,https://www.reddit.com/r/confessions/comments/1n9oi5p/i_asked_about_a_cousin_i_hadnt_seen_in_years_and/,I asked about a cousin I hadn’t seen in years and learned something disturbing,"Today I went over to my parents’ place for lunch. We were just hanging out, chatting after coffee, and out of nowhere I remembered this cousin of mine from my mom’s side. Let’s call him James. I realized I hadn’t seen him since we were both teenagers. He was one of those cousins you only see at family gatherings, but I always remembered him as a fun kid. We’d finish eating before the adults and run off to play together.

I casually asked my parents whatever happened to him, and the whole vibe in the room changed instantly. My dad tried to change the subject so fast it was almost comical. Later, when I was alone with my mom, I pressed her a bit and she finally told me.

Apparently when James was little, like 5 or 6, he had this disturbing habit. Every time he was left alone with an older person, family, teachers, even neighbors, he would try to kiss them. Not a little peck either. He would actually grab people and try to make out with them. It was always adults or older teens, never kids his own age.

He tried it with his own sister who was a lot older than him, his mom, his dad, teachers, even parents of his friends. Obviously this caused all kinds of uncomfortable situations. His parents at first thought maybe he had seen something on TV and tried to explain, but he just wouldn’t stop. If he was stopped, he would cry and throw a tantrum, then try again later like nothing happened.

As he grew older and stronger, it became impossible to manage. By the time he was 12, his parents basically had to move away and get him into treatment. That’s why I never saw him again. My mom says he’s now an adult but still difficult, and apparently he resents his parents for putting him through therapy.

I honestly don’t even know how to feel about this. My memory of him was just a sweet cousin I’d play with, but now I’m sitting here trying to process this really unsettling story.",1,1757126915.0,confessions,0,1.0,False
1n9oh4x,https://www.reddit.com/r/OCPoetryFree/comments/1n9oh4x/i_know_this_place/,I know this place…,"This is a poem I’ve written about a love I’ve once shared with someone very special to me. It’s rather long so I do apologize for that.


I know this place…

It started there — on the edge of my bed, in the hush of midnight,
when her voice cracked through the dark like a match struck in shadow:
“It’s your fault for making me fall in love with you.”

No fanfare. No grand gesture. Just those damned words — soft, trembling —
and suddenly every wall I’d ever built dissolved.

The moon spilled silver across her face,
her fingers tracing mine like she was learning me for the first time.
I didn’t speak. My breath caught somewhere between lungs and throat.
Because some moments aren’t made to be filled with sound;
they’re made to be felt — deep in bone and blood.
And from that night… we became real.

⸻

I turned to her and confessed that gentle sin.
I had fallen for her too, as disgraceful as it may have been.
As damaging and unknowing as it was at the time, I felt what I’d needed for so long.
And God… how I lived for that need.

⸻

We kissed through arguments sharp enough to draw blood —
over small things: silence mistaken as anger, boundaries crossed, rights and wrongs.
But it was never about what we fought, it was whether we’d survive after.

And always, always, she found her way back into my arms,
as if even fury couldn’t drown what lived between us then:
this wild thing beating beneath skin and scar —
love so fierce it refused its own death sentence each time it should’ve died.

⸻

There were nights she cried on my chest without words —
just tears soaking into cotton like prayers falling mute to stone.
I held her anyway. I didn’t ask why.
I just let her break where no one else could see,
because that’s what lovers do: they become shelter,
even when they’re drowning too.

⸻

There were nights where I cried in her arms.
My tears soaked the fabric of her shirt, yet she didn’t care.
As long as I was comforted and had her to lean on,
she knew that she was my shelter, and I was hers.

⸻

Lighters for companionship, bracelets for promise —
tiny relics of a love we swore would last.

⸻

We had drunken nights spent wasting time
and enjoying each other’s presence, like nobody and nothing else mattered to us.
Hours and hours of loving passion — a passion that not even the strongest blade could divide
if it cut through the two of us.
Every phone call we shared brought us closer, filled with laughter and love.

⸻

But slowly, the warmth thinned out like winter light retreating behind clouds.
Her touch turned careful — not cold yet, but cautious —
like touching glass after fire’s gone out under flame-licked wood.

Then came silence, heavier than any shout could carry.
The questions unanswered, the promises that felt untrue.
The promises I hold to myself dearly, yet cannot be spoken between her lips anymore.
A dead end that I ran into, like a truck hitting a concrete wall.

The love she once whispered beside moonlight now sits still behind locked eyes —
unreachable even when standing face-to-face across a room full of ghosts named memory and regret.

⸻

We never had that last kiss, the one we’d hoped would never come.
We never had that last night out together, drinking coffee and eating whatever our hearts desired.
We never shared our last bit of feelings that burned like an eternal flame.
Instead, we built shells around our hearts, unreadable to each other.

⸻

Her heart? Unknowing…but shut —
the kind closed not by pain, but choice.

And mine? Mine beats in unsteady echoes now:
a drum without rhythm, a pulse missing its reason.
Still holding space for someone who no longer lives here.
Still waking up reaching for warmth long since left.
Still loving past due date; past logic; past dignity even.
Still writing poems nobody will read but pain understands well enough.

⸻

Because sometimes letting go isn’t one act, it’s thousands:
each breath where I remember not to call, each song I skip, each photo hidden or saved —
though every view cuts deeper.
Every moment I catch myself hoping against proof that maybe tonight, maybe tonight,
she’ll indulge once again, like nothing ever changed.

⸻

But nothing has changed except this:
the mystery of whether she’ll miss what is gone,
the wonder of if I still matter to her,
and if the spark is still there.
I can’t stop missing everything all at once.

⸻

So here I am. Still loyal — to a woman who walked away, smiling at another man.
Still grieving — a loss only half acknowledged.
And still believing — in something most would call foolish:
that real love doesn’t vanish because someone stops choosing it.

It lingers — in heartbeat delays, in unsent messages rotting inside drafts folder purgatory,
in beds too wide with one pillow untouched since goodbye.
In photographs, videos, and nerve endings that fire like rapid bursts of emotion in the dead of the night.
In the absence of her once warm, inviting, and open arms.

And yes… it lives in poetry written by a shattered man
trying desperately not to forget how beautiful their ruin used to feel
before everything came to a screeching halt — left for guessing, assumptions, worries, and stress.

⸻

Yet even if the love still lingers, the damage is already done.
I remain unconvinced, unknowing, and dreadfully loyal to a love I know I cannot have.

So like all other things living in this world of billions of souls,
this love too shall die someday.
Not with anger, not with a bang or with revenge, but with a whimper.",1,1757126829.0,OCPoetryFree,0,1.0,False
1n9oght,https://www.reddit.com/r/kzoo/comments/1n9oght/is_kalamazoo_my_new_home/,Is Kalamazoo my new home?,"Hi! I’m a 39F moving up from Chicago and trying to figure out if Kalamazoo might be my new home.

In Chicago, some of my favorite neighborhoods I lived and worked in were Andersonville, Lincoln Square, Ravenswood, Rogers Park, Uptown, and Edgewater. I’m hoping to find something here with a similar feel. I visited a couple weekends ago and really enjoyed what I saw. I even chatted with a few small business owners/employees downtown who had nothing but great things to say about the area. I’ve spent time in Holland (where one of my close friends lives) but it’s not really the right fit for me, and while I’ve enjoyed visiting Grand Rapids, St. Joseph, and Saugatuck, Kalamazoo so far feels like it might be the best choice for this stage of my life. 

A little about me: I grew up in a small Midwestern town and went to college in a small Midwestern city (both in Indiana) so while I’ve been in Chicago for the last 15 years, I do understand and appreciate smaller-town life. I’m really looking for that middle ground... not too quiet, but not overwhelming either. I’m also part of the LGBTQ+ community, if that makes a difference.

What I love: local shops, coffee spots, live music, thrift stores, farmers markets, hiking/biking and other outdoor adventures. I also frequent dispensaries (and I get the feeling that’s pretty common in Michigan). I’m a hairstylist, so I really thrive in artsy, welcoming, slightly offbeat communities where people are open-minded and creative.

What I’m hoping to avoid: feeling super isolated or needing to drive 30 minutes just to grab a coffee.

If you had to point me toward the Kalamazoo neighborhoods or nearby communities with the best mix of character and community, where should I start? 

Thanks so much for any advice,  I really appreciate it!",1,1757126772.0,kzoo,0,1.0,False
1n9oe1r,https://www.reddit.com/r/WeightLossAdvice/comments/1n9oe1r/the_scale_doesnt_move_for_weeks_at_a_time_i_am_at/,The scale doesn't move for weeks at a time. I am at my wits end and about to rip my hair from my scalp.,"I'm literally about to stop eating. Like Im not joking. Starvation works. Im sick of everyone pretending like it doesnt. 

Losing weight ""the right way"" has turned out to be the worst thing I've done. I swear to God. 

Backstory:

I have been losing weight for 5 years. I weighed roughly 135kgs (295 pounds) at 180cm (5'11"") Female 5 years ago. I used to be a big over eating. All the bullshit. A tale as old as I time. I wont rehash it. 

I stopped binging, started walking. But didn't do anything particularly spectacular and lost 45kg pretty consistently from 2020-2022. I still have the data logged in my phone. 

Then it stopped at 90kgs. I remember I got so frustrated at 90kgs that I gave up trying. Because I swear I was ""stuck"" here. 

And I admit, at the time I was still suffering with food noise and giving in pretty often. And so I fluctuated from 90-98kgs over 2022-2024. 

In early 2024, I said FUCK IT and started going to the gym. I hated it. It was awful. But I kept going. 5 days a week consistently throughout the rest of 2024. My diet then was still inconsistent and my weight still fluctuated but I kept going. 


And now Ive been going over 1.5 years. And its part of my routine now. I go everyday. 

Diet: 

My diet was all over the place until 3 months ago. After trying a bunch of diets over the years and eventually failing, I finally figured out the source of my food noise. And stopped it. 

I no longer order take out (I used to several times a week). I don't eat fast food ever. Processed food like chips and snacks etc all stopped. 

This is probably the most locked in period of my fucking life. I swear to God. Im not even tempted by the bullshit food. 

And for the last 3+ months Ive been without food noise. I hate measuring out food. So I decided to start buying stuff as pre-portioned as possible. So that way I can remove the annoying step of weighing it all out. 

This is how I eat (a combination of these things to equal 450-700 calories a meal)

Breakfast: 

100g chicken breast 
2 low fat string cheese 
1 cup 85g plain (no sugar) yogurt 
1 pack of nuts 20g for 106 calories

Lunch: 

200g chicken breast 
Vegetables (sometimes I fry zucchini with osyster sauce and garlic, sometimes raw cucumber or carrots. This week it was salad, so add 200 cal dressing) 
I decided to cut the salads out and switch to rice paper rolls with vegetables inside to get rid of calories from dressing. 
100g of fruit (cherries, an apple, grapes etc) 
Add string cheese or pack of nuts if I have calories left over 

Dinner:

100g of chicken breast 
100g of whatever fruit I have 
Brothy vegetables soup 100-160 calories 
Piece of bread for carbs. 

This week I switched out cheese for one boiled egg at each meal. I add a teaspoon of mustard. And half a tablespoon mayo on each half. 

When I have to eat out, I get hot pot. I put in mushroom, bok choi, cabbage, bean sprouts, rice cakes and then 100g of the meal they sell there. But I do this for dinner when I get off work maybe once a week at most. 

I will get bored and eat just my chicken on tortillas and tomato and lettuce with an apple. For lunch sometimes until i run out of ingredients.

But I keep my meals around 500-650  3 times a day. 

I used to snack all throughout the day when I was fatter. But I drink water at work and dont eat anything at work. I eat an apple on the way home to stop from buying something on the way. 

I dont cook my chicken in any oil. I heat it up in its bag and pour it on the plate. 

I drink 1 zero calories drink a day. I drink 1 shot of espresso with 150ml of milk at how 4-7 days a week with a squirt of low calorie sugar.

The only time I eat more is on my period. For the first two days I eat 2500-3k calories of higher calories food. And have successfully returned to my diet for 3 months in a row without going into a binge. 

So I consistently stay under 2k calories.I would need to be eating 2700-3k calories a day to maintain 90kg frame. And Im not. 

Exercise: 

Lifting:
5 days a week upper / lower split 1-1.5hrs. Moderate weight and reps.

Cardio:
Upper body days jogging intervals 5 run 5 walk for 20-30 mins
Lately: walk 5 min / run 20 / walk 5
Saturday-Sunday: 1 hrs on tread mill doing intervals. 

Walking: 
Currently 20k+ steps a day. Ive been walking over 10k a day for years. I dont own a car and was doing 13-15k regularly anyway. And jogging and walking my dogs pushed it to 20k. 

I exercise as much as I do because if I dont, I will become sedentary again. If I dont go to the gym on Saturday and Sunday to jog and walk, I won't get any exercise at all. 

Also, I almost never feel fatigue. I dont push myself extremely hard with weights. I lift moderately. I very rarely get DOMS. And never train to failure. I just lift until it feels easy then up the weight. 

Currently I barbell back squat 90kgs for 5. 100kgs RDL for 4, Smith machine bench 30kgs. I neglected upper body last year, so this year I'm trying. Can jog 20 minutes straight through without stopping. 

Weightloss:

I weighed 96kg in March of 2025. 

Fixed my diet in May of 2025. Got back to 90kg in June of 2025. 

And I swear my weight sticks at this number. I dont know why. Its driving me crazy. 

I weighed myself daily and it wad 90.5kg. Weekly, and it was 90.3-90.5kgs. I went to the gym every single day in July. And August. 

If I pooped, 90kgs. If I drank water and peed, 90kgs. If I was constipated, 90kgs. If I had carbs the night before, 90kgs. 

At one point I thought of buying a new scale. Changing the batteries. STILL 90.5ish kg. Not 91. Not 89. Always 90.1-90.5

I dont know what the fuck this weird equilibrium is but for me its 90kgs. But instead of giving up I decided to keep going because I knew I wasn't eating enough to be 90kgs. 

And after SIX FUCKING WEEKS, the scale dropped 2.5 kilograms on 2 days.

😭😭😭😭😭😭😭

What the FUCK is that bullshit?

No matter what I did for 6 weeks I maintained the exact same, unchanged weight with no fluctuating for 6 weeks. How is that normal?

All through August I went to the gym 31 days in a row. Did over 20k steps the last 2 weeks.

I bought a new, more expensive in-body scale, to more accurate readings. 

Today September 5th, I weighed 90.6kgs on my new scale. It says my BF is 30%. Probably inaccurate to some degree. By my BF is definitely high still. 

I have no idea where my starting BF was I cant compare. But if I had to guess it was likely over 50% 5 years ago. 

My old scale reads 91.6kgs because fuck me I guess.

😭😭😭😭😭

Im about to stop eating. Just due to mental stress. Because I just want to be 80kgs. My goal is 70kgs. 

I was 90kgs 3 years ago when I was still eating 2700 calories a day and ordering take out once a week. I was 90 kgs when I was getting a large coffee at my workplace multiple times a week. I was 90kgs when I was getting bread from a French bakery near my house 2 or 3 days a week. I was 90kgs when I wasn't exercising at all 3 years ago. 

Ive managed to get over my exercise aversion. And stop my food noise. I stopped eating out. Stopped snacking. Stopped binge eating several times a month. 

But losing 10kgs of fat is my fucking white whale..and has been for literal years. 

And I haven't eaten yet today. And after stepping on the scale, I dont have an appetite honestly. 

I have avoided the mirror for the last decade and taking photos because I hated the way I look. My elevator is a 360.mirror and I try to avoid looking everyday

I bought a floor length mirror for the first time in 10+ years. It came yesterday. My in body scale came this morning. So I made sure not to eat many carbs yesterday. I had a small roll with breakfast before the gym.

And my weight still fluctuated up another kilogram. Im gonna lose it, I swear.

I looked in the mirror and I dont look fat. I look exactly like Im just outside my normal BMI (because I am). 

I know Im probably inflamed from working out 7 days a week. Probably am carrying water weight around. From running and lifting even though I dont feel fatigue from it.

I know Im not over 90kg. Because I have a pair of pants I can only fit when Im 90kg. And they've gone very  loose in the waist. So Im definitely 88kgs or less. My new pants that I bought 2 months ago. A size smaller, have also gotten looser. 

But I just want to see the shit reflected on the scale. Consistently. And I dont. It seems like consistently scale movement is the norm for most people. 

It has never been for me. When I was fatter and sedentary, it moved on a two week basis, if I was lucky. 

Now its gone to monthly. And I'm walking around with a bunch of water retention. And I'm sick of it. 

I see posts everywhere of people consistently losing weight on a weekly or bi-weekly basis. If their weight really gets ""stuck"" maybe a 3 weeks to a month. 

But 6 weeks is sending me over the fucking deep end. That seems like an unreasonable amount of time to maintain the same weight. And Im very close to just giving up again. 

I feel like I try too hard to still be fat. I look at my exercise stats and its crazy how much effort I put in for my body to still be swinging back up to the 90s. I dont have enough calories in my house to be swinging back to the 90s. I dont enough food on my plate to still be swinging back into the 90s.
 
I've tried to make short cuts with diet by only eating stuff already portioned out so I could reduce my mistakes in measuring error. 

But thats not working either. 

So the way I see it, not eating is the only way to ensure 100% that it cant be from calories. 

I give up. 








",3,1757126564.0,WeightLossAdvice,1,0.8,False
