id,url,title,text,score,created_utc,subreddit,num_comments,upvote_ratio,over_18
1k3bser,https://www.reddit.com/r/CreepCast_Submissions/comments/1k3bser/i_thought_the_funeral_would_be_the_last_time_i/,I Thought the Funeral Would Be the Last Time I Saw Her. I Was Wrong.,"I spent a long time trying to forget what I saw. Finally writing this down made it clear that pretending it never happened just made the fear more potent. Like most things in life you need to just take the medicine, no matter how dark and bitter it may be, with that I suppose this will be my spoonful then.

Two years ago I took a job as an armed guard for a cannabis dispensary in Orange County, California. It was very much illegitimate, cash paid weekly, a strict no cell phone policies in case of under-covers. It was an unspoken belief that the owners were paying off  the local government to leave the shop alone. It became pretty clear after we saw all the other shops in a fifteen mile radius get raided and shut down.        

 Meanwhile we raked in the cash, and a seemingly endless line of new customers. I never cared to examine it too closely, holding the old adage of don’t bite the hand that feeds you in my back pocket. It was about three months of getting accustomed to everything before I really began to feel comfortable. I soon began to know the regulars, what behaviors to watch out for, and really how many different people from different walks of life liked to smoke weed. Cancer patients, hipsters, sound-cloud rappers, burnouts, artists, hippies, they were all there.

 The events in question orbit a specific customer. Lacy Embersmith. Lacy was one of those customers who got along with everyone who worked there. The receptionists, security, bud tenders, delivery drivers, even other customers. She was  magnetic,  a cheerful personality that seemed to always light up the place. Lacy was the type of customer that came nearly every day, she would pick up a pre-roll joint, edible chocolate, or some other novelty. An excuse to  socialize and spend time in the company of others.

 I remember the last day I saw her, well the “her” before everything transpired. It was a slow period in the evening, dusk had turned the sky outside a hazy orange. Lacy strode through from the lobby doors into the middle room spouting her typical greeting of 

“Hello my gentle-dudes!” She was smiling, blue eyes bright against her pale face. She had put her auburn hair into a small bun. My partner for that shift began to chat with her as I sat quietly behind the security desk monitoring the cameras. I waited as per our routine.

Lacy would talk with Bill for a while then come and speak with me. She knew that one of us had to stay on top of things at all times. One of the few customers who understood our role there. My eyes scanned between the cameras, shots from the entrance to the building, into the lobby, to the lounge where we were now and the last room which held all the products for purchase. At one time we had doors between each room but somewhere between the months they all were removed and now the customers could stride through all the way to the end. The lounge acted as a sort of middle ground, it housed our cameras, monitoring software and a few couches with a television on the wall. They were for the customers to wait if the product room got backed up with customers. In all reality the TV’s acted more as a sort of pissing match between the guards, who could prove they had better taste in music.

This particular day had been a slow one, I remember struggling to hear Bill and Lacy’s conversation. A tinge of annoyance at the laughter from her due to Bill’s usual sleazy flirtations. Married with three kids and still tried hitting on any female that walked through that door. I knew he wasn’t her friend, just a predator.

 

Lacy walked over to the security desk leaning over the lacquered wood with  a goofy open mouth smile as if she were about to shout something. I turned away from the screen smirked and said 

“What? What are you smiling about?”  She Grinned wider before saying, “I got an invite!” I smiled in response, “Dude that's so rad how the hell did you get in!?” Lacy did a small dance, “ I met a guy at the bookstore who has an invite, totally cruising through the paranormal section too!” She laughed at this clasping her hands together in delight. 

“No shit, wow you lucky duck. Well you have got to tell me all about it afterwards, that will be some heavy stuff, maybe you can get me into the next one!” She was already nodding at my words, eyes closed like a little kid asked to keep a secret.

Lacy had managed to get an in at the closest thing to a paranormal Super bowl we had around here. It was a sort of meet and greet for all the local weirdos, occultists, pagans and ghost hunters of orange county, high class and invite only. The real kicker was the after party where rumor was they were going to attempt a ritual to summon something and conduct it as a mixture of occult practice and scientific study. The topic of the paranormal and the occult had forged our friendship. A mutual fascination and finding out we belonged to many of the same online forums, listened to many of the same podcasts, and watched the same YouTube channels all dedicated to all things that go bump in the night. I congratulated her and thanked her for the future invite to the next event. Lacy bought a few things and left. The day proceeded as always and I left for my weekend  happy and excited for my friend.

 

I returned two days later to find the receptionist attempting to hide her tears. I learned that Lacy had died in the days since I had been gone. In the early morning hours of Sunday she had collided with the center divider of a freeway and for some reason--most likely shock-- had gotten out of the vehicle and wandered onto the freeway only to be hit by a driver. Her body was launched yards beyond by the impact. We all had hoped she was killed before she landed. My thoughts were haunted by where she had been before the crash. The event she was supposed to attend was the Saturday evening before. Had she been drunk coming back home afterwards? Had she even attended it? Was there a connection in any way? I knew if I had been in her shoes she would have the same questions. Any news articles we found were unclear on the exact time of the accident. I was quiet for most of the shift that day, mourning. We all were really. A bright light snuffed out by tragedy.

I remember having one of the most vivid dreams that night. I was driving, the sky above was black and starless, the only light around were the headlights of my car piercing the night as I drove along a nondescript highway. I could see a figure along the side of the road. I could make it out to be Lacy as I approached, she turned waving as she stepped forward walking right into the car's path. I smashed my foot down on the brake pedal, jerking the wheel with no response. I slammed into her, the impact launching her down the road arcing through the air. A wide slit began to appear across the horizon beyond, a gaping chasm like a set of enormous jaws. The night sky separated as lips wrapped across a line of deep purple pink gums and needle teeth as tall as pine trees. The mouth opened in time for Lacy to shoot past its teeth and down its throat. My car careened forward as I screamed, slamming my foot on the brake pedal watching the mouth grow closer widening, anticipating its second victim, I woke just as my headlights zoomed towards those needle teeth.. I didn’t even attempt to sleep again that night.

The next day I showed up for my shift in a daze from the night before. I planned on making an entire pot of coffee to help fend off the exhaustion. The first sign of something off  was an interaction with the receptionist. She was an annoying little mousy girl. Always far to chipper for my taste. 

“Man, you look exhausted!” She exclaimed in her tinny staccato voice. I nodded, 

“Yeah had a bad dream about Lacy, I'm sure I'm not the only one.” She tilted her head at me like a dog that heard an unrecognizable sound. “Lacy?” she asked. I shook my head and shrugged, thinking she may not have heard the news. I was far too tired to be the one to explain it to her. I made my way into the lounge, going through the motions of setting up the coffee machine, greeting the first shift and half listened to their banter of ball-busting and shit talking. I had taken my first sip of coffee when the supervisor Edgar came to me, slapping me on the back asking, 

“Damn bro you look like tanned cat shit, never seen bags like that on you before.” Bill laughed at this, his smile illuminated by the light of the camera screens.

“Just had a rough night, bad dreams, rough one about Lacy.” I took another sip of coffee, waiting for Edgar and Bill to nod knowingly. Instead I watched their faces grow into mischievous grins. 

“Damn Guero, you have some naughty dreams about our customers huh?” Edgar said, Bill laughed too hard at this, like a braying donkey. I felt my face grow hot with anger. I was disgusted by their words, their disrespect of the dead. 

“What the fuck is wrong with you man, don’t talk about her like that! Are you fucking sick or something Jesus fucking Christ man.” I spoke louder than I should have, I could hear everyone fall silent in the rest of the shop, listening to my outburst. Edgar's face dropped, he stepped forward, his tone lowering. 

“What is going on, what are you talking about bro?” Bill was leaning forward smirking like a kid about to see a train wreck. I felt my face getting red, exhaustion feeding my frustrations.  

“Edgar, no, what is wrong with you? How can you act that way, talk about the dead like that…” My words were interrupted by a voice in the doorway. An impossible voice, a voice which said, 

“What's up my gentle-dudes!” Edgar and Bill responded, “What's up Lacy!”

My coffee slipped through my fingers, the Styrofoam cup bouncing on the cheap false wood linoleum, dark brown liquid splashing and steaming across the floor. Bill and Edgar turned to face me, “Man, what the hell is up with you today?” I said nothing. I couldn’t, all I could do was stare at her. Frozen, watching as she shambled forward smiling with bloody broken teeth. Bones jutting from her legs and arms. Splintered shards glinting under the overhead lights like pearl. Her hands mangled and most of her skin stripped away, hidden beneath the ragged shreds of her bloody clothes clinging to her raw exposed muscle. She walked a hard crooked angle, impossibly so as she said 

“You OK buddy?” She paused halfway through the lounge turning to me, her head crooked, turned at a nauseating angle, a trail of bloody footprints behind her. All I could do was stare in disbelief. Eyes wide and blood shot. My brain is doing back flips at what I was seeing. After several moments she proceeded into the product room, leaving me stuck in place with Edgar and Bill staring at me. 

“Dude what the hell man are you freaking out or something, you gonna clean up this mess?” I slowly shook my head asking,

 “What the fuck man, she needs to go to a hospital! She’s supposed to be dead, how is this happening? are you not seeing th...”

My words were choked by a rush of hot vomit. I turned just in time to catch myself over the trash can under the desk of the camera station. I could hear her come back into the lounge and ask, “Is he going to be OK?” , 

“I think he just ate something, he’s good, we will see you later Lacy.” I stayed there hovering above the trash can, not wanting to see her again. In a few moments after I learned very quickly that  no one saw her as I had seen her. Nor was I apparently living in a version of reality where her death had actually occurred. I was the only one that saw her walking around as a mangled corpse. Even on the camera system, I took video of her on my phone and showed others asking them what they saw. Each one saying the same thing. Just a normal girl.

She came into the shop again two days later. Luckily I spotted her coming to the front door from the camera before she made it inside. She was farther along in the decomposition stages. What I did see on camera was more ragged than before. A dark blue color to her. Sort of puffed up, bloated with an orchestra of bugs flying around her like a cartoon drawing of stink lines. I ran to the bathroom hiding like a coward. I could hear her through the pressed wooden door. Her voice was muffled, but sounded wet like she was speaking with a mouthful of food. I could smell the stench of rot creeping through the cracks of the door. Bud tenders responding in a normal voice, no reaction to her appearance. 

I waited until I heard the goodbyes and waited longer still before exiting the bathroom. Everyone was staring at me as I came out, I was gagging on the smell left behind. The acrid sweet scent of mold and decay, it was thick and choking. When I made it back to the camera station I was met with my Supervisor who began lecturing me on abandoning my post. I lied and said I had a stomach bug or something. He sent me home early that day. I swear it took three showers to get that smell out of my skin and hair.  

 

The last time I saw her was my last day working there. I was standing by the door of the product room. I had been preoccupied with a pair of customers who seemed to be giving the bud-tenders in the back a hard time. Some B.S. about the product they had gotten wasn’t what they expected. I stood by as a precaution, a reminder to remain polite. The smell hit me as I watched them. The hair on my neck standing stiff, my nose burning in protest.

 

“Lacy what's up my friend?” Edgar exclaimed from the camera station. I couldn’t turn my head, I was stuck, praying that it was anything other than what I was about to see. I felt my eyes watering, a wet gurgling croak sounded from a few feet behind me, 

“What's up my gentle-dudes.” It was like a voice coming from mud. A wet, wheezing, struggled phrase. I could hear the sound of her footsteps, wet slapping sucking sounds across the linoleum floor. A choking gurgle sounded next to me. I wanted to leap from my skin, shuddering at the sticky bony coldness of her touch as a hand cupped my elbow. Putrid garbage squirming with maggots across decayed chicken bones. 

I would have screamed if I hadn’t been frozen with terror. I remember turning to look down at her face and I couldn’t understand. Like looking at an optical illusion, an image I couldn’t process. What once was her cherub face with kind blue eyes now a rotting unknowable terror that looked back at me. Yet there was a knowing in those horrible eyes, familiar somehow. The glint of affection in two pools of  hideous black and yellow terror. I heard a ringing sound as I fell, watching her black putrid jaws moving like lampreys drowning in oil, she was asking something.

 

I woke up in the hospital with seven stitches across my temple. I had smashed the side of my head on one of the lounge chair arms after I passed out. I got my phone back from the nurse only to be greeted with a text message saying, Due to recent events the company has decided to proceed without. I didn’t even finish reading the message before deleting it. It was a relief in all honesty. I couldn’t go back there. Didn’t even pick up my last envelope of pay. No one else saw her, and I refused to see her ever again. The unfortunate reality is I will never be able to forget the feeling of that wet rotting hand on my arm, the pus colored pools where eyes should have been, and the inhuman croak, gurgling, asking, 

“Did you still want that invite?”

 ",2,1745113511.0,CreepCast_Submissions,0,1.0,False
1k3brab,https://www.reddit.com/r/Market76/comments/1k3brab/wcanned_coffee_h35k_caps/,W:canned coffee H:35k caps,,1,1745113403.0,Market76,11,0.66,False
1k3br8e,https://www.reddit.com/r/puertovallarta/comments/1k3br8e/coffee_filters/,Coffee filters,Does anyone know where I can buy coffee filters in ZR?,1,1745113398.0,puertovallarta,2,1.0,False
1k3bqix,https://www.reddit.com/r/Squamish/comments/1k3bqix/1914_coffee_co_drip_only/,1914 Coffee Co - drip only!,"Was surprised to see this week that this coffee shop no longer serves espresso based coffees. You can get a drip coffee or coffee beans or coffee accessories only now.  When asked, he said that there was no money in making espressos.

Too bad. I had previously rated him the #1 coffee shop in town. Good thing we have many other good options in town!",4,1745113329.0,Squamish,3,0.7,False
1k3bpv2,https://www.reddit.com/r/ParisTravelGuide/comments/1k3bpv2/not_sure_where_to_stay/,Not sure where to stay?,"I (32F) will be traveling with my daughter (13F) in November. This is a rough itinerary 

Day One:
Arrive in afternoon 
Relax/eat dinner 

Day Two: 
Dior museum 

Day Three:
Perfume making class

Day Four: 
Versailles

Day Five: 
Disneyland 

What arrondisement would make sense to say in? She’d also like to see the Eiffel Tower. I’d love to go shopping if there’s anywhere that won’t break the bank. Walkable to coffee / cafes / restaurants would be awesome. 
",0,1745113267.0,ParisTravelGuide,3,0.33,False
1k3bpry,https://www.reddit.com/r/AskDocs/comments/1k3bpry/unsure_why_my_body_feels_like_it_is_falling_apart/,Unsure why my body feels like it is falling apart?,"28F, diagnosed with bipolar 2, PTSD, generalized anxiety, b12 deficiency

daily medications currently include wellbutrin xl 450 mg, trileptal 150 mg,  topamax 75 mg, women's daily multivitamin, enskyce tablet birth control

weekly b12 injection administered by PCP

occasionally use cannabis if i am having really bad pain or can't keep food down. use it as a last resort.

background health info: history of mental health hospitalizations due to csa trauma. appendix out in 2020. stomach issues (consistent nausea/vomiting in 2023 that resolved on their own). migraines mid 2023 early 2024 that have come mostly under control since being prescribed topamax. have trouble with weight currently. lost over 50 lbs in 2022-2023 just by working a physical job. i kept it off until about now. in july of 2024 i weighed 183 lbs and i just weighed in at 220 on tuesday. 

i started to get really sick in january and have been experiencing symptoms since. although looking back i think my symptoms started to manifest physically in july of 2024

it started with mood changes that july. i was in a really dark place (never quite left to be honest) and had to do inpatient treatment for probably the 2nd worst depression i ever experienced and at that time they had increased my dosage of abilify. i don't remember the dosage.

then, i later started developing digestive issues again and was nauseated/vomiting frequently. i was having migraines all the time again but nothing would take them away. if i got sick with virus, i was sick for 10+ days and the illness was incredibly hard to kick. 

i was seeing my psych regularly for management because i have always needed to manage my mental health with treatment and will always need to and i have accepted that. keep that in mind with this backstory. 

i started to become so anxious and paranoid i couldn't go to work or be at work because i genuinely thought everyone was out to get me. i told my psych. she was like ok lets change your mood stabilizer. i weened off of abilify and started taking some other medication i don't even remember what it was but it wasn't very long.. maybe three weeks later and my feet started to itch at night. i never could get relief. 

then my hair started to fall out, my scalp was SO itchy, and i started to have ear pain. 

i told my psych because i genuinely thought i might have been the meds doing this to me... so she then put me on lamictal... within 24 hours of my first dose of that i was in mild anaphylaxis with an extremely itchy rash on my arms and legs that did not go away for over a month and a half. after i went to hospital er for anaphalaxis i was down for 2 whole weeks with the norovirus and was back at the er during this time when i started vomiting what looked like coffee grounds quite literally all day long. went to the dr multiple times during all of this and i was gaslit by PCP and told merely to stop my occasional cannabis use. crazy. i did stop for a while but honestly, that did not help. the only change was now i was not taking a gummy at the worst of my symptoms. 

within the next few weeks i became increasingly more tired, decreased appetite despite gaining weight and one night i was woken out of a dead sleep to my body being numb and tingling on only the right side of my body. it felt like electric shocks going through my body. extremely distressing and mildly painful, i thought i was having a stroke. my partner called the paramedics to take me to the hospital because i couldn't walk and they came and told me it was anxiety and to go to my happy place, go back to sleep. ... again.. crazy. 

i go to new dr. we're in feb now. and they do bloodwork and my b12 is at 199 and they're like ok we'll do 4 loading injections and take it from there. well. ok. not once during those four weeks did i feel better but i guess that was to be expected. new symptoms came up during this time like joint pain, breakouts on my scalp and hand tremors. two weeks after the final injection (we're in end of march) and my worst symptoms come back tenfold. i had full body (not even half this time) painful tingling that woke me out of dead sleep twice in one week. itchy feet are BACK. i'm extremely paranoid about things that don't even make sense. my depression is DARK. except nooow my lymph nodes under my jaw, and in my armpits are swollen and i was having back of neck pain, knee and hip pain. the knees are the worst though. sometimes i can't move them and it is an excruciating stabbing pain. 

i go to the dr on april 8 and he gaslit me too!! lol he said he gave me b12 i should be fine now but he'll give me a psych referral and do more bloodwork since ""im concerned"" .... ok. yes run the panel.. anyway bloodwork came back actually concerning which shocked him and they're sending me to a rheumatologist..which i don't even know what a rheumatologist really does and the earliest they could get me in is two weeks out. they also want me to ween off of topamax completely which i don't understand because it helps with how many migraines are happening to me. and they're giving me more b12 on a weekly basis until my level is ""waay higher"" (it's now 305)

so here's what came up abnormal in my bloodwork:

CRP - 26.2 H

Phosphate- 2.4 L

ANA SCREEN, IFA - POSITIVE

ANA TITER - 1:320 H

ANA PATTERN - Nuclear, Homogeneous

ANA TITER - 1:320 H

ANA PATTERN - Cytoplasmic, Fibrillar filamentous

i really don't know what to make of any of this. 

i thought i just had b12 deficiency?

regardless, i feel like my body is deteriorating.. my overall quality of life has completely downgraded. my everyday constant state of being is generalized pain and stiffness all over. i try to get out and take walks everyday but sometimes i have to take it so easy because getting up and doing the smallest things makes me feel like i got hit by a truck. if i sit feet flat on the ground... my feet fall asleep within minutes. if i sit with my knees bunched up on the couch, they become so painful i cannot move them. i cannot work anymore, i lost my job in february. 

i do not know what to do. 

how do i improve my quality of life? what tests should i ask them to run? any advice you could give me?



",2,1745113257.0,AskDocs,2,1.0,False
