id,url,title,text,score,created_utc,subreddit,num_comments,upvote_ratio,over_18
1ia6kc3,https://www.reddit.com/r/dating_advice/comments/1ia6kc3/dating_has_taken_a_toll_on_my_self_esteem/,Dating has taken a toll on my self esteem,"My (F24) dating experiences have left me scarred and I think I've given up on love altogether. I'm truly just exhausted. I know I've done a lot of things that I shouldn't have due to my people pleasing tendencies (situationships, setting no boundaries, etc..) but even when I would stand up for what I wanted, I'd still end up hurt.

Typically, things will be going great up until I bring up the exclusivity conversation (\~2 months in). That's when they decide to end things with me. It's just this repeating pattern of really great dates with someone I can see a future with, being open to them about how I feel with them reciprocating those same feelings, continuing to date, and then things ending when I bring up wanting exclusivity.

I don't even want to put the blame on the men I'm choosing to date. They've all been so different since I don't have a type. Short, tall, well off, unemployed/full time student, etc...

  
I can't help but to feel like it's me. I feel like I'm not good enough for love. Maybe they saw too many of my flaws and that scared them away? I probably don't look as pretty as I thought I do without makeup. Maybe my personality is just shit? Am I too chaotic of a person? Sometimes I let my childish side come out and maybe it was too weird for them. I'm spiraling with these self deprecating questions and It's mentally and emotionally exhausting. I used to embrace all of my weird quirks and flaws but now I feel the need to hide who I really am in fear that people will throw me away. I've even let this fear affect the way I interact with potential friends. I hate who I've become. 

I don't know. I just really needed to rant. Anyone else dealing with this?

(I know I need therapy but I'm a struggling engineering student who can barely afford coffee. I plan to find a therapist as soon as I get my career started)",2,1737868230.0,dating_advice,11,0.75,False
1ia6k0x,https://www.reddit.com/r/Spironolactone/comments/1ia6k0x/constipation/,Constipation,"What’s everyone doing about the constipation side effect? I’ve been on spiro 25mg for a week and feel like I keep getting constipated. I normally drink coffee when I’m constipated but I heard caffeine isn’t good to drink when you’re on spiro? 
I’ve been drinking 4-5 waters a day 
Along with a Gatorade to stay hydrated and feels like nothings working ",1,1737868200.0,Spironolactone,3,1.0,False
