id,url,title,text,score,created_utc,subreddit,num_comments,upvote_ratio,over_18
1ssb6og,https://www.reddit.com/gallery/1ssb6og,Raffles Singapore: Our best stay in Singapore,"
Aall rooms are suites and you have an on-call butler to assist.

* Amazing welcome and upgraded 1 level. Free breakfast + hotel credits

Booked with u/SmartTraveller83 seeing the 3rd night offer and perks.

✅ room technology is fantastic. Lights and blinds all iPad-controlled. Aircon, call for butler and dinner reservations etc can all be made through iPad.

✅ room inclusive of amenities cabinet. Included drinks, snacks and tea/coffee etc.

✅ welcome drinks of Singapore Sling.

✅ welcome gift of wine and chocolates.
✅ many restaurants to choose around the hotel

- Dinner: We ate at Bar & Billiards Room - delicious!

- Breakfast: included at the Tiffin Room. Absolutely divine! A mix of a La carte and buffet style - order main breakfast plate and coffee, then collect sides / fruit.
✅ swimming pool is a great size and has a bar adjacent to it.

I love Accor properties and have many of them on my bucket list - this one was simply incredible!

If you have been thinking about staying here - this is your encouragement! You won’t regret it!",1,1776832293.0,u_Guilty_Explorer_1817,0,1.0,False
1ssb55o,https://www.reddit.com/r/BariatricSurgery/comments/1ssb55o/unusual_post_op_story/,Unusual post op story,"Hi everyone, I wanted to share what’s been going on my feeling of gloom and doom has passed, but it’s been a ridiculous ride.

My mother, father and boss have all had a gastric sleeve. (I’m really good friends with my old boss.) i’ve been in the ER six times and hospitalized once for all the complications I’ve had my doctor gave me a blood thinner. I was throwing a blood that was crazy. I’ve had to go into the ER multiple times for a bunch of things, I contracted strep, and pneumonia separately over the course of the last eight weeks that I had to be hospitalized for and they scoped me because of all the complications I’ve had at six weeks. They suspected I had a stricture, but it turns out I have three ulcers and the ulcers were causing me huge issues with swallowing and keeping things down. I have not hit my protein or water intake daily metric for the surgery a singular day. Today marks eight weeks. I’ve lost around 50 pounds in those eight weeks finally the last week I’ve been able to keep some foods down such as pulled chicken. I also suffer from EOE, which has also been playing a problem for me. My surgeon was absolutely baffled from the level of complications I’ve had. My job also illegally fired me while I was out on approved medical leave, so I’ve been dealing with that. Not that it’s related, but it adds to the mental struggle. The reason I’m writing all of this is because I have to logically assume that someone else has dealt with similar stuff like me with this. I was wondering if anyone had any advice other than suffer through it and it’ll be worth it in the long run. The Weight loss is already been fantastic. My clothes are falling off my body basically but this food and regurgitation thing has me worried because I want to go back into law-enforcement and I’m afraid that this could be an ongoing issue of dehydration and foo. Prior to the surgery I only drank water. I don’t drink coffee, energy, drink, drinks or anything else except water and tea so if anybody has any advice or pointers, they can give me to help a suffering human being I would appreciate it. Strange reason the only thing I’ve been able to drink is pure life tea. I know the sugar is supposed to be bad for me, but it is literally the only liquid I’ve been able to keep down regularly. I was wondering if anyone knew why that was the case. I haven’t thrown it up a single time. ",1,1776832172.0,BariatricSurgery,0,1.0,False
1ssb52i,https://www.reddit.com/r/MyFrench/comments/1ssb52i/avoir_le_coeur_gros_uncovering_the_secret_to/,"**** **""Avoir le Coeur Gros"": Uncovering the Secret to Being a Little Heartbroken** **","**

### What does ""avoir le coeur gros"" mean?

Literal translation: ""to have a heavy heart""
Actual meaning in English: To be feeling a bit down, melancholic, or disappointed. Imagine having a heart that's carrying a weighty load - it's like having a perpetual knot in your stomach!

### When to use it:

* **Formal**: Use this expression in formal writing or conversations when you want to convey a sense of subtle sadness.
* **Casual**: Share your ""cœur gros"" with friends and family over coffee or at social gatherings. It's a great way to express empathy and understanding.
* **Familiar**: This expression is perfect for close relationships, like with a romantic partner or trusted friend.

### Where does it come from?

The phrase ""avoir le cœur gros"" has its roots in medieval French literature, where it described the weighty burden of carrying a heavy heart. Today, it's still used to convey a sense of emotional heaviness, often without going into too much detail.

### Example sentences:

1. **J'ai avoir le cœur gros en apprenant que mon ami avait perdu son travail** (""I had a heavy heart when I learned that my friend lost his job"")
2. **Mon chum m'a dit qu'il était désolé de ne pas avoir pu venir au concert, et j'ai avoir le cœur gros** (""My buddy said he was sorry he couldn't come to the concert, and I felt a bit down about it"")
3. **J'ai avoir le cœur gros après la rupture avec mon petit ami** (""I had a heavy heart after the breakup with my boyfriend"")

### Similar English expression:

If you're familiar with phrases like ""feeling down"" or ""having a heavy heart,"" then ""avoir le cœur gros"" is right up your alley! It's not an exact translation, but it conveys a similar sense of emotional weight.

**Ready to master this French idiom?**

[Learn more about ""avoir le coeur gros"" on My-French.com](https://my-french.com/expressions?link1=expressions&expression=avoir-le-coeur-gros)",1,1776832165.0,MyFrench,0,1.0,False
1ssb4pg,https://www.reddit.com/r/UtahInfluencerDrama/comments/1ssb4pg/just_ingredients_making_coffee_protein/,Just ingredients making COFFEE protein?,I’m in the JI Facebook group and so often over the YEARS I’ve seen sooooo many requests from people asking her to make a coffee flavored protein. She always says thanks for the suggestion I’ll had it to the list kinda thing. Presumably bc she’s Mormon and coffee goes against her religion. But now all of a sudden she’s selling a latte flavored protein!! With real coffee in it not just coffee flavoring or something. I feel like she is selling out😂 as the church says you can buy anything in this world with money… seems like the money has gotten to her and she is selling out and going for it since she knows it will be popular and make a lot of money. Has she tried this protein herself when formulating it!? Didn’t think she’d ever do it ,1,1776832135.0,UtahInfluencerDrama,1,1.0,False
1ssb4el,https://i.redd.it/gytsr5w36owg1.jpeg,On Wednesday,"Music&Flashlight, Kindle, Coffee. Good day!",2,1776832110.0,flashlight,3,1.0,False
1ssb3yz,https://finance.yahoo.com/markets/commodities/articles/coffee-trade-becoming-more-complex-145115031.html?guccounter=1&guce_referrer=aHR0cHM6Ly93d3cuYmluZy5jb20v&guce_referrer_sig=AQAAACns6hZ6Xw3XVSTOc4PWCYWuJfR4SxOeRA_4dRcgI3TrwRQbW6OtN9CnJJ14xUVsd9b4pGOZ4T2Rd3I5uRaYcILLGQTruVhOJfgHXYRCqUuLse2R9TtI2NFD2tXIkt-SMNOwWeN5s9V8nz6_7z3tyGIWSuAaZ0trNG3BQND7D1XG,The Coffee Trade Is Becoming More Complex. The Impacts Will Be Felt Worldwide,,2,1776832072.0,finance,0,1.0,False
1ssb3pv,https://i.redd.it/pifhw1xx5owg1.jpeg,Got myself a KLC as an early birthday present…,"And I daggone love it. Also got the remote, stylus, and clear case so that I could decorate it. I got it Saturday and read an entire book that night because I couldn’t put it down (the kobo or the book). Really enjoying the color annotation features. ",4,1776832052.0,kobo,0,1.0,False
1ssb3cg,https://www.reddit.com/r/keto/comments/1ssb3cg/question_about_staying_on_keto_at_music_festival/,Question about staying on keto at music festival.,"Hey everyone! This is my first time posting but I’ve been lurking for a few months. I started keto in February and have lost about 20lbs in that time, just recently breaking the threshold of 200lbs. I’m super happy with my progress and hoping to make it somewhere between 170-150. As for my question, I’m planning on going to a country music festival in early October and I would like to keep up with keto while I’m there. The problem is that we aren’t allowed to bring any food or drink into the festival. We are however allowed to bring drink additive packets and an empty bottle which we can fill with water in the festival grounds. I was thinking about replacing one of my meals with a protein drink but I’ve found that most of the packets are just protein and have no fat. So my question is: has anyone tried mixing a clear protein packet with like MCT oil to boost fat content? Has anyone found MCT powder packets that aren’t like coffee creamer and would work with a fruity protein powder and water?

TLDR: going to a festival where food and drink aren’t allowed but drink packets and a bottle are. Has anyone mixed clear protein packets with MCT powder? Has anyone found MCT powder in a packet form that is not coffee creamer?",3,1776832018.0,keto,1,1.0,False
1ssb2hv,https://www.reddit.com/r/gastricsleeve/comments/1ssb2hv/very_unusual_recovery/,Very unusual recovery.,"Hi everyone, I wanted to share what’s been going on with me since my last update a lot of you gave me some good advice and my feeling of gloom and doom has passed, but it’s been a ridiculous ride. 

My mother, father and boss have all had a gastric sleeve. (I’m really good friends with my old boss.) i’ve been in the ER six times and hospitalized once for all the complications I’ve had my doctor gave me a blood thinner. I was throwing a blood that was crazy. I’ve had to go into the ER multiple times for a bunch of things, I contracted strep, and pneumonia separately over the course of the last eight weeks that I had to be hospitalized for and they scoped me because of all the complications I’ve had at six weeks. They suspected I had a stricture, but it turns out I have three ulcers and the ulcers were causing me huge issues with swallowing and keeping things down. I have not hit my protein or water intake daily metric for the surgery a singular day. Today marks eight weeks. I’ve lost around 50 pounds in those eight weeks finally the last week I’ve been able to keep some foods down such as pulled chicken. I also suffer from EOE, which has also been playing a problem for me. My surgeon was absolutely baffled from the level of complications I’ve had. My job also illegally fired me while I was out on approved medical leave, so I’ve been dealing with that. Not that it’s related, but it adds to the mental struggle. The reason I’m writing all of this is because I have to logically assume that someone else has dealt with similar stuff like me with this. I was wondering if anyone had any advice other than suffer through it and it’ll be worth it in the long run. The Weight loss is already been fantastic. My clothes are falling off my body basically but this food and regurgitation thing has me worried because I want to go back into law-enforcement and I’m afraid that this could be an ongoing issue of dehydration and foo. Prior to the surgery I only drank water. I don’t drink coffee, energy, drink, drinks or anything else except water and tea so if anybody has any advice or pointers, they can give me to help a suffering human being I would appreciate it. ",2,1776831942.0,gastricsleeve,0,1.0,False
1ssb23i,https://www.reddit.com/r/BangaloreSocial/comments/1ssb23i/36m_seeking_friendship_m4f/,36M seeking friendship. M4F,"Life’s good on paper work is steady, routine is set but the days have started to blur into a loop of calls, deadlines, and ticking off tasks. Before I know it, it’s evening, and I’m left wondering where the day went.

Somewhere in all this, I feel like I’m missing the simple stuff those easy, random conversations where you just talk about anything and everything. Work rants, travel stories, bad jokes, memes, or just sitting over coffee and chatting about life.

Most friends are caught up with their own lives these days.

I’m looking to connect with like-minded folks who’d be up for a chat.

Nothing complicated just genuine conversations and a bit of connection outside the daily grind.

Big plus if you enjoy travel stories, life conversations, or just wandering discussions about life in general.",1,1776831907.0,BangaloreSocial,0,1.0,False
1ssb0ln,https://www.reddit.com/r/asksg/comments/1ssb0ln/just_realised_9s_coffee_shop_at_rivervale_shores/,Just realised 9S coffee shop at Rivervale Shores has been replaced by airconed eatery. Is the new setup any good?,"Was shocked to learn that 9S lasted only 1 year!

It was the coffee shop that Sengkang East Dr residents had waited in anticipation :)

I wonder if the new eatery has any must-try food items. Do recommend if you have eaten there and liked it, much thanks.",1,1776831777.0,asksg,0,1.0,False
1ssaylz,https://www.reddit.com/gallery/1ssaylz,"Edmonton Punk Rock Flea Market 7 is Sunday April 26th from noon-5pm. 🎟️Free Admission🎟️ Steele Heights Community League. 🧥 Bring layers, there may be a lineup to enter the venue. 🤘","Info copy-paste from the organizers:

SUNDAY APRIL 26, 2026
12pm – 5pm
Steele Heights Community League
5825 140 Ave NW, Edmonton, AB. Canada
Mark your calendars and Tag your friends! Don’t miss this once a year event.
Punk Rock Flea Market is a DIY / Punk-Rock inspired / Curated artists market.
Featuring 40+ Local artists and Independent creators bringing original art, prints, apparel, handmade goods, knit wear, beading, handsewn plush, and wild, one of a kind pieces you will not find anywhere else!
All Ages / Everyone is welcome / Free Admission / Tons of Free Parking / Flipside BBQ Food Truck / My Sweet Escape Treats / Tattooing on site by Fox Runner Tattoos / Great tunes all day
Come early to play Punk Rock Bingo for your chance at winning some amazing prizes from our local sponsors and our artists themselves;
>2 Propagandhi Concert tickets for their Edmonton Show.
>$150 Gift Card + Merch from Fox Runner Tattoos.
>10 x $25 Gift Card from Mr. Halal Burger.
>6 x 4 pack of Sea Change THE WOLF Hazy Pale Ale Beer
>2 Tickets to LOVE Pro Wrestling.
>$50 Gift Card from Flipside BBQ
>2 x $15 Gift Cards from My Sweet Escape
>$20 Gift card + Merch from Polyrhythm Brewing
and more!
See our Sponsor posts for full prize details and rules
Close to transit and the Londonderry Mall. Our space is one floor with no stairs, handicap accessible powered door entrance and private washroom.
Cash is king (Bring small bills) Most vendors can accept cards, some do not! Be prepared. No ATM on site.
Local Artists need YOUR support now more than ever!
Check our site for more information:
PRFMYEG.com",6,1776831611.0,Edmonton,0,1.0,False
1ssax60,https://i.redd.it/d25ul3804owg1.jpeg,Why all you guys staring at me?,"is it something I did? is it the night coffee? I can lay off it if it is

\*is completely oblivious to the bows that make him better no debate\*",4,1776831488.0,Kckensonofficial,5,1.0,False
1ssaw2k,https://i.redd.it/k9d396nz3owg1.jpeg,"Adorable Nina und Alina day 2,092: did I forgot the coffee creamer?",,3,1776831395.0,Nina_und_Alina,0,1.0,False
1ssau40,https://www.reddit.com/r/CPTSD/comments/1ssau40/finding_love_and_safety_for_the_first_time_at_33/,"Finding love and safety for the first time at 33, despite a language barrier","I’m 33 years old, and for the first time in my life, I feel like I’m truly in love. I had a traumatic childhood and, although I’ve dated before, I’ve never experienced anything like this.

The girl I'm in love with - we don't even speak the same language, she can't speak English, I just started to learn Spanish. I met her by chance in a 2nd hand shop and just started talking with my modest Spanish and she gave me her number. Ever since it has been so intuitive, talking to each other, meeting for coffee, holding hands, travelling together even. Everything feels right, like with instinctive ease. She told me she also experiences abuse as a child. Maybe that's one way why we understand each other so well. But it feels like there is so much more. Like that in your heart you know that this is the right person for you.  
  
(For me that is a bit new experience. Because of abuse I mostly shutdown my emotions in my life, studied philosophy and tried to live more with my brain and rationality since my emotions and instincts didn't feel safe.)

I just feel so good with her, so at ""home"". I only know her for some months, but I cried with her so many times. Just being so happy and feeling so safe with her. I don't know when I express my emotions with her I start crying, I'm just so happy she exists and so happy that we met.  
  
She started a new job, hard work, and at the moment I hardly see her. Of course I miss her and my heart aches for not seeing he. But just when I think about her I get happy. When I see that she wrote I feel happy. We don't really write much and . But I still feel so connected and comfortable.  
  
She told me that we can only be friends, that she was hurt and that she loses autonomy in relationships. She calls me “hermanito” which is a endearing form of saying little brother. While some may see it as a distance marker, which it of course is, I see it also as her expressing love and care in a way that feels safe for her. She knows that I have problems with my family and she made me wristband by herself with a stone in heartshape form with a ""T"" in the middle for her family name. So while it is a sign of friendzone I feel at the same time that this is such a profund connection.  
  
She wrote me “Tu sabes que no soy tan apegada absolutamente a nadie. Solo a ti.” (I don't attach my self at absolutly no one, only to you). I think my heart broke when she wrote that and I loved her even more. Of course it's sad that she can't trust or that its hard for her to trust and that me - a stranger and a foreigner - is more close to her then others. But also that she does trust me to some extend is so beautiful to hear. This heartache, that you love someone that might understand you and that in this moment you might have found someone that you can finally be safe with and that they too give you trust. I don't know how to say it, but it makes you cry and laugh at the same time maybe, that you are so happy and so sad about your sadness, but happy that you express your sadness.  
  
We didn't have sex. We slept together in a bed 6 times while travelling. I feel so calm and comfortable with her. Sometimes we hold hands or she caresses my hair. I could die of happiness. In those moments I think this is all I need, a small income and the connection with her, small social life, writing texts. We spoke about the future. She said she has a small piece of land where I could build something. Or that we could buy a car and make it into a taxi.  
  
I think I'm sure that I want to live with her as roommates, even if can only be friends. Imagining that I could say good morning to her every morning or kiss her good night every night, I don't know. I never thought that such small gestures could mean so much. One time she noticed I wanted to give her good night kiss on the cheek and she moved closer to me, basically kissing me with her cheek. I don't know it was so cute I felt like I would die of cuteness.  
  
I don't know have you ever been at point in your life and your thought this is it. This is life. Its actually happening. Right now. This how life would feel if you hadn't been traumatised. This is how people actually felt ever since they were 15/teenagers and this kind of connection they have felt. (No wonder people love live:)

  
",1,1776831241.0,CPTSD,1,1.0,False
1ssat5t,https://www.reddit.com/r/mumbaimeetups/comments/1ssat5t/36m_seeking_friendship_m4f/,36M seeking friendship. M4F,"Life’s good on paper work is steady, routine is set but the days have started to blur into a loop of calls, deadlines, and ticking off tasks. Before I know it, it’s evening, and I’m left wondering where the day went.

Somewhere in all this, I feel like I’m missing the simple stuff those easy, random conversations where you just talk about anything and everything. Work rants, travel stories, bad jokes, memes, or just sitting over coffee and chatting about life.

Most friends are caught up with their own lives these days.

I’m looking to connect with like-minded folks who’d be up for a chat.

Nothing complicated just genuine conversations and a bit of connection outside the daily grind.

Big plus if you enjoy travel stories, life conversations, or just wandering discussions about life in general.

P.S - I am not in Mumbai",0,1776831165.0,mumbaimeetups,2,0.5,False
1ssasuy,https://www.reddit.com/r/UFOB_Disclosures/comments/1ssasuy/uleifericm_approved_a_comment_in_rufob/,u/leifericm approved a comment in r/UFOB,"### On 22/4/2026, at approximately 04:10, u/leifericm approved a comment in r/UFOB

##### Complete Mod Log

| Action         | Moderator | Details | Description |
| -------------- | --------- | ------- | ----------- |
| approvecomment | leifericm | unspam  |             |

##### Original Comment

> Also Ra and Hathor are real according to some random past CIA man. This is all just StarGate fan-fiction horseshit.
> 
> AI is not a COMP, you’re not going to summon Demons with a magic app Steve Jobs gave you after your mom sent you to buy coffee.

##### Permalink

> https://reddit.com/r/UFOB/comments/1sphz8g/a_former_openai_executive_says_sam_altman_is/oh13a19/

---

^(This content was automatically generated, and correct at the time of posting. Changes to the referenced content, such as edits or deletions, may not be reflected here. All times are in UTC.)",1,1776831140.0,UFOB_Disclosures,0,1.0,False
1ssasti,https://www.reddit.com/r/SaltLakeCity/comments/1ssasti/looking_for_toddler_friendly_recommendations_on/,Looking for toddler friendly recommendations on the TRAX lines,"We’re new to SLC and my very energetic 14 month old and I have been exploring our neighborhood (which has been great) on foot and taking the TRAX as much as we can rather than driving. 

I’m wondering if anyone has recommendations for fun spots to explore that are on or close to the TRAX lines. Parks, thrift stores, cafes and coffee shops, things for kids, etc. We are usually at the main library a couple times a week and would love to keep getting to know the city! ",1,1776831137.0,SaltLakeCity,3,0.57,False
1ssassk,https://www.reddit.com/gallery/1ssassk,Most a*tistic shit that has happened on this sub,"I know this will be lost to the sands of time regardless, but I’d like this to be forgot about two days from now of now instead of today. i’ve talked a lot of shit about this sub, but it’s officially a place where you need /s tags, and I think that’s enough for me.

I think what irks me the most is knowing that deep down this f\*ggot thought he was being clever. I’ve seen what happens to  subs when they cater to f\*ggots who think they’re clever.

Anyways, thank you for everyone. If anyone has a good service/tool for backing up saved posts, please let me know",11,1776831135.0,redscarepod,4,0.87,False
1ssarnc,https://www.reddit.com/r/MyFrench/comments/1ssarnc/voir_rouge_when_frances_colorful_passion_turns/,**** 🔴 Voir Rouge: When France's Colorful Passion Turns Red Hot! 🔥 **,"**

### Meaning:

🔵 Literal translation: ""to see red""
🔵 Actual meaning in English: to get extremely angry or furious, often with a sudden and intense emotional response.

When you ""voir rouge"" (see red), it's like the whole world has turned red hot! You might feel like blowing your top or losing your cool. It's not just a minor annoyance; no, no, no! This is full-blown, fiery outrage!

### When to use it:

**Formal**: While it's not typically used in formal writing or professional settings, ""voir rouge"" can pop up in casual conversations with friends or family members who share your frustration.

**Informal/Familiar**: Share a laugh and some red-hot passion with close friends or when discussing a beloved topic – like soccer (football) or music!

### Origin:

The phrase is thought to have originated from the ancient custom of using red cloth or banners as symbols of strength, honor, or even war. When someone ""sees red,"" they're essentially unleashing their inner warrior!

### 3 Example Sentences:

1. **Je voyais rouge** when I saw them take our favorite coffee shop! (I was furious!)
2. **Les parents voyaient rouge** lorsque leur enfant refusait de faire ses devoirs! (The parents were enraged when their kid refused to do their homework!)
3. **J'ai vu rouge** lorsque mon équipe a gagné le match en prolongation! (I saw red when my team won the game in overtime!)

### Similar English expression:

If you're familiar with the phrase ""seeing red,"" it's not exactly the same, but it shares a similar idea of intense emotional response. Think of it as French flair added to an old friend!

**Want to learn more about this fiery expression and many others? Head over to [Learn more about ""voir rouge"" on My-French.com](https://my-french.com/expressions?link1=expressions&expression=voir-rouge)**",1,1776831043.0,MyFrench,0,1.0,False
