id,url,title,text,score,created_utc,subreddit,num_comments,upvote_ratio,over_18
1g73737,https://www.reddit.com/r/discordfriends/comments/1g73737/24f_looking_for_fun_chat_buddies/,"24/F, looking for fun chat buddies. ","Hi all! Not sure what to put here.. So I'll make this up as I go, I guess. I'm 24/F, just looking for some fun folks to DM here or on Discord and kill some time with. Please don't message though if you're gonna do 1-3 words at a time. I'd like an actual conversation.

Best way to get my attention is via a DM. I'm likely not gonna be checking replies/notifications on this post.

Hobbies of mine include:

Video Games - Recently beat Baldur's Gate 3 and Cyberpunk 2077. I just started Metaphor: ReFantazio the other day. I play tons of genres though. Even enjoy a CoD match or two each day. I'll be buying Black Ops 6 when it drops.

Horror Movies - Horror is life. Especially a lot of the older stuff. Not to say that new stuff can't be good too, though, because it certainly can. Recent obsession is the Terrifier series.

Music - I lean heavily towards rock and metal, but I'll listen to almost anything. Angus McSix is my favorite band, it's power metal. I'm always open to new suggestions.

Also a big (American) football fan, if anyone out there would like to talk about that.

Honorable mentions: Chili, sushi, Pepsi, coffee, weed, tequila, Holidays, my cat.",2,1729320784.0,discordfriends,1,1.0,False
1g7370r,https://www.reddit.com/r/Advice/comments/1g7370r/would_i_be_a_horrible_daughter_for_eventually/,Would I Be A Horrible Daughter For Eventually Going Low Contact With My Parents After They Blew Off My Safety Concerns?,"Throwaway account since I don't think I'll use Reddit often.

I (18F) am a first year college student, so I have had a huge change in life such as moving into a dorm (even though I am an in state student, both my parents and I agreed it would be a good chance for me to learn how to be independent). Growing up I had been the social outcast at my school so I never really had any close friends I felt comfortable enough to talk about more personal matters, but as of the last couple years have made some really great friends online through a project I made.

Seeing as I've become really close to these people, I started talking about my home life and just stuff that, while personal, I thought was natural and normal to experience. Apparently being constantly blown off by your parents by being told ""you don't know better"" or having them joke about how you are the dumb one of the family or the first pancake so you're ""not perfect"" is not at all natural or healthy. Yes, I've come to realize this now but back then I genuinely had no idea since I had nothing or no one else to go off of.

My friends, along with a few other people I have met through work and such have helped me to realize I should be tested for ADHD due to having many behaviors that line up with the inattentive type such as a severe lack of motivation, time blindness, and so on (the list of reasons is actually pretty long). This has caused a lot of conflict within my family as my mother would check on our grades multiple times a day, down to each every individual assignment, to question if I had already done something or why I was below a B on anything which was pretty stressful on top of the fact I attended an academically competitive private school that ranked their students by how many AP classes they took.

However, another reason why I mentioned being tested for ADHD is when I accidentally slipped and told my sister (16F) I was thinking about how I might have it, she went to tell my mom and they both cornered me one day to tell me I don't have it and that it was absurd I even thought I had something. They both went on to say my generation is so obsessed with being put under a label and I should know better than to follow such stupid trends.

This is when I really realized just how often my family looked down on me and didn't exactly treat me right. My mother, while in public, is typically a very nice woman who cares for everyone, but in private back when I was in elementary she has even told me that as a teacher aid she expects much more of me than she would her students. She said she felt slightly bad for it but never backed out on the behavior.

Come middle school and throughout the years I lost a lot of friends and went through a lot of toxic friendships, my school was full of a lot of entitled people who were definitely more interested in social media and trends while I was more into art and video games, I came into trends later but people still found me to just be super weird so I was sort of seen as the ""pity points"" person to hang out with lol. This caused me to go from a very hyper and sociable kid to a very generally closed off person as I never really found someone I could talk about my true passions with (believe me, I am beyond happy to now have my current friends, I can talk to them about anything and everything and just feel appreciated). My mother was not happy at all to see I wasn't a social person like her, who always could spout an endless stream of words, even to people she didn't like because she's always gossip about them to me and my family.

Being unsocial resulted in my mother commenting a lot about different things about my personality and the way I presented myself. She always said that I was at fault for being alone because I never tried (I had in the past but after some repeat toxic friendships I was scared to really involve myself in another) and would point out all my ""weird"" aspects. I walk weird, I dress too weird or manly (I recently realized I am non-gender conforming and I just like multiple different fashions), I present myself as not smart, I lack common sense, and just many different comments she made about how I wasn't like her during her teen years. As if I already didn't have a low self-esteem, this definitely made it worse. To this day I constantly find myself doing something or presenting myself a certain way and instantly thinking ""What would mom think?"" and it would always be something negative. One of my friends even mentioned that it feels like my mom is the voice of anxiety in my head since I comment so much about what she would think of me.

High school came and went and I think my only successes was I passed all my classes, gained a love for theatre (which fortunately because she was a theatre kid), and graduated with acceptances and scholarships from multiple different colleges. She always complimented me on my achievements and talked about how great I was to her friends... which I will acknowledge, but most of the time whenever I did something wrong I got an internal sense of panic because it would always feel like the one assignment I didn't get a good grade on was the end of the world apparently.

While there would be times I would rebel and try to say the way i was being treated was unfair towards me or hurt me, my mother would become sensitive and say ""apparently I'm not a good mom"" or ""I guess I'm just making everyone mad at me, aren't I?"" and would instantly go to being the victim. While my father has been getting better at not letting that get to him, he will talk to me in private and tell me to be a better daughter because ""Mom is just sensitive and does a lot for you, so even if she is hurting you, just nod and say okay and then it will be over."" Another thing that my parents have done which I've come to learn is not normal is constantly talking about the amount they spend on you as a reason to be grateful for them. My parents will constantly talk about the price of gifts or items they got for me-which, taking the silver-lining, has made me pretty aware of how and what I spend my money on.

So, getting to the main question I had come here to ask after that overwhelming chunk of context (sorry) is that I am in the middle of my first semester at college. I have been struggling greatly to make friends in person here but did make friends with this one guy in a class I have to take for my game development major. He seemed nice at first but eventually became super pushy in subjects with me and seemed to just appear everywhere and latch onto me and I could just not get away from him. Thing is I didn't really see this concerning behavior until one day where he had invited me to hangout with him and play on an arcade machine on campus at this one student hangout place. It was originally to complete an assignment reviewing older arcade games, but devolved into him following me to the bookstore to get a chai latte at the coffee shop and then to my dorm building. I thought we were done there and tried to hint at it a lot, but eventually I just got overwhelmed and wanted to get back to my dorm. He followed me into the elevator, where I thought he was just making sure I made it back to my room safe, but then he followed me back all the way into my room. It is safe to say I learned a lot about setting boundaries that day, especially considering this next part. I had quickly left because when I asked him if he wanted something to drink he asked for water and I had to refill my jug at the filtered water station down at the end of the hall. I came back and he was bringing out his gaming laptop and pulling up a game I had already told him I had no interest in playing because it was a horror one and I just don't do good with horror. I felt pressured to play so I gave it a go and when it got to a real scary part, he came over to me and started rubbing my back... and rubbing... and rubbing. I counted the clock and he just kept going for five minutes straight and I was super uncomfortable because this guy didn't even ask for my consent or anything. I know this could've been seen as an act of comfort, but seeing as we had only hung out once or twice after class, I really felt uncomfortable on top of the fact I sort of felt why this was why he had forced me to play this game.

I quickly found a spot to stop, told him I had homework, and FINALLY got him to leave. But after that, it felt like wherever I went he was just... there. Whenever I left my dorm to eat, he was sitting near the entrance and if I pretended not to notice him, would follow me all the way to the back of the dining hall as I was getting food. He would suddenly appear as I was walking to different classes and so on. This was also weird because his dorm was a twenty minute walk away from mine, so seeing him constantly around my dorm building skeeved me out a bit. I totally could've been paranoid, but on a relatively large campus full of tens of thousands of students, my gut was telling me these constant daily meetings were not just a coincidence. I honestly felt unsafe just trying to leave my dorm and realized just how creepy he was acting towards me in different previous meetings.

I asked a few different people and they told me to just tell him straight up that I was not interested. Even when I told my mom about it one weekend while I was visiting, it took me bursting into tears and crying that I didn't feel safe for her to realize ""Oh, he's really following you... isn't he?"" And even after that, she just thought I was being a silly paranoid girl who was just scared of men.

Anyways, when he had asked if I could hangout again for the second or third time, I messaged him apologizing that I hadn't made it clear sooner but I was not looking for a relationship (which really, I am not) and that it felt like he had been coming on to me and it was honestly making me uncomfortable. I'll give him credit in that he was very polite in his response, replying with ""Okay, thank you for letting me know. I'm sorry for making you uncomfortable and I understand."" I haven't seen him since aside from when in class, which I will sit on the opposite side of the lecture room.

When I had told my mother this, the first thing she had said is, ""I feel bad for him."" And asked if I felt bad and that I probably broke his heart. I will say in that moment... I sort of came to the conclusion that my mother would always love the image of me more than she loves me. In that moment, I had never come to despise and, regrettably, hate her more. While I definitely could've handled the situation better, I got no teaching, comfort, or anything from her other than her blowing off my concerns and telling me I was being unreasonable. And that hurt me, a lot. I thought my mom was supposed to help me when this stuff happened, not make me feel alone and like I'm the villain. What confused me even more was when we would talk to other families and friends, she would say the story as if she had took my side and this boy was a creep, which I notice she does with a lot of stuff she usually blows me off on. I will say I do not regret listening to my gut, but there still was a part of me that made me go to my friends to ask if I should feel bad, only for them to respond that he had made me feel uncomfortable and unsafe in the first place, and he had no excuse to act the way he did, even if he really was infatuated with me.

I also relayed on to them what my mother said and how I don't feel like I see her as a mother anymore, just someone I can only enjoy when out in public because she doesn't show her true colors and they also advised me on possibly going low contact with her, and even moving states (I am considering moving states after college to live near one of these friends as she has been my rock. I am visiting her this summer first just to see how it is there and to finally be able to hang out with her in person). The idea actually does seem really nice because I can say I'm not exactly happy in the state I live in currently and I do want to travel around the world in the future. I also do feel like I need some good distance from my parents to figure out who I am as my own person and to create a life for myself. I had stated my parents are good people, just not good parents, but have been told by others, especially with my mom, that they are narcissists who have used me as a social asset. I honestly believe that they have their good moments and I shouldn't cut them out of my life entirely because I still do love them and they have done a lot for me, but I also just can't stand being take so not seriously all the time and being looked down on.

So... would I be a horrible daughter if I go low contact and move to another state, even after everything they have done for me?",1,1729320777.0,Advice,0,1.0,False
1g7370l,https://www.reddit.com/r/MarkMyWords/comments/1g7370l/mmw_someone_is_going_to_steal_or_destroy_a/,MMW: Someone is going to steal or destroy a significant number of ballots in a swing state.,"I believe at some point between now and Election Day, some person or group of people are going to conspire to or attempt to steal or destroy ballots in one of the several swing states this election. Most likely a radicalized supporter of or nefarious actor for Donald Trump. I don’t have a guess as to the level of coordination with his campaign, if any, or exactly what could be fraudulently mishandled—the actual paper ballots, the actual voting machines, their digital vote tabulations, the voting software, etc.—but my guess is someone will attempt and possibly succeed in removing from the tabulation a portion of votes cast in some important county of a swing state. Perhaps one that just so happens to have a big urban center.

I also believe, though, that this fraudulent act will be discovered before it’s too late to reverse, or even before the plan is executed.

My reasons for thinking all this are as follows:

* A significant portion of Donald Trump’s supporters have been radicalized against their government—particularly its judicial and electoral systems. Many people have been made to believe that the elections themselves are fraudulent, that the officials and machinery conducting it are corrupt and possibly changing votes, and that the judges and prosecutors who monitor these elections are just as corrupt or complicit. If you believed this was happening in your country, why would you not want to stop it, or help your guy out? “They’re doing it, why can’t we?”

* This seed of distrust has grown, first sprouting a violent assault on our nation’s Capitol in the last election. Why should we not expect more outgrowths of obstruction and violence? 

* Sure, the bad actors and true believers are not running the executive branch this time around, stymied in their ability to aid or direct radicalized supporters or other bad actors like the Proud Boys, but for one, that doesn’t mean they are not running local election offices and procedures. They are. And two, that has not stopped Trump and his allies from trying to foment this sort of bad behavior all the time, right now, as you read this.

* As well, a voting machine is an easy target. It’s less well protected than the Capitol, it’s closer to home than the Capitol, it’s a less obvious target than the Capitol, and it’s lower stakes to break into a county election office on a quiet Sunday night than the Capitol. Any random person could do it if they really wanted to. And Donald Trump’s election lies have made many people want to.

* Any number of the usual rejects, hangers-on, sycophants, and true believers in Donald Trump’s orbit have a number of reasons to think it’s their ticket to power if they can conspire with any number of others to try and tamper with this election, as they did last time. Think Roger Stone, Steve Bannon, Sydney Powell, and many others.

* In fact, prosecutors have shown in federal court that Trump’s team **did** conspire with a group of people in the last election to gain physical access to voting systems in Coffee County, Georgia. They are now being tried for it.

Many more **will** fall on this sword for Donald Trump—who, when, and how are the only questions.
",19,1729320776.0,MarkMyWords,9,0.77,False
1g736ua,https://v.redd.it/wc23euteunvd1,Why is my shot pulling like this? [Bambino Plus],Just recently bought a bottomless portafilter and an IMS basket for my Bambino Plus. Need help dialing this in as I normally use the dual wall double shot basket with the OEM breville portafilter. I used a WDT and normcore tamper. Using dark roast coffee roasted ~ 1 month ago. Dosed at 17gr pulling about 42 gr in 30 seconds when using OEM dual wall basket. Dosed at 19gr when using bottomless. What is going on???,1,1729320754.0,espresso,29,0.6,False
1g736ne,https://www.reddit.com/r/chicory/comments/1g736ne/what_is_chicory_used_for/,What is chicory used for?,"Chicory is primarily used for its roots, which are roasted and often added to coffee or used as a caffeine-free coffee substitute. The roasted chicory root adds a rich, slightly nutty flavor to beverages, making it popular in coffee blends. Besides beverages, chicory is also used in food products and health supplements due to its high content of inulin, a prebiotic fiber that supports gut health and aids digestion.

https://preview.redd.it/a3gwwnqdunvd1.png?width=388&format=png&auto=webp&s=5c97851adfd3a20b723d65e0e64f9b75e4e99650

Chicory is also used in baking, flavoring, and even herbal medicine for its digestive benefits and potential to regulate blood sugar levels. Additionally, it serves as a food ingredient in various industrial applications.

At Vashila Industries, we specialize in a range of [chicory products](https://vashilaindustries.com/chicory/), including Dry Chicory, Roasted Chicory, Instant Chicory, and [Liquid Chicory.](https://vashilaindustries.com/liquid-chicory/) Our products are widely used in the food and beverage industry, and we also offer Dehydrated Garlic, Onion, and other vegetables. Learn more at [Vashila Industries](https://vashilaindustries.com/)

",0,1729320731.0,chicory,0,0.33,False
1g736ev,https://www.reddit.com/r/Crushes/comments/1g736ev/do_i_need_to_let_go_of_this_lingering_4_year_long/,Do I need to let go of this lingering 4 year long crush?,"I [F19] have known him [M20] since middle school and I don’t know whether or not to move on.

I have known someone since middle school and have had off and on interactions with him. A couple years back during quarantine we used to message back and forth everyday for a good couple months until it fizzled out and he ended up getting a girlfriend. I distanced myself heavily and it made me think well maybe he was just being nice as a friend. Flash forward to now, I am in college and have a job and extremely independent due to the fact that I am insanely pessimistic about relationships because of experiences I have had and well, the lack of any dating. I hadn’t truly had a connection to anyone besides this guy because of how genuine it felt with him. Recently I saw him back on the internet after being off of it for a while posting about a different state he has been working in, 
I decided to reply and we got back to chatting again. He is now back in our state but still working out of town in the mountains. We have now been messaging back and forth everyday it seems like for a month. I had asked him to get coffee but he canceled due to his high demand job. I don’t know when this project is over but I am starting to think maybe I should just stop engaging. He expresses his interest in what I’m doing and says he wants to hang out but it’s just hard for me to believe because I just feel like it won’t happen. I wish it could be more of an in person deal but I know that’s not really an option for him right now. Sometimes he won’t message back for a while or he will have shorter messages so I get a little paranoid that he’s trying to stop the communication but he keeps it going. What should I do? Should I move on and just try to forget it even though I already feel pretty attached? I really like him and honestly always have. It’s just I haven’t seen him in person in a good while. I always distilled it down to being a stupid crush that should have died out in middle school but who knows. 
Even his texts ending with the ‘:)’ or the comments saying ‘you’d be fun to shop with’ make my stomach feel like I’m going to barf.",1,1729320704.0,Crushes,0,1.0,False
1g7367w,https://www.reddit.com/r/springfieldMO/comments/1g7367w/shut_down_buildings_glenstonekearnysunshine_street/,Shut down buildings glenstone/kearny/sunshine street,"
As I drive through Springfield, I notice numerous abandoned buildings with potential. Instead of tearing them down, let's renovate and revive them! What businesses would thrive in these existing structures? Consider independent coffee shops, craft breweries, artisan food halls, vintage shops, co-working spaces, entertainment venues, wellness centers, or specialty restaurants.Then again we already have a lot of these. 

Share your ideas! What businesses would you love to see revive abandoned buildings? Are there specific neighborhoods or areas you'd like to focus on? I don’t have the money to start a business or anything like that but I’m just wanting to know what others think.

Post your thoughts!",0,1729320683.0,springfieldMO,4,0.5,False
1g735s7,https://www.reddit.com/r/Crushes/comments/1g735s7/is_she_interested_or_not/,Is she interested or not,"She works in the same company as me but in a different department. She had just started working 2 months ago. I had just started to get to know her 3 weeks ago. I asked her out for lunch 3x and 1x for coffee and she said yes. But I tried to ask her out for a movie 1x. She said yes, but she said she was busy the day before the movie. (She’s 31 F and Iam 23 M). Does that mean she’s not interested ?",1,1729320626.0,Crushes,1,1.0,False
1g7351q,https://www.reddit.com/r/zoloft/comments/1g7351q/just_started_my_first_prescription_of_anything/,Just started my first prescription of anything ever.,"Because I'm a man, didn't go to the doctor for a very long time until my housemate caught me in a complete mental breakdown on the floor of my room after weeks having not gone to work. She convinced me to see a doctor and ask for psych referrals and anti deps. I'm on 50mg of Zoloft a day, currently on day 2 and I gotta say, loving the placebo. I know there's hardly any chance it's already had an effect, but I'm excited to give this a try and see if prescriptions are something I've been missing all these years and I guess the anticipation has already put me in a better state of mind. 

I also got a blood test that checked for basically everything, since my depression and anxiety come from a possible binge eating disorder, (unconfirmed, seeing a psych soon) and my new doctor thought it best since I had no medical history to get some general details overall. 

The results made me really happy and I've been telling everyone about them. It's not perfect, but it's way better than I expected. I'm morbidly obese (23M) and had just assumed I'm prediabetic, or basically on the verge of having developed Type 2, but I'm only just barely over the comfortable insulin max, it's still something I need to work on and aim to lower, but my doctor said she wouldn't even call me close to pre diabetic. I guess rigorous sports as a kid has paid off.

There's other stuff in my blood I can fix, like urate, HDL and vitamin D, but my ego has jumped considerably. Now I know I pitched this as a rant, but I do have a question for anyone who has read this far.

I never drink coffee, like ever, purely cuz I don't love the taste, but my doctor said that maybe drinking coffee could help my liver, so once yesterday morning and this morning, I had a coffee after my Zoloft.

1. Is this a bad idea to mix caffeine and anti deps? Especially since I've never had either over a period of time?
2. Is the good mood I'm in cuz of placebo of the Zoloft or the coffee? ",2,1729320534.0,zoloft,2,1.0,False
