id,url,title,text,score,created_utc,subreddit,num_comments,upvote_ratio,over_18
1mj5wgl,https://www.reddit.com/r/MakeNewFriendsHere/comments/1mj5wgl/36m_only_person_in_my_office_this_morning_in/,36M Only person in my office this morning in Seattle,"One co worker is off and the other called out sick. A bit slow today and I was hoping to see if anyone else in the Seattle area, or anywhere else would be open to chatting or could use some company. Open to any age or Male/Female, happy to listen or whatever, im stuck here all day lol

Mid to late 30's white guy office worker, slightly nerdy but also love sports and stand up, gaming, manga, coffee, and whatever. So happy to chat about anything",1,1754489866.0,MakeNewFriendsHere,1,1.0,False
