id,url,title,text,score,created_utc,subreddit,num_comments,upvote_ratio,over_18
1n9ag52,https://www.reddit.com/r/Findabook/comments/1n9ag52/richmal_crompton/,Richmal Crompton,"William short story that is set in London,  he is unhappy away from his friends and his stomping ground. He is invited to a party full of stuffy kids as himself but embroiled himself with a street gang, they fight, he manages to get a job selling hot drinks on the streets (as you do!) Whereupon his family who have been searching for him realise he is serving them coffee. 
I have a set of the William books but I can't find this particular story and its driving me mad! Can anyone please help?
",1,1757090969.0,Findabook,2,1.0,False
1n9afg9,https://www.reddit.com/r/kdramas/comments/1n9afg9/kdramas_where_the_male_lead_is_lowkey_a_jerk_and/,Kdramas where the male lead is lowkey a jerk and..,"Likes someone else but then falls for the female lead. Like Coffee Prince and The Innocent Man. They are two of my favorite dramas and I want to watch something that has similar tropes. 

Like in Coffee Prince, the ML wasn't the best to the FL but he came around. And in Innocent Man he was just using her for revenge. 

So do y'all know any dramas with the following tropes: 
• hate/dislike to love
• yearning 
• rich ml or upper class

I don't mind old dramas as you can see I prefer those lol ",5,1757090923.0,kdramas,14,1.0,False
1n9adld,https://www.reddit.com/r/missoula/comments/1n9adld/to_the_allstate_agent_driving/,To the Allstate agent driving,"To the Allstate agent in the white SUV on Spruce Street this morning (09/05/25)... Please learn how to drive especially if you are going to promote auto insurance. Not only did you cut someone off, you decided single handedly that the car lane wasn't big enough so you took up half of the bike lane too before turning off without a turn signal I might add into Black Coffee Roasters. Please do better!!! ",1,1757090801.0,missoula,0,0.52,False
1n9acuf,https://www.reddit.com/r/cavite/comments/1n9acuf/saan_maganda_mag_photography_sa_amadeo/,Saan maganda mag photography sa amadeo?,Saan kaya maganda mag street photography or any documentary style sa amadeo. Example mga coffee farm tapos how they grind the coffee the old fashion way. Something in those lines. ,1,1757090753.0,cavite,0,1.0,False
1n9achh,https://www.reddit.com/r/Wexford/comments/1n9achh/moved_to_wexford_few_years_ago_and_still_finding/,"Moved to Wexford few years ago and still finding it hard to find my own groove of friends, is it just me or anyone else on the same boat?","Hi, im in my 30s - no kids. We moved to Wexford few years ago, I’ve always lived in the big cities so it was a huge change but a happy one. Picked up lots of hobbies and met nice people and always on the look out for events but still can’t help but feel its so different. 

I know theres lots of factors at play, I find adult friendships when you’re not local is different, especially I find that with female friendships. Having friends online/other time zones is just not the same as someone closer and who’s up for a coffee and chats! And just down for fun things really. 

I do see different threads on this but not sure if folks are meeting up etc - would love to know your experiences. ",12,1757090731.0,Wexford,7,1.0,False
1n9aca5,https://www.reddit.com/r/SFWr4rIndia/comments/1n9aca5/25_m4f_mumbaiindia_always_admired_what_radha/,25 [M4F] Mumbai/India - Always admired what Radha Meant to Krishna - wish i could find 1% of it.,"Hey there! 👋

I’m a 25-year-old guy who’s genuinely ready to find my person. I’ve talked with some cool people, but that next-level, **""can-read-each-other's-minds-over-chai""** kind of connection? Still waiting for that kyuki saath to kaafi chorr dete hai, koi nibhane vaala chaiye \^\_\^  


*Also - read the post, it actually might be worth it*

# Alright, about me:

>**I’m naturally the calm, quiet, and positive type**— In my past life (aka a few years ago), I was super athletic and outgoing. I’ve been a bit disconnected for the past couple of years. I haven't worked on myself for a while — but I'm kind of getting the hang of how important it is rediscovering myself and finally understanding that ""working on yourself"" - it’s actually pretty cool.

>**When i'm tired or exhausted** \- My perfect way to unwind is with a hot shower followed by getting lost in a good series, podcast, or book.

>I also really cherish having breakfast everyday (well of course there is a story behind it haha).

>On the other hand, my family means the world to me — they're my bedrock and my biggest cheerleaders—  **I'm looking for someone jo same values share karta ho.**

# The Big Dream 🌄

>To buy a big peaceful home near the mountains for my family and stay there — **a home that is filled with love and laughter.** But more than the house itself, I want to find that one person **jiske saath sapne dekhne me darr na lage, chahe vo sapne poore ho ya nahi.**

>For me, a that life is embeded in small moments:

>Jese Cooking Together (even if it’s just Maggi ), Planning a super cozy night in… or throwing all plans out the window for a random movie, or even getting a random hobby taaki time spend kar paaye

# My Idea of a Perfect Date Night 🚗🌙

>Night drive pe jaana → phir fast food lena →Then, we park somewhere quiet, eat it over the hood of the car under the moonlight → A long, hand-in-hand walk on the beach, sipping coffee and talking about everything and nothing.

# What I Value

>I know physical intimacy is important, but I’m a firm believer that emotional intimacy plays a very big part as well.

>I want us to be each other’s safe place—where we can be our 100%, unfiltered, weird selves, and **where it truly doesn’t matter what anyone else thinks about us, it's what we think about each other.**

>I'm the kind of person who will always listens, whether you're venting about a tough day or just telling me what amazing thing happened for you today.

# So, who are you? 👀

>What I’m looking for is very simple, someone I can **grow with, learn from, and explore this weird, wonderful life alongside.**

>The qualities I adore are: **Kindness, honesty, loyalty, empathy, a high EQ, solid values, and a commitment to working on yourself** (because I’ll be right there working on me, too!).

>*A small but meaningful thing:* Using Aap / Tum instead of Tu matters to me—it feels respectful and very sweet.

>*What i dislike*: Smoking, disrespecting, and abusing.

>I want us to be a couple jo ek dusre ko support aur appreciate kare, like picking up a random hobby or doing random stuff out of the blue or even just cheering each other on from the sidelines.

I know that no relationship is perfect, but I believe that thodasa **honesty aur efforts daalke bohot saari chize solve ho jaati hai.** 

**So, if this resonates with you...**

**I would absolutely love to hear from you! Tell me: What’s a quality you can’t live without in a person? Or just send a small intro about yourself**

`PS: if you just want to chat or drop by and say hi, I’m open to that too—I promise I don’t bite! (Unless you have the last piece of pizza. )`",2,1757090719.0,SFWr4rIndia,0,0.75,False
1n9ac9l,https://i.redd.it/4i6lictqkdnf1.jpeg,Clover Restaurant Current SaaS Plans and what they include.,With the recent changes happening with several plans over the last few months I just wanted to share what each plan has now included in it. ,2,1757090718.0,CloverPOS,0,1.0,False
1n9aa4f,https://www.reddit.com/r/relationship_advice/comments/1n9aa4f/my_32f_boyfriend_35m_lied_to_me_about_having_hsv2/,My (32F) boyfriend (35M) lied to me about having HSV2; how do I handle this??,"
I love my boyfriend more than anything. 

He and I met a little over 5 months ago and it’s been fireworks ever since. 

I’m a single mom to a toddler and I was living with my parents since I didn’t want to put my son into daycare while I worked.

 [How I became a single mom is a bit of an extenuating circumstance; my ex fiancé (who is the father of my son) has PTSD from being deployed to Afghanistan twice, and after self-medicating (behind my back) while we were together, he lost his mind and has been in and out of psyche wards since. This is likely why my parents have been so supportive and helpful throughout my pregnancy and my child’s life.]

I didn’t have a car, since I wasn’t working except for here and there (I sell on eBay, Facebook marketplace, etc.), and my boyfriend has several vehicles, one of which he has generously allowed me to use 24/7, without restriction. 

He’s also basically moved me and my toddler into his house. 

He works a lot, 6 days a week, but we get to see each other on the evenings. 

He also gave me his credit card and he pays for whatever I want/need. He even told me on my birthday to “pick something nice out for yourself, but try to keep it under $800.” 
Which was just insanely generous. 

I’ve never experienced a relationship like this. 

I do my very best to do whatever I can to make his life easier. When he comes home at lunch to see me, I have his lunch already made for him. I start his coffee in the morning, I keep his laundry and his house clean. I really do my best to make sure he doesn’t stress. On top of that, he’s a wonderfully kind man who is a gentleman in every way imaginable. I just love him so much. 

On to the bad part:

When we first met, I let him know I was recently tested and, while I have HSV1 (the cold sore herpes) I don’t have anything else. I asked him about his ‘status’ and he told me he hasn’t been tested recently but he just got out of a long, messy marriage/relationship about a year before and hasn’t dated, so I asked him if he’d be willing to get tested again, and he paid for it but never went, however he assured me he didn’t have anything. 

Cut to two nights ago, which is about 5 months later, and he takes a deep breath and tells me he has HSV2, and that the guilt was eating him up inside but he was worried that if he told me in the beginning, I’d reject him (he’s right, I would have). 

He said he had to tell me now because he is having a small outbreak (literally looks like a tiny ant bite) and he already rejected me (sexually) the night before and figured I would feel self-conscious if he didn’t have sex with me again that night, and so he told me. 

Which means he’d lied to me about it throughout our entire relationship and, while he didn’t have outbreaks for years until two nights ago, there’s a chance he could’ve passed it onto me, without even giving me the option to accept the risk or not. 

I gave a lot of backstory because it’s important those helping me with this understand this is a very happy relationship. 

I have an appointment scheduled for Monday to get tested. 

The question I have is: 

If I test positive, is it fair that I told him he has to marry me? Considering he gave me a very stigmatizing disease that could make me updatable in the future and didn’t give me the option on whether I wanted to accept the risk or not? 

And if I test negative, is it possible to stay with someone who has HSV2 without getting it yourself? 

How do I avoid this? 

Am I stupid for not even considering leaving him? 

He teared up while holding me after he told me and he’s been so sorry since. I know it’s genuine. ",3,1757090580.0,relationship_advice,14,0.72,False
1n9a905,https://www.reddit.com/r/iecvisa/comments/1n9a905/finding_a_job_in_vancouver_experience_5_years_in/,Finding a job in Vancouver (experience: 5+ years in Social Media Management in UK Senior roles),"What is the job industry in Canada/US/Vancouver at the moment? 

I would prefer to work freelance to give me the flexibility of exploring while I'm on IEC but not sure what the landscape is like in Vancouver for freelancers - if there are any helpful platforms to sign up to find clients etc that would be helpful!

Alternatively, I'm also open to applying for full time roles once I arrive. I am kinda taking everything step by step as I'm entering Vanvoucer recently unemployed as I prepare for my departure. 

ADDITIONALLY, I'm also happy to work in coffee shops... haha I would love to get any ounce of guidance from a job search pov! thanks :)  ",1,1757090506.0,iecvisa,3,1.0,False
1n9a8r4,https://i.redd.it/0wnccuh5kdnf1.jpeg,More energy please,,112,1757090492.0,memes,7,0.98,False
1n9a831,https://www.reddit.com/r/remotework/comments/1n9a831/whats_the_hardest_part_of_making_remote_work_feel/,What’s the hardest part of making remote work feel like working together?,"We talk to a lot of distributed teams, and one theme that keeps coming up is that the biggest challenge is presence.

* Slack and email are great for async, but they don’t capture the quick check-ins you’d have in an office.
* Video calls work for scheduled meetings, but they’re not designed for spontaneous conversations.
* Even with good project management tools, people often say that things slip through the cracks.

At Kumospace, we’ve been thinking a lot about how to bridge that gap and how to give teams a sense of being together without piling on more meetings or micromanagement. Some teams lean on rituals (like daily standups or virtual coffee breaks), others on tools that simulate presence in lighter ways.

How do you approach it?

* What’s worked best for helping your team feel present and connected while staying remote?
* Have you found any rituals, habits, or tools that recreate the “watercooler” effect?
* Do you think feeling present is actually critical for productivity, or more of a “nice-to-have”?",3,1757090447.0,remotework,0,1.0,False
1n9a7r5,https://www.reddit.com/r/krakow/comments/1n9a7r5/best_shopscafes_for_polishstyle_cheesecake/,Best Shops/Cafes for Polish-style Cheesecake,"Hi, I'm staying in Krakow for a few days on holiday and have come across a few small bakeries around the city centre. I remember from my child hood having Polish style cheesecake (one of the best cheesecakes you can get) which is slightly more dense in consistency and usually packed with a fruit compote or jellied fruit preserve.

Can anyone recommend a bakery within or close to the Old Town to pick some up (preferably with a good cup of coffee)?

Thanks",2,1757090428.0,krakow,0,1.0,False
1n9a7pm,https://www.reddit.com/r/chubbytravel/comments/1n9a7pm/review_white_elephant_nantucket/,REVIEW: White Elephant Nantucket,"[Lawn in front of the hotel's main restaurant, Brandt Point Grill. ](https://preview.redd.it/pmolpgapjdnf1.jpg?width=3024&format=pjpg&auto=webp&s=9ab2330d61c89995532a6aef6d75d7690ebcffce)

**Where we went:** [White Elephant Nantucket](https://www.whiteelephantnantucket.com)

**Room type:** One-bedroom residence

**When we went:** August 2025

**Who went:** Family of three incl. 4 year old. 

**TL;DR – 8/10. Exceeded expectations.**

Family friendly, unmatched convenient location, reliable and full service, luxury enough, and very convenient for a quintessential Nantucket experience when juggling little ones.  

**PROPERTY: 8/10**

* The resort overall was in great condition and well maintained. Lots of well-manicured green lawns for kids to run around but also a nice modestly luxurious quality for the adults. 
* Property’s location - very short 5-minute walking distance to the children’s playground and the connected children’s beach, and town’s great shops & restaurants. Bike and car rental shop was an easy 5-minute walk away as well. And we were able to stroller walk to the larger Jetties Beach (15-minute walk) and also take the complimentary hotel shuttle back to the hotel. 
* The property is spread across a few different spots within a few street blocks of each other. We stayed at the Residences location because the pool was there. 
* Great pool - Lots of complimentary pool toys, lightly heated (great for the cooler days), helpful and attentive staff, and convenient food/drink to order kiosk, easy to access and large bathrooms for the kiddos. From 9 a.m. - 10 a.m. is adult only before it then opens up for everyone else.
* Fun facts: Little rabbits can be found hopping around the property. Our kiddo had fun spotting them. 
* Lots of complimentary adult bicycles available. We rented a bike with a kid seat from [Cooks Cycles](https://cookscyclesnantucket.com) literally around the corner from the resort. 

**SERVICE: 7/10**

* All pre-arrival requests were met including seamlessly coordinating the arrival of a toddler bed and scooter rental from Nantucket Baby Rentals, a local [baby gear rental company](http://nantucketbabyrentals.com). Unrelated to the resort, but the toddler bed - while in good condition - had a mattress that was noticeably uncomfortable for our 4-year-old. We ended up placing laying a blanket on top of the mattress and then the sheet which helped. That said, the rental company was great and very responsive. 
* Staff from check-in to housekeeping to the pool and restaurant were generally friendly, responsive, and attentive. 
* Complimentary shuttle and house cars were readily available. 
* Service wasn’t necessarily personalized or proactive in a way where we felt a little extra love, but that wasn’t a big deal. I did appreciate that when we asked about directions to the beach, they brought out some beach sand toys for us. 

**ROOMS: 8/10**

* We booked the “one-bedroom residence” - located essentially in a standalone house. Felt very private and a good balance of the comforts of home plus benefits of a full-service hotel. 
* Large living room with a small kitchen, large dining table (seats 8), fully separated bedroom with ensuite full bathroom. Half bath accessed via the living room. There is a washer and dryer which was handy, but note that it’s located in a closet in the bedroom so running it may disrupt your kiddo’s sleep if they’re trying to sleep in the bedroom.
* Spacious living room and bedroom. Half-bathroom attached to the living room was convenient. 
* One small con is that the suite is located up one flight of stairs. But we were able to leave our stroller in the main entryway. 
* Note, the bedroom’s window curtains are not fully blackout. This wasn’t an issue for us, but just noting it for folks with babies who sleep better in blackout. 

**FOOD: 7/10**

* Complimentary coffee, tea, and a few selections of pastries in the morning (kiddo loved their marble bread); cookies (delicious!) in the early afternoon, and then cheese and port in the late afternoon. I do wish they had an alternative such as wine instead of just port each day. 
* Brandt Point Grill: Main resort restaurant but it’s at their “Harborside Hotel” location which was just a 5-minute walk from our ""Residences"" location where we stayed. Had breakfast and dinner here a couple of times. Friendly for families. Food wasn’t standout but not bad. Huge lawn in front that was good for kids to run around and burn off energy while waiting for their meal. 
* Poolside food: We mainly ordered off the kids’ menu for the kiddo. Seemed solid. We picked up our lunch from the town area nearby. 

",5,1757090426.0,chubbytravel,0,1.0,False
1n9a7lq,https://www.reddit.com/r/mormon/comments/1n9a7lq/my_lds_friend_loved_hot_chocolate/,My LDS friend loved Hot chocolate,"One of my LDS friends loved hot chocolate, and chocolate in general, because that was a permitted form of caffeine. She used it like coffee. Sometimes making a non-sweet cup in place of coffee. The status of chocolate is kind of strange. 

The status of coca leaves seems like that would be difficult for LDS to come to grips with.  In theory, a tea made from the leaves should be permitted, as its not 'tea' as people understand tea, like black tea, or green tea etc.    If its not concentrated, its not quite the same as the drug cocaine, as far as I know. I remember watching a documentary, and it showed Nuns drinking 'tea' made from coca lives. Apparently its like drinking a cup of green tea, in terms of stimulation. 

I am thinking about this morning because I made some decaf coffee using a keurig maker.  I think something is wrong with the machine, as it melted or crumpled the pod at the very least.  I know some people have raised concerns about making coffee with plastics. Its been approved, and its claimed it is not a problem. But I didn't really like seeing what looked like a partly melted pod. I didn't drink it.  

So, I am switching to tea, with attention to what the bag is made from. Some have suggested to keep with loose leaf tea for the best cup of tea.  I am also going to get a microwaveable, non toxic mug.  

Well, maybe LDS are incidentally protected from things like this. Although, LDS could still have problems with Hot chocolate, I suppose, depending on how its made. 

LDS can make much about coffee, tea, but then reach for coke or pepsi. Things depleted of nutrients, antioxidants. I was going to say also minerals, except they do have phosphorus, but most people have excess phosphorus. 

My friend also had a horrible, crappy diet, I must say. Its completely possible to adhere to the few Mormon dietary restrictions, and be supremely unhealthy. Perhaps even worse, as coffee, and tea are known to have a lot of antioxidants, which is usually low in most peoples diets in the USA. ",0,1757090419.0,mormon,7,0.33,False
1n9a791,https://v.redd.it/wd8zsn4vjdnf1,Is this a good extraction ?,"Using dedica ec685 
Bottom less portafilter 
Fresh coffee beans 
Grinder : comandante c40 (8clicks)
Tamp and Distributor
This is the result any further advice ? :)",0,1757090397.0,espresso,7,0.5,False
1n9a6pi,https://www.reddit.com/r/exjw/comments/1n9a6pi/are_jws_more_cultish_than_other_cultish_christian/,Are JW’s more cultish than other cultish Christian denominations?,"Years ago I used to think that other religions were more strict, for example I thought “wow Pentecostals are fanatics”, or JW’s can drink coffee and alcohol and Mormons can’t. But sometime ago I realized that although there are some restrictions not found in the witnesses, the structure of the Borg is more authoritarian than some religions I thought were cults. Sometime ago a classmate invited to me a mountain hiking group, and later I found many of them were from a Pentecostal church, a few were inactive but it wasn’t like a big deal for them if not everyone followed the rules of the church. I also met a gay guy who is an inactive mormon, he studies medicine in a city away from home, and no problem, he came up to his parents and the bishop also called him for not attending church so he explained the reasons why he wouldn’t attend. When I told him I was from JW he said to me “they are so extremist”. 
I asked many AI platforms to rate authoritarianism in JW’s org and all of them give above me 8/10, almost like Scientology, but higher than the average American sects. What do you guys think? I feel like the biggest problem in JW’s is their unquestionable hierarchy and shunning practices.",9,1757090363.0,exjw,4,0.8,False
1n9a6ml,https://www.reddit.com/r/diabetes_t1/comments/1n9a6ml/anyone_have_this/,Anyone Have This?,"My a1c is not too bad at 6.5, but often the blood sugar goes out of control and will stay high for many hours sometimes 6 hours in the 190s-200s+. I notice also that often for the same meals with the same dose at the same time, it could either go really well (stable, good levels) or poorly and rise later. Obviously, sleep and stress are other factors at play.. but still. 

I say this because over the past year, I have this throbbing pain in my upper sides, closer to the rib areas, that over the past few months is just starting to flare up more and feel worse. And I generally just feel like crap a lot of the time.  

After abusing myself stress wise and with poor sleep and diabetic timing over the 1.5 years (even despite decent a1c's throughout this time), I finally have started to change things for the better in the last month, with better sleep and dose timing, that is more consistent. Things are weird, some days, my levels are really, really good, never better, but other days, they are wild and stay higher for quite a while. 

For the last month, I've been supplementing with Vit D3 and Magnesium Citrate as I am deficient in D, and I've always felt bad symptoms with supplements for whatever reason, so I am wondering if this could be the culprit. Or maybe my morning coffee. But also my anxiety-brain always thinks the worst in that it could be something else, like GI related. My recent kidney and liver tests from my endo came back normal, but my bilirubin is always consistently on the high end, 1.2+ (latest was 1.6). 

Does anyone have this kind of pain / had it before, and any ideas as to what this could be? ",1,1757090359.0,diabetes_t1,0,1.0,False
