id,url,title,text,score,created_utc,subreddit,num_comments,upvote_ratio,over_18
1gp8zw3,https://www.reddit.com/r/MakeNewFriendsHere/comments/1gp8zw3/34f_for_your_new_nerdy_best_friend_inquire_within/,34F 🇺🇸 For your new nerdy best friend inquire within! 👽 ,"I'm rather nerdy. I spend most of my days at home hanging out with the cats, one of whom loves to play fetch. I've loved art ever since I was very young. I have big ambitions to have my own graphic design gig some day, but right now I don't currently work.

I love video games. I got a lot to play on. PS5, Xbox One, Switch, Meta Quest 2, and my iPad. So, like, pretty much everything but PC 😅 I'm a achievements/trophy hunter. I also collect PS1 & 2 games to play on my PlayStation 2. In recent years I've been very casual with my gaming, playing a lot of platformers and survival/crafting games. I'll play a bit of everthing, though, except for, like, sports games.

I love tabletop games. Star Wars Legion, Warhammer 40K/AoS, Magic: The Gathering, Pokémon TCG, Digimon TCG, and Lorcana. I love to paint miniatures as well, but it's a bit of a struggle to actually get people to play with me. Never really gotten the chance to play an TTRPG, but would love to. I suffer from a bit of learning curve.

I love music. Dance Gavin Dance, Papa Roach, Twenty-One Pilots, A Day To Remember, stuff like that. Bit of an elder emo. I wish I could play an instrument, but I fear I may be tone deaf 🙃

I love Marvel. Spider-Man's probably my favorite.

I love Harry Potter. Pretty sure my house is Hufflepuff.

Huge fan of The Office. I've seen the whole series countless times.

I love horror movies and got into true crime on YouTube few years ago. My favorite horror movie is probably The Blair Witch Project, second to the 2003 Texas Chainsaw Massacre. I watched all the SAW movies last month to kick off spooky season, and right now I'm making my way through the Friday the 13th movies.

I love anime and manga. Demon Slayer is by far my favorite. I also really love Fullmetal Alchemist, Attack on Titan, Digimon, Dragon Ball, and Sword Art Online.

I'm doin' a Japanese and a Spanish course on Duolingo right now.

I love baking, coffee, and grilling. I don't have too much confidence in my cooking skills 😅 But I'm trying new recipes all the time. I'm rather adept at baking though, and I love smoked meats 🤤

🟢4 20 friendly because some seem confused🟢",1,1731374440.0,MakeNewFriendsHere,2,1.0,False
1gp8zav,https://www.reddit.com/r/FridayNightFunkin/comments/1gp8zav/anyone_up_to_remaking_ycr_old_aka_the_one_that/,Anyone up to remaking YCR Old aka the one that was Allegedly made when Mar had four hours of sleep and two cups of coffee?,I'm just askin if anyone will do it,1,1731374396.0,FridayNightFunkin,0,1.0,False
