id,url,title,text,score,created_utc,subreddit,num_comments,upvote_ratio,over_18
1i8bfxm,https://i.redd.it/3qu6x8nymsee1.jpeg,I made Hashbrown and Bacon Casserole and Rum Flavored Coffee [homemade],"Bacon Hashbrown Casserole 
1/2 package of bacon
3 potatoes shredded 
4 large eggs scrambled 
1 tbsp of Old Bay
Salt and Pepper to taste 

1. Pan fry bacon to your desired texture 
2. Remove bacon from pan and chop roughly 
3. Place shredded potatoes into pan over medium heat and stir with bacon drippings 
4. Pour eggs on top and spread around evenly, add salt and pepper to taste 
5. Place bacon pieces on top and sprinkle with old bay 
6. Cover and reduce to low heat for 10-15 minutes 


Rum Flavored Coffee

4 cups water 
5 tbsp coffee
1/4 tsp rum flavor

1. Place rum flavor in French press with coffee and add boiling water 
2. After 5-6 minutes plunge press down and serve.",3,1737659879.0,food,0,0.8,False
1i8bfwx,https://www.reddit.com/r/ADHD/comments/1i8bfwx/any_natural_tips_on_calming_myself_down/,Any natural tips on calming myself down?,"**Note: This is NOT a request for any medical or pharmaceutical advice, I already spoke to the pharmacist.**

So this morning I absentmindedly took twice the prescribed dose of my Concerta, and had a cup of coffee on top of it. You can imagine my panic.

I spoke to the pharmacist who reassured that the dose I took was still below the maximum amount, and explained that I might be feeling some mild high blood pressure symptoms and may have trouble falling asleep tonight.

So right now I have to consciously keep stopping myself from grinding my teeth, I’m in a very bad mood, and I can feel a headache brewing. 

If it has happened to you before, how did you manage your day? Do you have tips for a calming tea, a link to some relaxing video, or anything else? I tried to lie down and force myself to take a nap, but that obviously failed miserably and I couldn’t even keep my eyes closed.

Any help would be appreciated.",1,1737659878.0,ADHD,3,1.0,False
1i8bfqm,https://www.reddit.com/r/raypeat/comments/1i8bfqm/dry_and_itchy_scalp_since_starting_cynolus_and/,Dry and itchy scalp since starting cynolus and cynomel?,"Hey guys. Since starting thyroid I’ve been feeling the best I have in awhile but all the sudden my scalp is super itchy and dry all the time. There some scab parts too if I run my fingers through I can feel them, maybe it’s seb derm? My hair itself feels really dry and brittle and looks like it is getting thinner.

Anyway prior to starting thyroid this wasn’t an issue at all. Tracking my nutrient intake on chronometer there isn’t really anything sticking out. I thought it seemed like classical vitamin A deficiency but I eat liver and eggs and even started a retinyl palmitate supp but no improvements.

My digestion has been quite good lately so I’m not sure it’s caused by intestinal inflammation either. I eat lots of diary, fruits, potatoes, masa, gelatinous cuts of meat, eggs, rice, OJ, usually coffee and some well cooked greens as I crave them. I add about 40-60g of collagen to my coffee and smoothies each day. I eat oysters and liver every 7-10 days or so. Supplement wise I only take vitamin D and sometimes vitamin K if I’ve take aspirin that day. I’ve dropped the vit A after taking 50,000iu a day for a couple months and ruling out vitamin A as the culprit. 


Topically I’ve tried bloo, Nizoral and raw honey. Anybody have experience with this ? Or suggestions on what could cause it? 

Only theory I have right now is thiamine deficiency? But I’m not sure I fit symptoms of that just kindof landed in it from process of elimination. I’ve read thyroid can deplete thiamine? I get 200% or more of the RDA on thiamine according to Chronometer fwiw 
",1,1737659865.0,raypeat,5,1.0,False
1i8bfq3,https://i.redd.it/aj18c55xmsee1.jpeg,5 year old Pothos I've been watering with boiled potato water for several months.,"I do not have a green thumb lol, this was a bereavement gift after my grandma died. It became mine when my mom moved out. My mom/papa had a Pothos for years that refused to die lol. 

It's been repotted/soil changed maybe 3 times. I had it in a small tabletop planter, a hanging coffee can, then this hanging pot I made with a protein tub, shoestring, and an ice pick, plus panty hose at the bottom. I don't prune it very often unless necessary. I don't water it very often, either, until the soil gets dry, then I fully saturate and let the excess drain out. It's started looking/feeling so healthy since I started using water from my boiled potatoes- no salt or oil, obviously. ",1,1737659865.0,plants,0,1.0,False
1i8bfax,https://www.reddit.com/r/footballcliches/comments/1i8bfax/due_one/,Due One,"I was watching Chelsea v Durham in women’s league cup quarter final on WSL’s YouTube channel. The commentator stated that Durham’s Sarah Wilson last scored in the league cup 5 years ago, and was therefore ‘due one’. This is ludicrous. I usually have three cups of coffee before noon everyday. If I got to 11am without a coffee, you could strongly argue I was ‘due one’. If the last coffee I had was 5 years ago, it would be outrageous to suggest I was ‘due one’. How many minutes, games, weeks, months can elapse before you are absolutely not no ‘due one’???",6,1737659834.0,footballcliches,1,1.0,False
1i8benh,https://i.redd.it/7scs2ntnmsee1.jpeg,Soulful Coffee Preferences,,18,1737659785.0,StrangerThingsMemes,0,1.0,False
1i8be12,https://i.redd.it/l3fd63zjmsee1.jpeg,☕💡 Did You Know? The Buzz on Caffeine Content in Your Coffee Cup!,,1,1737659742.0,OnchainCoffeeCTO,0,1.0,False
1i8bc6d,https://www.reddit.com/r/coffeeindia/comments/1i8bc6d/suggestions_for_someone_in_hostel/,suggestions for someone in hostel,"hey,
so i’ve been wanting to get into the entire almost hobby of coffee, i enjoy the standard filter coffee and a nice cup of plain local black coffee but i’ve been wanting to branch out a little more but i don’t have a lot of fancy equipment or even a stove for that matter. i’m only armed with a microwave and an electric kettle.
i’m looking to try something new or different 
i’m open to any suggestions or discussion 
thanks guys <3",1,1737659612.0,coffeeindia,0,1.0,False
1i8bbz6,https://v.redd.it/skji5laxlsee1,Lying about pointless shit,On accident??? She knew damn well she would be pulling an all nighter... you don't make coffee especially caffeinated at 10pm if you're planning on sleeping and secondly bc she left all her work til the last minute... she always goes on about how long it takes her to edit videos so she knew damn well she would be up all night editing... I don't get why she lies about everything even the smallest of things??,19,1737659596.0,rhegan777snark,4,0.96,False
1i8bbf8,https://www.reddit.com/r/discordfriends/comments/1i8bbf8/24_year_old_irish_guy_looking_for_peeps_to_talk_to/,24 year old Irish guy looking for peeps to talk to !!,"






















































































































































































Salutations everyone !
How are we all ? 
We better be good !!

Here’s my discord : Wigwamlad


I’m here today on the look for friends!  (short term / long term) 
Here’s some interesting stuff about me !

Well I’m from Ireland and I’m in uni ! And I’m 24
I’m nerdy, heavily enjoy fantasy and grimdark settings, so massive LOTR, elder scrolls, GOT/HOTD and Warhammer fan.
I play on PC (total war, arma 3, Hoi4, stellaris and many more ) and ps5 (Elden ring, battlefield) 
Im also big into history, specifically military history!! 

I’m a pagan, and I believe in ghosts and the supernatural!
Have had a few Creepy encounters

My fav food is a toastie and I love coffee n tea! 

I hope to hear from someone soon and if you have read this far, no hey, hi or hellos, write an introduction!",1,1737659557.0,discordfriends,0,1.0,False
1i8bayz,https://www.reddit.com/r/MakeNewFriendsHere/comments/1i8bayz/hey_you_im_a_24m_from_ireland_on_the_hunt_for/,"HEY YOU, I’m a 24M from Ireland, on the hunt for weird and fun people! COME TALK!!","



















































































































































































































































































































































































































































































































































































































































































































































































































































































































































































































































































































































































































































 






















 









































































































































































































































































































































Salutations everyone !
How are we all ? 
We better be good !!

I’m here today on the look for friends!  (short term / long term) 
Here’s some interesting stuff about me !

Well I’m from Ireland and I’m in uni ! And I’m 24.
I’m nerdy, heavily enjoy fantasy and grimdark settings, so massive LOTR, elder scrolls, GOT/HOTD and Warhammer fan.
I play on PC (total war, arma 3, Hoi4, stellaris and many more ) and ps5 (Elden ring, battlefield) 


Im also big into history, specifically military history!! I’m a history student in fact , my areas of study are Roman/Greek, military, Irish and archaeology! 
I’m a pagan, Norse pagan 

My fav food is a toastie and I love coffee n tea! 

I hope to hear from someone soon and if you have read this far, no hey, hi or hellos, write an introduction!!",1,1737659523.0,MakeNewFriendsHere,1,1.0,False
1i8ba59,https://i.redd.it/9w0yt8yplsee1.jpeg,"Burbank coffee run on my day off, any one got any favorite valley coffee spots?","Ugly mug, Burbank",9,1737659464.0,SFVfood,6,1.0,False
1i8b9yw,https://i.redd.it/kuu3nlpolsee1.jpeg,WB Defense Deoxys 725782824303,,1,1737659452.0,PokemonGoRaids,1,1.0,False
1i8b9ms,https://www.reddit.com/r/indianapolis/comments/1i8b9ms/any_locallyroasted_coffee_beans_that_make_good/,Any locally-roasted coffee beans that make good cold brew?,I like Starbucks cold-brew but don't go very often.  I make mine at home with some beans I purchase online.  I tried Zing! by Tinker years ago and found it did not have that dark rich flavor that I enjoy.  Has anyone found a locally-roasted variety that comes reasonably close to the Starbuck Cold Brew flavor profile?,0,1737659429.0,indianapolis,0,0.5,False
1i8b9db,https://www.reddit.com/r/relationship_advice/comments/1i8b9db/i_26f_have_an_issue_with_a_man_i_just_met_32m/,I (26F) have an issue with a man i just met (32M),"I (26F) met a guy (32M) a week ago at an event, and I really liked him. He makes me laugh a lot, and we like the same things. He invited me to dinner two days later, on Friday, to go to a restaurant. He's very chivalrous, opens doors for me, arrives on time, pays the bill, and the conversation was so pleasant that we stayed together talking until 2 a.m. The next day, I decided to go to the movies and asked him to join me. He came to pick me up and paid for the tickets. He placed his hand on my thigh and asked for permission. He's really my type physically, and he makes me laugh a lot.
At the end of the movie, we kissed and stayed together until 3 a.m., talking and kissing. However, when he kisses me, I feel like he gets excited very quickly and often presses his body against mine.
I told him about a sexual assault I experienced in the past and explained that I'd like us to take our time because I get very stressed when things move too fast physically. He said he understood and thanked me for opening up to him.
The next day, he suggested we go out for coffee, and at the café, he kissed me three times. We talked a little less, and he told me that he had missed me a lot and would love to hug and kiss me.
Once we got into the car, he kissed me again and started doing what he had done before. He grabbed my butt, kissed me intensely, put his hands all over me, and I found it hard to set boundaries in the moment because I'm really attracted to him, but I have this deep feeling of fear in my body.
Sometimes he grabs the middle of my thigh, and I have to say ""no, I don't want to"" three times before he stops. Yesterday, I went to his place to watch a movie. We barely made it 10 minutes into the film before we started kissing, and once again, it all happened again.
He moved his body as if he was having sex with me but with clothes on, and afterward, I told him I was disappointed because l've brought this up three times, and I feel like he hasn't changed.
He apologized, said I was right, and promised to control himself, but he admitted he's struggling because I'm 100% his type, and he's been holding back sexually for a year to find the right person. He also told me that I'm partly responsible for the situation and that it's not just him.
I don't know what to do. I like him a lot, and he has many of the values I'm looking for in someone, but I don't like feeling like a sexual object under his control. Also, he wanted to invite me for coffee on Tuesday, but I told him I couldn’t because I had a lot to do at home and I was finishing work late. That evening, he called me to say that he had bought my favorite chocolate and that he would drop it off at my door along with a novel he recommended, and that I didn’t need to see him. But I still opened the door because I felt it would be impolite not to, and we ended up spending the evening together. I don’t know if it’s just me, but I feel like he doesn’t respect my boundaries. Keep in mind that all of this happened even though I met him for the first time last Wednesday.
Are my traumas speaking, or is what l'm feeling legitimate?",1,1737659409.0,relationship_advice,6,0.67,False
1i8b8n6,https://www.reddit.com/r/u_Brief_Atmosphere_959/comments/1i8b8n6/experiences_with_code_enforcement_in_goleta/,Experiences with code enforcement in Goleta,"I've been having an issue with ants since around November 2024. The heard has been moving through different parts of my home. I've tried different traps in hopes of the ants bringing the stuff back to the nest to kill all the ants without success. My property management refuses to provide professional treatment, stating it's a ""tenant issue."" A lawyer advised me to have code enforcement come out since I am trying to go about this properly. By the time code enforcement comes out, the heard has disappeared because I moved my Keurig since they were going in it for the water and I was tired of deep cleaning it for 30 minutes a day to make coffee. There are still small groups of ants around though, which is apparently not significant enough for code enforcement who barely looked around. Didn't go through the whole house, didn't look outside, said it's not their job to look under the house to see if there is an infestation, they only cared if there was an active line of ants and some kind of property damage. I was told to reduce what attracts the ants into my home. Not really sure how to have a waterless home, but okay. Code enforcement blamed the dog food, but I haven't seen any ants in the dog food, I've also had my dog for 12 years grazing on his food without this much of an ant issue. They also blamed the trash, again, no ants in the trash. If they're really looking for food, why haven't they gone for the food yet? Moral of the story is if you need help from code enforcement with regards to property management not helping with pest control, leave the water in the place the ants are actively going for so they can see the line of ants, otherwise, good luck!",1,1737659361.0,u_Brief_Atmosphere_959,0,1.0,False
1i8b8lt,https://www.reddit.com/r/daemonology/comments/1i8b8lt/guys_what_is_this/,Guys what is this???,"Hello people , I am creating a post after my friend's suggestion . So i have been feeling an entity for a long time i ignored it even there were some pretty big tellatale signs and ignored it as coincidences and wind blowing and other stuff but yesterday when i was getting myself some coffee something weird happened .My electric kettle(its a a jug type device which heats up liquids ,it has a light indicator which glows when its switched on) is plugged in the socket and the switch was turned off (its a type of switch which requires some pressure to turn it on and off .Its like one of those switches when its not used for a long time ) when i was heating up the milk it suddenly turned on and turned my head to see but i just got a glimpse of something black that faded into nothingness. For a long time i ignored signs like this not paying attention to these things but i just got that incident slapped on face and i cant deny it . I dont know if thats a demon or not but its definitely something you guys would know better ,so please help me out with my doubts . Thank you",1,1737659359.0,daemonology,0,1.0,False
1i8b7gz,https://www.reddit.com/r/Colognes/comments/1i8b7gz/current_collection_18_m_as_a_college_student_what/,Current collection [18 M] as a college student. What should I add to my collection?,"Hey everyone, I’m an 18-year-old college student looking to expand my fragrance collection. Right now, I have:

1. [Hawas for Him by Rasasi](https://www.amazon.com/dp/B01LDT51ZU?ref=nb_sb_ss_w_as-reorder_k0_1_20&amp=&crid=KFAN5CWBDD3N&sprefix=hawas%2Bfor%2Bhim%2Brasasi&th=1) – Fruity, fresh, aquatic with a warm, spicy touch.
2. [Paco Rabanne 1 Million](https://www.amazon.com/Paco-Rabanne-Million-Men-Spray/dp/B002XQ1X4G?crid=DFJLA86MB6X1&dib=eyJ2IjoiMSJ9.fNzRgDVSmeS8ql6PMtse1iH6-RjxN1Y-s5iASSgLbxkMBelxD2U94B85XX-ELpTdHe7gQp4UKvsL1wrMe9J7qST95E6kVMB0t96N3AOUNOKFiZV3calgT8AZTCzUY3Rv_g-LXVf-69ty1M1c6jrF9dMyMK-EoiF2UgK9Pdw0NCFjneXGX_sg1snakNNuO-JRdyt-REywG0zF-dc08tdCJE5r4ZVelkBFDmOJc6dAbwXmwW8C_GeRLzA8wquhdNh4bDvb9x4X7tBZdx-qLDmnjD7jr1I27xZC0U1XKJT_ZLL4O4wkdmdZV76At7-MxvYLIkANAbbirYCiwO2K0I6nio2eNWRxCMBaf8M2wzdox3Wxp7tIsI8elNOrj8yDRObse_3R0w_ohDn08qocKDUNAM5JTgLMrdy6j8wPce4oL3Up0_up4GuuOStn-0HdcflE.9I6zzIWuHQlMi5tFOhbUTIGwcnm3GFIThlEjo4yupg0&dib_tag=se&keywords=1%2Bmillion%2Bcologne%2Bfor%2Bmen&qid=1736818231&sprefix=1%2Bmill%2Caps%2C183&sr=8-5&th=1) – Warm, spicy, sweet, leathery with a bold presence.
3. [Khamrah Qahwa Lattafa](https://www.amazon.com/gp/product/B0CN9PWGGL?smid=AX6XCF6TTGYRS&th=1) – Sweet, spicy, coffee, and vanilla-heavy with a cozy vibe.

I love all three because they last a long time and get me compliments. I don’t really pick my fragrance based on occasions—I just spray and go. I mainly wear them to school, the gym, and work.

# What I’m looking for:

* **Affordable** (around $25-$85, similar to what I already own).
* **Long-lasting** (I need projection and performance).
* **Crowd-pleasing** (I want people to like how I smell).
* **Must pass the ""mom test""** – Whenever I buy a fragrance, my mom has to like it, so she doesn’t get too mad that I’m “wasting money” instead of saving. If she hates it, I’ll never hear the end of it. 😅
* **Something that gets compliments** from both men and women.

I’m open to different styles, whether fresh, sweet, woody, or spicy. What do you guys think would fit well in my collection? What would be a great addition to my collection?

",1,1737659281.0,Colognes,3,1.0,False
1i8b6nd,https://www.reddit.com/r/DemonologyPublic/comments/1i8b6nd/riddle_me_this_guysno_but_seriously_tell_me_wtf/,Riddle me this guys......NO but seriously tell me wtf is going on????,"Hello people , I am creating a post after my friend's suggestion . So i have been feeling an entity for a long time i ignored it even there were some pretty big tellatale signs and ignored it as coincidences and wind blowing and other stuff but yesterday when i was getting myself some coffee something weird happened .My electric kettle(its a a jug type device which heats up liquids ,it has a light indicator which glows when its switched on) is plugged in the socket and the switch was turned off (its a type of switch which requires some pressure to turn it on and off .Its like one of those switches when its not used for a long time ) when i was heating up the milk it suddenly turned on and turned my head to see but i just got a glimpse of something black that faded into nothingness. For a long time i ignored signs like this not paying attention to these things but i just got that incident slapped on face and i cant deny it . I dont know if thats a demon or not but its definitely something you guys would know better ,so please help me out with my doubts . Thank you",1,1737659227.0,DemonologyPublic,0,1.0,False
1i8b4up,https://www.reddit.com/r/findommes/comments/1i8b4up/good_morning_subs/,Good morning subs 🐽☕️,Send for my coffee I’m thirsty🫰🫰 hurry up ,1,1737659105.0,findommes,0,1.0,False
1i8b4gw,https://www.reddit.com/r/JUSTNOMIL/comments/1i8b4gw/i_dont_want_my_mom_living_down_the_street_how_do/,I don’t want my mom living down the street - how do I tell her that?,"Currently, my mom lives in an apartment with my older brother (30M) in a town about 15-20 minutes away from me. I haven’t talked to her in a few weeks after a particular argument/fight between my brothers (I have two brothers total) & I, and her.

She texted me yesterday, basically apologizing and she mentioned that she & brother will be moving to a new apartment that is just down the street from where I live with my boyfriend (like 2 minutes away). The main reason for them moving there is because it’s closer to the university my brother attends, so it’s easier for him to commute without a car.

I really really do not want her living this close. My boyfriend & I love the small town we live in, and we love our home. We feel very safe & welcome in the small community, and we can see ourselves staying here long term. But I hate the thought of going to the grocery store or the coffee shop and seeing my mom there. It feels like an intrusion into my space & my life. I feel bad for feeling that way, as it’s ultimately because of my brother and his education for why they are moving there in particular. But there are so many other places they could have gone that are close to the school. The public transit system in the city is pretty reliable.

I just don’t know how to approach the situation. They have basically already signed the lease & everything, so the move is pretty much set in stone. So it’s too late to try and convince them to go somewhere else. And I definitely don’t want to move. Anyway - any advice is very much welcome & appreciated 🫶",7,1737659079.0,JUSTNOMIL,3,0.89,False
1i8b2w9,https://www.reddit.com/r/MeetNewPeopleHere/comments/1i8b2w9/30m_ukonline_on_the_search_for_a_clingy_bestie/,[30/M] UK/Online - On the search for a clingy bestie,"Ello ello, I'm Lewis, 30M and from the UK.

I'll try and keep it short and sweet. Unlike me, I'm your typical tall skinny white guy.

I'm on the search for a new bestie for sh\*ts and giggles. Someone to share the day with, build a connection, have some fun, live love laugh toaster bath. I'm interested in investing in something long term with someone who we can be out silly selves.

This isn't for everyone but Ideally I'm looking for someone kind of clingy. Someone who wants to talk all day, checks their phone for messages from each other, doesn't care about stuff like double messaging or spamming the f\*ck out of each other.

I'm like an onion. Peel back the layers to find out what's underneath. Try not to cry while you do it. I like my humour how I like my coffee, dark. I will probably p\*ss you off.

What I'm looking for in you:

* Age 21-34 - Not opposed to people outside this range but Ideally I'm looking for people around my age
* We don't need 100% compatibility on hobbies/likes, just show interest.
* Timezones don't matter. I work a crazy schedule
* Wanting to be supportive of each other and push each other
* Can hold a conversation and willing to put the effort in.
* Silly/chaotic vibes preferred

Accepting applications via DM. Photos preferred by not required.",1,1737658971.0,MeetNewPeopleHere,0,1.0,False
1i8b2e3,https://www.reddit.com/r/makingfriends/comments/1i8b2e3/40m_somehow_made_it_to_this_point_without_friends/,40M Somehow made it to this point without friends. DFW,"Somehow I made it to 40 and I don't seem to have any friends locally outside of work. Or hobbies really. 40M, have a partner, just no platonic social life. Hoping to try to at least talk to some people and maybe meet up for a coffee sometime. 

Interests: economics and politics, religion, all the third rails in normal social life. 🙄 But can be interested in lots of other things. ",1,1737658939.0,makingfriends,0,1.0,False
