id,url,title,text,score,created_utc,subreddit,num_comments,upvote_ratio,over_18
1idskqc,https://www.reddit.com/r/Lillian_Madwhip/comments/1idskqc/alex_maverick_and_the_swamp_monster_chapter_seven/,Alex Maverick and the Swamp Monster: Chapter Seven,"[<- Previously on Alex Maverick and the Swamp Monster](https://www.reddit.com/r/Lillian_Madwhip/comments/1hr77zx/alex_maverick_and_the_swamp_monster_chapter_six/):

----

**Alex Maverick and the Swamp Monster**
---
**CHAPTER SEVEN**

---

It’s morning. Wednesday, I think. I’ve lost track of the days of the week. I am so freaking tired. If I was in a Freddy Kruger movie, I’d be dead meat. Last night, I tried to fall asleep multiple times after spending an hour teaching Nate how to play Go Fish, but it was almost impossible with him and Dumah sitting up talking about angel stuff. Even Dutch finally gave up, grabbed a sheet off one of the beds, and disappeared into the bathroom, where he wound up sleeping in the tub. I ended up passing out by putting a pillow over my head and asking Paschar if he could fill my head with static like you hear on the TV when you’ve flipped to one of the channels you don’t get.

The four of us are sitting in a cramped booth at another road-side diner in this sinkhole of a town. The diner is called “Morning Bo’s”. I assume it was started by a man or a woman named Bo. Who knows why people name things what they do? It’s the kind of diner where you expect to find cockroach footprints in your ice cream sundae. We’re not having sundaes though, because it’s Wednesday. Also, it’s breakfast time, so I have to eat something to get me through the day, and ice cream does not cut it.

A middle-aged lady with black hair done up in a bun on top of her head and an overly cheerful smile on her face approaches us. She’s wearing one of those classic waitress uniforms, the kind of pink that looks like its stored in a heavy smoker’s wardrobe overnight, with a matching yellow-white apron with lots of pockets. She smacks her lips together in a loud fashion as she chews some bubblegum to hide the smell of her nicotine addiction.

“Good morning!” she says in a sing-songy voice that she probably puts on for customers, “My name is Hailey. What can I get for y’all?” She reminds me of the lady from Peewee’s Big Adventure, Simone, with the angry boyfriend. I had a friend once named Simone. I bet she’s waiting for the school bus right now, like a normal kid with a normal life. I wonder if my Simone has an angry boyfriend like Peewee’s Simone did.

“Waffles, please,” I mutter into the table top that my face is smushed, “And a glass of milk.”

The table is nice and cool on my face. Why is it so stupidly hot around here?

Dutch orders a coffee with cream and an omelet with grit. I don’t understand why anyone would want grit in their food, let alone pay a diner to do it for them. If you want your eggs to be crunchy so badly, just drop the omelet on the ground outside and you’re good. Paschar calmly explains to me why “grits” are not the same as “grit” that you find on the ground. I tell him that people need to stop naming food after dirt and trash because it just gets confusing.

Hailey’s smile twitches when she looks at Dumah. “A-and you?” she stutters, trying her best to keep the presentation of pleasantness up.

Dumah turns his hollow gaze upon her and gives a shrug. “What would I do with human food?”

Nate quickly interjects. “Don’t say human, just say food.” He smiles at poor Hailey in an attempt to get her to smile back but she’s too busy replaying Dumah’s words in her head and letting her forehead squiggle.

“Better yet,” I mumble into the linoleum, “just say, ‘nothing for me, thanks.’”

“Nothing for me, thank you,” Dumah continues to stare at our server with his fake eyes, then breaks out a rigored grin in a poor imitation of his brother.

Hailey hisses involuntarily and cringes away slightly. None of us is particularly bothered by this, but I can see Dutch staring nervously at his napkin. After regaining her composure, she turns to Nate. “And —heh-- last but not least! A-anything for you… bright eyes?” At the mention of eyes, she glances back to Dumah briefly.

“Do you, by chance, have the cereal called, ‘Raisin Bran’?” Nate asks.

“We got all sorts of cereals.”

Nate claps his hands excitedly. “I would love a bowl of your Raisin Bran, with the milk of a cow. Pasteurized. And a bowl of fresh, local fruit on the side. Please.”

“Not human milk?” Hailey asks with a scoff.

Nate becomes noticeably fascinated. “Is it pasteurized?”

She rolls her eyes, then turns and walks away without answering.

Almost immediately, she’s back, shoving a plate with a hot, buttery waffle against the side of my face. I must have fallen asleep with my face on this nice, cool tabletop. I would estimate fifteen minutes have gone by, based on the pool of drool by my mouth.

“Heads up, Alex,” says Nate.

Hailey chuckles as she continues to try to push the plate up my nose. “Someone’s a sleepyhead!”

Everyone else got their food already while I snoozed. Dutch keeps his head down as he cuts up his eggs and dirt or whatever grits is and stirs his coffee. Nate is already half done with his bowl of cereal and fruit. He appears to be pleased as punch about this. Dumah plucks a blueberry from Nate’s bowl and pops it past his chompers, where it disappears into the empty blackness within his skin suit. I imagine it rolling around inside him like a marble in a balloon. He stares into the middle distance for a moment like a malfunctioning robot.

“I don’t understand,” he finally says as he watches Nate take another spoonful of bran flakes and sugar-coated raisins bathed in the milk of a herd animal, “do you derive pleasure from consuming food?”

Nate laughs, choking on the spoon and spraying chewed cereal bits onto the table. A dribble of milk comes out his nose. He coughs and wipes his eyes with his napkin. “Brother, I’ve got a whole digestive system working in this framework.” He says, taking a moment to blow his nose. “I can taste things, as well as smell them. I can’t even describe to you what the sensations are like, you just have to experience them.” He pauses, looking at the wet napkin. “Except for that last one. That hurt. Don’t do that.”

“All is naught but ash,” Dumah retorts dismissively.

I butter my waffle with the little, cold butters the diner provided. It spreads like chalk on a wool sweater. My poor, lovely waffle. And worse, the only syrup they offer is some off-brand, brown, sugar water fake crap that turns into a grizzly crust around the outside of the syrup jar. And that’s what it’s going to be doing in my stomach after I eat it. Hopefully my tummy can hold it all in.

“Sirs,” Dutch says nervously, glancing around to make sure our waitress isn’t within earshot, “please, take no offense… but it might be better if you didn’t talk like you were Martians who just arrived on Earth.”

I take the opportunity to look around and observe the other patrons in the establishment. They all seem to be immersed in their own lives, but any of them could be eavesdropping and just really good at acting casual when they hear weird stuff. There’s a gaunt-looking lady who is probably a retired teacher or something. It feels so unnatural not immediately knowing things about every person around me. Like Hailey: what’s her deal? Is she married? Does she have kids? How long has she been a smoker? I don’t even know her last name.

Dumah ignores Dutch and turns his attention to me. “Oh, speaking of that—“ he sticks a hand into his business suit and pulls out a fork. It’s made from polished silver and has a little emblem scratched into it that looks like a turtle drawn by a caveman. “This is for you.” He holds the fork out to me.

“I already have a fork,” I say through a mouthful of waffle, wiggling the one I just used to put said waffle into my waffle hole.

“This isn’t for stabbing waffles, it’s a totem.”

“Uh,” I glance at Paschar, “I already have one of *those* too.”

“Who assigned you a totem?” asks Nate, reaching for the fork. Dumah jerks it back, then switches hands and tries to pass it to me again.

“No,” Paschar chimes in, “the important question is *who’s* totem is it?” He sounds like he’s reaching his wit’s end with Dumah. “I know the inventory, there is no fork totem. Dumah, you’re already playing with fire just by being here! If you really brought unsanctioned tutelary material to the other side, they are going to—“

“This isn’t connected to one of us,” Dumah doesn’t look at Nate or Paschar, he keeps his gaze strictly on me. “I made this one myself. It’s linked to the Trishul of Durga.”

The Trident of Durga. It’s a demon-killing weapon I held for a while the last time I was in the Veil. I don’t fully understand its power, but Dumah was definitely fascinated by the fact that the trident let me hold it at all. I guess it’s supposed to be pretty vicious when fighting demons, but I wouldn’t know. Only two things actually felt the wrath of the trident… one was this nasty, ugly brute called Mot. The other was Paschar.

Speaking of Paschar, he explodes. Not literally, but you know… angrily.

“You brought the Trishul of Durga back to the mortal plane?! Have you completely lost touch with reality?! Enough of this madness, you’re as far gone as Sam was!”

Dumah’s fake eyes bug out of their sockets at the mention of their dead brother. “How dare you?!” he hisses, which is really impressive because I don’t think he actually has a tongue in his mouth. “I am trying to *fix* what Samael did! These things that he released upon humanity are undetectable by *you* and untouchable by *her*.” He jabs the fork in my direction. “But they are not immune to *this*.” He waves the fork in a flourish as he says that last part.

Another look around at our fellow breakfasters reveals that some of them have noticed the heavy-set, bald man brandishing a dangerous-looking fork and seemingly yelling at Dutch, who hasn’t said a thing in a while. Poor Dutch is just keeping his head down and stirring his coffee for the life of him.

I snatch the fork out of Dumah’s hand before things escalate further. I give Paschar and Dumah both stinkeyes. “Can we finish our breakfasts and talk about this somewhere less public?”

“PLEASE,” Dutch whispers into his coffee.

Immediately, my hand is on fire. Not real fire, but it feels like I’ve stuck it in a microwave and it’s being cooked from the inside out. I want to scream and throw the fork away, but I can’t. Instead, my hand clenches it tighter, and the scream sticks in my throat where it becomes a warbling sound instead like one of those water whistles in the shape of a bird. I don’t know what else to do so I turn to Dutch as my vision blurs through tears. 

Dutch instinctively reaches for me to try to pry the fork out of my hand.

“DO NOT TOUCH HER!” Dumah snaps, attracting the attention of even more people in the diner.

Hushed comments and whispers pass among the other patrons. Miss Hailey watches from another table, her expression a mixture of confusion and annoyance. She frowns and chews her bubblegum. Despite not being able to read minds, I’m pretty sure I can tell what she’s thinking, and it’s something along the lines of wishing our weird, little troupe had never walked in here this morning.

Nate ignores Dumah’s command and reaches across the table, trying to pry my fingers open. He can’t.

“Alex, drop the fork!”

I would if I could! The searing hot sensation has filled my hand and is starting to travel over my palm toward my arm, but for some reason it stops at my wrist, not going any further. Instead, a red circular mark with a squiggly line and a star in the middle of it appears on my skin. It’s raised, angry and sore-looking, like someone pressed a cow brand on me. It also seems to turn back the feeling of pain, spreading a cool, comforting sensation back down over my burning hand. As the last ember of pain fades, I finally manage to stop whistling with my throat. My whole arm gets super heavy feeling and I just let it drop to the table top with a THUD, where it jostles all the other dishes and utensils.

Nate cautiously sits back in his chair. “What just happened?”

Dumah strokes his chin and looks at my hand. “I would wager that the sheer power of Durga’s Legacy does not translate well to a smaller container. Think of it like taking all of the water in the ocean and pouring it into a flagon. The mistake was mine. I should have added some sort of power dampener or a capacitor of some variety.”

“You think?!” Paschar snarls. “You had no business trying to MacGyver a totem to one of the most dangerous relics of Samael’s design, let alone hand it off to Lily —I mean Alex— without any prior analysis or comprehensive testing done!”

Dutch raises his hand up over his head. “Check please!”

“Alex.” For the first time I think that I’ve ever known, Dumah looks at me with… what is that? Is that regret? Shame? I can’t tell. The expression is clearly foreign to him. “I am very, *very* sorry for not thinking before giving you that totem. Though deep down I feel an overwhelming sense of providence that you happen to have that mark—“ he gestures toward the red welt on my wrist as he says this, “— the Mark of the Witch Queen Hekate on you. I had no idea she’d placed her sigil on you. A good thing, to be sure. I think we’d all be witnessing a human inferno right now otherwise.”

“The what?” Nate squints at my arm. “I don’t see anything. What are you talking about?”

“I want to ask how you can see Hekate’s mark,” Paschar begins, “considering even I’ve never been able to see it. But I think the important thing is YOU ALMOST KILLED HER.”

Dumah doesn’t blink. “I said I was sorry.”

I shake my hand with the fork in it, but it won’t let go. “I can’t drop it.”

“It does not want you to, I suppose.”

“You *suppose*?!” I think Paschar is about to become a doll inferno. He sounds about ready to tear through the Veil and strangle Dumah with his bare hands. That probably wouldn’t do much though.

The waitress Hailey marches up to our table with a stern-looking man in a greasy apron standing directly behind her. He’s got a grizzly, salt-and-pepper beard and is holding a large frying pan that’s clearly been used recently. Neither of them looks particularly happy.

“Here’s your tab. We’ll thank ya to pay up and leave… NOW.” Hailey says in a far less cheerful voice. “Y’all just get the Hell out of here and never come back, hear me? Just move on to wherever y’all were going. We don’t need none of this— whatever this is— around these parts.”

The man in the apron grunts and nods. “If I see you in here again, I’m putting your asses on the menu,” he threatens in a low voice.

Nate looks mystified at the idea of his ass being on the menu. Dumah, as usual, is unfazed at everything.

Dutch stares at the table and pulls out his leather wallet he always keeps in his coat pocket. He throws several high value bills on the table. “I’m really sorry for the disturbance—“ he starts to say without looking Hailey or her bouncer in the eyes.

“GET. OUT.” Hailey points toward the doors leading to the sidewalk.

“Look what you did,” Paschar starts into a lecture. “Now it’s going to be even harder for you to keep a low profile around town.”

Dumah snorts. “Me?”

“YES. YOU.” Hailey glares daggers at him. I can hear the guy behind her squeezing the handle of his frying pan in anticipation of getting to swing it.

I grab Paschar off the table just as Dutch starts urgently pushing me out of the booth. “Please stop talking to the doll,” I say through the side of my mouth to Dumah.

Most everyone else in the diner watches our little group leave with the same expression, a mix of disgust and confusion rubbed over a lemon. The only one that stands out is a little boy, maybe six or seven years old, standing on his chair as his mom clutches at his arm and tries to make him sit back down. He looks directly at me with eyes filled with fascination and wonder. What does he see that makes him so curious? Three grown men and a crinkly-haired teenage girl clutching a fork like its the only thing left in the world? Two angels in human outfits and a talking doll? Something else? I’ll never know.

“What do we do now?” I ask as we stand out on the sidewalk in the morning heat like a bunch of time-traveling starship personnel trying to locate a pair of humpback whales in San Francisco. 

Across the street sits Officer Lafleur in an black, unmarked vehicle, trying to blend in to the other cars parked along that side of the street. He’s got a pair of dark sunglasses on and is wearing a red baseball cap with the word “CAJUNS” on it in letters so bold I can read them from across the street and through the tinted windshield. I imagine if hide-and-go-seek was a team sport, Officer Lafleur would always get picked last.

Nate speaks up. “Take us to where you think you saw the… whatever it is.”

“What do we do about our tail?” I ask, pointing directly at Lafleur so he sees that I see him. He has a violent reaction to this in his car, his head snapping to the side and then his whole body trying to stuff itself down into his seat.

Nate squints in his direction. “Is that a friend of yours?”

“That’s the cop that pulled us over two nights ago.”

Dutch, to his credit, is trying really hard to stand patiently still and stay out of everything going on, but he physically tenses up when he realizes Lafleur is nearby and watching us. He clenches and unclenches his fists while grinding his teeth and scrunching up his face.

Nate’s mouth curves up on one side in a smirk. “I’ll take care of it.”

“Please don’t set him on fire,” pleads Paschar.

“I’m just going to melt his tires.” He raises one hand, ever so subtly at his side, pointing four fingers in the direction of Lafleur who has completely disappeared from view inside his black sedan. Nothing seems to happen, but it doesn’t take long for us to be able to visibly see the two tires on the side nearest us starting to sag. I feel a little bad for the guy, because tires are expensive, but he is being a total dink. However, the tires don’t simply melt into goop like I thought they would. Instead, we’re all startled by four loud BANGs in quick repetition as the car’s tires burst like balloons.

Lafleur screams and thrashes around inside his car some more. I can see him waving a pistol around suddenly. He seems to discharge it in a panic, blowing a hole through the roof. People walking by also scream and drop to the ground. One guy dashes into the door of a nearby shop, completely abandoning the woman he was walking with. I imagine they’re going to have a fun conversation about it later.

“Run!” Paschar says urgently.

And we do.",2,1738258799.0,Lillian_Madwhip,0,1.0,False
1idskjw,https://www.reddit.com/r/ShyBladderIPA/comments/1idskjw/yooooo_24m/,Yooooo 24/m,"I had bad heart palpitations for 3 months from September - December and basically ended 2024 for me. I've been better since 2025 started but I've been looking for treatments to cure my last health problems. 

I've been trying to live a normal life but this has been a major setback. Since September I have not felt the same in my own body. I feel weak, numb and in constant discomfort. I've been sober from alcohol for months and taken minimal caffeine but eliminated tea, coffee and energy drinks. 

During the heart palpitations I also experienced bladder issues, my bladder would come out weak and I would have trouble starting and would stop and start during my stream. This has also gotten better since January but whenever I'm out it still shrivels in public and seems very shy and it doesn't always empty when I'm outside. 

Even though the days have gone where I would experience sudden drops in my blood pressure, rapid heart rate, weak (I mean super weak) shaky, tired from my heart palpitations a month ago. I am still experiencing heart palpitations, I can feel them when I sit down and I can feel them when I try rest my head. 

Is there some underlying anxiety and stress going on in my body? On the surface I don't tense up in social situations and people see me on the outside as a very confident autistic adult who can conduct myself but on the inside I'm fighting a constant battle with demons. 

So far I've done a blood test through my GP and they found nothing, I tried to get my GP to do another examination and they just used my words against me and dismissed my questions. Fuck my GP they got 2 star rating and they never seem to care. 

I forked out money for a private urologist. He was a good individual. Fortunately my lifestyle changes finally kicked in and my bladder started working again, I just don't know why it is so shy when I'm out...my urologist gave me a quote to go hospital but it would of costed me 2k and there was uncertainty whether they'd find anything wrong. 

I'm going to hypnotherapy tomorrow and next week I have a consultation about erectile dysfunction because I can't get morning wood. I'm also thinking of getting a doctor who specialises in heart palpitations but I fear that if my heart rate is good which I tested it out on an app and it came back normal, I fear there will be no treatment for me because I can't prove anything and it seems like a waste of money. 

Before I end I have a few questions on mind. 

If I still have my heart palpitations is it making my bladder shy and my body weak? 

What treatment should I require? 

Could I suffer from underlying anxiety and stress? 

I'm sure I have more questions on my mind but those are all I can think of now...

Please shoot me a DM if you think you can help",1,1738258787.0,ShyBladderIPA,0,1.0,False
1idskhk,https://i.redd.it/gs03237t36ge1.jpeg,Take advantage for breakfast,,1,1738258782.0,BurgerKing,2,1.0,False
