id,url,title,text,score,created_utc,subreddit,num_comments,upvote_ratio,over_18
1pzan41,https://www.reddit.com/r/boulder/comments/1pzan41/whats_the_one_local_business_you_frequent_the/,What's the one local business you frequent the most in Boulder?,"Restaurants, pubs, gyms, coffee shops - anywhere with a cool aesthetic / storefront. Creating art to honor local Boulder businesses and want to feature community favorites.",1,1767075705.0,boulder,0,1.0,False
1pzamas,https://www.reddit.com/r/ProductivityApps/comments/1pzamas/i_got_tired_of_my_5000_youtube_watch_later/,I got tired of my 5000+ YouTube 'Watch Later' playlist becoming a graveyard. So I built a tool that summarizes new videos automatically,"https://preview.redd.it/k47dm7o1baag1.png?width=2368&format=png&auto=webp&s=f3aab0020546e440af93e0cf1a9a05c17ed7a9da

I follow about 30 channels for work (AI, Tech, Marketing). The problem is, keeping up with them feels like a part-time job. I was spending 2 hours a day watching videos just to find the 5 minutes of actual signal.

The Solution (Recapio Recaps): I built a ""Daily Feed"" that treats YouTube channels like an RSS reader, but for summaries.

How it works:

It monitors my selected channels (e.g., Huberman, YC, The Verge).

When a new video drops, it auto-generates a structured summary (Key Insights, Arguments, Action Items).

It pushes it to a clean ""Recap Feed"" so I can skim 10 videos in 5 minutes over coffee.

The Result: My ""Watch Later"" playlist is finally empty. I only click ""Play"" on the videos that are actually worth the deep dive.

It’s a work in progress. Would love to know if you guys prefer this ""Feed"" view or if you'd rather have these sent as a morning email?  
  
[You can try it here (No credit card required for the free tier).](https://recapio.com/recaps?utm_source=reddit&utm_medium=productivityapps)

Thanks!",1,1767075628.0,ProductivityApps,0,1.0,False
1pzam75,https://www.reddit.com/gallery/1pzam75,Am I the only one who hate the ranking!!😑,"I hate that the ranking is full of sm#t. Can't they have their own ranking pls.. 
(I know it sells but mehh..)
",1,1767075620.0,Webnovel,0,1.0,False
1pzaj6l,https://www.reddit.com/r/IndiaCoffee/comments/1pzaj6l/want_to_upgrade_my_black_coffee_experience_should/,"want to  upgrade my black coffee experience ,should I be getting the fellow ode gen 2?","I have been drinking black coffee from a French press for the past 10 years can't  do milk at all  , 2 cups a day ..source beans from different roasters online or locally ,  have been using an agaro burr grinder for a about a year and these days get them preground from the roaster...I plan to start doing pourovers / chemex along with French press ,espresso seems like a lot of work but I did contemplate getting a fully automatic espresso machine  like one of those DeLonghi /philips .



should I go ahead and get the fellow ode gen 2 grinder ? or do I get something else which costs much more or much less?",1,1767075339.0,IndiaCoffee,1,1.0,False
1pzaiza,https://www.reddit.com/r/u_Secuodsoftpvtltd/comments/1pzaiza/what_are_ai_agents_types_examples_complete_guide/,"What Are AI Agents? Types, Examples & Complete Guide 2026","Imagine waking up to an AI agent that’s already scanned your calendar, booked your morning coffee run based on your mood (detected via smartwatch data), and even drafted an email negotiating a better deal on your next flight,all before you’ve touched your phone. Sounds like sci-fi? In 2026, this isn’t just possible; it’s the new normal. With the global AI agents market exploding to over $50 billion, these autonomous AI systems are revolutionizing everything from AI automation in businesses to personal productivity hacks. But what exactly are AI agents, and how can they supercharge your workflow?

In this complete AI agents guide 2026, we’ll break it down: from core definitions to types of AI agents, real-world examples of AI agents, and insider tips on implementation. Whether you’re a developer curious about intelligent agents or a business leader eyeing machine learning agents for efficiency, this post has you covered. Let’s dive into the world of agentic AI and unlock its potential because by 2026, 80% of enterprises will rely on them for decision-making.

https://preview.redd.it/3xuit13baaag1.jpg?width=1280&format=pjpg&auto=webp&s=06a06bfa35386178b0d8057d3ba59c18fd072ace

# What Are AI Agents? The Basics Explained

At their heart, AI agents are autonomous systems powered by artificial intelligence that perceive their environment, process data, and take actions to achieve specific goals,without constant human oversight. Unlike traditional chatbots that spit out responses, AI agents exhibit reasoning, planning, and memory, making them true digital teammates. Think of them as the evolution of natural language processing (NLP) and machine learning models, blending [AI](https://www.secuodsoft.com/ai-machine-learning-development.php) automation with real-time adaptability.

In 2026, what are AI agents boils down to four pillars:

* Perception: Gathering data from sensors, APIs, or user inputs (e.g. voice commands or emails).
* Reasoning: Using algorithms to analyze and decide (hello, large language models like GPT-5).
* Action: Executing tasks, from sending messages to optimizing supply chains.
* Learning: Improving over time via feedback loops, turning one-off tasks into self-optimizing routines.

Why the hype? AI agents slash operational costs by 30-50% in sectors like finance and healthcare, while boosting user satisfaction through hyper-personalization. If you’ve ever used Siri to set reminders or Alexa to control your smart home, you’ve dipped your toes in simple AI agents. But as we edge into multi-modal eras, handling text, images, and video, these intelligent agents are set to redefine productivity.

# How Do AI Agents Work? A Step-by-Step Breakdown

Curious about the magic behind AI agents? It’s not wizardry; it’s a symphony of tech stacks. AI agents operate in a loop: observe, decide, act, learn. Here’s how it unfolds in 2025’s landscape:

* Input Gathering: Via APIs or sensors, agents pull in data, like market trends for a stock-trading bot.
* Processing with LLMs: Leveraging models like Grok-3 or Claude 3.5, they reason contextually, incorporating reinforcement learning for smarter choices.
* Decision Engine: Tools like LangChain or AutoGPT orchestrate actions, ensuring autonomous AI aligns with goals.
* Execution & Feedback: Agents act (e.g., booking a meeting) and refine via user input or analytics.

This AI agents workflow thrives on edge computing for speed and federated learning for privacy, key trends in 2026. Pro tip: Start small with no-code platforms like Zapier’s AI agents to test AI automation without a dev team.

# Types of AI Agents: From Simple to Super-Smart in 2026

Not all AI agents are created equal. In 2026, types of AI agents range from reactive bots to collaborative swarms, categorized by complexity and capability. Understanding these helps you pick the right intelligent agent for your needs, whether it’s a quick task automator or a full-fledged decision-maker.

Here’s a handy table breaking down the 7 key types of AI agents, complete with use cases and 2025 twists:

|Type of AI Agent|Description|Key Features|2025 Use Case Example|Complexity Level|
|:-|:-|:-|:-|:-|
|Simple Reflex Agents|React to current inputs without memory (if-then rules).|Rule-based, fast execution.|Spam filters in email clients.|Low|
|Model-Based Reflex Agents|Use internal models to track past states for better reactions.|Environmental modeling, basic memory.|Smart thermostats adjusting to habits.|Low-Medium|
|Goal-Based Agents|Plan actions to reach predefined objectives.|Search algorithms, path planning.|Navigation apps like Waze rerouting.|Medium|
|Utility-Based Agents|Evaluate options based on desirability (utility functions).|Optimization, trade-off analysis.|Recommendation engines on Netflix.|Medium-High|
|Learning Agents|Adapt and improve from experience using ML.|Reinforcement learning, neural nets.|Personalized fitness coaches like WHOOP.|High|
|Hierarchical Agents|Layered structure for complex tasks (sub-agents handle subtasks).|Modular design, scalability.|Enterprise ERP systems like SAP AI.|High|
|Multi-Agent Systems|Teams of agents collaborating or competing.|Coordination protocols, swarm intel.|Autonomous drone fleets in logistics.|Very High|

These types of AI agents evolve with LLM agents,large language model hybrids dominating 2025, where 60% of new deployments are multi-modal. For businesses, start with goal-based agents for quick wins in AI automation.

# Examples of AI Agents: Real-World Wins in 2026

Theory’s great, but examples of AI agents bring it home. In 2026, these autonomous AI powerhouses are everywhere, from your inbox to boardrooms. Here are 8 standout AI agent examples transforming industries:

* Salesforce Agentforce 2.0 (Enterprise CRM): An autonomous agent that prospects leads, qualifies them via NLP, and closes deals, boosting sales pipelines by 40%. Perfect for B2B AI automation.
* Microsoft Copilot Vision Agents (Productivity): These learning agents scan documents, suggest edits, and even predict project risks in Teams, saving knowledge workers 20 hours weekly.
* Harvey AI (Legal): A multi-agent system that researches case law, drafts contracts, and flags compliance issues, cutting legal review time by 70%.
* KAI Banking Agent (Finance): Detects fraud in real-time, analyzes portfolios, and sends spending alerts, handling 1M+ transactions daily with 99.9% accuracy.
* Lindy AI (Personal Assistant): Your go-to goal-based agent for email triage, calendar optimization, and travel booking, now with voice and image processing for seamless multi-modal AI.
* Non-Diagnostic Patient Agents (Healthcare): Chat-based simple reflex agents that triage symptoms, schedule appointments, and monitor vitals, reducing wait times by 50% in clinics.
* HubSpot Breeze (Marketing): A utility-based agent that crafts personalized campaigns, A/B tests content, and predicts ROI, driving 25% higher engagement for SMBs.
* Oracle Miracle Agent (Supply Chain): End-to-end hierarchical agent automating procurement, forecasting demand, and rerouting shipments, ideal for e-commerce giants facing 2026 disruptions.

These examples of AI agents showcase versatility, but integration via APIs like OpenAI’s Assistants is key for custom builds.

# Benefits of AI Agents: Why They’re a Game-Changer in 2026

Adopting AI agents isn’t just trendy, it’s transformative. Key perks include:

* Efficiency Boost: Automate 70% of repetitive tasks, freeing humans for creativity.
* Scalability: Handle spikes, like Black Friday traffic, without proportional costs.
* Personalization at Scale: Learning agents tailor experiences, lifting conversion rates by 35%.
* 24/7 Operations: Autonomous AI ensures non-stop productivity in global teams.

In 2026, AI agents benefits extend to sustainability, with agents optimizing energy use in data centers by 20%. The ROI? Up to 5x in the first year for forward-thinkers.

# Challenges and Ethical Considerations for AI Agents

No rose without thorns. AI agents challenges in 2026 include data privacy risks (hello, GDPR 2.0), bias in machine learning agents, and the “hallucination” glitch where agents spit faulty advice. Ethical must-haves:

* Transparency: Audit trails for decisions.
* Bias Mitigation: Diverse training data.
* Human Oversight: Hybrid models to catch edge cases.

Navigating these ensures [responsible AI agents](https://www.secuodsoft.com/blog/machine-learning-and-ai/what-is-ai-ethics-and-bias-examples-how-to-build-responsible-ai.php), a must as regulations tighten.

# The Future of AI Agents in 2025 and Beyond

By late 2026, expect AI agents to go hyper-collaborative: swarms tackling climate modeling or personalized education. Trends like edge AI agents (on-device processing) and quantum-enhanced reasoning will dominate, with the market hitting $100B by 2030. Get ahead: Experiment with open-source like BabyAGI for your first autonomous agent.

# Why Partner with Secuodsoft for Building Your AI Agents

Unlock the full power of AI agents with [Secuodsoft Technology](https://www.secuodsoft.com/), Bhubaneswar's forward-thinking tech innovator dedicated to crafting bespoke autonomous AI systems that drive real results. As experts in agentic AI development, we specialize in building everything from goal-based agents for streamlined task automation to sophisticated multi-agent systems for collaborative intelligence, tailored for sectors like finance, healthcare, marketing, and beyond. With a track record of 50+ deployments delivering 35% efficiency gains through advanced LLM agents and reinforcement learning integrations, Secuodsoft makes intelligent agents accessible, scalable, and ethical. Whether you're prototyping a learning agent for personalized user experiences or scaling hierarchical agents for enterprise workflows, our team turns your AI agents guide 2026 vision into robust, deployable solutions. Contact us at [secuodsoft.com](http://secuodsoft.com) for a complimentary consultation and let's co-create AI automation that propels your business into the future, no limits, just limitless potential.

# Conclusion: Embrace AI Agents Today for Tomorrow’s Wins

From demystifying what are AI agents to exploring types of AI agents and examples of AI agents, this 2026 guide arms you with the knowledge to harness agentic AI. These intelligent agents aren’t replacing us; they’re amplifying what we do best. Ready to build your first? Start with a simple goal-based agent and scale from there.",1,1767075323.0,u_Secuodsoftpvtltd,0,1.0,False
1pzairb,https://www.reddit.com/r/Accounting/comments/1pzairb/did_you_practice_your_signature/,Did you practice your signature?,"I am finding myself in more situations where my signature is required and truly wing it each time.

I got into tax much later in life and my previous work didn't require much handwriting, if at all; I don't think I've learned anything about cursive since grade school.

The first indication that this would need to be addressed at some point was when I withdrew a large sum of money from my bank to purchase a vehicle, and when my 'signatures' (realistically just different variations of squiggly lines) didn't match a national database, they had to do a manual review and had me wait in the lobby for an hour.

Nowadays it's mostly POAs, prometric intake/outtake, and other small tasks, but this has been on my mind. Should I be practicing this? Is there a series of recommended Youtube videos I can refer to?

I don't want to sign a return one day with what looks like the outlines of a coffee stain lol",1,1767075302.0,Accounting,0,1.0,False
1pzahak,https://www.reddit.com/r/piano/comments/1pzahak/anywhere_in_san_diego_to_try_roland_vs_kawai/,Anywhere in San Diego to try Roland vs Kawai digital pianos side by side (FP-10X / ES60 range)?,"Hi all —  
I’m a beginner adult pianist and I’m trying to decide between a Roland and a Kawai digital piano (thinking FP-10/30X vs ES60/ES120-level).

Before buying, I’d really love to actually play them side by side instead of just reading endless threads. So far, the only place I’ve found that might have both is up in San Marcos, which is a bit of a haul — so I thought I’d ask if there’s anywhere closer in San Diego (I'm in Point Loma).

Does anyone know:

* A local store where I could try both Roland and Kawai digital pianos side by side?
* If there's another digital piano that might have an action very similar to the Kawai (at Guitar Center, maybe, since they have the Rolands)
* Or possibly a teacher, studio, or private owner who might be open to letting a beginner try one briefly?

Totally understand if that’s a long shot — just hoping to avoid buying blind. Happy to bring coffee!

Thanks!",1,1767075163.0,piano,1,1.0,False
1pzagnx,https://www.reddit.com/r/CoffeeTraveler/comments/1pzagnx/the_best_coffee_grind_for_your_french_press/,The Best Coffee Grind for Your French Press,"https://www.tumblr.com/wanderlattetraveler/804336529585618944

# Mastering Your French Press Coffee

The French press. It’s a champion of simplicity and a gateway to rich, full-bodied coffee. But are you truly unlocking its potential? The secret often lies less in the press itself and more in the coffee you choose.

For the uninitiated, the French press method is all about immersion. Coffee grounds steep directly in hot water, and the resulting oils and fine particles aren't filtered out by paper. This is why selecting the right coffee and grind size is paramount. Too fine, and you’ll end up with sludge and bitterness. Too coarse, and the flavor won’t extract properly.

*   **Grind Size is King:** Aim for a coarse, uniform grind, resembling sea salt. This prevents over-extraction and makes pressing the plunger smooth.
*   **Bean Freshness Matters:** Always use freshly roasted whole beans and grind them just before brewing. Pre-ground coffee loses its volatile aromatics quickly.
*   **Roast Profile Harmony:** Medium to dark roasts often shine in a French press, their bolder flavors standing up well to the immersion brewing method.

Elevate your morning ritual from good to exceptional. Experience the difference that the right coffee makes.

Explore our curated selection of whole bean coffees perfect for your French press today!

https://www.tumblr.com/wanderlattetraveler/804336529585618944",1,1767075104.0,CoffeeTraveler,0,1.0,False
1pzag9f,https://www.reddit.com/r/GamerPals/comments/1pzag9f/24f_looking_for_ps45_buddy/,24(F) looking for ps4/5 buddy,"
Hiii, I don’t play much games due to my poor lifestyle(college) lol, I only rlly play Warframe, Fortnite, Genshin, and that’s it (I play warframe more then anything rn too so I’m sorry about that lol). More on my lifestyle I work at a coffee shop, own a cat and a dog, and yes, I still live with my mom, sue me for saving money XD I get awkward easily though and I’m also trying to get over a little bit of social anxiety (: Send me a DM and I promise to try to reply <3

Edit: a while back I did have to restart my entire PlayStation, and a cousin of mine, changed my PSN name to something so ridiculous I’m embarrassed to have it lol, and yes, I would love to change it, but I can’t, because A: forgot my password to account, and B: I got no money lol",1,1767075067.0,GamerPals,1,1.0,False
1pzaev6,https://www.reddit.com/r/loneliness/comments/1pzaev6/my_work_is_my_only_space_to_be_social/,My work is my only space to be social,"Hey everyone, I am not sure if there is a format for this but I just wanted a place to share how I feel. I really do feel like I cannot have people in my life, despite wanting connection. I am single, I don't have familiy, and throughout my life I don't think I have been someone close friend (although I have felt like that person maybe was mine).   
  
Over the past few years, life has become more isolating. I am in my late 20s and don't really date at all despite wanting to.I just work and then go home. I can go easily a week without maybe talking to another person if I don't work that week. I work as a classical musician so my job is very social. I love getting to talk to people and just connect but when everything is over and I get in my car to drive home, it feels like the biggest crash. To go from so many people to absolute nothing hits hard. To know that the long drive home through the night is leading my back to a home where there is no one waiting to see me feels cold.    
  
I used to have some pets and that was nice but my last pet passed this summer and I don't think I can handle another event like that so I haven't tried to adopt again. In a month sometimes, the only people I may ever speak with 1 on 1 might be just my students (I teach my instrument privately). I never use those lessons as a social hour. I always make sure they are getting what the need from me but I do sometimes wish we could just talk about their week the whole hour and see how they are doing as people. When my phone vibrates, I get excited thinking maybe someone is reaching out but it is almost always an app notification.   
  
I've noticed I have developed a bad habit of getting coffee or takeout most days just so I could go chat with someone for a brief moment... it makes me feel a bit embarrassed in retrospect. I think I'm a fun and even likable person but I don't think my history is telling me that. I think if i was more of those qualitiies, I'd likely have more friends and conenctions. People will laugh with me and compliment aspects of my personality sometimes but I dont think that overcomes what other issues they may see in me to get a bit closer. Sometimes life feels delusional. As if I am walking around with glasses that make myself appear normal to me but in reality I am far from that. I am on the spectrum and high masking but people likely just get a feeling maybe. I just hope there is a period in my life where it isn't like this. The life I wish I could have entails someone I can wake up next to, and people nearby I can see, who also want to see me.

Sorry for the rant, just not sure where else to go. ",1,1767074934.0,loneliness,0,1.0,False
1pzaebs,https://www.reddit.com/r/pourover/comments/1pzaebs/how_to_emulate_batch_brew_taste_feel/,How to emulate batch brew taste & feel?,"I‘ve gotten into pourovers this year and become fairly decent at brewing light roasts with the V60, and I enjoy playing around with that.

But I was visiting my grandma over the holidays and her coffee is just perfect, despite her using a fairly simple setup: She buys pre-ground (pretty fine) coffee from the supermarket and uses a Braun Aromaster coffee maker, which has a Melitta-like filter. She usually brews around a liter and the resulting cup has a really nice thick and creamy texture, while being strong but not extremely bitter. There’s also a very thin oil film on top of each cup, which I’ve also seen in other good batch brews.

Is there any way to emulate this when brewing just one or two cups or can this only be achieved with batch brew?",1,1767074882.0,pourover,0,1.0,False
1pzae4m,https://www.reddit.com/r/Sapporo/comments/1pzae4m/too_close_now_to_have_it_wrecked_by_exorbitant/,Too close now to have it wrecked by exorbitant airfare; welcoming ideas,"For eight successive winters of living in Cambodia, I've sworn that I'd go to Sapporo for two weeks in February to enjoy some snowy street scenes while sipping coffee in a big window. (It's my thing -- long story.) Each year some fresh wrinkle has gotten in the way, and I haven't made it. This year I've got the time, the health (knock on wood), and the circumstances needed to pull this off. I even have a hotel reservation. 

But the airfares are OUTRAGEOUS, and even with that, the itineraries are all overnight, with a +1 arrival heading in both directions. Call me insane for letting that sink the plan once again, but I can't bring myself to pay trans-Pacific airfare to go from Phnom Penh to Sapporo. It just doesn't seem right. 

Are there alternatives that I might be missing? In the past I've saved money by booking two completely separate round-trip tickets and then self-transferring, but so far Bangkok and HCMC don't seem any better. I would welcome ANY input that anyone may have. TIA. 

[\(4016 KHR = 1 USD\)](https://preview.redd.it/2zt5xvfq8aag1.jpg?width=1879&format=pjpg&auto=webp&s=8ef38329f24c5b8eab0bdbf55605efe8e8405a3d)

",0,1767074863.0,Sapporo,0,0.5,False
1pzad5k,https://www.reddit.com/r/LahoreSocial/comments/1pzad5k/lahore_people_coffee_conversations_that_start/,Lahore people coffee & conversations that start normal and end philosophical? ☕️😄,"Looking to meet new people who enjoy chill cafés, spontaneous city walks, and conversations that randomly go from “best coffee in Lahore” to “what is life?”

Purely platonic, zero pressure — just vibes.

DM if you’re down.",1,1767074773.0,LahoreSocial,1,1.0,False
1pzaco1,https://www.reddit.com/r/tagum/comments/1pzaco1/kape_ta/,Kape ta !,Mangape tas  Kurahi Coffee! Spanish latte!,1,1767074728.0,tagum,1,1.0,False
1pzablm,https://www.reddit.com/r/NewParents/comments/1pzablm/sentences_you_never_thought_you_would_have_to_say/,Sentences you never thought you would have to say... I'll go first.,"""I'll take the books off you if you don't stop eating them.""

I love my life since becoming a parent but it's becoming increasingly difficult to not laugh at my boy when he does the funniest of things. He's not sleeping so well at the moment so we got up at 4am, come downstairs and got the books out. He's 18 months so he's sat on his little sofa while I made a coffee in the kitchen (obviously I can see him before the hero's start), 30 seconds in he's munching on the gruffalo. I'm going to get it in the neck when the better half wakes up because it's her favorite book but I couldn't help but laugh. I'm going to miss this phase so much.

How do others stop themselves from laughing when they're doing the adulting in the relationship? ",2,1767074633.0,NewParents,2,1.0,False
