id,url,title,text,score,created_utc,subreddit,num_comments,upvote_ratio,over_18
1ij8al4,https://www.reddit.com/r/stayawake/comments/1ij8al4/vityas_effigy_part_6_final_part/,Vitya's Effigy [Part 6] [FINAL PART],"Andrew spent a few days in the hospital, having had a mild allergic reaction to the cocktail of toxins contained in the worm’s bite.  Austin stayed by his side pretty much the entire time…in fact, he might have actually slept *in* the hospital, I never asked, but I could make an educated guess.  I took Victor home soon after, once he’d been cleared of any injuries from Madame Blanc’s attack, and a couple weeks later, Alice and Curly dropped by the house for a small farewell party.  I was sad to see them go.  But, Curly was quick to tell me that he fully expected the two of us to visit him at the ranch sometime in the near future.  

“You still gotta try my famous biscuits ‘n gravy!” he said as he hugged the both of us goodbye.  Curly always gave the best hugs, like he could understand and accept everything about you simply through the act of putting his arms around you.  It was no wonder Alice liked him so much.

Things went mostly back to normal after that.  Victor seemed to be happier, even when he was working, and he took more breaks than he used to.  Madame Blanc took a bit of a toll on him, enough that he was pretty weak for a while, so I ended up moving in with him about a month after the incident.  It made it easier for me to take care of him.  

But the gallery was still on my mind.  I couldn’t forget what Victor had said that night in the hospital.  

*She’ll just keep eating.*  There had to be something I could do to get rid of the problem for good.  I reasoned that if there were babies (which I figured the smaller creatures were), there had to be a mother, and that was the “she” Victor had been referring to.  After a lot of thought and some Google searches that would concern any self-respecting FBI agent, I came to the conclusion that in order to get rid of Our Lady of Anguish for good, I needed to destroy the building that housed her.  Was the little stone church part of the organism or just a construct?  Who knew?  All I knew was I needed supplies.  But I didn’t know where to get things one would need to commit arson, like accelerant.  So I did something counterintuitive and texted Andrew.  Or, well, I tried to.

*-Hey, you got a minute?* I typed, expecting a quick response this late at night.  Andrew was always a night owl.

\-*Sure.*

*-I’ve got a technical question.  Let’s say I hypothetically wanted to burn down a building, what would I need?*  It took a long time for a response.  

\-*Arson is a crime, you know.*  I snorted.  

*-Yeah, well, so is impersonating a police officer, I’m pretty sure.  I know it’s you, Austin.*  I sent a laughing emoji along with the message.  

\-*Sorry.  He’s been a little out of it lately, as I’m sure you’re well aware.  How’d you know it was me?*

*-Andrew doesn’t use perfect grammar and punctuation in his texts.  He also uses way more emojis than you do.*

*-\[laughing emoji\] True.  So…you want to know how to burn down a building, huh?  Why?*

*-Like I said, hypothetical.*  The twins and Bridget were dealing with enough, they didn’t need to be worrying about me.  

*-I can ask him,* Austin typed after a moment.  *He’d know more than I do.  All I could tell you is get a bunch of gasoline and light a match.*  There was a longer pause than usual.  

\-*Heya, Livy.  How’s life?*

*-Drew?*

*-The one and only.  Sorry for the confusion, I’ve had Austin answering my texts for a few days, my brain is still scrambled as hell.  He said u wanna know how to burn down a building?*

*-Yeah, hypothetically.*

*-Right.  Well, hypothetically, you want to get your hands on some acetone, you can find it at most hardware stores.  Decent accelerant, but it catches FAST, so you want to make sure you’re outside the building when you light it up.*  

*-Matches or lighter?*

*-Either works.  I’d say matches, only because lighters carry a risk of exploding.  Shrapnel:  not even once.*  I laughed, shaking my head.  -*I hope you know what you’re doing.*  

*-I’ll be fine, Drew.  Thanks.*  

*-No problem.  Stay safe, Liv.*

After checking in with the twins, it was time to go shopping.  I got several bottles of acetone from the local hardware store, explaining to the cashier that I dabbled in calligraphy art and needed the acetone to clean up potential ink spills.  Matches weren’t hard to come by, I had some at the house for candlelight dinners.  Perks of dating a closet romantic.



To my surprise, when I reached the culdesac at around four in the morning, the little stone church was exactly where I’d left it, and the door was open, taunting me, daring me to come inside.  The interior was dark and damp, the smell of rotting meat wafting up from the staircase leading to the chapel under the gallery.  Pulling the neckline of my shirt over my nose, I carefully made my way down the stairs.  The statue was in much the same condition as when I had last seen it, though there were a few small cracks in and around its face.  The thing was even more creepy up close, its carved eyes seeming to hold a faint glint of malice.  I pretended it wasn’t there and started pouring the bottles of acetone around the room, running a trail of the liquid up the wooden stairs so the whole building would hopefully catch.

“*Usssselesssssssss…”*  I jumped, whirling around to face the statue.  It hadn’t moved; why had I expected it to?  It was a statue.  And yet…

“Excuse me?”  Maybe I had gone crazy.  That was something crazy people did, talking to statues.  

“*Your effortssssss are usssselessssssss…”*  The voice was grating and phlegmy, as if whatever was speaking had a very bad cold.  The liquid from the statue’s eyes began to flow thicker and faster.  “*My children will feassssssst…I will feasssssst.”*  I rolled my eyes.  

“What, the little leech things from the hospital?  They’re gone.  I killed them.”  A resounding screech echoed through the small chamber, burrowing its way into my ears and splitting my head open.  

“*Liesssssss!”* it hissed, and I saw more cracks forming in the face of the statue.  I started backing towards the stairs, reaching for the box of matches in my pocket.  “*Your ssssssuffering will be ssssssucculent and ceaselessssss!”*  I’d made it angry.  Oops.  By this time, I’d reached the bottom of the stairs, feeling the sharp edge of the first step against the back of my ankle.  Grabbing a match, I struck it.  In the flickering light, I caught a glimpse of the statue’s face crumbling inward, revealing concentric spirals of long, gleaming teeth, dripping with saliva.

“You want suffering?” I asked.  “*Bon appetit,* bitch.”  And I dropped the match.  I could feel the heat of the flames licking at my back as I turned and lunged up the stairs, hearing the splintering of stone behind me and the shrill cries of Our Lady of Anguish as she was engulfed.  Smoke filled the air, and I coughed, stopping only for a moment to wipe my stinging eyes before charging out into the parking lot.  The cool night air filled my lungs, and I bent over, hands on my knees as I wheezed for a moment.  A slam behind me caught my attention.  The giant evil lamprey-thing had made it out of the basement, but it was too fat to get through the door; too distended with the pain and tears of my friends.  I was fully content to just stand there and watch the motherfucker burn, but I was distracted by a rumbling from beneath me.

Before I could react, the asphalt under my feet suddenly buckled, crumbling downward in a circle around the church.  Shrieking, the creature pulled the little stone church in on itself, its claws curving around the mouldering rocks and crunching them to bits.  I yelped as the ground I was standing on caved in, and had I not managed to catch onto the edge of the resulting sinkhole, I would have fallen to my death.  Grunting, I tried to pull myself further up onto the pavement, but the ground was too unstable, and more of it disintegrated under my hands.  Just as I was about to fully slip off the ledge, a hand grabbed the back of my windbreaker and hauled me up, practically tossing me several feet away from the hole.  

“Oof!”  I had the wind knocked out of me, but at least  I was away from the unstable ground.  Scrambling onto my rear, I looked up to find Neville standing next to the edge of the hole where I had just been.  He looked like hell; hair dishevelled, eyes red and glimmering with unshed tears, clothes torn and stained with black spots.  I couldn’t be sure due to the smoke, but I could have sworn I saw something move under the skin of his neck.  He staggered back a couple of steps, clutching at his stomach, before suddenly forcing himself to stand up straight.  

And then, I saw Neville Pilgrim smile for the first and only time since I’d met him.  Frankly, it was closer to a grimace of pain, but I choose to believe he was smiling. 

“Thank you,” he said.  Before I could say anything in return, he took a couple more steps back, now on the very edge of the hole.  “Tell them I’m sorry.”  As if in slow motion, he toppled backwards, disappearing below the edge of the sinkhole.  Unsure of what else to do, I bowed my head and said a little prayer to the ancestors.  I didn’t have all the right tools to do a proper offering, but I hoped that much would give Neville at least a modicum of peace as he joined his gluttonous god in the abyss.  After that, I stood up, brushed myself off, and headed home.  



When I got home, I found Victor in the kitchen, bopping his head to “Night Witches” by Sabaton as he got together the ingredients for his famous breakfast stir-fry.  I set down my house keys in the bowl I kept by the door and shucked off my jacket before taking a seat at the kitchen island.  He jumped when he turned and saw me, putting a hand to his chest.  

“Baby, you have *got* to make more noise when you walk, you’re going to give me a heart attack one of these days,” he said, switching off the music before coming over to give me a kiss.  “Where’d you go, anyway–what the hell!*”*

“What, what is it?” I asked, but he grabbed my hands, squinting at them.  

“Your hands look like frozen hamburger, what did you do?” he demanded.  “And you’re covered in schmutz, did you swim in a gravel pit before you came home?”  I laughed, hugging him.  He was finally back to his old self.  

“I’m fine, V, I just fell off my bike on the way home,” I said.  He sighed and rested his chin on top of my head.  I could tell he didn’t believe me, but evidently he didn’t plan on pressing me.

“Don’t scare me like that, I thought you got hit by a car or something.”  

“I won’t.  I promise.”  We held each other for a long time, just breathing, just existing.  There was no way I’d killed that thing.  I couldn’t have, something so old wouldn’t go down that easily.  But I’d hurt it, badly enough that it had to retreat far underground.  It wouldn’t bother us again, I was sure of that.  

“Why don’t you go get cleaned up and get into something comfortable,” he said after a while.  “This will take a while to cook.”  I reluctantly pulled away from him, realizing I was very sore and a hot shower sounded really, really good.  “I was thinking maybe tomorrow we could visit that exhibit you’ve been wanting to go to, the one about the mummies?”

“Aww, Vitya.  I’d love to.”  I pecked his cheek before heading to the bathroom, stopping to chuck my dirty clothes in the hamper and grab some new ones.  As I went, I could faintly hear Victor humming an old Ukrainian lullaby.

  
**Epilogue**

It’s been a few months since the fire, and we’ve finally settled down into a sense of normalcy.  Every few weeks, Victor and I get together with the twins, Bridget, and Austin’s boyfriend Henry for dinner, at Red Dragon Buffet, of course.  I’ve started calling my mom more often, and once a month we go out for coffee.  I felt bad for not talking to her for so long after my dad died.  She’d been hurting too, but hadn’t been able to show it.

Victor still works in his studio pretty much every day except Fridays, since that’s our special day to spend together, and he’s even gotten a few of his sculptures into more art exhibitions…*legitimate* ones this time.  His latest one, “The Dragon’s Blessing”, is ten feet tall and depicts a woman in ornate *hanbok* touching foreheads with a majestic serpentine dragon, whose body is partially obscured by the water beneath it.  In Korean culture, the dragon is a mystical creature known for its generosity and benevolence…either way, it’s an honor to be depicted alongside one, so the fact that Victor insisted I model for the piece gave me a little bit of an ego boost.

While my boyfriend is still his good-naturedly grumpy self, he’s become softer and more open since Our Lady left.  He talks to me about his feelings more, and he’s started seeing a therapist to work on his trauma and feelings of self-loathing.  The best part?  Last night marked the fifth week in a row that Victor stayed in bed the whole night, without any nightmares or his leg bothering him.  

So if you’re ever walking around your city and come across a little stone church that you’re pretty sure wasn’t there before…stay away from it.  You’ll be a lot happier that way.

",1,1738863451.0,stayawake,0,1.0,False
1ij8a0s,https://i.redd.it/7o9ccweo1khe1.jpeg,He crawled under there for warmth,,7,1738863411.0,CirclejerkSopranos,0,1.0,False
1ij89w5,https://www.reddit.com/gallery/1ij89w5,"Pages 16-20. of the Comic. I'll probably stop saying when the images were made, (since I'm too lazy to scroll in IG). These drawings still feel rudimentary to me. No perspective, no b#$ches.",,1,1738863403.0,u_Animator_Bro_Man,0,1.0,False
1ij888w,https://www.reddit.com/gallery/1ij888w,Trudive Bikini for sale,"Never fitted, worn or used.
Size Large

Still for sale for Php 5500 only with free meet up in Mabini (Alwan Coffee)

Market price on Sanghinga is  Php 8290",1,1738863290.0,freedivingph,0,1.0,False
1ij886r,https://www.reddit.com/gallery/1ij886r,Missing part?,"I’ve had Keurig machines in the past, but I’m currently making coffee with a moka pot, a French press and a Nespresso. But somebody gave me their Keurig to use in my classroom. 

As I was examining it, a metal disk fell out of the top. Does anybody recognize this part? Does it go back in somewhere? Also, since it’s been sitting in a garage for a while, I’m thinking maybe I should take it apart and really clean it, in addition to washing the water reservoir and descaling. 

Any advice? Thanks!",1,1738863287.0,keurig,1,1.0,False
1ij87a9,https://www.reddit.com/r/ParisTravelGuide/comments/1ij87a9/help_me_improve_my_paris_travel_reference/,Help me improve my Paris Travel Reference?,"Hi guys! So I'm creating a guide and references for my friends and family to use to create their itineraries when visiting me in Paris. I've created a Gsheet, and made a couple lists on Gmaps, but I know there's a lot I'm missing as well as possible mistakes. I was wondering if people out there were willing to help take a look and give me suggestions and recommendations to improve it.

Thank you guys in advance!

[Google Sheet with Recommendations, References, & Notes](https://docs.google.com/spreadsheets/d/1a7q58vXroHPwZoN5DyqzbFIRIfA4FY_ddfiZj3O7zBQ/edit?usp=sharing)

[Paris Guide - Google Maps List](https://maps.app.goo.gl/Nypyw52ZDQrmt2bE9)

[Cafes & Restaurants - Google Maps List](https://maps.app.goo.gl/AvZ8LRLscJkNvTtq7)

[Sweets (Patisseries & Desserts) in Paris - Google Maps List](https://maps.app.goo.gl/gBJixuCGcac7VJyj7)

[Coffee in Paris - Google Maps List](https://maps.app.goo.gl/yefc99rhpijSdGxx6)

[Nightlife - Google Maps List](https://maps.app.goo.gl/AB9Y5nVy7Wzkk24e9)

",2,1738863223.0,ParisTravelGuide,0,1.0,False
1ij86dt,https://www.nakedcapitalism.com/2025/02/life-after-lambert-update-klg-to-provide-weekly-health-pandemic-coffee-break-still-seeking-help-in-finding-new-site-contributors-including-for-other-coffee-break.html,"Life After Lambert Update: KLG to Provide Weekly Health/Pandemic “Coffee Break”; Still Seeking Help in Finding New Site Contributor(s), Including for Other “Coffee Breaks”",,1,1738863160.0,StockMarketNewsToday,0,1.0,False
1ij85nh,https://www.reddit.com/r/Seattle/comments/1ij85nh/cute_streetsplaces_to_live_like_madison_ave/,Cute streets/places to live like Madison Ave,"Hi! I just moved here and have an airbnb off of Madison Ave. It's pretty perfect- the neighborhood is so cute with all the trees and little houses, it's walking distance to the arboretum, and walking distance to Madison which has nice restaurants and coffee places/etc. Wish I didn't have to leave, haha. I will try to find a place here, but inventory is limited, so are there any other parts of Seattle that look and feel like this? I tend to like a little more sophisticated/upscale vs. grunge. (Doesn't have to be too fancy, but like Madison I like nice restaurants and stores.)  
  
Note: I have already checked out Columbia City and didn't like it as much.

Thank you! :) ",0,1738863113.0,Seattle,9,0.43,False
1ij85mq,https://www.reddit.com/r/BreakUps/comments/1ij85mq/still_hurts_almost_a_year_later/,Still hurts almost a year later,"My ex and I broke up almost a year ago. I really thought I was doing better and getting to grips with moving on, but that has all come crashing down recently. Not sure what spurred that on in particular, but I know for certain that trying to get back on the dating scene was a massive mistake, and that was just one coffee date.

We were together for more than 7 years, and lived together for most of that. I still fall asleep thinking of her, and still look for her when I wake up. Plus, she has a big birthday coming up, and I hate that I won't get to celebrate that with her or be the one to make her day special.

I've made a decent amount of progress in the last year, both professionally and personally, but it just doesn't feel important anymore, you know? Kinda like I don't have as much of a reason to succeed. I know I shouldn't have put so much weight on the relationship, but it felt right at the time and I can't change it now.

I don't really know what I'm looking for posting this. We broke up due to different priorities for our futures, and I know she wouldn't want me to contact her. I guess I just felt like venting to the void.",3,1738863112.0,BreakUps,0,1.0,False
1ij84xk,https://www.reddit.com/r/dating_advice/comments/1ij84xk/seeing_a_new_guy_wondering_what_am_i_dealing_with/,Seeing a new guy. Wondering what am I dealing with. Any thoughts or advice welcome.,"Hi everyone!

I would love to have your impressions or thoughts about my story. 

I am in my 40s and he's 50. I met him on a dating app, however I was not in his country and just ""exploring"" the dating field there. 

I had not been dating for a few years, since my last relationship with an avoidant man traumatised me. I have been working on myself since then. And being on my guard. 

So in December, this guy matches with me and comes on really strong, his first message was jokingly asking me to be his last girlfriend. I explained I was just exploring and changed my location out of curiosity. He nevertheless kept messaging me showing a lot of interest in me.I made it clear I only wanted a relationship and he asked me if in the eventuality we would be right for each other if I would move to his country. I responded that was a possibility but would take time to get there.

He is a single dad of 2 teens and was never married. He has had a series of relationships since he separated from their mother, between 1 to 3 years each. We both had a relationship with an avoidant partner, but when I discovered his last attempt with his ex was a few months ago last summer, I felt turned off and told him he was not ready. He insisted and convinced me he already had rebounds and that he wanted someone that would make him happy and not miserable like the avoidant ex.

He said he wanted to come visit me in France soon, he is in Denmark. In the meantime, since we had so much time to get to know one another, I asked questions about what he wanted, his personality type etc. He said he also has an anxious preoccupied attachment style, like me, and tended to be too ""dependent"" in the past. I asked if he has had therapy. There were a few clashes after I expressed that I don't want a partner with female friends, meeting one on one.

This came up after he tried to bring the conversation to more sexual topic and I denied it, to which he responded his female friends talk about everything. This made me uncomfortable and I wondered if he was a player. He also said he had a lot of needs for closeness. After lots of arguing and proving his point, I felt turned off by the tug of war, but he agreed he would respect my preference if we were in a relationship.

  
We started having long phone calls and got to know each other more for many weeks. He was very invested daily, either call or texting. Very sweet and thoughtful. He booked his ticket to fly to Paris and a hotel.

Finally he came visit last week, for 5 days. We were both nervous to meet. The connection felt so good on the phone that I was afraid everything would be different if the chemistry was not there in person.

The first coffee date was lovely and he rapidly kissed me. I felt attracted to him too. He took me on nice dinner dates and it felt good. We became physically intimate. Maybe that was too fast.

There was a weird moment when I realised I don't know his name so I asked him. He was tired in bed and he started joking about being Mr Tired something for a few minutes, I felt suspicious. After that he said he said his name but I kept feeling triggered and asked for his passport (I know that sounds extreme). He wanted to sleep and not talk. I turned the lights back on and he said he didn't want to give it to me because he was afraid I would stalk him online. 

This made me upset and outraged, I confronted the fact that despite we had had sex he was no longer talking about being girlfriend / boyfriend. He said we were dating and not a couple yet. I said I was not on trial period and he must have had bad intentions towards me if he was suspicious about giving me his full name. It became messy and I told him to go back to his hotel.

The next day, he texted me he wanted to see me and talk. I agreed and we met. He said he should not have said that. BUT also felt like I crossed his boundaries and he let it slide (with the opposite sex friends). He said I was unreasonable. I responded that my feelings were valid and part of me, so if he invalided my feelings, instead of finding a resolution, it was a judgment and not helpful for the relationship. I have felt like he is very stubborn and wants to win the argument and can't see my point of view. As if he lacks empathy. And he said he felt criticised by me. Which is true.

We fell back into each other's arms. We spent the last days holding hands, having great sex, going out and he treated me well. I was affectionate and sweet, maybe too much. On the last day, he suggested I would visit him in Copenhagen. I agreed.

The same night we texted briefly but I felt immediately a shift in the communication. No goodnight text no call. I felt like it's ok maybe he needs to process his feelings after being close and meeting the real me. The following day, I only received a text in the evening ""How was your day""; I responded and he took more than 40 minutes to say he was glad to hear that. I asked about his day. NO response. The following morning still nothing. He left me on read. This was never the case before.

He texted at night an emoji 😘. No explanation as to why he left me on read the previous day. No phone call anymore, I decided to ignore that low effort communication.

So now it is 3 days he has left and I feel like I have lost the sweet guy he was before. The communication has changed. It feels like breadcrumbs. I don't feel like chasing, I feel betrayed and disappointed. Is he another avoidant man? A player that got what he wanted? 

Any thoughts or advice would be welcome! Thank you for reading me.  
  
",1,1738863064.0,dating_advice,1,1.0,False
