id,url,title,text,score,created_utc,subreddit,num_comments,upvote_ratio,over_18
1joqx9v,https://www.reddit.com/r/learnprogramming/comments/1joqx9v/lost_in_the_port_forest_a_firewall_management/,Lost in the Port Forest: A Firewall Management Quest,"**Background:** I'm drowning in a sea of VPSs and VMs where I've deployed various services. As my server collection grew (like my unpaid cloud bills), I've encountered the classic ""Where's Waldo?"" but for ports - ""Which service is running on which port on which server in which cluster?"" It's the tech equivalent of losing your car in a massive parking lot.

**My tech toolkit:** Java web development (I can make enterprise apps that require enterprise coffee to use), basic Linux knowledge (I can `sudo` without breaking everything), and some Vue development skills (enough to create UIs that don't make designers cry... much).

1. **Firewall Polyglot:** Must speak multiple firewall dialects (ufw, firewalld, etc.) - like a UN translator but for security rules
2. **Master-Slave Architecture:** Not the database kind, but the ""one server to rule them all"" approach. Master node barks orders, slave nodes report back like obedient digital puppies
3. **Mass Management:** Should handle clusters of machines without breaking a sweat (or breaking the servers)
4. **Port Control:** The ability to open/close firewall ports with the elegance of a digital doorman
5. **Lightweight Champion:** No bloated software here - think ""Olympic sprinter"" not ""sumo wrestler"" in terms of resource usage

If you could enlighten me with development wisdom, I'd be eternally grateful (or at least until my next technical crisis). And if you know any open-source solutions that might save me from reinventing this particular wheel, that would be even more splendid!",1,1743497326.0,learnprogramming,0,1.0,False
1joqwtb,https://i.redd.it/c7l3lfdis6se1.jpeg,"Bill's at London Bridge, £10 inc coffee",,17,1743497266.0,fryup,19,0.76,False
1joqw07,https://www.reddit.com/r/college/comments/1joqw07/out_of_curiosity_how_many_here_completed_high/,"Out of curiosity, how many here completed high school, college, and graduate school without any alcohol, coffee or recreational drugs?","I am especially curious how many double majors, especially in grueling STEM fields, people who graduated with honors, and/or those who landed high-paying jobs they liked after graduation were able to that. ",3,1743497162.0,college,17,1.0,False
1joqvpt,https://www.reddit.com/r/VoiceWork/comments/1joqvpt/season_teaser_style_short_clip_lf_both_male_and/,"""season teaser"" style short clip, lf both male and female voices","Hey guys,

Back with another D&D related hobby voice actor search. First and foremost, if you've messaged me before and haven't gotten a reply, please don't be shy, there were a lot of applicants last time. 

This is a super small one, however. I need about 5 actors, each voicing a single line, and I just want it to be as dramatic as possible. 

I plan to stitch together these clips in rapid succession and offer my D&D players a sort of ""next season/episode preview"" that you see at the end of anime sometimes.

It's all in good fun and I'm confident they'll love it. 

My budget is about 15 USD for the whole batch, so about 3 USD per person. Given that they're 1 short line each, I imagine that's perfectly fine for those who are looking for a super duper quick coffee.

I apologise for those insulted by the price if at all, this is a low budget hobby for me, and purely a fun thing I wanna do for my players.

Feel free to DM me or reply here. 

EDIT: a small edit, while this is a 1 liner because of both the nature of what I want to accomplish and budgeting, I am very open to expanding the single line to a ""cutscene"" in the near future with extended dialogue and subsequently a fitting price for your time and effort.",2,1743497126.0,VoiceWork,0,1.0,False
1joqvia,https://www.reddit.com/r/HeartProblems/comments/1joqvia/m22_abdominalchest_pain/,M22 Abdominal/Chest Pain,"M22 6’1 235 Lifting 5+ yrs Under extreme stress past month related to work and relationship

Going to preface this by saying (i know i’m an idiot) I have vaped since i was 15 and smoke weed regularly. Take cialis for pump for 1 yr. Pre workout/creatine or coffee for 4 yrs. I eat extremely clean, try to only drink water, and limit alcohol to 1-2 times a month. Quit vaping this week for zyn.

March 10-21 / 2025: Experiencing abdominal feeling (extremely dull) on the lower right side and varicocele swelling that caused pain Swelling and pain subsided, but abdominal feeling persisted. Saw primary care doctor and ordered BMP. Slightly elevated lipase that indicated pancreatitis.

March 22/ 2025 Right side abdominal feeling/ beginning to ache. Left side abdominal pain/pressure. Arrived home from work experiencing an “off” feeling for the lack of a better term; throughout my body and chest including pain in my heart/leftarm and palpitations around 6P which caused me to leave my apartment gym after 1 set of curls. I was watching Better Call Saul while eating a pint of ice cream around 11P when i went to use the bathroom. Immediately upon standing up, I had a weird light-headed feeling that wasn’t a normal “standing up too fast” feeling. I walked to the bathroom and felt like I was going to die so i immediately started looking for my phone. Last thing I remember was peeing and the thought of finding my phone before I woke up on my bathroom floor profusely sweating, with my cat on my lap. I got up in a panic and found my phone when i called my brother to take me to urgent care. I looked in the mirror and my left rip was purple, upper right back was scratched and bleeding, and my head was throbbing back/top right. I got to urgent care and had a strange feeling in my entire body especially my abdomen. After an abdomen/renal ct scan with contrast, there was nothing to be found. The doctor did blood work: Low anion gap Low platelet High RDW SD Normal Platelet Negative Abdominal Ct Negative Chest X-ray 
Blood pressure slightly elevated.

Diagnosis: Dehydration…. Referred to primary care.

March 23-31/ 2025 Abdominal pressure has persisted on both sides after shifting to completely organic diet and staying hydrated.

Attempting to get back into gym with pre workout and supplements. Lifts are actually not bad but sometimes my heart will absolutely pound causing me to take long breaks. I still have a constant weird feeling in my lower right abdomen and chest/neck/arm pains that come and go. I get very anxious thinking about it. I saw a cardiologist and i’m picking up my heart right monitor April 1. ECG and stress test later in the week.

I will provide updates",1,1743497099.0,HeartProblems,1,1.0,False
1joqv0p,https://www.reddit.com/r/bologna/comments/1joqv0p/where_to_buy_kimbo_coffee/,Where to buy Kimbo coffee?,Ciao! Where can I buy whole bean Kimbo coffee in Bologna? I tried several big supermarkets in the area but can't find them.,1,1743497033.0,bologna,1,1.0,False
1joquc1,https://i.redd.it/q9d9if5kr6se1.jpeg,FREE DUNKIN 😁,"
Go to Offers in your Dunkin app and use code THISISNOTAJOKE. Good for any size hot, iced or cold brew coffee. Expires 4/8 but make sure you add the code soon. 💙",1,1743496946.0,snacking,0,1.0,False
1joqtyr,https://i.redd.it/uaf15fwer6se1.png,Kilian Black Phantom- Memento Mori- (The Cellars collection),"
Perfume connoisseurs undoubtedly have heard about this fragrances at one point or the other due to the hype this fragrances created in social media platforms. 

Black phantom is part of the Cellars collection from Kilian Hennesy. I had visited Maison des Parfums in Jio world drive and had a chance to try out various kilian fragrances. Black phantom immediately caught my attention. The fragrance is categorised as a gourmand. 

Incidentally gourmands are one of my least favourite categories in perfumery. The notion of smelling edible is beyond my understanding or style. The moment I had sprayed it and had a sniff I was floored. The note of Rum with a combination of coffee and chocolate had elevated it beyond a juvenile feeling of smelling like a cookie or cake. 

This is one gourmand which a mature gentleman can easily pull off. 

The fragrance is linear and doesn't change much from start to finish. The key notes mentioned in the Kilian website are Rum, coffee, chocolate and cyanide. 

The note of cyanide I believe is the note akin to bitter almonds and it does smell that way. 

The fragrance is a combination of slightly boozy airy rum, with a bitterness of chocolate and slightly sweet dusty cocoa rounded off with a note of sugar. 

The fragrance in its dry down is slightly powdery due to heliotrope and a creaminess of sandalwood lingers at the end bringing off a delectable finish. 

It is not cloyingly sweet by any means, the bitterness of toasted coffee and dusty cocoa with sweetness of sugar and airy rum is a beautiful combination and will surely turn heads. 

Performance is good with a noticeable scent bubble for about 7 hours and stays close to skin for 10 hours. 

It is much suited for evening wear for parties, dates or special occasions. Would suit even better on an all black attire or satin based clothing. 

Overall i would highly recommend it to anyone who likes boozy fragrances and no one does it better than Kilian. 

And as the tag line says ""Memento Mori- Remember you must die"". And so I add..
Why don't we enjoy while we last...

An undoubtedly rich, boozy, decadent and luxurious fragrance.",3,1743496900.0,DesiFragranceAddicts,1,1.0,False
1joqtwi,https://www.reddit.com/r/ChatGPT/comments/1joqtwi/better_than_i_expected/,Better than I expected,"https://preview.redd.it/m1ta0fsar6se1.png?width=842&format=png&auto=webp&s=17b3e118880d539dfd50daeb2661583c1843789c

",2,1743496892.0,ChatGPT,1,1.0,False
1joqtuj,https://www.reddit.com/r/MakeNewFriendsHere/comments/1joqtuj/f23_bored_pm_me_to_chat_pst_time/,F23 Bored pm me to chat ? PST time 😎,"Hey! I'm 23 and looking to meet new people around my age (23) from the USA who enjoy similar things. I'm into shopping, visiting art museums, going to concerts, traveling, and trying out new restaurants, coffee spots, and matcha cafes. If you're into any of these or just want to connect and share recommendations, let's chat!",0,1743496885.0,MakeNewFriendsHere,1,0.5,False
1joqtkn,https://www.reddit.com/r/AndrewDitch/comments/1joqtkn/the_rage/,The Rage,Andy's shenanigans make me want to dive through a glass coffee table and then flop around like dying fish in the shards. Anyone else driven to this level of rage by the poopsquatch?,3,1743496845.0,AndrewDitch,0,1.0,False
1joqthc,https://www.reddit.com/r/IndiaCoffee/comments/1joqthc/curious_about_north_east_coffee_estates/,Curious about north east coffee estates,"I wanted to try some arabica coffee beans from north east indian estates. I don't see any estates from that region on Google map. Was just curious because I have done this seamlessly for Chikmagalur region and then roasted the green beans at home. 

Wondering if it would add fresh notes in my coffee palette.

Would appreciate names of any roasteries too. ",1,1743496835.0,IndiaCoffee,1,1.0,False
1joqsk7,https://i.redd.it/5d62omvvq6se1.jpeg,For sale: 300ml Bottled Coffee (Spanish Latte) for only P100 per bottle!,"Our bottled Spanish Latte coffee is only worth P100 per bottle, made to order, and freshly brewed using high quality beans. Pick-up or delivery pin locations are Cavite and Manila. Kindly help a student out by upvoting!
Thank you so much!",2,1743496723.0,classifiedsph,1,1.0,False
1joqrvt,https://www.reddit.com/r/oldcartoons/comments/1joqrvt/tomta_cartoon_i_cant_seem_to_find_anywhere_its_old/,[TOMT]a cartoon I can’t seem to find anywhere it’s old,"
It was a cartoon about a child who has a spaceship that comes from a coffee pot (possibly). In one episode, he visits a flat, 2D planet where he encounters 2D characters that look like CT scans. At the end of each episode, he returns home and goes back to sleep. I can't find any information about this cartoon, and I hope I'm not the only one who remembers it!",1,1743496628.0,oldcartoons,0,1.0,False
1joqqsx,https://www.reddit.com/gallery/1joqqsx,Brasil - Catuai & Bourbon roasting graph,"Hey fellow roasters! I’ve been experimenting on my Aillio Bullet R1 and would love your thoughts on my latest roast profile. I’m working with a Catuai & Bourbon mix from Brazil, trying to keep it lighter while avoiding that dreaded baked flavor.

I’ve attached my roasting graph and a photo of the beans. The roast tastes pretty good, **but I’m curious if there’s something I might be missing**. What roast profiles or development times do you usually prefer for Brazilian coffees? I’ve seen suggestions for a medium-dark roast with a longer development, but I’d love to hear your firsthand experiences and any tips you can share!

Thanks in advance, and can’t wait to learn from your roasting wisdom 😁",1,1743496484.0,roasting,0,1.0,False
1joqq47,https://i.redd.it/chg2zxaxp6se1.jpeg,Coffee Lover,,6,1743496398.0,TheCyberJapanDancers,0,0.88,False
1joqp8p,https://www.wionews.com/entertainment/lifestyle/is-your-office-coffee-adding-to-your-cholesterol-researchers-find-8912360,Is your office coffee adding to your cholesterol? Researchers find...,"Does a good coffee make your day? Are you also someone who sips on the first cup of coffee in the office? Well, then you have some tweaking to do here.",1,1743496293.0,iHeart,0,1.0,False
1joqp78,https://www.reddit.com/gallery/1joqp78,"Super small, coffee bean shaped egg/droppings?","Hello, I’ve been finding this on my floor once in a while now, but it has been occurring more frequently. After I clean it up, it would be back in around the same area in about a day or so. The little specs are dry and feel like dragon fruit dried dragon fruit seeds when you try and pop them. Does anyone know what this is? I believe that it might be droppings of an insect of some sort. I would appreciate it if anyone can help provide some insight on this!!
",1,1743496287.0,insects,8,0.99,False
1joqob8,https://www.reddit.com/r/espresso/comments/1joqob8/how_caffeinated_were_you_on_your_first_days_of/,How caffeinated were you on your first days of owning a new machine?,"Just started the hobby and drinking 3 double shots a day. I’m at a stage where I want to make more but simply can’t consume more. Also, now willing to stop drinking coffee :)",6,1743496189.0,espresso,1,0.88,False
1joqo3b,https://i.redd.it/lxl8mri8p6se1.png,Free coffee Dunkin donuts; use code - thisisnotajoke,,27,1743496164.0,freebies,2,0.94,False
1joqnql,https://i.redd.it/o6g98yy3p6se1.jpeg,FREE DUNKIN 🙌🏼,"Go to Offers in your Dunkin app and use code THISISNOTAJOKE. Good for any size hot, iced or cold brew coffee. Expires 4/8 but make sure you add the code soon. 💙",2,1743496122.0,freebies,0,0.67,False
1joqnjh,https://i.redd.it/dj2bkh71p6se1.png,Tulum to raise their prices from next week,,4,1743496098.0,IndiaCoffee,2,0.75,False
1joqnba,https://i.redd.it/wluufgiyo6se1.png,Free coffee Dunkin donuts; use code - thisisnotajoke,,3,1743496071.0,Freefood,0,1.0,False
1joqna4,https://i.redd.it/rwmujk7xo6se1.png,Coffee at 6 in the morning? Feeling tired for most of the day? Absolutely accurate,,2,1743496067.0,SpongebobMemes,0,1.0,False
1joqn10,https://www.reddit.com/r/PhR4Friends/comments/1joqn10/26_m4m_study_sesh/,26 [M4M] Study sesh?,"I’m planning to study out later in the South and thought it’d be nice to have an accountability buddy. Preferably someone who’ll be busy too - no pressure to talk, just a shared space to focus on our own work. Maybe some occasional conversation to keep our brains from overheating. I’ll be heading to a coffee shop around 7 PM and staying until late.

About Me:

5’9, mestizo, confident in my looks. Feminine in expression, masculine in fashion and character - fluid overall.

About You:

Someone who can be busy with me.",1,1743496032.0,PhR4Friends,0,1.0,False
1joqmi4,https://www.reddit.com/r/Netherlands/comments/1joqmi4/im_barista/,Im barista ☕️,"Searching for work in coffee shop that can help me to get sponsorship work visa in. Netherland. France . Or wherever in Europe .
Bcuz im stuck in Algeria 🇩🇿 my country without finding work . like my job i love it by the way 🤍
So im 21 years young men how have ambition hope U can help me guys 
Working This job is part of my dream 🤍",0,1743495967.0,Netherlands,10,0.15,False
1joqlp4,https://www.reddit.com/r/imigrantesroad/comments/1joqlp4/im_barista/,Im barista ☕️,"Searching for work in coffee shop that can help me to get sponsorship work visa in. Netherland. France . Or wherever in Europe .
Bcuz im stuck in Algeria 🇩🇿 my country without finding work . like my job i love it by the way 🤍
So im 21 years young men how have ambition hope U can help me guys 
Working This job is part of my dream 🤍",1,1743495861.0,imigrantesroad,0,1.0,False
1joqlkw,https://www.reddit.com/r/Advice/comments/1joqlkw/help_how_do_i_deal_with_my_bi_polar_mom_in_this/,Help! How do I deal with my bi polar mom in this situation?,"I F 22 am moving out of my house to live with my boyfriend because I can’t stand living in a constant state of stress anymore. TW: neglect, emotional abuse?

Context:
Here’s the sob story but to give you an idea of what she’s like. Growing up I was emotionally neglected as a child because my younger sibling was born with a medical condition that required he have more attention. I went from being an only child to non existent practically and expected to raise him and keep him from getting into trouble at the age of 6 and up. My mom used to yell at me a lot and go off on me for little things all the time. If I accidentally spilled something, if the coffee machine didn’t work. 

It was my fault. My feelings have always felt they didn’t matter and I have always been asked by my father to put my feelings aside for my mother. If I was upset with her and would cry she would cry and then I would comfort her. There were a lot of times she would cry and I would be comforting her I felt like I was raising my mom. She’s also said a lot of nasty things to me in the past but then will deny saying them and claim she would never say something like that 

For example: when I got diagnosed with autism (as an adult) she told me one morning “you know I thought when you were having issues with friends they were the problem but now I think you were the problem”. 

Also when they got me a car I make payments on and I moved out the first time my dad told me “we got you the car so you could take your brother to school in the morning so your mom didn’t have to not so you could move out”.  

I’m moving out again and this time with my boyfriend and I know she is going to have a meltdown. My dad has even said so. 

What is the best way I can deal with this and navigate the conversation with her? I stress a lot about her saying hurtful things. I think she’s going to argue about us not being married they’re religious I’m not. And argue with me that I’m choosing him over my family. 

I also think she’s going to escalate escalate escalate. And advice is really appreciated. ",1,1743495846.0,Advice,0,1.0,False
1joqk4f,https://www.reddit.com/r/Vancouver4Friends/comments/1joqk4f/are_there_any_libertarians_out_there_38_m/,Are there any libertarians out there? 38 M,"I have wondered what would it be like to hang out with other libertarians?

38 M here, would like to meet for coffee and talk",3,1743495671.0,Vancouver4Friends,3,1.0,False
