id,url,title,text,score,created_utc,subreddit,num_comments,upvote_ratio,over_18
1q579pw,https://i.redd.it/j2n9kcqncnbg1.jpeg,"""Welcome to your local convenience store. How can I help you?”","
“You can start by putting the money in fucking bag Rac bitch!”

Kas was struck by the butt of the shotgun the robber had. She fell to the floor hard, her nose bleeding. 

A panic scream came from the snack section as a small Mosulin girl dropped everything she was holding to stack the shelves. 

The robber, a tall angler fish-like alien with dark black scales, rows of thin sharp teeth and milky white eyes, looked at the sacred mosulin girl and barked orders to her.

“Get over here and get on the ground!” He pointed the shotgun at her.

Panic, the mouslin obeyed his orders. He then focused back on the Rac manager and shouted at her once more to open the register and hand over the money. 

A sound of someone grabbing things off the shelf came next to the fish man and he groaned with annoyance. 

“Bilg, stop looting the snacks and go grab the safe from the back!” 

A skinny eel-like alien stopped what it was doing and hissed. 

“Im hungry boss, plus free Gong bars always taste best when stolen.”

“If it were not for the fact that you are my brother I would shoot you here and now. Now go get the safe in the back you idiot!” 

Kas turn to look at the Mouslin girl. 

“Jenny, you put a fresh coffee on when I asked you to?” kas asked holding her bleeding nose.

“Y-yes w-why?” Jenny squeaked.

“Good, the humans will be needed soon.” kas smiled.

The angler fish alien looked down at Kas and saw her smile.

“Why are smiling fur ball?” He would press the barrel of the shotgun to her chest.

“You are robbing a store protected by blitz security. The humans are on their way right now or just outside.”

The fish man's blood dropped cold. And the eel alien stopped what he was doing and looked at his boss.

“B-b-boss, we're robbing a human protected store! We gotta go now!”

Kas just laughed, “It's too late, friend.”


Art done by:https://x.com/bearsockz
",12,1767669396.0,humansarespaceorcs,1,0.75,False
1q57948,https://i.redd.it/ouzavc2jcnbg1.png,"This is, non-ironically, my test👌🏻","I eat whatever you give me as long as it's edible, and surprisingly, I'm skinny asf. ",5,1767669352.0,TeenagersButBetter,3,0.86,False
1q5789b,https://www.reddit.com/r/NLUs/comments/1q5789b/in_search_of_fellow_law_studs_from_other/,In search of fellow law studs from other Universities who'd wanna chill together or maybe get connected...,"Hey guys, thanks for the love y'all showed on my earlier post..... I'm in search of peeps from other Unis who'd like connecting and maybe confabulating w me over a cup of coffee? Lol. Just wanted to get to know y'all and interact daily so as to make a few amazing connections. Hmu if y'all wanna catch up 💪🏻🫴🏻

( Do upvote this, lol 🫠😝 )",3,1767669288.0,NLUs,3,0.8,False
1q5785s,https://www.reddit.com/r/SideProject/comments/1q5785s/can_an_algorithm_guess_your_life_story_based_on/,Can an algorithm guess your life story based on your pizza preference? I built an app to find out.,"Hey everyone,

I’ve been obsessing over simple binary choices lately (Coffee vs. Tea, Dark Mode vs. Light Mode, etc.).

I had a hypothesis: Can an algorithm predict random facts about a person based solely on their answers to these trivial ""This vs. That"" questions?

To test this, I built a service that runs calculations on user choices to see if there are hidden correlations in the data. Basically, I'm trying to see if knowing your preference for ""Pineapple on Pizza"" can actually help a model predict other random demographic facts or habits.

It’s a fun side project/experiment, but I’ve put some work into the backend logic.

I’d love for you guys to try it out and roast the predictions (or the UI).

[https://alocalo.com](https://alocalo.com)",38,1767669280.0,SideProject,7,0.91,False
1q5783q,https://i.redd.it/qovghtsacnbg1.png,Coffee tea or meeeee I'm a cutie,,5,1767669276.0,FemboySafeSpace,0,1.0,False
1q577sv,https://www.reddit.com/r/TalesFromTheCreeps/comments/1q577sv/rose_thorns_chapter_3/,Rose thorns chapter 3,"Lucy leads me back to bed and I fall asleep again. No thorns. No caves. No stalagmites. No beam of light. No monster. Nothing.
Instead I dream about some twins talking in reverse and a cup of frozen coffee.
I wake up to Lucy handing me the opposite and sitting on the edge of the bed.
“You slept better this time,” she says, rubbing my head like she lost something in my hair.
I nod, sip the coffee, and glance at the clock.
I nearly burn my sinuses out my nose when I see it’s noon.
“Fuck. I’m supposed to be helping Jack with his truck two hours ago.”
Lucy and I sprint through the house, grabbing the clothes I stripped off last night. I nearly trip out the front door, kissing her as I pull on my left boot.
I drive through the now-alive town while Simon Le Bon tells me he gets high off perfume or something. I stop at a red light and stare into the woods.
The peak of the mountain where the caves live rises above the trees, peeking out like it’s spying on Thorn Hollow. The whole town could fit inside it and still have room for another one.
I break eye contact when someone guns it past me, trying to beat the Hamburglar to McDonald’s.
I pull up to Jack’s with a peace offering from Debbie’s. Hopefully that smooths things over.
I call into his garage, where the dead body of his truck sits—older than half the town.
“Dave! I’m on the roof. Thank God you’re here, boy.”
I shield my eyes from the sun and spot Jack waving like he’s been stranded on an uncharted island for years.
“Why the hell are you on the roof, old man?”
He flips me off and holds up a wrench.
“Found my wrench up here again. Fuckin’ thing moves I swear.”
I shake my head.
“The ladder fell. I've been up here since eleven. Get it standing before I turn into Jack jerky.”
He points to the left side of the garage. I head over.
The ladder looks like someone had four quarters and enough nails to stick a tank to a wall.
“Jesus, Jack. I’m gonna get tetanus just looking at this thing.”
“Oh shut the fuck up before I drop like your balls should’ve.”
I chuckle and lift the ladder like it’s a World War II mine about to go off, setting it against the garage. Jack slides down like he isn’t sixty-five and immediately grabs the bag of donuts.
“Better be jelly, David.”
I nod. He smacks my back. I wince.
“Hey, elder you forgot the wrench.”
He frowns so hard his eyes turn into eyebrows.
“Well shit. You grab it. I’ve been up there for hours because you wanna be fat and grab donuts.”
He sucks jelly off his thumb.
“I’ve got one in my tool bag. I brought it from a late call last night.”
He waves his donut at me. I go to the truck and carry my bag into the garage and we get to work. Mostly he hands me tools and tells me stories about races he won with this carcass.
I ask for my pliers.
He doesn’t hand them over.
“You lose your hearing, old ma—”
I stop. Jack’s face is wrong. His wrinkles don’t fold the way they should.
“David,” he says quietly. “Where did you get this?”
He’s staring at the hook from last night. It shimmers under the light of his garage.
I forgot to show Frankie. The jelly donut distracts all.
“I forgot it was in there. Some spike lodged in a gas line from a late-night call.”
His eyes lock onto it.
“I haven’t seen anything like this since I was your age. I don’t remember how—but I’ve seen this.”
His hands shake. He pulls the pliers apart, lets the hook fall back into my bag, and hands them to me.
I stare at him.
“You tryna kiss me or what, boy?”
I chuckle.
“You’re sick. Get back on your meds.”
We work a while longer until I hit a bolt I can’t loosen with anything I’ve got.
“I can’t get this one, old man. What size is it?”
He studies the engine, then stares at the ceiling.
“It’s not in your bag. It’s on the roof. I stole it last week when you were here.”
I press my palms into my cheeks and groan.
“You klepto. You could’ve just asked.”
He shrugs.
I grab my ladder from the truck and lean it against the garage.
It’s not tall enough.
“Jack, grab my tool bag I need my gloves to climb your damn lad—”
He shoves the bag into my chest. He already has it.
I snatch it back, and push him away,  I pull on my gloves, and plant the ladder. Every step creaks and bends like it’s arguing with my boots.
I look down at him, teeth clenched. He gives me a thumbs-up.
“You’re doing great, boy. Built that thing before your daddy fucked your mom.”
“No shit,” I mutter.
I roll onto the roof like I climbed Everest.
“Grab the wrench before I die of old age!” Jack yells.
I toss it down, then glance toward the mountain again. The sun dips behind it. Something flickers near the base—like fire.
“C’mon, you big pussy,” Jack shouts.
I breathe out and step toward the ladder.
“Oh wait, David don’t step there, it’ll—”
The rung snaps.
I fall through the ladder and slam onto my tool bag. The air rips out of my lungs. My spine cracks. I make a noise like a kid squeezing a rubber chicken too hard.
Jack says something I can’t hear, then laughs like I didn’t fall 20 feet.
I roll off the bag and suck in my first breath.
“Mmmfuck you, old man.”
He laughs harder until a two-by-four smacks him in the head.
I scramble over to him. He’s rubbing his skull, and I laugh at him then points at my waist.
“David… you’re bleeding.”
I look down.
The hook is sticking through my hip, coming from the back it.
",1,1767669253.0,TalesFromTheCreeps,1,1.0,False
1q576e2,https://www.reddit.com/r/TheIronCouncil/comments/1q576e2/the_psychology_of_dark_persuasion_sciencebased/,The Psychology of Dark Persuasion: Science-Based Tricks That Actually Work (Use Wisely),"You've noticed it, right? Some people just seem to have this invisible superpower. They walk into a room, and everyone leans in. They ask for something, and people say yes without thinking twice. They navigate social situations like they're playing chess while everyone else is playing checkers.

Here's what nobody tells you: It's not charisma. It's not luck. It's psychology. And yeah, some of it lives in the grey zone between influence and manipulation. I've spent months digging through research papers, binge-watching behavioural psychology content, and reading everything from Robert Greene to modern cognitive science studies. What do I find? These tactics work. They work really well. But they come with a responsibility label.

The thing is, understanding these mechanisms isn't about becoming a manipulative asshole. It's about recognising when they're being used ON you, and occasionally leveraging them ethically when it matters. Society's already using these tricks on you through advertising, social media algorithms, and political campaigns. You're swimming in psychological manipulation daily. Might as well understand the water you're in.

Step 1: Master the Power of Silence

Most people are terrified of silence. Like, genuinely scared of those awkward pauses in conversation. Here's the trick: Stop filling the void.

When you ask someone a question, and they give you a half-answer, just sit there. Don't nod enthusiastically. Don't jump in with your own story. Just maintain eye contact and wait. The psychological discomfort of silence will literally force them to keep talking and often reveal way more than they intended.

FBI negotiators use this constantly. Chris Voss talks about it in “Never Split the Difference” (the dude literally negotiated with terrorists for a living; this book is insane for understanding human psychology). He calls it ""tactical empathy"", but really, it's weaponised silence. People will confess, elaborate, or backtrack just to escape the tension.

Try it in your next salary negotiation. State your number, then shut up. Whoever speaks first usually loses.

Step 2: The Foot-in-the-Door Technique (Getting People to Say Yes)

This one's backed by solid research, and it's almost stupid how well it works. You want someone to agree to something big? Start by getting them to agree to something tiny first.

Ask your roommate to help you move one box, not the whole apartment. Once they've said yes to the small thing, they're way more likely to help with the bigger task because humans hate cognitive dissonance. We want to see ourselves as consistent. If I helped you with one box, I must be a helpful person, so I'll help with more boxes.

Robert Cialdini breaks this down in **Influence: The Psychology of Persuasion**. Dude's research at Arizona State basically created the blueprint for every marketing campaign you've ever seen. The book reads like a manual for understanding why you bought that thing you didn't need. Fair warning, though, after reading it, you'll see these tactics everywhere, and it's kinda creepy.

This works in dating, sales, friendships, everywhere. Start small. Build momentum.

Step 3: Mirroring (Become Their Psychological Twin)

Your brain is wired to like people who are similar to you. It's tribal instinct stuff. So when someone mirrors your body language, speech patterns, or energy level, your subconscious reads them as ""one of us"" and drops its guard.

Here's how to do it without being obvious: Match their speaking pace. If they talk slowly and thoughtfully, you slow down too. If they're animated and loud, bring your energy up. Subtly mirror their posture after a 2-3 second delay. Cross your legs when they cross theirs. Lean back when they lean back.

The research on this is wild. Studies show that waiters who mirror customers get bigger tips. Negotiators who mirror body language close more deals. It creates this subconscious rapport that words alone can't achieve.

But don't be a robot about it. The keyword is subtle. You're not doing a mime performance.

Step 4: Strategic Vulnerability (The Pratfall Effect)

Here's something that sounds backwards but works like magic: Showing small, controlled weaknesses makes people trust you more.

It's called the Pratfall Effect. Psychologist Elliot Aronson discovered that highly competent people who make small mistakes are actually rated as MORE likeable than those who appear perfect. Your brain sees perfection as threatening or fake. But someone who's mostly got their shit together AND admits they burned dinner or forgot someone's name? That person feels real.

The trick is strategic. You're not trauma dumping or showing major character flaws. You're showing minor, relatable imperfections that humanise you. ""I'm terrible with names"" or ""I always forget to water my plants"" makes you approachable while maintaining competence.

Politicians use this constantly. CEOs do it in interviews. Even your favourite podcaster probably deploys this without thinking about it.

Step 5: Anchoring (Control the Frame of Reality)

Your brain is lazy. When it encounters new information, it grabs onto the first number or piece of data it sees and uses that as a reference point for everything else. This is called anchoring, and once you see it, you can't unsee it.

Want to sell something? Start with a high anchor. ""This usually goes for $500, but I'm offering it for $250."" Even if $250 is the actual value, people will perceive it as a deal because you anchored them at $500.

Salary negotiations? Never give your number first if you can avoid it. But if forced, anchor high. If you want $80k, say $95k. Now $80k feels like a compromise, and they feel like they won.

Daniel Kahneman won a Nobel Prize partly for his work on this stuff. “Thinking, Fast and Slow” is the book, but heads up, it's dense as hell. Worth it though. You'll understand how your brain constantly tricks you into bad decisions.

Step 6: Reciprocity Weaponised
 
Do something for someone, and they'll feel psychologically obligated to return the favour. It's hardwired. Anthropologists think reciprocity is one of the foundations of human civilisation.

But here's the dark part: The favours don't have to be equivalent. You buy someone a coffee, and they feel obligated to help you move. You give someone unsolicited advice, thand they feel like they owe you something.

This is why free samples work. Why sales salespeople bring you water during a pitch? Why cults lovebomb new members with overwhelming kindness. The recipient feels debt.

Use this ethically. Do genuine favours without keeping score. But understand that when someone does you an ""unsolicited favour there might be strings attached.

Step 7: The Illusion of Choice

Give people options, but frame them so all choices lead wheto re you want. Parents do this with kids. ""Do you want to wear the red shirt or the blue shirt?"" The kid feels autonomous, but going shirtless was never an option.

Salespeople do this constantly. ""Would you prefer the premium package or the standard?"" Notice how ""neither"" wasn't offered as a choice.

Frame your requests as choices between two yeses instead of yes or no. ""Should we meet Tuesday or Thursday?"" beats ""Want to meet up?"" The first assumes the meeting will happen and just negotiates details.

Step 8: Scarcity and FOMO (Fear Runs the Show)

Limited time. Only 3 left. Exclusive access. Your brain's threat detection system goes haywire when resources appear scarce. Even if you don't want something, scarcity makes you want it.

Every marketing campaign uses this because it works. But you can use it too. When setting boundaries, make your time or attention appear limited. ""I can only meet for 30 minutes"" makes people value that time more than ""I'm free all day.""

But real talk, if you're using scarcity to manipulate people into bad decisions, you're just being an asshole. Use it to protect your actual limited resources.

Resources for Going Deeper

If this stuff clicks and you want to keep learning, there are some solid resources that'll take you further down the rabbit hole.

BeFreed is an AI-powered learning app built by former Google engineers that turns books, research papers, and expert interviews into personalised content. You type in what you want to learn, like improving negotiation skills or understanding dark psychology, and it pulls from high-quality sources to create custom podcasts for you. 

The depth control is clutch. Start with a 10-minute overview of a book like Influence or Never Split the Difference, and if it hooks you, switch to a 40-minute deep dive with examples and context. You can pick different voices too; some are weirdly addictive, like this smoky tone that makes dense psychology research way easier to absorb during commutes. The app also builds an adaptive learning plan based on your goals, so it's structured instead of random.

Books worth the time: “Never Split the Difference” by Chris Voss is street-level tactical. Influence by Cialdini is the research bible. “Thinking, Fast and Slow” by Kahneman is dense but rewarding. “The 48 Laws of Power” by Robert Greene, if you want the full Machiavelli experience.

These tactics work because they exploit how human psychology actually functions, not how we wish it worked. Silence creates pressure. Small agreements lead to big ones. Mirroring builds unconscious rapport. Strategic vulnerability increases trust. Anchoring controls perception. Reciprocity creates obligation. False choices guide decisions. Scarcity triggers fear responses.

The thing is, knowing this stuff is defensive as much as offensive. You'll start noticing when car salesmen use anchoring on you. When your boss uses scarcity to pressure you. When dating apps use variable rewards to keep you swiping.

Use these wisely. Or don't use them at all. But at least now you know when someone's using them on you.",1,1767669150.0,TheIronCouncil,0,1.0,False
1q576c3,https://www.reddit.com/r/JamesHoffmann/comments/1q576c3/currently_in_colombia/,Currently in Colombia,What coffee beans MUST I bring home? I am partial to dark roast coffee. Thank you!,1,1767669146.0,JamesHoffmann,3,0.67,False
1q574ry,https://www.reddit.com/r/mokapot/comments/1q574ry/how_many_grams_of_ground_coffee_in_a_6_cup_moka/,How many grams of ground coffee in a 6 cup moka pot?,"I keep seeing suggestions that the 6 cup moka pot should be between 27-30gs. I just got my first moka pot this holiday. So far I’ve loved it and it has been producing great moka coffee. But I can’t for more than 26g of coffee in. I’ve messed with the grind setting a bit in my Turin df64 and regardless of grind size 26.5 is the most I’ve fit. I know you’re not supposed to tamp the coffee down, but maybe I’m not tamping it enough? How much pressure should I be putting on the grinds? ",0,1767669028.0,mokapot,2,0.5,False
1q574es,https://www.reddit.com/gallery/1q574es,Coffee Comic,[https://www.pixiv.net/en/artworks/82107520](https://www.pixiv.net/en/artworks/82107520),16,1767669001.0,Helltaker,0,0.95,False
1q573of,https://i.redd.it/4y1uhn2f7lbg1.png,Coffee Date with Mina,,1,1767668945.0,AiWholesome,0,1.0,False
1q573jb,https://www.reddit.com/r/juliagpt/comments/1q573jb/i_want_to_write_to_someone_i_met_on_bumble_that/,I want to write to someone I met on Bumble. That im not interested on a date,"I want to write to someone I met on Bumble, and now we communicate through Instagram. The first time he asked me out, we happened to be in the same place on vacation a month ago, but he asked if I had anything to do at 2 AM, and obviously, I did not respond.

Now he's actually asked me out for a coffee date on a Friday, but after two months of following each other on Instagram. How can I write to him that he's been taking so long, and I've lost interest? I don't want to write anything long. I just want him to understand that I'm not interested anymore because I'm more direct, and I like it when people don't beat around the bush. If he wants to hang out, it would be as friends.

I don't want to ghost him, but I don't want to go knowing that I'm not actually interested. I was initially, but not now.",1,1767668934.0,juliagpt,1,1.0,False
1q572xy,https://www.reddit.com/r/SwordAndSupperGame/comments/1q572xy/crack_cocaine_coffee_in_the_fields/,Crack cocaine coffee In the Fields,This post contains content not supported on old Reddit. [Click here to view the full post](https://sh.reddit.com/r/SwordAndSupperGame/comments/1q572xy),2,1767668888.0,SwordAndSupperGame,0,1.0,False
1q572v0,https://www.reddit.com/r/ChillSG/comments/1q572v0/looking_for_likeminded_friends/,Looking for like-minded friends!,"Hello, 30M here. I think one of my new year resolutions is to broaden my social circle and also hopefully find some like-minded friends!
Some of my interests:

1) Running
2) Gym
3) Watching NBA, Netflix, Anime
4) Cafe Hopping (I'm very much into coffee)
5) Enjoy music and singing
6) Fashion! Recently started a fashion based insta account. Trying to do something new this year!
7) Travelling to Japan. Hope to visit every prefecture one day, and I speak Japanese. Would be nice to find some people to travel with to!",3,1767668883.0,ChillSG,4,1.0,False
1q5722u,https://www.reddit.com/r/ForeverAloneDating/comments/1q5722u/27_m4f_online_seeking_a_real_longterm_relationship/,"27 [M4F] #Online | Seeking a real, long-term relationship","I've learned how to be happy by myself, but I think some moments are meant to be shared.

Hey. There is a lot I could say about myself, but the most important thing is that I stay grounded for the people I care about. I live a sort of quiet life, with my writing and drawing, but recently I have found enjoyment in small adventures.

A perfect relationship for me is one where we support each other and still know how to play and tease. If we ever run into bumps, I may take a little time to collect myself, but after I always come back ready to listen. We can spend our time enjoying our hobbies, co-oping games, or going out on calm but fun dates like cafés or arcades. A night just cuddled up on the couch laughing or enjoying each other's presence is perfect to me.

The woman I'm looking for is a passionate one, the type who can go on and on about the things she enjoys. I always find myself falling for the shy and introverted girls with nerdy hobbies and strong values. I’m most drawn to a cute, girl next door type: expressive eyes, a warm smile, and a slim or active build. Not some perfect model, but not just anyone. I fall for someone who is kind to others, is loyal to the ones she loves, and is just as picky as I am on who she lets into her life.

A side note, Final Fantasy is my favorite series (obviously), and I'm aiming to cosplay Cloud in con season. So if you think you can rock a good Tifa, Aerith, or even Yuffie, then you're my type. If you've got other ideas, feel free to say them. Yeah, we'll be the couple that gets others inspired.

Indiana based, open to long-distance in USA only for now. Only interested in a long-term relationship for dating, not into anything casual. Preferably around age 20-27. We can swap pics early to see if there's a spark. If we're nearby, let's plan a coffee date and see where it goes.

Me: https://imgur.com/gallery/pics-of-me-u85QaBG",0,1767668823.0,ForeverAloneDating,1,0.5,False
