id,url,title,text,score,created_utc,subreddit,num_comments,upvote_ratio,over_18
1g8neg7,https://www.reddit.com/r/nosleep/comments/1g8neg7/i_should_have_stayed_in_bed/,I Should Have Stayed In Bed,"

My eyes blinked open to the soft, pale glow of the morning light filtering through the curtains. I lay still, my body sunken into the familiar dip on my side of the bed, the weight of sleep lingering in my limbs. The silence was comforting, and I reached across the mattress, expecting to feel the warmth of my wife beside me.

Her side was empty.

I frowned, my fingers brushing the cold, undisturbed sheets. Lisa never woke before me on her days off. I pushed the thought aside, trying to shake off the lingering fog of sleep. Maybe she’d gone to the bathroom or been called into the ER last minute. They were always short-staffed these days.

I glanced at the old wooden clock hanging above the dresser.

6:17 AM.

Too early for Lisa. My stomach knotted with unease, but I told myself not to worry yet. Maybe she was downstairs, making breakfast. I sat up, rubbing my eyes, and was greeted by Middow, our cat. He wove between my legs, his purring loud and insistent. I reached down to stroke him absentmindedly before stumbling into the bathroom, the chill of the house creeping into my skin.

The stillness of the house unnerved me as I splashed cold water on my face. The only sound was the soft hum of the heater kicking on, filling the empty spaces with a mechanical, distant drone. I pulled on my housecoat and headed down the dimly lit hallway, Middow at my heels.

Coffee first. 

The thought was comforting—routine. I moved toward the kitchen, but something stopped me.

Middow’s bowl was empty. Strange. Lisa was always the first to feed him in the mornings. A flicker of confusion passed through me, and my gaze fell on her purse, hanging from the back of the kitchen chair. Her car keys were still on the rack by the front door.

A sense of unease prickled at the back of my neck. I crossed the room to the living room window, brushing aside the heavy curtains. The landscape outside was barren under the pale winter sky, the frost glistening in the early morning light. Lisa’s car sat in the driveway, untouched.

“Babe? You home?” I called, my voice sounding hollow in the stillness.

No answer.

I fed Middow, his purring louder than ever, as the coffee maker began its slow drip. I waited, tapping my fingers against the counter, trying to shake the creeping dread building in my chest. Something was off. I grabbed my phone from the bedroom, hoping for a message. Nothing. I hit the call button, but my heart sank when I heard her ringtone—a familiar melody vibrating from her nightstand.

She hadn’t taken her phone.

Now the worry set in, sharp and sudden. I threw on yesterday’s clothes, my fingers fumbling as I laced up my shoes, and stepped outside. The cold air hit me like a slap, biting through my thin layers. The house stood alone on the outskirts of town, fields and forest stretching for miles. There was no movement—no sound but the whistle of the wind through the trees.

Then I saw her.

Lisa stood at the far edge of the property, just before the dark line of trees that bordered our land. She was still in her pajamas, her thin silk nightgown a stark contrast to the frozen landscape. Her back was to the forest, facing me, unmoving.

“Lisa?” I called, my voice quivering slightly. “What are you doing? It’s freezing out here!”

She didn’t move. She didn’t respond.

I took a few steps toward her, my heart pounding harder with each one. A strange sense of dread clawed at my chest.

As I approached, she began to move—backward. She was still facing me, but her steps were slow, deliberate, retreating into the shadows of the forest. The trees seemed to swallow her whole.

“Lisa!” I yelled, breaking into a run. “Wait! Stop!”

She disappeared into the trees.

I stopped at the edge of the forest, the towering pines looming overhead, casting long, dark shadows across the frozen ground. The cold felt sharper here, biting deeper, as if the forest itself was colder than the rest of the world.

I hesitated, my breath clouding the air in front of me. Everything about this was wrong. Lisa hated the cold. She wouldn’t wander into the woods in a nightgown, not in this weather.

I took a deep breath and stepped forward, crossing the threshold into the trees.

The world changed instantly. The sounds of the wind and the distant hum of the house disappeared, replaced by an oppressive silence. My footsteps were muted on the frozen ground, the air thick with an eerie stillness.

“Lisa?” I called, my voice small in the vastness of the woods.

No answer. The trees crowded in on me, their dark branches like twisted fingers reaching toward the sky. I moved deeper, my eyes straining to see through the thick underbrush. Every shadow seemed to shift, every tree standing like a silent, watching sentinel. The cold bit through my clothes, but I pressed on, my pulse quickening with each step.

Then I heard it—a voice, soft and distant, carried on the wind.

“…Edgarrrr…”

I froze. It was Lisa’s voice, but something about it was wrong. Too delicate. Too close.

“Lisa?” I called, spinning around. “Where are you?”

The silence pressed in, thick and suffocating. Then, once again, the voice came.

“…Edgar, this waaay…”

The voice echoed from deeper in the woods, sending a shiver down my spine. Without thinking, I ran toward it, the panic now fully taking hold. Branches whipped at my face, roots seemed to rise up from the ground, snagging my feet and tearing at my clothes. The cold air burned in my lungs as I stumbled through the forest.

Finally, I broke through the trees into a large clearing. The ground was frozen, barren, and lifeless, the trees forming a circle around me like towering sentinels. At the far edge of the clearing, I saw her—Lisa. She was hunched over, her back to me, her nightgown streaked with dirt and blood. Her shoulders shook with soft, pitiful sobs.

“Lisa?” My voice cracked, tears of relief welling in my eyes.

Before I could take a step, my phone buzzed violently in my pocket. Startled, I pulled it out and glanced at the screen.

It was Lisa’s number.

A cold wave of confusion and dread crashed over me. I looked from the phone to the figure in the clearing, my heart pounding in my ears.

With a shaking hand, I answered. “H-Hello?”

“Edgar?” Lisa’s voice came through, frantic and full of fear. “Where are you? I’ve been trying to call you for hours!”

My throat tightened. “What? I’m… I’m in the woods. Where are you?”

“I’m at home!” she cried. “I went out for breakfast with Lacey, and when I came back, you were gone! I’ve been calling and calling!”

I stared at the figure in the clearing, still sobbing, still covered in blood.

My mind reeled as I struggled to make sense of what was happening. “Lisa… if you’re home… then who…?”

The line cut out, the phone in my hand going dead as the battery drained in an instant. I stared at the dark screen, a cold sweat breaking out across my skin.

The sobbing stopped, but was replaced with a soft, creeping giggle.

Her arms hung at strange angles, twisted and contorted unnaturally. She took a step backwards towards me, then another, her body jerking and spasming with each movement.

“Run,” she whispered, her voice no longer human.

I didn’t wait. I turned and ran, my feet barely touching the ground as I tore through the forest. The laughter echoed behind me, growing louder and more hysterical, a sound that chilled me to my very core. My heart pounded, my breath came in ragged gasps, and still, I ran, faster than I ever thought possible.

Branches lashed at me, roots tripped me, but I didn’t stop. I could hear her—no, it—closing in, its twisted limbs crashing through the underbrush, its laughter ringing in my ears.

Finally, the edge of the woods came into view. I threw myself through the trees and collapsed onto the frozen grass, gasping for air.

When I opened my eyes, I was surrounded by paramedics, friends, and Lisa. The real Lisa. She was holding my head in her lap, her face streaked with tears.

They told me I’d been missing for six hours.

I said nothing. I couldn’t explain what had happened. No one would believe me if I tried. So I told them I didn’t remember anything after making coffee that morning.

But I know what I saw.

They kept me in the hospital for a few days, running tests and scans of my brain to make sure my “breakdown” wasn’t related to something serious. 

When the tests came back clear, I was prescribed some medication and ordered to see a psychiatrist once a month for three months. And then they sent me home with a note granting me one month of paid leave from work.

Lisa took a couple of weeks off of work to stay with me. She never left my side. Wherever I was, she was. Admittedly, it was hard looking at her the same way after what happened. I felt paranoid, uneasy. Terrified that whatever chased me through the woods was still out there, just waiting for me to come back.

Or maybe it would come for me in the night.

I hardly sleep anymore. I spend my nights listening to the ticking clock above the dresser while who I think is Lisa sleeps soundly next to me.

A few days ago, I was in the basement doing the laundry. It’s a chore that both Lisa and I tend to procrastinate on. I pulled out an armful of dirty clothes from the overflowing laundry basket and stuffed them into the washer. 

I looked back into the basket and froze. In the bottom of the basket was Lisa’s nightgown—the same one that thing had been wearing in the woods. An awful feeling blanketed over me as flashbacks filled my head.

It became worse when I reached in and pulled it out.

Her nightgown was tattered and torn, stained with dirt and dried blood.",1,1729510130.0,nosleep,1,1.0,False
1g8nees,https://i.redd.it/jgd4jlijh3wd1.jpeg,Vintage Inspired Cushion Case Design Interest Check - Aventor Watch Co,,0,1729510126.0,MicrobrandWatches,11,0.5,False
1g8ndm7,https://www.reddit.com/r/NIOCORP_MINE/comments/1g8ndm7/niocorp_us_critical_nminerals_administration/,#NIOCORP~ U.S. CRITICAL NMINERALS~ Administration Proposes to Further Strengthen “Made in America” with Shortest Exception List in History & a bit more... ,"# OCT. 21st , 2024 ~Administration Proposes to Further Strengthen “Made in America” with Shortest Exception List in History

***Today’s announcement is the latest action in the Biden-Harris Administration’s historic efforts to strengthen “Made in America”.  In the first week of the Biden-Harris Administration, President Biden signed an Executive Order on Ensuring the Future is Made in America by All of America’s Workers, launching a whole-of-government initiative to strengthen the use of Federal financial assistance and Federal procurement to support American manufacturing.  In addition, the Biden-Harris Administration enacted landmark legislation to invest in America—legislation the last administration failed to pass—which has catalyzed nearly $1 trillion in investments in domestic manufacturing and clean energy to date.***

[Fact Sheet: Biden-Harris Administration Proposes to Further Strengthen “Made in America” with Shortest Exception List in History | OMB | The White House](https://www.whitehouse.gov/omb/briefing-room/2024/10/21/fact-sheet-biden-harris-administration-proposes-to-further-strengthen-made-in-america-with-shortest-exception-list-in-history/)

https://preview.redd.it/ty3qv6utf3wd1.png?width=903&format=png&auto=webp&s=6b8fdd69f629b677fa94a133ac2eea78d2da79b4

# SEPT. 21st, 2024 ~US Senate passes Lankford’s bill aimed against Red China’s critical minerals

# [US Senate passes Lankford’s bill aimed against Red China’s critical minerals - Oklahoma Energy Today (okenergytoday.com)](https://www.okenergytoday.com/2024/09/us-senate-passes-lankfords-bill-aimed-against-red-chinas-critical-minerals/)

https://preview.redd.it/ezersz76g3wd1.png?width=300&format=png&auto=webp&s=1f6a872ffceb8db17e4359b84583e9a049c67313

The U.S. Senate passed legislation authored by Senators James Lankford (R-OK), Gary Peters (D-MI), and Mitt Romney (R-UT) to reduce American reliance on China and other adversarial nations for critical minerals.

“The United States should not depend on communist China to keep our critical mineral supply chain running. Relying on China for critical minerals means relying on our adversary for batteries, medical supplies, and military equipment,” said Lankford. “We need to prioritize American-produced energy solutions and give US suppliers a seat at the table.”

Critical minerals and rare earth metals are used to manufacture electric vehicle batteries, military equipment, and other technology that is vital to American economic competitiveness and homeland security. China remains the largest source for more than half of the critical minerals on the US Geological Survey’s [2022 list](https://www.usgs.gov/news/national-news-release/us-geological-survey-releases-2022-list-critical-minerals) that the United States imports, such as lithium and cobalt.

The Senators’ bill would address this threat to our manufacturing supply chains by creating an intergovernmental task force to identify opportunities to increase domestic production and recycling of critical minerals. The bill now moves to the House for consideration.

The Intergovernmental Critical Minerals Task Force Act creates a presidential task force with representatives from federal agencies who must consult with state, local, territorial, and Tribal governments to determine how to address national security risks associated with America’s critical mineral supply chains. The task force will also identify new domestic opportunities for mining, processing, refinement, reuse, and recycling of critical minerals. The legislation would also require the task force to publish a report to Congress and publish findings, guidelines, and recommendations to combat the United States’ reliance on China and other foreign nations for critical minerals.

*Source: press release*

[ QUICK POST WITH SOME RELEVENT NEWS WITH COFFEE THIS AM!](https://preview.redd.it/ai8rwqxcg3wd1.png?width=472&format=png&auto=webp&s=cb675f0433d9c4252e9c2d8126ccf9e413bd3103)

# FORM YOUR OWN OPINIONS & CONCLUSIONS ABOVE:

***Food for thought above, as we continue waiting with many to see ""IF"" Niocorp can get the funds/commitments from interested entities via Debt/Equity to complete/update the 2024 F.S. & build the Elk Creek Project? ALL T.B.D.***

***Staying Tuned....Waiting with many to Engage!***

https://preview.redd.it/aobo6px4h3wd1.png?width=917&format=png&auto=webp&s=3c1d140a91c9cac7e973b663e3999cda1a7fc8bb

https://preview.redd.it/dqj68721h3wd1.png?width=1080&format=png&auto=webp&s=5ead333df306c1a6648f571b82c58a56e8fe6d1d

Chico",2,1729510049.0,NIOCORP_MINE,0,1.0,False
1g8ndh1,https://i.redd.it/7m4n4whah3wd1.jpeg,Did you found this mistake? Don't forget your coffee cup.,"Phill took his cup into the car but whe Luke was leaving, cup appeared back on top of the car. It is not big mistake or anything it is just first time I found something like this in a movie or series.",2,1729510034.0,Modern_Family,0,1.0,False
1g8ndfe,https://www.reddit.com/r/decaf/comments/1g8ndfe/im_struggling_to_quit_drinking_coffee/,I'm struggling to quit drinking coffee :(,"I'm 16, and I've been drinking coffee every day since I was about 10. I've quit a couple of times, but I always end up going back to it—I always find an excuse to start drinking coffee again. I just feel so tired without it. Recently, I started drinking two coffees a day, and now I feel jittery and overwhelmed throughout the day, but I can't seem to function without it. Without coffee, I struggle to do even the bare minimum—I can't think, study, or do anything. But it's also making my anxiety worse, and I recently realized that coffee has been the cause of my constantly upset stomach (I have a very sensitive stomach).

I tried switching to decaf, but it's just not the same. What should I do? Should I quit cold turkey, or should I gradually reduce the amount of caffeine I drink over time? I'm lost.",2,1729510029.0,decaf,4,1.0,False
1g8ncu7,https://www.reddit.com/r/norsk/comments/1g8ncu7/helpp/,Helpp,"I saw theres a place in oslo where you can go, grab a coffee and learn/practice Norwegian with other people. Is it actually good? Helps? ",0,1729509965.0,norsk,2,0.5,False
1g8nche,https://www.reddit.com/r/r4r/comments/1g8nche/46_f4r_north_carolinaanywhere_coffee_and/,46 [F4R] North Carolina/Anywhere- Coffee and connections,"I'm looking for a genuine connection with someone that might turn into more, if the chemistry is right. I'm perfectly happy with platonic chats but ultimately I think I'd like a romantic connection. 
Also, I'm a big beautiful fat girl, I'm mostly ok with that but if you aren't that's fine, everyone has preferences.  Happy to exchange pics.

I'm a little witchy and introverted and like your bog standard introvert activities like reading, binging all the things, I like to paint sometimes, I'm a huge LotR nerd, I'm into astrology, crochet, arts and crafty things, and I listen to a fair amount of podcasts that range from history to Bigfoot and spooky things. I've started making some lifestyle changes so that I can be less of a big beautiful fat girl, so I'm happy to talk about things related to that as well. I also have a bit of anxiety, but who doesn't eh? I'm still a goth girl at heart but you wouldn't know it to look at me.

You just be you, I don't have any requirements other than be 100% single and have a good head on your shoulders. Please keep in mind I'm not looking for a hookups or anything superficial and I'd prefer the conversation be relatively SFW. I'm honestly out here just trying together to know someone at a normal pace.

Send me a bit about yourself (please for the love of everything, more than just your age and where you're from, be different from the masses and catch my eye! I'm likely not to respond to low effort messages) and your zodiac sign and let's see if we click 😊 Sometimes messages fall through the cracks or I see them days later and figure it's too late to respond so if you've messaged before, feel free to reach out again.",3,1729509928.0,r4r,1,1.0,False
1g8ncer,https://www.reddit.com/r/phinvest/comments/1g8ncer/how_to_be_cost_effective_in_buying_and_managing/,How to be cost effective in buying and managing consumables supplies? ,"To those who owns restaurant, manages office or has a business that regularly purchase these supplies for employees and clients, any tips on how to minimize expenses while ensuring that we have the necessary supplies? Like paano magmanage ng supplies efficiently? These may look small and can be bought off orange or blue apps, but costs can build up kasi. Any tips/helps is much appreciated! 

supplies such as : Pantry Snacks, Drinks, Coffee, Tea, Hand Soap, Paper Towel, Alcohol etc.",1,1729509920.0,phinvest,0,1.0,False
1g8nc0d,https://www.reddit.com/r/norwegian/comments/1g8nc0d/helpp/,Helpp,"I saw theres a place in oslo where you can go, grab a coffee and learn/practice Norwegian with other people. Is it actually good? Helps? ",0,1729509879.0,norwegian,2,0.5,False
1g8nbnv,https://www.reddit.com/r/austinfriends/comments/1g8nbnv/extra_ticket_to_dashboard_join/,Extra Ticket to Dashboard - Join?,"Hey everyone. I have an extra ticket to the Dashboard Confessional concert this coming Saturday. I know it’s a long shot, but shoot me a message if you’d be interested in going with me!

I’ve posted on here before but I’m a 36 year old (trans) guy, super chill, and always looking for new friends. Plus I’m an emo kid at heart. Would absolutely be down to get coffee or something during the week to make sure the vibes are right. Let me know!

Hope everyone has a good start to the week ✌🏼 ",3,1729509841.0,austinfriends,2,1.0,False
1g8naw2,https://v.redd.it/jvv4rxxgg3wd1,"Pringle 3 in 1 Breakfast Maker with Coffee Maker, Mini Oven, Non Stick Grill Toaster Oven Portable Multifunctional Family Size Breakfast Station, Grilled Machine, Frying Pan for Home, Office",,1,1729509763.0,HReviewforKitchen,0,1.0,False
1g8n9yb,https://youtube.com/shorts/1YHdJ784qxQ?feature=share,"Pringle 3 in 1 Breakfast Maker with Coffee Maker, Mini Oven, Non Stick Grill Toaster Oven Portable Multifunctional Family Size Breakfast Station, Grilled Machine, Frying Pan for Home, Office",,1,1729509673.0,HReviewforKitchen,0,1.0,False
1g8n9ae,https://i.redd.it/21ae9dozf3wd1.jpeg,Mark Bradley's career began at Peet's Coffee in Emeryville,,1,1729509603.0,u_markbradley0,0,1.0,False
1g8n8xk,https://i.redd.it/h5b00cmwf3wd1.jpeg,My first Jellycat dragon ☺️,I’ve just gotten in to collecting Jellycats it started with the coffee cup and espresso cup to go in my kitchen and I knew I really wanted the dragons mainly the onyx one. Well after much hunting I managed to get him online (he was the last one available) he came today and I love him! Also just ordered pumpkin Bartholomew bear 😂,7,1729509569.0,Jellycatplush,1,1.0,False
1g8n8vu,https://www.reddit.com/r/Santiago/comments/1g8n8vu/looking_for_people_to_connect_with_in_santiago/,Looking for people to connect with in Santiago and perhaps share a morning coffee for just casual talks,"Hi everyone, not sure where to start.. I'm from the
Netherlands (Amsterdam) and have been living in Chile for quite some time. I am looking for friends who enjoy having conversations about life (preferably in English).
In case you wonder: l'm just a 34 year old mom who's currently going through a divorce process. I can use a good company and wish to meet people who are open to talk about everything. Usually the mornings are convenient for me :)

Wishing you all a nice day and thanks for reading
this!",6,1729509564.0,Santiago,4,1.0,False
1g8n7v8,https://www.reddit.com/r/Crushes/comments/1g8n7v8/i_27_f_have_tried_3_times_to_ask_him_3536_m_out/,I (27 F) have tried 3 times to ask him (35/36 M) out and chickened out each time. ,"I have a huge crush on a guy at the gym. I have tried to ask him out for coffee 3 times. He notices me like we both know we exist because we go to the same classes. I am recovering from ITB syndrome so have not been to the gym often (will be out for another few weeks) but today I went despite my PT telling me to take things slow because I was going to ask him out. Well, I did not. He is much older than me and I get anxious. He is definitely in his mid-30s. Once I wore really cute earrings to class, and he kept looking at me throughout the class. After that, he distanced his position in position, but once when I turned back after talking to someone, I saw him looking in my direction from across the room.  But I fear that he might be married (have not seen his wedding band). What should I do? It's a very intense crush, he is my type. ",1,1729509455.0,Crushes,1,1.0,False
1g8n6vm,https://i.redd.it/mhexubv8f3wd1.jpeg,241021 Weverse: Sunoo,"📍[Source](https://weverse.io/enhypen/artist/3-183034044)

>누나가 찍어준 사진 🌞
>>Picture taken by my sister 🌞",9,1729509347.0,enhypen,1,1.0,False
1g8n6fa,https://www.reddit.com/gallery/1g8n6fa,Christmas trees from past.,Little tinsel tree we had in our flat from years 2018 and 2019 and big one from 2023 wich is on coffee table to keep it out of reach of crawling baby.,2,1729509302.0,ChristmasDecorating,0,1.0,False
1g8n5ve,https://www.reddit.com/r/answers/comments/1g8n5ve/how_to_operate_this_coffee_machine/,How to operate this coffee machine? ,"What do the knobs and levers do? 
[This machine](https://imgur.com/a/GKufd5R) here.
I've never used a coffee machine before. ",1,1729509239.0,answers,2,1.0,False
1g8n5h7,https://i.redd.it/dbkij2mse3wd1.jpeg,"Chocolate chip waffle ,egg ,sausage and a coffee",,1,1729509194.0,Breakfast,0,1.0,False
