id,url,title,text,score,created_utc,subreddit,num_comments,upvote_ratio,over_18
1k3cpxo,https://www.reddit.com/gallery/1k3cpxo,📸Unit 605 Coffee - La Union,"📍Unit 605 Coffee - La Union
In front of Ugly Bar
",2,1745116766.0,WheninElyu,0,1.0,False
1k3cpvn,https://www.reddit.com/r/NoStupidQuestions/comments/1k3cpvn/i_still_love_her_am_i_an_idiot/,"I still love her, am I an idiot?","From the start, my ex avoided video calls, saying her hair was messy. Later, she revealed she was autistic. Our conversations were mostly one-sided, and she often canceled our plans, like the time she claimed she hurt her leg.

She told me her ex had replaced her with another guy and said I started treating her differently after learning about her autism. When I got mugged and almost lost her number, I noticed she was indifferent and only replied if I texted first.

She often talked about her cats and got upset when a cousin mentioned she used to drink with her ex. When I invited her to the movies, she first refused, saying she was too shy, but later accepted. We kissed and spent the afternoon together, but soon after, she became distant, hid her phone, and only gave me her Instagram after we broke up.

Once, her sister dropped her at my place, and when I said she wasn’t going out with me because she was ""being difficult,"" she got really mad. Another time, I criticized a game we were playing, and she stopped playing. Even after sweet moments, like when she gave me chocolate, she’d soon mention breaking up.

She invited me to a party, later said she wasn’t going anymore, but changed her mind. I asked to arrive earlier, but she insisted I should only come at 6 PM. I arrived early anyway, her sister saw me and invited me up. At the party, she introduced me as her boyfriend, but later joked: ""Let’s download an app to find you a hot girl.""

We argued, I broke up with her, she cried and blocked me. Later, she texted saying she missed me. We started talking again until I found her on a dating app. When I confronted her, she claimed she was looking for a friend’s ex.

Even so, I told her I loved her. She invited me to her mom’s birthday, but I didn’t go. Her mom later called, asked if I loved her, and even invited me for coffee. Later, my ex told me her dad was mad at me. I felt bad, vented online, and she saw it. She accused me of lying and using her, said she only acted the way she did because she was autistic and insecure, that she had prayed for me every day, and then blocked me for good.Please help me
",0,1745116762.0,NoStupidQuestions,5,0.5,False
1k3cos6,https://www.reddit.com/r/PurdueHousing/comments/1k3cos6/close_to_campus_yearlong_lease_20252026/,✨ **Close to Campus: Year-Long Lease (2025-2026)** ✨,"**Sublease/Lease Takeover 📍 240 S Chauncey, West Lafayette, IN 47906**

🚶‍♂️ **Steps from Purdue 🚀**

* **Prime Location**: Literally on Purdue’s campus! Walk to class, the library, or late-night study sessions in minutes—no car, no stress!
* **Great Connectivity**: Just a **5-minute walk** to campus bus stops for easy access.

💸 **Affordable Vibes 💰**

* **Rent**: $1,800/month for the entire apartment ($850 for bedroom 1, $950 for bedroom 2).
* **Unit**: Cozy **2-bed, 1-bath**—perfect for students!

🍔 **Campus Life at Your Door ☕**

* Dining halls, coffee shops, and bookstores are steps away.
* Grab a snack or hit student hangouts without breaking a sweat!

💧 **Utilities? Sorted! 🗑️**

* **Water, sewage, and trash** included by Muinzer—fewer bills, more chill time!

📍 **Location**: [Google Maps](https://maps.app.goo.gl/EGL1YxTZohnY1Y8T8)

📞 **Contact**:

* **Call**: +1-765-767-2732 | +1-765-532-6818 | +1-765-543-4307
* **WhatsApp**: +1-765-767-2732 | +91-8668438250",1,1745116653.0,PurdueHousing,0,1.0,False
1k3cobh,https://www.reddit.com/r/Advice/comments/1k3cobh/what_do_i_do_am_i_bad_am_i_an_idiot/,"What do I do? Am I bad, am I an idiot?","A from the start, my ex avoided video calls, saying her hair was messy. Later, she revealed she was autistic. Our conversations were mostly one-sided, and she often canceled our plans, like the time she claimed she hurt her leg.

She told me her ex had replaced her with another guy and said I started treating her differently after learning about her autism. When I got mugged and almost lost her number, I noticed she was indifferent and only replied if I texted first.

She often talked about her cats and got upset when a cousin mentioned she used to drink with her ex. When I invited her to the movies, she first refused, saying she was too shy, but later accepted. We kissed and spent the afternoon together, but soon after, she became distant, hid her phone, and only gave me her Instagram after we broke up.

Once, her sister dropped her at my place, and when I said she wasn’t going out with me because she was ""being difficult,"" she got really mad. Another time, I criticized a game we were playing, and she stopped playing. Even after sweet moments, like when she gave me chocolate, she’d soon mention breaking up.

She invited me to a party, later said she wasn’t going anymore, but changed her mind. I asked to arrive earlier, but she insisted I should only come at 6 PM. I arrived early anyway, her sister saw me and invited me up. At the party, she introduced me as her boyfriend, but later joked: ""Let’s download an app to find you a hot girl.""

We argued, I broke up with her, she cried and blocked me. Later, she texted saying she missed me. We started talking again until I found her on a dating app. When I confronted her, she claimed she was looking for a friend’s ex.

Even so, I told her I loved her. She invited me to her mom’s birthday, but I didn’t go. Her mom later called, asked if I loved her, and even invited me for coffee. Later, my ex told me her dad was mad at me. I felt bad, vented online, and she saw it. She accused me of lying and using her, said she only acted the way she did because she was autistic and insecure, that she had prayed for me every day, and then blocked me for good.

",0,1745116605.0,Advice,0,0.5,False
1k3co59,https://www.reddit.com/r/CPAPSupport/comments/1k3co59/implementing_changes_rippinglegos_suggested/,Implementing changes RippingLegos suggested,"Hey everyone,

Incoming long post/essay, but I'm so happy to have joined and found this community r/SleepApnea, but particularly this subreddit. After having my min at 11 and finding many CAs, I changed it to 8.2 (my med EPAP stat in first pic). If there's anything more I can change settings wise, please let me know. Guess this goes to show you that trying to raise your min pressure to where your 95% sits is not the golden rule for everyone (despite what a lot of commenters on other sub-reddits would say).  

Relevant CPAP settings:   
8.2min (suggested by Legos from my med EPAP when I had my min at 11) 15 max pressure, EPR3, mask mode full face, and ramp off. My mask is ResMed AirTouch N20. I want to try the Airtouch F20 because of the foam, am a frequent mouth breather depending on posture. Have heard it hurts the nose bridge, but my nose bridge is very skinny/not as broad as many people.

Tried masks:   
Can only fall asleep sleeping on side or partially stomach. Have septum and nostril piercings.  
1. Dreamwisp Nasal:   
Found it irritated/hurt my skin around my nose, and put pressure on tip and underside of nose.  
2. F&P Vitera: mask seal was difficult to obtain due to being a side sleeper   
3. Dreamwear Full Face Mask; too loud (may try it again) 

Gaps in screenshots:  
Due to struggling to keep the mask on due to a variety of reasons that I'm working on; adjusting to Mirtazapine prescribed for insomnia/delayed circadian rhythm, autistic sensory stuff, struggling with mouth tape/keeping mouth closed, struggling with finding a solution to my chin tucking that doesn't injure my neck, chronic pain due to faulty collagen/hypermobility stuff. A lot of that stuff I'm working on already, so please no suggestions there. It's so frustrating for me to want this to so badly work and putting in so much effort into going to sleep, and then still waking up exhausted. I am on the wait and cancellation list for a sleep study after I failed my first one.

My first one failed because I could not sleep at all. I thought I may have fallen asleep because you can think you're still awake, but that was ruined by the sleep tech coming in and saying ""Hi, you haven't fallen asleep at all. Can you keep trying?"" which... did the exact opposite of helping me haha. Proceeded to try and then the power went out. Tech came back in telling me so and asked if I wanted to leave early due to power being off. Agreed and just as I finished signing the form with my name, the power came back on. Obviously wasn't the sleep tech's fault though. The bed was super painful due to me having a pain flare up, and I couldn't sleep because I already have difficulty sleeping. My next one is not until December. I'm heartbroken and frustrated because there's no other option where I live; I checked the surrounding area for other clinics and their wait-times are just as long/did not respond to me/too far away for me to drive. Unfortunately, you need an in-lab sleep study to qualify for Ontario's provincial CPAP coverage and many extended coverage options (my spouse's included). 

Semi-relevant background stuff/history if anyone is curious or relates:  
FTM 5'11"" 180lbs. Drink one med coffee a day. Non-nicotine smoker and not a heavy drinker. The most I'll drink is once every 3 months, probably not even that. Smoke weed for chronic pain/CPTSD when it becomes too much once in a while. AuDHD, CPTSD, chronic pain, hypermobile, low muscle tone even being on testosterone now, easily injures self so high-impact exercise is not an option (e.g. hurting my neck badly due to chin-tucking/not lying on pillow correctly). 

Always struggled to go to bed for an 8-5 job even with wearing dark orange glasses before bed/limiting blue light before bed even when already exhausted. But, when I would fall asleep before CPAP therapy, I would sleep 12-14+ hours, still not be refreshed, and feel hungover or like I got hit on the back of my head. COULD NOT wake up before 8/9am unless I pulled an all-nighter, no matter how many alarms I set. I will turn them off in my sleep, no matter where they are located. Not a frequent snorer, and only mostly on my back or when sick, volume is apparently quiet talking volume. Constant fatigue except for the one day every 1-2weeks where the CPAP therapy works/the stars align. Only getting treatment now because people listen to me and take my issues seriously instead of telling me to manage my anxiety, exercise, that everyone is tired, or tell me I can't possibly have sleep apnea due to being skinny.

If you read this far, much appreciated. Hope everyone continues having success on their sleep health.",2,1745116590.0,CPAPSupport,0,1.0,False
1k3co0r,https://www.reddit.com/r/starbucksbaristas/comments/1k3co0r/can_i_dye_my_old_coffee_gear_black/,can i dye my old coffee gear black?,or what,2,1745116578.0,starbucksbaristas,2,1.0,False
1k3cnct,https://www.reddit.com/r/AskNYC/comments/1k3cnct/in_need_of_a_omewhere_that_can_remove_screen/,In need of a omewhere that can remove screen print from t-shirt,"Hello,

I had gotten 4 black t-shirts from a coffee shop that I was supposed to work at that decided last minute to not actually go forward with hiring me. 

The shirts they gave me are great quality black t-shirts… very soft, perfect size, etc. However, they have the company’s logo on the breast side over my heart. I used acetone to remove the majority of each print and I’m letting a stain remover soak in before washing them to hopefully get most of the rest. 

I’m wondering if there is any person or shop in NYC who I would be able to give these too that could remove the rest of the printing medium. I’m okay with spending above $50 for this service since four t-shirts of this quality would go for about that price. 

Any leads would be helpful! I certainly don’t want to rock the brand",4,1745116516.0,AskNYC,0,1.0,False
1k3cnam,https://www.reddit.com/gallery/1k3cnam,THIS is Doug DeMuro's [Lamborghini Countach] spotted at the local Cars and Coffee,,19,1745116510.0,spotted,2,0.91,False
1k3cnal,https://i.redd.it/08m3o8scjwve1.jpeg,Quick pencil sketch on printer paper,Did this is a small sketch done at work while on a coffee break,7,1745116510.0,doodles,1,1.0,False
1k3cn4j,https://www.reddit.com/r/AmIOverreacting/comments/1k3cn4j/aio_she_fucked_up_and_blamed_meshe_fucked_up_and/,AIO She fucked up and blamed meShe fucked up and I blame herShe fucked up and blamed me,"From the start, my ex avoided video calls, saying her hair was messy. Later, she revealed she was autistic. Our conversations were mostly one-sided, and she often canceled our plans, like the time she claimed she hurt her leg.

She told me her ex had replaced her with another guy and said I started treating her differently after learning about her autism. When I got mugged and almost lost her number, I noticed she was indifferent and only replied if I texted first.

She often talked about her cats and got upset when a cousin mentioned she used to drink with her ex. When I invited her to the movies, she first refused, saying she was too shy, but later accepted. We kissed and spent the afternoon together, but soon after, she became distant, hid her phone, and only gave me her Instagram after we broke up.

Once, her sister dropped her at my place, and when I said she wasn’t going out with me because she was ""being difficult,"" she got really mad. Another time, I criticized a game we were playing, and she stopped playing. Even after sweet moments, like when she gave me chocolate, she’d soon mention breaking up.

She invited me to a party, later said she wasn’t going anymore, but changed her mind. I asked to arrive earlier, but she insisted I should only come at 6 PM. I arrived early anyway, her sister saw me and invited me up. At the party, she introduced me as her boyfriend, but later joked: ""Let’s download an app to find you a hot girl.""

We argued, I broke up with her, she cried and blocked me. Later, she texted saying she missed me. We started talking again until I found her on a dating app. When I confronted her, she claimed she was looking for a friend’s ex.

Even so, I told her I loved her. She invited me to her mom’s birthday, but I didn’t go. Her mom later called, asked if I loved her, and even invited me for coffee. Later, my ex told me her dad was mad at me. I felt bad, vented online, and she saw it. She accused me of lying and using her, said she only acted the way she did because she was autistic and insecure, that she had prayed for me every day, and then blocked me for good.

",0,1745116497.0,AmIOverreacting,0,0.33,False
1k3cmu5,https://www.reddit.com/gallery/1k3cmu5,"22 M, 9 Months BUT - OIL > MINOX, read more.","I just wanna say, by know means am I a hyperresponder or monkey like some of these lucky chads- so take this with a grain of salt BUT- I have something I want to recommend so bad! So I used minox on and off for 8/9 months (sometimes twice a day a few days in a row, sometimes a week without) so I can’t say how great my potential is due to the weird dis consistency- but it aged me around the eyes , and skin was getting dry- anyway, I started used oils in the past with minox since around January 2025, and since February I haven’t touched it. I’ve instead been doing lots of research into oils and eo’s and how the %’s with blends work and carrier oil viscosity’s (I basically became a wizard and deep dove into everything oil related), and it is scientifically proven to be JUST AS EFFECTIVE if not MORE - than Minoxidil. This means if you have dormant and/or damaged hair follicles, (basically the possibility if you’re body is able to produce hair there ever) , it’ll wake it up. There are studies(EO’s peppermint, rosmsry , cedar, eucalyptus essential oils)(CO’s and Coffee Bean Extract, Castor, Absynian, Pumking Seed, Buriti Carrier Oils) whether you agree or think you’re debunking me I don’t care- the proofs in the pudding you tit lickers (sorry ily I didn’t mean that). I think this is much healthier alternative, smells great, and promotes softer healthier hairs WHILE filling in what’s possible. I am around 2/3 months of using mainly / if not only oils, and keep in mind, if this stuff didn’t work, a lot more of the vellus hairs I have would have already fallen out since I stopped prematurely- and while I haven’t shaved in a few months, there are still little vellus hairs filling in and an overall noticeable difference compared to what I was a few months ago , compared to even a year or two ago. Cheers! This isn’t to bash minix I know it’s awesome and why we’re all here, this is just me giving a (what I consider to be) just as effective BUT much more beneficial alternative!",2,1745116468.0,Minoxbeards,3,1.0,False
