id,url,title,text,score,created_utc,subreddit,num_comments,upvote_ratio,over_18
1k3sqdu,https://www.reddit.com/r/newbrunswickcanada/comments/1k3sqdu/a_nb_covered_bridge_story_in_light_of_the_recent/,A NB COVERED BRIDGE story in light of the recent demolition announcement posts:,"I wrote this fiction in 2017.  The bridge is real.  Sad to read that the province of New Brunswick, has slated a similar nearby bridge for demolition and replacement -- not restoration and improvement.  I'd help in the efforts to bring attention to the cause, but fear it's moving forward despite the opposition.  So, if you want to take the time to read a quick tale of creative writing about a local icon, then just keep reading....

Naming Bridge #3

Crisp air, vibrant fall colours, a picnic lunch, and probably the last use I’d get out of my well-worn hiking boots -- we tossed water bottles and phone charger into the car.  I wanted to capture all those colours to get us through the long winter ahead.

Though there are many covered bridges in Albert County, we’d never made the trek to Crooked Creek # 3.  There’s the 45 Road, Sawmill Creek, Shepody River, and others -- we’d even ventured out to King’s County to visit more of those long-standing icons of New Brunswick.  But the more strenuous hike up the old logging road to see #3 kept putting me off; I love scenery, but not exertion and sweating.

Naturally I’d read all about the history of the bridges, but it’s the local stories that folks share and have been told in the post office lobby, standing with ice cream or coffee in front of Crooked Creek Convenience Store at the corner, or told while shuffling the deck at card parties.

It’s the old-timers that have the best tales.  “If it isn’t true, it ‘oughta be!”, “Well, I heard it from a man who knows a fella who sez it’s true!”, and “anyway, take it as you hear it; my salt shaker don’t spill”.... So who knows what story is factual, augmented, entirely made up, embellished; they’re the fabric of the stories of our rural county living.

Before heading out, we stopped at the Buddha Bear Coffee Roaster cafe in Alma, and asked for extra sugar -- “I’ll need the energy today!” I told Peter, one of the owners.  When he asked what our plans for the day were, I explained our destination, shared my enthusiasm for exploring the last on our list of Albert County covered bridges, and asked if he’d been there yet.

Then I heard a harrumph at the coffee bar, and looked over to see an unfamiliar, older gray-haired man, with both hands wrapped around his mug of coffee, “Silly pursuits.” he muttered. I dropped my shoulders, and tsked.  “Don’t say that!” I cheerfully responded, “It’s a beautiful fall day, and we’re off on a fun little adventure; you’ll spoil it.”

“SPOIL IT?!” he barked back, “I’ll tell you about spoiling things…..how ‘bout a spoiled LIFE?”

Not knowing how to respond, we just watched him.  It was a little un-nerving, and we certainly didn’t want to engage with a hostile curmudgeon just as we were about to set out for a fun-filled day, but something seemed sad and lonely about him.  So we hesitated a moment more to see if what he’d say next.

He shifted a little, looked up slightly, and quickly glanced back and forth at both of us a few times.  “You married?” 

“Yes! 36 years ago this week, actually” I was proud to answer.  “That’s why we’re off this morning, an annual fall-colour outing to celebrate.”

“Yeah, well I was married once a long time ago -- longer than that in fact, and he looked back to his coffee cup with what looked like an odd mix of resentment and longing.  He made me nervous, so I nudged us along and said, “We’d better get going….” and he said quietly said, “Oh, sure, you love birds head off to that Bridge # 3 …. You’re so young, you probably don’t even know why it’s named that”…...looking up he met our faces, looked boldly, challengingly, and waited; his silence demanding a response.

…..”um, no I guess not, really…..”

He leaned back, picked up his coffee cup, took a sip, and started a story we’ll never forget.

""I was young, about to be married, working in the woods, logging, hauling timber, cutting lumber, and it was the loneliest work I’d ever done.  Long exhausting days followed by dark cold nights spent in solitude that seemed even longer than the day.  

For my wedding, I hauled myself out of the woods at the end of the work season, crossed the Crooked Creek Bridge -- that was the name of it in those days -- ready to see my girl, get married, and end my days and nights of loneliness.""

He took another sip of coffee, nodding, remembering….he looked at us again, we looked at each other wondering if we should interrupt and just head off, but his look compelled us to stay for more of his narration.

""In those days, we hauled our loads out of the woods by ground-skidding.  Horse teams, strong men, grappling, block and tackle, it was crummy work -- see what I did there?  The crummy was the wagon that took the crew out to the work site….yeah, you folks have no idea…..I was a feller, all right -- but when I came out of the solitude of the woods, I was a son-of-a-***** of a fella. -- excuse me, for that last one, Ma’m” 

-- he gave me a wink, and raised his cup to me for the apology, then to Peter for a refill on his coffee.

""Well, that job got me enough to pay for my wedding and for a horse, so I bought it and hooked that old filly right up to our wagon, said “I DO”, and took my new bride out for our first ride together.  She cuddled right up to me on the box seat, and it was right nice.  But just as we were about to cross that Crooked Creek Bridge, that old filly reared, and jostled us all about, nearly tossing us out, and I worked hard to get her under control.""

As he described the incident, it looked like he was still holding the reins in one hand while holding on to his now invisible bride.  He bucked and jerked still seated on his bar seat, and we all felt the relief as he described the calm after the struggle.  

“That’s ONE” he said.

""Well, we continued on, all calmed down and back again my dear bride slid close next to me, and just as we exited the other side of the bridge, didn’t that old horse do the same thing again…""

Now he stood, pantomiming the actions, grimacing at the strength it took, his dark eyes were fully recalling the danger, the power of that horse, and the skill required to rein it back to safely righting their wagon.  

He sat back down, winded, took another sip of coffee, and said, “That’s TWO” and loudly clanked his cup back on the wooden bar as he sharply said the word TWO.

""Well, by now, I’d had my fill of this uncooperative old horse, and decided to return it back to get my money back so I turned that horse right back around and headed back across the bridge to go home ….  He paused in thought.  Yup, so back through that bridge we go, and by now, naturally, my bride…. she’s disappointed, and scared, and all discombobulated, and don’t you know it just as we’re about to go into that covered bridge, doesn’t she do it again!"" 

The old man JUMPS up, startling us, and he WHINNIES loudly!  We look over at Peter, who is captivated by what’s going on, and we are immediately redirected to the antics of this old-timer galloping, bucking, rearing, snorting, and pulling, imitating the horse’s actions this time instead of his own to control it.  We watched, wide eyed until he sat down.

He mopped his brow, caught his breath, sipped his coffee and quietly, flatly, resignedly stated,

“That’s THREE.”

And then he slowly and dramatically silently play acted;  pulling a gun out of his pocket, loading a bullet, cocking the imaginary gun, aimed precisely away from us, and yelled,

“BANG”

We ALL startled.

""I shot that horse, and let her fall dead down the embankment.  We walked home in silence, leaving the wagon behind.""

Thinking that was the end of the story, we grimaced.  Looking at Peter, back to each other, then around the cafe -- still no one else had come in, and it was awkward.

""Well, it doesn’t end there, you see, when we got home, my new bride, she pouted and sulked.  I put on a fire, set the kettle on for a boil.  She just sat there.  Wouldn’t say a word.  Shock, I suppose.""  

""We had some tea, and then I went round to the neighbour’s to borrow his horse to retrieve my wagon, and didn’t she insist that she come along, still quiet as a mouse.  We walked that horse back up the road to the bridge, and there was my wagon, and that’s when she first spoke to me again."" 

He reached into his back pocket for his wallet and took out a 10 dollar bill, laying it on the bar securing it under his nearly empty cup.  Then he opened his wallet wide to show us a very old black and white photo of a plain woman in a simple wedding dress holding a small nosegay.  

""That’s how she looked on our wedding day.  The day that she left me at Crooked Creek Covered Bridge # 3.""

""You see when she finally broke her silence she cried, she nagged, she whined, she complained, she just wouldn’t stop talking saying things like …..”what kind of a honeymoon is this?  First, your impatience with an old horse, your temper, walking all that way on the muddy road in my beautiful dress….she rattled on and on.  Oh I listened.  I took it all.  When she got eventually got winded, and fell silent again, I simply said to her, I said.

“That’s ONE”",2,1745172654.0,newbrunswickcanada,0,1.0,False
1k3sps2,https://i.redd.it/kh5bgpd161we1.jpeg,Have I ruined my table?,Thrifted this table and it had a few heat stains from coffee rings on it. Saw online to try the iron and steam on a towel method to remove the stains. It didn’t remove the rings and have now been left with these dull patches/marks on the table? Think it’s where I used the steam maybe? Is there any way to fix this without completely refinishing the table? The mark feels rough compared to the smooth finish of the rest of the table. Feel so stupid!,1,1745172610.0,DIYUK,0,1.0,False
1k3sprv,https://www.reddit.com/r/r4r/comments/1k3sprv/21m_m4a_onlinr_wanting_someone_to_be_cute_with/,21m [M4A] #onlinr wanting someone to be cute with,"Haii! 21m here! I'm a guy from California that is looking for a boyfriend/girlfriend. I am looking for a long term relationship. Here is some stuff about me. I am a 21 year old guy from California. Am a college student who was majoring in game development, but is now going to be majoring in computer science. Game development is my biggest passion. So naturally I also like video games. My favorite video games at the moment are valorant, Minecraft Java, and rocket league. As for other things I'm into. I'm really into fashion, and music. I love talking about those. And I'm also really into movies and coffee haha. Now as for what I'm looking for. I'm looking for someone who is nice, kind, and sweet. Someone who can help lift me up and share the good times and the bad times with me. My type in men is anybody with blonde or dirty blonde hair xD. My type in women is, well anybody lol. 

I'm okay with long distance. Dm me if you are interested! :)",1,1745172610.0,r4r,1,1.0,False
1k3sphq,https://www.reddit.com/r/AskMenAdvice/comments/1k3sphq/said_he_wasnt_ready_after_he_came_back_saying_he/,Said he wasn’t ready after he came back saying he was?,"This guy and I had been on and off for 2 yrs. Never dating. 

We met when I was 23 and he was 22. I was freshly single and he was in no place to start something serious so we kinda just were flirty friends. After a couple months of hanging out a few times and often going home w each other after the bar he pulled away. I called him out next time he tried to talk to me. And he said he started to catch feelings but wasn’t ready for anything. 

Fast forward we start being friendly again for another few months and then we got closer and started hanging out every week. He started to pull away again and it hurt me and made me realize I like him more than what we’ve been doing so I ended things with him and said it’s because I want more. He understood and we stopped talking. A few months later he sees me at the bar and he’s drunk. Says he wanted to fight for me and that he missed me and wants a relationship and doesn’t want to see other girls. 

He texts me a week after that asking me to get ice cream I clarified I don’t want anything casual and he said how in the past he wasn’t ready but he is now. Fast forward we go on a date and it went well but he started pulling away SUPER fast after. And so I pulled away. We stopped talking within 2 weeks of the date. And we didn’t talk for 5 months. 

He then reached out. (We are now me 25 and him 24) he said how sorry he was how he regrets not trying harder, how he wants me and that I check all his boxes and he’s really ready for something. Basically says all the right things. I go “I need actions not just words” and he PROVES HIMSELF. For 2 months. Taking me on dates, bringing me coffee to work, told his family about me, all the things even bought me flowers and came over on Valentine’s Day. But all the while not pushing things and making sure I was comfortable with everything and with the past we were taking things.

Then I go on vacation for a week and. Like clock work…he… pulls away. I say how I feel him pulling away again. He says how he doesn’t think he’s ready for a serious relationship and that his feelings aren’t where they should be.

Like what…. The fuck..??? I’m confused!!!

Side note: in the whole 2 yrs we’ve been on and off we’ve only hooked up 5x. So I really don’t think it was sex related. ",1,1745172591.0,AskMenAdvice,1,1.0,False
1k3sp84,https://www.reddit.com/r/NoStupidQuestions/comments/1k3sp84/when_you_have_bad_breath_do_you_have_a_test_to/,"When you have bad breath, do you have a test to know if you're too close to people/it can be smelled, and you need to talk to people?","Let's say you ate lots of garlic, drank coffee, or are at the end of the day and it's time to brush. What do YOU do, if you need to speak to people and you don't have gum/the ability to brush?",1,1745172570.0,NoStupidQuestions,0,1.0,False
1k3sp1l,https://www.reddit.com/r/AmanitaMuscaria/comments/1k3sp1l/i_seem_to_no_respond_to_amanita_much/,I seem to no respond to amanita much,"I took about 3.6 g of pantherina over the past 2-3 hours. That is supposed to be just barely a high dose (3 - 6 g) with twitching and nausea possible. A moderate dose (1.5 - 3 g) is supposed to give altered time and deep stillness. I am experiencing something a little bit like being drunk without the impairment of judgement and sense of humor. My vision changes in one second waves where it seems to throb closer and with more color mildly somewhat like looking at the surface of shallow waves on a pond. My typing is error-prone, and I feel like a I had too much coffee. My motor skills are definitely impaired, but I seem to be able to think and reason and perceive normally. It seems to give me the bad effects of alcohol without the fun effects. I suppose this is ibotenic acid. I also occassionally feel the butterflies in my stomach feel along with a short flash of nausea.

As a newbie to amanita, I think there must be something wrong in my brain that is preventing me from experiencing these mushrooms properly.",1,1745172557.0,AmanitaMuscaria,1,1.0,False
1k3sosy,https://www.reddit.com/r/BreakUps/comments/1k3sosy/i_am_in_pain_i_deserve_it_it_hurts/,I am in pain. I deserve it. It hurts.,"This would be my first break up the first official one my relationship of three years has come to an end and it was my fault. I have never felt this kind of pain before. I am sad. But I deserve it.

I met my girlfriend three years ago and she’s the best thing to ever happen to my life, but I didn’t realize it until the break up. She would always put me first. If I said I was tired she would surprise me with coffee, she would make time to see me even if it’s inconvenient or out of her way. She loved me. I was a very introvert person but she was someone to get me out of my comfort zone. Throughout the relationship, I would notice some things about her. She’s very clumsy. She always forgets things, she always drops things, she makes decisions based on impulse without thinking things through, and that was the first thing I noticed that we were different. 

Because of this, I think I started to get annoyed, annoyed in a way that I cared about her. For example she has a bad habit of switching lanes without shoulder, checking and I would always call her out for it, but she always does and whenever she does, it just makes me angry because I want her to be safe. There are other times where it’s like just forgetting her key cards at home for the gym where we would have to turn back and get it when it was unstaffed and the time that she was in a call with me saying how windy it was when we were on our way to the gym in both of our separate cars. Then when she opened her door, she just let it go causing a dent in my car. These little things. So many things like this happen and I get so repetitive that I started getting annoyed. 

It started to get annoying and frustrating. I think it became a habit and then at some point nearly 2 years later I started to feel like I was babysitting her, but my anger just kept getting worse. From here on now, I would just get angry to the point where I would get mad and yell at her calling her names like how dumb she is how stupid she is and how she doesn’t think. She would usually always cry and apologize. Well, I will just keep making it bigger. Throughout the time I felt like I was losing interest because of that, but I still love being around her and liked her presence, but the things that I do, like my anger, the fact that I never see her friends or parents, and how I gradually stopped taking her out or on a date, got to her. 

Fast-forward to a month ago she finally said the words, that she doesn’t think this is working out. At that point, I agreed and I was fine because I’ve had these thoughts in my head for a while, but then she kept talking and then it hurt me. It finally got to me. I knew that she put up with all the yelling and me calling her names and all that kind of stuff, but I never knew how bad it was. She explained me the things that hurt her how I would never show up to events with her when her friends and their significant others are presence, but I’m not how I never take her out anymore. How her parents always ask about me, but I never make any efforts to see them. (I live out of town 45 minutes away- not an excuse but sometimes a factor). How she always drives over to my house to see me when I would rarely do the same. To be honest, I am a naturally shy person so meeting new people like her friends, and even interacting with her parents makes me nervous. There was more like that.

But the thing that got me was this. She said that whenever I’d get mad over the little things when she’s being “clumsy” that she would take everything in. Even though she was apologizing she couldn’t use her voice because she thought I was gonna get only more mad and she was scared of that. She said that if something happened on Monday, she would think about it every day and can’t sleep over it thinking about it for the next few days. She would think about things that she wanted to say, but couldn’t so she just has to play it in her head during the night. She also said every time she tries to talk to me and communicate these feelings, I would always shut her out, which was true.

My heart sank, and it’s still sinking so deep and it hurts. Why was I like this? How can I do this to someone who I appreciate and loved. Specially when she’s been nothing but good to me. Every day since a month ago, when she said this, I have been suffering and thinking of all the scenarios I can think of when I was mean to her, when I was yelling at her, when I was calling her names, when I would tell her to stop talking, when I would tell her to shut up, when I would ignore her. This is the biggest lesson I have ever learned and it’s eating me. Every day I can see her crying in my head vividly. How can I see her crying so clear now when I was blinded by my actions back then. 

A month ago, she labeled this as a break. Since then we’ve been talking, we’ve been talking more actually, something that I gradually stopped doing as much throughout the three years. We’ve also been hanging out for the past month post break (-up), and yes we have been intimate and kissing. We’ve been going out for food, going to the gym together like the usual routine. But she keeps saying that this would be the last time after each time we see each other and the last time, but it becomes more serious each time. Anyways, two weeks in this break, I found out that she had told people that it was a break up, which I was not aware of. Kind of sucks. Since then every night, our texts would turn into talks. I always ask her if she would reconsider trying again. But she’s kept saying no. She thinks I will just go back to the way I was and she doesn’t want to invest time because of it. She has every reason to think that. 

I could never hurt her again the way I did. Every single day since our break (up) I would replay the memories of her crying and trying to use her voice in my head, all the times that I was being mean to her. I can’t let that happen again, either to her or to whoever it may be in the future. Like I said, this is the biggest lesson in my life. The break up hurts, but it hurts more knowing how much I actually hurt her.

But after all this, after thinking that I thought I I was better off alone when I was in the relationship. After constantly thinking about how I have to babysit her. I feel like I want to try again. I can’t tell if it’s because I want to make it up to her for treating her bad. For not treating her the love that she deserved. Or the fact that me hurting her finally made me realize how much I truly loved her. I don’t know. I know that I still love her a lot and I miss her so much everyday. I just feel so bad and it hurts. I don’t know what to do. I think I really do want her back but she’s made up her mind.

",1,1745172538.0,BreakUps,0,1.0,False
1k3somy,https://i.redd.it/r6t0stps51we1.jpeg,Have I ruined my table?,Thrifted this table and it had a few heat stains from coffee rings on it. Saw online to try the iron and steam on a towel method to remove the stains. It didn’t remove the rings and have now been left with these dull patches/marks on the table? Think it’s where I used the steam maybe? Is there any way to fix this without completely refinishing the table? The mark feels rough compared to the smooth finish of the rest of the table. Feel so stupid!,1,1745172527.0,CleaningTips,0,1.0,False
1k3so28,https://www.reddit.com/gallery/1k3so28,Best Italian and mocktail found.,"Found the best cafe in shillong.
The Press Cafe in Nongthymmai, Shillong. (Near Laimukhrah) Its a cosy cafe with reasonable prices and mouth watering food.
Even the mocktails are next level.
It's so underated.
We order the watermelon and rashberry mocktails.

The Aglio olio was the charmer. The tacos were also very good.

If you are visiting shillong make sure you enjoy their food.
The coffee yes ofcourse its also very good.

I feel sad , we have hundreds of cafe's in Guwahati. Not a lot knows how to make a good coffee. Although i believe there are some bit unfortunately i have came accross one yet.",1,1745172485.0,guwahati,0,1.0,False
1k3sn5p,https://i.redd.it/6m05yv6e51we1.jpeg,Looking for 3rd roommate off campus housing apartment <$600 close to campus by end of April,"Hello,

I am looking for a third roommate willing to room with me (an incoming 4th year undergraduate) and a recent UF graduate for a year-long lease starting this August or late July. We have toured a few apartments and have found a very suitable option 10 minutes by bike away from campus within the $530-$580 range, but are still in the process of looking at more units to be safe. We are preferably looking at an unfurnished 3 person unit <$600 with a washer & dryer, somewhat close to campus, and have no preference on pets. We would also like to sign a lease by the end of April.

If you would like to be our roommate, please DM, and we can get coffee or something to get to know each other a bit. We would like to have a third person on board before any lease is signed. You can come tour with us too during this week, but please respond quickly if you think you might want to to join us. We unfortunately don't have a lot of time.

We are both free to talk over Discord as well.

Best,",2,1745172423.0,ufl,0,1.0,False
1k3slgv,https://www.reddit.com/r/punemeetup/comments/1k3slgv/looking_to_meet_women_around_lohegaondhanori/,Looking to meet women around Lohegaon/Dhanori,"Hey! I’m a 38-year-old male living in the Lohegaon–Dhanori area. Looking to meet like-minded women for coffee, conversations, and good vibes. If you’re around and open to connecting, feel free to DM!
",1,1745172302.0,punemeetup,1,1.0,False
