id,url,title,text,score,created_utc,subreddit,num_comments,upvote_ratio,over_18
1gpalde,https://i.redd.it/s9m9xkpavd0e1.jpeg,Selling Coffee Maker ,"Hi everyone! Selling this Blakk Coffee Maker for 650 pesos.

Location: Project 8, Quezon City

Issues: None! You can ask me more about products.

Modes of Payment: Paymaya.

Modes of Delivery: J&T or Lalamove.

RFS: Currently decluttering our kitchen and in need of funds.",1,1731379205.0,phclassifieds,0,1.0,False
1gpakvj,https://www.reddit.com/r/Needafriend/comments/1gpakvj/24f_hii_dms_open_if_you_wanna_be_online_friends3/,"24F Hii dms open if you wanna be online friends<3
","I'm into coffee, manhwa, YT, shows, reading a bit, mat pilates, walking, and sometimes playing stuff like genshin and aram

Please be around my age ty:)",1,1731379165.0,Needafriend,1,1.0,False
1gpajrz,https://www.reddit.com/r/GriefSupport/comments/1gpajrz/keeping_their_memories/,Keeping their memories.,"The past few years have been incredibly tough. I’m proud of myself for being able to stand here today, remembering everything without breaking down.


Every ber months (any months that ends with ber ex. November) my grandparents would start decorating the house with Christmas ornaments, having Christmas music early in the morning and practicing which dishes to do in Christmas eve. As a teenager, i felt a bit sofocated, my sister's and i lost our parents early and it felt like Christmas is a reminder that i don't have a complete family. I didn't really pay attention to my grandparents efforts during that time.

In my college days, i got more closer to my grandparents, doing most errands with them, driving them to places they need to be. When covid happened, we were actually doing fine, i was working online and so our financial wasnt hit like everyone else. By the 2nd year of covid and things loosen up, we would go to to beach almost everyday. I work night shift and before i sleep, i will hang out with them, preparing breakfast or doing a quick drive to the beach to catch some vitamin d.

Im writing this to help myself remember what it was like. Having their favorite Christmas songs in the speaker, smelling the breakfast and freshly made coffee. Feeling the sun in my back. I truly cannot express how lucky I was. 

Im on a different journey of my life and theres no day where i wouldn't remember them. When i feel doubt i already know what they'll tell me. When im cooking, i hear them guiding me and telling me what NOT to do lol. I was a very forgetful person and hence why i wanna try to remember them so much.

Im scared that one day i wont remember how they sound and look like. 

Ma, Pa i miss you so much.",1,1731379072.0,GriefSupport,0,1.0,False
1gpajij,https://www.reddit.com/r/cmhocpress/comments/1gpajij/the_general_attends_services_at_canadian_national/,The General Attends Services At Canadian National Vimy Memorial in France,"*The General, being a retired service member herself, knows the importance of Remembrance Day. For her, this day is one of the most holy days, made to honor those who put it all on the line and made the ultimate sacrifice for their country. The General made arrangements to attend a service at the Canadian National Vimy Memorial in Vimy, France, departing on a commercial red eye flight out of Toronto Pearson the night before. She landed early in the morning, well rested despite the constraints of her basic economy seat. Today was a solemn day, and The General was sure to respect that. She arrived at the memorial service, wearing a light blue dress adorned with a poppy. After hearing from a variety of speakers, including a local French politician, The General was invited to give brief remarks. She took to the stage, and took in the sights around her.*  
“Good morning to all of you here with me today. Remembrance Day is one of the most important days to me. For those of you who do not know, I proudly served as a Brigadier-General in the Canadian Armed Forces for over 3 decades, and dedicated my life to service, patriotism, and protecting the freedoms that make Canada great. I have lost many brothers and sisters in arms during my service, and every year on this day I like to highlight the bravery of one. Today, I’d like to share with you the story of Lieutenant Dan Haverson. Lieutenant Haverson was one of my officers during my tour of duty in Afghanistan in 2002. The two of us bonded back home in Canada during our time at Garrison Petawawa, sharing stories over morning cups of coffee and doing training sessions together. Lieutenant Haverson was a second brother to me. We quickly found out our unit would be deployed to Kandahar to help in the global fight against the islamist Taliban regime. While many of us were worried, Lieutenant Haverson remained a beacon of hope and a significant morale boost during the first few months on the ground. Lieutenant Haverson proved himself to be a true leader, commanding the respect of both his subordinates and senior officers alike. I wish I could bring Lieutenant Haverson on stage with me to talk about his love for service, but unfortunately, I cannot. Lieutenant Daniel Haverson made the ultimate sacrifice in 2003, laying down his life for the safety of his fellow soldiers. While out on patrol, his squadron was ambushed by guerilla terrorists. A grenade was thrown in the direction of his soldiers, and with little time to spare, Lieutenant Haverson did the unthinkable. In order to spare the lives and safety of his fellow brothers and sisters in arms, Lieutenant Haverson dived on top of the grenade, absorbing the shock and ending his life. Lieutenant Haverson put his love for his country and for the freedoms of Canadians above all else, and he made the ultimate sacrifice by doing so. It is this very same sacrifice that we commemorate here at the Canadian National Vimy Memorial. Vimy Ridge was an important battle in World War I, turning the tide of the war by pushing back the German advances into France. Vimy Ridge was also the first battle of the war with all four Canadian divisions participating. During the battle of Vimy Ridge the Canadian army showed bravery, courage, and determination, winning in spite of all odds. Their spirit and conviction is a reflection of the Canadian spirit. My friends, while this is a solemn day, let this also be a day for us to celebrate the lives of our fallen soldiers, and give them the dues they deserve for putting the greater good above themselves. Thank you.”  
*The crowd claps for The General, and she lays down roses at the memorial.*",1,1731379051.0,cmhocpress,0,1.0,False
1gpaj8x,https://www.youtube.com/watch?v=ZmsvYkxhg_U,"MISS HOT COFFEE REACTS BABYMETAL - ""BABYMETAL DEATH"" | REACTION VIDEO!!!",,1,1731379028.0,BABYMETALReactVideos,0,1.0,False
1gpaihh,https://www.reddit.com/r/dating/comments/1gpaihh/long_story_short_she_came_back_then_unfollowed/,"Long Story Short: She Came Back, Then Unfollowed – Now What?"," It all started when we met in college last year. We were working on the same project, exchanged phone numbers, got along pretty well, and started texting every so often. I didn’t ask her, but she mentioned she had a boyfriend, and I didn’t say anything about having feelings for her (which I do) and carried on with the rest of the school year.
One year later, on a random night, I hadn’t thought about this girl since college, but all of a sudden she came to mind, and I was thinking, 'I wonder what she’s up to.' The next day, she followed me on Instagram! I was like, there’s no way—I was just thinking about her, and the next day she followed me. I was so happy. I followed her back, and we started talking and getting along great.
A couple of days later, she asked me, 'Do you like me?' and I said, 'Yes, I do like you…' She mentioned she broke up with her boyfriend a month ago. When she told me that, I was thrilled; she also mentioned that the reason she was being distant with me before was because she was catching feelings for me and didn’t want to ruin her relationship, which I totally understood. Then, in almost every text she sent, she started repeating the last letter of words, like 'Awwww' or 'Totallyyyyy.'
Now we’ve started to flirt with each other, and I wanted to do random things with her, like going to a movie theater or restaurant. She even wanted me to go with her to her friend’s wedding as her plus-one, lol. I hadn’t seen her for a while, so she invited me to come by her work, where she’d give me a free coffee. Before I went, I bought her a bag of her favorite candy and decorated it with our favorite football teams. When I arrived, my heart was racing—I couldn’t believe my crush from college liked me. As soon as I walked in, she smiled and gave me a hug, and she really liked the gift I gave her. We talked when she was on her break, and I noticed some good body language—when a girl gets shy or nervous, she often plays with her hair, which she did. We talked for about twenty minutes, and when her break was almost over, she walked me to my car. We hugged twice, and they were long hugs. I thanked her for the coffee, and I was on my way home.
Before we met up, she’d told me her parents are strict and that she wanted to focus on herself before starting to date again, and I was cool with that. At this point in the story, you’re probably thinking, 'Okay, there’s no way this story can get weird, right?' But the next day, I texted her to say thanks again for last night and that I hoped she enjoyed her candy. She replied, 'You’re welcome, and thank you for the candy.' I asked about her day, and she said it went well. Then she texted me this:
'I also spoke with my parents right now and told them about you and I just you know hanging out but my parents don’t think it’s good for me right now to be talking with someone cause they ya know assume and were right I have some feelings for you but they think it’s too soon because of the break up and honestly they might be right (my name), you’re the sweetest and super caring trust me when I say that but I know my parents at the end of the day want what’s best for me, and plz don’t hate me but they’re making my brother go with me to the wedding since he’s already gonna be in town, I’m so so sorry I promise its nothing against you, I just know that they’re right maybe it’s best if I do just focus on myself right now and I would have told you this in person but they just told me right now and I wouldn’t want to wait to do that, that’s not right, if you ever want a free coffee though lol you’re more than happy to visit me or come to me with any advice I just need to figure out some things right now I’m sorry.'
I replied, 'Thank you for being honest with me, I could never hate you, I totally understand where your parents are coming from, and I respect your decision to focus on yourself right now, just know that I care about you and I’m here if you ever want to talk or hang out, even if it’s just for coffee, take your time to figure things out, and I’ll be here when you’re ready.' She responded, 'Thank you (my name), I really appreciate that.'
We haven’t texted for a month, but she posted something on Instagram of her at the wedding. When I saw it, it had been up for a few hours. I liked the post but didn’t say anything. Later that night, after work, I noticed she had unfollowed me on Instagram when I checked my profile and saw my follower count had dropped and this happened yesterday and also, she didn’t block me on Instagram. What should I do, and does this mean anything?",2,1731378968.0,dating,1,1.0,False
1gpahtm,https://www.reddit.com/r/Cairns/comments/1gpahtm/redlynch_coffee_club_closed/,Redlynch Coffee Club closed?,Anyone know what’s happening with the Coffee Club at Redlynch shopping centre? The wife likes to go there. ,1,1731378910.0,Cairns,0,1.0,False
1gpag81,https://www.reddit.com/r/developersIndia/comments/1gpag81/somebody_stole_my_contribution_to_the_linux/,Somebody stole my contribution to the Linux kernel and his commit got merged.,"I was working on a hardware integration and had recently purchased a development kit. At the time the manufacturer said it only works with Windows, but since I refuse to use evil proprietary software on my computer, I was looking for a way to get this to work on Linux.

I opened my coffee machine and saw a chip called ARK3116 near the USB port. I started searching for this in the Linux source code and found the reference so I modified the file to add the USB vendor and product ids and then added a few lines of code to correctly set the baudrate. Tried compiling it and it actually worked! I was so happy I can finally control my coffee machine using Emacs.

I sent a pull request on GitHub and someone acknowleded my contribution and that was it. I thought it will get merged and Linus Torvalds will personally say thank you. As it turns out, the Linux repository on GitHub is just a mirror and it's just bots talking to each other. By the time I realized this, someone already took my changes and re-submitted to kernel mailing list and it got merged.

I didn't know the free software community had code thieves like this. What a disappointment.",3,1731378776.0,developersIndia,2,1.0,False
1gpag65,https://www.reddit.com/r/espresso/comments/1gpag65/delonghi_ec685_or_ec885_180_165/,delonghi ec685 or ec885? (180£ / 165£),"as title says, after some looking online I’m deciding between the ec685 and the ec885; and was wondering if one was better over the other (only in terms of espresso, i dont usually drink coffee with milk). If im not mistaken, the 885 comes with a tamper as well, but thats the only difference i noticed",1,1731378772.0,espresso,0,1.0,False
1gpaf68,https://www.reddit.com/r/army/comments/1gpaf68/veterans_day_caloric_victory/,Veterans Day Caloric Victory,"The successful battle plan for Veterans Day:  

05:45: Starbucks for a free brewed coffee.  

06:00: Krispee Kreme for a free donut. 

06:15: Denny’s for a free Grand Slam. 

07:00: Newspaper & bathroom break. 

08:00: Ihop for Pancakes. 

09:00: bathroom break. 

10:00: hit Dave and Busters for a free $10 Power Card. Also entree up to $20. 

11:30: free meal at Chilis. 

12:00: bathroom break. 

13:00: Free meal at Olive Garden (no breadsticks). 

14:00: bathroom break.  

16:00: free wings at Buffalo Wild Wings   

16:30: rest for the main event. 

18:00: we storm the Applebees. 

Calories eaten: 19,200.   

Times thanked for Service: 17 times. ",2,1731378684.0,army,2,1.0,False
1gpaeh5,https://www.walmart.com/ip/Keurig-K-Express-Essentials-Single-Serve-K-Cup-Pod-Coffee-Maker-Black/1721905244,Keurig K-Express Single Serve K-Cup Pod Coffee Maker $29.88 Retail $59,,1,1731378625.0,DailyRedditDeals,0,1.0,False
1gpae6u,https://i.redd.it/6rugfv0itd0e1.jpeg,Got a cutie little mug so made a matcha in it today.,"Do you guys like matcha? If yes, what brands? Also can we all post our morning coffee/ tea pics in here?",1,1731378601.0,indianbeautyhauls,1,0.67,False
1gpae4r,https://v.redd.it/x3ap6s9htd0e1,"My first ""God Shot"". It tasted like sweet dark chocolate.","About a year of coffee making, never really gave my coffee a 10/10 till this. Decided to work on this profile and thus record for reference. 1:2 yield from 18grams. 25 sec pre-infusion, 20 secs extraction.",4,1731378597.0,espresso,3,1.0,False
1gpacwq,https://www.reddit.com/r/dating_advice/comments/1gpacwq/expectation_of_ghosting_and_the_app_doom_spiral/,EXPECTATION of ghosting and the app doom spiral ,"22M here. I recently started my first venture in corporate America, in a new city (one of the #11-20 biggest in the US) and it's lonely. It's known to be hard to break into circles here, my co-workers are friendly but distant, and I have not found any sort of meet up / volunteer group with a consistent pool of people somewhat close to my age that I get along with. Perhaps that has made me too invested in the apps as a crutch which might be relevant in a bit. When I was in college - partially abroad, and I did a stint in NYC - at least I had a few close friends to fall back on.

I do think I'm attractive, or at least not bad looking. I mean, my profile usually gets multiple matches a day between the apps and I don't pay for any premium. I'm not muscular, relying on the face card right now. And I do have a more introverted personality which may be a turn-off but it's hard to figure out the ways I need to change it without compromising myself. I had far from the best childhood socially but have certainly worked on myself some and become a lot more interesting, well-traveled and well-adjusted. Like, over the years my 1:1 conversational ability has drastically improved and I never feel like I'm just interviewing people. But it feels hard to talk ""enough"" / not get talked over in group settings. I prefer to be a bit more observant, and find, say, silence in an Uber ride better than filling every second with conversation. It's not that I'm not interested in people. I can be witty, but not very energetic and excitable and I feel that's at odds with the dancing monkey persona a lot of people want.

I realized I needed to take a step back today after, in my response to yet another ""you're sweet but we don't line up"", saying ""dating is such a fucking waste of time in this city anyway"". The cold winter is approaching and I'm entering a doom spiral. I think it's partially rational. It's so frustrating to have such a low percentage of people respond > such a low percentage of people who can get to a date without flaking > such a low percentage of people who can actually communicate after, let alone be interested in a 2nd. I am witty over text but again, the dynamic is imbalanced. I don't know what I'm supposed to say to the 5th Tinder profile I've seen today with no bio or yet another girl on Hinge who loves The Office, her dog, and doesn't like cilantro or pineapple on pizza or tequila or whatever.

But yet admittedly I sometimes fumble the hardest when the conversation is very interesting over text and they actually seem to have a personality. That immediate shift to one-word responses or HR speak or radio silence gets me every time. Most of my successes with women before have been because they have been quite forward or at least made it easy. I feel like maybe the issue is that I'm not escalating or something, when I expect it to be a mutual buildup. But I have to be drunk and/or on a date with some physical activity to get that to work. I don't understand how people build anything after a lunch/dinner/coffee date because I always get the soft rejection even if the conversation flows.

So I feel like it's fueling a doom spiral here. Expect to just get ghosted anyway > be more checked out / not present in the process > even more likely to get ghosted probably. Is the obvious answer just taking a break and working on myself / feeling more established where I am?",1,1731378493.0,dating_advice,1,1.0,False
1gpacoo,https://v.redd.it/ila3ms34td0e1,Jojo has a new song coming out Nov 22 call ice coffee and it’s be on TikTok sound on Nov 13.,,1,1731378471.0,SiwaSnark,1,1.0,False
1gpacnl,https://www.reddit.com/r/PixelArtTutorials/comments/1gpacnl/do_you_use_a_mouse_of_a_pen/,do you use a mouse of a pen?,"I've always been curious about the preference for drawing pixel art. I'm considering working at a coffee shop to help me focus, but do most people use both a tablet and a mouse for pixel art, or do you prefer one over the other?",2,1731378469.0,PixelArtTutorials,2,1.0,False
1gpacfv,https://www.reddit.com/r/AskDoctorSmeeee/comments/1gpacfv/if_youre_a_doctor_please_read_this_is_my_last/,"If you’re a doctor please read, this is my last resort. No appetite, nausea, burning stomach etc","This is my last resort. I’m so worried about myself but I can’t seem to get a clear answer from my doctors. I was hoping there are doctors on here to help me.
I’ve been having a lot of nausea, stomach burning in the middle of my stomach and zero appetite. Today I only ate one meal and coffee. I’m already extremely small and I lose weight very fast. I’m a mom of 5, my youngest is 11 month old. I weigh 117, I’ve already lost 3 pounds and that may not sound like a lot but it is for me. The doctor gave me pantoprazole, I took 3 pills so far and yesterday I felt even worse than before. I got so scared. I haven’t taken anymore. 
I’ve been having heart palpitations here and there, dizziness, foggy and fatigue. 
Also, I’m a cancer survivor. 8 years in remission. I’ve had a double mastectomy and reconstruction. 
I’ve been having severe breast pain in the breast where the cancer was. My shoulder and my neck. Now it’s under my arm. My MRI for this isn’t till the 20th. I’ve had scar tissue and that’s what I’m hoping this pain is. 

Idk if any of it is connected. I don’t want to die. I want to eat and be healthy for my kids and live a happy healthy life. My quality of life is so terrible right now it’s bringing to depression. I’ve had the best life since surviving cancer and all my beautiful babies. I can’t even enjoy them and my life! I feel like giving up. 

All my bloodwork looks good except something called lipase levels, these seemed slightly elevated and I’m waiting on my doctor to call me and talk to me about what those even mean. 
Just as a side note, I know what I wrote is all over the place, sorry about that. But please be kind, this is a lot of personal information I’m already having anxiety about sharing this with strangers but idk what else to do. I really need help. If you read all this and help me thank you from the bottom of my heart.

Anyway, any ideas please throw them my way. I’d truly appreciate you. ",1,1731378450.0,AskDoctorSmeeee,0,1.0,False
1gpabx7,https://i.redd.it/om6rortwsd0e1.jpeg,My current wishlist. What to buy on priority? ,,3,1731378405.0,Indianbooks,0,0.8,False
1gpabu1,https://www.reddit.com/gallery/1gpabu1,all these coffee shops still nothing beats the wicked coffee!,"i'm from the south and traveling to qc for the wicked coffee is so worth it for me! my favorite drink from them is spanish latte, after i've tasted it hindi na makuha ng ibang coffee shops lasa ng spanish latte na gusto ko.

last time i've tried their speculoos latte and of course as always masarap! especially if nalusaw na yung biscoff 💕 

the ambiance in their shop is also a plus, ang cozy and homey ng feeling.

for commuters like me: lrt-2 anonas station, walk further pagbaba hanggang may makitang mcdo then kanan from mcdo, may mga trike don ang sabihin mo lang 69-A Bignay St. ",4,1731378399.0,CoffeePH,0,0.75,False
1gpabrl,https://i.redd.it/mjamsczcpd0e1.jpeg,See post below~,,1,1731378394.0,acnh,0,1.0,False
1gpab6d,https://www.reddit.com/r/TheGreatNorth/comments/1gpab6d/will_they_add_aunt_dirt_to_the_opening/,Will they add Aunt Dirt to the opening?,"She's part of the family, lives on the Tobin property and is a regular on the show.  I don't think she'd pose in the family photo since it's already been taken, but she could at least show up maybe in the fireside boardgame night leaning on the couch drinking some coffee.",2,1731378341.0,TheGreatNorth,0,1.0,False
1gpab6b,https://i.redd.it/9u7rg54qsd0e1.jpeg,Diving deeper into Anaerobics and Co-Ferments,"These are the coffees that will carry me into 2025.  My main goals were to experience a range of ""alternative"" processes, while also experiencing some better roasters.  I do like a sweeter cup with a little more body.  

So far it's not a disappointment.  While I'm not 100% sure the coffees I've tried are worth 2-3x my local roasters,  they do seem more ""refined"" with none of the rough edges and slight harshness or negative flavors I get in most local roasts. This is from B&W red fruits (needs more rest), Dak Coco Bongo (ditto), and 94 Celsius Fruitopop (not pictured - awesome cups every day - roasted 10/2)

 If this is a consistent finding across all 10 bags, maybe the answer is ""yes, it's worth it.""  But maybe it's the processing more than the roasting. Maybe it's a little of both.

I'll probably hit a few more local roasters as I work through these beans, but who knows?  There are just so many awesome beans to try!  I can also see working through as many of the Top 50 roasters as I can manage to develop some personal benchmarks for trying other roasters. Looks like maybe 20-25  could be accessible without breaking the bank.  That could be a fun 2025.  :)

Anaerobics and Co-Ferments have  been hard to find in Pittsburgh.  I'll make sure to leave tasting notes in the weekly threads as I dial-in each coffee.

Roast dates on all of these are 10/25 - 11/1 and resting.   Probably should have spread out my orders.  :)

Orders were from eight ounce, rogue wave, and B&W.

Coffees: 
Dak Milky Cake and Coco Bongo

September Buttercream and Coconut Crush (for direct compare to Dak) 

B&W - Red Fruits and Cinnamon Co-Ferments 

Rogue Wave - Benitez Sudan Rume Anaerobic, Benitez Anaerobic Decaf, Nguisse Nare Bombe Natural, plus 3 samples.

(Not pictured) 94 Celsius Fruitopop Anaerobic, also from Benitez",4,1731378341.0,pourover,2,1.0,False
1gpab65,https://www.reddit.com/r/askportland/comments/1gpab65/any_local_coffee_shops_do_a_two_for_one_bag_of/,Any local coffee shops do a two for one bag of beans special?,Randomly encounter some roasters and shops that have a two for one special if you go in on a specific day but can not for the life of me remember where/what they were. Anyone know of anything? ,1,1731378340.0,askportland,0,1.0,False
