id,url,title,text,score,created_utc,subreddit,num_comments,upvote_ratio,over_18
1juq0u0,https://www.reddit.com/gallery/1juq0u0,Need some help making table topper not tilt,"Hello all, 

I am need some help with finding a creative solution for this removable table topper I am working on. The idea was to mimic a leafed table with three removable boards that could be placed on our coffee table. The top consists of three 2’ x 4’ boards. 

They would clip together at the joints and use toggle clamps to make sure it won’t shift laterally. 

Where I am needing some help is finding a means to stop the boards from tilting when you lean on them. 

The goal of this topper is to have it be a non permanent addition to the coffee table, so attaching it to the coffee table permanently is not an option. 

Take a look at the pictures and let me know if I need to take any more. If you know of any hardware I can use or really any ideas it would be super helpful! 

Thanks! 
",2,1744150058.0,woodworking,0,1.0,False
1juq0n2,https://www.reddit.com/r/MakeNewFriendsHere/comments/1juq0n2/34f_hospital_trash_can_saweet_thanks_buddy/,"34F // Hospital? Trash can! Saweet… Thanks, buddy.","Hi, I’m me. I’m the kind of person who uses full sentences most of the time but will also send “lol” as a complete thought if I am indeed laughing out loud (or just lazy).

Not looking for anything too intense—just someone to swap sarcastic commentary with, trade weird personal anecdotes, and maybe discuss Dostoevsky or quote Hot Rod. Because balance, right?

My hobbies include watching things that make me laugh, reading classic literature (mostly), listening to things from Mitski to Fleetwood Mac to true crime podcasts that lull me to sleep, and walking around in any weather contemplating my life decisions.

So if you enjoy a good roast (of coffee or character), want to talk about movie soundtracks, or just need someone to send you weirdly specific gifs/memes, let’s do this. Snarky jabs encouraged. Bonus points if you’ve also spent too much time thinking about that scene where Bill Hader is tripping and bleeding everywhere.",1,1744150045.0,MakeNewFriendsHere,1,1.0,False
1juq0g6,https://www.reddit.com/r/LearnerDriverUK/comments/1juq0g6/getting_a_uk_driving_licence_a_humble_guide_to/,Getting a UK Driving Licence: A Humble Guide to Insanity.,"So, you’ve decided to get a UK driving licence. How honest of you. How brave. After all, what’s life without a little chaos and a direct debit to DVSA?

First stop: the theory test. You’d think it’s just a quiz about road signs and speed limits, right? Wrong. It’s the Hunger Games with hazard perception clips. And good luck booking it unless you're free in... four months. Fail it? That’s another few months wait. Pass it? Congratulations, now your real problems begin.

Next up: driving lessons. Because obviously, you need to pay £40/hour to sit in a car with a stranger who clutches the passenger brake like you’re aiming for a ditch. But hey, you’re funding their next holiday and possibly their retirement plan.

Now, the practical test. Getting a slot for that? Might as well wish upon a star. And when you do? The examiner will judge your entire existence in 40 minutes. Parallel park a little too enthusiastically? Immediate fail. Too cautious at a roundabout? Fail. Blinked wrong? FAIL.

And if, by some miracle, you pass? Welcome to insurance quotes that look like they’re trying to fund NASA missions. Seriously, you’ll start missing those £30 Uber rides that came with no stress, no test, no paperwork... just vibes.

Moral of the story? Take an Uber, blast some music, sip your overpriced coffee, and let someone else deal with the roundabouts.",1,1744150031.0,LearnerDriverUK,0,1.0,False
1juq0a2,https://i.redd.it/r4g2pindpote1.jpeg,San Antonio ward wants kids to “walk with Christ through the stages of the cross”…nothing traumatic about recreating capital punishment in front of minors…,"Hi kids, wanna learn about a brutal execution method used on untold thousands of people in ancient and modern times? But this guy's was special, and if you drink coffee you're making it all for nothing.",1,1744150019.0,exmormon,1,1.0,False
1jupzwe,https://www.reddit.com/r/Market76/comments/1jupzwe/h_200_canned_coffee_w_polished_mods/,H: 200 Canned Coffee W: Polished Mods,,1,1744149988.0,Market76,1,0.67,False
1jupzf7,https://www.reddit.com/r/TimHortons/comments/1jupzf7/won_a_week_of_frre_tims_coffee/,Won a week of frre Tims coffee,"So excited to win the week of free 

coffee, my husband goes to Tims at least three times a day so this was perfect. I picked all the winners proud of myself.",1,1744149954.0,TimHortons,0,1.0,False
1jupz84,https://www.reddit.com/gallery/1jupz84,Couple of questions about epoxy tables mainly about adding legs,"Been working on these for my mom and mother in laws birthdays gifts. Had a few questions come up today after doing a bit of research.

The last picture of these legs I plan to use. How would I attach them without any issues? I don't want to have the wood separate from the epoxy or crack. Would threaded inserts be okay with a bolt? It should allow for expansion and contraction. Would I have to do anything? I have been research this for awhile and can't find an exact answer.

My second question is if I seal it with a finish, would I have to worry about expansion and contraction of the wood? If I seal it with a sealant such as rubio monocoat then a clear layer of epoxy, would it still expand and contract? First time so still learning.

Thank you all in advance :)",1,1744149939.0,BeginnerWoodWorking,0,1.0,False
1jupyxm,https://i.redd.it/vsnaxox1pote1.jpeg,"Graduation gift idea: personalized acrostic calligraphy scrolls! Each one is handwritten, sealed with wax, and totally unique to your grad. $28 with free shipping 💌
🛍️ https://lavslunaarts.etsy.com","🎓 Looking for a meaningful graduation gift that’s *not* just another generic card or coffee mug?

I create **custom calligraphy scrolls** where each letter of your grad’s name becomes part of a personalized acrostic poem – celebrating their journey, strengths, and future. 🖋️

These scrolls are handwritten on parchment, sealed with a wax stamp, and made to feel like something out of a storybook. ✨ They're great for grads of all ages—kindergarten through college—and make a beautiful keepsake they can treasure forever.

🛍️ $28 with **free shipping**  
📦 You can check them out here: [https://lavslunaarts.etsy.com]()

Happy to answer any questions if you're curious about the process! 😊",1,1744149915.0,u_Independent_Boss8314,0,1.0,False
1jupyv3,https://www.reddit.com/gallery/1jupyv3,Rotation: AMOC partnership!,"Been working with AMOC for pre-packaged bags!

Looks great, saves me time, and all look to be nitrogen sealed.

New Drop is this upcoming Monday! 4/15 

Please show your support and buy ALL from A Matter Of Concrete offerings! (Check out offerings on rotation.coffee) 

Let’s show them that a partnership with Rotation is worth the investment!",2,1744149911.0,coffeerotation,0,1.0,False
1jupxzr,https://i.redd.it/7fvqfs0yoote1.png,Coffee or Coconut?,,1,1744149847.0,appleorbanana,0,1.0,False
1jupvrv,https://www.reddit.com/gallery/1jupvrv,Pepper’s first month!,"Thank you to everyone for your love on my post introducing our grey pup, Pepper! A few asked for an update so since we’ve now had her over a month I thought I would share how we’re getting on 🥰

Pepper is now 5 months old and a whopping 17kg at her last weigh in (don’t worry we can still see & feel ribs, she’s just a biggun!) She has learnt how to sit and we’re almost there with potty training. Some things we’ve discovered about Pepper are: 

1. She is a thief. Her middle name is now Swiper. Our daughter was almost late to school the other day as pepper had kindly hidden her school shoes in different rooms in the house 😂 Toys, books, phones & anything on coffee tables are not safe from this master pickpocket! 

2. She is my shadow. Here she is (pic 1) helping me run my daughter’s nightly bath. I was under the impression that grey’s were quite an independent breed but little miss Peppercorn is anything but! She follows me everywhere and cries like a banshee when I leave the house. Hoping she’ll start to settle more soon so me leaving is less anxiety inducing for her. 

3. Loves pupcakes!! (See pic 3) peanut butter, bully sticks and strawberry yak chews. But if it’s food she’ll have it! Especially if it’s YOUR food

4. Things the dog park is the best thing ever! (Pic 4) we even got her to try some of the agility equipment, so excited to see if we can build on that in the coming weeks and months. 

5. She likes to eat her bully sticks Lady and the Tramp style with her frenchie sister, Minnie (pic 5)

6. She adores Minnie, and Minnie adores her! It’s sooo lovely to see their bond and how they look after each other. As you can see in pic 6 & 7 Minnie is now Pepper’s PR manager and only allows pre-arranged photoshoots! 


Now that the weather is warming up we’re hoping to take her for her first trip to the beach to stretch those long noodle legs, so stay tuned☀️",5,1744149688.0,Greyhounds,0,1.0,False
1jupvdw,https://www.teindiqueiofertas.com/java-burn-review/,Java Burn Review: Does This Coffee Supplement Really Work for Weight Loss? - Te Indiquei Ofertas,Click here and read the full article  ➡️,1,1744149662.0,DietTea,1,1.0,False
1jupv1s,https://www.reddit.com/r/brisbane/comments/1jupv1s/wholesome_wednesday_post/,Wholesome Wednesday Post,"to help bring some positivity into everyones week come share something positive that you've experienced this week.

had someone pay for your coffee? you paid for someones coffee? had a neighbour bring in your parcel to keep it safe? etc. post about it here 

spread the positivity",0,1744149642.0,brisbane,0,0.5,False
1jupu8o,https://www.reddit.com/r/dating_advice/comments/1jupu8o/what_am_i_supposed_to_text_between_dates/,What am I supposed to text between dates?,"So I (20M) just started dating for the first time recently, and I’ve gone in a couple dates with this girl but the third one is on Friday and I don’t know what to text her to keep a bit of connection. I’m thinking of just sending a good morning text, asking her how her day is going. Maybe ask her to grab a coffee if she doesn’t have anything planned. Is that a good plan? I can’t think of anything better to text ",1,1744149590.0,dating_advice,2,1.0,False
1jupu38,https://www.ebay.com/itm/155383754243?mkcid=16&mkevt=1&mkrid=711-127632-2357-0&ssspo=5m3qfks_rsy&sssrc=2380676&ssuid=5m3qfks_rsy&widget_ver=artemis&media=REDDIT,Pfaltzgraff 3 Village Stoneware Coffee or Tea Cups,Please come visit my Ebay store Bubby's Bazaar!,1,1744149580.0,u_Alternative_Cry_9329,0,1.0,False
1juptae,https://www.reddit.com/gallery/1juptae,How to achieve a more open crumb,"Did I underproof these ? I did a 2hr proof in the oven turned off. Did one bake and they still seemed underproofed (no airpockets) I let them sit in the fridge to slowly proof for 4hrs and it didnt do much. After that I let them sit for another hour in the oven turned off and they looked better but I still feel like they are underproofed judged on the inside.

Maybe the cacao/coffee layer also hinders it to fully expand?",1,1744149522.0,pastry,3,1.0,False
1jupt16,https://www.reddit.com/gallery/1jupt16,Change coffee volume using Nespresso Smart app,"Using the Nespresso Smart app, the coffee volume can be changed on any capsule that your Nespresso machine supports. I own a Nespresso Vertuo Next and use this feature somewhat regularly.

I refill my Vertuo capsules and depending on the coffee I used, or the capsule size, I would usually increase the coffee volume. Based on the coffee I have been using, I don’t notice a difference in taste, although I’m sure that a person with a more discerning palette than mine would notice.

Usually, I would use a Mug (7.7/7.8 oz) capsule and increase volume to 9.1 oz just so that I have more coffee to enjoy.

For anyone who values this functionality and is trying to decide between a Vertuo Plus and one of the other models that supports this functionality, this may help you in your decision. 

",1,1744149502.0,nespresso,0,1.0,False
1juprek,https://www.reddit.com/r/askgaybros/comments/1juprek/i_tried_to_bottom_for_the_second_time_in_my_life/,I tried to bottom for the second time in my life and a humiliating situation happened.,"Last week, I met a guy on Tinder and since then, we've been chatting all the time. He seemed really nice and cool. After a lot of chatting, he told me he was a versatile top and I honestly told him that I didn't feel comfortable being a bottom, but that I was fine with anything else. We met for the first time at a coffee shop near my neighborhood, and today we went to his house. Before we got there, we flirted and I thought it could be an opportunity to try it again, since the first time I bottomed with someone hadn't been the best (and the reason for that is below). I got ready and went.

When we got there, he took me to the guest room (I think) which was tiny and even had TWO bicycles next to the bed. We kissed a little and he simply put on the condom, fucked me and came in literally 2 minutes. And that was it. There was no foreplay, nothing. He didn't even touch me properly. And even though I did EVERYTHING to prevent that from happening, as soon as he took off the condom, a secretion came out on him (it was kind of colorless, I don't know if it was because of the lubricant), but he let out an ""aaah"", came out asking for the whole roll of toilet paper, took me to the shower, asked me to ""finish"" there and then, he changed the bed sheets and, in the end, I didn't feel good about the situation at all.

I still kept comparing myself to him, because he was all ripped, his dick was much bigger than mine, and we talked a little afterward, but I just wanted to leave. Anyway, now I'm crying and feeling horrible. Have you ever been through something similar?

^(\* My first time as a bottom was horrible because I was raped and I only realized what had happened after everything.)",3,1744149381.0,askgaybros,0,1.0,False
1juppph,https://i.redd.it/uyrykhm7note1.jpeg,'Six times the cuteness!' Sextuplets born for the first time at Davis Farmland in Sterling,"https://www.telegram.com/story/news/local/2025/04/08/sextuplet-finn-lambs-avis-farmland/82989259007/

The newest additions at Davis Farmland are tiny, fluffy, full of energy, and a first for the organization. The farm welcomed sextuplet Finn lambs this spring, and while the breed is known to give birth to multiples, six is incredibly rare.


The lively bunch have been given names to match their energy: Coffee, Cold Brew, Latte, Expresso, Mocha and Chai.


Davis Farmland opens for the season April 17 and the new lambs are just some of the baby animals that have recently arrived.


""So far, we've got baby goats, lambs, kittens, alpacas and even a baby llama,"" said manager Nicki Sacco, adding this year they've seen a ""serious case of baby fever"" on the farm.


This year, the farm has added new farm-themed play areas full of hands-on activities. Later in the summer, it is expected to open a brand-new water spray park.


""This spring, families visiting Davis Farmland will get to meet the new lambs up close and learn about the importance of endangered/heritage breeds in farming and conservation,"" Davis Farmland wrote in a press release.


Endangered species and heritage breeds have long been a priority for Davis Farmland, which created a nonprofit, The Farmland Conservancy Inc., in 1995, to provide care for endangered farm animals. Currently, Davis Farmland houses the largest collection of endangered farm animals in the country including Highland cattle, Poitou donkeys, Nigerian dwarf goats, alpacas and camels.",2,1744149255.0,central_ma,0,1.0,False
1jupp46,https://i.redd.it/yioeqku2note1.jpeg,Nutty,,1,1744149213.0,namesoundalikes,0,1.0,False
1jupoqp,https://v.redd.it/ys9w7n30note1,"Coffee goes a-flyin, hits my car!",,4,1744149186.0,MildlyBadDrivers,4,1.0,False
1jupo5k,https://i.redd.it/z7br7xupmote1.png,"First day ""on campus.""",Loving USC so far. Shout out to Kevin and all the alums.,4,1744149142.0,HollywoodHandbook,0,0.75,False
1jupmqg,https://www.reddit.com/r/pregnant/comments/1jupmqg/rage_consumes_me/,Rage consumes me,"Today was one of those days where I just felt like a bad pregnant person. I called off of work and totally used pregnancy as an excuse because I’ve been so angry recently about everything and today I just needed a day of peace. I didn’t eat breakfast until like 12:30, I’m having a coffee, I cleaned my car because it’s filth has been pissing me off, I cleaned my boyfriend and I’s room because he doesn’t do SHIT even though I’m always exhausted and can never find the energy to clean, and I’m going to clean the bathroom. The filth around me is upsetting. Then he has the audacity to tell me not to have a coffee?! Like hun, I’m fucking exhausted and I’m cleaning up all of our shit all while creating a human being. He says he helps but I just don’t think it’s enough and I’ve spoken on this countless times. I just wish I could feel cared for when I feel like I’m putting my all into this baby. I’m exhausted. ",1,1744149043.0,pregnant,1,1.0,False
1juplsy,https://www.reddit.com/gallery/1juplsy,I was only a kid and never liked coffee~,But somehow these bars were so good. Miss em so much lol,7,1744148979.0,forgottenfoods,1,1.0,False
1jupkwc,https://www.reddit.com/r/AdvLiterateRP/comments/1jupkwc/fpm4apf_girl_goes_countryunwillingly_city_girl_x/,[FpM4ApF] GIRL GOES COUNTRY...UNWILLINGLY | City Girl x Cowboy | F x M | 18+,"\> ▪︎ INTRODUCTION

Hello, you can call me Trixie or Tracy. F18 here. My timezone is CET. 

NOT REPLACING ANYONE! DM me if I forgot to reply (school hhh)



\> ▪︎  WHAT AM I LOOKING FOR?

• MxF pairings. I only play as male characters for personal preference. 

• Advanced Literate or Novella writers.

• 18+ only

• I would to speak with you about the characters' development and arcs throught the story.

• I only roleplay as 18+ characters.



\> ▪︎ WHAT AM I WILLING TO ROLEPLAY?

Tropes: small town • enemies to lovers • slow burn • ranch drama • land feud

Y/C had it all: designer everything, a penthouse view, and enough influencer clout to never worry about the real world. That is, until a PR scandal tanked her brand and sent her spiraling into the headlines for all the wrong reasons. Her fix? A summer in the middle of nowhere, specifically, her grandmother’s dusty old ranch in Wyoming, where there’s no Wi-Fi, no decent coffee, and a whole lot of cows. She hates it.

Until she meets my character, a rough-around-the-edges rancher with piercing eyes, fire in his gut and a charming facade, he's known Y/C grandmother for years. What he doesn’t have time for is a bratty city girl who thinks life is a reality show. Still, somehow she keeps getting in his way, especially as her grandmother’s health takes a turn and Y/C forced to stay longer than planned.

However, things aren't going smoothly. The family’s ranch is under siege from a rival clan with deep pockets, dirty secrets, and a plan to flip the town into a commercial hellscape. Y/C might just hold the key to stopping them… if the two of them can stop bickering long enough to work together.

\---

That's it, DM me if interested so we can start brainstorming together a unique plot and explore the characters dynamics!! 

",1,1744148915.0,AdvLiterateRP,0,1.0,False
1jupkmp,https://www.reddit.com/r/BreakUps/comments/1jupkmp/he_wants_a_divorce/,He wants a divorce,"I guess I just need to vent a little & dont wanna get into much detail, but we’ve been having lots of fights & misunderstandings which affected our connection & intimacy. we tried to go to counseling & planned for it but couldnt afford it & never went which drove a wedge between us until we broke. we’ve been together for 4 years, married for 1. we have a beautiful cat together & we wanted to have kids after we get better emotionally, mentally & financially. we even chose names for our kids & had so many plans for the future… I feel like Im going insane because I cant move on (its been almost a week), I had my first lunch in a week, usually I only have breakfast so I can take my antidepressants but today I decided to have lunch too, thats progress, I guess? my best friend is in canada & I feel absolutely alone right now. She usually calls me every night & we watch a show together but today she’s busy & I feel so alone sitting alone in a coffee shop sobbing as Im writing this. my parents loved him so much & I still have no idea how to tell them (they live in another city), my mom has severe anxiety & she’ll be crushed. I wish we could’ve afforded counseling, we would’ve still been together by now. I miss him so much & the house feels so empty & cold without him… ",1,1744148896.0,BreakUps,0,1.0,False
1jupkkq,https://archiveofourown.org/works/64377205/chapters/165272527,"""The Best Laid Plans"" by TheBoyWhoWrote, the first fic for the HMS Harmony Fool's Fest",,4,1744148892.0,HPharmony,1,1.0,False
1jupke3,https://www.reddit.com/gallery/1jupke3,Looking for these cards. Let’s talk stars ☺️,,1,1744148878.0,Monopoly_GO,1,1.0,False
1jupk6j,https://i.redd.it/4v3bdxb1mote1.jpeg,WTT H: Canned Coffee W: Leaders,,1,1744148862.0,Market76,1,0.67,False
1jupjbw,https://www.reddit.com/gallery/1jupjbw,I:1 trade have v need,Let me know! Finishing sets!,1,1744148800.0,Monopoly_GO,13,1.0,False
