id,url,title,text,score,created_utc,subreddit,num_comments,upvote_ratio,over_18
1hot2ji,https://www.reddit.com/r/nbacirclejerk/comments/1hot2ji/i_am_going_to_end_my_existence/,I am going to end my existence,"https://preview.redd.it/po13fqgnhr9e1.png?width=1024&format=png&auto=webp&s=cf477ca05243b894a62e488c7bffcd426cd45bf0

Title: Cross-Court Connection  
In the heart of Indianapolis, under the bright lights of Gainbridge Fieldhouse, two stars from different basketball worlds found an unexpected connection. Caitlin Clark, the electrifying guard for the Indiana Fever, known for her sharpshooting and game-changing plays, had just wrapped up a practice session. Meanwhile, Tyrese Haliburton, the Pacers' point guard, renowned for his court vision and dazzling passes, was doing the same on the other side of the arena.  
As they both headed towards the exit, their paths crossed in the quiet corridor. Caitlin, still in her sweat-drenched jersey, was fiddling with her water bottle when she accidentally bumped into Tyrese, causing him to drop his phone.   
""Oh, I'm so sorry!"" Caitlin exclaimed, bending down to pick up the phone.  
""No worries,"" Tyrese laughed, his smile lighting up the dim hallway. ""I've been meaning to drop some calls anyway.""  
Their laughter mingled, creating a melody that seemed to echo through the empty halls. They walked together towards the parking lot, talking about the pressures of being young stars in a city that lived and breathed basketball. Tyrese shared tales of his high school games in Wisconsin, while Caitlin reminisced about her days in Iowa.  
The conversation flowed effortlessly, leading them to a local diner where they decided to grab a late dinner. Over burgers and fries, they discovered they had more in common than just basketball. They both loved old school hip-hop, had a soft spot for dogs, and shared a passion for community service.  
As the night turned into early morning, they found themselves sitting closer, their knees touching under the table. Tyrese looked at Caitlin, his eyes reflecting sincerity and a hint of something more. ""You know, I've always admired your game,"" he said, his voice low. ""But tonight, I think I've started to admire you more.""  
Caitlin blushed, the compliment catching her off guard. ""I could say the same,"" she replied, her voice steady but her heart racing. ""Your passes are pretty, but your company is even better.""  
They left the diner hand in hand, the city lights painting a backdrop for their burgeoning connection. In the days that followed, they were often seen together, not just at practices or games but at charity events, local festivals, and quiet coffee shops. Their bond became the talk of the town, a story of love that transcended rivalry, uniting fans from both the Fever and Pacers.  
As the season progressed, their on-court performances seemed to elevate with their off-court relationship. Caitlin's shots were more precise, and Tyrese's assists more magical, as if they were passing not just a basketball but love and inspiration across the court.  
Their love story became as legendary as their games, proving that sometimes, the greatest connections are made not just by chance, but by the heart's alignment with another's passion and drive. In Indianapolis, Caitlin Clark and Tyrese Haliburton weren't just stars; they were a constellation, shining together, lighting up the night sky of basketball and love.",1,1735466851.0,nbacirclejerk,0,1.0,False
1hot1td,https://www.reddit.com/r/DandysWorld_/comments/1hot1td/more_to_the_au/,More to the au,The main cast act pretty different shrimpo is the most like there normal version each have their own kinda gang scraps and goob have one together same with sprout and Cosmo and some new toons have their own gangs some don't really act like a gang ones basically just a coffee shop,1,1735466758.0,DandysWorld_,0,1.0,False
1hot0vr,https://www.reddit.com/gallery/1hot0vr,I love the visual of Apple Maps so much that I would love a CitySim Game to be in this style,"This post is translated into English:

Not sure why, but Apple Maps’ 3D models feel particularly refined to me. Maybe it’s the way shadows are handled, the perfectly balanced simplifications, the lighting, the color palette, the terrain, or perhaps the details like the trees. Whatever the reason, it gives me the same kind of elegance as games like Monument Valley. Other map apps are decent too, but they often feel slightly off in terms of integration.

Lately, I’ve been idly exploring cities in Apple Maps with DCE (Detailed City Experience) instead of checking out satellite 3D views. I’ve developed a real fondness for this non-realistic, “model-like” texture. Even when playing Cities: Skylines, I always find myself switching to the white model view.

Honestly, I’d love a city-building game with the visual style and texture of Apple Maps. Imagine a game where landmarks have unique models, transit lines flow semi-transparently through the city, and other buildings are procedurally generated with white models overlaid with colors to represent zoning and density. Traffic and pedestrians could simply be represented by dots of varying sizes to indicate flow. This could bring back the data-focused design of SimCity 4, which was much less reliant on realism. It would also avoid the performance demands and new issues introduced by agent-based systems in games like SimCity (2015) or Cities: Skylines.

Though not realistic, such a design could strike an excellent balance between visual quality, development cost, and performance requirements. It might even pave the way for a large-scale, in-depth city-building game on mobile platforms. Imagine it being added to Apple Arcade as a premium, ad-free game—that thought alone is exciting. My ultimate daydream? Apple themselves creating a game using Apple Maps’ UI and assets. That would be a dream come true.

In a way, Mini Metro and Mini Motorways touch on this concept, but they don’t quite reach this scale. If their studio created a “MiniCity,” it might come close to this idea.

Oddly enough, Tokyo still doesn’t have DCE， which is a shame",2,1735466644.0,applemaps,0,0.75,False
1hot06y,https://www.reddit.com/r/bologna/comments/1hot06y/brunch_in_bologna/,Brunch in Bologna,"Hi all, I am visiting Bologna and looking for healthy brunch places (trying to avoid having croissant every day). Something where we can find the usual eggs, açai bowl maybe and good coffee. Many thanks! ",2,1735466559.0,bologna,1,1.0,False
1hot05e,https://i.redd.it/recvhit2hr9e1.jpeg,Too late to go back to sleep. Too early for coffee. I guess I’ll just drop this here instead. ,,2,1735466552.0,Firefighting,0,1.0,False
1hosz9w,https://i.redd.it/ox8w2fyrgr9e1.jpeg,Weird flex. Just take the train. ,Of course every cleaning person and Burger King staff would be tremendously more productive with their own driver. Also it’s clear that one of his hours is worth shit. ,5,1735466452.0,LinkedInLunatics,2,1.0,False
1hosz4y,https://www.reddit.com/r/popculturechat/comments/1hosz4y/sip_spill_daily_discussion_thread/,Sip & Spill Daily Discussion Thread,"**Grab your coffee & sit down to discuss the tea!**

This space is to talk about anything pop culture or even off-topic.

*What are you listening to or watching? What is some minor tea that doesn't need its own post?  How was your date? Why do you hate your job?*

Please remember [rules still apply](https://www.reddit.com/r/popculturechat/wiki/index/rules/). Be civil and respect each other.

**Now pull up a chair and chat with us.** ☕",1,1735466438.0,popculturechat,1,1.0,False
1hosz4b,https://open.spotify.com/episode/0o9o6vupxuhc1lGJ4MrDnE,"""How Diddy Helped make J Lo a Music Star & Bought her Silence"", Coffee & Cults: A Deep Dive Into Hollywood, 28 Dec 2024 [1:34:48] ""Diddy & Jennifer Lopez were an item back in the late 1990's & early 2000's & during their relationship the both went through huge life altering moments. During their r…""",,1,1735466436.0,cultpodcasts,1,1.0,False
1hosy8p,https://www.reddit.com/r/QuittingZyn/comments/1hosy8p/caffeine_pouch_recommendations/,Caffeine pouch recommendations. ,"I’ve stopped using nic pouches but my God do I love to pop an upper deckie. 
I thought of switching over to caffeine pouches. 
I’ve come across Can Of Joe, Berserker and Gr1nds coffee pouches. 
Anyone has had any experience with them? Is the buzz the same as nic pouches? ",1,1735466338.0,QuittingZyn,0,1.0,False
1hosxd8,https://www.reddit.com/r/tipofmytongue/comments/1hosxd8/tomt_i_watched_this_movie_as_a_kid/,[TOMT] i watched this movie as a kid,"i remember very little of this movie, and i just had a flashback of it rn, but this was a movie i watched when i was around 5 years old. i think i remember the opening scene being where the male or female opens the door and enters a coffee shop, the walls were yellow, and it had an early 2000s vibe to it (the movie was likely made before 2010). it was a live-action, and for some reason i’m connecting a white and small female dog, a veterinarian, someone, or the dog, dies (or maybe almost dies), and a love story kind-of plot. i’m probably mixing movies together, but again i don’t remember much. ",1,1735466221.0,tipofmytongue,2,1.0,False
1hosx3c,https://www.reddit.com/r/mangalore/comments/1hosx3c/oat_milk/,Oat milk ,Does anyone know of anywhere that sells oat milk or serves oat milk coffees in Mangalore? I love my morning coffee and haven’t been able to have it since getting here. Don’t want to go to Starbucks. ,1,1735466184.0,mangalore,2,1.0,False
1hoswjw,https://www.reddit.com/r/offmychest/comments/1hoswjw/i_cant_tell_if_im_being_bullied_and_it_makes_me/,i can’t tell if i’m being bullied and it makes me want to quit ,"(i’m not using anyone’s real names in this just fyi) 

i got this job back in august, im a barista at a coffee shop. i love it, and i can genuinely see myself doing it for the next 4-6 years. 

i’m on the spectrum, if you talk to me it’s not super obvious, but i’m sure you could figure it out. watching me walk and move around is probably a bigger sign. i don’t just tell people that im autistic because i want them to get to know me first. i’m also just insanely insecure about it, id give anything and everything to just not be autistic. 

 long story short, i told a coworker (let’s call them billy for the sake of the post). billy said they picked up that i probably had something but wasn’t sure and didn’t want to ask as to not be rude, which is perfectly understandable. everyone i’ve told about my autism since then has been so kind. 

i’ve been working super hard to get situated into my job and learn all my coworkers names. i want to make friends here, and i want to learn who to avoid/maybe who isn’t nice? . i’ve worked a handful of shifts with this girl and she’s so rude every single time i work with her (lets call her riley for the sake of this post). she only ever says the most blunt things, bland expressions on her face, no signs of friendliness ever. she’s only ever like this to me and the other person with autism. i can name instances of her being pointlessly rude. 

although billy said that riley doesn’t like them either, so maybe she just doesn’t like certain people? but billy has a lot of empathy and tends to just say things to join. 

i told my boss about this whole mess and she’s talked to riley about it. it even ended up getting other people involved that had seen certain events which i wasn’t planning but they did help i suppose. post boss talking to riley my plan has been to straight up avoid her as much as i can, not be rude, but just neutral. if she needs help i’ll help her and leave the interaction asap. my plan was NEVER to deliberately ruin her life. 
we got shoved together to work on the same station and i was just trying to get it done, when she needed an order i would just slide it down, no problem. i think she’s began taking it the wrong way because i was dropping stuff off in the back and she came in there too and said “behind” and bumped me to the side. even now i can’t figure out if she meant to do that or not because it is cramped back there. 

i don’t know what to do about all this. it’s been stressing me out since it started. i’m tired of reporting back to hr - should i lend her an olive branch? if so im gonna write her a note apologizing, explaining, and asking her to text me or wait so we can talk in person. ",1,1735466115.0,offmychest,0,1.0,False
1hosvtz,https://www.reddit.com/r/MakeNewFriendsHere/comments/1hosvtz/30m_from_sunny_australia_seeking_a_friendly_spark/,30M from sunny Australia 🇦🇺 Seeking a friendly spark. Prefer long term. 100% no-ghosting guarantee! ,"I'd love to connect with a friend or two locally or internationally for some good times and some fun day to day chat. Anything goes from ranting about work/family to discussing/creating wild conspiracy theories, from sharing life stories to pictures of interesting trees/graffiti/anything else. 

I'm a working professional. Outside of work, I volunteer, exercise, visit local markets, cook, binge on horror/psych thriller movies/shows, and read. I can easily pick up a random topic to talk about, but my main interests include fitness, exercise, finance, and cooking. I love coffee, straight up black with nothing else (except water... Boiling water!). Dark jokes are welcome. I enjoy learning about people's life experiences and perspectives on different things. I'm genuinely good at listening too for when you need to vent. 

I'm open to all locations, relationship statuses, employment statuses, native languages, ages, ethnicities, religions, etc. As long as we can hold a good conversation and vibe well, that's all that matters. A big plus would be if we share the total despise for ghosting too 👻

Looking forward to reading from you.",1,1735466024.0,MakeNewFriendsHere,1,1.0,False
1hosvtj,https://www.reddit.com/r/BokunoheroFanfiction/comments/1hosvtj/what_if_izuku_was_raised_by_eraserhead_but_became/,What if Izuku was raised by Eraserhead but became a villain instead?,"After his house got burnt down by Endeavor’s scorching flames, Izuku is put into an orphanage and is later then adopted by Aizawa and Yamada, who raise him with love and discipline (and coffee). Despite him being quirkless, Izuku grows up intelligent, resourceful, and fascinated by Aizawa’s underground hero work, as well as a subtle growing hate towards Endeavor and many other heroes. 

During one of Aizawa’s trips to the ‘grey zone’ - a neutral ground for heroes, villains, and vigilantes - to gather more information on a certain villain he was chasing down, Izuku decides to tag along and unexpectedly bumps into Giran, who sees potential in the boy’s incredible analytical abilities.

Fascinated by the morally grey world of the underground, Izuku begins secretly visiting Giran whenever Aizawa returns to the grey zone. Over time, Giran became his unofficial mentor, teaching Izuku the art of negotiation, strategy, and manipulating. In return, Izuku begins to help him behind the scenes, analyzing quirks, weaknesses, and strategies for clients who pay a hefty amount. Starting off as a harmless side gig, the job quickly spirals down into something darker and deeper, and Isuku becomes infamous in the underground as one of the best analysts whose information has led to the downfall, and even death, of several pro heroes, causing Izuku’s reputation as an analyst to rise in the underground. 

But things take a turn when Tsukauchi takes on the case of the new analyst who has been causing so much problems for the heroes. With more and more evidence (and stress) piling up, Tsukauchi gets the help of Nezu and Eraserhead, unknowingly pulling Izuku’s adoptive father into an investigation against him. Izuku, aware of the case, has to put more caution and care into maintaining his double identity while avoiding the detective. 

Poor dadzawa once he finds out :(

Let the chaos begin… 😈😈",4,1735466023.0,BokunoheroFanfiction,0,1.0,False
1hosv8o,https://www.reddit.com/r/decaf/comments/1hosv8o/caffeine_alternative_guarana/,Caffeine alternative - Guarana?,Hey guys normal coffee or black tea gives me bad mood so i drink it since 3 weeks but i miss the energy i got from caffeine. Do you think Guarana could replace it without the sideeffects?,1,1735465949.0,decaf,2,1.0,False
1hostwe,https://v.redd.it/8ks4mv4ser9e1,Oracle Touch potrafilter won’t rotate and lock,"Hi! 

Wanted to do my coffee today and suddenly portafilter stopped fitting the grind outlet. I can insert it but it won’t rotate to the lock position.

I already cleaned the tamp fan. What could be the issue? I have the device for two months now.",1,1735465781.0,BrevilleCoffee,0,1.0,False
1hostrf,https://www.reddit.com/r/developersPak/comments/1hostrf/is_this_a_good_idea/,Is this a good Idea? ,"I'm thinking of creating something regarding reminders in WhatsApp.

Where the user would receive reminding messages for different times of the day. 
Like for lunch 
For a break 
For a walk or a coffee 
For dinners 
For good night and a good morning message in the morning. 

It's just a start. 

So it a good idea? 

It's not for money or anything but just a simple thing for people who are either lonely or are lost in work that they forget about time and to look after themselves. ",2,1735465761.0,developersPak,1,1.0,False
1host9x,https://i.redd.it/gtpszrrjer9e1.png,Damn giorno ,,10,1735465703.0,JoJoMemes,1,1.0,False
1hosrty,https://i.redd.it/a970d0d0er9e1.jpeg,Big line outside Macchiato,"I wonder what the occasion is, if any. Anyone know?",1,1735465523.0,foodies_sydney,1,0.67,False
1hosqta,https://www.reddit.com/r/Cebu/comments/1hosqta/cebu_city_day_trip_recommendations/,Cebu city day trip recommendations,"Hello, I will be in Cebu in January and will have one free day to explore the city. Any recommendations on where to go? Would also appreciate your recommendations for food places and coffee shops. Thanks!",1,1735465398.0,Cebu,0,1.0,False
1hosp2o,https://www.reddit.com/gallery/1hosp2o,I am an amateur coffee enthusiast from India and have just started my coffee journey. This is my small inexpensive setup.,"Hi everyone. My setup consists of the following:

1. Agaro Imperial Espresso maker
2. Agaro Supreme Steel burr grinder
3. Pressurized basket portafilter (51mm)
4. Supvox Dosing cup
5. THX tamper (30 lb)
6. Supvox Distributing tool 
7. Supvox Espresso stirring pin set
8. Sprayer
9. Supvox Milk frothing pitcher (12 oz)
10. Sipologie Weighing scale (0.1 gm interval)
11. Rubber air blower
12. Supvox Puck screen (51mm)

Currently using the Lavazza Gusto Crema beans. Dosing at 14 gms for a 28 gms yield within 30 secs.",5,1735465185.0,espresso,2,1.0,False
1hoso0l,https://www.reddit.com/r/MakeNewFriendsHere/comments/1hoso0l/21f_looking_for_someone_to_hangout_and_bond/,21F Looking for someone to hangout and bond together.,"I hope this message finds you well! I’m looking to connect with new friends and expand my social circle. Whether you’re into outdoor adventures, movie marathons, or just grabbing coffee and chatting, I’d love to meet up and get to know you better.",4,1735465050.0,MakeNewFriendsHere,1,1.0,False
1hosnf9,https://www.reddit.com/r/SatisfactoryGame/comments/1hosnf9/satisfactory_ficsmas_tree_avenue/,Satisfactory Ficsmas Tree Avenue,"[Whole Factory Night-time View](https://preview.redd.it/9aek8dwdbr9e1.jpg?width=1440&format=pjpg&auto=webp&s=159c069e861e99d4450c032f42e8a845ed59df3a)

[The Tier 1 Ficsmas Tree](https://preview.redd.it/8xk5yg2fbr9e1.jpg?width=1440&format=pjpg&auto=webp&s=eb0a833667f8fe61a086138b7ef7db6533d39b8f)

[The Final Ficsmas Tree](https://preview.redd.it/8mbe7oqfbr9e1.jpg?width=1440&format=pjpg&auto=webp&s=abc1a4dc4510058503bb856f3dceda225358f403)

[Both Tier 1 and Tier 2 Ficsmas Trees](https://preview.redd.it/p3pvlqcgbr9e1.jpg?width=1440&format=pjpg&auto=webp&s=7b822e826d3ad13a06429e4387390cbb5b11b954)

[The Present Storage Containers](https://preview.redd.it/y80zeg4hbr9e1.jpg?width=1440&format=pjpg&auto=webp&s=525fc4c06a7b4f76bb941f535d3aa6203cbd5be1)

[The Gift Tree Forest](https://preview.redd.it/strqc2phbr9e1.jpg?width=1440&format=pjpg&auto=webp&s=2a8e3021c93aa5c2d721c2a10fe39af0a3aa8a03)

[The Starting Gift Entrance to the Factory which also stores the Wonder Stars.](https://preview.redd.it/ms904u8ibr9e1.jpg?width=1440&format=pjpg&auto=webp&s=ef5b3deba108eb686e269999a3ef76fcacc087f7)

My Ficsmas Factory for the Contest. This took about 12 hrs to make and produces 4 Wonder Stars per Minute along with excess of every other main part which are stored in the present shaped storage containers. Hope you like it Coffee Stain.

[Full Ficsmas Factory Tour](https://reddit.com/link/1hosnf9/video/hbiq693aer9e1/player)",2,1735464974.0,SatisfactoryGame,0,1.0,False
1hosmkk,https://v.redd.it/b93jt451cr9e1,Is my shot good?,"The initial shit when I am pre-infusing doesn't seem to be well distributed. Why is that and how can I make it better? 

I am using neo flex, k6 at 40 ticks, and a coffee from a local roaster - medium dark roast. Is there something else I can do better. 
I noticed that there was water in the portafliter  after the shot. Should I grind a lil finer? ",1,1735464865.0,FlairEspresso,5,1.0,False
1hosmf3,https://www.reddit.com/r/beermoneyuk/comments/1hosmf3/50_credit_when_switching_to_octopus_energy/,£50 credit when switching to Octopus Energy,"**Get £50 Credit When You Switch to Octopus Energy!**  

Looking for greener energy and savings on your bills? Switch to Octopus Energy today and enjoy a £50 bill credit after your first Direct Debit payment!  

# [**Claim Your £50 Now**](https://share.octopus.energy/grey-koala-624)  

Already signed up? Enter the referral code **grey-koala-624** to receive the same bonus!  

---

**Why switch to Octopus Energy?**  
- Competitive rates that could lower your energy bills.  
- Award-winning customer service that makes switching hassle-free.  
- 100% renewable electricity, so you’re helping the planet too!  

**Switching is simple and takes just a few minutes:**  
1. Click my [referral link](https://share.octopus.energy/grey-koala-624) to get started.  
2. Enter your postcode to receive a personalized quote.  
3. Confirm your switch if you’re happy — it’s that easy!  
4. Your switch will be completed in just two days.  
5. Enjoy £50 credit after your first Direct Debit payment is processed.  

---

**The perks don’t stop there!**  
Once you’re an Octopus Energy customer, you can:  
- Share your referral code with friends and family. For every successful referral, you and your friend will both receive £50 credit!  
- Join **OctoPlus** (for smart meter customers) and unlock exciting benefits like:  
  - A free coffee every week from Caffe Nero or Greggs.  
  - Discounted cinema tickets.  

Want to know more?  
[Learn More](https://octopus.energy/blog/octopus-referrals/) | [T&Cs](https://octopus.energy/policies/terms-and-conditions/) | [Non-Referral Link](https://octopus.energy/)  
",6,1735464846.0,beermoneyuk,21,1.0,False
