id,url,title,text,score,created_utc,subreddit,num_comments,upvote_ratio,over_18
1g6u1wc,https://www.reddit.com/r/Perfumes/comments/1g6u1wc/coffeenonsynthetic_smelling_gourmand/,coffee/non-synthetic smelling gourmand?,"i’ve been searching for like months for a good perfume that smells like coffee and or like a warm, non-synthetic smelling vanilla? a specific reference to the smell i’m thinking of is the french vanilla tilamook ice cream. also, cruelty free pls!! 💌",1,1729289304.0,Perfumes,1,0.99,False
1g6u1n1,https://www.reddit.com/r/SanDiegoClassifieds/comments/1g6u1n1/howloscream_seaworld_entrance_tickets_2/,Howl-O-Scream Seaworld entrance tickets (2),"I have 2 tickets that I got for a donation I made. I'm not into Halloween events, so I'd rather take my wife to dinner lol. 

(2) Tickets for $60. These are selling for $45-$49./each 

Info on ticket: No blackout dates! One single night admission. Valid until 10/31/2024. 

We can meet at Panera downtown to exchange. I'll even buy you a soft drink or coffee, on me.

",1,1729289284.0,SanDiegoClassifieds,0,1.0,False
1g6u0hg,https://www.reddit.com/r/Gastroparesis/comments/1g6u0hg/does_anybody_else_get_nauseous_from_warm/,does anybody else get nauseous from warm drinks/liquids?,"hey guys!

I searched the sub but it seems like most people have the opposite issue: I noticed that I get nauseous from warm liquids! I never liked them and in hindsight I think this might be the reason why. I get nauseous from tea or warm coffee, while iced coffee is fine. I just made some pudding and just ate a spoon of it warm > nauseated. I can eat it just fine once it's cooled down.

is anybody else the same? I tolerate water and juices and stuff way better when it's iced, even warm it often makes me nauseated.

anybody else? and any idea why? it seems like many people here think that warm liquids help with digestion, but I generally prefer my meals cold. I'll have to observe if I can tolerate solid food cold better than warm, but I think I might be.",2,1729289193.0,Gastroparesis,1,1.0,False
1g6tzhp,https://www.reddit.com/r/shittyaskreddit/comments/1g6tzhp/how_much_my_life_would_be_easier_if_i_could_or/,How much my life would be easier if I could or would just say hi and maybe even if you just want to grab a coffee?,"But who am I kidding, I don’t even know who I’d say that to, or if I’d even want to. I don’t know.",1,1729289116.0,shittyaskreddit,0,1.0,False
1g6typ4,https://i.redd.it/jceh4z058lvd1.jpeg,"Coffee stand, France 1900.",,1,1729289056.0,dragonutopia,0,1.0,False
1g6tyj8,https://www.reddit.com/r/gaggiaclassic/comments/1g6tyj8/is_this_model_affected_by_the_boiler_issue/,Is this model affected by the boiler issue? ,"GAGGIA

COOKING APPLIANCE:

ESPRESSO COFFEE MAKER R19303/47

TYPE: SIN 035 (CLASSIC)

120 V ~ 60 Hz 1425 W

A

Serial N°: TW901336455846 DO NOT IMMERSE

09/2013

SERVICE:1-888-389-4123

886930347540

9307USOC0011

USAGE DOMESTIQUE SEULEMENT",1,1729289045.0,gaggiaclassic,0,1.0,False
1g6ty86,https://www.reddit.com/r/Anemic/comments/1g6ty86/doc_saying_my_abnormal_results_are_normal/,doc saying my abnormal results are normal?,"had a cbc panel done today and along with a first time reticulocyte count+hemaglobin after a bout of abnormal panels.

most results came back normal this time, some on the very low end of normal, but 3 results were flagged as abnormal. 

mean cell hemaglobin concentration was 31.8 (slightly low)

immature reticulocyte fraction was .15 (slightly high)

reticulocyte hemaglobin was 30.8 (significantly low)

there are multiple other results that were normal but on the very low end. to further clarify, i have NO nutritional deficiencies (iron, b12, foltate, everything is within perfectly normal range)

it'd be one thing if i were otherwise healthy... but im not whatsoever. im only 23 and 100lbs with stage 2 hypertension, sinus tachycardia, and history of AFIB (+POTS). to me this looks like a mild form of anemia, perhaps thalassemia, that is taking a toll on my organs. i was supposed to have genetic testing done as a child due to congenital hypontonia but was never taken.

i dont know if i should even respond to him in fear of being mislabeled as a hypochondriac. i dont want to be sick, i want to find a reason and possible treatment for all the ridiculous health issues i have at my age.

i also stupidly had nothing but coffee prior to my appt, because i wasnt expecting to have blood drawn today. i know that can cause a higher concentration skewing results. when i had my last draw and was adequately hydrated, my cbc panel results were far more extreme/low. i dont know what to do😐",1,1729289019.0,Anemic,0,1.0,False
1g6tvty,https://www.reddit.com/r/CVS/comments/1g6tvty/kinda_pisses_me_off_someone_selling_coffee_gets/,Kinda pisses me off someone selling coffee gets paid more than we do (in New York),"My friend works at Starbucks and has a starting salary of 20$, meanwhile starting pay for pharmacy tech is 17.50$, there is no way cvs can’t afford to pay everyone 2.50$ more ",1,1729288838.0,CVS,1,1.0,False
1g6tvke,https://www.reddit.com/r/phishing/comments/1g6tvke/another_usps_text_scam/,Another USPS Text Scam...,"Text scam saying package undeliverable, gives a link, etc. It's such a common one and I fell for it while half awake. Already feel like an idiot, but this is why you shouldn't do anything until after your coffee.

I'm in the middle of moving and have some important packages I'm waiting on at the new address. I haven't set up my mail forwarding yet, so it didn't set off any flags for me until after I submitted my info. I locked my card to be safe, and will be getting a new one, but the address I entered is not my billing address. Can they actually do anything with it?",1,1729288820.0,phishing,0,1.0,False
1g6tuxf,https://www.reddit.com/gallery/1g6tuxf,Nice ride around Milford/Kensington,"Parked at Kensington and took the trail into Milford. Grabbed a coffee at Probing Grounds, then rode out to some singletrack and hit some fun gravel. Topped it off with a ride around the lake at Kensington. Great day for it!",4,1729288775.0,MichiganCycling,0,1.0,False
1g6tulz,https://www.reddit.com/gallery/1g6tulz,Starfield mug shots (I'm sure they are others...),,1,1729288751.0,AmazingStarfieldPics,0,1.0,False
1g6tujg,https://www.reddit.com/r/MeetPeople/comments/1g6tujg/relationship_32_m4f_orangecounty_california/,"[Relationship] 32 [M4F] #OrangeCounty, California - looking to make a connection","Nerdy, witty, and here to threaten you with a healthy relationship 🔫

I'm 32, male, 181lb, 6'0"", Southeast Asian, average build. A professional engineer by day and a food dispenser for my cat by night. A bit of a homebody and night owl so I don't often get the chance to meet people, so giving reddit a go. Dating apps are just... no.

I currently live on my own and my two big hobbies are anime and videogames. Currently obsessed with FFXIV, Honkai: Star Rail, and Hololive lol. Other hobbies being sleeping, cooking, visiting new coffee shops, trying new foods, biking on trails, and making poor attempts at exercise to stay in shape. I only ask that you aren't overweight yourself.

Let's chat about our passions and hobbies or let me see how many times I can make you laugh. We don't have to like all the same things, tell me what you're into! Would love a genuine connection that could lead to long term dating but I'm open for anything. ",1,1729288746.0,MeetPeople,0,1.0,False
1g6tugc,https://www.reddit.com/r/h3h3productions/comments/1g6tugc/with_peace_and_love_get_ethan_an_insulated_cup/,With Peace and Love get Ethan an insulated cup!,I don’t care if it’s yeti or another brand but Ethan’s hot coffee complaints aren’t hard to fix. You don’t need a $150 self heating/warming cup. I have a yeti mug (was a gift) and what I do is pour hot boiling water into it then I prepare my tea or coffee in a separate mug then dump out the yeti full of boiling hot water and pour my tea/coffee into the yeti. It stays very hot for at least an hour to an hour and a half. ,1,1729288738.0,h3h3productions,0,0.67,False
1g6tu8l,https://i.redd.it/zez02xj77lvd1.jpeg,Early morning workout ,Dim Dam slapping Hannah’s bum and Hannah squealing in excitement was too much before my morning coffee… 🤢,3,1729288720.0,ballerinafarmsnark,1,1.0,False
1g6tu1k,https://www.reddit.com/r/Naples_FL/comments/1g6tu1k/high_speed_internet_upload/,High speed internet-- upload,"Hello everyone,

I have a large amount of data I need to transfer over my laptop (several terabytes)

Comcast had promised they had symmetrical upload/download speeds at 300mbps, but it turns out it is only 300mbps download and 30mbps upload.

Wondering if anyone knows of any businesses or coffee shops or locations that might have a relatively fast upload speed that I could work out of?  Or if you own a business and have fiber would you be available to use a few days of your network?

Happy to pay for the inconvenience.

Strange request I know, but thank you in advance!",1,1729288703.0,Naples_FL,0,1.0,False
1g6ttw6,https://www.reddit.com/r/AITAH/comments/1g6ttw6/aita_for_the_way_i_24f_treated_my_f29m/,AITA for the way I (24f) treated my F+(29m)?,"So - I just moved towns. In my old city, I met a guy this summer, he got me into a festival, we made out, went to his place and a couple of weeks later agreed to be friends with benefits. We both knew I would move in fall. We had a conversation a bit before I moved about what's going to happen then, as the new city is 4 hours away from the old city. He stated he would like to keep what we had going, and I said we could see how it'd go.

I do have a hard time saying no and I did enjoy the first couple of weeks a lot - but he got more and more needy, texted me good morning messages and kept me updated about his entire day - so I talked to him about having difficulties when it comes to commitment and that his constant texting was too much for me. He listened and was thankful for my communication and told me he'd change that.

So the good morning texts stopped (thankfully), but we kept seeing each other quite a lot as we lived nearby. The sex was good in the beginning, but pretty soon, it felt like he was just checking a box with foreplay to get to the ""main act"". I was in pain sometimes and usually told him that it was starting to be painful as I wasn't that horny anymore but that he could kept going until finishing (encouraging him to stop holding back). So, for me, the benefits part started to become a bit dreadful - the start was usually nice, but always ended up being painful due to too much friction and lack of lubrication.

 

There were a couple of reasons why I did not want to end the situation. For once, I did want to keep him around until my move - which was a terrible decision in all the ways as his mood on the day of my move was terrible, making everyone (four women) feel uncomfortable. For example, he was angry at me for not having a Coke (Coca Cola, not cocaine) there for him - I forgot he didn't drink coffee. I offered him Iced Tea (""okay then I'll take that"") - unfortunately, that was almost empty so he angrily went down to the store (in the same building) to get a coke.

He told me he was exhausted because it was his tenth (not sure about the exact number, but a lot) move this past month as an explanation for his irritability. We each had to walk only 2-3 times until we had it all in the car, everyone said that was the easiest move they had ever been at, as a lot of my stuff had already been taken by my dad. To be fair: when my dad was there, the guy had also helped me carry my stuff outside, in a less annoyed mood.

So that was the one reason why I wanted to keep him around: I was afraid of no one having time at the move as a lot of my other friends had to work.

But I also enjoyed having someone to snuggle with and to sit outside with and enjoy my last summer in the old city with.

The third reason: I was interested in seeing what would happen, as he's a nice guy. He tries hard and he had quite the difficult childhood and I wanted to give him a chance to see where things would take us. He had an immense need to share every step he took, but when I wanted to talk about something that bothered me, he was able to listen and he was thankful for me telling him (e.g. I told him I felt uncomfortable with pda and he actually listened and told me about his point of view and agreed that if it made me uncomfortable, then he'd refrain from taking my hand in public. It was a very small city, so everyone knew everyone and I didn't want to have to tell people that he was not my boyfriend.) So even though I didn't have romantic feelings for him in the start, I wanted to see if something could develop.

I made clear from the beginning that I had no romantic feelings and was only up for a friends with benefits situation. Very clear, as there had been misunderstandings in the past, so we had more than one occasions where I very bluntly told him that I only wanted this and if I found someone new in the new city, I would want to end our situation. In the beginning, he had said he felt the same, just wanted to see where things would go. Towards the end, I felt him hesitating a bit more and last week, we were on the phone and I told him I'd like to take the benefits out of the equation and just be friends again. (This has worked the other way round for another guy and me in the past; he ended it, I wouldn't have minded it to keep on going, but we're still good friends.)

This is where it starts to get complicated. I told him on the phone that I wanted to go back to being just friends, referring to those past conversations where I had already told him this could be the case once I moved. He was not happy - when he asked how came, I said I just hadn't thought about it as much and thought it best to end. Which is true; I hadn't missed him at all, so after talking to my brother, I decided to rip it off like a band-aid. He was quite hurt, which he just told me - and I get that. I refrained from telling him about the sex feeling less about sex and more about getting to the P in V and from telling him how he annoyed me the past couple of weeks (in the new city already) with oversharing and complaining - I wanted to give him the space to just tell me about how he feels and making the explanation as short as possible (I just didn't think about it as much).

In hindsight, that was not the nicest phrasing. He texted me, a long text, a couple of days later where he told me about being hurt by me telling him how it didn't mean anything to me and how he wasn't important to me. Which I had never said. He texted that to me on my first day of University in the new city and the text itself upset me. I forgot/procrastinated to text him back for a couple of days - I do have some friendships where we text each other back after a couple of days/weeks, so that is not completely unusual for me. However, with this guy, I had usually texted him back quicker, the topics were not that intense as well before. Three days later he wrote a disappointed text, almost like a letter, stating his disappointment in me ghosting him and how shitty he felt and how he had expected more. I then texted him back - it was my first week-end with university already started, so I hadn't had time to go into this emotional state. I told him I had procrastinated and forgotten to answer. It goes on like this for a bit, with him texting me droplets of new things that angered him/made him sad and me replying the following day / a couple of hours later. I definitely did not like the way he talked to me, telling me what I should have done (spoken to him in another way when ending the benefits-part) and just dumping all his emotions onto me at any random time.

One of these times, he told me he didn't want an excuse, he just wanted to share his thoughts/feelings. That's something he had said multiple times - not expecting anything, just wanting to share, and it had always annoyed me, usually I just joked about it. This time, I told him that he couldn't expect me to just take that in without any reaction and how I wasn't his therapist or plushie.

We texted a bit more, and today, I called him after he tried to call me when I was in class, followed by a long message about how his phrasing had been wrong, what he actually meant was that he felt not respected because of my long reply time etc - so I called him and told him to tell me whatever he had to say. He said, there wasn't really much more he wanted to say. I asked him to just tell me he wanted to talk if he felt the need for that, so we could make a time, instead of just texting me all his emotions, which ripped me out of my daily life in the new city at the new University.

He did apologize for the way he communicated his feelings in the beginning. But I still am not sure what to make from the situation. As I wrote this, I started to think that maybe we're just not a good combination. He overcommunicates and keeps talking about his most benign feelings (I was a bit upset this morning because my pancake was ugly-type of benign) and I pull back the more desperately a person tries to get close to me. I know that and I try to work on it - I did tell him that commitment is difficult for me and I also told him on multiple occasions that he overshared and I felt bulldozed by the, you could call it trauma-dumping.

He is a nice person and tries hard - and I am very glad I ended the benefits-part. I will still see him in the future as he participates in an organization I co-founded and I, at no point, intended to hurt him. I think he started to develop more profound feelings for me towards the end, which was another urgent reason for me to end the situation. I just wonder what I could have done differently. I did want to have him around and we had some nice times - nightly walks, some good sex, cuddles, good talks.

Am I the asshole for not ending it earlier?

 

TLDR: My friend with benefits helped me move, I ended the benefits-part a couple of weeks after moving. He was upset about the phrasing and about me taking three days to reply to his upset text afterwards. I had wanted to keep him around until the move, I had told him I wasn't in for a relationship multiple times. I liked to have someone to cuddle and wasn't sure if I would still like to keep it going after moving a couple hours away. He is a heavy oversharer and some things already annoyed me beforehand.",1,1729288691.0,AITAH,1,0.67,False
1g6ttqm,https://www.reddit.com/r/studentsph/comments/1g6ttqm/tips_kung_paano_hindi_makatulog_after_school/,tips kung paano hindi makatulog after school ,"Hi! I'm a freshie. I need advice lang po kasi halos pagkauwi ko from school everyday mas pinipili kong matulog kaysa gawin yung assignments para takasan ang stress, natatakot kasi baka di magising the next day para mag-commute, pati na rin pagod na pagod sa workload at ganap sa school in general. Sa mga nakakaranas po nito ngayon or before, ano pong tips niyo para di makatulog agad (di ako coffee drinker huhu) at magka-sense of fulfillment sa acads? ",1,1729288680.0,studentsph,1,1.0,False
