id,url,title,text,score,created_utc,subreddit,num_comments,upvote_ratio,over_18
1hos9an,https://i.redd.it/3ii7ijoy6r9e1.png,Why did the Scientist TV spilled the coffee? Is he stupid?,,9,1735463153.0,skibiditoilet,0,1.0,False
1hos9ak,https://i.redd.it/whntb19x6r9e1.jpeg,"Lu, Preston and Lisa are ready for Coffee Time 🙌🏻😃☕ Happy Sunday, my friends 🥰",,5,1735463153.0,Replikatown,2,1.0,False
1hos919,https://www.reddit.com/r/IVF/comments/1hos919/1st_mock_transfer/,1st mock transfer,"I’ve been away from Reddit since my last retrieval. While the results weren’t ideal, they were good enough for us to finally move forward with the mock transfer. It’s taken such a long time to reach this point, and I’m feeling incredibly nervous. I’ve never made it this far before, and I feel like I’m stepping into the unknown. I’ve never had a thorough discussion with my doctor about this stage since our primary focus was always on egg retrievals.

On top of that, I’ve gained weight after my last two retrievals, and I’m worried it might affect the transfer (mock and actual). I’ve also been drinking coffee daily (which I plan to stop). For whatever reason, once I started birth control my cravings have been intense. Does anyone have any tips or suggestions on how to prepare for the mock transfer? If you’ve been through this stage, I’d love any advice on what to expect or how to prepare for what’s ahead.

Here’s where I’m at: I was on birth control for a few weeks due to the holidays. I’m now off it, waiting for my cycle to start, and gearing up for my first mock transfer appointment. I’ve been told I’ll start estrogen patches the day after, and I have so many questions:
	•	Where exactly should I place the patches?
	•	What time of day should I apply them?
	•	What symptoms might I experience, and is there anything I can do to ease them?

I’m especially anxious because of my family history. My mom used hormonal patches post-menopause to address hormonal issues, and she ended up developing breast cancer. Her doctor, who also had breast cancer, prescribed the same patches to another family member, who later developed breast cancer too.

About 9 days after I start the patches, I start the progesterone injections. I’ve read that this is injected to the buttocks area. Have y’all done it yourselves? Any tips and tricks?

I’m sorry if this feels scattered—I’m feeling overwhelmed and lost right now. I’m holding onto hope that everything works out and that the new year finally brings the blessing I’ve been praying and working so hard for.",1,1735463118.0,IVF,0,1.0,False
1hos8it,https://www.reddit.com/r/dating_advice/comments/1hos8it/23f_need_advice_on_how_to_have_more_self_respect/,"23F. Need advice on how to have more self respect. Also, am on day 3 of no contact.","When I was in 6th grade, a boy two years older than me, who used to be my neighbour spread a rumour that he watched me bathing through the bathroom window and that he’s also kissed me in the lips. . My neighbourhood is quite conservative. The rumour spread fast and soon everybody started talking about it. All the kids started treating me differently, made fun of me. The adults judged me. Kids in school also got to know about it. So basically, it became very difficult for me to step outside without feeling a lot of shame. 
I moved to a different city for school in 8th grade. 
When covid started, I had just started college (online). I started dating this boy from my old school. We would mostly talk online. Met a few times. But then I found out from a mutual friend who told me that he was actually seeing someone else and that he was cheating on her with me. When i confronted him about it, he blocked me from everywhere. This relationship had lasted for 6 months. I felt like a loser for not having been more aware. It was my first relationship.
Then two years ago, I started dating this guy who was 31 at the time. I fell in love with him. He made me feel very loved and cared for. He would always take random pictures and videos of me. He was funny, was kind to people and seemed a very nice person overall. I thought very highly of him. But he never introduced me to his friends or family. He said it’s because he’s afraid they would judge the relationship and he didn’t want their negativity. But this always bothered me. Sometimes I would get too upset and then he started telling me I need to go to therapy. He never let me use his phone in the beginning. Then after a year and a half into the relationship, he let me. There was nothing suspicious on his phone.Then on September 30 of this year, he was in the gym and I had asked for his iPad to study with. It was the first time I was using it. I looked through his iMs. 
On it, there were conversations with tens of girls. They were from December of 2022 till August of 2024. We had started dating in October 2022. I was shattered. With some girls, the conversations lasted for a month, with others for up to three months. He had also made plans to see two girls multiple times but it seems like they turned him down.
When he came back from the gym, I confronted him. He cried and said he’s sorry and he would do whatever it takes to keep me from leaving. I drowned myself in alcohol for two days. I didn’t want to leave him. I loved him too fkin much. After a few days, I asked him to make some changes. I asked to not be kept a secret. He said yes to everything. I felt like he meant all of it because he would cry with me. But then he didn’t make any change. And slowly, he started becoming cold and distant. When I would finish crying, he would get up and go about his work whistling or would get on his phone. He said I make him feel badly. Whereas I was just asking him to be accountable and fix things. He was refusing to change. So when I would fight and cry about it, he started saying he doesn’t want to deal with the emotions that he’s feeling. He said he wants us to try again. We can start as friends and then see where it goes. He said I should have a relationship with him but with zero expectations. I refused. I wanted changes. This loop continued till November 29. 
I knew it in my brain that I need to leave this guy. But my heart wouldn’t let me. 
Then in December, he became a completely cold person. It started feeling like I was chasing him so bad and he wanted nothing to do with me.
I finally accepted he just doesn’t want me. But I didn’t want to let go of him.
Then finally on December 26, he said he wants to end things but still wants me in his life. That his guilt kills him. I don’t know if I believe him.I refused and said I can’t be his friend. Started no contact.
I miss him terribly and wait for his text every hour. But I know he’ll never text me. Sometimes I wonder if I should ask to meet for a coffee and have one last talk with him. But I know he doesn’t care for it.
I put with everything that he did because I didn’t want to lose him. I have spent every single day since sept 30 crying at least once. I’m tired of it all. I know I have to heal but the months spent healing will be very painful and I don’t want to live those months. 
To live with the realisation that I was never important to this man hurts so bad. To have thought a 31 yo would actually want to be with me, I was stupid. ",2,1735463048.0,dating_advice,1,1.0,False
1hos7m2,https://i.redd.it/823xr5ka6r9e1.jpeg,Looking for a GL show whose 1st EP description fits this,,1,1735462926.0,GirlsLove,0,1.0,False
1hos71s,https://www.reddit.com/r/adultingph/comments/1hos71s/buying_delicacies_help/,Buying delicacies.. HELP!!!!! ,"Not sure if this is the right sub. 

I usually travel locally, but hindi ako nag uuwi ng food from the area I traveled to, aside sa calamansi muffin from Real Coffee. 

Anyways, I'll be traveling to Bacolod, and Dumaguete. And since kilala silang lugar na masarap ang food I'm planning to bring home some. 

I'll be traveling by plane. Not sure paano gagawin. Sabihin ko lng ba sa pagbibilan ko na I'll travel it to Manila? I plan to buy molo (if meron sa bacolod) and other food pa. 

Thanks!! ",1,1735462862.0,adultingph,2,1.0,False
1hos57v,https://www.reddit.com/gallery/1hos57v,Home Barista Struggles,"When you’re the only coffee drinker at home and make about 1-2 cups a day max, time to practice advanced shapes is hard to come by.

This minimum word count thing to post is annoying.",22,1735462648.0,espresso,2,1.0,False
1hos572,https://www.reddit.com/r/mokapot/comments/1hos572/moka_pot_bitter/,Moka pot bitter,"Hello, I'm new to making coffee with a coffee pot. I have a Bialetti, and I use it on an induction stove (with an adapter). My coffee tastes bitter. I LOVE going out to try new coffees, and I've tried some specialty coffees that taste great without sugar. However, my coffee always ends up tasting bitter.

Here are the steps I follow:

I add cold water (I've also tried using hot water) to the pot.
I put the coffee grounds in without tamping them down.
I set the induction stove to medium heat (5/10) and wait.
Please help me! I'd love to enjoy a nice cup of coffee every morning. It would be fantastic!",3,1735462645.0,mokapot,4,1.0,False
1hos56j,https://i.redd.it/r6ifw2xq4r9e1.png,[OC] Enjoying a nice warm cup of coffee into the new year,,41,1735462643.0,ImaginarySliceOfLife,3,0.98,False
1hos563,https://www.reddit.com/r/bathandbodyworks/comments/1hos563/which_candle_do_you_wish_you_bought_more_than_one/,Which candle do you wish you bought more than one of before the collection went away? ,"I wish I had bought more than one of Elevens Waffles and Hopper’s Coffee. I ended up really liking them both. If I had known better, I would’ve bought like three each. ",2,1735462641.0,bathandbodyworks,2,1.0,False
1hos3bk,https://www.reddit.com/gallery/1hos3bk,I am an amateur coffee enthusiast and have just started my coffee journey. This is my small inexpensive setup.,"Hi everyone. My setup consists of the following:

1. Agaro Imperial Espresso maker
2. Agaro supreme steel burr grinder
3. Pressurized basket portafilter (51mm)
4. Supvox Dosing cup
5. THW tamper (30 lb)
6. Supvox Distributing tool 
7. Supvox Espresso stirring pin set
8. Sprayer
9. Supvox Milk frothing pitcher (12 oz)
10. Sipologie Weighing scale (0.1 gm interval)
11. Rubber air blower
12. Supvox Puck screen (51mm)

Currently using the Lavazza Gusto Crema beans. Dosing at 14 gms for a 28 gms yield within 30 secs.  ",20,1735462398.0,IndiaCoffee,3,1.0,False
1hos2yy,https://www.reddit.com/r/hypertension/comments/1hos2yy/wonder_whats_up_with_my_numbers/,Wonder whats up with my numbers,"Im on ramipril 2.5mg and been on it month and 3 days systolics been rly okay but diastolic not. i have quitted smoking and drinking coffee 2 months ago and 2 days ago quitted taking alcohol. 

Im using omron comfort for measuring

issues been that my diastolic been mostly not changing much. im 31Y old.

i measure both hands due my right hand is bit smaller than left (im left handed) its birth defect but doesnt cause issues. so measures been like these

right hand i take 3 measures 4 days ago:  
Morning  - 118/96 Pulse 81 ,115/97 94,117/94 81  
Night  -  120/82 71 ,110/83 66 for some reason only did 2 measures

left hand 3 measures as well 4 days ago:  
Morning  - 136/93 87 ,130/91 91, 129/89 88

Night  - 131/81 70 ,120/74 76    


Then lets skip to 2 days ago right hand:  
  
Morning - 125/96 77, 109/89 76, 113/93 75  
Night - 126/91, 125/91, 128/92

Left hand 2 days ago:  
Morning - 126/96, 114/87, 108/86  
Night - 134/95, 132/82, 124/86  
 

And on yesterdays measurings were on  
Right hand morning : 126/100,121/97,120/93  
Left hand morning: 125/94,125/89,123/91  
Right hand night: 108/87,120/89,110/87  
Left hand night: 120/81,117/87,113/83

On last medication losartan 50mg (in half so 25mg) i was mostly averaging 125/85 but on ramipril systolic looks rly good but im wondering about diastolics. Anxiety? or something else. ive eaten quite badly on xmas too 

",1,1735462356.0,hypertension,0,1.0,False
1hos2un,https://www.reddit.com/r/FutureWhatIf/comments/1hos2un/fwi_spacebound_houston_releases_in_january_2026/,"[FWI] ""Spacebound: Houston"" releases in January 2026","**Spacebound: Houston**


*Planned release date: January 2026*


Developer reportedly trying to build ""an accurate-as-possible to-scale open world gaming map of the Inner Loop of Houston, Texas using photogrammetry"". Called ""Spacebound: Houston"", you play Tristan Jones in an alternate future 2050s, where you're trying to raise money to repair Nero and ""get back out there""

Upcoming action-adventure alternate future open world game **Spacebound: Houston**


Set in an alternate future sometime in the 2050s, you play Tristan Jones, a 20something year old former UESF cadet (United Earth Space Force) who is stuck on Earth after badly damaging his ""baby"", Nero and getting himself kicked out of the Navy for assaulting a fellow cadet. 

""Nero"", Tristan's private space corvette, is badly damaged and in need of repairs, but a broke Tristan has to try and raise funds in a variety of ways in order to repair the ship, fix the Jump Drive, E-Drive and Halycon Core and ""get back out there"".

Doubling up as a life sim, there is over 250 square kilometers of playable space and although the ultimate objective of the main story campaign is to repair Nero - your ship - multiple hiccups appear along the way and there are many side missions and tasks.

Although set in an alternate future 2050s where space travel is ""just about as normal and ubiquitous as air travel"", Houston ""looks pretty much the same"" and it is not unusual to see people driving around in vehicles which are decades-old, as the State of Texas managed to avoid signing up to the Common Climate Agreement which would have effectively seen vehicles built before 2029 removed from the streets of Texas entirely.

Much like in Watch Dogs 2 or Star Citizen or Quantum Break or Ghost Recom: Wildlands, the game can be played in third or first person.

Tristan - the main character - whilst once being a ""former rich kid"" whose father was once a high-ranking officer in the UESF, but was cut off from his family - nevertheless has many ""rich friends"" and so has multiple safe houses available to him dotted around the map. He can also purchase and enter properties, but his primary objective is to repair Nero - which is an already very expensive endeavor itself.

Given Houston's grip on the past, you will still find early 21st century businesses dotted across the map, many of which have open interiors, ranging from early 21st Century movie theaters, eateries, burger joints, coffee shops, gas stations, malls and even ""retro-style"" arcades.

Whilst the game features over 120 driveable vehicles and 11 aircraft (only helicopters so far), more vehicles and aircraft - even planes - are planned for a future DLC.

Although the map is already quite sizeable - 250km2 - a planned future DLC plans to add more than 1,100 square kilomters of extra playing space to the existing map, whilst also introducing planes, airports, 17 additional aircraft and 130 additional vehicles, but also comes with new characters and a new story campaign and effectively increases the game's total playable area by nearly 5.5 times. No definite release date or release window has been set for the upcoming DLC for this upcoming game.",1,1735462339.0,FutureWhatIf,0,1.0,False
1hos2pm,https://i.redd.it/39j1c3oh4r9e1.jpeg,Stop ,Come on Starbucks stop giving me milk drinks. Cafe latte is more like milk with a splash of coffee. ,1,1735462322.0,starbucks,10,0.55,False
1hos2hv,https://www.reddit.com/r/HousingUK/comments/1hos2hv/i_dont_think_my_landlord_put_my_deposit_in_a/,I don't think my landlord put my deposit in a scheme amongst other issues...,"It's been almost a month now since I moved into my new place, and I haven't had anything through from one of the deposit schemes. Sorry this is long, I'm having a lot of issues with my new landlord. 

I ended up connecting with the old tenant from this place, mainly because I went 4 days without hot water due to a broken timer when I first moved in, which my landlord was convinced I broke or didn't set up properly, and wanted me to call the old tenant at 11pm on a work night (she was overseas at time), to prove I had broke it/not set it up correctly, rather than call a plumber. I had to fight for her to come out and the timer was broke. This is one of many issues since I moved in, and I could use some advice. 

- wanted me to pre-agree as they are desperate to fill other room (which is vastly overpriced, I'm only here because my disability support allowance covers it) to pay more on electric because new prospective tenant who hasn't even met me or seen property demanded it prior to viewing. 

- did a viewing on Christmas day, I was away fortunately, then wanted me to interview new prospective tenant on boxing day, guilting me into by saying they helped me out after a break up and I should empathize that this prospective tenant is going through something similar. Again, I refused, as I was with my family/friends for the holidays and had plans that day (requested this on the day) and agreed to call this weekend, now I'm likely going to be blamed that she found somewhere else in that time.

- refused to get a smart meter for the boiler, until I said that I wouldnt take the property if that was the case as she wanted me to work out electrical contributions with new prospective tenant by going over meter readings vs daily activities on a day by day basis. 

- during the viewing, some of my things were knocked over, mud dragged into living room, rug bunched up from getting pulled on doors, so I had to clean when I got back. I am constantly told by landlord how I need to keep it clean, so yeah, coming home to a messy apartment right after Christmas and having to clean it was not fun. 

- charged me for the 10 days of electric before my tenancy started, paid a 3rd of bill as a contribution for higher electricity use when hot water was broke and I had to use boost constantly for hours. Is claiming that the bill is higher due to me not turning off switches and I need to turn boiler off when not in use!? Have been advised by plumber not to do this as can break the components. So basically cut off hot water, which we don't have for most the day anyway, as when it's not on timer it doesn't work. But disregards the charges for the broken timer or me paying for utilities on those extra days. 

- every week since I moved in, there has been some disruption, errand I need to do, visit from her or a family member and it's exhausting because even when she says she'll be quick and not disturb me, she disturbs me. When I'm working, relaxing, or have plans I need to cancel to wait in for a collection of something or workmen. This weekend, she is coming over to collect some of the things she stored in the room, despite being here only a few days ago for the viewing. She is also getting a new bed delivered so not doubt she'll be here again in a few days, or I'll be asked to wait in for the delivery and communicate with the delivery men. 

- the old tenant from the property has stated previous problems for boiler breaking, causing high bills, mice and the landlord putting her on a ""Lodgers"" agreement instead of tenancy (my contract starts just tenancy agreement, so I'm not sure where that falls onto) and found when she moved out, the deposit was withheld and she was charged for plumber visits etc from when the boiler broke. I haven't had a deposit award scheme notification (I got one at my old place) and I am thinking as it's nearly 30 days since I moved in, she is trying to do the same with me. 

- the old tenant had ago at the landlord (sent me screenshots) as even when a plumber confirmed the timer was broke, she still tried to blame me and was slagging me off to her saying she needs to be kinder to her tenants and not always try to point balme.  The old tenant now wants to me for coffee, which I'm assuming is to give me more info/warning on what to expect these next coming months. 

- the property is constantly freezing cold in the day, resulting in me wearing 2/3 layers to keep warm or blasting the electric heater for 30 mins or so.  the landlord refuses to let me put the heating on timer, or show me how to do it because it's ""too expensive"" and the other flats should heat up this one. 

I have a 6 month break clause, so I've got 5 months here now. I have mobility issues, so as long as I am able to physically, I intend to break the contract at the 6 month clause unless things vastly improve with this landlord or my health stays poor. 

Does anyone have any advice please? How can I best navigate the next 5 months? She's coming over again this morning, and I'm sick, in pain and CBA with it. But I also don't feel like I should have to leave the property I'm paying for because she's likely going to be moaning at me and blaming me for the tenant dropping out due to me being busy on boxing day and not able to call. (The rooms are rented separately for context, so it's not like the benefits for me are massive for securing a roommate, although I would like one, it's pretty lonely here post breakup). ",1,1735462296.0,HousingUK,2,1.0,False
1hos1xz,https://www.reddit.com/r/stories/comments/1hos1xz/developer_reportedly_trying_to_build_an/,"Developer reportedly trying to build ""an accurate-as-possible to-scale open world gaming map of the Inner Loop of Houston, Texas using photogrammetry"". Called ""Spacebound: Houston"", you play Tristan Jones in an alternate future 2050s, where you're trying to raise money to repair Nero and ""get back ","Upcoming action-adventure alternate future open world game **Spacebound: Houston**


*Planned release date: January 2026*

Set in an alternate future sometime in the 2050s, you play Tristan Jones, a 20something year old former UESF cadet (United Earth Space Force) who is stuck on Earth after badly damaging his ""baby"", Nero and getting himself kicked out of the Navy (UESF) for assaulting a fellow cadet. 

""Nero"", Tristan's private space corvette, is badly damaged and in need of repairs, but a broke Tristan has to try and raise funds in a variety of ways in order to repair the ship, fix the Jump Drive, E-Drive and Halycon Core and ""get back out there"".

Doubling up as a life sim, there is over 250 square kilometers of playable space and although the ultimate objective of the main story campaign is to repair Nero - your ship - multiple hiccups appear along the way and there are many side missions and tasks.

Although set in an alternate future 2050s where space travel is ""just about as normal and ubiquitous as air travel"", Houston ""looks pretty much the same"" and it is not unusual to see people driving around in vehicles which are decades-old, as the State of Texas managed to avoid signing up to the Common Climate Agreement which would have effectively seen vehicles built before 2029 removed from the streets of Texas entirely.

Much like in Watch Dogs 2 or Star Citizen or Quantum Break or Ghost Recom: Wildlands, the game can be played in third or first person.

Tristan - the main character - whilst once being a ""former rich kid"" whose father was once a high-ranking officer in the UESF, but was cut off from his family - nevertheless has many ""rich friends"" and so has multiple safe houses available to him dotted around the map. He can also purchase and enter properties, but his primary objective is to repair Nero - which is an already very expensive endeavor itself.

Given Houston's grip on the past, you will still find early 21st century businesses dotted across the map, many of which have open interiors, ranging from early 21st Century movie theaters, eateries, burger joints, coffee shops, gas stations, malls and even ""retro-style"" arcades.

Whilst the game features over 120 driveable vehicles and 11 aircraft (only helicopters so far), more vehicles and aircraft - even planes - are planned for a future DLC.

Although the map is already quite sizeable - 250km2 - a planned future DLC plans to add more than 1,100 square kilomters of extra playing space to the existing map, whilst also introducing planes, airports, 17 additional aircraft and 130 additional vehicles, but also comes with new characters and a new story campaign and effectively increases the game's total playable area by nearly 5.5 times. No definite release date or release window has been set for the upcoming DLC for this upcoming game.",1,1735462226.0,stories,0,1.0,False
