id,url,title,text,score,created_utc,subreddit,num_comments,upvote_ratio,over_18
1m6xvrx,https://v.redd.it/f00t98n3fjef1,"I'm Latina, but...","I pour heartbreak, obsession, betrayal, and redemption onto the page…  
so I can sip my coffee in peace while my characters fall apart 😌  
\#ImLatinaBut #AuthorLife #LatinaAuthor #FatedNovel #GizelV #MulticulturalReads #PlotTwistQueen #DarkRomance #FictionalChaos #LatinaWriters #DebutAuthor",1,1753238815.0,u_InsatiableM3,0,1.0,False
1m6xtwc,https://www.reddit.com/r/r4r/comments/1m6xtwc/30_m4f_north_carolina_online_just_a_dreamer_guy/,30 [M4F] #North Carolina / Online - Just a dreamer guy shooting his shot into cyberspace! Looking for a wholesome connection. 🫶,"**Hi there, Welcome to my post & thanks for checking it out!**

I am honestly exhausted in this dating game, endless swiping on faces in apps, meeting in questionable bars etc. and I am ready to meet my forever person if it's in the cards. No games here! Looking for someone I could grow to genuinely trust who won't flake out. I care more about the substance of the person & want to take care of someone else to the best of my ability in all ways too.

Obviously physical attraction does matter to a degree, but you don't need to be perfect. I just want that person I really click with and hopefully we can enjoy each other's company. Play some video games, have a laugh, or just chit chat. I wish I could be truly excited by someone's presence again. That kind of thing where you can't wait to talk to that person again.

# About me -

I'm an average looking slightly nerdy but masculine guy. I'm 5'8, white, have curly hair, and have an average physique but have started working out a bit. Not fat but not skinny either. I think I look decent. I will be glad to swap pics once we've been chatting for a little while. I am an INTJ / Ambivert. I look pretty young for my age, I get mistaken as someone in their early to mid 20s all the time. Still have all my hair. (lol)

I have a lot of hopes, dreams, and goals. I try my best to be kind and caring. I would say I have a dry sense of humor, and enjoy deep conversations about life that could go anywhere. I'm not a city person but I don't like living in the middle of nowhere either.

I enjoy a variety of different things. I love playing video games even though lately I haven't had time. Doing anything outdoors when the weather is nice calms me and makes me relax. I enjoy hiking trails around here locally.

Road trips, exploring new music (lets swap music?) , reading books, long drives through the countryside with good coffee and conversation, watching movies or shows, and listening to podcasts. If you play certain games, I will gladly play them with you! I'm also open to trying new hobbies with my partner. I enjoy going to food festivals and trying new types of food too.

I live in a small-ish town here in NC and don't really get the opportunity to meet people outside of work too often due to having a busy week, then being too tired on the weekends but I'd like to change that! I am a sweet guy who just wants that special spark with someone again. I want to meet a girl who will hijack my weekends and prevent me from becoming a workaholic, lol.

Long story short, I want to enjoy quality time together even if it means just voice chatting at first. If you show me that you're worth it, I will make you a priority. Ideally I am not looking for someone too far away from me, but if you're really amazing I will make an exception. I'd like to move somewhere else, as I have grown up in NC and lived here my whole life, although I have traveled around quite a bit.

I have a stable career, college educated, no kids, and in good financial standing / financially responsible with no real debt or criminal record. I work two jobs and have a bachelors degree, and would love to meet someone for 2025. 🫶

When you reply, describe your ideal first date idea and we can discuss that and use it for an icebreaker.

Also, if you are gonna ghost, or we are just gonna do the whole - ""hey"" and ""what u up to"" ""nm you?""and that's it, just save both our time please. No offense, lol. I also will not date anyone who already has children.",1,1753238658.0,r4r,1,1.0,False
1m6xtog,https://i.redd.it/4ai6m48mejef1.jpeg,Best solar generator?,"What’s the “best” solar generator for making sure batteries stay topped off on say a week long off grid camping trip?

I have a camper that has 400w installed solar and 2 AGM batteries in parallel for about 160 AH of capacity or so.

Understand it’s a vague question, so maybe focus on reliability, price per watt hour, and value ratio (say something includes 400w of solar panels).

I’d like it to have a 30 amp plug so I don’t have to use the dog bone connector, and if at all possible I’d really like something that could run the ac for 20 to 30 minutes.

I don’t use a lot of power off grid / 12V fridge (I leave the drink fridge outside off), a few lights, water pump, igniters for propane water heater and stove, and a couple of fans. Plus keeping phone and air pods charged.

I was camping this weekend for a shakedown off grid trip and it was suddenly more overcast than expected so I picked up a 2000w pure sine wave inverter from Harbor Freight. It powered everything but the AC just fine - I used it to microwave food and run a coffee pot.

For those interested, the inverter is a cool option that lets you hook into your truck battery (make sure your car is running!) and essentially turn your truck into a generator. I used it to top off the batteries before bed, but want something quiet because the campground I like to stay in has some really awesome sites in the generator free loop.  Running a solar charger instead of a gas generator or the truck inverter opens up some cool spots for me.",0,1753238640.0,RVLiving,4,0.5,False
1m6xtky,https://www.reddit.com/r/R4R30Plus/comments/1m6xtky/30_m4f_north_carolina_online_just_a_dreamer_guy/,30 [M4F] #North Carolina / Online - Just a dreamer guy shooting his shot into cyberspace! Looking for a wholesome connection. 🫶,"**Hi there, Welcome to my post & thanks for checking it out!**

I am honestly exhausted in this dating game, endless swiping on faces in apps, meeting in questionable bars etc. and I am ready to meet my forever person if it's in the cards. No games here! Looking for someone I could grow to genuinely trust who won't flake out. I care more about the substance of the person & want to take care of someone else to the best of my ability in all ways too.

Obviously physical attraction does matter to a degree, but you don't need to be perfect. I just want that person I really click with and hopefully we can enjoy each other's company. Play some video games, have a laugh, or just chit chat. I wish I could be truly excited by someone's presence again. That kind of thing where you can't wait to talk to that person again.

# About me -

I'm an average looking slightly nerdy but masculine guy. I'm 5'8, white, have curly hair, and have an average physique but have started working out a bit. Not fat but not skinny either. I think I look decent. I will be glad to swap pics once we've been chatting for a little while. I am an INTJ / Ambivert. I look pretty young for my age, I get mistaken as someone in their early to mid 20s all the time. Still have all my hair. (lol)

I have a lot of hopes, dreams, and goals. I try my best to be kind and caring. I would say I have a dry sense of humor, and enjoy deep conversations about life that could go anywhere. I'm not a city person but I don't like living in the middle of nowhere either.

I enjoy a variety of different things. I love playing video games even though lately I haven't had time. Doing anything outdoors when the weather is nice calms me and makes me relax. I enjoy hiking trails around here locally.

Road trips, exploring new music (lets swap music?) , reading books, long drives through the countryside with good coffee and conversation, watching movies or shows, and listening to podcasts. If you play certain games, I will gladly play them with you! I'm also open to trying new hobbies with my partner. I enjoy going to food festivals and trying new types of food too.

I live in a small-ish town here in NC and don't really get the opportunity to meet people outside of work too often due to having a busy week, then being too tired on the weekends but I'd like to change that! I am a sweet guy who just wants that special spark with someone again. I want to meet a girl who will hijack my weekends and prevent me from becoming a workaholic, lol.

Long story short, I want to enjoy quality time together even if it means just voice chatting at first. If you show me that you're worth it, I will make you a priority. Ideally I am not looking for someone too far away from me, but if you're really amazing I will make an exception. I'd like to move somewhere else, as I have grown up in NC and lived here my whole life, although I have traveled around quite a bit.

I have a stable career, college educated, no kids, and in good financial standing / financially responsible with no real debt or criminal record. I work two jobs and have a bachelors degree, and would love to meet someone for 2025. 🫶

When you reply, describe your ideal first date idea and we can discuss that and use it for an icebreaker.

Also, if you are gonna ghost, or we are just gonna do the whole - ""hey"" and ""what u up to"" ""nm you?""and that's it, just save both our time please. No offense, lol. I also will not date anyone who already has children.",1,1753238632.0,R4R30Plus,0,1.0,False
1m6xtd6,https://www.reddit.com/r/espresso/comments/1m6xtd6/espresso_grinder_recommendation_150/,Espresso grinder recommendation [$150],"I would not mind having to go manual, but today I have this grinder from KitchenAid and find it hard to get a espresso quality from it: https://www.amazon.com/KitchenAid-BCG111OB-Blade-Coffee-Grinder/dp/B003WIZ5PC/ref=mp_s_a_1_4",1,1753238614.0,espresso,1,1.0,False
1m6xskh,https://www.reddit.com/r/bipolar/comments/1m6xskh/i_love_humanity_and_the_world_around_me/,I love humanity and the world around me!,"Ok- prefacing this with the disclaimer that yes, I’m aware I’m in an episode right now, have spoken with my psychiatrist, and am going to take my rescue meds.

But! In the past few weeks, I’ve really been struck by how great people are- I went to a concert where seniors sang in a choir, in a park as the sun set. There were loads of people there sitting on picnic blankets and cheering like crazy at every song. 

I work as a barista and I also LOVE seeing the wide scope of humanity that comes in and gets coffee. Being on the register is my favorite thing, because I can strike up conversations with people and learn about them. And nobody is sadder after they get their coffee- it improves everyone’s day!

Fundamentally, I really do think humans are amazing and good. We all are together, living our own lives and getting through the world as best we can, sometimes intersecting and sometimes never meeting. There’s so much bad out there, but there’s so much good too. 

Right now, I haven’t been sleeping more than 3 hours a night. So instead of just laying in my bed, I’ve been going outside and watching the Perseids- the meteor shower happening right now. My backyard is full of fireflies and the temperature has been perfect!

My psychiatrist has told me I’m in a pretty worrying place right now, especially with the lack of sleep. But at least the world is a beautiful place! 

Anyways- I’ll stop my rambling. I hope you are all doing well! 

",2,1753238549.0,bipolar,2,1.0,False
1m6xrre,https://www.reddit.com/r/northwestarkansas/comments/1m6xrre/evening_coffeereading_places/,Evening Coffee/Reading Places?,"Are there any places that are open in the evenings or 24 hour around town that are good for studying, reading books, or working on projects?",4,1753238484.0,northwestarkansas,0,1.0,False
1m6xrn9,https://www.reddit.com/r/teenagers/comments/1m6xrn9/for_anyone_struggling/,For anyone struggling,"Haha. I read my rape book they hand rape victims and never felt seen but also felt my shields go down. I walked to a bridge and started to watch the cars go by, seeing how my dead body would disrupt traffic and cause a big crash. I thought everyone gave up on me. But then, I remembered, that God cares and he wants me to prove everyone wrong. I fell asleep and woke up a new person. I walked from the bridge and returned to the coffee shop where I got those resources. Walked in as if they never saw me cry.

I may have DID but I declare myself as a survivor. A boss. And a bitch with a soft spot. I will let no one tear me down

This world is cold and mechanical, yes, but in every winter is a volcano of warmth and fire. There are people who care about you. For me, it is the LGBTQ community and my own African American community.

I believe suicide is the absence in the belief your life will get better. The absence of love and warmth. And the romanticization of death and revenge. No one dies just to die.

The worst and most traumatizing part about it is that it stops being about revenge. Because you realize that even if your life ends, they will still somehow blame it on you and use you as an example. That's why I got up. Suicide isn't the solution. Opening their eyes by showing how much stronger your worldview is than there's.

They see me homeless on the streets as evidence that their comfort and stagnation is better than critical thinking and progress. My entire family turned against me because of my differing beliefs than theirs. They turned because I questioned their lifestyles so they made me go through hell to ""teach me a lesson"". But I will show them all the superiority of my outlook.

Black lives do matter. People should be able to have sex as they please and who they please with. Drugs should be legal and not criminalized for usage. Pure capitalism is dystopian. The government needs to intervene. Homeless people deserve a safe place to live. Mentally ill people deserve to be heard not silenced. Women deserve rights and a chance to prove themselves (as well as the right to have needed protections). Mental illness deserves sympathy not stigma. Children deserve more anatomy. Rape should be as bad as murder. Trans rights are human rights. Empathy and understanding over villainization and stereotyping

The world crushes those who question it because letting ""dangerous"" ideas grow will destroy reality as we know it. However if you deem an idea dangerous then perhaps it is your worldview that is flimsy and flawed.

",3,1753238474.0,teenagers,2,1.0,False
1m6xqqz,https://www.reddit.com/r/SpecialtyCoffee/comments/1m6xqqz/help_i_need_a_recomendation/,HELP I NEED A RECOMENDATION,"Hi everyone! I'm from Argentina, and my boyfriend (21) is a passionate barista who's about to fulfill his dream of opening his own specialty coffee shop. I'm incredibly proud of him and want to give him a meaningful gift to celebrate this big milestone.

I'm looking for ideas that are not about our relationship (so no romantic gifts), but rather something that connects with his love for coffee and his new role as a coffee shop owner. It could be something **useful, decorative, inspiring, or even symbolic**—as long as it feels thoughtful and relevant to his journey.

He’s very into **aesthetic, modern, minimalist design**, with a touch of brutalism. I know very little about the specialty coffee world myself, so I’d really appreciate any ideas you can share.

I'm open to: Books - equipment or tools - accessories - decor for the café - sentimental (but coffee related) ideas - and anything you'd recommend to someone starting ther own coffee place <3

Thanks so much in advance!",1,1753238403.0,SpecialtyCoffee,0,1.0,False
1m6xqku,https://www.reddit.com/gallery/1m6xqku,M1 Max Logic Board in an M2 Upper Assembly - can it be done?,"I have come across a great deal on an upper case assembly, display, screws for a 16” M2 MacBook Pro for around $300 dollars US. The M1 Max 16” I have has recently suffered a coffee spill, but fortunately most of the parts still work. I took apart the laptop, and dabbed up the coffee with alcohol. Right now, There’s one USB port that isn’t working. Just for curiosity sake, is it possible to use an M2 upper case assembly for an M1 Max? I’ve looked at photos, and it looks like it might. However, without tearing down the laptop completely and trying it - I am not sure if it will.

Otherwise, it’s probably looking for another logic board for an M2, but from what I’ve noticed supply is so limited and Apple charges so much that it’s almost not worth it. Any suggestions appreciated.",3,1753238388.0,macbookpro,0,1.0,False
1m6xqaw,https://www.reddit.com/r/HomePicks/comments/1m6xqaw/should_your_rug_go_under_the_coffee_table_or/,Should your rug go under the coffee table or around it?,"I recently renovated my living room and faced this exact dilemma - should the rug go under my coffee table or around it? After extensive research and consulting with interior designers, I've found some clear answers that might help you too.

The short answer is: Yes, your rug should absolutely go under your coffee table. Here's why:

First, placing your coffee table on top of the rug creates a more cohesive and anchored look in your living space. When the rug runs underneath, it ties all your furniture pieces together and makes the room feel more purposeful and organized.

I learned this the hard way when I initially tried placing my rug around the coffee table. It made the room feel disconnected and somehow smaller. The floating coffee table created an awkward visual break in the space.

Here are some practical guidelines I've discovered:

- Leave 18-24 inches of rug visible on all sides of your coffee table
- Make sure at least the front legs of your sofa and chairs sit on the rug
- Choose a rug size that's proportional to your room (8x10 or 9x12 work well for most spaces)

Speaking of coffee tables, I found some gorgeous options that work perfectly with this rug placement strategy here: https://explorehomedeals.com/coffee-tables

Some additional considerations:

1. Protection: Rugs protect your flooring from furniture scratches
2. Sound absorption: Having the rug under furniture reduces noise
3. Visual flow: Creates a natural pathway through the room
4. Maintenance: Easier to vacuum when everything's properly aligned

There are some exceptions though. If you have a very small living room or an unusually shaped coffee table, you might need to adjust these rules. Also, if you're working with a vintage or antique rug, you'll want to ensure your coffee table won't damage it.

I recently helped my sister with her living room design, and we found some amazing modern and traditional coffee tables that work perfectly with this under-rug placement: https://explorehomedeals.com/coffee-tables

Remember, the goal is to create a balanced, welcoming space that feels intentional and put together. Having your rug extend under your coffee table is one of those small details that makes a big difference in achieving that polished look.

One final tip: If you're still unsure about placement, try laying out painter's tape on your floor to visualize different rug sizes and positions before making your final decision. This helped me tremendously when I was planning my space.

Hope this helps you make the right choice for your living room setup!",1,1753238363.0,HomePicks,0,1.0,False
1m6xpyk,https://www.reddit.com/r/Bentley/comments/1m6xpyk/is_30k_for_a_05_bentley_continental_worth_it/,Is 30k for a ‘05 Bentley Continental worth it?,"Saw a ‘05 Bentley Continental GT with 103,000 miles for $30k. They state that it’s had a full tune up with replaced plugs, oil, ignition coils, valve cover gasket and spark plug gaskets. It has new brakes, new front struts with updated interior from a 2010 model and updated body kit/wheels. 
I really like this Bentley. It wouldn’t be my daily tho (more of a take it out when I go golfing or when I go to a car n coffee or to dinner.) 

Spending 3-7k annually to keep a Bentley running well isn’t an issue for me. 
I’m curious if it is an actual money pit like people suggest it is and if I should just take my 30k somewhere else?? I’ve never owned or thought of owning a Bentley until I saw this listing. 
Love at first sight type shiii 😏 I’d love to hear yall thoughts, thx",1,1753238332.0,Bentley,3,1.0,False
1m6xpvs,https://www.reddit.com/r/fearofflying/comments/1m6xpvs/aa_flight_723_from_chicago_to_new_york/,AA Flight 7/23 from Chicago to New York,"Hi! I posted on this sub before my previous flight and the support was very helpful. I’m flying to La Guardia tomorrow morning from Chicago for a work trip and I’m feeling pretty anxious. Have an event scheduled, coffee chats, and presentations lined up. I keep on having the fear that something will go bad when a great experience is awaiting me and there’s much ahead of me. Advice?🥲

Flight 2723 AA",1,1753238325.0,fearofflying,2,1.0,False
1m6xpjy,https://www.reddit.com/r/gardening/comments/1m6xpjy/gardenia_struggling_immediately_after_planting/,Gardenia struggling immediately after planting,"Hi, I recently brought a gardenia home from the nursery, and within a few days of repotting its buds have been turning yellow and now brown earlier and earlier — now even before blooming. I know gardenias are finicky, so I've been careful not to let the soil dry out, and when I started noticing it struggling I put some coffee grounds in the soil in case it was the pH. Any ideas what the issue could be? I assume there's an issue with the soil, since the flowers were very healthy at the store. [This](https://shop.americanplant.store/ocean-forest-potting-soil-1-5-cu-ft/#description) was the potting soil that I added when repotting, is there anything bad for the plant in this potentially?

  
The plan gets partial to full sun, and although it is in the 80s to 90s where I am, it was even hotter in the weeks before I bought the plant and didn't notice any signs of heat stress then — so I assume its not that. Any help would be greatly appreciated!

https://preview.redd.it/evqg2xzgcjef1.jpg?width=3024&format=pjpg&auto=webp&s=4dab12d624dd58b5fb46b17dd83700f471ccc9a0

https://preview.redd.it/ciofjvzgcjef1.jpg?width=4032&format=pjpg&auto=webp&s=2a0af35c983dec3af07c3ad2fc2d1011012f1bc3

",1,1753238298.0,gardening,0,1.0,False
1m6xpis,https://www.reddit.com/r/SmallBusinessPH/comments/1m6xpis/should_i_give_up_my_passion_photovideo_to_go_all/,Should I give up my passion (photo/video) to go all in on a Coffee Cart Pop-Up?,"Hi! Just wanted to open up and hopefully get some advice from fellow small biz owners or creatives here.

Lately, I’ve been seriously thinking… *worth it pa ba ipagpatuloy yung passion ko sa photography/videography?*

Matagal ko na siyang ginagawa, and it’s something I really love — but lately, it feels like the market is too saturated, and income has been super unstable. So I’ve been considering shifting to something new and more potentially stable… like starting a **Coffee Cart Pop-Up here in North Caloocan**.

I’m honestly tempted to sell my camera and all my gear and go all in with the coffee business.  
The thing is — wala naman talaga akong solid knowledge sa business side, and that scares me. Pero gusto ko na talaga maging *financially stable*. Pagod na pagod na akong mabuhay na parang nagsu-survive lang araw-araw.

Has anyone here ever made a big pivot like this before?  
Any tips, experiences, or advice — kahit kaunting push lang — would mean a lot.

Thank you in advance 🙏  
Let’s support each other, lalo na tayong mga nagsisimula pa lang.",2,1753238295.0,SmallBusinessPH,2,1.0,False
