id,url,title,text,score,created_utc,subreddit,num_comments,upvote_ratio,over_18
1q56shz,https://www.reddit.com/r/SIBO/comments/1q56shz/desperate_post/,Desperate Post,"Deciding to post here with the hope someone can shed some light and maybe help me get though this hell. Maybe it’ll just be a helpful vent for me, so excuse me if it becomes verbose.

I am chronicling my entire battle here with ‘IBS’ as, unfortunately, it has become a long and strenuous battle. It almost becomes difficult to remember the entire timeline as I enter the new year. I figured it would be prudent to take note of everything that has happened from first symptoms, doctors visits, and medications. Hopefully this will give me sufficient detail to prompt either AI or doctors - honestly still not sure which will provide more help.

I am going to take note of everything, even if it may have nothing to do with my IBS.

Throughout my whole life, ironically I usually had excessive bowel movements and flatulence. Nothing concerning or painful ever, just a reality that I would defecate multiple times a day and fart constantly. In my later years of high school, I noticed I was having some issues with lactose so I started switching from milk to lactose free versions. I would still eat lactose products and feel fine for the most part, so the only lactose I cut out was milk. 
Fast forward into college, and junior year is when I start noticing a little change. I am unsure if this is related, but it definitely didn’t help my health - when I ate within a couple hours of a workout, I found myself puking frequently. At the time I was on the rowing team and the scrunching movement would really upset my stomach and cause me to puke almost daily. Also, at this time I noticed some issues mainly with late night oatmeal. Maybe it was caused by the milk I put in my oatmeal, but I often used oatmeal as a late night snack in college. Oftentimes, after a late night oatmeal snack, I would wake up the next morning with some cramping. I was very reliant on Tums to help my cramping, and they usually did the trick.
Up until this point, I am not sure if anything above is a hint as to my condition, or just red herrings and excess information that is not prudent. It came in my second semester of senior year where the real problems started. The rest of this story or nightmare, whichever you prefer to call it, takes place from January 2025 and onwards.
In late February, I began to notice some constipation issues. I was pooping far less frequently, and far less in general. I didn’t really think it was too much cause for concern, as I usually had the opposite issue as previously mentioned. After a couple weeks of fewer and fewer bowel movements, I began to get slightly concerned. It got to the point where my bowel movements were just pebbles that were difficult to force out. This coincided with my college spring break, where I went out to Colorado for skiing. In Colorado, the constipation had gone from a nuisance to now causing some pain. I finally decided to deal with the cramping, so I stopped at a store in Colorado and picked up some stool softener. I thought this would be the end of the story, and I could just move on, but the stool softener did not fix me. After no success with stool softener, I upgraded to miralax and was still constipated.
Following Colorado, nothing improved. In fact, everything worsened. The constipation continued and the camping became debilitating. It was at this time I realized I had a problem I needed to address. I began hopping on reddit and AI asking for first steps to take. The consensus way to deal with gut issues is through diet. I had taken the obvious steps of restricting products with lactose, but now I began cutting what seemed to be giving me issues. Unfortunately, this seemed to be everything. It got to the point where I was eating spinach and salt, hoping to avoid the debilitating cramps. I of course tried eating more fiber, but this didn’t provide any relief.
It was at this time when I got my first doctor's appointment. My first doctor’s appointment for the gut issues was on April 9, 2025. In this doctor's appointment, I took a GI panel (stool test), urinalysis test, and other miscellaneous tests. Frustratingly, the tests all came back clean, giving me no information. The diet I was currently on had helped slightly, but the cramping was still painful. At this point, I tried booking an appointment with a GI doctor only to find out they were booked out for at least 6 months. Desperate, and with no immediate help in sight, I decided to go to the ER with the hopes of getting tests done and or at least to increase my priority on the GI waitlist. During this time, I was obsessively researching GI issues, convinced I had something along the lines of IBS, Chrons, or some other chronic gut issue. I was trying everything I could find on the internet at this time. Fiber pills, peppermint enteric encoated pills, peppermint tea, probiotics, yogurt, kefir, pickles, ibs pills, tums. You name it, I tried it.

My ER visit came on April 19. In this visit, they ran many of the same tests the previous doctors ran with many of the same results. They also performed an X-Ray scan of my abdomen which came back clean. This was a low point as I had seen all the doctors I could see, and had learned nothing new. However, it was also at this point that I came up with my most likely problem: SIBO. I became convinced I had sibo as many of my symptoms aligned, especially some of the more niche symptoms like I had splotchy red skin at one point. The main symptoms I was experiencing throughout this time were cramping, constipation, feeling like air was trapped, belching. Confident I had Sibo, I went to the PA and requested a SIBO breath test. These symptoms have been constant throughout my journey - especially feeling the need to burp but being unable to. And whenever I am fortunate to either fart or burp, I feel some slight relief.

Despite all my confidence that my symptoms had aligned with SIBO, the test came back negative. I still wasn’t fully convinced I didn’t have it, as my hydrogen peaked within 30 minutes of the breath test which I was told was because the glucose was absorbed so quickly in the small intestine, it could point to my GI issues being in the upper small intestine. 

After even this had failed, I became extra desperate and resorted to something I had heard about - the carnivore diet. On this diet, I consumed only steak and tallow. It was this diet that gave me my first sign of hope. While consuming this diet and a digestive daily probiotic, I started noticing a lessening of symptoms and cramps. Within a couple weeks, I had gone from constipation to wet, frequent stools. Continuing through this, I was momentarily cured. I got through summer having issues, but them being rather minor. Cramping here and there, but nothing debilitating. I noticed coffee and cream would make me cramp the hardest so I gave those up. I was still having issues, but far from what they were in previous months. I came off of all restrictive diets, and was this way for a couple months.

Then I moved, and about a month after moving the symptoms were back and worse than ever. Extreme cramping and just feeling ill after every meal. I tried the carnivore diet again, but this time, it did not provide the same relief. I stayed on it for longer, but did not get the same benefit. After doing carnivore for about a month and still experiencing symptoms, I realized it might have been the probiotic that helped me, not the carnivore. I took the same probiotic (Digestive Advantage Intensive Bowel Support Probiotic Capsules) that had previously helped me. This is when something strange happened.

Most of my symptoms went from my stomach to my head. The main problem for me then became debilitating brain fog. Immediately after eating, I would experience immense fog, making it difficult to focus or think. It was also during this time that I finally got in with a GI. He performed a colonoscopy and endoscopy, where he found I was lactose intolerant. I had already assumed this, but it was good to get confirmation. His only other finding was melanosis coli and some mild irritation in the colon. Additionally, the colonoscopy confirmed I don’t have Chron’s or any kind of ulcer colitis. Lastly, they confirmed I don’t have celiac or any gluten intolerance. He said he could treat the mild irritation, but I doubted that could cause all my severe issues.

That takes me to just recently, when I saw a video on SIBO and thought it aligned perfectly with my symptoms. I began herbal treatment for the SIBO, where I noticed some improvement. I think it was the ginger artichoke pills that have been helping me, so I have continued those. I still deal with severe brain fog and some cramps if I eat known bad foods. 

This leads me to now. I am hoping my herbal treatment of SIBO (oregano, berberine, ginger artichoke) can prove helpful as it has already lessened bloating and symptoms, but it doesn't seem to be a cure. The brain fog is the main issue that I have been dealing with lately - feelings of dissociation and drunkeness upon waking up and after eating. The brain fog became so bad I thought I might have histamine intolerance, so I tried taking Famotidine. And this is where I am at today as I continue my struggle with these GI issues.
",1,1767668133.0,SIBO,3,1.0,False
1q56rze,https://i.redd.it/xu2a6wms8nbg1.jpeg,Local coffee shop,,1,1767668096.0,u_Lilliangreg,0,1.0,False
1q56rr3,https://www.reddit.com/r/Pets/comments/1q56rr3/dog_rehoming/,Dog rehoming,"Rehomed my dog today to a family with a big back yard, and kids (he loves kids.) He was the sweetest thing that was stuck in a studio with me who worked a lot. I truly didn’t want to. The whole time I wanted to call it off, but knew he would be much happier in his new home.

Going home today has been so hard. Seeing his little hair on the bed, and his old toys on the floor. I’m truly devastated. I have not stopped crying all day so much my eyelids are swollen

I don’t know the point of this post. I guess is there anyone that re-homed their fur baby & was sad… how did you cope with it? How do you go back to coffee shops that gave him pup cups without crying?",4,1767668080.0,Pets,0,0.84,False
1q56rgp,https://www.reddit.com/gallery/1q56rgp,Before and After,The riser is to allow the cat to pass underneath and folks to put bottles on the coffee table without obscuring the picture.  I'm happy with it.,20,1767668058.0,TVTooHigh,6,1.0,False
1q56rcl,https://www.reddit.com/r/MaximizeMe/comments/1q56rcl/upgrade_your_life_now_smart_optimization_hacks/,"Upgrade Your Life NOW! 🚀 Smart Optimization Hacks for More Time, Energy & Joy! 💡✨🔋","# Upgrade Your Life NOW! 🚀 Smart Optimization Hacks for More Time, Energy & Joy! 💡✨🔋

Hey Maximizame fam! 👋

Feeling like you're running on fumes lately? Or maybe just a little… stuck? We've all been there. That feeling of wishing you had more hours in the day, boundless energy, or just that extra spark of joy to make things feel *good*.

The great news? You don't need a magic wand! You can actively *upgrade* your life, starting right now. It's all about smart optimization, and I wanted to share a few things that have been game-changers for me, and hopefully can be for you too.

Think of your life as a system. Just like a computer or a phone, sometimes it needs a little fine-tuning to run at its best.

Here are some quick hacks to get you started:

*   **Time Blocking Magic:** Seriously, schedule your day. Not just meetings, but *everything*. That workout? Block it. That deep work session? Block it. Even dedicated ""no-distraction"" time. It sounds rigid, but it actually *frees* you up by removing decision fatigue and ensuring what's important gets done.
*   **Energy Auditing:** Where does your energy go? Track it for a few days. Are you spending hours on social media that leave you drained? Are certain conversations a total energy vampire? Identifying these drains is the first step to plugging them and redirecting that precious energy to things that actually fuel you.
*   **Micro-Joy Moments:** Don't wait for a vacation to feel happy. Find joy in the small things. That first sip of coffee. A beautiful sunset. A quick dance break to your favorite song. Actively seeking out and savoring these tiny moments can drastically shift your overall mood and outlook.
*   **Systemize Your Success:** What tasks do you do repeatedly? Can you create a checklist? A template? A simple process? This applies to everything from meal prep to responding to emails. Automating or simplifying these things frees up mental bandwidth and time.

It's not about a complete overhaul overnight. It's about making small, intentional adjustments that compound over time. Think of it as a series of upgrades, each one making your system run a little smoother, a little faster, and a lot more joyfully.

Sometimes, navigating these feelings and making these changes can feel overwhelming. If you're struggling to find your footing or need some extra support as you work on yourself, please know you're not alone. You can find help through [this resource (affiliate link)](https://praneetbrar.com/digistore24/make-my-plan/#aff=maximizeme).

What are your go-to optimization hacks? I'd love to hear what's working for you in the comments! Let's keep this engine of self-improvement running! 💪✨",1,1767668050.0,MaximizeMe,0,1.0,False
1q56r0m,https://www.reddit.com/r/stories/comments/1q56r0m/the_department_of_acceptable_outcomes/,The Department of Acceptable Outcomes,"Arthur Pelts worked in a building that looked like it had been designed by someone trying not to be noticed.

It wasn’t ugly exactly. It was just… apologetic. A tall grey thing with windows that seemed uncertain about being windows, as if they’d been added after someone realised humans needed daylight to survive.

Arthur understood this kind of design. He’d spent most of his life trying not to be noticed either.

The building was home to the Department of Acceptable Outcomes.

The Department did what its name promised: it decided whether the things that happened in the world were acceptable.

Not good. Not fair. Not deserved.

Acceptable.

This was an important difference, though it took Arthur a long time to realise why.

On the seventh floor, in Acceptability Review—Subsection C: Personal Disappointments (Non-Fatal)—Arthur processed the quiet collapses. The kind of collapses that didn’t make the news but did make people stare at ceilings at 2:14 a.m., wondering how they’d ended up with a life that felt like a smaller version of the one they’d pictured.

Arthur had two stamps.

One said: ACCEPTABLE.

The other said: UNFORTUNATE BUT STATISTICALLY EXPECTED.

He used the first one more. Not because it was always true, but because it sounded kinder. And Arthur liked kindness. He liked it the way some people like strong coffee or clean sheets—something necessary, something that made existence feel a little less sharp at the edges.

His desk also had a mug with a cartoon cat clinging to a branch above the words HANG IN THERE.

Arthur didn’t even like cats, but the mug had been a gift, and he had never developed the ability to throw away gifts. He kept them like proof that someone had once thought of him.

Most mornings, Arthur opened case files and did what he was trained to do.

Case 7C-4411.

Denise K., 42. Promotion awarded to someone else. Notes indicated she would smile and say all the right things and then sit in her car and cry so silently that even she might not hear herself.

Arthur stamped ACCEPTABLE, then paused, pen hovering over the paper.

He wasn’t supposed to write anything beyond the stamp. But he did anyway—small, in the margin, like a confession made to a wall.

Still hurts, though.

He closed the file and sent it on, as if it might arrive somewhere that mattered.

The Department believed that naming things made them manageable. That giving disappointment a label was a kind of control. Like putting a wild animal in a cage of language.

Sometimes Arthur believed it too.

Sometimes he didn’t.

On the days he didn’t, he tried to concentrate on the mechanics: open file, read, stamp, close file.

A life reduced to a sequence. A person reduced to paperwork.

It was easier than thinking about the alternative, which was that the Department existed because nobody knew what else to do with the chaos.

At lunch, Arthur often sat opposite Marlene from Subsection F: Minor Joys (Overlooked).

Marlene dealt with things like unexpectedly warm sunlight, finding a forgotten coin in a coat pocket, laughing at a joke that wasn’t even funny, and the relief of a cancelled plan. She treated these events with the seriousness other people reserved for tragedy.

“You look like you’re walking around in someone else’s body,” Marlene said one Tuesday, unwrapping a sandwich that smelled strongly of mustard and determination.

Arthur smiled in a way that didn’t quite make it to his face. “Is that one of your cases?”

“It could be,” she said. “What’s yours?”

Arthur didn’t answer. He didn’t need to. In the Department, silence was a form of disclosure.

Then his phone buzzed with a notification that a new case file had arrived.

He went back upstairs.

At his desk, an envelope waited.

The label made his stomach do something strange, like a lift door dropping half an inch before catching itself.

Case 7C-8890.

Arthur Pelts, 39.

Arthur stared at the words for a long time, as if he could make them rearrange themselves into something else.

He checked the return stamp.

Internal.

That was impossible. Department staff weren’t supposed to appear in the system. You couldn’t be both the judge and the judged. That was the rule. The rule was there for a reason.

Rules, Arthur had always thought, were there to keep reality from leaking in.

He opened the file anyway.

Event: Life feels smaller than promised.
Notes: No single incident. Ongoing condition.

There were attachments. Charts. A graph with a line that dipped gradually, year by year, like enthusiasm draining through a slow puncture.

There was a section titled: Things Arthur Thought Would Happen By Now.

It listed, in neat departmental font:

A sense of purpose

A great love (or at least a vivid one)

A house that felt like home

More laughter

Less fear

Arthur felt the room tilt slightly—not physically, but emotionally, as if the building had shifted to accommodate a truth.

The file wasn’t cruel. That was the worst part. It was calm. Factual. Like a weather report for the soul.

Arthur picked up the ACCEPTABLE stamp.

His hand hovered.

He pictured stamping his own dissatisfaction as acceptable, and something in him recoiled. Not because the Department was wrong. Life was full of disappointments. People did adapt. They did carry on. That was what humans were best at, sometimes to their own detriment.

But it wasn’t just disappointment in the file.

It was a question.

A question that Arthur had spent years avoiding.

Is this it?

He set down the stamp.

He picked up the second stamp—UNFORTUNATE BUT STATISTICALLY EXPECTED—and found he couldn’t lift it.

His hands were suddenly heavy, as though they belonged to someone older.

Then he saw a red pen on his desk. He didn’t remember where it came from. Maybe it had always been there, hiding under forms. Maybe it had appeared because the universe occasionally gave people small tools when they were finally ready to use them.

Arthur uncapped the pen and wrote, across the front page of his own file:

UNRESOLVED

The effect was immediate.

The lights flickered.

The printer beside him began to whine, then spit out blank pages like panic.

Somewhere far above, a phone rang and kept ringing, as if trying to warn everyone about something nobody could name.

Arthur sat very still, red pen in hand, heart pounding the way it did when he was about to do something he couldn’t undo.

Two minutes later, a security guard arrived—not with menace, but with the brisk politeness of someone who had been trained to treat all crises as administrative.

“Mr Pelts,” the guard said, as if they were meeting for coffee. “The Director would like to see you.”

The Director’s office was clean in the way that suggested effort rather than nature. A cleanliness that had been enforced.

The Director looked at Arthur with tired eyes. She didn’t look angry. She looked… worried.

“You can’t do that,” she said softly.

Arthur held the file like a guilty child holding a broken vase. “Why?”

“Because…” The Director exhaled. “Because if things are unresolved, people start to believe they can change them.”

Arthur blinked. “Isn’t that… good?”

“For people,” the Director said.

There was a pause.

“For systems,” she added, “it’s a disaster.”

Arthur thought of all the stamped files. All the quiet griefs made official. All the lives that were told to accept what hurt.

He thought of Denise crying in her car, gripping the steering wheel like it was the only solid thing in her world.

He thought of his own graph, trending down.

The Director slid a form across the desk.

“You have a choice,” she said. “Retract the stamp. Return to your position. We’ll mark this as a momentary lapse.”

“And the other choice?”

“Transfer to Subsection Z.”

Arthur had heard of Subsection Z the way people heard of deep ocean trenches. It existed, but nobody wanted to go there.

“What’s Subsection Z?” he asked, though he already knew.

“Irreconcilable Events,” the Director said. “No stamps. No verdicts. Just… reality.”

“How long do people last there?”

The Director hesitated. “Not long.”

Arthur surprised himself by smiling. “And how do they leave?”

“Different,” she said.

Arthur signed the transfer form.

He went back to his desk, packed his mug, and left the stamps behind.

Down in the basement, Subsection Z had a single whiteboard on the wall. The writing was uneven, like it had been written by someone with a trembling hand, or by someone who had finally stopped pretending.

WHAT HAPPENED, HAPPENED.
WHAT HAPPENS NEXT IS UP TO YOU.

Arthur stared at the board for a long time.

He felt fear, yes—because there was no stamp to hide behind, no label to make the world feel settled.

But he also felt something else. Something gentle. Something like air entering a room that had been closed for years.

A kind of permission.

Unresolved didn’t mean doomed.

Unresolved meant alive.

That evening, Arthur walked out of the building and noticed—truly noticed—the sky. It wasn’t dramatic. It wasn’t a movie sky. It was just the sky, doing what it had always done, above a world that kept happening without anyone’s approval.

He thought about all the things he had stamped acceptable.

He thought about the one thing he hadn’t.

And for the first time in a long time, he didn’t feel the need to decide what his life was.

He only felt the need to live it.

To do one small thing that might make the graph curve upward again.

Even if only by a fraction.

Even if nobody stamped it.",2,1767668025.0,stories,1,0.75,False
1q56qhm,https://i.redd.it/tm52poug8nbg1.png,"Which of these is Indonesians' favorite drink? Which one would you recommend to foreigners? If you could only drink one of these for the rest of your life, which would it be?","Dari minuman-minuman ini, mana yang adalah minuman favorit orang Indo? Mana yang bakal lu rekomendasikan untuk orang Bule? atau orang Mainland Chinese? atau orang India? atau orang Afrika? Kalo lu hanya bisa minum salah satu dari minuman ini seumur hidup, lu bakal pilih yang mana?",40,1767667987.0,indonesia,87,0.9,False
1q56qhf,https://www.reddit.com/r/VyvanseADHD/comments/1q56qhf/first_time_on_adhd_meds_guidance/,First time on ADHD meds - guidance?,"Hey all! 
After being diagnosed in late November, I started  Vyvanse at the beginning of December - two weeks at 20mg and then 30mg ever since. I have my check in with the clinic tomorrow and I'm trying to get a sense of how to discuss the meds with them. Since I've never been on ADHD meds before this is all new to me and I'm not exactly sure what I should be expecting / feeling this far in. 
Each day I do find there's time where I have more focus / ability to stay engaged on a task - also noticing more energy and less brain noise (but I do have GAD so it's never zero!). 
But on the other side I'm finding I feel kind of jittery, I'm clenching my jaw a lot more (already have tmj but it's feeling worse), and its hard to catch my breath / take a full breath? 
I have been taking my dose with breakfast and then making sure to eat and hydrate throughout the day, but I am still having caffeine - one tea, maybe one coffee. 
Does anyone have any thoughts or input? Should I be expecting more from ADHD meds than what I'm feeling? 
Thanks ❤️",2,1767667986.0,VyvanseADHD,0,1.0,False
1q56qbx,https://www.reddit.com/r/xaviersobased1c/comments/1q56qbx/who_is_on_the_cover_of_expensive_coffee/,who is on the cover of expensive coffee?,"this chick is mad iconic, who is she? im assuming shes one of xavs friends",2,1767667975.0,xaviersobased1c,4,1.0,False
