id,url,title,text,score,created_utc,subreddit,num_comments,upvote_ratio,over_18
1k37ik0,https://www.reddit.com/r/Portsmouth/comments/1k37ik0/new_business_in_portsmouth/,New business in Portsmouth,"Im planning to open a business in Portsmouth and I wanted a public opinion on what you guys think is missing in Portsmouth and what you’d want. Recreational centres? Coffee shops? More childcare options / play centers? 

I want to do something to improve the community. Please let me know your opinions! 
",0,1745100101.0,Portsmouth,1,0.5,False
1k37hn5,https://www.reddit.com/r/relationship_advice/comments/1k37hn5/my_boyfriend_is_19m_and_i_am_20_f_and_i_dont_know/,My boyfriend is 19M and I am 20 F and I don’t know how to feel about this text he sent me?,I sometimes struggle with my boyfriend not really making plans or doing surprises for me. He’s never really gotten me just because flowers or showed up with my fav coffee etc. We have been dating for a little over 3 years now. I love him very much but this has always bothered me. I do these things for him so I would think that he would know that it is a thing he could do. I have kinda told him this before but at the same time I don’t want him to do something because I am asking. I want him to do it because he wants to. He has done surprises on like Valentine’s Day this year and stuff but never really just because. Well Easter is on Sunday and he texted me to come outside my house because he was there and I got super excited and he showed up with his mom and they give me an Easter basket. I was super excited because he thought of me. Then I texted him that it was super sweet and he replied with “of course baby! It was all my mom!” this text kinda took some of the excitement away from me because I thought that he had actually done it. Now I get if he maybe went with his mom to get the stuff and drop it off because I do that too. But to say it was all his mom makes me think it was her idea and so me thinking that he did all of that kinda took some of that away. I am not sure if this is really a valid feeling? Or if anyone has dealt with something similar? If so how do you deal with it? ,1,1745100036.0,relationship_advice,2,1.0,False
1k37h1s,https://i.redd.it/nqdmxyj86vve1.jpeg,BrewRoo: The Great Coffee Bean Exchange,"Hey everyone! Most of you have seen the sign ups for this, but some of us have organized a coffee bean exchange while at Roo. If you’d like to be part of it, sign up on the link that’s on the poster. Hopefully this can be something we can do every year. See you all there!",3,1745099992.0,bonnaroo,0,1.0,False
1k37gfc,https://getupnote.com/share/notes/DmCdtEuAlxU2l2Rava7oKM5m24t1/beadc0d6-ef99-4304-9377-0ea9d24e8280,Switch is Really Good for Small Batches (>10 g),"Had 6.5 grand left from a light roast bean that I didn't want to waste and brewed it in a Hario Switch/Mugen. However any size V60 would work as well. 

Grind on finer side of what you would for your V60.  I used 7.5 on  the K-Ultra.

I used the standards red Cafec filter

**Smaller Brew by Asser at CC **
8 g/130 ml. 
Pour 65 ml and close at 20-25 seconds. 
Pour 65 ml and open at 2:00 minutes

**My Small Batch Version**
6.5 g/150 ml
Pour 75 ml and close at 20-25 seconds. 
Pour 75 ml and open at 2:00 minutes

TBT for me was around 3:00+ a few seconds. 

I liked the results from both ratios. I bought the Cafec Deep 27 brewer for small batches before I knew how well the Switch could handle them. Knowing what I do now, I'd say skip the Deep 27 if you own the Switch, unless you collect  The Deep 27 is a sweet brewer 

The link above leads to all my *unedited* notes I've taken on the Coffee Chronicler's videos on the Switch.

Pax

",1,1745099942.0,pourover,1,0.67,False
1k37fl4,https://www.reddit.com/gallery/1k37fl4,Is Sharp Spear partially based on Yang Wen-Li?,"When I first saw Sharp Spear's outfit I was immediately reminded of Yang Wen-Li, although to be fair Sharp Spear's is far more detailed. Their characters also share some similarities, both end up being a military and political leader despite wanting democracy to choose who leads; both end up gaining fame as military strategists despite just wanting their country to be peaceful; and both prefer tea over coffee. ",5,1745099875.0,equestriaatwar,0,0.86,False
1k37f4l,https://youtu.be/fT-iwo-BL5o?si=c-R6uiecR0f9XUi8,2 minutes of video from Cars & Coffee this morning,,3,1745099838.0,classiccars,0,1.0,False
1k37eds,https://www.reddit.com/r/VyvanseADHD/comments/1k37eds/are_these_adhd_traits_that_vyvanse_treats_or_more/,Are these ADHD traits that Vyvanse treats? Or more personality traits?,"Wondering if my quirks are adhd related and if others do them too. Meds have not changed these aspects of me:

\- can't sit with my thighs beside each other. I have to cross legs or sit with one knee up (my right) and my foot beside my bottom

\- can't stand like a normal person, legs beside each other. It feels odd. I have to lean on a wall, or squat like a cat.

\- I always leave one thing behind/unfinished. If I eat a sub, I leave one little bite left that I dont eat. If I do dishes, I'll leave 2 or 3 forks and not finish. I don't completely finish even though I can.

\- I often repeat myself twice. When I explain things, I'll repeat the same sentence word for word twice in a row sometimes.

\- I have serious memory issues with names. So difficult to remember. Also have no perception of time, days, how many days ago, what year was that, etc. Also things with numbers. I mix up the numbers often and am horrible at math above grade 10 level (and I'm an adult, lol)

\- I am ALWAYS thirsty and always have a few drinks going. A water, an ice tea and a protein drink usually or gatorade. I am never without liquids have been like that my whole life.

\- honestly think I'm psychic. I often predict things, see things happen before they do, feel like I can feel others pain, feel like I can read people's minds sometimes. Hyper sensitive to others emotions I guess.

\- I am so angry in the morning. Angry, sad, annoyed, tired. I struggle to get out of it and get ready. I get up early for work, 5am, im not able to have a convo until 7ish. Coffee helps calm me down.

Do you have any of these traits? Curious to see.......thanks! :)",2,1745099778.0,VyvanseADHD,1,1.0,False
1k37e1l,https://www.reddit.com/r/humansarespaceorcs/comments/1k37e1l/crisis_mode/,Crisis Mode,"*For other stories that relate to the Teyasu and the Rayet, check out my posts.*

Humans unique evolution make them invaluable in a crisis, it's not just their intense durability and physical prowess; It's their *mind.*

# Crisis Mode

“Paras.” Marcus gave a sly grin as he sipped his coffee from the cold can.

“I’m sorry Human-Marcus, I do not know this name.”

“It’s what my granddad called the Teyasu - Paras.” Marcus enjoyed messing with the furry Phiulid, Garina. They were often over-formal in speech and behavior, and regularly struggled with the more chaotic behavior, language, and habits of the Solarians. “On account of them looking like an ancient Earth dinosaur. Parasol - err. Parason... Para-”

“Parasaurolophus.” Elodie continued to work at her tablet even as she half-listened to Marcus and Garina.

Marcus raised his can in a mock toast, “that’s it! Elodie the Brain always with the answer!”

The three of them were working on the secondary reactor stack deep in the bowels of the Teyasu Starport. Two of their Teyasu counterparts had departed for lunch. The last one, a young and uncharacteristically energetic Teyasu named Korta, watched Elodie’s datapad as she worked out the advanced calculations to properly balance the reactor. 

Elodie paused to look at Korta. “I’m sorry about him. Some of my colleagues think he comes from a slightly less evolved subspecies of Solarian.”

Korta looked at Elodie, then to Marcus, and finally stopped at Garina. Korta’s large eyes and stocky build reminded Elodie of a stuffie she had as a child, disarming her every time she looked at them. 

Ever-helpful Garina assumed Korta’s expression was curiosity or confusion and offered a response to the unspoken question. “I believe Human-Elodie is referring to Human-Marcus’ ancestral homeland of Scotland. Though I was not aware of any significant evolutionary differences betwee-”“No, I said less *evolved*. Men. I meant *men.*”

Marcus guffawed, “you may be right at that! The Void knows we men can be dumb as-”

The rest of his sentence was engulfed by their entire world instantly turning inside-out. One moment their workroom quietly hummed along as it always had. In the next, it seemed to Elodie a god of chaos had passed through in a fraction of a second, roaring in rage and fury. It left behind a storm of debris and shrapnel in a maelstrom of screaming wind. It was all too much for Elodie to immediately process, but time also seemed to slow to a crawl as her brain took in every detail. The reinforced reactor bulkhead crumpling as it slid away, tearing beams from the ceiling and floor. Sparks flying as conduits split, the thick cables dragged down through the floor along with the bulkhead. Marcus caught mid-laugh even as a pane of transparisteel burst out of the ceiling and tore through the floor next to him, and a spray of blood as it took his drinking arm with it.

An instant later, the time sped back up for Elodie, the blizzard of debris suddenly gone as it was all sucked into the void where the second reactor stack used to be. Now Elodie could see cold, uncaring space and the blue-green curve of Teyasu IV. Elodie’s training kicked in and she was already moving as she switched to crisis mode and her mind buzzed.

*Lights flickering or out - no power in this section. Of course. Reactor 2 is gone.*

*Air still evacuating Emergency bulkheads hadn’t all closed. We have a minute or less of air.*

Marcus was severely injured, but he had already grabbed Garina. He pushed the Phiulid towards the open hatch leading to the interior of the station, fighting upwind against the venting atmosphere. The wind sprayed blood from his severed arm across the room behind him.

Korta stood in utter confusion at all the chaos.Elodie grabbed Korta by his uniform and yanked him towards the same doorway Marcus and Garina were headed towards. They made it halfway across the deck when it lurched again, throwing Garina and Korta to the floor. Marcus instinctually crouched down and kept his feet. Elodie stumbled as the deck lurched and vibrated. The atmosphere venting out of the door they were headed towards stopped, no longer offering any resistance to their escape. 

Marcus lifted Garina up with a single yank, the Phiulid wide-eyed in surprise as he did so. The air was already getting thin and Elodie pointed at the door leading to the outer edge of the station. Marcus sprinted, launching him and Garina toward the door. Elodie scooped up Korta and followed behind him. She could feel Korta wrestling ineffectually to break free of her grip. 

Passing through the door, Elodie saw Marcus had already torn the cover to the manual controls open, and was heaving on the bar to close the hatch. He was bleeding too quickly, and there were red smears on the wall, the lever and streaks across Garina’s uniform. She dropped Korta, practically tossing him aside to grab the lever and slam the door shut.

Marcus then collapsed, soaked in sweat and blood. Elodie bent to stop the bleeding from what remained of his right arm. As she twisted the makeshift tourniquet tight, the orbital starport rang and shuddered with a third powerful impact.

\---

Elodie came back to the utility room she had left her crew in. After stabilizing Marcus with a universal first aid kit, she got his assurance that he could watch over the others while she searched the area for survivors, supplies, and information.

Marcus was on the floor leaned up against a bulkhead, definitely in pain, but the available drugs had taken the edge off. Phiulid physiology was designed to play dead or flee when threats arose, and Garina’s apparently unconscious form was waiting for the threat to pass. Korta was faring somewhat better. His peaceful homeworld had left the Teyasu with no response to danger. While Korta *intellectually* understood their situation was precarious, he simply didn’t *feel* the danger, leaving him deeply confused. 

Elodie passed water pouches around and helped Marcus drink. She had also come back with a few emergency food packs, blankets, and, Marcus noted, a flare gun. Her face was grim, and with a glance at the other two, he spoke quietly.

“You’ve been gone an hour. ” The station groaned and clanged occasionally, the sounds distant as the damage settled.

“There are a couple other survivor clusters, but they’re behind some hard vacuum and bent bulkheads. A couple others had made it to some lifepods and launched. They…” Elodie closed her eyes and shook her head.

Korta blinked and looked at the two Solarians. “Emergency protocol 3.3 states that when there is a risk of decompression, we must proceed to a lifepod and eject. If we are unable to evacuate due to injuries or other factors, 3.6 states that we must use signal methods to alert rescuers of our presence.” 

Elodie smiled gently at Korta. “Yes, but I don’t think either of those are good options right now.”

Korta turned his head to give Elodie his full attention. “But there was a catastrophic impact to the station. We cannot tell how stable the structure is. The protocol gives us clear steps on what to do.” Faint clanging punctuated Korta’s words, lending an urgency he was unable to feel. 

Marcus closed his eyes and took a deep breath. “Korta, what d’you think hit the station?”

“I have been thinking hard about that. I believe it was rogue asteroids.”

Marcus winced as he shifted, then nodded. “Okay, why rogue asteroids?”

Korta waggled his head in confusion. “Nearby construction debris wouldn’t move that fast relative to the station. Industrial castoffs from the outer system would have been reported, tracked and compensated for. That leaves high-speed extra-system uncharted objects like a rogue asteroid cluster. Only…”

Elodie was listening in as she popped the panel off the door console. Marcus glanced at her, then back to Korta. “Only what?”

Korta waggled his head even more. “Only, the odds of that happening are impossibly remote for a single strike. But three?”

Elodie twisted some wires together and the door slid shut, the latch making an audible *click*. She reseated the panel back into the wall. “What if it was from something much closer? Say, a mass accelerator?”

“I have read that mass accelerators could be used to provide thrust to ships, but there are other, far more efficient ways. In addition, the ship operators would need to be careful to ensure their castoff mass didn’t harm anyone. No. Mass accelerators are-” a loud clang nearby shook the deck, cutting Korta short.

Elodie leapt for Korta and Marcus, snatching their emergency lights and switching them off, much to Korta’s objection. “Elodie, what are..”

“*Shut up,”* Elodie hissed. She continued in a whisper. “Mass accelerators are more efficiently used as weapons. When made at a sufficient size, they could do the damage we saw.”

Korta stared at Elodie with those innocent, trusting, wide eyes and was once again reminded of her childhood stuffie.. “But why…”Elodie grabbed his beak, clamping it shut. “Your planet is under attack. That clang? That was an enemy boarding pod. Now we have to be *quiet*, and hope they don’t have scanners that can detect us in here.”

Distant rattling echoed down the corridor outside.

Elodie dragged Marcus and Garina behind a shelf, while Korta gathered up their supplies and followed along behind. She pulled out the flare gun and began to pray.",2,1745099750.0,humansarespaceorcs,1,1.0,False
1k37dta,https://www.reddit.com/r/CanadaPost/comments/1k37dta/coffee_table_from_amazon_stuck_in_canada_post_hell/,Coffee Table from Amazon Stuck in Canada Post Hell,"On April 6, I ordered a coffee table from Amazon for approximately $200. When Amazon shipped it, I was dismayed to see that they had used Canada Post. I saw it go from Belleville (weird) to Mississauga, then Montreal (where I live). I checked the tracking on April 10 and it said ""delivery attempted"". I was home all day and didn't hear a knock at my door. I then found a delivery notice card in my mailbox. So, I went to the post office ready to pick it up. When I got there, they told me they didn't have it. They told me to call the Canada Post depot at \[this number\]. So, I called and they told me they didn't have my table and didn't know where it was. Then they told me to call Canada Post at another number. Again, I called and it was an automated system. They sent me a link by text where I was able to chat with a live agent and open a support ticket. After about a 15-minute chat, I received an email with a support ticket number and an estimated resolution date of 2025/04/23. It seems they have misplaced my table. Could they have lost it? if so, can I get a refund or another table shipped to me (just not by CP)? I know it's not the 23rd yet, but I'm just nervous about losing $200 because Amazon and CP fucked up. I also hate that Amazon doesn't let you choose which company to ship with and they don't even tell you which one until it's been shipped.",2,1745099734.0,CanadaPost,0,1.0,False
1k37bs0,https://www.reddit.com/r/EDAnonymous/comments/1k37bs0/my_diet_culture_dad/,my diet culture dad,"'thats a big banana'
'oooh big sandwich!'
'wow you have a big appetite you boiled two eggs for your egg sandwich instead of one'
'isnt it good that grandma hasn't put as many sweet things on her shopping list?'
'ugh chocolate so sweet and sickly. adults shouldn't have Easter eggs'
'omg mum had three chocolate biscuits instead of two!'
'ew peanut butter and jam together blah blah'
'thats sooo healthy well done I need to eat more fish'

i just feel anxious making meals for myself when he's around as I hate him commenting on it in any sort of way. just sensitive about it still. his constant diet culture kinda talk angers me because 
this good/bad foods thing absolutely doesn't help anyone. it just creates guilt and shame and makes weight a 'moral issue' or failure. 

yesterday i did coffee with 1 and 1/2 tsp of sugar and he judged me saying it was a lot and saying he wouldn't put as much. like bruh that's hardly excessive.

general fatphobia- apparently anyone who doesn't obsessively exercise and walk everywhere is lazy and 'fat'. his words not mine. he hates people who drive everywhere. he's obsessed with getting his steps in and feels guilty if he doesn't move. he feels like he needs to earn food all the time. guess these issues run in the family woohoo!!
he also says the word 'fat' like he's spitting out something extremely nasty, there's so much hate and anger and vitriol in his voice it's honestly horrible. me in recov is just grimacing and gritting my teeth. i do pull him up on it but makes no damn difference.

my family are so body obsessed too like ie:
his comments about my 'long fingers' and calling them elegant and said it's good I don't have 'short stubby fingers'. ugh.
also my grans comments about how she wishes she was slim like me (I am literally gaining idk what she's talking about) 

my dads constant comments about how only fat people go to drive thrus etc.
his constant mocking of fat people who are just existing
I am at my wits end when it comes to his comments. he may be 60 but inside he is a school bully that hasn't ever grown up. he seriously makes me uncomfortable. sometimes I hate him. why do people feel the need to care SM ab what other ppl are eating and moralise food. 
",4,1745099566.0,EDAnonymous,1,1.0,False
1k379al,https://v.redd.it/t5go9mu84vve1,Please help with 2018 indie rock song!,"Please help! I've been trying to find this song since December 2018. I've only heard it once in a Colectivo coffee shop in Evanston, Illinois. It's indie rock I think. I think there was a male and female voice? But unsure. I've searched for so long :,( This is the original recording I made after, sorry for song quality. ",1,1745099366.0,NameThatSong,0,1.0,False
1k377vj,https://i.redd.it/kb3c4f904vve1.png,Time Tracker Productive Hours with Stats and Achievements!,"I was tired of all the other timers i always wanted a switch system between productive time tracking and freetime tracking for a day and i love statistics so i programmed my own productive time app.

To always have it in the back of my head is a real help for me to stay in line sometimes and i love to rush going to the toilette or making myself a coffee to keep the freetime tracking low.

Somtimes just watching the clock is pure dopamine for me.

Its very sad that this sub dosnt allow Pictures because i literally have one of those angled ipad stands beside my laptop where i track my time all day and i cant show you guys!

now my shameless selfplug i hope the mods dont remove it its completly free time tracking tool i tried to better my adhd with i dont plan on making a single dime on it.

apple: [https://apps.apple.com/us/app/productive-time/id6475698456](https://apps.apple.com/us/app/productive-time/id6475698456)

android: [https://play.google.com/store/apps/details?id=com.tgeiling.timer](https://play.google.com/store/apps/details?id=com.tgeiling.timer)

",1,1745099248.0,studytips,0,1.0,False
1k377ox,https://www.reddit.com/r/AskLosAngeles/comments/1k377ox/help_with_5_day_itinerary/,Help with 5 day itinerary?,"Hi everyone! My partner (27M) and I (27F) are visiting LA next week for 5 days and I'm looking for some help with our itinerary! We will be renting a car. These are a few things we have come up with based on prior research + using this sub (in no particular order, still figuring out the details):

* Griffith Park Observatory
* Little Tokyo
* Huntington Gardens
* Venice Canals
* Rodeo Drive
* Manhattan Beach
* Universal Studios
* Hollywood Sign
* Malibu

Is there anything else we should be sure to do/see while we're here?

Here's a few more things we need help with:

* Where to stay: We're currently thinking about getting an airbnb in Santa Monica or West Hollywood. We also considered Manhattan Beach.

* Hiking recommendations?

* Malibu beaches/restaurants?

* Please suggest some of your favorite restaurants- breakfast, lunch or dinner!

* More specifically regarding food, what are your favorite places to go for mexican food or ramen?

* We LOVE trying local coffee shops and roasters- specifically we love to try pour overs but recognize not every place has those. Please suggest your favorites!

If you have any other suggestions, please let me know :) Thank you all so much!",1,1745099234.0,AskLosAngeles,1,1.0,False
1k3776g,https://i.redd.it/h3qa0jiu3vve1.png,Time Tracker Productive Hours with Stats and Achievements!,"I was tired of all the other timers i always wanted a switch system between productive time tracking and freetime tracking for a day and i love statistics so i programmed my own productive time app.

To always have it in the back of my head is a real help for me to stay in line sometimes and i love to rush going to the toilette or making myself a coffee to keep the freetime tracking low.

Somtimes just watching the clock is pure dopamine for me.

Its very sad that this sub dosnt allow Pictures because i literally have one of those angled ipad stands beside my laptop where i track my time all day and i cant show you guys!

now my shameless selfplug i hope the mods dont remove it its completly free time tracking tool i tried to better my adhd with i dont plan on making a single dime on it.

apple: [https://apps.apple.com/us/app/productive-time/id6475698456](https://apps.apple.com/us/app/productive-time/id6475698456)

android: [https://play.google.com/store/apps/details?id=com.tgeiling.timer](https://play.google.com/store/apps/details?id=com.tgeiling.timer)

",1,1745099191.0,ProductivityApps,0,1.0,False
1k3770v,https://www.reddit.com/r/ParisSaclay/comments/1k3770v/socializing_at_saclayorsay_area/,Socializing at Saclay/Orsay area,"Hello everyone!  
I'm an Erasmus M1 student at Paris-Saclay — I arrived a bit late, so I'm still catching up with everything. I wanted to ask if there are any social clubs or events where I could casually meet other students or just connect with people from uni?

I'm up for anything really — chill hangouts, language exchanges, board game nights, movie nights, walks, coffee, whatever.  
If you know about something like this, or if you’re also down to form a little social group and hang out, let me know! I’d love to meet some new people :)

This is not limited to Uni ofcourse, I live in Orsay so if you know some fun places where I can meet people or if there are some social event, language exchange etc let me know! I am down for anything!",1,1745099179.0,ParisSaclay,0,1.0,False
