id,url,title,text,score,created_utc,subreddit,num_comments,upvote_ratio,over_18
1j3ryox,https://www.reddit.com/r/fintech/comments/1j3ryox/seeking_startup_friendly_stripe_issuing/,Seeking Startup friendly Stripe Issuing alternatives,"They declined my application and I am scrambling to find an alternative. I am a US, Delaware C Corp, prelaunch, no funding.

The proposed virtual card usage model is as follows:  
  
\- Subscribers will receive virtual cards for payment purposes.

  
\- These virtual cards can be added to their Apple or Google Pay wallets for convenient checkout integration. Alternatively, they can manually input card details at checkouts.

  
\- The virtual card will remain locked until the subscriber manually indicates their intention to make a purchase (e.g., for cupcake/bakery-related products where Visa is accepted). The card will automatically lock every 15 minutes.

  
\- Upon card unlocking, the subscriber will input the transaction amount. Funds will be transferred from my company’s account to the subscriber’s virtual card to cover the transaction.

  
\- Upon purchase confirmation, the subscriber will upload a picture of the transaction receipt.

  
\- The funds will be sourced from the subscriber’s monthly or annual subscription, which covers 50% of a transaction, up to $2.50 per day. Subscribers will be responsible for the remaining balance for transactions exceeding this limit.  
  
For instance, if a customer orders a gluten-free red velvet cupcake ($5) and CupcakePass covers $2.50 of the transaction, the customer will be responsible for the remaining $2.50. Similarly, if a customer orders a cupcake and a cup of coffee ($12), CupcakePass will cover $2.50 of the transaction, and the customer will be responsible for the remaining $9.50.",1,1741139628.0,fintech,2,1.0,False
1j3ryiy,https://www.reddit.com/r/u_PatientEquivalent979/comments/1j3ryiy/yay_or_nay_to_coffee_cups_as_wedding_favours/,Yay or nay to coffee cups as wedding favours,"I am thinking of customizing coffee cups to be similar to the SB Been There mugs as I am having a destination wedding.  The mug would have the name of the destination and then a whole bunch of fun images pertaining to lives and adventures of the bride and groom.  I would like something useful, so interested to know if this would appeal to our guests.  My fiancé and I collect these wherever we go... So was thinking of something like that for our guests seeing as though majority are travelling...",1,1741139614.0,u_PatientEquivalent979,0,1.0,False
1j3ry2n,https://i.redd.it/998sp40w1sme1.jpeg,Just a quick review,"Went to B&BW for more lotion and instead walked out with these 2 new items and no lotion lol.

Rouge Rebel - This def a 10/10 scent for me! I’m not a fan of super masculine scents bc I feel it gets to a point where it’s just too much and becomes overwhelming. However this is a soft masculine scent and smells SUPER good. Wish they had it in a bodywash too.

My Signature - This is honestly a 5/10 for me. It smells good but isn’t something to write home about. It suffocates me in the shower when I’m putting it on but idk how strong it is outside of that. I’ll use it but probably wouldn’t recommend🤷‍♂️.

Bring back Coffee and Whiskey bodywash!!! PLEASE🙏 😭",8,1741139578.0,bathandbodyworks,2,1.0,False
1j3rxmq,https://www.reddit.com/r/GriefSupport/comments/1j3rxmq/odd_dream/,Odd Dream.,"Bit of a back story, my mother passed away the day before my birthday 14 years ago. My brother, my father, and myself I think dealt with it all different ways. Our Dad kind of left without saying much, just disappeared for a couple of months. My brother and I used martial arts as an outlet. I also started drinking heavily for a couple of months. I don't think anyone of us ever got closure from it. Our Dad leaving has severely impacted myself and my brothers relationship with him now, which is unfortunate as I have a daughter, and my brother is expecting his first child in the summer. I always wished that my daughter could have had the type of relationship with my Dad that I had with my grandparents. Luckily, my wife has amazing parents, and even though there is no blood relation (Wife is my daughters step mom), they have never treated her any different. 
I have never really had dreamt of my mother, at least any dreams I can remember. But last night I had a dream of just my mom, my brother and I. We were younger, toddler age and my mom was in her early 30's. We were living in a house I didn't recognize. It was in shambles, and barely standing. I recall one part of the dream where I was able to actually stick my head out of a hole in the roof and look around. But my brother and I were so happy, always playing. It was honestly great as my brother now has moved to another province and I don't see him as much as I'd like. Through out my dream, my mother always had the same look on her face. It was the same look she had while battling cancer. I couldn't tell if it was a depressed look or not, but my mom would just sit at the kitchen table until 4am, smoking and listening to music through her headphones. Her eyes just always seem to be fixated on something that seemed far away. When I woke, I really started to reflect on this as I had my morning coffee. I have never talked about my feelings about my mom's death. Not with my brother, or wife. Never sought help. I am really contemplating on what this dream meant, the house I never knew in shambles. My mother's expressionless face. I think this is the first time I've ever talked this much about it all. 
I did mention this dream to my brother and couple of hours ago, and he mentioned that he had a dream about our recently passed uncle ( mothers side) last night, and that they were sitting at the kitchen table and he took his hand, and my uncle gave him a nod.
Im not sure where I meant to get to by posting all this, but it just felt right.",1,1741139541.0,GriefSupport,0,1.0,False
1j3rxi9,https://www.reddit.com/r/AskReddit/comments/1j3rxi9/what_are_your_thoughts_on_coffee_cups_as_wedding/,What are your thoughts on coffee cups as wedding favours?,,1,1741139530.0,AskReddit,12,0.67,False
1j3rx3g,https://www.reddit.com/r/Bellingham/comments/1j3rx3g/coffee_place_suitable_for_working_and_studying/,Coffee place suitable for working and studying,"Need to stay at Bellingham for a couple hours on Friday before proceeding to Vancouver, searching a coffee place that has got chargers (outlet I shall say) and an atmosphere suitable for working. 

Thanks for recommendations!!!",2,1741139497.0,Bellingham,4,0.67,False
1j3rwng,https://www.reddit.com/r/MentalHealthPH/comments/1j3rwng/drinking_coffee_while_on_ssris/,Drinking coffee while on SSRIs?,"Ano po experience niyo drinking coffee while on antidepressants? Tinanong ko kasi doctor ko at sabi bawal daw talaga. Sabi naman dito ng iba, pwede naman daw basta konti lang. I don't drink coffee daily, I only drink when I have to stay up late. I prefer drinking brewed coffee and I had this experience na nag heighten talaga yung anxiety ko malala. Pero yung 3-in-1 coffee, wala naman masyadong epekto sa akin.  ",4,1741139462.0,MentalHealthPH,2,1.0,False
1j3rtpl,https://www.reddit.com/r/nsOne/comments/1j3rtpl/the_poor_man_is_the_one_who_invents_and_innovates/,The poor man is the one who invents and innovates.,"Hey everyone!

Today, I want to share a little story related to my nsOne project. I won’t go into technical details or boring stuff, but rather the conditions in which I worked.

Many people think that you need expensive equipment and a high-end lab to create something innovative. But the truth is, I built this entire project using tools so cheap that most would call them “the worst purchases ever.”

I started with fine sandpaper—yes, the kind used for smoothing walls—to work on the motherboard, along with a $9 soldering iron from a local Chinese store. This thing takes forever to heat up, so I literally have time to make a coffee before it’s ready, and it’s not even temperature adjustable… but in the end, it did its job.

I also used a $15 hot air gun with only two settings (250°C or 450°C). It took a lot of practice, but I eventually learned to remove and reattach every single chip on the PS1 motherboard—even the 208-pin ones—without damaging them.

To test connections, I relied on a $7 multimeter from a flea market. Not the most convenient tool for touching tiny pins, but it got the job done. To align the two motherboard layers, I used GIMP, an open-source software, and scanned everything with a 300DPI printer scanner. For checking component footprints, I simply printed them on A4 paper to verify their accuracy.

The most useful tool? Probably my $20 digital caliper with 0.01mm precision. It was crucial for making accurate measurements and recreating some of the board’s components.

All of this is to say: you don’t need a huge budget to create something meaningful. What you really need is passion, ingenuity, and perseverance.

If you have a goal—whether in this field or any other part of life—go for it. There will be ups and downs, but the most important thing is to start.",1,1741139216.0,nsOne,0,1.0,False
1j3rtdl,https://fatlossstrategie.blogspot.com/2025/02/scientists-discover-simple-coffee-hack.html,Fat Loss Strategies: Scientists Discover Simple ‘Coffee Hack’ To Help Boost Metabolism And Release Belly Fat,,1,1741139191.0,weightlosscom,0,1.0,False
1j3rtd9,https://www.reddit.com/r/starbucksbaristas/comments/1j3rtd9/is_being_an_asm_really_that_bad/,Is Being an ASM Really That Bad?,"Hi! Ive been reading many posts on here about how horrible being an ASM or SM is and Im wondering if that has a lot to do with bad DMs and training SMs? I've been at Starbucks now for 1.5 years and a SSV for 6 months I have an amazing SM (who would be my training manager) and good relationships with our DM and GM. They have all encouraged me to apply for the ASM position. Just wondering if it's as bad as so many people say. 

*Side note I did manage a competing coffee chain for 11 years so I do feel I have the necessary qualifications. ",4,1741139191.0,starbucksbaristas,2,1.0,False
1j3rt69,https://www.reddit.com/gallery/1j3rt69,Coffee House Cherry Profile PC Fog Transparent Full Keycaps Set,,8,1741139173.0,keycaps,3,1.0,False
1j3rt1w,https://www.reddit.com/r/psx/comments/1j3rt1w/the_poor_man_is_the_one_who_invents_and_innovates/,The poor man is the one who invents and innovates.,"Hey everyone!

Today, I want to share a little story related to my nsOne project. I won’t go into technical details or boring stuff, but rather the conditions in which I worked.

Many people think that you need expensive equipment and a high-end lab to create something innovative. But the truth is, I built this entire project using tools so cheap that most would call them “the worst purchases ever.”

I started with fine sandpaper—yes, the kind used for smoothing walls—to work on the motherboard, along with a $9 soldering iron from a local Chinese store. This thing takes forever to heat up, so I literally have time to make a coffee before it’s ready, and it’s not even temperature adjustable… but in the end, it did its job.

I also used a $15 hot air gun with only two settings (250°C or 450°C). It took a lot of practice, but I eventually learned to remove and reattach every single chip on the PS1 motherboard—even the 208-pin ones—without damaging them.

To test connections, I relied on a $7 multimeter from a flea market. Not the most convenient tool for touching tiny pins, but it got the job done. To align the two motherboard layers, I used GIMP, an open-source software, and scanned everything with a 300DPI printer scanner. For checking component footprints, I simply printed them on A4 paper to verify their accuracy.

The most useful tool? Probably my $20 digital caliper with 0.01mm precision. It was crucial for making accurate measurements and recreating some of the board’s components.

All of this is to say: you don’t need a huge budget to create something meaningful. What you really need is passion, ingenuity, and perseverance.

If you have a goal—whether in this field or any other part of life—go for it. There will be ups and downs, but the most important thing is to start.",6,1741139163.0,psx,1,1.0,False
1j3rsfp,https://www.reddit.com/r/NameThatSong/comments/1j3rsfp/it_starts_like_woke_up_to_the_sound_of_rain_feel/,"It starts like “Woke up to the sound of rain. Feel the cool window pane. Coffee brewing start the day. In a robe, I sing away”","I think the lyrics is mostly correct but it doesn’t show up anywhere…

It’s by a male singer.
Soft voice
Some what mellow melody.",1,1741139111.0,NameThatSong,1,1.0,False
