id,url,title,text,score,created_utc,subreddit,num_comments,upvote_ratio,over_18
1t6q2xi,https://www.reddit.com/r/r4r/comments/1t6q2xi/33f4r_cincinnati_if_im_lonelyand_yourre/,33[f4r] Cincinnati if I’M lonely…and YOUR’RE lonely………….then WHOS driving the BUS????,"Hello what up and how’s it going. I’m Jay and I am here to fuck everything up. Not necessarily on purpose but I know who I am. 

I’m autistic as hell so please tell me about your niche I am a thirsty bitch for that good good info dump thank you and goodnight. 

I just moved into a new apartment so setting everything up and decorating had commanded most of time lately. I enjoy sitting in the dark, lukewarm coffee, and smutty fantasy novels. I don’t work so I spend most of my time alone which honestly is amazing. 10/10. No notes. 

I’ve been getting back into art recently which is cool. Mostly just sharpie on canvas but I’m about to convert this little cabinet into a graffiti piece with a surprise forest scene inside. It’s gonna be dope as he’ll. I don’t know who he is, but it will be. 

I was recently told that YouTube has three hour blocks of vhs recorded cartoons from the 90’s and 2000’s including commercials and that’s been running pretty non stop since. When did the world stop being fun

Anywhoodle, here I am, sitting in front of a screen, asking you to look at your screen, and read the message, and compose a message, and send the message, and wait for a response. So romantic ",1,1778194070.0,r4r,1,1.0,False
1t6q2v2,https://www.reddit.com/r/IntrovertDating/comments/1t6q2v2/30m_want_to_talk_to_a_nice_guy/,30M want to talk to a nice guy,"So I’m honestly just looking to talk to a nice guy. Someone that likes to text and call. Play video games, talk about tv shows and movies. Just someone that can make me smile. I’m introverted and mostly keep to myself so I don’t have any friends. I play video games , go running and workout often, love Japanese dramas and music, sipping coffee while reading mangas and sci fi novels on rainy days … I’m just a very simple person to be honest. One day I’d love to meet someone that I can do these things with and also see the world with if possible. But it starts with just finding someone to talk to. 5’9, mixed, lean and from Florida. Hope to meet someone kind!",1,1778194065.0,IntrovertDating,1,1.0,False
1t6q2lr,https://www.reddit.com/r/helena/comments/1t6q2lr/lol_little_ol_lady_needs_teensy_bit_of_help/,LOL (Little Ol' Lady) needs teensy bit of help converting a computer file,"I'm posting in the Helena subreddit because I'm in Helena, one of your neighbors (near the cathedral) and not a scammer. I am only 67% computer literate. I downloaded LibreOffice and used it thinking that it was interchangeable with Microsoft Word. I decided I don't like LibreOffice and deleted it. The issue is that the one and only document that I spent all day writing using Libre is NOT compatible with Word and I can't open it. I don't really want to re-download Libre for a single file. Therefore I was wondering if one of my fellow Helenans has Libre and would be willing to have me email the file, copy/paste into Word or an email, and send it back to me. I'm willing to pay for a coffee, either at BuyMeACoffee or at Firetower. The file is a collection of facts from a book I got at the library called ""The Big Bad Book of Botany"" and it took me the ENTIRE DAY to read that book and file those facts for an article I'm writing, dang it. Anyway, doesn't hurt to ask, so I'm asking.",2,1778194046.0,helena,0,1.0,False
1t6q1ev,https://www.reddit.com/r/NoStupidQuestions/comments/1t6q1ev/is_water_good_at_keeping_someone_awake_and_if_yes/,"Is water good at keeping someone awake? And if yes, why?","I'm currently at the hospital and have a colonoscopy tomorrow, and I need to drink a hella lot to get my intestants clean. It's almost 1 in the morning and I'm not even a little tired. Why the warer then and not something else? The past two days I did not drink so effing much water and couldn't even stay awake during the day. And it's healthier than coffee or energy drinks. Friends of mine that drink a lot of water also never complain about being tired, so I guess it's not nervosity keeping me up.",1,1778193960.0,NoStupidQuestions,3,0.67,False
1t6q183,https://www.reddit.com/gallery/1t6q183,Coffee station,Hey all! What do you think about this setup? I just got the Hibrew G5 grinder a week ago and i made the knock box and tamping station by myself. The moka pots and the lamps are thrifted. Any thoughts or suggestions? ,2,1778193946.0,espresso,0,1.0,False
1t6pz7u,https://youtube.com/watch?v=_LHzjdmJfNM&si=UzB5W5EVpFNAxaEe,We Tested Folgers vs Hills Bros Coffee,,1,1778193802.0,CoffeeWarsTv,0,1.0,False
1t6pz7r,https://www.reddit.com/r/Tunisia/comments/1t6pz7r/good_coffee_shops_f_cv_tunis/,Good coffee shops f CV tunis,"looking for good cozy recommendations for coffee shops in cv Tunis for a nice breakfast with my man. we both aren't very knowledgeable about places in cv , we want calm tasty coffee f zone : Medina/lafayette / Mohammed 5  etc",1,1778193802.0,Tunisia,0,1.0,False
1t6pyhf,https://www.reddit.com/r/AirBnB/comments/1t6pyhf/host_replied_to_my_review_stating_something_i/,Host replied to my review stating something I didn’t do [guest] [USA],"Hiya! long story short, stayed in a property for a few days, and I reviewed it 5 stars, but in my review I mentioned that there were two coffee cups left around the house that must’ve been missed when cleaning, no big deal! The host replied to my review saying that she found the cups ’thrown into a basket’ which they stained, and said it would’ve been ‘more helpful’ to throw them into the bin instead. 

  
I didn’t include it in my review, but I did empty the cups I found and then put them in the trash, so I’m not sure what she is on about, I assume there was another coffee cup left somewhere else in the house that I wasn’t aware of.

  
What would you do in this scenario? is it worth sending her a message saying I have no idea what she is on about, or just leave sleeping dogs lie? Obviously not a major thing, but I am aware that future hosts can check the reviews I have left for other people and might get the wrong impression..",1,1778193749.0,AirBnB,2,1.0,False
1t6pyd8,https://youtube.com/watch?v=dwNSquNV6M8&si=GjWp9SRjaruCMtoE,Coffee’s Wild Origin,,1,1778193741.0,CoffeeWarsTv,0,1.0,False
1t6py0j,https://www.reddit.com/r/UnsentLetters/comments/1t6py0j/2305_7526/,23:05 7/5/26,"You, 

It’s almost another ‘morrow. I reached out the other night. You barely said two words. I’d have overlooked it if I didn’t know you. We spun circles around each other for so long, I memorised your every mood. Every tactic you employed in your playbook. 

We’d wake together, schedule breaks for everything from coffee to when we ate. The onus of that is on you, you were older, wiser, more liberated than me. So you led the dance. Imagine a dance lasting just gone 3 years. 

We never did anything but enjoy each other’s company, subtle games of words with friends where no words were ever enough; dumb movies neither of us was paying attention to. 

Then you ghosted, a year didn’t fly by, it dragged. Nails on a chalkboard, kicked more energy out of me than I could afford. I built my routine back up. I told myself you’d be back. Filled times marked ‘A- Date Night.’ with solo time because, what else was I supposed to do? Drink? You never drank, I hate who I am when I drink.    
Pills? Barely touched the torched sides. So I whispered that you’d be back. 

And taught myself that when someone says they love me, when someone wants my company? It’s not for me. It’s for what they can drain from my psyche. 

Thank you. 

M    
‘x’ ",1,1778193717.0,UnsentLetters,1,1.0,False
1t6pxz7,https://i.redd.it/t442x83vmszg1.jpeg,Lost dog in St. John’s (please do not approach),"Tiny scared shelter dog recently rescued from a hoarding situation has escaped in the St John’s area. She has been spotted on Willamette & Polk, as well as on the cameras at Cathedral Coffee during the night. PLEASE DO NOT APPROACH! If spotted, please call one of the numbers on this flyer with info. Please help bring Daria home!",8,1778193714.0,Portland,0,1.0,False
1t6pxmm,https://www.reddit.com/r/TalesFromTheCreeps/comments/1t6pxmm/i_tried_the_ritual_because_i_was_desperate/,I tried the Ritual because I was desperate.," **u/finalgirl6692**  
 I honestly don’t  know how to explain this without sounding insane but here goes….  
I’m Maria. I write screenplays for a living, or at least I’m supposed to. Most of the time it feels more accurate to say I sit at a laptop and get yelled at for not producing miracles on command.  
A few weeks ago, I was stuck on a horror script my boss wanted me to rewrite. Same problem as always: they wanted something scary, but not too scary. Dark, but marketable. Brutal, but still “fun.” They wanted a final girl who made everything look easy.  
I hated it.  
So I did what I always do when I start feeling boxed in. I disappeared.  
I took an Uber out to my family’s old farmhouse in Kansas, the one nobody uses anymore. It’s out past the last real road, surrounded by dead grass and flat fields and silence so deep it makes you feel watched. I figured if I was going to be miserable, I might as well be miserable somewhere quiet.  
The driver didn’t say much. He just looked at the house when we pulled up and asked if I was sure about this place.  
I told him I’d be fine.  
He gave me that look people give you when they don’t believe you but don’t want to argue, then drove off and left me standing there with my bag on the gravel drive.  
The house was exactly what you’d expect from a place nobody’s lived in for years. Dust. Warped wood. Old wallpaper curling at the corners. That stale smell of closed-up rooms. I checked every door and window twice, more out of habit than fear, and then set up in the kitchen because it had the most usable table and the least creepy light.  
I opened my laptop.  
I stared at the cursor.  
Nothing.  
For hours, nothing.  
I wrote one line and deleted it. Wrote another and deleted that too. I paced the kitchen. I drank too much coffee. I got annoyed at myself, then annoyed at the script, then annoyed at the whole idea of having to make another fake monster out of a pile of notes from someone who thought “more commercial” was a creative direction.  
At some point I got so frustrated I started messing around online, looking for stupid little writing rituals people swear by. Candles. Intention. “Open the path.” That kind of nonsense.  
There was one that said to draw a pentagram, light five candles, and speak your story aloud before you begin.  
I know how that sounds.  
At the time I was tired enough and irritated enough that it sounded like a challenge.  
So I did it.  
I found chalk in the utility closet and made a messy, uneven star on the kitchen floor. I lit five old candles from a drawer nobody had opened in years. Then I stood in the middle of it and read the little ritual out loud like an idiot.  
Nothing happened.  
No sound. No cold spot. No creepy feeling. Just me in a dusty kitchen with bad lighting and a headache.  
I laughed at myself.  
Poured me some wine kicked back and basically procrastinated more, after a glass and a Joint I went back to the laptop.  
And then it happened……  
Out of nowhere, it was like somebody switched something on in my head.  
I didn’t feel blocked anymore. I didn’t feel tired. I just started writing.  
It wasn’t even hard. The words came so fast I could barely keep up with them.  
Page after page, scene after scene, like the whole story had been sitting there waiting for me to finally shut up and let it out.  
I stayed up until my hands hurt.  
I didn’t stop to think. I didn’t stop to proofread. I just wrote.  
And when I finally hit the last page and typed the ending, I remember sitting back and feeling weirdly proud of it.  
That was the last normal feeling I had.  
I saved the file.  
I shut the laptop.  
I was about to send it in to my boss but  
That was the exact moment everything started.  
Out the kitchen window it something caught my eye, i swear I saw someone standing at the wood line it was foggy and I had smoked and had some wine so I was like ughh ok? Definitely need to chill on the drinky drinks   
I was done writing right?   
 first sound was upstairs.  
A single heavy step.  
I looked up toward the ceiling and told myself it was the house settling.  
Then I heard another step.  
Then another.  
Slow.  
Measured.  
Like someone pacing above me.  
I stood up so fast my chair tipped over behind me.  
The kitchen was still, the candles burning low around the chalk star on the floor. I remember looking at that stupid little ritual and feeling embarrassed for having fallen for it.  
Then the back door creaked open.  
Not all the way. Just enough to make the hair rise on my arms.  
I backed up without meaning to.  
Something moved in the hallway.  
A shape. Tall. Dark. Wrong.  
I don’t think I screamed at first. I think I just made this little choking sound because my brain still hadn’t caught up with what my body was seeing.  
Then the thing came forward and I saw the face.  
Or what passed for one.  
Pale. Smooth. Blank.  
The same figure I had just written.  
The home invader from the script.  
That was when my stomach dropped so hard I thought I might throw up.  
He just stood there… then in one motion  
He hit me before I could run, slamming me sideways into the wall hard enough to rattle my teeth. I slid down, trying to crawl away, but he grabbed me by the shoulder and yanked me back up just to throw me into the counter.  
The impact knocked the air out of me.  
I tasted blood.  
He hit me again before I could even get my hands under me.  
Not a clean punch. More like a violent, ugly blow that sent me skidding across the floor and into the leg of the table.  
I’m not going to pretend this was a stylish horror scene. It wasn’t. It was brutal and clumsy and terrifying.  
I fought back with whatever I could reach.  
A chair.  
A lamp.  
My own hands.  
He kept coming.  
Every time I thought I’d gotten space, he was right there again.  
I got to my feet and ran into the living room, but he caught me by the back of my shirt and threw me into the doorway so hard I cracked my shoulder on the frame. I went down hard, curled around myself, and felt him kick my side once, then again.  
I still can’t take a deep breath without remembering that feeling.  
I crawled toward the front door and managed to wrench it open with shaking hands. I got one foot outside before he grabbed me by the ankle and dragged me back across the threshold.  
My hands caught on the porch boards.  
Splinters.  
Blood.  
Then he slammed the door shut and the whole house seemed to go quiet for half a second, like it was listening.  
I got away from him only because I kicked him in the knee and got enough room to roll off the porch and hit the dirt hard.  
I ran.  
I didn’t think. I just ran.  
Out past the porch. Past the broken steps. Into the field behind the house.  
The grass was tall and wet and cut my legs as I pushed through it. I heard him behind me. No yelling. No frantic noise. Just those heavy, deliberate footsteps closing the gap.  
I made it to the tree line before he tackled me from behind.  
We hit the ground hard enough to knock the wind out of me again.  
He rolled me over and I saw the same blank, pale face hovering over mine in the dark.  
That’s when I finally understood I wasn’t dealing with some random intruder.  
This was the thing I had written.  
The thing I had put in the script.  
The thing that had been waiting for me to finish before it could start.  
I drove my knee up into him as hard as I could.  
It bought me maybe two seconds.  
I used them.  
I crawled into the old shed near the fence line and slammed the door behind me, then shoved a busted shovel through the handle to keep it shut. I was shaking so badly I could barely breathe. My face was wet with blood and dirt and tears I didn’t remember crying.  
My phone had one bar.  
I called 911 first.  
I got through enough to say my name, say there was someone in the house, and say I was at the farmhouse outside town.  
I tried to explain, but then I heard footsteps outside the shed the dispatcher finally respond and what she said made my blood run cold she said “did you finish the script?”I I was shocked I said “wtf please! Send someone!”   
The dispatcher replied “finish the script” and the line went dead.  
I called my boss next because my brain was still doing that stupid thing where it tries to reach for the most normal person in the world when everything is falling apart.  
He answered irritated, like I’d interrupted him.  
I told him something was wrong.  
He told me to calm down.  
I said, “He’s here.”  
There was a pause.  
Then he said, “Who?”  
But I couldn’t answer because the shed door was shaking under a hard удар from the other side.  
Hard enough to make the whole frame groan.  
I backed into the corner and held my breath.  
Then it clicked.  
The way he was moving. The way he looked. The timing. The script.  
It all clicked.  
The invader wasn’t just some random maniac.  
He was my home invader.  
The one I’d written into the story.  
And somehow, because I finished the script, he’d started happening for real.  
I don’t know what the ritual actually did.  
I don’t know if it called him or made room for him or just opened the door enough for him to step through.  
I just know that once I understood that, there was no going back, I know what the ending is and my dumbass wrote a fucked up ending, to trump all forms of torture you think you’ve seen on film and I was not about to go through that.   
He got into the shed a minute later.  
I won’t pretend I was heroic.  
I was half dead by then.  
He threw me into a shelving unit, and the whole thing collapsed on top of me. Something sharp cut my arm open. I screamed and shoved a broken piece of wood into his face. He staggered, and I used that second to crawl past him and out the back of the shed.  
I made it to the house again on pure panic.  
The laptop was still on the kitchen table.  
The script was still open.  
I grabbed it and saw the final pages.  
My final pages.  
And I realized the ending I had written for the heroine was the one I needed.  
Not elegant. Not clever.  
Just survival.  
I started changing things.  
Fast.  
I rewrote the ending to give her a chance to escape. I rewrote the invader’s last scene. I made him hesitate. I made the house betray him. I made her keep moving even after she was too hurt to stand straight.  
And the whole time I was typing, the house was getting quieter.  
Not safe.  
Just quieter.  
Then he came through the kitchen again.  
Same blank face.  
Same horrible calm.  
I was too tired to be scared the way I had been before. All I felt was this cold, ugly certainty that if I stopped writing, I was dead.  
So I kept going.  
I hit save.  
I saved again.  
Then I finished the last line.  
The second I did, the lights flickered.  
The invader stopped moving.  
Not because he was gone.  
Because he was looking at me.  
I grabbed the knife from the counter and told myself not to think about how ridiculous I probably looked. Then I swung at him, shoved past him, and ran for the front door.  
This time he didn’t grab me.  
I don’t know if it was the script.  
I don’t know if it was luck.  
I don’t know if he was already slipping away.  
I just know I got outside.  
I got down the road.  
And I saw headlights coming toward me.  
A woman in a pickup stopped and let me into the cab without asking a single question.  
I must have looked insane.  
By the time I got to town I could barely keep my eyes open.  
The police searched the farmhouse.  
They found the chalk star on the kitchen floor.  
They found my laptop.  
They found blood.  
They did not find him.  
Not by the time they got there, anyway.  
I’m home now.  
I’m hurt. Bruised. Stitched up. Everything aches. I can’t sleep more than an hour at a time without waking up thinking I hear footsteps in the hallway.  
My boss keeps asking if I’m able to send the revised draft.  
He thinks that’s a normal question.  
I haven’t told him the whole story.  
I don’t know if he’d believe me anyway.  
I don’t know if I believe me.  
What I do know is this: I wrote something in that farmhouse, and whatever it was, it didn’t stay on the page, he did end up loving the script….i understand what it means to survive now, when you’re the one in the mix it changes your perspective and my god do I understand the meaning of survival……it did pretty well for what it was.   
I’ll update if anything else happens.  
I don’t exactly want a sequel, but I’m not sure I’m the one deciding that.  
Signing off.  
— **finalgirl6692**",1,1778193689.0,TalesFromTheCreeps,1,1.0,False
1t6pw9r,https://www.reddit.com/r/VietNam/comments/1t6pw9r/visiting_hanoi_on_sunday_may_10_anyone_wants_to/,"Visiting Hanoi on Sunday (May 10), anyone wants to hang out?","Hey everyone,

I’ll be in Hanoi on Sunday, May 10, and thought it would be cool to meet some new people while I’m there — locals or fellow travelers/foreigners, everyone’s welcome.

I’m thinking about arranging a casual meetup in the afternoon around Hoàn Kiếm Lake. Maybe coffee, walking around, chatting, or exploring nearby spots.

If anyone’s interested, feel free to comment or send me a message.",1,1778193598.0,VietNam,0,1.0,False
1t6pv8t,https://www.reddit.com/gallery/1t6pv8t,Laneige x Cobe x RW presents Condo Party Edition | RW Coffee,"We’re somewhat certain that this is Phupha’s personal business but we’re still trying to confirm whether he owns it or just works there 

[source](https://vt.tiktok.com/ZS9stDupe/)",1,1778193527.0,Domundi,0,1.0,False
1t6pv5w,https://www.reddit.com/r/dating_advice/comments/1t6pv5w/19f4a_trying_to_make_more_friends/,19F4A — trying to make more friends,"hello !! looking for genuine friendships because making friends as an adult is actually hard 😭 i like chill conversations, late night talks, coffee runs, random food trips, and sending each other memes/tiktoks.

i’m shy at first but warm up quickly if we click. would love people around my age who are easygoing and fun to talk to.

tell me about yourself if interested ♡",5,1778193521.0,dating_advice,2,1.0,False
1t6ptxc,https://www.reddit.com/gallery/1t6ptxc,Free app that I made seems perfect for this subreddit! :D,"Hi everyone!

  
So recently, I made this app to use amongst me and my friends (I personally have ADHD so it was initially for me haha), but I was recently suggested that I make it publicly available, and I think people of this subreddit would love it!

The premise of the app is basically the same as that of this subreddit, building habits and hobbies are easier when you do it together. In the app, you can create ""huddles"" in which you set a minimum commitment, and people who join the huddle need to set personal commitments equal to or greater than that of the huddle. People in the huddle check in via taking a photo every time they complete the action. :)

Well... that's it! I spent sooooo much time on making this publically appealing and pretty (I had no prior design experience) and I hope people of r/Accountabilibuddies find this useful!

  
Please let me know if you wish to see new features or find any bugs!

The app is called:

Huddle: Easier Together on both App Store and Play Store :)

",2,1778193434.0,Accountabilibuddies,0,1.0,False
1t6ptke,https://www.reddit.com/gallery/1t6ptke,Pattern weld uneven dark spots,"Posted a few days ago about an etch that was really bad, I re sanded and tried sulphuric acid instead of ferric chloride, way better results but it seems like it’s dark in some places and light in others. I cleaned with acetone before etching, warm acid, polished to 1000 grit, did not coffee etch yet. What do we think the problem is here? Would a coffee soak fix this?",1,1778193408.0,Blacksmith,0,1.0,False
