id,url,title,text,score,created_utc,subreddit,num_comments,upvote_ratio,over_18
1mw4omk,https://www.reddit.com/r/creepypasta/comments/1mw4omk/mint_and_metal/,Mint and Metal,"I walk home after late shifts. It’s a boring route I could do half-asleep: across the tram tracks, past the shuttered bakery, up the concrete stairs to my building. Nothing ever happens. That’s kind of the point. It’s the part of the night where your brain goes quiet and your feet do the rest.

First thing that threw me off was the stair rail in my building. The metal has a cheap paint on it that flakes if you scrape it with your keys. I grabbed the rail like always and felt rough patches under my palm—little bumps where it should’ve been smooth. When I leaned in, there was a cluster of tiny marks at elbow height. Not scratches. Not a key drag. It looked like someone had pressed their teeth into the paint and tested a bite, over and over, in a neat line. Half-moons with little ridges.

I said out loud, “Okay?” to nobody, and laughed because it was a dumb thing to say. Maybe some kid did it as a joke. Maybe a stray dog looking for something to munch on. I wiped my hand on my jacket and went upstairs.

The next night I walked into the lobby and the elevator doors were already open. Nobody inside. I got in, hit my floor, and only then noticed the smell. Not the usual piss and cigarettes. Mint. Like toothpaste. Clean, bright mint, and under it a metallic tang, like a handful of coins. It wasn’t strong, just there. I checked the corners of the elevator for a urinal cake or something weird. Nothing. The camera dome in the corner had a faint smear on it. At a certain angle it looked like a mouth print. It was probably a hand. 

On my floor I got out and listened before unlocking my door, because that’s what you do when a smell puts a thought in your head. The hallway was quiet. I slept badly anyway and blamed the coffee I’d had too late.

Third night, I heard a clicking sound on the street. Not loud. Just every few steps: click. I stopped and it stopped. I walked and it started again, like it was syncing with my footfalls. Teeth tapping together. I didn’t want to think that, but once I thought it, I couldn’t unthink it. The street behind me was empty in the hazy orange light. I did the thing where you pretend to check your phone so you can turn your head without looking scared. Nothing there. I went inside, took the stairs two at a time, and didn’t touch the rail.

Fourth night I decided I was being stupid and went the long way around, past the parking lot where the delivery trucks sit. Someone had wheeled a dumpster to the curb, one of those big green ones with a split lid. The left lid was up and a short person was standing with their head inside the opening. That’s what it looked like, anyway. I made a point of not staring. People dig through recycling; it’s not a horror movie. When I got to the corner, the lid clapped shut like someone let it drop, and the sound made me flinch. I kept walking. At the glass door to my building I caught my reflection and I looked like a person pretending they weren’t hurrying.

Inside, Marek the night guard had his small TV on with the volume down. He likes to talk. He said, “You see the kids putting gum on the camera again?” and laughed, pointing at the elevator view on his monitor. I said no and he rewound a little for me. It was mostly an empty lobby loop, slowed down, sped up, the way he plays with it. Then there was this one freeze—just one frame where the lens looked fogged from the outside, fogged and pressed in a shape that could’ve been a grin. Then back to normal. He said, “Freeze-frames always look stupid.” I nodded like I agreed. I didn’t ask him to rewind again.

The fifth day it rained hard, the kind of rain that makes the sidewalks flash inside the streetlights. The bakery’s awning had a rip that spit water right at the curb. I was skirting the edge to avoid the splash when a delivery van cut the turn and I stepped off the curb without thinking. My foot hit slick metal. I slipped, grabbed for the lamppost, and heard the clink that makes your stomach drop before your brain catches up.

Keys. They went down the storm drain.

It wasn’t a deep one with a grate you could pry up, either. It was one of those long, skinny slits that swallow things and pretend they never existed. I swore out loud and then swore again, louder. The rain made it hard to see. The keys were there, just inside the opening, caught on something. I could see the blue supermarket tag bobbing in the runoff. I got on my knees in the puddle and reached, and at the last second they slipped one notch deeper. Not gone, but out of finger range.

I looked around. No one on the street. The van was already up the block. I tried to hook them with a twig. It snapped. I thought about calling Marek to come down with a magnet or a hanger, but I’d left my phone at eight percent and it had already died. I swore a third time because why not, then leaned in and said, “Come on,” like the water would hear me.

Something moved in the dark gap under the grate. It wasn’t big. A small hand came up, pale and careful, with short fingers and neat nails. It took the key ring between two fingers and fed it up through the slit. The keys rose, dripping, and tangled it what looked like some old dental floss. I froze just long enough for the part of my brain that likes to ask questions to say, Where is that arm coming from? Did a squirel or some rodent just handed me the keys? I'm tripping...maybe i shouln't have eatem that brownie after all, but it looked to good to pass on. Then I did the only thing you do when a stranger hands you your keys from a place no person should be: I took them.

“Thanks,” I said automatically, like I had good manners. The hand slid back down, quick and tidy. The keys were looped with a short length of dental floss, tied in a clean square knot I didn’t make.

I stood there with rain in my eyes, a wet knee, and my keys in my hand, thinking about how I was going to tell this story to a person without sounding like I’d made it up. I walked away fast because standing there seemed worse. The floss hung off the ring and tapped against my knuckles with each step, and I didn’t want it to touch me but I also didn’t want to pull it off and drop it in the street. The feeling was dumb and real at the same time.

In the lobby, Marek wasn’t at his desk. The elevator doors were closed. I took the stairs and kept my eyes pointed at the center of each step like I was counting. At my door I fumbled the lock because the floss had twisted around the front-door key and tightened itself.

I put the keys in the ceramic bowl by my bed, peeled my wet socks off, and sat on the edge of the mattress thinking about the feel of that hand. It hadn’t been cold, the way you imagine something from a drain. .It was also careful, like the hand of someone who didn’t want to get bitten by a dog.

I woke up with a coin under my pillow. Not one of mine. It was too light, with a hole drilled near one edge like a charm. The metal was dull and had that old pocket smell. My gums were sore on the upper right for no good reason. When I prodded the spot with my tongue, a sharp stab shot through my jaw and watered my eyes. I hadn’t dreamed anything that would explain waking up with a souvenir, so I did what you do when you don’t know how to process something: I put the coin in my nightstand and pretended it was a prank I’d done to myself. That brownie was crazy.

In the bathroom I spat pink and saw a thin pale line on the gum above that molar, a straight line like someone had drawn it with dental floss and pressed hard. I stood there with the toothbrush in my mouth  confused.

I moved the ceramic bowl to the dresser and set the keys inside it, floss and all. I realised i never removed the tangled floss. The know on it was neat and small. A better knot than I could tie.

Later that day I booked a dentist appointment because that tooth didn’t feel like the pain was gona go away.. The receptionist had one of those voices that makes everything sound like a solution. “Tomorrow afternoon? Great, we’ll see you then.” I almost told her why, just to hear what it sounded like out loud, and stopped myself in time.

In the elevator the air smelled mint-clean again, then coin-sharp when the doors closed. It was faint, like it had soaked into the carpet. I hit the button for the lobby and watched the floor numbers. Somewhere between floors the cab made a soft bell sound it doesn’t make, like a tone from a different building snuck into this one. The doors opened on the basement for no reason. The light down there is on a motion sensor and it didn’t come on. I hit my floor again and the doors closed too slowly. I stood in the mirror with my own face and didn’t turn around to see if anyone else had gotten in because I didn’t want to be the kind of person who checks.

When I got home that evening, the building chat we have had a photo of the little boy from 4B grinning with a missing front tooth, thumbs up. It was neat little thing, we were all friendly and nice and liked to chat. Reminded us of those old MSN days. The caption from his mom said, “Look who’s growing up!” People posted hearts and tooth emojis. I typed “nice” and erased it and typed “congrats” and erased that too because I didn’t feel like saying anything.

I listened for the clicking that night and didn’t hear it. That should’ve been reassuring. It wasn’t. Around the time I usually fall asleep, the bowl on the dresser rattled once. A small ceramic sound like a coin settling after a long slide. I stared at the ceiling and told myself it was the windows. The bowl did it again, a polite little knock. I sat up and looked. Nothing moved. The floss tail hung over the rim and swung, then eased to still.

I took a photo of the keys so I’d have proof they’d moved if they moved. I watched the photo for a long time like an idiot, as if it were going to show me more than the real thing.

At the dentist I tried to explain the ache without sounding like a person who bites down hard when they’re anxious. “It’s this one,” I said, tapping the molar. He poked and tapped and made the little thinking sounds they make.

“You’ve got a microfracture starting at the root,” he said. “Strange pattern. Almost like something was chipping at it. You could wait and see or we can schedule an extraction and be done with it, but its not realy there yet. It's up to you. But i do need to remind you your insurance has expired. If you want this done before you renew it, its gona cost you, but you could also take some painkillers and wait and see.”

“Wait and see,” I said automatically. He offered me a bite guard for grinding. I said yes to the guard because it made me look like someone with a normal problem.

At the counter, the bowl of candy was all peppermints. I reached and then didn’t, suddenly sure I’d be rude if I touched anything mint with my mouth.

When I came back to the building, the boy from 4B was dragging his scooter over the lobby tile. He stopped by Marek’s desk and told him very seriously that his tooth fairy had a voice like a man on TV. “Did you say thank you?” his mom asked. He nodded. “He said I owe him when I get my big teeth,” the kid said, and the mom laughed and said, “You owe me not to leave your scooter in the hall.”

I went upstairs and closed my door and leaned my head against it. I know kids lie. I know they tell big stories. It didn’t matter. The words stuck anyway and repeated themselves: I owe him when I get my big teeth.

That night I taped over the bedroom vent with masking tape I found in the junk drawer. I put the chair under the handle of the door even though the lock turns the other way. I took a kitchen towel and crammed it against the gap at the floor because some part of me needed to be busy. When I was done, I stood there and felt stupid and less exposed at the same time.

I put the keys and the coin from my nightstand in the ceramic bowl and set it on the dresser. The coin looked harmless. It had little dots around the edge where you could imagine a country name but there wasn’t one. I sat on the bed and waited for the bowl to rattle. It didn’t. When it finally did, I had started to drift and the sound snapped me back. It was quieter than the night before. A second later, something touched the bottom of the bowl from underneath, like a knuckle, and then went still.

I did not look in the mirror above the dresser. I didn’t want to see anything over my shoulder. I lay back down and watched the door and finally slept because you can’t not sleep forever.

When I woke up, the bowl was arranged differently. The keys were on top of the coin with the floss tail draped neatly over the rim. The knot had been retied tighter. The tooth pain was worse and now there was a taste in my mouth like chewing a penny. In the bathroom I ran my tongue over the gum and felt a thin ridge, straight and purposeful. I spat blood once and then water until it ran clear, and caught myself staring at the pliers in the cabinet, and sudenly felt this strong urge, that i coulnt explain..It was a bad idea but for some strange reason it felt so natural to do, like i was suposed to do it. I shruged it off.

I went to work and did my job and tried to think of anything else. You know how your brain will not let go of a word once you’ve said it out loud? The word “thanks” sat like a pebble in a shoe at the front of everything I tried to think. I said it without thinking when the hand lifted my keys. I made the deal I didn’t understand. It sounded stupid phrased like that. That didn’t make it feel untrue.

In the hallway that afternoon, the elevator bell made a soft chime even though nobody pressed it. The doors opened on my floor. I stood in my doorway and watched. The car was empty. The air inside it smelled like the dentist’s tray after he opened the little packet of tools. The doors stayed open longer than they’re supposed to and then drifted shut, gentle as eyelids.

I got a message from the building chat that evening: the kid from 4B had a nosebleed that scared his mom and she took him to urgent care. He was okay. It was “just one of those things.” People posted hearts and “poor guy” and advice about humidifiers. I typed “get well soon” and sent it because not sending anything felt like saying nothing on purpose.

I boiled water in a pot for too long. The kitchen filled with steam and I didn’t turn the fan on because the fan noise makes me think of empty tunnels. I put the pliers in the boiling water and set them on a clean towel and didn’t touch them for a long time. When I finally sat on the closed toilet and opened my mouth in the mirror, my hands shook hard enough to make the reflection look like someone I didn’t want to see. I put the pliers down again.

Here’s the part people will judge me for because people love to judge the part where you choose to hurt yourself on purpose. I didn’t want to do it. I also didn’t want to be the only person in the building who knew about the hand in the drain and the little neat knot and the bowl that knocks once to be polite. I didn’t want to go to the boy’s mom and say something that would get me a nickname in the chat and a private email from the landlord. I sat there with my front tooth throbbing and made a decision that felt ugly and clean.

The molar they said was already cracked came easier than I thought once I committed. I’m not going to write a blow-by-blow. There’s no bravery in it. The pliers were hot from the water. I wrapped the handles in the towel and held fast and pulled the way they tell you not to in every story your grandparents ever told. Pain smacked my vision white for a second and then went grey and then settled into a deep ache. I rinsed with salt water and shook all over and laughed once in a way I didn’t like, and the laugh turned into a cough because my throat tasted like blood and mint even though I hadn’t put anything mint in my mouth.

I wrapped the tooth in tissue and put it in the bowl with the keys. I added the coin from the nightstand on top like a tip for a server you don’t want to offend. I wiped the rim of the bowl with the corner of the towel and felt crazy because who was I cleaning up for. And strange thing was, this felt so natural and normal and i still do not know why i did this, it was like i had instructions, but that wasn't the case.

I went to bed and lay on my side to keep the blood from pooling at the back of my throat. 

In the morning the bowl was empty. Not completely; the floss knot was still there, curled like a tiny white worm, laid across the bottom. The coin was gone. The tissue was gone. The keys were gone too, until I checked the hook by my door. Its there for the keys but i literaly never use it.  I found them there, the front-door key now tied with the same small neat knot, floss wrapped and trimmed like a craft project. The knot was tight enough that it seemed part of the key.

My jaw hurt but in a honest way—post-pain, not the worrying kind. The cut line in the gum looked cleaner than it had a right to look. The bathroom smelled like boiled metal and toothpaste. I opened the window and the smell left like it had been waiting by the latch.

The building chat said the boy’s bleeding had stopped. A photo followed: him with a band-aid under his nose, chewing on a popsicle, the caption saying “He’s fine! Thank you everyone.” People posted hearts. I typed nothing and closed the app. My tongue went automatically to the gap and then flinched away from it.

That evening, I put the keys in my pocket and told myself not to look for anything. Not in the lobby, not in the hall, not in the mirror in the elevator that makes you glance down the long reflected hallway behind you even if you know nothing is there. The elevator didn’t ring a wrong bell. The mint smell was gone. The stair rail had new marks lower down, at a kid’s height, tidy half-moons in a row.

On my windowsill there was a tiny chip of enamel. Not mine. Smoother, like it had been carried in a pocket a long time. It was shaped like the top of a key. I flicked it off the sill with my nail and it landed somewhere behind the radiator where a thousand other lost things live.

I kept going to work. I kept coming home. Nothing dramatic happened for a few days and then it started to slide back in the way it does. The elevator chimed a bell I still haven’t heard during the day. The bowl clicked on nights I forgot to put the keys in it. I started to lock my door even when I took out the trash. Normal precautions turned into habits, and I tried not to think about who the habits were for.

I saw the short figure once more, across the street near the bins, standing very still and looking into the glossy side of a black plastic bag like it was a mirror. The streetlight made a reflection I couldn’t quite parse. Head tilted, posture neat, hands together like a person waiting for a bus. I kept walking because what else do you do. When I got to the corner, someone behind me clicked their teeth, quick and tidy, the way you do when you’re lining up a thought. I didn’t turn around. You would have kept walking too.

A few practical notes, since that’s the only part of this that feels like it might be useful:

If you drop your keys and a stranger returns them with dental floss tied to the ring, get a new lock. Don’t take the keys if you can help it. If you already took them without thinking and your mouth starts to ache for no reason, go to a dentist and get something small taken out before something bigger is asked for. If you wake up with a coin under your pillow and you don’t live with anyone who would find that funny, don’t put the coin somewhere special. Coins are for circulation. Let it circulate away.

If a kid tells you their tooth fairy talks, don’t laugh it off. Don’t scare them. Just put their tooth in a drawer and tape over the bedroom vent for a few nights, and maybe leave a piece of enamel you can spare in a bowl by the door with the keys. You will feel stupid and you’ll sleep better. Paying something forward doesn’t have to be a good thing.

If you smell mint and metal where mint and metal shouldn’t be, check that your keys are where you left them. If they aren’t, don’t call down the vent. Don’t say thank you into a drain. Manners matter, but not always in the way you think.

I keep telling myself it’s over because nothing has happened this week beyond ordinary apartment noises. The floss knot is still tied on my front-door key, neat and flat, and sometimes I catch myself rubbing it with my thumb like it’s a worry bead. I’m not going to cut it off. It feels like cutting it would be a kind of rudeness I can’t afford.

On my way home tonight, a jogger passed me on the sidewalk with his mouth open in the way people do when they breathe through their teeth, and the click of it made me tense up without thinking. He kept going, normal and sweaty, and I stood there and counted to five in my head before moving again. On the stairs I let my hand hover over the rail and then caught myself doing it and put my palm down on the paint anyway, pressing hard. You can live in a place and still choose not to see the marks.

Nothing bad happened while I finished typing this. That feels important to say even if it means nothing. If anything changes, I’ll know it before anyone else does. That’s the other part people won’t say out loud: once you’ve owed and paid, it doesn’t leave you alone. It just lets you walk ahead for a while.

***-""And if someone behind me clicks their teeth again, I still won’t turn around. Not because I’m brave. Not because om scared...but because I already know the shape of that smile.""-***

",1,1755762797.0,creepypasta,0,1.0,False
1mw4of2,https://i.redd.it/fzizm1x2wbkf1.png,"Introducing CalorieDaddy, the no chill calorie tracker","AI that don't lie.

Get some honest feedback with CalorieDaddy.

(If you're easily offended perhaps this isn't the best app)

TestFlight available for 90 days for free, testers with genuine feedback will receive access post-launch.

Download now at [https://testflight.apple.com/join/TMA7XsPN](https://testflight.apple.com/join/TMA7XsPN)",1,1755762772.0,iosapps,1,1.0,False
