id,url,title,text,score,created_utc,subreddit,num_comments,upvote_ratio,over_18
1g8me20,https://www.reddit.com/r/Xenomorphseverywhere/comments/1g8me20/xenomorphs_everywhere_chapter_25_part_01/,Xenomorphs Everywhere Chapter 25 Part 01,"**Alien queen's hive**

The temperature in the Alien Queen's hive has risen dramatically during the night and morning and it is now 67 degrees in her hive and condensation is constantly dripping from the ceiling onto the Alien Queen's crowned head, but she is not bothered by the dripping, but by the high heat. The reason it has gotten so hot in the Alien queen's hive is because there has been a technical fault in the heating system so that the water in the facility continues to heat up even though it is already warm enough and the heat continues to rise.

The high heat in the Alien queen's hive affects the fluid in the egg sac in a negative way. Thousands of small bubbles form in the silky liquid in the egg sac and the bubbles rise to the surface and pop. Each time the bubbles pop, some of the silky liquid splashes out from the open part of the egg sac where Michael thrust his hands. Because there are over a thousand bubbles that rise to the surface, it pops and splashes non-stop. The reason why a lot of bubbles form in the liquid is because the liquid has almost reached its boiling point. Most liquids boil at 100 degrees, but the liquid in the Alien queen's egg sac begins to boil already at 70 degrees. The alien queen can feel lots of steam rising from the part of the egg sac that is attached to her body and she finds it uncomfortable as the steam rises right up her anus.

The alien queen's ovipositor is undulating strongly and there are five eggs per minute and it's really far too often but the production of the eggs has also increased since the previous day and the alien queen has had to eat from some metal sitting above her to get enough nutrition so that she can produce the eggs. Some of the metal above her is holding her heavy body so the Alien Queen didn't want to eat the metal at first but she was forced to. Several Alien warriors have also fed the Alien queen with various metals they have found in the tunnel.

The temperature in the Alien queen's hive continues to rise and finally it is 70 degrees in her hive and the liquid in the egg sac begins to boil. There are no longer any bubbles rising from the silky liquid but it is violently moving back and forth and it begins to pour out of the opening where Michael thrust his hands. The egg sac itself vibrates strongly from the boiling liquid and the hot steam shoots up into the Alien queen's anus. The fluid that is at the opening of the egg sac is very thick and it pours out of the egg sac like a thick cream and when enough liquid has formed on top of the egg sac, the law of gravity causes it to slowly flow down the outside of the egg sac. The thick fluid hangs from the outside of the egg sac as a thick slime and it looks like transparent and very slimy snot or colorless slime. Finally, the thick liquid lands on the ground with a loud plop.

The boiling liquid continues to pour out of the egg sac, but it has become more fluid and flows continuously along the outside of the egg sac. Several of the eggs in the egg sac that are close to the opening are pushed up from the egg sac but slide down into the silky fluid again but they are pushed up again and slide down again. None of the eggs get anywhere because it's boiling so hard in the egg sac and they just go up and down the opening while the boiling silky liquid continues to pour out of the opening non-stop. It gets very sticky on the ground under the egg sac and the silky liquid flows onto the ground and approaches the Alien queen.

The alien queen's ovipositor continuously squirts out eggs and several of the eggs are not even fully developed when they come out of the ovipositor and when they land on the ground they sink into a dark brown goo and the unfinished facehuggers die immediately. Some of the unfinished eggs start to flow as loose yolk and it looks like they are melting. It is as if the ovipositor has suffered from severe diarrhea but instead of faeces it spews out eggs and boiling liquid. At the beginning, when the eggs started to shoot out of the ovipositor, several of the eggs were already ready to be laid, but due to the high pressure that occurs when the liquid boils, many unfinished eggs manage to squeeze past the finished eggs because the unfinished eggs weigh less than the finished eggs and have a smaller circumference. The boiling causes several of the eggs to thump against each other as they move through the egg sac.

Because the ovipositor continuously ejects eggs, the eggs land on top of each other even though the Alien queen is constantly moving her ovipositor. There is such a large pile of eggs in several places that they cannot eject from the ovipositor and the ovipositor immediately begins to swell greatly and bulge to the sides in an abnormal way and the ovoid eggs push the already bulging ovipositor to the sides and it looks almost grotesque looking. The alien queen lifts her ovipositor as much as she can and some of the eggs land on top of other eggs, but it soon starts to bulge out to the sides again and swell strongly as it stops ejecting the eggs. The alien queen moves her ovipositor again and the first 6 eggs that have gathered at the bottom fit on top of each other, but then the ovipositor can eject the eggs and begins to swell strongly and bulge out. Because the eggs spray out without a break, the Alien warriors do not have time to move the eggs before the pile of eggs becomes too large.

The alien queen is upset and makes several high-pitched screams because the ovipositor hurts and the hot steam that shoots up her anus is so hot it burns. The alien queen's warriors approach their queen and seem to try to help her but they can't help her with this problem. The alien queen looks at the ovipositor, which continuously ejects eggs, and at the egg sac, where boiling liquid is constantly pouring out, and she makes an active choice and decides to detach herself from her egg sac. There is no other way to solve this problem. The alien queen's egg sac is stuck to her in two different places. Partly under the anus but also where the ribcage ends and it is easiest for her to detach herself at the anus and she starts to stand up. The alien queen has always squatted in her hive but she has very long legs that she can stand up on. The eggsac begins to detach from the anus and there is a stretching sound and it stings badly in the anus, but the hot steam feels worse than the sting that she feels. When the eggsac has detached from the anus, the Alien queen continues to rise slowly.

The egg sack stuck under the ribcage also begins to come loose and there are loud sticky and stretching sounds as it comes off and the Alien Queen hisses loudly because it hurts more than when she detached the egg sac from her anus. The alien queen is stubborn and continues to rise and finally this part of the egg sac detaches from her body and she is free. The boiling liquid and masses of eggs spill out from the two parts of the egg sac and begin to fill the ground around the Alien queen. Even though the Alien Queen has been squatting when she has been in her hive, she still has very strong legs. The alien queen is careless when she rises and suddenly she hits her crowned head on the ceiling of the space because she has risen so high. The Alien Queen lowers her legs and begins to move forward into the space and she makes a sound that causes all the Alien warriors to follow her. The alien queen leaves her hive and comes out into the tunnel and she's never been here before so she doesn't know where to go.

The alien queen chooses to follow Michael's scent trail and she keeps moving forward as she approaches the exit of the tunnel. The Alien Queen can feel how fresh air moves through the tunnel and she becomes curious about the exciting world she is on her way to.,When the Alien Queen has come out onto the road outside the tunnel, she is almost hit by a motorist and she angrily pushes away the car and makes a loud screeching sound

**Slussen**

Hulda is on her way to the grocery store in Slussen and she has intended to buy their delicious honeydew melon. The honeydew melon that Hulda is going to buy is only sold by the grocery store. Hulda is 45 years old and nine months pregnant, and she feels that she cannot do without this honeydew melon.

Hulda has been pregnant once before, but that pregnancy was very different from this one. It was barely visible on Hulda's belly when she was pregnant the first time, but this time she has a really big belly to brag about. No one who sees Hulda can avoid seeing her huge protruding belly and she likes the attention she gets. People that Hulda meets like to stop and talk to her and they ask about her pregnancy and wish her luck. Hulda also blogs every day about her pregnancy and many people read her blog. Hulda can feel the baby moving in her stomach as she approaches the store and she smiles at feeling the baby's movements.

Hulda goes into the store and buys two large honeydew melons that are already split and pays at the register and leaves the store. Hulda has decided to visit Skansen because she likes the nice zoo. There aren't that many people moving in Slussen today even though it's Saturday. Hulda feels that she has to go to the bathroom again. That's one of the downsides of being pregnant. Hulda enters the ladies' toilet and finds an empty toilet stall. There is something large and dark brown in the booth and the top of the object resembles the opening of an ass. There are also four leaf like things around the opening. The object is next to the toilet itself, so Hulda can still fit in the toilet stall and she sits on the toilet. Hulda can see that the top of the object looks very slimy and she looks the other way.

Hulda suddenly hears an intimate and sticky sound and she turns her head and looks at the object and she sees the four leaf like things open up and wrap around the object itself and Hulda begins to think that the object looks like a large egg. Hulda can look down into the object where she is sitting on the toilet seat and she can see something light moving further down the object and she is at first curious as to what it is but then she becomes worried. Perhaps what moves further down the object is dangerous. There is a lot of clear slime in the object and it is a bit like lubricant but doesn't seem to have any particular scent.

The facehugger explodes out of the egg and Hulda doesn't have time to react but she sees a smaller beast with eight finger-like legs jump towards her face. The facehugger lands on Hulda's face and a chemical reaction occurs when the inside of the facehugger meets Hulda's skin and she becomes unconscious, and because the facehugger is so heavy, Hulda's head bends backwards and lies above the toilet flush button.

The facehugger thrusts its long and elastic proboscis through Hulda's mouth and it moves down towards her throat. The proboscis penetrates down through the throat and when it has penetrated far enough, it stops and begins to swell while continuously giving Hulda oxygen. When the proboscis has swollen to double its thickness, hundreds of small black eggs begin to shoot out from it and the eggs move down towards the chest region. The proboscis continues to eject its eggs for about two minutes and when they are finished the proboscis becomes limp and regains its normal thickness and it is drawn into the body of the facehugger and soon only the opening of the proboscis is visible. The facehugger detaches from Hulda's face and crawls behind the toilet and lies there. Hulda wakes up after a few minutes and she gets up and flushes and leaves the toilet. Hulda doesn't even turn around and look at the egg.

Hulda leaves Slussen and approaches Skeppsholmen and she finds an empty seat by the benches and picks up one of the split melons and she also takes out a bigger spoon that she has in her backpack and then she starts to eat the melon and it is so good and she enjoys the good taste. Hulda wonders if her expecting child will also like this melon when its adult enough to taste it. In the meantime, a Chestburster begins to grow in Hulda's chest and it absorbs the nutrition that the unborn child would have received and thus grows faster. So far, Hulda can't feel the extra weight that comes when the Chestburster grows bigger.

**Nybrokajen**

The water glistens in the sunlight and 38-year-old Douglas approaches his boat. It is a fairly large boat and it is possible to both sleep in it and cook, but Douglas only intends to be out with the boat for a few hours. Since it's Saturday and Douglas is off from his job and won't be working until Monday, he can sleep over in the boat if he wants, but today he feels like he just wants to be out at sea for a few hours.

It's full of boats at the big dock but Douglas has parked close to his boat and he could already see it from the car window. As Douglas gets closer to the boat, he sees something large and dark brown in his boat and at first he thinks it looks like a giant poo, but when he gets even closer, he thinks it looks more like a big egg. Douglas looks at the big egg and wonders what it's doing in his boat. The egg is on the boat's deck just in front of the stairs that go down to the boat's cabin. The cabin consists of a spacious kitchen and bedroom and a smaller toilet. There is a large table in the kitchen for Douglas to sit at and he even has a small TV hanging on one of the walls. Douglas looks at the boat next to his but there is no egg there and not in the next boat either and Douglas thinks that someone must have wanted to play a joke on him.

Douglas steps aboard the foredeck and loosens the fenders and everything else that holds the boat in place at the dock and soon the boat is ready to leave the dock and drive out to sea. Douglas can see the blue water of Riddarfjärden and that is where he is going and he goes down to the deck and looks at the egg and thinks about what to do with it. The egg looks heavy and Douglas can see that it has four leaf like things around an opening that looks most like an ass. Douglas has a dirty imagination and immediately sees some sexual overtones on this egg and thinks that the person who created it likes sex and especially body openings. Douglas thinks he might be able to lift the egg and place it on the edge of the dock and he bends over the egg and crouches at the same time and this makes it easier for him to lift the heavy object.

Douglas hears a sticky sound and sees the four leaf like things around the opening of the egg open up like a big flower and they settle around the sides of the egg. Douglas looks down into the egg and sees that it contains lots of clear mucus and it looks like thick string. But Douglas can also see something bright in the middle of the egg and whatever it is, it moves and Douglas immediately becomes alert and starts backing away from the egg. Douglas no longer believes that it is someone who wanted to play a joke on him, but this is something else and he is not sure if it is dangerous or not. Too many strange things have been happening lately and it's worried Douglas. Sweden is no longer as safe as it once was.

The facehugger jumps up from the egg in a big explosion and it splatters transparent slime everywhere. Douglas watches as the facehugger approaches his face and it moves significantly faster than he does and he realizes that it will land on his face. Time seems to pass both quickly and slowly and Douglas feels that he should get away from this beast but his feet are moving far too slowly. The facehugger lands in Douglas's face but it ends up slanted and the inside of it therefore does not meet Douglas' skin.

The facehugger thrusts its long proboscis through Douglas's mouth and since he is still conscious he can feel the slimy and slippery proboscis moving forward in his mouth and he feels raped. Douglas tries to bite the facehuggers proboscis, but because it is so slippery and slimy, Douglas's teeth can't get a good grip on it. Douglas grabs the facehuggers tail and tries to pull the beast away from his face but he soon notices that the strong tail is starting to strangle him so he lets go. The facehuggers proboscis has begun to penetrate through Douglas's throat and he panics as he can no longer breathe through his mouth, but he notices a few seconds later that the beast is giving him oxygen through its proboscis. The facehuggers proboscis penetrates deeper and deeper into Douglas's throat and he is so disgusted by what is happening that he almost starts to vomit. The proboscis stops but Douglas can feel it start to swell and vibrate and it teases his gag reflex. The proboscis begins to shoot out hundreds of small black eggs and Douglas can't actually feel the eggs themselves but he can feel them shoot out through the proboscis because the eggs are felt through the proboscis and it moves in a wavy motion as the eggs shoot out through it.

Douglas thinks this is terrible. Douglas has a dirty imagination and has both seen and been part of some disgusting things, but this is the very worst thing he has been part of. Douglas tries once more to bite the facehuggers proboscis and this time his teeth get a grip on the slippery and slimy proboscis and the slime seeps into his gums but Douglas sinks his teeth into the billowing proboscis.

The facehugger feels what Douglas is doing and it pushes its body harder against Douglas' face and now the inside of the facehugger meets Douglas' skin and a chemical reaction occurs which causes Douglas to lose consciousness and fall onto the deck. When the facehugger landed on Douglas's face, he was standing very close to the boat's railing, but in the meantime Douglas has moved so that he is standing by the door that leads down to the cabin where he can sleep and cook. If Douglas had remained at the railing when he lost consciousness, he could have fallen overboard and ended up in the water, but now he lands on the first step that leads down to the cabin. The facehuggers proboscis continues to eject the black eggs, but after a minute and a half they run out and the facehuggers proboscis becomes narrow as it usually is. The facehugger pulls its proboscis back into its body and detaches itself from Douglas's face. The facehugger crawls around on the deck, looking for a place to die.

Douglas wakes up after a few minutes and he immediately starts to fight with his arms but he very quickly notices that the beast has come loose from his face and that he is lying down. Douglas turns his head and can see down into the cabin that is just behind him and he thinks that it was lucky that his body didn't tumble down the stairs. Douglas can't see the little beast anywhere in the cabin and he's relieved. Douglas moves his tongue and feels the slime from the facehuggers proboscis moving between his teeth and he immediately feels nauseous and hurries to sit up. The sickness gets worse and Douglas gets up quickly and stands in front of the railing and vomits in the water. Douglas hopes that what he felt being spewed down his throat comes with the vomit and when he has finished vomiting, he stands leaning over the railing for a good while and just breathes.

Douglas hears a scratching sound behind him and he turns to see the facehugger still crawling around on the floor and Douglas quickly walks over to the little beast and grabs its long tail firmly and lifts the little beast up so that it hangs a bit above the ground. Douglas sees the facehuggers proboscis hanging out of its body like a penis and he first intends to push his finger through the proboscis so that the beast can feel what it's like to be orally raped, but Douglas changes his mind and throws the little beast into the water instead. The facehugger cannot swim and it soon drowns. Douglas looks at the large egg and walks over to it and begins to lift it. The egg is not that heavy but some of the slime sloshes onto the deck and it becomes slippery so Douglas has to walk carefully. Douglas throws the egg into the water and it sinks very quickly and disappears from view.

Douglas considers if he should contact the Emergency services and have them examine him considering he felt something unknown being shot down his throat and it would make perfect sense to do so but Douglas decides not to and instead goes out with his Boat. Douglas starts the boat's engine and it starts with a roar on the first try and Douglas steers his boat off the dock and out into the sparkling sea. When the boat has left the dock a bit and no longer needs to be steered as much, Douglas feels that he is very hungry and he opens his rucksack and takes out two sandwiches with liver pate and his old steel thermos, which today contains hot chocolate. Douglas fills the thermos cup with the hot chocolate and eats the first sandwich and the sour taste from the vomit disappears but also the remaining mucus that is between the teeth. Douglas carefully turns the rudder so the boat is on a straight course ahead and then he eats the second sandwich and refills the cup with more hot chocolate. The air is already 25 degrees and Douglas guesses that it will get hotter during the day and he thinks about whether he shouldn't go a little further after all and maybe sleep in the boat. It's such a nice day for a boat trip.

**Lars Café (near Essingen)**

Michael has finished his tea and Sven has finished his coffee but he goes and fills his mug with more coffee and after a few seconds Michael goes and fills his mug with more tea. Michael is in no hurry to go home.

Krister could not say whether Michael would still have a curfew or not. He said he would think about it. If Krister finds out that it was Michael who placed all the eggs in the Kungsträdgården and the Karolinska hospital, he will guarantee that Michael does not leave the accommodation when he comes home. Michael thinks punishment is very silly.

Michael sits and thinks about the question about whether he felt power when he placed the eggs and he is becoming more and more sure of his answer, but he is unsure if he dares to admit this to Sven. Michael looks at Sven with a serious expression.

- Sven, can you keep a secret? You know, something that only you and I know about?

- Sure, no problem. What is it about?

- Do you promise not to get angry?

- It depends on what you have to say, but you know that I usually have a hard time getting angry.

- This question you asked about whether I felt power when I placed the eggs.

- Yes.

- Well, I felt absolute power yesterday when I placed all the eggs. It was like my whole body was vibrating with lust and power and I couldn't wait for the people to be attacked by the facehuggers. I didn't see when all 42 people were attacked but I saw when several of them were. I also saw when the three animals were each attacked by a facehugger. This girl that I made sure she came home, her father was. uh, I don't know if I should say this.

- It's okay, you can tell me.

- The father of the child belonged to one of the bullies at school and I tricked him into one of the eggs and made sure he was attacked by a facehugger but I didn't know he had started a family and had a child with him but the child wasn't around then this happened. I think she was with a friend at the time. She never found out what happened to her father. He went into a toilet before the Chestburster was born from his chest but I was standing outside and heard when it was born. It was cool watching all the facehuggers jump up at people's faces and then seeing all the chestbursters being borned but when I got home I just felt..empty.

- I understand. This feeling of emptiness is a psychological reaction when the body is no longer rewarded with stimuli from the power that you felt. It is very common to feel that way. How do you feel now? Would you like to place more eggs, for example outside this cafe?

- No, I don't want to do that. I'm probably feeling as usual, but at the same time I'm excited that you're going to meet the Alien Queen for the first time. It will be so exciting. I know she won't hurt you so it's not about that but you finally getting to meet her.

- That sounds good. You probably realized that you didn't make a good choice when you placed all the eggs the previous day.

- You're probably right. I saw several Alien warriors coming out of the tunnel and they had many eggs with them and I followed them to see where they placed the eggs but this was after I had placed all the eggs in Kungsträdgården.

- Where did the Alien warriors place the eggs?

- On Sveavägen.

- Did you see someone on Sveavägen who was attacked by a facehugger?

- I saw someone who was standing at an ATM being attacked, but I had the child in the wooden cart at the time and cycled through the tunnel after the Alien warriors went back in there.

- You went with them in the tunnel?

- Yes, and then I greeted the Alien queen one last time and you called.

- I think I understand.

Suddenly, several loud screams of terror are heard outside the cafe and Michael turns to the window and looks out to see lots of people running around in panic, pointing at something coming from the left. Michael can't see what the people are pointing at, but he can see that they are hurriedly moving away from the cafe. Several people who are further away also move away from the cafe. A few seconds later, Michael sees the reason for the people's panic. Seven Alien warriors come walking from the left but they are not carrying any eggs and Michael thinks it is strange.

The seven Alien warriors pass right outside the cafe and Michael sees a movement just behind them and thinks there are more Alien warriors, but a few seconds later he sees that it is not. The Alien Queen comes walking right after the seven Alien warriors and Michael can see that parts of her egg sac are hanging under her tail and on the front of her body and he realizes that she must have detached herself from her egg sac for some reason. The alien queen's dark body glistens with moisture and water regularly drips from her crowned head. Michael sits and looks at the Alien queen for a few seconds, but then he quickly stands up.

- Sven, we go down to her. Hurry before she has passed.

- Is that the Alien Queen? What is she doing here?

- It´s her. I have no idea why she's here. We must hurry before she has left.

Sven also gets up and both he and Michel go down the stairs and leave the cafe and they hurry out through the exit. The alien queen has quite a high speed as she moves forward.

",1,1729506414.0,Xenomorphseverywhere,0,1.0,False
