id,url,title,text,score,created_utc,subreddit,num_comments,upvote_ratio,over_18
1n9cm3h,https://www.reddit.com/gallery/1n9cm3h,The Latest with Bargaining,"In 2024, Starbucks workers at hundreds of union stores joined Starbucks at the bargaining table to make progress on our union contracts. But right as we neared the finish line, CEO Brian Nicol took over, the company backtracked on our path forward, and negotiations fell apart. Over 12,000 union baristas are strong, united, and ready for our contracts. It's your move, Starbucks.

ALLIES: Tell Starbucks that you will not cross a picket line! Help workers send a big message to the company by signing the No Contract No Coffee pledge (link below)
https://starbucksworkersunited.controlshift.app/petitions/no-contract-no-coffee-pledge-to-act-in-solidarity-with-starbucks-workers-united",1,1757095892.0,UnionizeStarbucks,0,1.0,False
1n9cku6,https://www.reddit.com/r/blackmen/comments/1n9cku6/black_owned_coffee_beans/,Black Owned Coffee Beans,"Men - 

Any coffee drinkers in the group? Came across a black-owned toilet paper company last night called Leafy Products. Made me realize I hadn't considered black owned coffee companies. Let me put a stop to that expeditiously!

Anyone have some recommendations? Would be nice if they were west coast based but any recommendations appreciated, brothers. 

FYI I did google and of course found some. But still want your recommendations because I think we don't get enough talk in here about actually supporting black businesses. Good to reignite this convo as a reminder as much as possible. Things like coffee, house supplies, etc. that you buy on a repeat basis are all things we should be committed to buying permanently from black **only**!!",1,1757095815.0,blackmen,0,1.0,False
1n9cjld,https://www.reddit.com/r/espresso/comments/1n9cjld/total_newbie_with_delonghi_stilosa_so_many/,Total Newbie With De'Longhi Stilosa: So Many Questions!,"I have never owned an espresso machine before, but just took the plunge and ordered a De'Longhi Stilosa Manual Espresso Machine.

I’ve watched the YouTube video by Lance Hedrick, and he talks about some things to potentially upgrade to improve the quality of the espresso the machine can put out… but the problem is I can’t figure it out.

Question #1) He talks about replacing the basket with “a more traditional IMS basket”.  My understanding is upgrading the basket is maybe the top thing that I can upgrade to improve the quality of the espresso this machine can make.  The problem is when I looked on Amazon there were multiple options and since I know literally nothing about espresso I have no idea which one to pick.  **Can anybody steer me towards the correct one that would be compatible with the De'Longhi Stilosa?**

Question #2) In the video, he discusses the fact that this machine comes with pressurized baskets and how to remove the plastic gizmos on there.  Is that the same part he’s talking about upgrading with that IMS basket?  Would I still need to do that if I got a different, aftermarket basket?

Question #3) He also talks about putting a “puck screen” on top of the coffee before you brew it.  How much difference would that make to the final product?  Is that an upgrade you’d suggest is essential to getting decent espresso from this machine, or more f a ‘nice to have’ sort of thing?

Question #4) Can anybody recommend any additional resources for getting started with a basic espresso machine?  Like, stuff for a complete beginner?

Thank you so much!!  ",1,1757095732.0,espresso,0,1.0,False
1n9cjkr,https://www.reddit.com/r/classifiedsph/comments/1n9cjkr/offering_companion_errand_service_hire_me/,Offering Companion / Errand Service] Hire me!,"Hello! 👋 I’m currently looking for some extra funds to help with my expenses. I’d be more than happy if you could hire me for any tasks, errands, or companion needs. Thank you in advance for considering me! 💖

I am offering:
	•	Companion service (dinners, coffee shops, malls, study buddy, etc.)
	•	+1 for your events (e.g. parties, gatherings, meetings)
	•	Running errands (paying bills, lining up for services, meeting people on your behalf)
	•	General companion for almost anything!

About me:
	•	Female
	•	26 years old
	•	Petite
	•	Friendly and easy to talk to
	•	Good communicator
	•	Not shy, talkative, and approachable ✨",1,1757095731.0,classifiedsph,1,1.0,False
1n9ci2t,https://www.reddit.com/r/LGBTindia/comments/1n9ci2t/why_is_being_queer_like_shutter_island/,Why is being queer like shutter island?,"My colleague and i have work in close proximity (separated by a cubicle). She has been here since an year, but we used to randomly chat just once or twice a week, just general conversation. 

I slowly realised that she would put in a flirt or 2 mid conversations. I just thought it's a joke, so i would tease-insult her too, but still all small talks. 

Then, a few months ago, one night, she flirted with me quite explicitly on text. I kept it jokey-teasing with no flirty replies, but she kept flirting. And then onwards, I also started talking to her everyday. We have coffee every evening together almost as a ritual. And all our conversations are loaded with flirts and double innuendos, and we remember the most trivial and silliest things from the conversations we have had. 

We keep talking to each other in hushed tones, sharing smiles, flirting. We go for movies alone, her friends or my friends aren't invited to our plans. 

I have come out to her, but I have also pulled away completely for a month, when I realised that I am may leave this completely heartbroken if this is all just a joke for her. She also pulls back quite a lot every now and then. She has mentioned a few too many times to me in jokes that she likes men. She also keeps bringing up each of our weddings for some reason, where the other would be invited as a guest. It's a running flirt-joke-insult.

Usually we layer our flirts in a sandwich of insults, and the sandwich wrapped in plausible deniability. 

And all this feels exactly like when Leonardo dicaprio finds out the truth in Shutter Island. I keep asking myself:

Do I awaken myself to reality, by making my stance explicit that may lead to rejection? 

Or do I keep enjoying the delusion, never knowing if it is real?",2,1757095635.0,LGBTindia,0,1.0,False
