id,url,title,text,score,created_utc,subreddit,num_comments,upvote_ratio,over_18
1h1nhlw,https://www.reddit.com/r/ArticulateOffers/comments/1h1nhlw/community_coffee_black_friday_2024/,Community Coffee Black Friday 2024,"Visit this page for [**Community Coffee Black Friday 2024**](https://bit.ly/3nGbSZ7). The website offers a wide selection of coupons, promo codes, and discount deals that are updated regularly, just visit the website to find the perfect one for you.",1,1732766946.0,ArticulateOffers,0,1.0,False
1h1ngt2,https://www.reddit.com/r/bonnaroo/comments/1h1ngt2/roo_family_i_need_your_help/,Roo family I need your help ,"Hi family, I’ve posted everywhere else with no luck and I’m running out of time. 
My electricity is going to be cut off in the morning over $88, I have the rest of it. But they aren’t willing to work with me. I’ve pawned everything I had left, sold my coffee table, etc. I’m having medical issues and not able to work now. 

I have a 4 year old and he is so excited for Thanksgiving, he’s talked about it all week. He’s more excited about it than Christmas. I’m terrified if I can’t find the $88 by the morning we will have no power, no food. He’s been through so much this year and I just want this day to be special for him. Does anyone know where I could get help with my electric? I’ve tried churches, cac, etc no luck. They are either out of funds or they can’t get it paid in time for it to get cut off. 

If not, is there any Roo family in Tennessee that would love two people at their thanksgiving, like if anyone is a Friendsgiving? Or I have a fridge full of food that’s going to go bad if someone would like to cook it or have it and just give my son a plate? Or any local things that are having thanksgiving that I can take him to? 
He’s just been so excited and our lives have changed a lot since I got sick. I want this day to be good for him. 

Any suggestions welcome, please don’t judge me! 

Happy Thanksgiving Roo Family 🩵✌🏽",2,1732766865.0,bonnaroo,0,1.0,False
1h1ngmg,https://www.reddit.com/r/Batangas/comments/1h1ngmg/specialty_coffee_shops_in_and_around_calatagan/,Specialty coffee shops in and around Calatagan,Best if they sell beans.,1,1732766848.0,Batangas,0,1.0,False
1h1ng3c,https://www.reddit.com/gallery/1h1ng3c,Lexus GS 400 I saw at a cars & coffee awhile back.,,0,1732766796.0,carspotting,0,0.5,False
1h1nfsb,https://www.reddit.com/r/productivity/comments/1h1nfsb/how_do_you_stay_awake_without_caffeine/,How Do You Stay Awake Without Caffeine?,"I’ve been trying to cut out coffee (especially with milk) because it’s been causing acne breakouts, but staying awake and focused without caffeine has been a real challenge.

What are your best tips for staying energized naturally? I’ve heard about hydration, exercise, and even essential oils, but I’d love to hear what actually works for others. Any advice is appreciated!",0,1732766766.0,productivity,3,0.5,False
1h1nf4t,https://www.reddit.com/r/Advice/comments/1h1nf4t/the_one_that_got_away_reaches_out_to_me_10_years/,"The ""one that got away"" reaches out to me 10 years after our break up and three years into her marriage for closure. Is this normal? Why now?
","The ""one that got away"" reaches out to me 10 years after our break up and three years into her marriage for closure. Is this normal? Why now?

""The one that got away"" began following me a few months back. We broke up 10 years ago shes been married for 3 years now and with that person for almost 9 years. She met him a year or 2 after me so theyve been together a while.

I was young immature and unsure in the world I believe you have to be happy with yourself before youre happy with someone else.

I walked away away to do what I thought was right by both of us at the time. I always wondered if I made the right decision. I dont know if I wouldve grown up if she was there with me. Maybe id be a better man maybe id still be that frustrated insecure kid unsure of everything. It was real though. Im in a better place. Two college degrees etc. We met in high school and dated for years it wasnt the most healthy relationship all the time. Nothing physical but just angry young dumb kid stuff but we were in love.

She started liking my stuff a lot lately and she reached out to me the other day via reply to IG story (I kinda thought she would at some point) and how she was happy to see me doing so well etc. Im a comedian and things have been decent lately. She said she had been talkikg to her friends about messaging me for a month now.

Long story short we text for a day straight. 

We met up (her suggestion) and I apologized for the past etc. Her reason was to get closure which idk I found incredibly odd. Youve been married for years but needed to reach out now? Her husband doesnt know yet she lied to him about where she was going but I she think may tell him in a few weeks? She hasnt decided. We didnt get physical etc like that just walked and talked for two hours.

She asked why I never reached out if I wanted to chat like I claimed and I said she was married and was going to respect her happiness. My sister told me to lay all the cards on the table so I told her how I still felt and was in love and never stopped because I realized this may be the only chance to see her.

 Now I know a lot of you will say in love with the past etc but I'm not I often think of her and my screw ups and always feel like im trying to dig myself out of the hole the younger man did.

She said shes happily married and I said I understand and respect that.
She said she felt bad and I said don't I get it that ships sailed I said I understand I get it. She said at some point shes going to start a family with this person and I told her not to. Not him anways but she assured me out time was done and I said I udnerstood. I think she was taken back by my calm demeanor of accepting her wishes. She said we cant talk anymore or carry any sort of relationship and again I said I understood lol (despite her reaching out to me). Shes still going to follow me on socials etc and I her (I blocked her content so I cant actually see her stuff but sometimes curiosity gets the best of me and I look)

My question for everyone is do you consider this emotional cheating on her part? She may or may not tell her husband down the line. We talked and walked for close to two hours.

And do you believe in closure?

 I personally don't but especially after 10 years no contact. Ive been on her mind and come and go on it but she says it sometimes impacts her relationship to her husband. She named a few random things. Even sex being one of them (I told her she could stop right there I didnt wanna hear that one lol) So again just wondering what peoples thoughts are?

Ill be honest I'm really hoping she messages me but won't hold my breath but again my mind cant help but wonder why now? Especially after so long and three years of marriage to hit me up and do this now? It just feels...so odd and to keep it from her husband just makes me wonder if theres feelings there or not on her part?

I just cant help but think this doesnt feel normal after so long and how great she says her life is (shes doing well for herself) but then why contact me?

I feel like Im gaslighting myself convincing myself this is normal that maybe she needed this healing to het things off her chest and I for her but then the more I think about it. Its been 10 years? Why randomly start this now?

Thoughts would be appreciated!

Update:
 She messaged me this morning saying I know I told you not to reach out but just wanted to say thank you for meeting up with me and how it mustve disrupted my life and that she wanted to leave on better terms and not with me sad or bummed out as I appeared and she was sorry and to take care.

I told her I was okay but thank you and to take care of herself. 

I didnt wanna come off as rude idk if I did but just wanted to keep it short.

Day after that she responds to my story saying she felt bad how we left things and if I was okay I told her I was fine again. She said was nervous seeing me and felt like she blacked out during us meeting and was nervous to see me and felt like neither of us got to get everything off our chest. She said she didnt get to say the things she wanted and just forgot out of nerves. She agreed we had a real love and that she just had the itch to see how I was doing but shouldn't have.

I told her its fine but to do me a favor and not contact me unless she was going through a divorce or seperated. Maybe we can grab a coffee and talk about it but always said I wasnt waiting around and that I was excited to find my person whenever fate allowed it. Someone who deserves and loves me. She said I hope that Id find them and that being loved by someone who makes you happy is a great feeling (like I dont know what love is?) Lol but I just let it go. She said no matter how good her life is or how happy her marriage is that we had good times and she has accepted that Ill come in her mind from time to time because we got to live life together for a time too. We wished me good luck.


Sorry for the novel. I guess I just wanted to get peoples thoughts on it? Is this normal? Like Id like opinions of both sexs honestly?


Im also curious what does this say about the foundation of her marriage with him? Is this a bad sign? She mentioned theyve talked about starting a family together Im just curious as she keeps saying her marriage is so happy (shes got a good poker face so I cant tell lol) but if so happy why even have an inch?

Just frustrated and confused and any and all opinions would be appreciated.

",1,1732766706.0,Advice,0,1.0,False
1h1nf0h,https://www.reddit.com/r/bjj/comments/1h1nf0h/caffeine_on_day_of_comp/,Caffeine on day of comp?,"I cannot find any past threads on this topic. I usually have caffeine every morning and not really anything before 6pm class except maybe a tea two hours before. 

And before a morning class I may have a coffee an hour before but obviously minus all the nerves I’d have with a competition. 

I just don’t want to throw off my whole routine and not consume caffeine on the day of my comp but I also don’t want my heart to explode lol. Do you think a small coffee would be ok? Or do you think one day without caffeine won’t affect me as in the past I have dealt with headaches from caffeine withdrawal. 

What do you guys normally do?",1,1732766694.0,bjj,2,1.0,False
1h1nes5,https://www.reddit.com/r/MyrtleBeach/comments/1h1nes5/tanger_outlets_myrtle/,Tanger outlets myrtle,"Info was scarce when I looked.

Two tanger outlets in Myrtle.

Tanger hyw 17. This one is nicer and more high end and more deals More stores and more stuff. Downside. Terrible navigation getting around,whoever did the maps set them up in the most confusing way. Parking sucks. This is located in Northern part of Myrtle. Very confusing last mile to get there. Weird loop.

Tanger 501. 80 stores compared to 100. Located on South West part of myrtle. Stores and setup not as nice. Certainly not run down but hwy 17 seems more upscale. Parking good. Navigation on point easy to get around and not as frustrating as hwy 17. It says ""eateries"" but mister coffee is best spot here.



",1,1732766670.0,MyrtleBeach,0,1.0,False
1h1ne0l,https://www.reddit.com/r/TrueChristian/comments/1h1ne0l/im_done_playing_pretend/,I'm done playing pretend.,"I've had enough. No matter how much other people prayed, no matter how much I prayed, nothing ever changed. No matter what I prayed for, nothing ever changed. I prayed to see, I tried to see, but I can't. He isn't there and I'm done pretending that the new coffee machine I got on tuesday from Helen is a gift from God because it made my day better and I get to be thankful. I'm done pretending that Christians don't bend the bible in a thousand different ways to match the modern world and understanding of things. I'm done pretending that 'It's more likely and rational that God exists' when It's objectively not, but simply a matter of perspective. I'm done pretending that there's 'heaps of evidence' when It's the absolute bare-bones against the hundreds more rational arguments against Christianity. I'm sick and tired of this lie that is for my comfort and well-being. I didn't ask for a lie, but the truth. I'm done pretending like life has any value when it doesn't and I have the freedom to take my leave from this Earth without consequences, because I never wanted to exist in the first place. No matter how much I cried, he didn't show up. No matter what I did he didn't do anything. No matter the tears I cried, the times I cut myself, the times I tried to take my life, the times I have been wronged and suffered. There hasn't been an ounce of this infinite 'love' for me to feel. I suppose we are all the wicked generation and the wicked generation shall recieve no sign, but the sign of Jonah. I promise you there isn't a thing or verse you write here that I haven't read or tried to do. I'm done. I prayed for everything, forgiveness the most, yet none of my prayers were answered.",0,1732766597.0,TrueChristian,0,0.33,False
1h1ndht,https://www.reddit.com/r/LifeAdvice/comments/1h1ndht/the_one_that_got_away_reaches_out_to_me_10_years/,"The ""one that got away"" reaches out to me 10 years after our break up and three years into her marriage for ""closure."" Is this normal? Why now? What's exactly going through her mind?
","""The one that got away"" began following me a few months back. We broke up 10 years ago shes been married for 3 years now and with that person for almost 9 years. She met him a year or 2 after me so theyve been together a while.

I was young immature and unsure in the world I believe you have to be happy with yourself before youre happy with someone else.

I walked away away to do what I thought was right by both of us at the time. I always wondered if I made the right decision. I dont know if I wouldve grown up if she was there with me. Maybe id be a better man maybe id still be that frustrated insecure kid unsure of everything. It was real though. Im in a better place. Two college degrees etc. We met in high school and dated for years it wasnt the most healthy relationship all the time. Nothing physical but just angry young dumb kid stuff but we were in love.

She started liking my stuff a lot lately and she reached out to me the other day via reply to IG story (I kinda thought she would at some point) and how she was happy to see me doing so well etc. Im a comedian and things have been decent lately. She said she had been talkikg to her friends about messaging me for a month now.

Long story short we text for a day straight. 

We met up (her suggestion) and I apologized for the past etc. Her reason was to get closure which idk I found incredibly odd. Youve been married for years but needed to reach out now? Her husband doesnt know yet she lied to him about where she was going but I she think may tell him in a few weeks? She hasnt decided. We didnt get physical etc like that just walked and talked for two hours.

She asked why I never reached out if I wanted to chat like I claimed and I said she was married and was going to respect her happiness. My sister told me to lay all the cards on the table so I told her how I still felt and was in love and never stopped because I realized this may be the only chance to see her.

 Now I know a lot of you will say in love with the past etc but I'm not I often think of her and my screw ups and always feel like im trying to dig myself out of the hole the younger man did.

She said shes happily married and I said I understand and respect that.
She said she felt bad and I said don't I get it that ships sailed I said I understand I get it. She said at some point shes going to start a family with this person and I told her not to. Not him anways but she assured me out time was done and I said I udnerstood. I think she was taken back by my calm demeanor of accepting her wishes. She said we cant talk anymore or carry any sort of relationship and again I said I understood lol (despite her reaching out to me). Shes still going to follow me on socials etc and I her (I blocked her content so I cant actually see her stuff but sometimes curiosity gets the best of me and I look)

My question for everyone is do you consider this emotional cheating on her part? She may or may not tell her husband down the line. We talked and walked for close to two hours.

And do you believe in closure?

 I personally don't but especially after 10 years no contact. Ive been on her mind and come and go on it but she says it sometimes impacts her relationship to her husband. She named a few random things. Even sex being one of them (I told her she could stop right there I didnt wanna hear that one lol) So again just wondering what peoples thoughts are?

Ill be honest I'm really hoping she messages me but won't hold my breath but again my mind cant help but wonder why now? Especially after so long and three years of marriage to hit me up and do this now? It just feels...so odd and to keep it from her husband just makes me wonder if theres feelings there or not on her part?

I just cant help but think this doesnt feel normal after so long and how great she says her life is (shes doing well for herself) but then why contact me?

I feel like Im gaslighting myself convincing myself this is normal that maybe she needed this healing to het things off her chest and I for her but then the more I think about it. Its been 10 years? Why randomly start this now?

Thoughts would be appreciated!

Update:
 She messaged me this morning saying I know I told you not to reach out but just wanted to say thank you for meeting up with me and how it mustve disrupted my life and that she wanted to leave on better terms and not with me sad or bummed out as I appeared and she was sorry and to take care.

I told her I was okay but thank you and to take care of herself. 

I didnt wanna come off as rude idk if I did but just wanted to keep it short.

Day after that she responds to my story saying she felt bad how we left things and if I was okay I told her I was fine again. She said was nervous seeing me and felt like she blacked out during us meeting and was nervous to see me and felt like neither of us got to get everything off our chest. She said she didnt get to say the things she wanted and just forgot out of nerves. She agreed we had a real love and that she just had the itch to see how I was doing but shouldn't have.

I told her its fine but to do me a favor and not contact me unless she was going through a divorce or seperated. Maybe we can grab a coffee and talk about it but always said I wasnt waiting around and that I was excited to find my person whenever fate allowed it. Someone who deserves and loves me. She said I hope that Id find them and that being loved by someone who makes you happy is a great feeling (like I dont know what love is?) Lol but I just let it go. She said no matter how good her life is or how happy her marriage is that we had good times and she has accepted that Ill come in her mind from time to time because we got to live life together for a time too. We wished me good luck.


Sorry for the novel. I guess I just wanted to get peoples thoughts on it? Is this normal? Like Id like opinions of both sexs honestly?


Im also curious what does this say about the foundation of her marriage with him? Is this a bad sign? She mentioned theyve talked about starting a family together Im just curious as she keeps saying her marriage is so happy (shes got a good poker face so I cant tell lol) but if so happy why even have an inch?

Just frustrates and confused and any and all opiniond would be appreciated",2,1732766551.0,LifeAdvice,1,1.0,False
