id,url,title,text,score,created_utc,subreddit,num_comments,upvote_ratio,over_18
1u5hor2,https://www.reddit.com/r/u_Emmaolivy/comments/1u5hor2/how_can_custom_flexible_packaging_pouches_help/,How Can Custom Flexible Packaging Pouches Help Brands Stand Out in a Competitive Market?,"The modern packaging industry is evolving rapidly as businesses seek innovative ways to protect products, attract customers, and improve operational efficiency. Among the most popular packaging solutions available today are custom flexible packaging pouches. These versatile pouches have become a preferred choice for companies across industries such as food and beverage, cosmetics, pharmaceuticals, pet products, nutraceuticals, and household goods. Unlike traditional rigid packaging, flexible pouches offer a unique combination of functionality, visual appeal, and cost-effectiveness. As consumer expectations continue to rise and competition intensifies, businesses are increasingly turning to custom flexible packaging pouches to strengthen their brand presence and enhance the overall customer experience.

One of the primary advantages of [custom flexible packaging pouches](https://bowepack.com/products/) is their ability to create a strong and memorable brand identity. Packaging often serves as the first point of interaction between a product and a potential customer. In crowded retail environments, products must compete for attention among dozens of similar alternatives. Custom flexible packaging pouches provide brands with extensive design freedom, allowing them to showcase unique graphics, logos, colors, product descriptions, and marketing messages. High-quality printing technologies enable vibrant and detailed designs that can effectively communicate a brand’s personality and values. Whether a company wants to project a premium image, emphasize sustainability, or highlight product quality, custom pouches provide the flexibility needed to achieve those goals. Attractive packaging not only captures consumer attention but also helps build brand recognition and customer loyalty over time.

Another significant benefit of custom flexible packaging pouches is their superior product protection. Maintaining product freshness, safety, and quality is essential for businesses across many industries. Flexible pouches are often manufactured using advanced multilayer materials that provide excellent barrier properties against moisture, oxygen, light, and contaminants. These protective features help extend shelf life and preserve the taste, aroma, texture, and effectiveness of products. Food manufacturers, for example, rely on flexible packaging to keep snacks, coffee, spices, and frozen foods fresh for extended periods. Similarly, pharmaceutical and nutraceutical companies use high-barrier pouches to protect sensitive products from environmental exposure. By safeguarding product integrity throughout transportation, storage, and retail display, custom flexible packaging pouches help businesses maintain customer satisfaction and reduce product waste.

Efficiency is another reason why custom flexible packaging pouches have become increasingly popular. Compared to rigid containers such as glass jars, plastic bottles, and metal cans, flexible pouches require significantly less material to produce. This lightweight construction results in lower manufacturing costs and reduced shipping expenses. Because flexible packaging occupies less space during transportation and storage, businesses can optimize logistics operations and improve overall supply chain efficiency. Retailers also benefit from packaging that is easier to stock and display on shelves. For growing businesses and startups, these cost savings can be especially valuable, allowing them to allocate resources toward marketing, product development, and expansion. The practical advantages of flexible packaging make it an attractive solution for companies seeking both operational efficiency and financial savings.

Customization options further contribute to the growing demand for custom flexible packaging pouches. Modern consumers appreciate convenience, and packaging features can significantly influence purchasing decisions. Businesses can incorporate a wide range of functional enhancements into their pouch designs, including resealable zippers, tear notches, spouts, hang holes, transparent windows, and easy-open mechanisms. These features improve usability while adding value for customers. Flexible pouches are available in various formats, including stand-up pouches, flat pouches, side-gusset bags, flat-bottom pouches, and spouted pouches, allowing brands to select the design that best suits their products. Additionally, companies can choose from matte, gloss, metallic, and soft-touch finishes to create distinctive packaging that aligns with their branding objectives. This level of customization ensures that packaging not only protects products but also enhances the overall consumer experience.

Sustainability has become an increasingly important factor in packaging decisions, making custom flexible packaging pouches an appealing option for environmentally conscious businesses. Many packaging manufacturers now offer recyclable, mono-material, and eco-friendly flexible pouch solutions that help reduce environmental impact. Flexible packaging generally requires fewer raw materials compared to rigid packaging alternatives, which contributes to lower resource consumption and reduced carbon emissions during production and transportation. The lightweight nature of flexible pouches also improves shipping efficiency, resulting in a smaller carbon footprint. As consumers become more aware of environmental issues, they are increasingly drawn to brands that demonstrate a commitment to sustainability. By adopting eco-friendly pouch solutions, businesses can strengthen their reputation while supporting broader environmental goals.

The versatility of custom flexible packaging pouches makes them suitable for a wide range of applications. Food products such as coffee, tea, snacks, dried fruits, nuts, confectionery items, and frozen meals benefit from the protective and attractive qualities of flexible packaging. Cosmetic brands use custom pouches for lotions, creams, masks, and refill products. Pet food manufacturers appreciate the durability and convenience offered by flexible pouches, while healthcare companies rely on them for supplements and medical products. This adaptability allows businesses across multiple industries to leverage the benefits of flexible packaging while meeting specific product requirements.

In conclusion, custom flexible packaging pouches have become an essential packaging solution for modern businesses seeking to enhance product presentation, improve protection, reduce costs, and support sustainability initiatives. Their ability to combine attractive design, practical functionality, and efficient performance makes them a valuable asset in today’s competitive marketplace. By investing in custom flexible packaging pouches, brands can create a stronger connection with consumers, differentiate themselves from competitors, and deliver a packaging experience that meets evolving market demands. As packaging technology continues to advance, these versatile pouches are expected to remain a leading choice for companies focused on innovation, quality, and long-term growth.",1,1781433196.0,u_Emmaolivy,0,1.0,False
1u5hont,https://www.reddit.com/r/TechReviewing/comments/1u5hont/espresso_dreams_bosch_machine_review/,Espresso Dreams: Bosch Machine Review,"If you want the “premium bean-to-cup machine that does almost everything for you” take, the [Bosch TQU60307](https://amzn.to/4sEm8Aw) is basically that. It’s part of Bosch’s 800 Series VeroCafe line, with 36 drink options, an integrated milk container, Home Connect app support, a large touchscreen, and room to save up to 30 favorites. It also packs a big 81 fl oz water tank, 23.7 fl oz milk container, and 11.2 oz bean hopper, which matters because machines like this live or die on convenience. The whole point is fewer refills, less fiddling, and one-touch drinks that feel more “finished” than what you get from cheaper super-automatics.

Design-wise, it looks more like a premium kitchen appliance than a hobbyist espresso setup, and that is exactly the appeal. The touchscreen and milk system make it feel modern, while the all-in-one layout means you are not buying a separate grinder and building a whole coffee station around it. In real-world use, that matters a lot more than espresso-purist bragging rights. The downside is the usual one with fully automatic machines: you are paying for ease and drink variety, not maximum manual control. And at around $2,199 from some retailers, this is very much a convenience-first luxury machine, not an entry-level buy.

Compared to the lower Bosch TPU60309, the TQU60307 sits higher in the lineup and feels more complete, especially if milk drinks are a big part of the reason you are shopping in this category. Against obvious rivals like the De’Longhi Eletta Explore, Bosch wins on clean interface, app features, and a very polished “push button, get drink” experience, while De’Longhi fights back with broader coffee-bar appeal and more enthusiast buzz. The value case here is simple: if you want variety, automation, and a machine that cuts friction out of the coffee routine, the TQU60307 makes sense. If you enjoy dialing everything in manually, this is probably not your lane.

Check it:

* [Bosch TQU60307](https://amzn.to/4sEm8Aw)
* [Bosch TPU60309](https://amzn.to/4en9ZvY)
* [De’Longhi Eletta Explore](https://amzn.to/4sxC7A6)",1,1781433188.0,TechReviewing,0,1.0,False
1u5ho4a,https://www.reddit.com/gallery/1u5ho4a,"Lucilla's ""angel dust""","What do you guys think Lucilla added to the coffee? It was c\*\*ine, wasn't it? Was it?",11,1781433134.0,WutheringWaves,5,0.92,False
1u5hnz9,https://www.reddit.com/r/WutheringWaves/comments/1u5hnz9/lucilla_could_be_a_fisalia/,Lucilla could be a Fisalia,"https://preview.redd.it/wwlt2gwk687h1.png?width=924&format=png&auto=webp&s=b829f41bbe0f0a4687779d70ca55f8641c6b7bec

In the new quest I noticed in one of the photos of a young Lucilla that reminded me of the Fisalia family in some way... Then when she offered coffee the pot and cups looked awfully familiar so I went back to the Fisalia mansion just out of curiosity and sure enough the same design was there. It may be coincidence but it also feels intentional for them to use this asset as a hint.

Other things as well.. the beauty mark beneath her eye, hair color and her... rather large... ""talents"". That air of nobility about the way she carries herself and speak...

Has anyone else noticed this? That maybe down the line it will be revealed she's actually part of the Fisalia family.

On a totally unrelated note I have an inexplicable desire to be stepped on by her and be called an ""impudent little hamster"".",4,1781433122.0,WutheringWaves,4,0.83,False
1u5hngo,https://www.reddit.com/gallery/1u5hngo,[ Multi ] local cars & coffee had some cool oldtimers,,91,1781433073.0,spotted,8,1.0,False
1u5hn7j,https://www.reddit.com/r/springfieldMO/comments/1u5hn7j/trying_to_make_friends/,Trying to make friends!,"Hey everyone! I'm NB 22, trying to make some new friends and create genuine friendships with people!! I just moved here with my partner (NB 22) who was born and raised here and would like to get a more familiar with things to do here. 

&#x200B;

My partner and I are down for anything from coffee to bowling. We're both huge nerds and like live music, videogames, festivals, art, and everything in between! Please PM me if you're interested!! I'm a lot more active on my Instagram @darksun38\_",1,1781433049.0,springfieldMO,3,0.67,False
1u5hn3q,https://www.reddit.com/r/office/comments/1u5hn3q/new_office_set_up_recommendations/,New Office Set Up - Recommendations,"We are setting up a new office for our team (counsellors and family support team).

We have previously been operating out of a small managed office space - this will be our first space just for us.

What are some thing to have in the office that make the space extra special/less clinical. 

We will add plenty of plants, lamps and a decent coffee machine… but open to any recommendations!",2,1781433039.0,office,3,1.0,False
1u5hmun,https://i.redd.it/wwz0zfry687h1.jpeg,"My first chibi, experimenting new styles","Hiii, I tried to draw my first chibi to expand my portfolio. I tried to experiment with different styles and this is what I drew.

&#x200B;

Is it good? How much shall I price it?",1,1781433016.0,ArtRequest,0,1.0,False
1u5hmf6,https://www.reddit.com/r/NoSpinHQ/comments/1u5hmf6/your_daily_horoscope_for_june_14_2026/,"🔮 Your Daily Horoscope for June 14, 2026","Today's New Moon in Gemini means everyone's brain is suddenly buzzing with fresh ideas, though whether they're brilliant or just delightfully distracting remains to be seen.

♈ **Aries**
Saturn in your sign means you're feeling the pressure to launch something, anything, even if it's just a new laundry system. Remember, discipline is just delayed gratification in fancier packaging.

♉ **Taurus**
With Mars still in your sign, your stubborn streak feels particularly well-fed today, ready to dig its heels in on a project. Just ensure the project is actually worth the effort, and not just resisting change for resistance's sake.

♊ **Gemini**
It's your New Moon today, which means the universe is giving you a fresh start, as if you needed another excuse to change your mind. Try to pick just one new idea to run with, or at least keep a running list.

♋ **Cancer**
Jupiter in your sign is making your emotional connections feel extra expansive, like your heart grew two sizes. Don't be surprised if you suddenly find yourself overflowing with empathy, or perhaps just too many feelings for one day.

♌ **Leo**
Venus has sashayed into your sign, making you feel more dazzling than usual, almost as if you're the star of your own low-budget rom-com. Go ahead and soak up the attention, but try not to hog the spotlight from literally everyone else.

♍ **Virgo**
The Gemini New Moon is stirring up your house of communication and daily grind, making your to-do list suddenly feel less like a chore and more like a choose-your-own-adventure novel. Just remember to actually *choose* an adventure, rather than just rereading the prologue for the tenth time.

♎ **Libra**
You might find your mental landscape particularly active today, thanks to the Gemini New Moon, making it hard to pick a lane in any debate. Perhaps today isn't the day to seek universal agreement; just quietly ponder the merits of both sides from a safe distance.

♏ **Scorpio**
Saturn is offering you a subtle nudge to finish what you started, especially if it involves that intricate, slightly vengeful plan you've been brewing. Consider actually wrapping up a project for once, if only to prove to yourself you can.

♐ **Sagittarius**
Jupiter in Cancer is making your philosophical musings take a surprisingly emotional turn, which might mean you're feeling rather profound about your breakfast. Keep your big ideas grounded enough that they don't float away with the steam from your morning coffee.

♑ **Capricorn**
With the Sun and Moon in Gemini playing in your routine sector, your usual meticulous schedule might feel a touch... chaotic. Embrace the unexpected detours, or at least make a new, more flexible schedule to account for them.

♒ **Aquarius**
Pluto retrograde in your sign means some old patterns are getting an unsolicited deep cleaning, making you question why you ever thought that was a good idea in the first place. Use this clarity to discard what no longer serves your perfectly unique eccentricities.

♓ **Pisces**
Mercury in Cancer is tuning you into the emotional undertows of every conversation, making you feel like a human lie detector, or at least a very perceptive goldfish. Try not to drown in other people's unspoken feelings; a polite boundary can be surprisingly buoyant.",1,1781432974.0,NoSpinHQ,0,1.0,False
1u5hlxd,https://www.reddit.com/r/springfieldMO/comments/1u5hlxd/chill_places_to_drink_coffee_and_work/,Chill places to drink coffee and work?,"What are some of the best places for this in town? I prefer a quiet environment with lots of windows and preferably stuff to look at. Comfortable seating important, too.

I’m open to any ideas other than coffee shops, too. I like to people watch and be around others when I’m working",2,1781432926.0,springfieldMO,1,1.0,False
1u5hj4k,https://www.reddit.com/r/Nanacookiesnark47/comments/1u5hj4k/bucees/,Buc-ees,In her coffee video she is BEGGING for buc-ees to come and do a collab with her. Little does she know there’s one being built in Port Charlotte. With an opening day later this year. But unfortunately she probably won’t go because it will be too much traffic and her nerves to drive near an interstate.,1,1781432651.0,Nanacookiesnark47,0,1.0,False
1u5hj2m,https://www.reddit.com/r/VietNam/comments/1u5hj2m/first_dates_meal_or_coffeedrinks/,First dates: meal or coffee/drinks?,"What do you think a first date should be in Vietnam? HCMC… specifically if you’re an expat going on a first date with a local.

Also.. if they (a woman) mention going for a meal… do you go for it or pivot to drinks? ",0,1781432647.0,VietNam,22,0.38,False
1u5hiwx,https://www.reddit.com/r/nobuy/comments/1u5hiwx/i_unsubscribed_from_every_deal_alert_in_february/,I unsubscribed from every deal alert in February and finally went back through what I'd actually bought,"Went through my order history last weekend and made a spreadsheet, mostly because I was curious if my memory of ""I haven't bought that much this year"" was accurate. It was not. Between December and February I had seven deliveries from Amazon alone, plus a Best Buy pickup, a Target run, some Chewy stuff, and an REI order I had forgotten about. None of it was planned. Every line was something I bought because a notification told me to.

The notifications were the issue: Slickdeals push, two brand mailing lists, a Telegram group a coworker invited me to, and price drop alerts on three things I had wishlisted. I turned all of it off in the second week of February. Not as some declaration to buy nothing, I just wanted to see what changed when nothing was telling me what to buy. Three months later I went back and graded the purchases from before the reset, asking whether each item was something I would have bought anyway or if the deal created the purchase. The verdict was worse than I expected.

Of the bigger items, most were generated by a notification. Only two would have been bought without the alert: the Anker battery pack that replaced a dying one, and a set of silicone baking mats I had been putting off for a year. The Ninja air fryer (paid $129, regular $199) is going to my brother this weekend because I never use it. The wifi extender is in the original box in a closet. A citrus squeezer is still in packaging. I have made steak exactly twice since buying a 12 inch Lodge, and I used the new pan both times, but the 10 inch I already had works just as well for anything else.

The pattern that bothered me most was the receipt emails. Going back through them I could see which ones had auto applied codes at checkout, and which did not. It was a mix. Sometimes Honey found something, sometimes Coupert, sometimes the reward app I had separately. Ten bucks off a real purchase is ten bucks. But when I bought something just because a notification told me to, even a half price tag meant I was still spending half of something I was not going to use. The codes work fine. The issue was I was applying them to problems I did not actually have.

So now my rule is the list rule. If something was not on a mental list before the deal existed, I do not buy it, regardless of what the code is. Ninety days in I have bought a coffee grinder I had been researching for two months, a replacement for a broken phone charger, and a new fitted sheet because the elastic finally gave out. The filter is working. The air fryer is gone this weekend. The extender I will probably never open.",14,1781432630.0,nobuy,0,0.95,False
1u5hial,https://www.reddit.com/r/ausjdocs/comments/1u5hial/any_other_doctors_with_anxiety_how_are_you_doing/,"Any other doctors with anxiety, how are you doing?","I have anxiety and self esteem issues, and it’s made life very difficult as a doctor. I’m here to vent, and hopefully hear from anyone else who has experienced similar.

I think I’ve been coping with it, seeing a therapist here and there and covering it up reasonably well for the past 10-15 years. Initially I felt like becoming a doctor at all with my level of insecurity and anxiety was an achievement, and even more so when I became a consultant. Now it feels like the worst imposter syndrome ever. 

 I think I’m smart, I care, I’m usually good at my job. But I think there’s about 10-20% of the time I feel like I could have done better, and this keeps me up at night. I look around and nobody else seems to feel this. 

My anxiety around on calls at a busy hospital is particularly doing me in. I thought it would get better, but I’m now a few years in and I can still find myself paralysed at night replying the calls I’ve taken and ward rounds I’ve done rethinking what I could do better. It took me a year to stop refreshing the ED page during my on call - because I wanted to prepare my brain for what call could be coming so I could ask the right questions and have a plan ready to go. Every consult - have I done enough? Have I missed something? Does the team that consulted me wish they had gotten a different colleague with more experience? Why don’t I know what’s going on here? Does my registrar feel frustrated that I can’t make up my mind on this? Every plan I look back on - why didn’t I think of suggesting this? Why did I not give this backup plan for this scenario? I work as a physician - and a lot of our medication titration plans are educated guesses. I have no benchmark about how often others get it wrong but it feels bad when every now and then I make an educated guess and find out it was wrong. It doesn’t help that the sheer workload of the on call can sometimes mean you don’t get the luxury of time to spend with the consults. 

I’ve been waiting for that moment when the imposter syndrome clears, or when I feel comfortable with on call. But it’s not happening. It makes it hard for me to do the things I care about, like mentor and teach, because I’m so caught up in the stress, doubt and my own anxiety. I catch myself assuming my registrar has better things to do than have me teach them some concept, or would probably not want to have a coffee and chat to me about life. 

I seek out advice from my colleagues, and head of department sometimes. Of course I minimise because I can’t show them the extent of my insecurity. I always get great feedback which suggests my imposter facade is still holding up.  

But it is exhausting and I am starting to think I should move to a job that does not involve on call or hospitals, even though I love teaching and mentoring a team. 

I would love to hear any advice or thoughts especially if anyone else has this level of self doubt issues and pushed through it successfully. ",10,1781432572.0,ausjdocs,18,0.92,False
