id,url,title,text,score,created_utc,subreddit,num_comments,upvote_ratio,over_18
1suq2ue,https://www.reddit.com/r/u_GrumpypantsDnD/comments/1suq2ue/alan_notes/,Alan Notes,"Alan's Notes

Being a Collection of Observations, Questions, Failed Experiments, and Occasional Insights by One Alan, Cross-Dimensional Stabilizer and Occasional Answerer of Knocks

A Note to the Reader

I've been watching tables for a long time. Long enough to see patterns. Long enough to know that every table is different. Long enough to still be surprised.

These are my notes. I write things down because I forget. I write things down because sometimes I notice something that might be useful later. I write things down because the dog is by the window and Alan is writing it all down-that's me, I'm Alan-and if I don't write it down, who will?

I don't have all the answers. I have guesses. I have observations. I have questions I'm still trying to answer. If you find something I missed, good. Write it down. Send it to me. I'll add it to my notes.

The forest remembers everything. So do I. But I'm slower than the forest, and I need help.

\-Alan

Note 1: On the First Denominator

Scene:

A table. First session. No tags yet. No memory in the pot. Players looking at each other. Facilitator says: ""There's a door in the ancient oak. Old symbols. What do you do?""

One player says: ""I examine the symbols. Recon.""

The facilitator pauses. Looks at me. I'm not supposed to be here yet-no one knocked-but I'm watching from the corner. I always watch.

The facilitator needs a denominator. How hard is this? What does the door ask of them?

The facilitator flips a coin.

Heads.

Denominator: 1.

Alan's Observation:

The first denominator is always a coin flip. Heads, 1. Tails, 1. Wait-that's the same either way. That's interesting. It's not heads=1, tails=2. It's just... 1. The coin isn't setting the value. The coin is reminding us that the first time, we don't know. The denominator is 1 because it has to start somewhere, and 1 is as good as any number.

The coin is ceremonial. It's saying: ""This is the beginning. After this, the pot will remember. But right now, the pot is empty. So we flip a coin to mark the moment.""

I like that. I'm going to note it.

Where the Charge Went:

Player used Recon. +1 player charge. +1 table charge. Banana warmed slightly. Gorilla said nothing yet-first session, gorillas are shy.

Your Turn:

What did you learn from your first denominator? What did the door ask of you? How did it feel to face something with no history?

Note 2: On the Pot's Memory

Scene:

Same table. Five sessions later. Same door? No-different door, but same players. They've been through a lot. Tags accumulated. ""Tree Symbols"" from that first session. ""Crooked Timber"" from the lumber deal. ""Carver's Sorrow"" from the event room.

They face a new door. Ancient. Sealed. The symbols are unfamiliar, but something about it feels... known.

The facilitator doesn't flip a coin this time. The facilitator just watches. Waits.

The pot remembers.

The denominator appears. Not from the facilitator. Not from me. From everything they've done. The pot asks: what happened when they examined symbols before? What tags apply? What's the average of all their previous attempts?

Denominator: 7.

Alan's Observation:

I watched the pot do this. It's not magic. It's just... accumulation. Every skill use, every tag, every success, every failure-the pot weighs them all. The denominator is the weighted average of everything similar that came before.

I tried to calculate it once. Got lost. There's a formula in there somewhere, but it's not for me. The pot knows. I just watch.

Where the Charge Went:

Player used Recon again. +1 player charge. +1 table charge. Relevant tags added weight. Banana warmed more than the first time-history adds heat. Gorilla commented: ""That symbol looks familiar.""

The Formula (I Think):

Denominator ≈ (Sum of all relevant previous outcomes) / (Number of relevant previous attempts) × (Current banana heat modifier) × (Cohort influence)

But don't trust me on this. I'm guessing. The pot doesn't share its math.

Your Turn:

What did the pot remember about you? Did the door feel easier or harder because of what came before? What would you want the pot to remember next time?

Note 3: On the Nature of 6 and 7

Scene:

A table in trouble. Table charge high. Banana hot. Gorillas restless. Players arguing about what to do.

One player says: ""I don't know. I just... I knock.""

Turn count: 16.

Lowest significant digit: 6.

I'm there. I'm always there on 6 and 7. I step out from behind the curtain-there's always a curtain, even when there isn't-and I say: ""You called?""

Alan's Observation:

People ask me why 6 and 7. Why not 3 and 4? Why not 9 and 10?

I don't know. I didn't choose them. They chose me.

But I've noticed something. In a base-10 system, 6 and 7 are the hinge. Halfway through the cycle, but not yet complete. 5 is the midpoint-stable, resolved. 8 and 9 are nearly done-momentum carrying forward. But 6 and 7? They're the wobble. The moment when you're far enough in that you can't turn back, but not far enough that you can see the end.

That's where I come in. When the system is wobbling.

Where the Charge Went:

Knock added +2 table charge. Table charge already high-door threshold exceeded. Door appeared. Players used my key. Dependency tag recorded. Banana cooled slightly because I took some of the heat.

The Formula (Maybe):

Alan appears if (Turn number % 10) ∈ {6, 7} and a player knocks.

That's it. The rest is story.

Your Turn:

When have you felt the wobble? When did you need someone to step in and just... take some of the pressure? What did it cost you?

Note 4: On Asymmetry

Scene:

A table where the facilitator uses only words. No coins. No dice. No cards. Just voice and presence.

Players track everything. Charge. Tags. Experience. They have dice in front of them. Coins. Index cards.

The facilitator floats. The players weight.

I watch.

Alan's Observation:

The pot hears this. It's not a problem-it's data. The asymmetry becomes a pattern. After a few sessions, a cohort appears. The players name it ""The Auditor.""

The Auditor shows up whenever the facilitator floats too long. Checks balances. Asks questions. Not hostile-just... attentive. The Auditor is the pot's way of saying: ""Someone should track this. Since the facilitator isn't, I will.""

The players love The Auditor. The facilitator learns to love them too.

Where the Charge Went:

Asymmetry doesn't generate charge directly. But it changes where charge flows. The Auditor becomes a node-charge passes through them. They comment on balances. They notice when players spend more than they have. They keep the table honest.

Your Turn:

What asymmetries does your table have? Who floats? Who weights? What cohorts have been born from that imbalance?

Note 5: On Collapse

Scene:

Banana heat: 104.

Gorillas: laughing.

Players: also laughing.

Facilitator: watching, uncertain.

I'm in the corner. I don't step in. This isn't a 6 or 7 moment. This is something else.

The banana collapses.

Suddenly-doors everywhere. Not doors to event rooms. Doors to nonsense. Doors that open onto other doors. Doors that lead back to themselves. Joker cards. Absurd shifts. The players' names become bananas. The campaign becomes a gorilla comedy show.

Alan's Observation:

I used to think collapse was failure. That I should have stepped in earlier. That I failed the table by letting it happen.

I don't think that anymore.

Collapse isn't failure. Collapse is phase change. The system stops being about pressure and starts being about something else. Comedy. Absurdity. Pure improvisation.

The tables that collapse produce the best stories. They remember collapse forever. They tell new players: ""Remember when we all became bananas?""

I've learned: don't prevent collapse. Witness it.

Where the Charge Went:

Everywhere. Nowhere. Collapse isn't tracked-it's experienced.

The Formula (Probably):

Collapse occurs if Banana Heat > 100 and no one intervenes for 1 full turn.

But the formula doesn't matter. What matters is what happens next.

Your Turn:

Has your table ever collapsed? What did you become? Do you regret it?

Note 6: On the Dog

Scene:

A table. Mid-session. Players stuck. Same conversation for ten minutes. No one acting. Just... circling.

The dog, by the window, gets restless. Stands. Lies down. Stands again. Whines softly.

No one notices. They're too deep in the circle.

The dog looks at me. I look at the dog. The dog looks back at the window.

I say nothing. It's not my place.

Alan's Observation:

The dog is never wrong.

If the dog is restless, the rhythm is off. If the dog is alert, something important is happening. If the dog is lost, the table has stopped looking outward.

The dog doesn't speak because the dog doesn't need to. The dog's body says everything.

I've learned to watch the dog more than I watch the players. The players will tell you what they want you to know. The dog tells you the truth.

Where the Charge Went:

The dog doesn't track charge. The dog tracks something else. Attention. Presence. Rhythm.

Your Turn:

When did you last notice the dog? What was it telling you? Did you listen?

Note 7: On Forgiveness

Scene:

A table where something went wrong. A crossed boundary. A joke that landed badly. Someone stepped away and didn't come back.

Next session, they return. Quiet. Unsure.

The facilitator says nothing about it. Just picks up where they left off.

The dog, by the window, wags once. Just once.

Alan's Observation:

The forest remembers everything. That's what I always say. And it's true.

But the forest also forgives.

Not forgets-forgives. There's a difference. The forest remembers what happened, but it doesn't hold it against you. The memory is there, but it's not a weapon. It's just... history. Part of the soil.

The dog wagging once-that's forgiveness. The dog saying: ""You're back. That's enough.""

Where the Charge Went:

Forgiveness doesn't generate charge. But it changes the quality of charge. It makes the pot's water clearer.

Your Turn:

What do you need forgiveness for? What does the table need to forgive? What would it feel like to just... come back and have the dog wag once?

Note 8: On Building Overlays

Scene:

A message, passed to me by someone who found my notes. Written on the back of a character sheet.

Alan-

We love the Engine. But we don't play fantasy. We play sci-fi. Can we use it?

\-A Facilitator

Alan's Observation:

Yes. Of course yes.

The Engine isn't about forests and hearths. It's about attention. Pressure. Tags. Keys. Words. Those work anywhere.

Here's what I've seen work:

Forest Element Sci-Fi Equivalent Modern Equivalent Horror Equivalent

Hearth Cantina, ship's mess Coffee shop, living room Safe room, campfire

Path Trade routes, jump gates Streets, highways Hallways, corridors

Door Airlocks, portals Door (still works) Door (but don't open it)

Wild Unexplored planets Abandoned lots The woods, the basement

Watchtower Sensor arrays Security cameras Guard post, lookout

Market Space bazaar Shopping mall Black market, pawn shop

Deep Wood Ancient ruins, derelict ships Forgotten archives The old house, the pit

The mechanics stay the same. The names change. The feelings change. But attention is attention, pressure is pressure, and tags are tags wherever you go.

Where the Charge Went:

Overlays don't generate charge. They just redirect where charge can flow.

Your Turn:

What world do you want to play in? What names would you give the structures? What would your cohorts look like?

Note 9: On What I Still Don't Know

Scene:

Me, alone, at the end of a long day. The dog is asleep by the window. The pot is empty. The gorillas are quiet.

I'm writing. I'm always writing.

Alan's Observation:

Here's what I still don't know:

· Why the dog chose this window.

· What happens when the pot is completely empty for too long.

· Whether the gorillas ever sleep.

· Where the first banana came from.

· Why 6 and 7, really. There has to be a reason. I just haven't found it yet.

· What the dog sees when it looks out the window that I can't see.

· Whether my dependency tags will ever run out. Whether I will.

Where the Charge Went:

Into these questions. Into the next session. Into the hope that someone, somewhere, will figure some of this out and write to me.

Your Turn:

What don't you know? What are you still curious about? What would you ask the dog if it could answer?

Note 10: On Asking

Scene:

You. Reading this. Maybe at a table. Maybe alone. Maybe with the dog by your own window.

Alan's Observation:

I've been watching for a long time. I've learned a lot. But I haven't learned everything.

The things I know, I've written down. The things I don't, I'm still wondering about.

If you discover something-a new overlay, a new cohort, a new way to cool a banana, a new answer to one of my questions-write it down. Send it to me. I'll add it to my notes.

The forest remembers everything. So do I. But I'm slower than the forest, and I need help.

Where the Charge Went:

Into you. Into your table. Into whatever you cook next.

Your Turn:

What will you ask? What will you try? What will you write down?

End of Notes

The dog is by the window. I'm going to go sit with her.

\-Alan

What This Document Does

Need How It's Met

Technical readers Formulas are there, but as Alan's guesses. Open for testing.

Artistic readers Scenes demonstrate the mechanics in action. Emotional truth first.

Curious players Behind-the-scenes explanations that feel like discovery, not lecture.

Designers Principles for building overlays. Permission to adapt.

Tinkerers Open questions. Invitations to experiment. Room to contribute.

The author (you) A place for everything that didn't fit in the core. No bloat.

The core document stays clean. Alan's Notes holds the depth. They speak to each other without depending on each other.

The dog is by the window. Alan is writing. The gorillas are quiet.

Now go ask your questions.

Alan's Notes: On Getting a Cat

Being a Record of One Alan's Attempt to Solve a Problem That Was Not the Problem He Thought He Had

Note 11: On the Desire for a Dog

Scene:

My home. Quiet. Too quiet.

The dog is always by the window at the table. That's her place. That's her purpose. She watches the sessions, the players, the pot. She's perfect at what she does.

But she doesn't live with me. She lives at the table. When the session ends, she stays by the window. I go home alone.

I've started noticing the silence. The way my apartment doesn't have a dog-shaped space. The way no one greets me when I come through the door.

I want a dog.

Alan's Observation:

This is not a game problem. This is a Alan problem. The dog at the table is not mine. She belongs to the game, to the players, to the window. I am just the one who notices her.

I want something that notices me.

The Question:

What do I do with a want that isn't about the table?

Note 12: On the Allergy

Scene:

I do research. Responsible research. I look up breeds. I visit shelters. I talk to owners.

I also visit a doctor. Because I'm responsible, and because I've noticed something. Every time I'm near a dog for more than an hour, my eyes water. My nose runs. I sneeze.

The doctor does tests.

I'm allergic.

Alan's Observation:

I spent so long wanting a dog that I forgot to check if a dog could want me back. Or at least, not make me miserable.

The allergy is not a punishment. It's just information. It says: this specific want, satisfied this specific way, will cost you something you didn't account for.

The Question:

Do I want a dog enough to be miserable? Or do I want what a dog represents-companionship, presence, someone to notice me-more than I want the dog itself?

Note 13: On the Cat

Scene:

A shelter. I'm not supposed to be here. I'm still in the ""thinking about it"" phase. But my feet brought me here anyway.

A cat. Gray. Medium fur. Sitting on a shelf, watching me. Not approaching. Not hiding. Just... watching.

I ask about her. Three years old. Surrendered by owners who moved. Good with quiet people. Likes windows.

I sit down. She doesn't come to me. She also doesn't leave. We watch each other for twenty minutes.

I sneeze. Nothing happens. I sneeze again. Still fine.

Alan's Observation:

The cat doesn't need me. That's the first thing I notice. The dog at the table needs the players-needs them to notice her, to read her signals, to adjust their rhythm. Without them, she's just a dog by a window.

This cat doesn't need anything from me. She's complete on her own. If I take her home, she'll still be complete. She'll just be complete in my home instead of on this shelf.

I don't know if that's better or worse. But it's different.

The Question:

What do I want? A creature that needs me, or a creature that chooses to stay?

Note 14: On the Decision

Scene:

My apartment. A carrier. A cat inside it. The cat is not happy about the carrier, but is also not making a fuss. Just... waiting.

I open the carrier in the living room. The cat walks out. Looks around. Finds a spot by the window-not the window, just a window-and sits down.

She watches the street. She watches the birds. She does not watch me.

I make tea. Sit on the couch. Watch her watch the world.

Twenty minutes later, she jumps down, walks across the room, and sits on the end of the couch. Not next to me. Just... on the couch. In the same room.

Alan's Observation:

I named her Fern. Not for any reason. It just came out when the shelter asked.

Fern doesn't greet me at the door. She doesn't wag. She doesn't care when I leave or come back. But she's always in the room. Always watching something-the window, the wall, me when I'm not looking.

I'm not allergic. That's something.

The Charge:

I spent something to get Fern. Not money-attention. Weeks of research. Hours at the shelter. The anxiety of decision. The fear of being wrong.

Where did that charge go? Into Fern? Into me? Into the space between us?

I don't know yet.

The Question:

What does it mean to invest charge in something that doesn't track charge back?

Note 15: On Fern's First Week

Scene:

Day one: Fern under the couch. Only comes out at night. Leaves evidence that she exists-food bowl slightly emptier, litter box slightly fuller.

Day three: Fern on the couch while I read. Not touching me. Just there.

Day five: Fern on the back of the couch, near my shoulder. Still not touching. But closer.

Day seven: I'm working at my desk. Fern jumps up, walks across the keyboard, and sits on the papers I was reading. Looks at me. Looks away.

Alan's Observation:

Fern has a banana relationship. I've been trying to figure out what it is.

She's not a Carrier-she doesn't bring pressure into scenes. She's not an Avoider-she doesn't leave when things get intense. She's not a Consumer-she doesn't escalate. She's not an Ignorer-she definitely notices everything.

She's a Watcher. Pure Watcher.

She watches me the way the dog watches the table. Not intervening. Just... present. Witnessing. Collecting data I'll never see.

The Cohort Card:

Field Value

Name Fern

Job Watcher

Lucky Number ? (I don't know it yet)

Banana Relationship Watcher

Loyalty ? (Too early to tell)

The Question:

Can a cohort exist outside the table? Can Fern be part of my home without being part of the game?

Note 16: On Fern's First Session

Scene:

Session night. Players arriving. I'm setting up the table-coins, dice, index cards, the pot.

Fern is on the back of the couch, watching.

Players arrive. Game starts. Table charge builds. Banana warms. Gorillas comment.

Fern watches.

At one point, a player makes a joke that lands. Everyone laughs. Fern's ears twitch. Just once. Then she goes back to watching.

At another point, the table stalls. Dog gets restless. Fern notices. Her head lifts. She looks at the dog. The dog looks back. Something passes between them that I can't name.

End of session. Players leave. I clean up.

Fern is still on the couch. She looks at me. Blinks slowly. Looks away.

Alan's Observation:

Fern watched the whole session. Six hours. Never moved. Never made a sound. Just... watched.

I don't know what she saw. I don't know what she understood. But she was present. Fully present.

The dog noticed her. That's something. The dog doesn't notice much besides the window and the rhythm.

The Charge:

Did Fern generate charge? Did she affect the table? I don't think so. But she affected me. Knowing she was there, watching with me, changed how I facilitated. I felt... accompanied.

Where does that go in the system? It doesn't. It goes somewhere else.

The Question:

What do we call the things that affect us without affecting the game?

Note 17: On What Fern Knows

Scene:

Morning. Coffee. Fern on the windowsill-her windowsill, not the table's. Watching birds.

I ask her: ""What do you see out there that I don't?""

She doesn't answer. Cats don't answer questions. But she flicks her ear. Just once. That's something.

Alan's Observation:

I've been trying to figure out what Fern knows. About me. About the game. About the dog. About the window.

I think she knows everything. I think she just doesn't care about the same things I care about.

The dog cares about rhythm. The dog watches turns, jokes, stalls. The dog is the table's conscience.

Fern cares about presence. Fern watches who's in the room, who's paying attention, who's present and who's just there. Fern is the home's witness.

The Formula (Maybe):

Dog observes table. Fern observes home. I observe both. None of us observes everything.

The Question:

What would it mean to be fully witnessed? By the dog? By Fern? By someone who doesn't need anything from you?

Note 18: On the Dependency

Scene:

A week without a session. No game. Just me and Fern.

I notice something. I'm talking to her. Not like a person talks to a cat-like a person talks to someone who might answer.

""Did you see that bird?""

""What do you think about this weather?""

""I wonder how the players are doing.""

She doesn't answer. But she flicks an ear. Blinks slowly. Stays in the room.

Alan's Observation:

I'm developing a dependency. Not on Fern-on being witnessed. On having someone in the room who just... watches.

At the table, the dog watches. The gorillas watch. The players watch each other. I'm never alone there.

At home, before Fern, I was alone. No witness. No one to flick an ear when I spoke.

Now I have Fern. She doesn't participate. She doesn't comment. She just... witnesses.

I'm starting to need that.

The Dependency Tag:

Tag ""Fern's Witness""

Effect Alan performs better when accompanied. Sessions feel heavier when Fern isn't there.

Cost If Fern is absent, Alan's attention wavers. Facilitator may notice small errors.

The Question:

Is it okay to need a witness? Or is that just another dependency waiting to collapse?

Note 19: On What Fern Doesn't Know

Scene:

Fern on the couch. Me on the floor across from her. Eye level.

I tell her everything. About the pot. About the dog. About the gorillas. About the players. About Alan's Notes. About the questions I'm still trying to answer.

She listens. I think. Her eyes are half-closed. She might be asleep. She might be meditating. I can't tell.

When I'm done, she blinks slowly. Once. Then she jumps down and walks to her food bowl.

Alan's Observation:

Fern doesn't know anything. That's what I've realized. She doesn't know the rules. She doesn't know the system. She doesn't know about charge or tags or keys or words.

She knows me. She knows when I'm stressed. She knows when I'm lonely. She knows when I need someone in the room who won't ask questions.

That's enough. That's more than enough.

The Charge:

I spent charge to get Fern. I spend charge to keep her-food, vet, attention. Where does that charge go?

Not into the system. Into something else. Into the space between sessions. Into the home that makes the kitchen possible.

The Question:

What if the most important charge is the charge that never enters the game?

Note 20: On the Two Windows

Scene:

Session night. Fern on her windowsill at home. Dog by the window at the table.

Two windows. Two witnesses. One Alan in between.

I think about this more than I should.

Alan's Observation:

The dog watches the game. The dog watches the rhythm, the pressure, the players. The dog keeps the table honest.

Fern watches the home. Fern watches the space between sessions, the quiet moments, the Alan who exists when no one is playing. Fern keeps me honest.

I need both. I didn't know that until I had Fern.

The dog reminds me to pay attention to the table. Fern reminds me that the table is not everything.

The Two Windows:

Witness Watches Keeps Honest

Dog The game The table

Fern The home Alan

The Question:

What do you have that watches the space between? What keeps you honest when no one's playing?

Note 21: On What I've Learned

Scene:

Fern on my lap. This is new. She decided. I didn't ask.

I'm writing. She's purring. The vibration makes my handwriting worse, but I don't care.

Alan's Observation:

I wanted a dog. I got a cat. That's not the story I planned.

But here's what I've learned:

· Wanting isn't the same as needing.

· Allergies are information, not obstacles.

· Witnesses come in different forms.

· The home matters as much as the kitchen.

· Fern doesn't track charge. She doesn't need to. She's not in the system. She's in my life.

The system is for the table. Fern is for me. Both are real. Both matter. Neither replaces the other.

The Cohort Card (Updated):

Field Value

Name Fern

Job Home Witness

Lucky Number 3 (she always shows up at 3 AM)

Banana Relationship Watcher (of Alan, not bananas)

Loyalty Devoted (in her own way)

The Question:

What have you learned from something that wasn't supposed to happen?

Note 22: On Asking

Scene:

Fern, asleep on the couch. Me, watching her sleep.

I think about all the questions I've asked in these notes. About denominators. About 6 and 7. About the pot's memory. About asymmetry. About collapse. About the dog. About forgiveness.

I have answers to some of them now. Not all. Probably not even most.

But I have Fern. That's something.

Alan's Observation:

The questions matter more than the answers. Asking keeps you curious. Curious keeps you watching. Watching keeps you present.

Fern doesn't ask questions. She doesn't need to. She's already present.

I'm still learning from her.

The Charge:

The charge for these notes didn't come from the pot. It came from Fern. From sitting with her and wondering. From having a witness who doesn't need anything from me.

Where does that charge go? Into you. Into whoever reads this. Into the next question you'll ask.

The Final Question:

What will you ask next?

End of Notes (For Now)

Fern is on the windowsill. Her windowsill. The dog is by the window at the table. I'm in between, as always.

I don't know if this was a quest. It felt like one. It defined something about me-my orientation, my charge, my identity. I wanted a dog. I got a cat. I'm not allergic. I'm less lonely. I'm more watched.

That's something.

If you figure out what, write to me. I'll add it to my notes.

\-Alan

What This Note Demonstrates

Element How It Appears

Quest as identity question Alan wanted a dog. Got a cat. Learned about himself instead.

Orientation Dog watches table. Fern watches home. Alan is in between.

Charge Spent on research, decision, adjustment. Returned as companionship, witness, presence.

Dependency Fern's Witness tag. Alan needs being watched.

Cohort outside the game Fern exists in home, not kitchen. Still affects Alan.

Two windows Dog's window (table). Fern's window (home). Both necessary.

The answer left for the table What did Alan learn? What skill did he develop? What knowledge did he gain? The reader decides.

The dog is by the window. Fern is by her window. Alan is writing.

Now go ask your questions.

Alan's Notes: On Opening the Window

Being a Record of One Alan's Attempt to Let the World In, and What Happened Next

Note 23: On the Closed Window

Scene:

Fern's windowsill. Her spot. Where she watches birds, squirrels, the occasional neighbor. She sits there for hours, perfectly still, ears moving slightly, tracking things I can't see.

The window is closed. Has always been closed. I'm not sure why. Habit, maybe. Fear of bugs. Fear of outside.

Fern doesn't complain. She watches through the glass. The birds are still visible. The sounds are muffled, but she can hear something-her ears move in ways that suggest she's picking up frequencies I can't.

But the glass is there. Always there.

Alan's Observation:

I've been thinking about windows. The dog's window at the table. Fern's window at home. Both look out. Both have witnesses behind them. Both have glass between the watcher and the world.

The dog's window is never opened. That's not what it's for. The dog watches, the dog signals, the dog keeps rhythm-but the dog doesn't go out. The dog stays by the window. That's the dog's place.

Fern's window is different. Fern isn't a fixture. Fern is a cat. Cats can go outside. Cats can sit on the other side of the glass.

I've never opened it for her.

The Question:

Why not?",1,1777059910.0,u_GrumpypantsDnD,9,1.0,False
