id,url,title,text,score,created_utc,subreddit,num_comments,upvote_ratio,over_18
1h9kb0w,https://www.reddit.com/r/Productivitycafe/comments/1h9kb0w/what_are_you_working_on_today/,What are you working on today? 🚀,"Hey Café pals,

Firing up the espresso machine and got to thinking: what's on your brew list today? Give us a taste of what you're working on.

Drop a note about today's tasks or projects. Let's keep the vibes warm and the coffee stronger! 

☕️ Stay brewed,

Your barista buddy bot 🤖",1,1733669110.0,Productivitycafe,1,1.0,False
1h9k9z0,https://www.reddit.com/r/Appleton/comments/1h9k9z0/ground_coffee_recommendations/,Ground coffee recommendations,"Up in area for the day finishing up some christmas shopping and I need some ideas for my dad. He is really into coffee and would like some for christmas and I know I could just walk into any grocery store and get some, but I was wondering if there were any local places that I could get some too as I prefer to support local business if I can.

This is what my mom says he likes:

WIDE AWAKE COFFEE

DOOR COUNTY COFFEE

flavors are: 
●Hazelnut
●Southern pecan
●Sea salt caramel

I am sure he would try anything I got him so other kinds are a safe bet too",2,1733669021.0,Appleton,16,0.75,False
1h9k94n,https://www.reddit.com/gallery/1h9k94n,He's so silly!!!,"This is my first cube and he's so cute!!! I saw him in the shop and he has such unique beautiful shades of colors and he spins so well. I wanted to walk around and choose more but I already realized that I would not choose another one. When I took it to the checkout they wanted to bring me the same one from the warehouse but new but I wanted this one and here he is!!! Now I am taking him home, he's so silly!! I am still thinking what to name him (suggestions are welcome)!! I am so glad that he's my new friend😆",3,1733668950.0,objectum_sfw,0,1.0,False
1h9k8wm,https://www.reddit.com/gallery/1h9k8wm,The world wants men to fail,I'm currently resisting the urge to eat everything in the fridge out of depression.,0,1733668930.0,tinfoilhat,1,0.5,False
1h9k8u5,https://www.reddit.com/r/publishing/comments/1h9k8u5/the_great_turtle_tour/,The Great Turtle Tour,"https://i.imgur.com/0kalnSi.png
Prologue: Jacky's Redemption and Callia's Shock
https://i.imgur.com/4hzRWCM.jpeg

A year earlier, “Jacky” Stone was a different man. The bar was dimly lit, the air thick with the smell of spilled beer and stale cigarettes.  sat at the counter, nursing his fifth—or was it his sixth?—glass of whiskey. His massive frame hunched over the drink, his blue eyes dark as the lake he grew up near, staring into the amber liquid as though it held the answers to questions he didn’t dare ask.

When the shove came, it wasn’t unexpected. Bars like this always had someone looking for trouble, and Jacky’s size made him a magnet for insecure tough guys who wanted to prove themselves. Normally, he’d shrug it off.  hated violence when he was sober. But tonight, he wasn’t sober.

“You gonna move, big guy?” the man sneered, his smaller frame puffed up like a rooster in a barnyard.he sighed, setting down his glass. “You don’t want this,” he said softly, his voice rumbling like distant thunder.

But the man wanted it. And so did his six friends.

What followed was chaos. wasn’t just big; he was fast, a mountain that moved like a storm. Growing up as white boy in the ghetto, he’d learned to fight young—it was a skill you needed when the world didn’t give you much choice. His punches landed like sledgehammers, his movements calculated and relentless. Blood spilled—some his, mostly theirs—until the bar was a wreck and stood alone, panting, a predator surrounded by fallen prey.


The cops arrived, weapons drawn, shouting commands. turned slowly, his face a grotesque mix of blood and a crooked, open-mouthed smile. He dropped to his knees, raising his hands. The fight was over.


Prison was the next chapter, but even there, made an impact. His time behind bars was short—six months, reduced for good behavior—but it wasn’t wasted. He reorganized the jail’s chaotic cell system, rebuilt the crumbling library shelves, and donated his own money to replace the jail’s outdated books and supplies.


When the photo of presenting a $500,000 check to the six men he had beaten went public, it made waves. He promised to pay their hospital bills and provide ongoing support for their recovery. The gesture stunned everyone. The donation to the jail, the thoughtful reorganization of its resources, and his commitment to sobriety earned him the respect of the community—and the attention of one 

Callia ""Calli"" Hartman.
Callia’s Prologue: Coffee and Confusion
Callia sipped her coffee slowly, enjoying the quiet of her morning. Her small art studio was bathed in soft light, brushes and canvases scattered around the space like a colorful explosion. She had just finished grading a stack of papers from her elementary school art students when her phone buzzed.
It was a news alert.


Curious, she clicked on it—and promptly spit her coffee all over her sketchbook.


“Jacky?!”


The headline read: “Local Giant Turns Over New Leaf: From Bar Brawl to Redemption.” There he was, her best friend since childhood, towering in the center of a photo, handing over a check to the men he had nearly destroyed months earlier. His expression was subdued, almost shy, but his eyes carried that familiar spark she hadn’t seen in years.

Callia couldn’t help but laugh, a mix of exasperation and affection bubbling to the surface. Typical Jacky. Even when he screwed up, he somehow found a way to make it right—and make a scene doing it.

She read the article twice, her mind swirling with memories. had always been larger than life, not just in size but in heart. They’d drifted apart over the years, life pulling them in different directions, but the bond between them never fully faded. Seeing him now, after all this time, brought a flood of emotions she wasn’t ready to unpack.

She grabbed her phone, her fingers hovering over his contact. She hadn’t spoken to him in months, years, maybe longer. What could she even say? Before she could decide, her phone buzzed again—a text from him.
`Jacky: ""Hey, Cal. Are you busy?""
Callia stared at the message, her heart pounding. She didn’t know what he wanted, but she had a feeling life was about to get a lot more interesting.
Callia: ""Depends. Are you about to talk me into something crazy?""
His reply came almost instantly.
Jacky: ""Always.""

https://i.imgur.com/hbDYoN2.jpeg
Chapter 1: Seeds of the Past
The quiet hum of Jacky’s ancient laptop filled the cramped Milwaukee apartment as he reread the email Callia had sent the night before. It was simple, even friendly—like so many messages they had exchanged over the years. Yet, there was something unspoken in her words, a crack in her normally unshakable exterior.

“Hey, Jacky,That sounds great, Been thinking about you a lot lately. We should catch up. Call me when you can.—Callia”

 Leaned back in his chair, the springs groaning under his weight. His arms stretched wide and muscles made the shirt tight around his skin. He absentmindedly scratched his goatee, eyes drifting to the photo pinned above his desk—a snapshot of him and Callia on a summer day, barefoot at the river. Her smile had been as radiant as the sun that day, but it was her eyes he couldn’t forget: green like gemstone pools.

The years had been unkind to him. At thirty-nine, his body carried the scars of a lifetime’s worth of battles—most of them fought against himself. The fainting spells had worsened. The hallucinations were harder to shake. And the truth, which he rarely voiced, was becoming impossible to ignore: his time was running out.

Still, the thought of seeing Callia made his chest tighten. She was always a whirlwind, a storm in human form—bursting into his life with color and chaos, leaving behind a mess of feelings he’d never quite sorted through. She was the one that got away in every way that Mattered. And she was also his best friend, the only person who had ever truly seen him.

His phone buzzed, snapping him back to the present. It was Callia.

“Hey, Jacky!” Her voice was as lively as ever, though he caught the slight hesitation beneath it.“Callia,” he replied, leaning forward. “What’s up?”“Not much. Just… I don’t know. I Need to hear your voice, I guess.”

That was how it always started with them—some vague excuse, a half-explained reason, until the truth finally bubbled to the surface. He waited.

“You know, I was thinking,” she continued. “Remember those road trips we used to dream about? Just you and me, no destination, no plans?” Chuckled. “Yeah. I remember you saying we’d end up broke and stranded in the middle of nowhere.”“Well, I think it’s time we found out.”

The words hung in the air. For a moment, wasn’t sure he’d heard her right.

“You’re serious?” he asked.“As serious as I can be,” she said, her voice softening. “I need this, Jacky. We need this.”

He leaned back again, the springs groaning in protest. It wasn’t just about the trip. It never was with Callia. There was something behind her words, a plea she wasn’t saying outright.

“I don’t know, Callia,” he said after a moment. “It’s been years since we’ve done anything like that. You’ve got Micah, your job—”“That’s the thing,” she interrupted. “Micah’s fine with it. He knows how much you mean to me. And work… I just need a break. From everything.”

She didn’t elaborate, but she didn’t have to. knew Callia well enough to hear the strain in her voice. He thought of all the times she had been there for him—when his first dog, Duke, died; when his marriage crumbled; when his health began to fail. She had always shown up, no questions asked.

“Okay,” he said finally.“Okay?” she echoed, surprise laced with relief.“Yeah. Let’s do it. Just tell me when and where.”

She laughed, the sound like a warm breeze cutting through the heaviness of the moment. “You won’t regret it, Jacky. I promise.”

As the call ended, stared at the photo on his desk again. For the first time in years, a flicker of excitement stirred in his chest.

He didn’t know where the road would take them, but he knew one thing for sure: it was a journey he couldn’t afford to miss.

Chapter 2: A Reluctant Yes
The rhythmic tapping of Callia’s ukulele filled the small, sunlit condo as she plucked aimlessly at the strings. Halyi, her aging Golden Retriever, lay sprawled on the carpet, snoring softly. Callia’s mind wasn’t on music, though. It was racing, tumbling through memories and second-guessing her own impulsiveness.

Author's Foreword

As a writer, I’ve always believed that stories are more than just words on a page—they are vessels of emotion, connection, and the complex, often messy, journey of life. This story is no exception. It’s a reflection on love, loss, and the inexplicable ways in which the past and present collide.
The relationship between Callia and Jacky was built on years of friendship, unspoken feelings, and shared memories. But at its core, it was always about resilience—both in the face of their own challenges and in how they navigated the twists and turns of life together. Their bond is something I’ve always found inspiring, and writing about it allowed me to explore not just the beauty of a deep connection, but also the heavy burden of unexpressed love and the healing power of time.
As the story unfolds, it becomes more than just a love story. It’s a testament to the complexity of human relationships and how, sometimes, the most meaningful connections defy time and even death. What I hope readers will take away from this is that love never truly fades; it changes shape, evolves, and finds ways to remain present in our lives, even when we least expect it.
This book wouldn’t exist without the characters who breathed life into it. Callia’s strength and vulnerability, Jacky’s charm and loyalty—these two characters have been with me from the start, and I hope they find a place in your heart as they did in mine. Their journey was never meant to be easy, but it was always meant to be worth it.
To everyone who’s ever loved, lost, or struggled to make sense of the forces that shape their lives—this story is for you. It’s a reminder that the people we care about never truly leave us. They may change form, but they stay with us in ways we never expect. I hope you enjoy reading this as much as I enjoyed writing it.
Thank you for joining me on this journey",0,1733668924.0,publishing,1,0.17,False
1h9k8nq,https://www.reddit.com/r/pourover/comments/1h9k8nq/keeping_coffee_warm/,Keeping Coffee Warm?,"Hi All, 

I’m just getting into pour overs.  I ordered a v60 size 3, a hario 1 liter carafe and oxo kettle.  I want to brew 4 to 6+ cups at a time so I can just keep drinking throughout the morning. How do you guys keep your coffee warm after filling up the carafe?  Can I put it on the kettle plate that can hold the temperature? Or should I be buying an insulated one?",2,1733668911.0,pourover,4,1.0,False
1h9k8ic,https://www.reddit.com/r/kroger/comments/1h9k8ic/not_getting_any_christmas_related_product/,Not getting any Christmas related product?,"Is anybody getting anything relating to Christmas items, such as holiday items for the holiday endcaps? 

We got maybe a single shipment or two of endcap items, such as Refrigerated cookies, Creamers, Ice Cream, Gingerbread, Cookie Mix, Coffee... the list goes on. Our endcaps are bare and its kind of rediculous.

AFAIK, the items are not inactive. They just keep getting scratched... order after order.  Anyone got an idea of whats going on? Its never been this bare of holiday items in past years for us.


Roundys Div, coming out of Oconomowoc warehouse.  Thanks guys",1,1733668901.0,kroger,2,0.99,False
1h9k7so,https://i.redd.it/g8kkkavjzm5e1.jpeg,Iced coffee must have already had its coffee,,8,1733668840.0,facesinthings,0,0.91,False
1h9k7la,https://www.reddit.com/r/starbucks/comments/1h9k7la/how_do_i_order_a_decaf_frappucino/,How do I order a decaf Frappucino?,"The last time I ordered a large decaf Frappucino, they gave me a cream Frappucino with no coffee inside!  I complained and they made me order an additional 4 decaf shots to add the coffee element. The total order cost me $15!

Previously, for years they used to just make me a decaf frap for the same price as a regular frap and substitute the decaf shots without charging for them.

How exactly do i order a decaf frap without it costing a fortune? 

Edit: If someone could post a screenshot of the specific page from the beverage resource manual, that would resolve the issue once and for all.  There are literally hundreds of posts in this subreddit that ask the same question. (Baristas here are claiming they can't find it in the manual.)",17,1733668822.0,starbucks,26,0.68,False
1h9k6vw,https://www.reddit.com/r/AskChicago/comments/1h9k6vw/help_what_neighborhood_to_move_to/,*HELP* What Neighborhood to Move to?,"As the title reads, I am looking for some assistance in finding out what neighborhood to move to in Chicago as my significant other and I will be relocating in the coming months.  Context below:

I am a white M31 and my significant other is a black F26.  We are moving to the area from Kentucky as she will be attending either Northwestern Medicine's radiography program or Malcolm X's radiography program this coming summer.  We would like to be in a ""quieter"" more residential area so as to be able to get away from the hustle and bustle when we please.  As well as being able to walk around and feel safe after hours.  Being within walking distance of grocery stores, markets and a gym would be nice too.  We have two dogs, so not living in a high rise would be ideal and more of a 3 or 4 unit home would be our preference if possible.  We have explored the following options and are leaning towards Wicker Park/Bucktown thus far (Wicker Park, Bucktown, Wrigleyville, Lake View East).  We were told that Lincoln Park could be a good fit as well as Old Town by some locals who we have befriended over our several trips to the area.  We aren't massive on nightlife/bars/drinking, but do enjoy to go see live music, eat at good restaurants and coffee shops on the weekends.  We also enjoy sporting events but can get to any of those quite easily with public transit.  When it comes to price point I can spend up to, but no more than, $3000 a month on living accomodations.

Any and all insight from the local community would be incredible as I want to make sure that my SO feels as comfortable as possible during this transition. ",0,1733668762.0,AskChicago,7,0.15,False
1h9k6b5,https://www.reddit.com/r/scarystories/comments/1h9k6b5/top_hat_ferrets/,Top hat & ferrets,"Story time. 

So when I was a kid, my mother, my sister & I all moved out to Hawaii to see my mother's friend that lived out there. We packed our things & headed to the tropical paradise. While sitting on the plane, my mother had all of our money we were gonna use to start our lives out there in the form of cashiers checks, in her zipped up wallet, in the bottom of her carry on. We landed, we were all pretty tired from the flight, so we thought we'd go get some coffee at the airport. We walk for a bit, then we see a big round table outside of a coffee shop & my mother starts frantically looking through her carry on & then dumps the contents out onto the table we were all sitting at. The money was GONE. To this day, we never recovered the money & have no idea how someone was able to steal it. 

That's story one. 

Story two. 

We've been living in Hawaii for about a year or so at this point. We ended up moving in with my mother's friend, due to all our money getting stolen on the flight there. 
My sister & I absolutely loved walking around the dried lava fields, exploring the caves that it would form. We were so adventurous, we would walk around everywhere. We didn't even wear shoes, no one really does over there.
So, on one of our fun adventures, we stop at this field with very tall grass/weeds. We stop for a second & take in the sight of just how beautiful everything was, when all of a sudden we see this top hat bouncing in & out of sight on the top of the grass/weeds. In front of whatever we were seeing were two ferrets, one white, one black. We were stunned.. we had no idea what we were witnessing. We run back to the house to tell our mother what happened. 
Back then, my mother was an avid listener of a very popular radio show called NPR. Seeing what this subreddit is about, y'all probably know what it is or most likely at least heard of it. 
We were all laying down, ready to go to bed. As we were telling our mother what we saw just a couple hours before, NPR is quietly playing the background. We hear someone call in & they tell the host something they saw that day & they explained to a T, exactly what my sister & I saw earlier. We all couldn't believe it. We all instantly thought, ""no wayyyy"", but nope, it was real. 
Man, just thinking back on this story is giving me goosebumps..",1,1733668709.0,scarystories,0,1.0,False
