id,url,title,text,score,created_utc,subreddit,num_comments,upvote_ratio,over_18
1g6sfrv,https://www.reddit.com/r/pcmasterrace/comments/1g6sfrv/i_spilled_cold_coffee_on_my_pc/,I spilled cold coffee on my PC,"I spilled Coffee on my pc today, it wasnt much Just a few drops but i think it got on the gpu, my pc was on but i shut it down inmidiatly, i think i need to open the gpu and clean it with alcohol, any recomendatios for opening my gpu or cleaning?

I unfortunately can't clean it now since I don't have alcohol. Not only that, but I'm at the university right now and won't be home until 9. So, I'll need to do it tomorrow. Is there a problem with that?",1,1729284739.0,pcmasterrace,6,1.0,False
1g6sfr0,https://www.reddit.com/gallery/1g6sfr0,Using exposed dowels as screws?,"Hello! Building a little coffee table here and would like to fasten the 2x6 boards to the 2x 2x10 supports using dowels. I’ve added a reference photo here where I’ve seen it done. 

Wondering will this be enough support for the table, or would it be better/more efficient to counter sink screws and plug it with tiny dowel buttons for the look? 

Basically, what’s the best way to go about achieving this look, making a secure table. 

",1,1729284737.0,woodworking,1,0.99,False
1g6sf8n,https://www.reddit.com/r/adhdwomen/comments/1g6sf8n/i_literally_forgot_i_was_dating_someone_they/,I literally forgot I was dating someone. They blocked me.,"I was dating a guy for about 3 months, talking almost every day (I'm terrible at responding and whenever I'm super burnt out, have a bad can't-get-out-of bad day or a hyperfocus session I forget my phone exists too). 

It was getting serious, we had ""the talk"", all was great. Until I went on a trip with my best friend for about a week (mid september) and when I came back he had just left for a 2 week family vacation. We had talked about this obviously, I knew he was leaving but we didn't talk much while I was on my trip and after I came back to reality getting back into routine was SUPER hard. I had millions of chores and it took me a week to just shower and unpack my bags, all while having to WFH too while making even more of a mess. Then it took me a couple more weeks to recover from that and catch up on the work I couldn't focus enough to do. 

Anyways, I'm ""back"" on my routine (of having a couple productive days a week) and I feel like I'm missing something... OH GOD I HAVE NOT ANSWERED ANY OF HIS TEXTS IN 2 WEEKS. I guess he thought I was ghosting him because he blocked me after a couple tries.

This is not the 1st time it happens either (this was a little more extreme though) but I have fucked up many relationships because I forget to *want* to meet up with them, I'm too tired or forget to text back. I genuinely enjoy getting to know these people (for the most part) but I always get the same ""I'm sorry I feel like you don't like me as much as I do as you don't seem interested"". I AM!!! But ""out of sight out of mind"", I don't feel the need to see them but if I hang out with them or if I were to randomly see them on the street I'd be the happiest person on earth.

Is this normal or am i just an asshole??? Am I too self-centered? I could only think about getting back into routine, showering, trying to do (very simple) tasks for myself, only person I talked to was the guy from the coffee shop next door. Not in a depressed way it was exactly what I wanted and needed.

I live in a different country from my friends and family and I think I have the same issue with them until I go back and see them face to face. If they need anything from me they just call because they know it takes me weeks sometimes. ",0,1729284695.0,adhdwomen,5,0.5,False
1g6sb63,https://www.reddit.com/r/DunkinDonuts/comments/1g6sb63/coffee_temperature/,Coffee temperature?,Does anyone know what the regulation coffee temperature is supposed to be? My inner thighs are blistering because incompetence. The manager told me they keep it at 201°.,1,1729284398.0,DunkinDonuts,3,0.67,False
1g6sa7l,https://www.ozbargain.com.au/node/872265?utm_campaign=redditozbnew&utm_medium=reddit&utm_source=reddit,The Killer Coffee Co Cold Brew Coffee Can Packs BOGOF (Save up to $96). Free Shipping over $50,,1,1729284329.0,OzBargainNew,1,1.0,False
