id,url,title,text,score,created_utc,subreddit,num_comments,upvote_ratio,over_18
1q57ttu,https://www.reddit.com/r/DVLT/comments/1q57ttu/the_night_watch_season_3_episode_1blood_for_blood/,"The Night Watch - Season 3, Episode 1(Blood For Blood) - 1-5-26","https://reddit.com/link/1q57ttu/video/yb2g8a6j7nbg1/player

Welcome back, Watchmen!  Let's analyze!

We stood on the shores of the weekend, wondering if the Friday resurrection was a dream.  Under the light of the New Year's starry sky came the answer.  Pre-market opened with a gap up to $1.23, leaving the dollar mark far behind.  Before most of the world had their first coffee, price had already surged to test $1.38, pulled back to find footing at $1.19, and coiled for the strike.

The opening bell rang, the gates swung wide, and 17 million shares changed hands in the first few minutes alone.  Price sprung from $1.31, and after a brief pause around $1.35, launched even higher, until we tagged the psychological fortress of $1.50.

Anyone that had merchants at $0.50 was up 150% in three days.  The rejection was absolute.  Price was sent tumbling back down to test the resolve of the new buyers.  It found a floor at $1.13 in the mid-morning, carving out a massive new demand zone.  From there, the climb was mechanical.  Continuing the fight through $1.28 and reclaiming $1.35, we spent the afternoon gathering forces just outside the gates of the $1.45-$1.50 zone, closing the day at $1.44.

The After Hours session saw a brief scare, dipping to test $1.10, but price bounced back and finished at $1.39.  The battles for pennies are no more.  Now, we fight for dollars.

The Catalyst: Amidst the roar of the ticker, a new signal emerged.  DVLT has struck a deal with Available Infrastructure.  The details are technical, but the implication is massive: we are acquiring new IP to bolster the ecosystem.  But here is the shadow cast by the light—the seller of this IP is not publicly known.  Has a silent partner entered the game, handing us a weapon, and remaining in the dark?  Is it a friend?  A former enemy?  We don't know, but the market loves the mystery.  Let's look at the charts.

https://preview.redd.it/q2pehoez8nbg1.png?width=1172&format=png&auto=webp&s=a2f1936a7b798f3c4267556f8407643abdb0e736

Looking at the daily, we can officially state that the downtrend has indeed been broken.  We can see that price has regained the orange 100-day average and is rapidly approaching the 50-day as well.  This isn't something you see every day.  The price drop from $4 was so fast, the MA's didn't have time to cross back to the downside.  We may see some resistance from the 50, and likely from $1.90 as well before we place the $2 castle under siege.  Let's dive a little deeper.

https://preview.redd.it/d0udkzfeanbg1.png?width=877&format=png&auto=webp&s=ef35493ade35876c21897088c5634eea2fae4a56

Zooming in on the hourly, I would like to point out that the drop in AH absorbed all of the demand created during the normal session, and came right back to nest in that $1.40 zone.  If it had been some massive selloff, it would not have been likely to bounce back that easily.  Seems like it coincided with the re-release of the AP PR, and people got spooked before reading.  Based on the order book, and the rejection from the first test, the supply above around $1.50 should prove to be a formidable defense.  I'm sure we will see tomorrow.  Let's dive a little deeper and honor our...

Candle!

Of!

The!

Day!!!

https://preview.redd.it/etgdbwwbcnbg1.png?width=1404&format=png&auto=webp&s=09ff111c36e7b542718029f2b47ade59701229ac

Today's trophy is awarded to the highest volume, highest reaching candle of the morn!  For the briefest of moments you shared the glory of $1.50, before the greed of men pulled you away.  We appreciate your efforts, friend.

**Forecasts**:

**Best Case:** Rally continues on massive volume again, fueled by people wanting in for the record date and upcoming catalysts.  Gap up over $1.50 to open, smash resistance overhead at $1.70 and $1.90, close at/above $2.

**Worst Case:** Price bumps its head on $1.50 again from heavy profit taking.  Lower than recent volume doesn't have the strength to break it and price flounders around $1.30-$1.40.

**Most Likely:** I think we will fight over $1.50 for a bit more before volume spikes and it eventually falls.  I then see another rejection from the 50-day SMA and/or the supply @ \~$1.70 before another volume spike takes us through those.  Rejection from the \~$1.90 supply zone, closing back down around $1.60.

Season 2 was about betrayal.  Season 3 is about vengeance.  We were stabbed.  Bleeding out, and left for dead.  We were thrown into the oceans of despair, to drown in our own miseries.  We were dead, floating on the surface of an endless void.  But we were resurrected, as is the phoenix from the ashes of what once was, and given purpose: to destroy the enemy that had plagued us in the previous life.  It seems the Ironborn may have been right:  *What is dead, may never die*.  

The Night Watch stands.

\---------------------------

If any of you would like to help choose our CotD, please inbox me with the time(and timezone), volume, open, and close of your 5M candle choice. No PM or AH candles, please. Any submissions must be in my inbox by 11pm EST to be considered.

Also, if you would like to join me and the rest of The Watch in the DVLT Underground Discord server, this link should suffice. [https://discord.gg/HfQfDdrfs](https://discord.gg/HfQfDdrfs) I do live analysis there, calling new zones as they form and reporting on updates/answering questions for everyone there, so come and hang out and make some gains with us!

[buymeacoffee.com/ACLionellus](http://buymeacoffee.com/ACLionellus)

As always, I could be completely wrong about everything. None of this is to be considered as financial advice. Always perform your own DD before risking your capital.",23,1767670936.0,DVLT,7,1.0,False
1q57tf6,https://www.reddit.com/r/ChaseSapphire/comments/1q57tf6/chase_edit_hotel_review_kimpton_hotel_vintage/,Chase Edit Hotel Review - Kimpton Hotel Vintage Portland,"Stayed for two nights in Portland, which included New Year's Eve.

Good:

\- Booked 6 weeks before stay. Total Cost for Two Nights was $477.92; I used 2,500 UR points with with Points Boost, and was charged $427.92, which was immediately credited using one $250 Edit credit and balance of my $300 annual travel credit.

\- Received two vouchers for breakfast at Il Solito, the hotel restaurant, which was up to $30 per person, enough for an entree and coffee/drink.  Voucher does not cover tips.

\- Chase Travel had covered hotel amenity fee.

\- Informed of $100 credit upon checkin.

\- Thanks to CSR, I had IHG Platinum status, which meant I received an additional $10 per night for food beverage. (So $120 total credits.)

\- There was some confusion at the front desk about whether I would receive point for the stay, but 2 days after the stay, my received 5,155 IHG points for the stay and 600 point Platinum Elite bonus.

Bad:

\- No upgrades available; I also showed up at noon and was told no rooms were available yet. I did not try for late checkout, so did not have a chance to try ""guaranteed 4pm check out.""

\- If you spend less than $30 per person at breakfast, you can't use the ""balance"" for tips--they actually broke out the tips for each breakfast on the hotel bill.

\- Il Solito only serves breakfast, so they only other food option is the small bar in the lobby which has great drinks but meager food options.  We ended up spending our $120 in credits on drinks and desserts (and tips for breakfast).

\- Welcome ""amenity"" was a small bottle of sparkling water and two Lindt truffles.

\- IHG would not let me add my member number until check-in at the front desk.  


Overall, I think the Edit experience went smoothly and we would definitely repeat.  Looking forward to using our Edit credits again at a future Kimpton, which will hopefully have better food options.",9,1767670905.0,ChaseSapphire,7,1.0,False
1q57t9e,https://www.reddit.com/gallery/1q57t9e,"Prices in Rancho Cordova, CA",The line wasn't too bad at dinner time tonight.,22,1767670892.0,innout,4,0.96,False
1q57sg3,https://www.reddit.com/gallery/1q57sg3,We walked the length of Manhattan today and this is everything we ate along the way,"1) G’s coffee shop Inwood - breakfast tacos with everything. 10/10 these were fantastic, slightly too spicy but in the best way, vibe in here was really nice, service was great. Would love to go back for the breakfast burrito

2) Kuro Kirin Espresso & Coffee - flat white, 8/10. Satisfied this coffee snob!

3) El Panadero Bakery on W 179th - tres leches cake. 10/10 this was really nice, moist and light, had much hilarity ordering because we didn’t speak Spanish and they couldn’t understand our British translation of tres leches. Eventually someone stepped in to translate. Very funny.

3) West side bagels on W 141 - everything bagel toasted with lox cream cheese. 6/10 this was small and very light, the cream cheese could have been more flavourful, bagel was fine nothing remarkable 

4) Sal and Carmine Pizza on Broadway - pepperoni pizza. 7/10, pretty good but the pepperoni had fennel in it which is quite a strong taste and not my personal preference

5) Maison Pickle - 24 layer chocolate cake. 6/10, this was good but not life changing, I’ve had better chocolate cake in New York. We only managed about 1/3 between two of us. The vibe in here was really nice, we sat at the bar and the staff were great, would love to go back for food

6) Los Tacos No 1 in Chelsea Market - one pork taco one chicken both con todo. 6/10 for the pork, 8/10 for the chicken. Found the pork a bit rich, the chicken was beautiful. 

We had planned to get dinner downtown but were too exhausted/full from a rich days eating so got an assortment of fruits and veggies and ate them back in the hotel.

I’m simultaneously surprised at how much we ate and surprised it wasn’t more?? Six stops doesn’t seem that many? The whole thing took just over nine hours of which 5.5 was walking and 3.5 ish was eating. A lot of fun - not sure I’d rush to do it again!",95,1767670832.0,FoodNYC,11,0.97,False
1q57rx6,https://www.reddit.com/r/Supplements/comments/1q57rx6/psa_if_ashwagandha_didnt_work_for_you_try_adding/,"PSA: If ashwagandha didn't work for you, try adding L-theanine. Here's why","For years, I had a low-grade anxiety that never left. It wasn't full-on panic attacks or anything, but more like a constant buzzing stress that made everything feel harder than it needed to be. Shoulders were always tense, I slept like shit, and I'd replay the tiniest interactions in my head for literal days.

I tried ashwagandha first (both regular and KSM-66) because everyone on here raves about it. It helped a bit with the physical stuff, but my brain was still going a million miles an hour esp before bedtime. Then someone posted here about L-theanine and how it targets the mental side more than the physical.

So I started taking them together and it really helped. I use to think of them as separate supplements when in reality they're like 2 pieces of a puzzle. It's like they each cover a different part of the anxiety thing. Ashwagandha helps my body chill out (less chest tightness, easier breathing), and L-theanine turns down the volume on all the thoughts that won't shut up.

THIS IS NOT A MIRACLE CURE and I'm not saying that I'm never anxious anymore. But it's the difference between white-knuckling my way through the day vs actually feeling like a person. I can drink coffee again without getting jittery, I can have a weird conversation and not dissect it for hours, and my whole baseline feels quieter.

The weirdest part is noticing when I forget to take them for a few days. That buzz comes right back and I'm like ""oh yeah, this is what I used to deal with 24/7.""

If you tried one or the other and it didn't really work, maybe try combining them both. Bodies are weird and complicated, sometimes you need more than one thing.

Daily dose: Ashwagandha 600mg and L-Theanine: 160mg. Feel free to mess around with the dose but this is what I find worked well for me. Best before coffee or bed in my experience.

Has anyone else had better luck combining these instead of just taking one? How many mg worked for you?

Edit: I won't share the brand publicly incase it goes against this subreddit's rules for posting links, but my DMs are open and I'm happy to share",2,1767670793.0,Supplements,5,0.75,False
1q57ri5,https://www.reddit.com/r/actualgyaru/comments/1q57ri5/gal_at_work_in_your_country/,GAL at work in your country.,"so in Japan I can wear my GAL make no matter what as long as my hair is pinned back and im in uniform (I work part time at Tulleys, a coffee house) but my friend in the states says she works as a medical assistant and cant wear her GAL make, I was curious if anyone here works in the medical field and does a toned down version of GAL make? she really hates that she is 5 days out of the week not in her GaL make. any examples would help thank you",4,1767670761.0,actualgyaru,1,1.0,False
1q57qlt,https://www.reddit.com/r/Torontoevents/comments/1q57qlt/vision_board_meetup_meet_new_friends_plan_your/,Vision Board Meetup - Meet New Friends & Plan Your Year Together,"Start your year with a vision board event where you can meet other students, young professionals and friends in the community while working on your goals.

You'll be working on your own vision board, but in a room full of people doing the same thing. We'll have dedicated time for both creating and connecting, meaning you're not just leaving with goals, you're leaving with new friends who share your values.

This is perfect if you:

* Want to meet people in a meaningful (not awkward) way
* Enjoy creative, collaborative activities
* Are looking for community around personal growth and intentional living
* Prefer small group settings to loud bars or rushed coffee chats

What makes this different from solo goal-setting: the energy of a group, shared inspiration, and the accountability that comes from planning your year alongside others who actually get it.

Whether you're a student finding your footing or young professional in the midst of their career, everyone's welcome. Grab a friend or come solo to meet people (that's what this is for!).

Event details: [https://luma.com/k7graw4v](https://luma.com/k7graw4v)

Cost: $20 for a physical board, or $12 for a digital version for your phone or laptop  
Location: UofT Schwartz Reisman Innovation Campus  
Time: 1:00 to 3:30 pm Saturday, January 10th",3,1767670689.0,Torontoevents,0,1.0,False
1q57qgg,https://i.redd.it/bej79x1hgnbg1.jpeg,What can I do to improve my teeth,"What can I do to improve my dental health? I brush twice a day, use mouthwash, and floss twice daily. I do drink coffee, but only in the morning. I’ve always kept up with my oral hygiene, yet my teeth still look like this. I’m wondering what else I can do to improve my teeth health. ",1,1767670677.0,askdentists,1,1.0,False
1q57on4,https://www.reddit.com/r/tokyoirl/comments/1q57on4/group_coffee_anyone_anytime_before_saturday/,Group coffee anyone? Anytime before Saturday.,"Just tell me your nationality, the day and time you want to join and I’ll organize around that. 

Will be in one of these cafes: 
https://maps.app.goo.gl/r2QFC45ykgG1VQP96?g_st=i",0,1767670535.0,tokyoirl,1,0.5,False
