id,url,title,text,score,created_utc,subreddit,num_comments,upvote_ratio,over_18
1tpjr9z,https://www.reddit.com/r/BabyBumpsCanada/comments/1tpjr9z/am_i_overthinking_how_hard_leaving_the_house_will/,Am I overthinking how hard leaving the house will be? [ca],"Is anyone else weirdly scared of not being able to just leave the house anymore?

I’m pregnant and obviously excited!! But lately I keep thinking about how different normal little things are going to feel. Like grabbing coffee, running into the grocery store, seeing friends, all the random stuff you don’t even think about now.

I know life doesn’t end after having a baby, but I keep seeing parents with so much stuff everywhere they go and I’m like… am I about to need a full strategy just to buy milk?

For moms who already have a baby, did leaving the house feel as overwhelming as it looks at first? What made it easier?",1,1779918448.0,BabyBumpsCanada,0,1.0,False
1tpjqvk,https://www.reddit.com/r/confessions/comments/1tpjqvk/i_drink_my_coffee_black/,I drink my coffee black,,1,1779918423.0,confessions,0,1.0,False
1tpjqf6,https://www.reddit.com/r/DIYHeatPumps/comments/1tpjqf6/thoughts_on_four_head_minisplit_for_small/,Thoughts on Four Head Minisplit For Small Bookstore/Cafe?,"Hi folks.  This group helped me install minisplits in my house last year - Gree Livo R32 four head 36K BTU, bought from HVACDIrect.com.  Thanks!

I am now installing minisplits in a small commercial building I am renovating.  It is actually an old house that I'm converting to bookstore/cafe on ground floor, office on second floor.

The bookstore/cafe has a coffee bar room (the old foyer, 200 sf), two seating rooms (the old living room and dining room, each about 200 sf), and a small commercial kitchen (the old kitchen, about 200 sf).  

I'm looking at four head 48K BTU systems with 12K wall units in each room.  The room size suggests 9K, but since there could sometimes be 20+ people inside plus baking in the kitchen, I thought I'd upsize - thinking primarily of AC capacity with all those bodies.  The walls and ceilings are currently open, so I have the opportunity to run the lines concealed.  

We're in Portland OR where it is pretty temperate, very seldom gets under 25F, a couple weeks a year above 95F but summer highs are usually more like 85F.  

I found a couple possible systems at HVACDirect: 

i) ACiQ ""Extreme"" system (with the double condensor unit)  [48,000 BTU ACIQ Extreme 23 SEER2 4 Zone Wall Mount Mini Split Heat Pump System - R454B | 230V - 12 + 12 + 12 + 12 - ACIQ-48Z-HH-M6C / ACIQ-12W-HH-MD-4 | HVACDirect.com](https://hvacdirect.com/48-000-btu-23-seer2-aciq-extreme-4-zone-wall-mount-mini-split-system-r454b-230v-12-12-12-12-203060.html)

ii) Gree ""Livo"" system [Gree 42,000 BTU Livo 21 SEER2 4 Zone Wall Mount Mini Split Heat Pump System - R32 | 230V - 12 + 12 + 12 + 12 - MUL42HP230V1R32AO / 4-LIV12HP230V1R32AH | HVACDirect.com](https://hvacdirect.com/42-000-btu-gree-livo-21-seer2-quad-zone-wall-mount-mini-split-heat-pump-system-r32-230v-12-12-12-12.html)

iii)  Mitsubishi ""GX"" (also with double condensor unit) [Mitsubishi 42,000 BTU GX-Series 21.5 SEER2 4 Zone Wall Mounted Mini Split Hyper Heat Pump System R454B | 230V - 12 + 12 + 12 + 12 - MXZ-SM42NLHZ / 4-MSZ-GX12NL | HVACDirect.com](https://hvacdirect.com/42000-btu-mitsubishi-gx-series-23-seer2-four-zone-wall-mounted-mini-split-hyper-heat-pump-system-r454b-200613.html)

Any thoughts on my approach and which you'd choose?  Thank you!

",1,1779918393.0,DIYHeatPumps,0,1.0,False
1tpjq4i,https://v.redd.it/edeo95dx2r3h1,Finally 100%'ed the coffee shop minigame,Imo best minigame in the game. I had a LOT of fun grinding these levels ,2,1779918374.0,NevernessToEverness,0,1.0,False
1tpjpjs,https://www.reddit.com/gallery/1tpjpjs,Baby Scooby,"Scooby 😍 new coffee pacman from Josh's Frogs. Already disappeared into the depths of the substrate, but I got these before they vanished 🐸 ",2,1779918337.0,pacmanfrog,0,1.0,False
1tpjpdy,https://i.redd.it/oxtia4co2r3h1.png,Anyone know about this restaurant opening?,"I saw this when I was searching for the Capitol Hill location. It's a Japanese restaurant chain with 2 current locations and according to google maps is opening a 3rd on Van Ry. I cant find any other info about this but it would be awesome if true.

Anyone else know by chance?",2,1779918327.0,mountlaketerrace,1,1.0,False
1tpjon0,https://www.reddit.com/r/honeymoonplanning/comments/1tpjon0/honeymoon_planning_janfeb_2027/,Honeymoon planning Jan/Feb 2027,"Hello! My fiancé and I are getting married in December, and since we are having a destination wedding we are pushing our honeymoon back until the holidays are over. I’m pretty open to anything but NO México. That’s where we are getting married and we have just been there too many times over the years! 

We enjoy a semi-walkable city/neighborhood with other bars/restaurants/shops around, or even a quick taxi ride away. We also enjoy going to the casino. Typically our days on vacation are relaxing at the beach or pool, dinner & bar hopping or shopping. We’re not huge on excursions but we are open to anything truly, but we’re not extremely adventurous. I am not tied down to an all inclusive resort considering we do like to explore the area a bit, but if it’s not all inclusive I would like it to be on the more reasonable side considering we do drink quite a bit so we get our money’s worth with that aspect of it. I would prefer it to also be adults only; but as long as the place isn’t overloaded with kids it’s whatever. Something I always look forward to and that can make or break a hotel for me is the food & bars! If the food & drinks are delicious and I can get a good spot at the pool, I’m happy. 

Some places we have been and loved: 

Aruba— stayed in the area with a casino, coffee, and shopping walkable from the Divi Resort. I love going into a local coffee shop! 

Playa del Carmen— we stay near 5th avenue so that we can spend the evening going to different bars & restaurants 

Cabo— stayed at the hard rock hotel and LOVED it. Food was delicious, vibes were immaculate! This was one of the only trips we have ever been on that we didn’t leave the resort except for one time to meet up with some friends who were also in Cabo at the time. 

Montego Bay— stayed at the S hotel and everything was so good. It was a smaller boutique hotel and we got great service & spots at the pool everyday with our own little cove to ourselves. The resort had an amazing coffee shop inside with great smoothies and coffees. One of my favorite things to this day! 

We have also visited various islands while cruising but nothing that stuck out to us in particular, but didn’t have much planned at any of the ports so that could be why we maybe feel like we weren’t missing out on much. 

Send me your suggestions! Pretty much anything goes but a must is great food, drinks, good vibes and great service at the hotel! Budget is semi-flexible but definitely not more than 10k. I would go back to any of these places in a heartbeat, but really looking to go somewhere new on our honeymoon for some new memories together 🫶🏼",1,1779918279.0,honeymoonplanning,0,1.0,False
1tpjoh9,https://www.reddit.com/gallery/1tpjoh9,This GC Ophidia tote has officially become my everyday carry,"I bought this thinking it would just be a good practical everyday tote and somehow it ended up becoming the bag I reach for without even thinking now😄

I’ve been using it nonstop since it arrived because it literally works with everything Casual outfits, errands, coffee runs, work stuff… it just fits into every situation so easily And I love that it holds a lot without looking overly huge or bulky on the shoulder
The Ophidia line has always been one of my favorites because it feels classic without trying too hard. Something about the GG canvas with the green and red stripe just looks so timeless to me",2,1779918269.0,RepReviews,0,1.0,False
1tpjmzf,https://www.reddit.com/r/DenverMeets/comments/1tpjmzf/newly_out_trans_woman_seeking_friends/,Newly out trans woman seeking friends,"Any LGBTQ folks (or others always welcome) that would want to be friend a newly out trans woman in her late 30s? Looking for friends who wouldn’t mind sharing makeup tips, coffee or lunches! ",1,1779918170.0,DenverMeets,0,1.0,False
1tpjmn2,https://www.reddit.com/r/cfs/comments/1tpjmn2/transition_chair_to_prevent_going_back_to_bed/,“Transition chair” to prevent going back to bed after waking up,"I find it really difficult to resist the “pull” of lying back down on my bed (not necessarily getting under the covers and going back to sleep - just lying on top of it).

I wake up, have coffee and breakfast, and then immediately want to lie back down on my bed and wait for my stimulants to kick in before I get up. 

I want to find a “transition chair” - something comfier than an office chair, that isn’t a mattress, but is still comfy and lounge-y enough to convince myself to sit there instead of my bed. Basically I want to ease myself up in “stages” rather than slide back to bed where I know I will wallow and not be productive. 

Has anyone out there tried this? Have you found your “transition chair” (slash-cot/chaise/etc.) that keeps you out of bed until you eventually wake up and start moving? Really struggling with this, so any ideas are very much welcome!",1,1779918148.0,cfs,1,1.0,False
1tpjmkc,https://i.redd.it/7u0drc7h2r3h1.jpeg,"I have 3 NIB Cafelat Robots available for sale. Orange, blue and green colors. $595 plus shipping. I have Pirate Ship, so decent shipping rates. Please PM if interested.",,0,1779918143.0,CafelatRobot,0,0.33,False
1tpjlrh,https://i.redd.it/ji01sf4r1r3h1.jpeg,Filter set to Woman only. Why is this like 1/5 swipes. Please bumble do something.,The amount of men when im searching for a female partner is absurd,0,1779918092.0,Bumble,2,0.33,False
1tpjlpw,https://www.reddit.com/r/webkinzbuyselltrade/comments/1tpjlpw/selling/,SELLING!!!,"Hi there guys! I’m selling some more Retired/Promo/Seasonal/PSI Items!!!

Sales vary from $0.50-$17.00!!

VENMO ONLY!!!

[https://wtu.camr.ws/list?id=5975](https://wtu.camr.ws/list?id=5975)

Message me if you are interested!!!

https://preview.redd.it/a4k9u04a2r3h1.png?width=1022&format=png&auto=webp&s=ceada1d914c5e9789635f2a91cb06c6a5e948a4b

",0,1779918089.0,webkinzbuyselltrade,0,0.33,False
1tpjlmt,https://www.eventbrite.com/e/luckin-coffee-omakase-tasting-experience-tickets-1989326939427,"If you. Like Coffee Luckin Coffee Omakase Tasting Experience Tickets, Multiple dates | Eventbrite",,1,1779918083.0,nycadventures,0,1.0,False
1tpjk1j,https://i.redd.it/qae3oruz1r3h1.jpeg,Coffee grinder review pls!!,Hi guys can you pls help me with grinder as I’m thinking of buying this grinder for my coffee machine ( vantro ) and I don’t want to spend lot of money on grinder and can you also pls suggest me coffee beans ,1,1779917983.0,IndiaCoffee,0,1.0,False
1tpjjqx,https://www.eventbrite.com/e/luckin-coffee-omakase-tasting-experience-tickets-1989326939427,"If you. Like Coffee Luckin Coffee Omakase Tasting Experience Tickets, Multiple dates | Eventbrite","Luckin Coffee Omakase Tasting Experience

By

Luckin Coffee

33 followers

0 events

Follow

261 3rd AveNew York, NY

Multiple dates

Overview

Join us for a 35 minute guided tasting led by Anthony Douglas, 2022 World Barista Champion on June 2 & 3rd.

For two days only, Anthony Douglas is leading an intimate, hands-on tasting experience — with multiple time slots across both days, so you can find one that fits your schedule.

This is a guided session in how to actually taste what's in your cup: where coffee comes from, what roast does to it, and the markers world-class judges use to separate a good cup from a great one.",1,1779917963.0,nyc_forfree,0,1.0,False
1tpjjeq,https://i.redd.it/xv9h6olv1r3h1.jpeg,She is still active on her account. She cleaned up her reposted reels today (or yesterday) and has also been following and unfollowing accounts ;d,,2,1779917942.0,glitterandbagelssnark,2,1.0,False
1tpjio4,https://i.redd.it/fe5jcyeq1r3h1.jpeg,Why Going Outside Makes A Day Feel Longer,"Same Day, Different Universe

Novelty and time perception explain why going outside can make one ordinary day feel strangely larger. Why does time feel faster when you stay home all day? Usually because your brain gets fewer scene changes, fewer social cues, and fewer little “wait, where was I?” markers to separate the hours.

A day indoors can be perfectly fine, obviously. Humanity has achieved great things under blankets. But if every hour happens in the same room, with the same chair, same screen, same snack crumbs judging you, memory has less to organize. The day becomes one continuous folder named “misc.”

Outside adds boundaries. A short walk, a different street, a small conversation, a cafe, a sunset, even a weird pigeon doing business pigeon activities. None of that needs to be impressive. It just gives your mind more hooks.

Same 12 hours. More checkpoints. More proof that something actually happened.

So when a day disappears, was it short, or was it just under-documented?",4,1779917894.0,DumbFact,1,1.0,False
1tpjhc0,https://koreajoongangdaily.joins.com/news/2026-05-28/opinion/columns/Starbucks-and-the-siren-of-hatred/2602308,Starbucks and the siren of hatred,"TL;DR:

- The author is an editorial writer at the JoongAng Ilbo.
- The recent Starbucks Korea controversy has made me question my own literacy. I once laughed at stories about younger Koreans asking, “Where is Ucheon?
- Shinsegae Group Chairman Chung Yong-jin bows his head in apology for the controversy surrounding Starbucks Korea’s “Tank Day” event at the Josun Palace hotel in Gangnam District,…

The author is an editorial writer at the JoongAng Ilbo.

The recent Starbucks Korea controversy has made me question my own literacy. I once laughed at stories about younger Koreans asking, “Where is Ucheon?” after reading notices saying an event would move indoors “in case of rain” ( ucheon-si in Korean, which sounds like the name of a city). But confronted with the marketing controversy surrounding Starbucks Korea, I, too, became a consumer unable to fully grasp the meaning behind what I was seeing.

Shinsegae Group Chairman Chung Yong-jin bows his head in apology for the controversy surrounding Starbucks Korea’s “Tank Day” event at the Josun Palace hotel in Gangnam District, southern Seoul, on May 26. \[KIM KYUNG-ROK\]

Only belatedly did I recognize the seriousness of the “Tank Day” controversy, accused of mocking the May 18 Gwangju Democratization Movement, a pivotal pro-democracy uprising violently suppressed by the military dictatorship. The debate became even more confusing by turning into a partisan conflict ahead of the June 3 local elections. My first instinct was disbelief: Surely, no company would intentionally design such a campaign.

The accusations, however, accumulated. Critics pointed to the 503-milliliter (17-ounce) capacity of a military-themed tumbler, matching former President Park Geun-hye’s prison identification number. A “Tank Duo Set” carried a 21 percent discount, corresponding to May 21, the date when troops opened fire on civilians in Gwangju in 1980. Starbucks Korea also released a mug featuring its siren logo on April 16, 2024, the 10th anniversary of the Sewol ferry disaster. At first, some of the claims seemed excessive, even conspiratorial.

Now, however, I believe that society needs to raise its level of vigilance.

Part of that shift came after reports on May 19 of a rapper who had canceled his concert, set to take place last Saturday. The performer had planned the event to coincide with the anniversary of former President Roh Moo-hyun’s death. The Roh Moo-hyun Foundation filed for an injunction after finding that the rapper’s lyrics contained phrases such as “jump like Roh Moo-hyun,” widely interpreted as mocking Roh’s death by suicide. Even the symbolism surrounding the event drew criticism: The concert was scheduled for 5:23 p.m., and tickets cost 52,300 won ($35) — references to the date of Roh’s death on May 23. The foundation declared that it would respond firmly to “all attempts to hide behind freedom of expression while damaging community values and insulting historical pain.”

The rapper later posted a handwritten apology on Instagram. He admitted that he had mocked and insulted the late president simply for attention and entertainment. But one wonders how much sincerity can truly exist in a reflection written less than a day after the concert’s cancellation.

The case demonstrates how hatred, mockery and humiliation can become forms of entertainment in the age of social media. Just as children sometimes repeat offensive language without understanding its meaning, ridicule of the Gwangju uprising and mockery of disaster victims now circulate casually online. According to experts, expressions once confined to fringe internet communities have gradually spread into mainstream culture and even influenced corporate marketing.

That is why critics believe that the language of hatred may have seeped into campaigns such as Tank Day or the siren mug. The phenomenon resembles what is known as a dog whistle, a coded message recognizable only to insiders while remaining invisible to the broader public. Similar examples appeared during the 2022 presidential election, when then-candidate Yoon Suk Yeol and his supporters posted anchovies and soybeans online to spread the anticommunist “myeolgong challenge” — a wordplay combining the “meol” from anchovies ( myeolchi in Korean) and the “gong” from beans ( kong ), echoing the Korean term myeolgong , meaning “destroy communism.” The symbolism was largely understood only within conservative online circles. The controversy grew larger because Shinsegae Group Chairman Chung Yong-jin also became associated with the campaign.

Members of a civic organization hold a protest against Shinsegae Group, the owner of Starbucks Korea, following the coffee franchise's ″Tank Day″ promotion in Gwanghwamun, central Seoul, on May 27. The poster displays a photo of Chung Yong-jin, the chairman of Shinsegae Group. \[YONHAP\]

No evidence has confirmed intentional wrongdoing by Starbucks Korea. The suggestion that the company deliberately used its mythological siren logo to evoke the Sewol disaster would ordinarily sound absurd. But in an environment saturated with coded hatred and political signaling, people are no longer quick to dismiss suspicion.

If a company wishes to be regarded as a national brand trusted by the public, it must do more than complain about unfair accusations; it should actively seek the truth. That process could become an opportunity to reaffirm the values a democratic society must protect: respect for the sacrifices made for democracy and solidarity with victims of national tragedy. Attempts to trivialize those experiences through ridicule or hidden symbolism will continue to face scrutiny.

Starbucks’s siren logo is said to share its origin with another definition of “siren” — a warning signal. Perhaps this controversy should also be heard as a warning siren for a society increasingly shaped by hatred.

This article was originally written in Korean and translated by a bilingual reporter with the help of generative AI tools. It was then edited by a native English-speaking editor. All AI-assisted translations are reviewed and refined by our newsroom.

Source: [https://koreajoongangdaily.joins.com/news/2026-05-28/opinion/columns/Starbucks-and-the-siren-of-hatred/2602308](https://koreajoongangdaily.joins.com/news/2026-05-28/opinion/columns/Starbucks-and-the-siren-of-hatred/2602308)",1,1779917811.0,KoreaNewsfeed,0,1.0,False
1tpjgmc,https://www.reddit.com/r/ViewsToRevenue/comments/1tpjgmc/local_seo_is_having_a_moment_small_businesses_are/,Local SEO is having a moment. Small businesses are beating big brands with this one tactic,"Big brands own national keywords.

But local keywords? Wide open.

Here's what's working for local businesses right now:

The tactic: Hyper-local content clusters

Instead of trying to rank for ""best coffee shop"" — impossible.

Rank for ""best coffee shop in \[neighbourhood\] for remote work"" — very possible.

How to build a local content cluster:

1. List every neighbourhood, district, and area you serve

2. Create a dedicated page for each: ""\[Service\] in \[Location\]""

3. Add genuinely local information — nearby landmarks, local events, community references

4. Interlink all location pages to a main service page

5. Get mentioned in local publications, blogs, and community groups

Results from a client we ran this for:

Local service business, mid-size city.

Published 24 location pages over 6 weeks.

Organic leads up 180% in 4 months.

Zero paid ads. Zero backlinks built.

Google Maps rankings followed the organic rankings up.

The mistake most local businesses make: one generic homepage trying to rank for everything.

The fix: many specific pages ranking for narrow searches.

\---

Anyone else running local SEO content clusters? What results are you seeing?",1,1779917767.0,ViewsToRevenue,0,1.0,False
1tpjg8t,https://www.reddit.com/r/AskTheWorld/comments/1tpjg8t/what_would_happen_in_your_country_if_coffee_was/,What would happen in your country if coffee ☕️ was only sold in liquor/beer stores to over 22 yr olds?,Age of majority ,2,1779917747.0,AskTheWorld,10,0.75,False
