id,url,title,text,score,created_utc,subreddit,num_comments,upvote_ratio,over_18
1j3s8ct,https://www.reddit.com/r/ConstipationAdvice/comments/1j3s8ct/23f_with_chronic_constipation_and_history_of/,23F with chronic constipation and history of eating disorder,"I am a 23 year old female and throughout my 20's I lost over 25 pounds, which I beleive damaged my digestive system. I have since somewhat recovered, I weigh 80 lbs and measure 5'4, but I know I still have a ways to go to gain weight. Ive been struggling to gain weight because I suffer from constipation which leaves me nauseous, full, and depressed. For breakfast, I usually have four slices of Dave's Killer Bread, thinly sliced, with coffee, a tsp of walnut butter, and a half an almond flour cookie at 7:30 AM. For lunch at 1:00 PM, I alternate between the following: have spring mix, one stick of celery, and three cherry tomatos with either of the options:

* Tuesday: half a cooked yellow squash, three spears of asparagus, and cooked lean beef
* Wednesday: half a cooked yellow squash, 1/4 a turnip, black eyed peas, chickpeas, or lentils and 1/2 avocado.
* Thursday and Friday: half a cooked yellow squash, 1/4 a turnip, boiled egg or cooked chicken breast and 1/2 avocado.
* Sunday, Monday: chicken soup or vegetable soup

For dinner I have the same every day: 1/2 cup of Dannon Light and Fit greek yogurt, two strawberries, 1/4 of an apple, peach, nectarine, pear, banana, 1/4 cup of blueberries, rasperries, cherries, grapes, mango and pineapple. This is followed by a homemade trail mix that has three of each: pecans, walnuts, cashews, almonds, pistachios, macadamias, with 1/2 a fig, 1/2 a date, 1/2 a prune, and 1/5 cup of peanuts. I always have a small slice of dark chocolate at the end for dessert. I drink a cup of peppermint tea with my dinner.

I have tried basil tea, peppermint drops, which do not help. I've tried Miralax and Magnesium, which help me have a daily bowel movement, but it is incomplete (very small, thin, and loose), it makes me bloated, and only makes my stool softer but still makes me strain. The only thing that helps me is sodium picosulfate at night, which I know is a stimulant laxative, my morning coffee, ox bile extract and a squatty potty, and this has only somewhat helped me, I have a daily bowel movement but it is small, feels incomplete and I get bloated throughout the day, unless I take 5mL sodium picosulfate at night, which is the only thing that truly provides me relief.  I wake up at 5 AM and do a 1.5 hour workout before breakfast, and I do anothe 30 minutes of cardio before dinner.

I know that fiber and water intake are not my issue since I consume a lot of fiber and a lot of water throughout the day.",1,1741140431.0,ConstipationAdvice,1,1.0,False
1j3s7hn,https://v.redd.it/co1m63284sme1,I found u/Icy-book2999 a coffee maker,,1,1741140362.0,LoveTrash,4,0.67,False
1j3s7gv,https://www.reddit.com/r/u_Massive_Anteater_915/comments/1j3s7gv/whats_the_best_coffee/,What’s the best coffee,,1,1741140360.0,u_Massive_Anteater_915,0,1.0,False
1j3s6gd,https://www.reddit.com/r/AskWomenOver30/comments/1j3s6gd/ex_that_blindsided_me_contacted_me_almost_6/,"Ex that blindsided me, contacted me almost 6 months later","I know you don’t know our relationship, and you aren’t mind readers. But I’d like some female perspective, how do you read these messages?

She sent this text (translated from Swedish)

Hi (my name)!
Hope everything is okey with you!

I've been thinking and feeling a little guilty about how I ended things.

I really hope you can look back and that it's not just bad memories but also fun ones etc. I like our memories and always will. When I look back it's only good things even though my feelings subsided. 

If you feel like talking sometime, going for a walk or coffee or whatever, let me know. 

Hugs (her name)

My response:
Hello!
Everything is good with me. 

I only have good memories of the time we spent together. 

But of course, the way you ended things hurt a lot, and it was not a good time for me. But I can't blame you for your feelings, I just wish you had been more open, and we could have talked about it instead of everything ending so abruptly. 

Hope everything is okey with you, the family, the horses and the cat. 
Hugs

Her response:
Yes, I get it. I just think it's really hard with breakups and hurting someone.

My response:
I understand that, but I actually think it made it a lot worse. I didn't understand what had happened, didn't get a real answer, and I was generally confused because I thought everything was great between us. 
But that's in the past now, nothing that can be changed. But I appreciate you writing this, so thank you.



This was it, the conversation ended after that. 
What does this mean? Does she want me back, or is this just an apology?
I’m seeing someone new at the moment, but my ex is always in the back of my mind…",1,1741140276.0,AskWomenOver30,8,1.0,False
1j3s4xp,https://www.reddit.com/r/overwatch2/comments/1j3s4xp/time_to_rant_developer_overreach_and_the_general/,Time to rant. Developer overreach and the general state of Multiplayer in 2025.,"First Reddit post, decided to dump it here.. go figure. But need to let some stuff go. Consider yourself **warned**, or get a coffee. This post was inspired by systems such as the leaver penalty, combined with forced win/loss in matchmaking. Not unique to Overwatch, but very blatantly implemented in this game.   
  
Quick background: I've been playing MP games since Quake 3 Arena back in 2001 and lots of online competitive fps ever since like the original MoH, RTCW, Killzone 2 and many more.   
Now before matchmaking became a thing.. MP gaming was such a simple yet efficient deal:   
You have good players that inspired the newcomers to play better, and bad players that aspired to become like the good players if they so wished.   
There were no systems in place to balance things out, no (unseen) rating or rank that you would hold, or a tracking system that would decide the preferred outcome of your next match.   Just pure, raw, bare bones MP gaming.  
Some players were simply unreal, some barely knew how to use a mouse, and it was all in the same match. Or you could simply switch servers and try with some other folks, until you either gave up or got better at the game, and once you did, it was instantly noticeable.  
It worked perfectly, it caused MP gaming to grow into what it is now.  So why change it?

Now I know, in the interest of player retention you'd want to balance out those matches, minimize the players leaving your game and finding another hobby to spend time on when they can't find their turn in the game.  
But there is such a thing as overreach. Overly controlling systems that decide who and when, why and how.  
And it messes with everything that (imo) made multiplayer gaming such a cultural success.   
  
Which brings me to OW2. As a faithful Pharah main since 2016 (closest I've gotten to blasting rockets a-la Quake 3) the experience has just been getting worse with each year.  OW initially was very open, casual, fun and left to each players desire as to what character to play etc.  But more and more I've found that freedom to be taken away.  Restricted hero pickings, restrictions on leaving lobbies (penalties), more aggressive matchmaking (steamroll or steamrolled depending on your previous matches, essentially condemning you to a pre-decided outcome) just to name some.   

I'm sure these systems were made with the right intention.. (quote needed), but I'm afraid it destroys the competitive spirit entirely. Now if the matchmaking would actually be fair and consistent, I could see why a penalty system would be an idea. But the matchmaking seems to be deliberately unbalanced, and players are getting punished for recognizing the patterns and leaving the match.   
And I've tested it. Purposely de-ranking for days, to such a point as to where I couldn't stop losing games even if I tried (literally did nothing all match, still winning consistently or get forced backfilled into winning teams, joining teams with full comms etc)  
As well as the opposite, trying my hardest to progress yet getting loss after loss (to a point of being backfilled into losing games with 1 minute left multiple times, full dps teams ignoring the obj etc.) 

All consistently, test after test. (and I've done quite a few)

There are obvious systems at play here, and I sincerely believe these systems are for the worse, and are causing people to ditch OW. Even if players can't quite pinpoint it, they can still sense somethings' up.  
There is such a thing as too many systems and too much control. 

Maybe I'm just getting too old or something, but MP gaming used to be an enjoyable activity to dive into in the late hours, not a source hopelessness and stress.

",0,1741140147.0,overwatch2,3,0.2,False
1j3s4i1,https://www.reddit.com/r/Fallout76Marketplace/comments/1j3s4i1/ps4_h_anti_armor_w_limit_breaking_conductors_pin/,[ps4] h: anti armor w: limit breaking/ conductors/ pin pointers,"Trade 1:1? can include some coffee (130 is all I have, so 20-30 each trade?)
I have 7 anti armor and can make more
Need 2 conductors
2 pin pointers
2 limit breakers

Also interested in Sawbones overeaters pyromaniacs",1,1741140110.0,Fallout76Marketplace,1,0.67,False
1j3s43j,https://i.redd.it/br9d71od3sme1.jpeg,So this happened! My Grandma's Star of David punch bowl..is gone!,"My husband and I were rearranging our pool house... My Grandma's punch bowl was on an oak coffee table that my Grandpa made. We were trying to figure out which one of us bought this hideous rug...I know I didn't. We don't know where it came from.

Well, I went into the main house...he comes in with a bloody chin. He tripped over that damn rug and slammed his chin on the punch bowl and coffee table. He is okay... and feels terrible. It's completely replaceable... Im just happy he's okay and doesn't need to stitches! ",1,1741140077.0,glasscollecting,0,1.0,False
1j3s419,https://www.reddit.com/r/AskGaybrosOver30/comments/1j3s419/help_me_find_a_new_perspective_as_i_age/,help me find a new perspective as I age,"After weeks of re-drafts, I have given up on trying to hide how lost I feel and given up on trying to avoid even the whiff of left-over self-pity, so I apologize in advance, and I thank anyone who reads this and can offer me help.

I was impressive until about five years ago,  successfully hiding the depression that hit me until a car ran into me and I spent a semester on medical leave from the university where I teach.  But after I recovered, I found I could not do the things I had done five years ago.

The doctors at the hospital insisted I had made a full recovery from the accident, so I confronted my personal physician about it.  She told me that I *had* made a full recovery;  my problems were nothing more than the natural consequences of my passing the half-century mark.

When I pointed out how sudden it was, she said to me in effect, ""There are some men who can stave off the effects of age for a while as you had, through sheer willpower and stubbornness, but they pay a price for it, and when age finally hits them it gets some paypack for the delay.""

I said I would put up with any surgery, any medication even suspect ones like steroids, to return to ""normal"", but she insisted this is now my normal.

What I want to know is how a person can live like this, what great wisdom or new perspective enables them to live like this without feeling like they're just wasting time waiting for death to arrive?   I don't want to be like a catatonic horse grazing just outside the glue factory until they're ready to take him in for pulping.

I have swallowed my pride and found a psychological counselor, but counselors around here won't talk about spiritual or philosophical issues, and I don't dare say anything about wondering if I'd been better off dying in that accident without the counselor panicking and insulting me that I might not stick through this life to end.  I intend to stick through it; I just don't know how.

Five years ago, I was the ""go-getter"" in my division at the university, the innovator and problem-solver everyone turned to, the ""man who made it all work somehow"".  More than once I was told I was like one of those ice-cutter ships that break up thick ice on the sea to make a wake everyone else could follow.   They tell me that I left a hole they never managed to fill during my semester on medical leave.   I mattered.

I couldn't leap up the stairs three at a time as I did in my 30s, but I could still run up the steps.  I mastered new classroom technology quickly enough that I tutored other professors in it.  I was often (far from always) the person with the last word that everyone else agreed with at our department meetings.

But it's nearly impossible to be the ""ice-cutter"" when I have to rely on the banister half the time to get up the stairs now.

It's nearly impossible to be the innovator when I can no longer remember what it's like to get a full night of uninterrupted sleep without waking up for bathroom trips or waking because some random part of me has decided to ache for no discernible reason and so I'm always tired at department meetings.

It's nearly impossible to be the ""stand-up man"" at a department meeting when I sometimes need help getting to my feet or when they have to indulge me with a bathroom break when everyone else could go another three hours -- just as I could five years ago.

It's humiliating to find myself now the last person to be able to master the newest technology, to go from the person I.T. saluted to the person I.T. dreads to hear from.

I remember five years ago when the department needed volunteers to move desks and other heavy furnishings around.  I accomplished just as much as the younger men and woke up the next day without a single ache or pain for it.   A couple of weeks ago, the university needed volunteers again, and I hurt my back the first hour.  Instead of lifting things usefully, I ended up . . . fetching coffee and sandwiches.   All my decades of learning and life experience, my Ph.D. and teaching career, my intelligence, worthless as I found myself diminished from a ""go-getter"" to a ""go-fer"".

How can I manage to achieve anything worthwhile or live a life that has any value or worth to it if I find that half the time when I enter a room I can not for the life of me recall what I went into that room for in the first place???

I recall reading wise men of the past claim that to age graciously an older man must find his purpose in different things than the worldly achievements that defined his 20s and 30s, that heroism is a young man's game and that older men should become instead . . . what?

Surely there is some way of understanding the world, some new perspective, which says that I have more to look forward to in this life than picking out a nice burial plot and staring like Alexander the Great at all that remains to be conquered that is now beyond me.

I hope you can tell me what what purpose there is to life when one no longer has a worthwhile body, what role remains for us to fulfill, what identity we can have when go-getter and ice-cutter and innovator become rare peaks instead of our daily norm.

If you have managed to put up with reading this far, I thank you.

If you have actual worthwhile advice to share, I am honestly grateful, though I doubt I have any talent of expressing that well right now.

Thank you.",1,1741140073.0,AskGaybrosOver30,8,1.0,False
1j3s3wy,https://www.reddit.com/r/MontechPC/comments/1j3s3wy/hyperflow_silent_just_how_quiet_is_it/,🔇 HyperFlow Silent: Just How Quiet Is It?,"https://preview.redd.it/etg4782oumme1.png?width=5334&format=png&auto=webp&s=cb5353dbb87e1326519f077db5a3f3b7e10f5eba

Ever wondered how loud your PC cooling really is? Let’s put it into perspective. **Every decibel matters** when you're aiming for a **powerful yet peaceful** setup.

\-

**Noise Level Comparison:**

✈️ **Jet Takeoff** – 120dB (Your ears will NOT thank you 🎧)

🗣️ **Casual Conversation** – 60dB (Your usual coffee shop chat ☕)

🌬️ **HyperFlow ARGB** – 28dB (A balance of cooling & noise 🔄)

🔇 **HyperFlow Silent – 23dB** (MONTECH’s quietest AIO cooler EVER 🌊)

\-

💡 **Why does it matter?**A drop of just **5dB** might seem small, but in a high-performance PC, it can mean the difference between a system that hums in the background and one that **vanishes into silence**.

HyperFlow Silent is engineered for those who want **strong cooling without the distraction**—perfect for **gamers, creators, and minimalists** alike.

💬 **What’s the loudest component in your rig? Let’s compare setups in the comments!** 👇

🔗 **Check it out here:**[ Amazon Link](https://www.amazon.com/MONTECH-HyperFlow-Silent-360-Black/dp/B0DY2JT3W5/)",2,1741140064.0,MontechPC,1,1.0,False
1j3s2e1,https://i.redd.it/klv8nqkz2sme1.jpeg,"Hello friends, which coffee do you prefer?",,3,1741139947.0,coffeestations,6,0.6,False
1j3s2dm,https://www.reddit.com/r/Indians_StudyAbroad/comments/1j3s2dm/a_list_of_careers_which_are_desperately_required/,A list of careers which are desperately required in the Austrian job market,"Found a link that may benefit some of you. This is list of occupations Austria are desperate for. I do not know the costs of Education etc, but though it might benefit you.

[https://www.migration.gv.at/en/types-of-immigration/permanent-immigration/austria-wide-shortage-occupations/](https://www.migration.gv.at/en/types-of-immigration/permanent-immigration/austria-wide-shortage-occupations/)

# Austria-wide shortage occupations

For the year 2025, the following occupations are deemed shortage professions:

# 1. Special(ist) power engineers (TechnikerInnen für Starkstromtechnik)

# 2. Engineers for agricultural machinery (LandmaschinenbauerInnen)

# 3. Technicians with a higher level of training (engineers) for power engineering technology (TechnikerInnen mit höherer Ausbildung (Ing.) für Starkstromtechnik)

# 4. Train drivers (TriebfahrzeugführerInnen)

# 5. Graduates in power engineering (DiplomingenieurInnen für Starkstromtechnik)

# 6. Graduate nurses (Dipl. Gesundheits- und KrankenpflegerInnen)

# 7. Cost accountants (Kalkulanten/Kalkulantinnen)

# 8. Technicians with a higher level of training (engineers) for mechanical engineering (TechnikerInnen mit höherer Ausbildung (Ing.) für Maschinenbau)

# 9. Physicians (Ärzte/Ärztinnen)

# 10. Roofers (DachdeckerInnen)

# 11. Technicians with a higher level of training (engineers) for data processing (TechnikerInnen mit höherer Ausbildung (Ing.) für Datenverarbeitung)

# 12. Electrical installers, electrical fitters (Elektroinstallateure/Elektroinstallateurinnen, Elektromonteure/Elektromonteurinnen)

# 13. Milling machinists (FräserInnen)

# 14. Special graduate engineers (TechnikerInnen mit höherer Ausbildung (Ing.), soweit nicht anderweitig eingeordnet)

# 15. Telecommunications Technicians (Fernmeldemonteure/Fernmeldemonteurinnen)

# 16. Special fitters (SpenglerInnen)

# 17. Motor vehicle mechanics (KraftfahrzeugmechanikerInnen)

# 18. Specialist technicians for mechanical engineering (TechnikerInnen für Maschinenbau)

# 19. Metal turners (DreherInnen)

# 20. Medical technology specialists (Medizinisch-technische Fachkräfte)

# 21. Black toppers (SchwarzdeckerInnen)

# 22. Graduate engineers for data processing (DiplomingenieurInnen für Datenverarbeitung)

# 23. Ophthalmic opticians (AugenoptikerInnen)

# 24. Welders, cutting torch operators (SchweißerInnen, SchneidbrennerInnen)

# 25. Pipe installers, pipe fitters (Rohrinstallateure/Rohrinstallateurinnen, Rohrmonteure/Rohrmonteurinnen)

# 26. Graduate mechanical engineers (DiplomingenieurInnen für Maschinenbau)

# 27. Vehicle body and radiator sheet metal workers (Karosserie-, KühlerspenglerInnen)

# 28. Varnishers (LackiererInnen)

# 29. Graduates in weak-current and telecommunications engineering (DiplomingenieurInnen für Schwachstrom- und Nachrichtentechnik)

# 30. Special fitters (SchlosserInnen)

# 31. Certified public accountants (WirtschaftstreuhänderInnen)

# 32. Technicians for fuel and gas technology (TechnikerInnen für Feuerungs- und Gastechnik)

# 33. Special technicians for low voltage engineering and communication engineering (TechnikerInnen für Schwachstrom- und Nachrichtentechnik)

# 34. Wood machine workers (HolzmaschinenarbeiterInnen)

# 35. Midwives (Hebammen)

# 36. Building plumbers (BauspenglerInnen)

# 37. Special technicians in business administration (TechnikerInnen für Wirtschaftswesen)

# 38. Special technicians (TechnikerInnen, soweit nicht anderweitig eingeordnet)

# 39. Payroll accountants (Lohn-, GehaltsverrechnerInnen)

# 40. Engineers / technicians for rough mechanicals (GrobmechanikerInnen)

# 41. Electrical mechanics (ElektromechanikerInnen)

# 42. Construction and furniture joiners (Bau- und MöbeltischlerInnen)

# 43. Blacksmiths and carriage builders (Huf- und Wagenschmiede/Huf- und Wagenschmiedinnen)

# 44. Building fitters, sheet metal fitters, construction fitters (Bau-, Blech-, KonstruktionsschlosserInnen)

# 45. Carpenters (Zimmerer/Zimmerinnen)

# 46. Retailers and sales clerks of perfumes, washing and houshold articles, paints, varnishes (HändlerInnen, VerkäuferInnen von Parfümerien, Wasch-, Haushaltsartikeln, Farben, Lacken)

# 47. Construction joiners (BautischlerInnen)

# 48. Technicians with a higher education (engineer) for civil engineering (TechnikerInnen mit höherer Ausbildung (Ing.) für Bauwesen)

# 49. Butchers (FleischerInnen)

# 50. Graduate engineers - special professions (DiplomingenieurInnen, soweit nicht anderweitig eingeordnet)

# 51. Chimney sweepers (RauchfangkehrerInnen)

# 52. Restaurant chefs (Gaststättenköche/Gaststättenköchinnen)

# 53. Machine fitters (MaschinenschlosserInnen)

# 54. Conductors and train supervisors (ZugführerInnen, ZugschaffnerInnen)

# 55. Pavers (Pflasterer/Pflasterinnen)

# 56. Accountants (BuchhalterInnen)

# 57. Graduate Engineers for Engineering Physics, Physicists (DiplomingenieurInnen für technische Physik, PhysikerInnen)

# 58. Graduates in business administration (DiplomingenieurInnen für Wirtschaftswesen)

# 59. Plastics processors (KunststoffverarbeiterInnen)

# 60. Retailers and sales clerks for iron and metal goods, domestic and kitchen appliances (HändlerInnen und VerkäuferInnen von Eisen- und Metallwaren, Maschinen, Haushalts- und Küchengeräte)

# 61. Technicians for weak-current and telecommunications engineering (TechnikerInnen mit höherer Ausbildung (Ing.) für Schwachstrom- und Nachrichtentechnik)

# 62. Track layers (GleisbauerInnen)

# 63. Special technicians for civil engineering (TechnikerInnen für Bauwesen)

# 64. Physical-technical Special Professions (Physikalisch-technische Sonderberufe)

# 65. Civil engineering specialists (TiefbauerInnen)

# 66. Special(ist) technicians for data processing (TechnikerInnen für Datenverarbeitung)

# 67. Denture technicians (ZahnprothesenmacherInnen)

# 68. Technicians with a higher education (engineer) in business administration (TechnikerInnen mit höherer Ausbildung (Ing.) für Wirtschaftswesen)

# 69. Coffee product makers and other food manufacturers (Kaffeemittel-, andere NahrungsmittelherstellerInnen)

# 70. Department store sales clerks (WarenhausverkäuferInnen)

# 71. Childcare-Workers (ErzieherInnen)

# 72. Special railroad professions (Bahnberufe anderer Art)

# 73. Florists, flower arrangers (NaturblumenbinderInnen)

# 74. Construction joiners (BodenlegerInnen)

# 75. Non-Graduate Nurse Practitioners and Related Professions (Nicht diplomierte KrankenpflegerInnen und verwandte Berufe)

# 76. Bakers (BäckerInnen)

# 77. Confectioners (ZuckerbäckerInnen)

# 78. Bus drivers (AutobuslenkerInnen)

# 79. School bus drivers (SchulbusfahrerInnen)

# 80. Professional motor vehicle drivers - passenger transport (BerufskraftfahrerInnen - Personenbeförderung)

# 81. Tram drivers (StraßenbahnwagenführerInnen)

  
my\_qualifications: - ",2,1741139946.0,Indians_StudyAbroad,2,1.0,False
1j3s1os,https://www.reddit.com/r/writing/comments/1j3s1os/what_are_some_weird_recipe_or_unholy_food/,What are some weird recipe or unholy food combinations your characters made up/enjoy?,"I need to make sure I'm not the only one who does this. One of my characters doesn't like coffee; instead, he takes instant coffee ground, puts sugar and/or Splenda into it, and eats it with a spoon.

Has anyone else come up with weird concoctions their character likes? If so, what are they? I need proof that I'm not the only one who does this 

Edit: recipes*",5,1741139885.0,writing,10,0.78,False
1j3rzqv,https://www.reddit.com/r/DaNang/comments/1j3rzqv/2_coffee_filters_any_leads_on_where_to_get/,#2 coffee filters? any leads on where to get?,"thanks! I've checked Go! Lotte and Winmart to no avail...


checking coffeeshops for insight next : )",1,1741139718.0,DaNang,0,1.0,False
