id,url,title,text,score,created_utc,subreddit,num_comments,upvote_ratio,over_18
1h9m3rp,https://www.reddit.com/r/LucidDreaming/comments/1h9m3rp/does_wbtb_actually_make_lucidity_easier/,Does WBTB actually make Lucidity easier?,"So this morning I woke up like 4 hours before I was supposed to wake up, so I ended up getting out of bed drinking coffee and eating breakfast for the morning and about 5 hours after I initially got up, went back to sleep for like, 2 hours,  and i actually had a dream during this! 

I wasn't really lucid, and it was hard to keep track of, but I had one, and i think I may have actually exerted dream control without realizing it? I ended up flying in a specific direction I chose without really...trying? I guess?

So i have a couple of questions.

1: Does what I did actually count as WBTB considering it took so long for me to go back to sleep? 

2: Does WBTB actually make lucidity easier? I'm the kind of person where this sort of thing can easily ruin my sleep schedule so I'm really not sure I want to try and make this a habit unless it's really worth it.",1,1733674194.0,LucidDreaming,1,1.0,False
1h9m3e2,https://i.redd.it/ov4u20mdfn5e1.jpeg,Loving this preground Segafredo Peru coffee,,1,1733674164.0,mokapot,0,1.0,False
1h9m36j,https://www.reddit.com/r/TheGirlSurvivalGuide/comments/1h9m36j/my_parents_hate_that_im_fat_and_so_do_i/,My parents hate that I'm fat and so do I,"I'm 21 years old, 5 feet 5 and a half inches or 168 cm tall and I weigh about 145 pounds. I used to me a lot thinner when I was a teenager and I keep wishing I kept the same body even though I know I'm taller now.

My parents hate that I look chubby with a double chin. I keep getting comments on how they've never seen a person my age at my weight, how I clearly look unhealthy. I've been wearing loose clothes for a while but now that I'm fat, it's a problem. My mom has told me I don't need to buy new clothes because I'll be encouraged to eat more and hide  the extra weight in the looseness. She tells me I need to be able to fit into the clothes I wore when I teenager. Shes told me that I'm growing horizontally.  Dad has called me a fatass several times. I've been told that I'm tricking myself into thinking I'm skinny when I wear baggy shirts. My mom has told me "" You think you look so nice and skinny in that loose shirt. You look horrible. Just see yourself in the mirror and tell me if you look healthy.""

There are so many incidents I remember that I can't fit it in this post. The worst part is that it got into my head and I can't forget about it. I keep looking in the mirror and examining myself and feeling disgusted. Sometimes I can't even look in the mirror. One time me and my friends were taking pictures of my skinny friend and when i showed her a photo , she  immediately exclaimed that she looked fat in the photo and she wanted a another one. It wasn't even targeted at me . I still nearly burst into tears. If she's fat, then how grotesquely fat am I?

I have not been dealing with my self disgust well. I keep skipping meals whenever I can because I'm chubby enough where a few meals missing here and there won't matter. Sometimes I hope I can get sick with typhoid or something similar to loose the weight. My problem is that i stress eat to cope with my exams. So I'll justify my skipped meals by thinking the junk food will provide the calories I missed. I started to drink more coffee because I heard it makes you poop more. I try to reach 10K steps per day.

I want to just give up . I get so jealous when I see thin people talk about how they get body shamed because my parents and relatives were so much more nicer and kind to me when I was at my thinnest. I know it's not a fair comparison but I can't help but to think if they knew what I was going through, being thin in my place is more desirable than being at my weight. I know it's not a nice thing to say. 

I genuinely want to get out of this cycle of self hatred. I'm not independent because in my country, the parents pay for college and the child usually stays with them till they start working. I'm in my second year of college. I won't be leaving soon .

Please give me advice on what to do. I would very much appreciate it if you could help.
 ",1,1733674145.0,TheGirlSurvivalGuide,0,1.0,False
1h9m2jc,https://www.reddit.com/r/HomeHive/comments/1h9m2jc/are_breville_espresso_machines_good/,Are Breville espresso machines good?,"Hey coffee enthusiasts! I've been a barista for over 8 years, and I've worked with countless espresso machines. Today, I want to share my honest thoughts about Breville espresso machines since I've noticed lots of questions popping up about them lately.

I'll cut straight to the chase - yes, Breville espresso machines are actually pretty great. I got my first Breville about five years ago, and it's still going strong. What really stands out is how they manage to balance quality with user-friendliness, which is pretty rare in the espresso machine world.

The thing that impressed me most was their temperature control system. If you're into coffee, you know that brewing temperature can make or break your espresso shot. Breville's PID temperature control (fancy term for super-precise temperature regulation) ensures you get consistent shots every time.

But let's talk about the elephant in the room - the price. While they're not the cheapest options out there, I'd argue they're worth the investment. When you break it down, making coffee at home saves you a ton compared to daily café visits. Plus, their machines tend to last for years with proper maintenance.

Speaking of maintenance, these machines are surprisingly easy to clean. Most parts are removable and dishwasher safe, which is a huge plus in my book. Trust me, when you're half-awake trying to make your morning coffee, you'll appreciate this feature.

What really sets Breville apart is their range. Whether you're a beginner who wants something simple or a coffee nerd who loves to experiment with different settings, they've got something for everyone. I've seen complete newbies pull decent shots within their first few tries.

If you're interested in checking them out, you can find their full range here: https://athometouch.com/breville

One thing to note though - like any espresso machine, they need some basic care. Descale regularly, clean the portafilter, and don't skimp on the grinder quality. A good grinder is crucial for getting the best out of these machines.

I especially love their built-in grinders in some models. While pure coffee snobs might prefer separate grinders, having an all-in-one solution is super convenient for daily use. The grind settings are precise enough for most people's needs.

The steam wands on Breville machines deserve a special mention. They produce the right pressure for creating that silky microfoam needed for latte art. I've managed to create some pretty decent rosettas with mine, though I'm still working on those fancy swans!

Bottom line? If you're serious about making quality espresso at home but don't want to deal with overly complex machines, Breville offers solid options. They're reliable, well-built, and produce consistently good results. Just make sure to pick the model that matches your skill level and needs.

I'd love to hear about your experiences with Breville machines or answer any specific questions you might have about them. Drop your thoughts in the comments!",1,1733674094.0,HomeHive,0,1.0,False
1h9m222,https://www.reddit.com/r/7Brew/comments/1h9m222/does_their_decaf_still_have_some_kind_of_caffeine/,Does their decaf still have some kind of caffeine in it? ,"I have recently had to quit drinking caffeine because it causes my anxiety and heart rate to sky rocket and sends me down a rabbit hole of anxiety attacks and episodes of dry heaving… anywho, I tried to drink a coffee from there recently and I made sure it was made decaf and I still got the shakes afterwards. No it wasn’t from the sugar content or anything but it was almost like my caffeine shakes. I used to work at 7 Brew so I went from drinking it regularly (maybe too much) to completely stopping so now even caffeine in soda stresses my body out. 

Does the decaf they get in store have a small amount of caffeine still in there? I say that because a lot of coffee I’ve looked at getting on Amazon still has maybe 10% caffeine in it per cup and it made me wonder if their decaf wasn’t 100% or if I was just getting in my head about it when I drank it the other day. ",1,1733674058.0,7Brew,0,1.0,False
1h9m20z,https://www.reddit.com/r/LetsReadOfficial/comments/1h9m20z/the_two_who_made_me_loose_my_mind/,The two who made me loose my mind.,"So I work in a museum. It's a grand old tudor home built in the 1400s.

The building doesn't look quite typical of tudor architecture as during the 1500s part of a church wall was added to the main hall.

At it's finest point this house had acres of land, and many buildings attached to it. It had a grand garden with space for orchards.

Sadly now it's just the main house, all the extra building and beautiful gardens have gone. Although some of the orchard trees still remain.

We were coming to to the end of the day and only two guests remained int he hall. They were sipping coffee in the cafe at the enterance.

I decided to go and get cleaning supplies as it was my turn to clean the bathrooms. Unfortunately we have the cleaning cupboard at the far end of house, roughly a 2-3 minute to walk there and back.

At the back of the hall is the old family lodging range. In the late 1500s many families and businesses occupied the area.
Now the downstairs part is an education space, and upstairs just has various plaques describing the types of people who lived there.

And the sad story of a little boy who ahd died in the 1800s.

As I got to the education space door I heard footsteps. As I looked tot he stair cade beside me I saw the shadow of two people climbing the stairs.

I could hear them muttering about something but I paid no mind.

As I was getting the cleaning supplies I could heard their footsteps on the floor above.

So I returned to the front of the house and told my co worker who groaned. She had been eager to finish early and was annoyed that we'd be shutting late.

I went about my business, refilling toilet roll holders, cleaning parts of the house and hall.
Then I returned to the front desk and asked if the couple I'd seen had left yet.

My co worker said she hadn't seen or heard anyone. 
So I decided to go backwards around the usual route of the house, searching for the couple. I'd figured that they'd almost be finished by now. I searched the upstairs of the east range and there was no one around. Perplexed I went in to the medieval kitchen, searched the upper rooms there. Still no one.

I looked to the lodging range, ""surely they couldn't still be in there"" I thought as I walked inside.

Sure enough as i stepped into the lower half of the lodging range in heard what sounded like a ladies voice. I couldnt out her words. I also heard the same footsteps.

I reached for the education space door. I wanted to suss out where upstairs they were. The very second the door opened everything fell silent.

I figured they must have stopped to read a plaque and made my way upstairs.

Not a soul around.

I've dealt with hauntings in the old house before, but this one was very vivid. It left me confused and feeling like I was going insane.

A few weeks later I was told that no one was in the house so I took  quick look around to be sure. I saw a lady standing in the kitchen. All I could think as I told my colleague about her was ""God let me not be insane.""

Thankfully there was indeed a group of 4 people in the hall, the lady being one of them.

But I'll honestly never forget that day, I'll never forget how real it all was.

I have other stories too but I'll finish off with a short mention. A couple of my colleagues who work in the kitchen have had times where they've been entirely alone. When theyve heard someone whisper their name directly into  their ear.

This almost 600 year old building, is very haunted.",1,1733674056.0,LetsReadOfficial,0,1.0,False
1h9m0x4,https://www.reddit.com/r/UNCCharlotte/comments/1h9m0x4/rush_student_living_sublease/,Rush Student Living Sublease!,"
Hey everyone, I’m subleasing my apartment at Rush from mid December to July.

- Rent is 1,060 a month and includes all utilities.

- Girls only! Two of the roommates are freshmen and the other is a sophomore.

- 4x4, which means you’ll have a room with a bathroom. The closet is walk in and very big, and the room is also the bigger layout in this apartment. 

- Directly across the street from campus so no car is needed. However if you are bringing one, the room is placed on the third floor, and conveniently on the side of the complex which is surrounding the parking deck.  

- Amenities include the pool, gym, mini golf, grills and patio, small dog park, fire pits, and a coffee bar.

Shoot me a dm if interested!",0,1733673973.0,UNCCharlotte,0,0.5,False
1h9m0v6,https://i.redd.it/pql4j9wsen5e1.jpeg,Testing Seals Before I’ve had my Coffee ,"I was too excited about the cranberry juice I canned last night that I ran downstairs before I had my coffee to test all of the seals and such. 

I picked up one, tested the seal, and it slipped a bit when I went to place it down (I really should have done this when I was more awake!) and it landed on another jar. The seal here is still good, as in I tested it again and the seal is still on securely. But, my assumption is that if something like this happens it’s a goner regardless right?

The jar sealed well overnight, just had one land on it this morning and it kept the seal. Not sure the best practice here! I am a beginner here! ",1,1733673969.0,Canning,2,1.0,False
1h9lzwk,https://www.reddit.com/gallery/1h9lzwk,Current collection (I need help),"1. Amouage Purpose (pink pepper, olibanum, sandalwood, cypriol, guaiac wood, vetiver)


2. Amouage Reflection Man (rosemary, red berries, petitgrain, jasmine, neroli, cedarwood, patchouli)


3. Byredo Bal d'Afrique (bergamot, lemon, neroli, violet, jasmine, vetiver, cedarwood)


4. Byredo Black Saffron (grapefruit, juniper berries, saffron, black violet, leather, vetiver)


5. Creed Aventus (bergamot, blackcurrant, apple, pineapple, birch, jasmine, musk, oakmoss, vanilla)


6. Creed Absolu Aventus (bergamot, blackcurrant, apple, pineapple, birch, jasmine, musk, oakmoss, vanilla)


7. Creed Original Santal (coriander, cinnamon, sandalwood, lavender, rosemary, vanilla, tonka bean)


8. Creed Centaurus (marine notes, citrus, jasmine, lavender, cedarwood, musk)


9. Creed Delphinus (citrus, fruity notes, rose, jasmine, amber, musk)


10. Creed Queen of Silk (green notes, citrus, rose, iris, sandalwood, musk)


11. Tom Ford Costa Azzurra (seaweed, driftwood, citron, cardamom, juniper, lavender, frankincense)


12. Tom Ford Tobacco Vanille (tobacco leaves, spices, tonka bean, cocoa, woods, dried fruits)


13. Tom Ford Néroli Portofino (bergamot, mandarin, lemon, lavender, neroli, orange blossom, ambrette)


14. Tom Ford Oud Wood (rosewood, cardamom, oud wood, sandalwood, tonka bean, vanilla)


15. Tom Ford Ombre Leather (cardamom, leather, jasmine sambac, amber, moss, patchouli)


16. Tom Ford Noir (bergamot, caraway, pink pepper, iris, amber, vetiver, patchouli, vanilla)


17. Ormonde Jayne Nawab of Oudh (bergamot, cardamom, rose, magnolia, labdanum, musk, oud)


18. Parfums de Marly Sedley (bergamot, mint, lemon, lavender, geranium, vetiver, ambroxan)


19. Kilian Black Phantom (rum, sugarcane, coffee, dark chocolate, tonka bean, sandalwood)


20. Eaux Primordiales Superose (pink pepper, grapefruit, rose, raspberry, ambroxan, musk)


21. Eaux Primordiales Ambre (bergamot, black pepper, incense, labdanum, amber, vanilla)


22. Eaux Primordiales Ambre Supermassive (bergamot, black pepper, incense, labdanum, amber, patchouli, vanilla)


23. Eaux Primordiales Champ d'Influence (bergamot, pink pepper, vetiver, cedarwood, amber, musk)


24. Eaux Primordiales Cèdre (lemon, black pepper, cedarwood, vetiver, musk, amber)


25. Eaux Primordiales Mécanique Intuitive (metallic notes, sandalwood, ambergris, musk)


26. Eaux Primordiales Particules Imprévisibles (pepper, citrus, incense, cedarwood, vetiver, musk)


27. Mizensir L'Envers du Paradis (bergamot, petitgrain, musk, vetiver, driftwood)


28. Jazeel Wid (saffron, rose, oud, musk, patchouli)


29. Frédéric Malle Musc Ravageur (cinnamon, clove, lavender, musk, amber, vanilla)


30. Frédéric Malle Cologne Indélébile (bergamot, neroli, musk, amber)


31. Maison Francis Kurkdjian Amyris (lemon, amyris, coffee, sandalwood, musk, amber)


32. Maison Francis Kurkdjian Apom (orange blossom, cedarwood, ylang-ylang)


33. Les Indémodables Vanille Havane (tobacco, vanilla, cedarwood, rum, patchouli)


34. Marc Antoine Barrois B683 (saffron, violet, leather, patchouli, sandalwood)


35. Marc Antoine Barrois Encelade (fig, vetiver, cedarwood, musk, leather)


36. Serge Lutens Fleur d'Oranger (orange blossom, jasmine, musk, sandalwood)


37. Serge Lutens Chergui (tobacco, honey, iris, amber, musk, leather)


38. Penhaligons Mr Thompson (bergamot, vetiver, sandalwood, musk).



",2,1733673895.0,Perfumes,1,1.0,False
1h9lz6o,https://www.reddit.com/r/QuikTrip/comments/1h9lz6o/coffee_refills/,Coffee Refills,"Y’all need to start charging these fuck ass customers the right refill prices. I keep getting a “well they charged me 2.15 at this store” and then they wanna bitch and moan when I charge them the correct price for their fucking 50+ ounce cup. Like I get giving your favorite customers a cheap refill cause they’re cool, but at least let them know it’s not the regular price and charge the randoms the right price 😭",3,1733673844.0,QuikTrip,0,0.8,False
1h9lygc,https://www.reddit.com/r/PlasmaReferrals/comments/1h9lygc/csl_plasma_get_extra_igive_rewards_points_after/,CSL Plasma: Get Extra iGive Rewards® points after two donations for new donors! (Plus new donor bonus money) Using the CSL Plasma app! Referral Code: AYLGY54DAG Solid advice for new plasma donors included! Thank you!,"Link to copy code, download app, and paste code:

[https://rewards.cslplasma.com/referral/referral-unique-code/eyJkb25vcklEIjoiMTMwMTkyMTciLCJjb2RlIjoiQVlMR1k1NERBRyJ9](https://rewards.cslplasma.com/referral/referral-unique-code/eyJkb25vcklEIjoiMTMwMTkyMTciLCJjb2RlIjoiQVlMR1k1NERBRyJ9)

I have educational advice for new plasma donors who may be considering to try it out and earn extra money:

* Plasma is 92% water and the rest is mostly protein elements.

* The plasma is separated from your blood and your red blood cells are returned to you in cycles.

* Your body regenerates plasma fast from staying hydrated and eating protein.

* Per FDA regulations, you're only allowed to donate plasma twice in a 7 day period, with a 48 hour wait inbetween those two times. Don't risk your health by hopping around to different plasma donation centers to circumvent these regulations, and you may get caught if you do.

1. Eat a meal high in protein 2-3 hours before donating, but your plasma protein levels depend on what you ate the day before.
2. Drink plenty of water and/or non-caffeinated juice before donating to stay hydrated. It's important to stay hyrdrated at least the day before, and the day of your donation.
3. Avoid caffeine such as in coffee or soda before donating or you may get nauseous and vomit or faint during your donation.
4. No alcohol 24 hours before, and for a little while after donating.
5. No exercising for at least 6 hours after donating as it can put too much stress on the vein.
6. Some people get away with smoking or vaping nicotine before and after donating, but it's recommended not to for 2 hours before and after. The nicotine can raise your heart's pulse rate.
7. If your pulse rate is 100 or above, you'll be able to do a vitals retake after a 15 minute wait. But if it's 100 or higher again you'll be deferred for the day. If your pulse rate is an issue, listen to ""Pink Noise"" or ""Green Noise"" at a low volume before donating which may help reduce your pulse rate, along with its effect on lowering your blood pressure.
8. There is a risk of getting a blown vein if the worker is having a hard time finding your vein when they're sticking you with the needle or if you have small veins. You may get deferred until your vein heals if that happens. But it's ok, your body is able to regenerate your veins with a process called Angiogenesis.
9. There is a risk of blood clots, but when your blood is constantly moving through the machine it prevents that from happening.
10. You may be subject to drug screening. The drug screening tests for methamphetamines, cocaine, and heroin. Certain pharma prescription meds may show up as a false positive so you'll want to let the plasma center know what meds you're taking. Testing positive for these drugs can result in a permanent deferral from donating plasma.
11. A sample of your blood will be drawn periodically to test for certain sexually transmitted infections (STIs). A positive test will result in either a temporary or permanent deferral from donating plasma. If you've ever been diagnosed or received treatment for HIV/AIDS, Hepatitis B (HBV) or Hepatitis C (HCV) you will be permanently deferred from donating plasma.

Donating Plasma with Managed Diabetes

Individuals with well-controlled diabetes can contribute to plasma donation, but certain criteria need to be met:

Absence of Complications: This means no existing diabetic complications affecting your kidneys, heart, blood vessels, or eyes.

Insulin Independence: If you rely on insulin for diabetes management, a three-month waiting period is required after using needles for non-prescribed medications. Additionally, you must be free of symptoms or treatment needs related to blood sugar fluctuations (high or low) for the past three months.

1. Healthy Feet: Active foot ulcers requiring medical attention will disqualify you from donation.
2. Steady Balance: You shouldn't experience dizziness or lightheadedness upon standing.
3. Type 1 Consideration: For Type 1 diabetics, eating within two hours of donation is mandatory.



* Wait a few hours before taking the bandage wrap off of your arm after donating.
* It's recommended to use Vitamin E oil/Mineral oil on the needle site for the puncture area to heal better. A Q-tip can be used to apply it easier. I simply dip the Q-Tip in the bottle, but never dip the used cotton back into the bottle.
* Frequently donating over a prolonged period of time may lead to your body having decreased vitamin D levels.

* Red meats are particularly high in the protein vitamins and minerals found in plasma.
* Personally, I take a Now brand Vitamin D supplement that contains vitamin D3, Calcium, Magnesium, and Zinc. But I only take a half a dose, 1 gel capsule instead of 2, since I get these from eating meats and other foods as well. It's bad for your health if you take too much of these vitamins and minerals over time. I also take an Iron supplement once or twice a week. I also try to drink a protein shake before donating. Just to be safe.

Link to copy code, download app, and paste code:

[https://rewards.cslplasma.com/referral/referral-unique-code/eyJkb25vcklEIjoiMTMwMTkyMTciLCJjb2RlIjoiQVlMR1k1NERBRyJ9](https://rewards.cslplasma.com/referral/referral-unique-code/eyJkb25vcklEIjoiMTMwMTkyMTciLCJjb2RlIjoiQVlMR1k1NERBRyJ9)

CSL Plasma: Get Extra iGive Rewards® points after two donations for new donors! (Plus new donor bonus money) Using the CSL Plasma app! Referral Code: AYLGY54DAG Solid advice for new plasma donors included! Thank you!",1,1733673787.0,PlasmaReferrals,0,1.0,False
