id,url,title,text,score,created_utc,subreddit,num_comments,upvote_ratio,over_18
1k3nbvm,https://www.reddit.com/r/MeetPeople/comments/1k3nbvm/chat_43_married_m_here_would_love_to_meet_new/,"[Chat] 43 married M here, would love to meet new online friends","Hey, I have a little down time today, and would love to chat with someone new.  I enjoy reading, visiting coffee shops, and own an embarrassingly large board game collection.  If I sound like someone you would like to talk to, reach out ",1,1745158073.0,MeetPeople,0,1.0,False
1k3nbga,https://www.reddit.com/r/Machupicchu/comments/1k3nbga/should_i_bring_my_own_coffee/,Should I bring my own coffee?,How is the coffee on Inca Trail treks? I suspect it will be Nescafe? Should we bring our own Via packets?,1,1745158034.0,Machupicchu,0,1.0,False
1k3na3q,https://www.reddit.com/r/OCPoetryFree/comments/1k3na3q/every_thing_stayed_just_the_way_you_left_it/,Every thing stayed just the way you left it,"TW: Grief


Today is Easter Sunday. It’s a holiday I don’t normally give much weight to but today feels hard. I lost my brother last month and today, I would normally send him a one lined text saying ‘happy Easter’ but now I can’t. This is a poem I started when I lost my grandma last year and finally finished today. Just want somewhere to share it so it’s not stuck in my head or my notes app.

***

Everything stayed just the way you left it -for a few days, at least.Then I poured your last cup of coffeedown the drain of the kitchen sink.Tidied up some papers,tossed away old receipts,organized your clothes,tried to keep them neat.Shuffled through some photos,changed the worn bed sheets,pulled down boxes from the garage,parked your car out on the street.Cancelled your subscriptions,made attempts at getting sleep.I see you now when I close my eyes;there's no point in counting sheep.
Some people came to carry awaythe little pieces of you.They moved around the furnitureuntil I didn’t recognize the view.I kept your old walletand some photos in their frames.I kept your favorite jewelryand cards signed with your name.
I’m learning that grief is just love with no home.I talk to you in prayer,instead of picking up the phone.I spend my days writing lettersI know you’ll never read,and reading the last of your notes,like you wrote them just for me.
I’ll cherish every moment,all the good and even the bad.I’ll be forever gratefulfor all the love we had.
",1,1745157924.0,OCPoetryFree,0,1.0,False
1k3n9s3,https://www.reddit.com/r/MakeNewFriendsHere/comments/1k3n9s3/29m_nyc_goooood_morning/,29m - nyc - goooood morning :),"Heya! I’m Jackson. I’m 29, live in nyc, and work in banking.

Just getting my morning started with a workout and cup of coffee.  Anybody want to chat while I get ready for the day?

I love to run and cycle! And lately have been big into cooking and reading.

Physically, I’m half Asian, 6’1”, 170ish lbs, slim but fit.",1,1745157897.0,MakeNewFriendsHere,1,1.0,False
1k3n8es,https://v.redd.it/nxpnf911yzve1,A rare arboreal blood python sighting,"I was just trying to make coffee 😭 She never quite got the memo she’s supposed to be a terrestrial species, this is pretty common for her honestly if I pick her up she wants to be as tall as possible ",2,1745157776.0,Shorty_Life,0,1.0,False
1k3n8do,https://www.reddit.com/r/Westchester/comments/1k3n8do/best_coffee/,Best coffee?,"Have been disappointed by all the options in armonk. 

Anywhere make excellent lattes in armonk / chappaqua / mt kisco / pleasantville? ",1,1745157773.0,Westchester,1,1.0,False
1k3n8by,https://www.reddit.com/gallery/1k35mup,The horrible monsters at this local coffee shop 😭 This alone makes me never want to come back.,,1,1745157770.0,Etiolation,0,1.0,False
1k3n882,https://www.reddit.com/r/gaydating/comments/1k3n882/31_m_single_europe_looking_for_chats_first_to_see/,"31 m, single, Europe, looking for chats first to see where things go","Hello, all, and happy Easter!! 

So as the title suggests, I am looking to get to know someone for a chat first, and then we can see how it goes from there. I have an undergraduate and masters degree and I have a wide variety of hobbies and interests. My hobbies include swimming, bowling, rock climbing, traveling, but my favorite hobby is chatting over a tea or coffee in a cafe or restaurant. I don’t drink or smoke. 
I am a blind person and I decided early in life that it wasn’t going to stop me from achieving what I wanted to achieve. I’m also very outgoing. In terms of appearance, I’m tall, with slim build. I also produce my own music and have been doing so for the last 3 years. 

I am also interested in a wide variety of subjects including meteorology, sociology, psychology and language learning. I have spent a lot of time in the US, including states such as New York, New Jersey, the Carolinas, Georgia , Florida, Nevada and Arizona. If you’re from Europe it would be probably be better to chat because the time zone differences woudln’t be so great. 

If any of this sounds interesting to you, or if you have similar hobbies to mine, feel free to send a dm, I’d love to hear from you! I would prefer a dm instead of a reply to the post as Reddit is not the most accessible app out there. ",1,1745157761.0,gaydating,0,1.0,False
1k3n7sx,https://www.reddit.com/gallery/1k3n7sx,The little buggers & the yearly exploration of fav (natural) tips!?,"Oh the irony. Earlier this morning I was skimming another rose post that showed up on my feed about someone’s first rose and the beetles…

These sweet loves are all David Austin climbers (a special gift to myself after a tragedy back in 2017, grew from bare roots). (I mention that bc it’s not actually in my budget to spend much- I’m a big DIY-er). 

Anyway I have traditionally done the hand removal thing, and as soon as I finish typing this I’ll head out there, tissues in hand, and start smashing the little buggers. 🤢

I do the organic/ natural approach. In past years I’ve tried adding more lady bugs, done the neem oil, planted garlic around them, and eventually just decided to let nature be nature. I’ll help when I can and where I can. (Which usually amounts to the morning coffee wander, tissues in hand). I also try the hose em down thing, but honestly I never saw much of a difference with that. I do it anyway, bc I figure the ladybugs need it and so do the roses, but it never seems to affect the aphids. 

So- anyone else have any other tricks or special care I didn’t mention? Especially since they are getting taller? Tess over there on the grey building, it’s amazing how big she gets, it was a bit crazy trying to prune the top… I don’t know how people treat climbers naturally… 

Ok that’s all. Happy gardening and hope you all enjoy some lovely time outside today! 🌱",1,1745157726.0,gardening,0,1.0,False
1k3n6yv,https://www.youtube.com/watch?v=hKpa9ntjgeo,Cardioids in Coffee Cups - Numberphile — Numberphile,,1,1745157664.0,throwaway_the_videos,0,1.0,False
1k3n5ta,https://www.reddit.com/r/Crushes/comments/1k3n5ta/gave_my_engineering_entrance_exam_today_but/,Gave my engineering entrance exam today... but something else stole my focus !!,"



Today was supposed to be all about the exam. Months of preparation, sleepless nights, coffee-fueled cramming  all leading up to this one day. I walked into the exam hall determined, focused, and ready to give it my all.

And then, she walked in.

One of the invigilators  a woman with the kind of presence that quietly pulls you in. Graceful, poised, with a calm expression that somehow made the chaos around us feel still. I don’t know what it was exactly maybe the way she carried herself, or the way her eyes scanned the room with quiet intensity but in that moment, my brain forgot every equation I ever knew.

For a while, I wasn’t thinking about ranks or cutoffs. I was just trying not to look too distracted, even though my heart definitely was. I wondered what her story was. Did she notice me? Probably not. But for a couple of hours, she became the most beautiful mystery in that exam hall.

I finished the paper, somehow. Maybe it went well, maybe not. But part of me walked out thinking less about my marks and more about a stranger who reminded me that sometimes, life surprises you in the most unexpected, quietly romantic ways.

Have you ever had a moment like that  where someone’s presence just  stays with you?",2,1745157577.0,Crushes,1,1.0,False
1k3n516,https://www.reddit.com/r/cyprus/comments/1k3n516/cafes_in_larnaca/,Cafes in Larnaca,Can you guys recommend a quite coffee shop in Larnaca i can study at? I am a last year Med student so you get me. thanks and much appreciated ,1,1745157508.0,cyprus,1,1.0,False
1k3n4sq,https://www.reddit.com/r/MeetNewPeopleHere/comments/1k3n4sq/43m_here_would_love_someone_new_to_talk_to/,"[43M] here, would love someone new to talk to","Good morning!  Married man here, I am up too early, and have the house to myself.  I am just drinking a little coffee and reading a bit.  I would love to have someone to talk with throughout the morning.  ",1,1745157488.0,MeetNewPeopleHere,0,1.0,False
1k3n3yx,https://www.reddit.com/r/Market76/comments/1k3n3yx/h330_radiated_sugar_bombs_wcoffee_offers/,H:330 radiated sugar bombs W:Coffee offers,,1,1745157416.0,Market76,3,1.0,False
1k3n3gg,https://www.reddit.com/gallery/1k3n3gg,Culinary Crimes With....?,If you could have any two people on Culinary Crimes who are you choosing? I'm going with Smosh's two best detectives Sarah Christ and Detective Where's My Coffee. I'm waiting for any and all lore on them to be uncovered and the obvious competition to be the best detective at Smosh,13,1745157370.0,smosh,2,1.0,False
1k3n36h,https://www.reddit.com/r/dirtongrowth/comments/1k3n36h/sometimes_total_chaos_and_what_looks_like/,Sometimes total chaos and what looks like disaster could actually be opportunity,"I wrote that in a journal entry in 2020 when we were forced to close our doors of our salon, coffee shop and cafe.  

It was the scariest experience in our businesses trying to lead through uncertainty. Not knowing if our businesses were going to survive through the shutdown and if when did reopen, we would still have teams to support the businesses.  We poured our blood, sweat, and tears into these businesses. The thought of closing our salon- after seven painstaking years of building it from the ground up, was heartbreaking! Fear was front and center, and it became easy to spiral downward into self pity. 

The thing that became apparent, the only control in uncertainty is your mindset. Your perspective and ability to see the silver lining through the chaos of uncertainty is what keeps you grounded. As much as we can plan for the future, none of us really know where our lives are headed. 

It’s important to have a plan, but just as important to stay open to the unknown possibilities and unexpected opportunities that come your way. We found ways to innovate, adapt, and keep our business afloat- and somehow, we didn’t just survive the pandemic, we grew through it. I even rebuilt my salon team all over again, shortly after reopening our doors.

The pandemic was a reminder that you are not really in control of your life, the only control you have is your ability to navigate the storms that life throws at you with flexibility and grace. 

The pandemic was that life quake that shook us and opened the door of opportunity to see that there was something else for us in store, something we hadn't planned for and didn't know was possible. 

Two years later, we made the bold decision to sell our businesses and start a new chapter in Spain. When we allow ourselves to grow through life’s storms, we level up- we become more courageous and ready to face new challenges. Gratitude, even in the midst of hardship, is a superpower. It fuels resilience, deepens courage, and helps us evolve into the version of ourselves we never imagined was possible.

What was an experience you had that led you to opportunities you didn't know were possible? ",1,1745157345.0,dirtongrowth,0,1.0,False
1k3n1p6,https://i.redd.it/bqw3itrdwzve1.jpeg,[I ATE] Butter croissant with cold coffee.,,1,1745157215.0,indiafood,0,1.0,False
1k3n0mm,https://www.reddit.com/r/Frugal/comments/1k3n0mm/cheaper_coffee_panera_sip_club/,Cheaper coffee panera sip club,"I joined panera sip club recently at $3 a month for 3 months. When I’m already out I go and pick up a 30 oz iced beverage. I fill it up with no ice and take it home. I have coffe e for 3 days alone and 2 if a loved one wants a cup. I don’t know if I will continue after the 3 month promo is over because the price will be $15 a month. But if I’m shopping for coffee grounds at the store, I don’t think I can get coffee for under $3 a month. ",4,1745157120.0,Frugal,3,1.0,False
1k3mza4,https://i.redd.it/ksz934arvzve1.jpeg,"In the past 9 years of daily use, I have consumed two whole aeropress originals due to microplastics","I mean not really, but my press from 2016 has served roughly 3265 cups of coffee and isn't broken.  I use the AbleFine stainless disc filter and grind my beans to espresso grind, inverted method.   Press on lads and lassies",7,1745157002.0,AeroPress,1,0.89,False
1k3myen,https://www.reddit.com/r/MakeNewFriendsHere/comments/1k3myen/23m_from_nyc_and_down_to_talk/,23m from nyc and down to talk.,"Hey there! 23-year-old guy in NYC looking to connect with some cool people. I'm a big soccer fan, always down for a good chat, and I love exploring random interests. Hit me up if you're interested in grabbing coffee or just hanging out.",1,1745156927.0,MakeNewFriendsHere,1,1.0,False
1k3myca,https://www.reddit.com/r/cuck_femdom_tales/comments/1k3myca/obedient_heart_chapter_one/,Obedient Heart - Chapter One,"David practically dashed through the door, eyes darting to the clock. He still had two hours—plenty of time to make everything perfect. He had to get it right. He hung his coat up, put down his work bag and hurried to the kitchen while glancing at his watch. It was 4.20pm, fortunately his boss had allowed him to leave a little early today so he would have plenty of time to make everything perfect for his wife. His wife. His Dream Girl. The love of his life. Emily. His heart fluttered slightly as he pictured her face, as he thought of her smile, of her touch.

Two years since they were married and he was more in love with her than ever. And tonight for their anniversary, he wanted things to be just right. He knew she would love it. He had gone to so much effort and he just knew she would be pleased with him. His heart fluttered as he imagined her walking into a spotless kitchen, her eyes lighting up—just for him. He could imagine her look of happiness and love as she saw the bunch of flowers on the kitchen table, a beautifully cooked meal (Herb crusted Monkfish with Potato Dauphinoise and spinach – her favourite meal)…and then the petals leading up the bedroom…His heart fluttered again. Her touch. Her smell. Her liquid eyes gazing into his…Concentrate! Concentrate! He thought. He only had two hours until she was home.

He prepared everything with a speed and precision that he was proud of. Emily had high standards and ever since the wedding he had made sure to adhere to them.

The front door clicked open to announce Emily’s arrival. Showtime!

“Hey sweetie, I’m so glad you’re home.” David walked towards her with a large, warm smile on his face. He took her coat and bag from her. “Can I get you anything?”

Emily swept past him, her luscious black hair flowing behind her, the scent of jasmine clinging to the air. She didn’t look at him. David was used to this. Sometimes she could be moody, sometimes she could be wrapped up in her own world. That was her prerogative. Even though it hurt sometimes, he knew better than to draw attention to it. Emily plopped herself down on the couch and put her feet up on the coffee table. David winced a little as he saw the mud from her boots appear on the table, the table he had polished only thirty minutes earlier.

“Love you sweetie” He spoke, trying to get her attention, “Did you have a good day?” Still nothing, Emily was engrossed with her phone. David started to walk back to the kitchen when Emily stopped him,

“Glass of white wine!” She asked, well… it felt to David more like a demand, but he pretended that she was asking.

“Of course sweetie!” He returned with the wine and placed it on a coaster next to her left hand. As he leaned over her, he inhaled her soft, floral scent and could feel his mind swim a little. It had been three months since they had last had sex. Three weeks since she had last kissed him…He longed for her.

“Take my boots off” She said coldly. “Oh and get this mud off the table before it dries!”

“Yes of course” He smiled serenely. He was adamant that nothing was going to ruin this evening. He loved Emily, he would accept being spoken to by her, however she liked.

He kneeled before her and lifted each leg up in turn as he gently removed each shoe. Emily ignored him as he did this. Not even a glance in his direction.

Once her boots were off and the table was spotless again, he sat down on the couch next to her.

“I bought you a present Emily” He spoke softly, carefully. He was desperate for her to look at him, to acknowledge him. But he did not want to irritate her.

“Really?” She finally looked up from her phone, “That’s sweet of you.” She smiled.

“I’ll go and get it.” His heart was thumping as he retrieved the gift from under the bed and handed it to her, along with the card. Inside was something more than just a note. A poem. He’d written it late at night, over several evenings, pouring in all the words he was too afraid to say aloud:

 

*That night we skated, hand in glove,*  
*Your fingers wrapped in mine—*  
*Not for warmth,*  
*But something gentler,*  
*A promise I still hold.*

*The air was sharp, the stars were shy,*  
*You laughed as I stumbled,*  
*And I laughed too—*  
*Because you looked at me,*  
*Like I was someone worth falling for.*

*Since then, I’ve fallen gladly,*  
*Every day, deeper still.*  
*Not just for the memory of your touch—*  
*But for the way you once waited*  
*For me to catch up.*

*If this night means anything,*  
*Let it be this:*  
*Even in the coldest winters,*  
*I have never felt alone*  
*Since you reached for my hand.*

 

“Any reason for this?” She asked quizzically.

“Errrrr…Ummm…well its our anniversary.”

“Oh my god! No, it cant be…” She looked at the calendar on her phone to check, “Oh my god it is! Shit, sorry, I forgot.” She looked slightly sheepish as she looked at him.

“That’s okay” David said as he stroked her hair, “I just thought…I wanted you to have a good day!”

“Awwwww, you’re a real darling, you know that. I can be such a bitch sometimes but you’re always so devoted to me.” Emily’s whole demeanour softened.

“I love you so much Emily” David spoke with such feeling. He could feel his heart heavy with love and desire.

“I know you do, you little romantic thing!” Emily giggled and tapped his nose with her index finger playfully. He noticed that she hadn’t said that she loved him back. He knew she did. He just wished sometimes she would tell him more often.

She tore open the wrapping paper and gazed in disbelief at the diamond necklace that was revealed.

“Oh my god, I love it, its stunning.” She grinned widely as she examined it closely. It was decadent, gorgeous, eye catching but without being gaudy or over the top. David felt it suited Emily perfectly.

“I’m so glad you like it!” David said, grinning ear to ear. Seeing Emily happy, especially happy with him was the best experience of his life. Nothing beats it, he thought to himself. Literally nothing. Emily came close to him, hugged him. She held him—for a heartbeat, then two. David clung to that touch like a drowning man. Maybe tonight would be different. Maybe she saw him again.

“You’re special to me David!” She whispered in his ear and he almost melted. His heart was overflowing. He loved her so much.

And just like that it was done. Finished. Emily leaned back on the sofa and went back to her phone. To go from such a high back down to earth was hard for David. The romance, the love, the evening’s momentum seemed to have just dissipated. The necklace had cost him a lot. A few thousand dollars. He didn’t mind the money. He just had hoped her joy would have lasted longer.

His eyes fell upon the unopened letter with its tender poem inside. The letter lying on the coffee table next to Emily’s boots. He had been nervous and excited for her to read what he had written. It had taken him hours of drafting and redrafting. But she couldn’t even be bothered to tear it open.

“I’m cooking your favourite meal Babe!” Emily remained focussed on her phone, “Babe!” He spoke again. “Emily?”

“What?!” Emily shot back at him and his heart skipped a beat. She was annoyed now. He’d fucked it up. Why did he have to be so annoying. Why couldn’t he just leave her alone sometimes. His self-doubting thoughts swirled round his head.

“I’m sorry…I’m really sorry…I was just saying that I was making Monkfish…for our anniversary, the way you like it.” He spoke timidly, not able to meet her eye.

“Well you should have said something, you should have asked David!” She spoke irritably, “I fancy Pizza tonight.”

“Oh yes of course, I’m sorry.” He knew he’d ruined the evening and he hated himself for it. “I’ll go and order us a couple of pizzas and I’ll go and pick it up so you don’t have to wait.” He remembered the last time he had kept his beloved wife waiting for her food when she was hungry; he had had to sleep on the couch for a week. He walked towards the phone in the hallway but was stopped in his tracks by his wife shouting out “More Wine!” He felt a wave of nausea and dread. He was always shocked at how quickly Emily’s mood could change but he rushed to get the bottle and topped up her glass.

He then called the local pizza restaurant and before heading out to the car to pick it up, he decided to pick up all the petals he had placed leading to the bedroom…something told him that tonight wasn’t going to be the night for love.",1,1745156922.0,cuck_femdom_tales,0,1.0,False
