id,url,title,text,score,created_utc,subreddit,num_comments,upvote_ratio,over_18
1t6oy78,https://www.reddit.com/r/victoria3/comments/1t6oy78/idea_for_completing_the_brazilian_magnanimous/,Idea for completing the Brazilian magnanimous monarch JE and coffeemaxxing,"So I tried first a month ago for a random Brazil run, and apparently I didn’t know the Pedro point rules so I fucked up, I tried again today (1.12.5) and fucked up again. These are like 10h in total and pretty frustrating. 

After some recaps I summarized some key points. First is to never let a civil war reach 50% progress which costs a Pedro point. If you don’t expand, the threat would be mainly the slave rebellion movement. I don’t have any brilliant idea on this but maybe healthcare and legacy slavery helps. 

About the slavery JE, completing it will cost one Pedro point, but the catch here is filling the progress bar to 100% won’t do anything! I assumed it would trigger something like the triumph of liberals but nothing happened. So you can just go full liberal (without a pro slavery or conservative civil war) and try to marginalize armed forces and landowners which gives one Pedro point respectively. 

About the integrating ethnicities, I got it last time so I didn’t keep an eye on it but I failed it this time. It seems like the fervor requirement was decreased from 75 to 65 but still you have to pay attention. For this you will need public schools (which is also a reason why state religion is unnecessary) and wars with your neighbors. In the social tree rush pan-nationalism (gives a few fervor) after company. I think the best choice is an external trade league or religious convocation if you’re going state religion.

This also impacts your choice of power bloc.  It means you shouldn’t create a sovereign empire and try to puppet the Spanish South America by subjugate them (which I did) for two reasons: the cohesion is so bad (relations eats up your influence and liberty desire eats your military budget), and you miss war opportunities to get Brazilian fervor up. Also if you don’t wage wars to your neighbors, you don’t really have a chance to spend your infamies. If you get bad relationships with GB, it might ask you to transfer your overseas puppets, and when (not if) your navy gets beaten up, it’ll be a threat to the navy JE which gives a Pedro point. 

A big problem of Brazil is no sulfur, so I recommend rushing for market unification for the first two mandates, and prioritize getting Venezuela and Chile into the block. Chile is an easy one because you can get Chile into your war against Bolivia at the beginning of the game.

Also a random strategy for plantation (coffee) maxing: improve relationship with BIC and somehow get investment rights. For companies go general tooling (prestigious tools), coffee plantations (prestigious coffees), general minerals for basic mineral coverage, Brazilian flavored railway company (15% coffee plantations throughout prosperity bonus), and after finishing the Pedro JE conquer Prussia/Austria for prestigious engines companies very late game. The only goods plantations consume are tools and engines, so this will be how you can get max throughputs. It would have been cool if there were a Brazilian flavored coffee company though…

Overall this is a pretty cool DLC which for me is annoyingly interesting. I can’t really think of any other JEs I’ve played harder to complete than this one, and the biggest reason is probably it actually forbids territory expansion. Point it out if I got anything wrong or you have other ideas. ",1,1778191287.0,victoria3,1,1.0,False
1t6oxzl,https://www.reddit.com/r/TokyoTravel/comments/1t6oxzl/where_to_stay/,Where to stay,"My girlfriend and I will be stopping in Tokyo for 1 day, 2 nights landing in Haneda airport.   
We are both in our early 20s but going out and nightlife isn’t really our thing. We both love experiencing new food when we go to new places and access to great food is really important. We also both love matcha, coffee, and want to try Japanese desserts.  
So what would be the best area to get a hotel and visit for the day, it would be great if we could just walk around and see great places to get real sushi, tonkatsu, Wagyu, matcha, desserts, etc.  
I also love the Japanese car culture so would be cool to experience that.",0,1778191273.0,TokyoTravel,5,0.11,False
1t6oxyt,https://www.reddit.com/r/UIUC/comments/1t6oxyt/beyond_the_cloudy_days_in_cu/,Beyond the Cloudy Days in C-U,"Hello UIUC Reddit,

There has been an influx of mental health posts and reports lately. As someone who has struggled with their mental health throughout college and long before, I can only tell you one thing: it does get better.

Beyond the cloudy days here in the Champaign-Urbana area, when there is sun, it really helps to walk on the Quad. Maybe even grab your favorite coffee, soda, or whatever you drink (boba is my personal favorite).

Grades didn't come back the way you wanted? Big deal. Come back with a vengeance next semester. School is only a small percentage of the life you are supposed to live. If you ever feel like life is too much for you to bear, think of all the people who would miss you, or the people you will never impact by not being here.

\- u/Beneficial_Physics68

Never Too Early for Christmas Cheer! I love You All! [https://www.youtube.com/watch?v=9h39W2fI8u0](https://www.youtube.com/watch?v=9h39W2fI8u0)",13,1778191272.0,UIUC,0,1.0,False
1t6oxhx,https://www.reddit.com/r/indiranagar/comments/1t6oxhx/im_28_living_alone_in_indiranagar_and_ive_finally/,"I’m 28, living alone in Indiranagar, and I’ve finally realized: I’ve never enjoyed life more.","​A few months ago, I was standing in the middle of a living room filled with flat-pack IKEA boxes, wondering what the hell I was doing. It was January, I had just moved into my own place in Indiranagar, and for the first time in a long time, it was just me. No roommates, no constant background noise, just a blank canvas.

If you had told me then that by May I’d be the happiest I’ve ever been, I probably wouldn’t have believed you. But lately, I’ve realized something massive: I’ve started loving myself, my space, and my life more than anything else.

For the longest time, I felt like I was just rushing. Rushing to build my media production agency, rushing to meet expectations, rushing to figure out my late twenties. But setting up this apartment changed something. I put on an oversized hoodie, threw on a playlist through the soundbar, and built my sanctuary piece by piece.

Now, my weekends don't involve forcing myself into crowded pubs where you can't even hear yourself think. Instead, my idea of a perfect Saturday starts slow. I throw on my favorite pair of New Balances and walk down to a quiet cafe with outdoor seating. There is nothing quite like sitting in the Bangalore morning breeze with a proper, artisanal pour-over or a hot filter coffee, just watching the neighborhood wake up. It’s quiet. It’s intentional.

​And then, there are the milestones you finally let yourself celebrate. Last month, I finally pulled the trigger and brought home a Kawasaki ZX-6R. Taking that machine out, feeling the raw power of the engine under me , it’s pure therapy. It’s a promise I made to myself years ago, finally realized.

​My evenings are strictly mine now. Sometimes it’s ordering a massive portion of Meghana Foods biryani and spending hours diving into a Cyberpunk 2077 playthrough, or queuing up for some Dota 2 or Valorant. I’ve stopped feeling guilty for indulging in my passions, whether it's gaming, upgrading my audio gear, or obsessing over my sneaker collection.

I’m 28. I’m single, I live alone, and I’m finally at peace. To anyone in their twenties feeling the pressure of the timeline, or feeling like they aren't ""doing enough"" , take a breath. Build your space. Buy the thing you’ve been saving for. Find a quiet corner to drink your coffee. When you actually start building a life entirely for yourself, you’d be surprised by how quickly you fall in love with it.",6,1778191244.0,indiranagar,3,1.0,False
1t6oxg1,https://www.reddit.com/r/travel/comments/1t6oxg1/where_to_stay/,Where to stay,"My girlfriend and I will be stopping in Tokyo for 1 day, 2 nights in July on the way from Sydney to NY. We would just like some suggestions on where we should stay.     
We are both in our early 20s but going out and nightlife isn’t really our thing. We both love experiencing new food when we go to new places and access to great food is really important. We also both love matcha, coffee, and want to try Japanese desserts.     
So what would be the best area to get a hotel and visit for the day, it would be great if we could just walk around and see great places to get real sushi, tonkatsu, Wagyu, matcha, desserts, etc.     
I also love the Japanese car culture so would be cool to experience that. ",0,1778191241.0,travel,2,0.4,False
1t6owu5,https://www.reddit.com/r/careerguidance/comments/1t6owu5/should_i_be_worried_that_my_current_company_will/,"Should I be worried that my current company will find out I’m leaving to an old client, and can they fire me for that?","I recently applied for a job at an old client company we used to work with. To my knowledge, my boss and that company’s boss were friendly while working together, but haven’t talked in months. I got invited to and interview next week, but now see on my boss’ diary that they are going for coffee a week after my interview with the other company’s boss, AKA the person interviewing me AND who I’d be working under. Should I be worried that they will talk about my application, and can my current company fire me if they find out? I am 2 weeks away from my probation, and looking for another job as a) what I’m doing now is not enjoyable and I want to transition and b) I’ve been told by multiple coworkers that they are super cutthroat here and choose who to keep on after probation based on how much they like them, not how well they perform. ",2,1778191206.0,careerguidance,0,1.0,False
1t6owlh,https://www.reddit.com/r/tea/comments/1t6owlh/i_might_be_switching_back_to_tea/,I might be switching back to tea,"Hi. I was a tea drinker in high school, then I discovered coffee, and have drank coffee ever since. But ive been getting herbal rea and I love the calming sensation it gives me. I also dont crave caffeine as much. I might be switching back on accident. Im gonna miss coffee. Maybe ill still have coffee on occasion",3,1778191189.0,tea,3,1.0,False
1t6ovui,https://www.reddit.com/r/DeepThoughts/comments/1t6ovui/we_have_free_will_when_we_feel_discomfort/,We have free will when we feel discomfort,"Free will is  the idea that people can genuinely choose between different possible actions, instead of actions being influenced by biology or outside influences. For example: If you choose tea instead of coffee, free will means you could have chosen differently. But, every thought and action was already determined by your genes, brain state, and environment, then some philosophers argue free will is an illusion. Thus there is no scenario where you would have chosen tea above coffee at same circumstances.  
Overall, it suggests that much of human behavior is programmed, and that we usually act according to this programming. From now on, I will call “free will” “progamming”

I will give an example where I believe we lose our progamming: Every year, Christmas is celebrated. Many people place a Christmas tree in their living room and decorate it. For some, this is tradition; for others, it is connected to religion. But why do we put a tree inside our homes? Why do we decorate it? Most people do not question the logic behind the action. The reason we dont question is that Christmas is strongly associated with joy and positive emotions. The experience feels good, thus we rarely reflect on our behavior or question the meaning behind it.  
But imagine the opposite. If Christmas were associated with negativity, discomfort, or fear, people would begin to question the tradition. They would become more aware and reflect on their actions.  
This is where I believe consciousness and free will emerge.

So what does this mean?  
When you feel discomfort, it is consciousness whispering to you to reflect on your actions, thoughts, and emotions. Discomfort interrupts automatic behavior and forces awareness. Perhaps free will is not something constant, but something that emerges in moments of consciousness. It appears when awareness breaks through our programming, allowing us to question ourselves, reflect, and choose whether to continue our current behavior or change it.",2,1778191139.0,DeepThoughts,2,1.0,False
1t6ovg6,https://www.reddit.com/r/vagabond/comments/1t6ovg6/thursday_may_7th_2026_log_update_536pmest/,"Thursday, May 7th, 2026 (Log) (Update) [5:36PM/EST]","I was in a depression funk..for a few days.. barely ate, barely slept, mind racing, reclusive..

I was able to snap out of it today.. went for a walk.. bought some groceries.. got me can of coffee.. I had ran out.. I’ll do another food run tomorrow..

\- - - - - - - - - - - - - - - - - - - - - - - - - - - - - - - - - - - - 

The weather was cloudy but nice when I walked to the store today..  
I saw the Cyr bus while walking back to the shelter.. I’ll be taking that.. when I leave this city..

\- - - - - - - - - - - - - - - - - - - - - - - - - - - - - - - - - - - - 

Around 3pm.. worker knocked on my door.. said I was being moved.. to another room.. 

He was lucky I was in a good mood today.. had energy after drinking my Maxwell house coffee.

I rushed to get my stuff out of there.. to the other room..

My bald, old, roomate ain’t gonna’ be to happy about this.. he’s got way to much stuff to move..  
\- - - - - - - - - - - - - - - - - - - - - - - - - - - - - - - - - - - -   
I have to be honest.. I don’t like.. the new people upstairs.. their vibes are just.. something else..

Glad.. I won’t be here for long.. im leave this dumb fuckery.. and finally be free..

\- - - - - - - - - - - - - - - - - - - - - - - - - - - - - - - - - - - - 

Im gonna snack on some classic bugles.. sip on some   
mineral water.. relax.

Currently listening to - Part Of Me by: Armin Van Buuren  
\- - - - - - - - - - - - - - - - - - - - - - - - - - - - - - - - - - - - 

I’ll check in again with you guys.

Be safe out there. 

Peace be with you all.

\~Serrot",10,1778191112.0,vagabond,3,1.0,False
1t6otjv,https://www.reddit.com/gallery/1t6otjv,Ambrosia coffee Wilmington,"Don’t be fooled by the dumpy little parking lot.  This coffee is spot on. I got the Viet Coco. 

It’s Vietnamese coffee with coconut milk and coconut flakes on top.",1,1778190989.0,u_Linn0000,0,1.0,False
1t6ot5w,https://www.reddit.com/r/4hourbodyslowcarb/comments/1t6ot5w/5_weeks_in_zero_progress_what_am_i_doing_wrong/,"5 weeks in, zero progress. What am I doing wrong?","Hey fellow slowcarbers.

I’m quite surprised (and frustrated, honestly) about how this diet might not be working for me. I’m currently on week 5 and I’ve officially lost a grand total of 0.4kg (0.88lbs).

Before anyone suggests it: yes, I took my measurements on day 0 and just checked them again today. I officially have ZERO change. Not even half a cm down anywhere - waist, thighs, arms. Literally nothing.

And before you think I might be eating wrong or slipping up on the rules, my husband and I are eating the exact same things in the exact same portions. He has officially lost 5kg (11lbs) in this same timeframe. Yes, I know everybody is different, but I’m just trying to say that I’m not eating anything that is not compliant.

Here’s what my meals looked like this week so you can tell me if I’m missing something:

**Morning (within 30 mins of waking up):** 3 eggs, 100g black beans, 50g minced beef, 1/2 avocado  
**Midday:** 120g lentils, 100g minced beef (or 150g chicken breast), broccoli  
**Evening:** 120g black beans, 150g minced beef (or 250g salmon), broccoli  
**Liquids:** About 2 liters of water, loads of black coffee, herbal teas.

MyFitnessPal says my protein intake is about 120g a day (well above the recommended amount), and I have an (unintentional) calorie deficit of roughly 500 to 800kcal.

I go mental on cheat days. When I say mental, I mean it. I eat like a labrador that’s been starved for a week. I stuff my face with chocolate, pasta, fruits, crisps, you name it.

For a bit of context, you can see my previous post about how I felt hungry all the time here: [https://www.reddit.com/r/4hourbodyslowcarb/s/rqdB6DutoH](https://www.reddit.com/r/4hourbodyslowcarb/s/rqdB6DutoH). After a few suggestions from this sub, I switched from pure isolated whey to the solid breakfasts you see above, which helped with the hunger.

**TL;DR on my history:** I previously lost 50kg with keto and successfully maintained it for 5 years. I'm just trying to lose some post-uterine surgery weight (about 4-5kg) at the moment.  
Is my body reacting this way because I’ve introduced carbs (even slow ones) to my diet after 5 years of not eating any? Has anyone had such a slow/unsuccessful start like this?

EDIT: 37F. Current BMI is 23. I don’t exercise but am pretty active throughout the day as I run a coffee shop.",1,1778190962.0,4hourbodyslowcarb,1,1.0,False
1t6oqot,https://www.reddit.com/gallery/1t6oqot,DOUGHNUTS ON DOVER!!!,"How did I not know about this until now?  
REAL doughnuts, not that Timmy’s junk ",28,1778190798.0,nanaimo,15,0.94,False
1t6op3u,https://www.reddit.com/r/BenignExistence/comments/1t6op3u/a_new_friend_took_me_to_breakfast_after/,A new friend took me to breakfast after volunteering this morning.,"I woke up this morning on the first day of my 3-day weekend. I went to my run club at 5:30 am and received a standing ovation for completing my first 100-mile race last weekend. It was great to see my friends. I went straight to a volunteer commitment I usually do on the first Thursday of the month. We receive pallets of food and distribute it. I met a new friend there. He made sure I was in on the jokes as my  
Spanish is pretty bad. Afterwards, he asked me to grab a bite. He bought sandwiches and coffees and we chatted before I headed home to move apartments and deal with a long list of chores. I picked up some moving boxes I found for free in my ‘Buy Nothing’ group on Facebook.

Today, I feel like a part of my community. Everyday, I find reasons to continue believing most people are good. I moved around for a decade before I landed here and I don’t take these moments of connection for granted.",56,1778190697.0,BenignExistence,6,1.0,False
1t6op2j,https://i.redd.it/s66k95pudszg1.jpeg,Love how Walmart put these two next to each other.,,0,1778190694.0,Epstein,13,0.24,False
1t6op15,https://www.reddit.com/r/AITAH/comments/1t6op15/aitah_for_not_wanting_to_pay_to_go_to_the_club/,AITAH for not wanting to pay to go to the club when my gf got a ticket for free?,"So basically she works with this guy that is a club promoter on the side and there is an event he is throwing that my gf wants to go to. She wants me to go too and I said okay sure I’ll come but now she just told me that her and her friend from work got two tickets despite asking for more. 

Now he knows about us and that we have been dating for 5 years, I’ve never had a problem but then he started buying my gf coffees and doughnuts at work and started being overly nice. At first, I never really had any problems but it kept going and I started to feel a way about it cause it seemed like he was hitting on her and he’s known to be a player. Also, I know her and know she would never cheat but when she would talk about him, she’d get overly excited  and idk for lack of words but was acting like a fan, which kinda bothered me. 

I told her about it and how it seemed like she liked him and she reassured me that she didn’t and said that she would limit their interactions, even though I never told her to do that. But that was the end of that and it’s been awhile since it’s happened, so we’ve moved on from it. Until now, she wants to go and I’m just reminded of everything. 

Idk for some reason, I have a problem paying while he let her in for free cause it feels like he was disrespectful of our relationship before and this action shows it again. I told her to go without me and just go with her friend, but now she’s mad at me for not going with her after saying I would go. 

She said that we would’ve paid ourselves to go anyways, which is true since I did commit to going. But it feels different to me. I feel like just making me pay to get into the club feels like I’m allowing this disrespect of my relationship and for this guy to keep hitting on her despite our relationship. 

Idk I’m not good at describing things so I may be the asshole just looking for other perspectives ",2,1778190691.0,AITAH,60,0.56,False
1t6oo2a,https://www.reddit.com/gallery/1t6oo2a,Home Reno suggestions?,"Recently bought a home. The second picture is the current layout. The first is what I would like to do with it. The second hallway leading to laundry bedrooms etc is very dark. I would like to combine it with the first hallway. With the carport not being right next to the property. That part of the house is in a large slope and it would just not be worth the money building it there. The current built in wardrobes in bedroom two and 3 are absolutely massive and unnecessary. Shrinking them would not harm the bedrooms individually. 

The last picture is just to visualise how the patio and glass roof looks like to better understand the property. 

What do you guys think?",2,1778190623.0,floorplan,1,1.0,False
1t6onxu,https://i.redd.it/themsl3ndszg1.jpeg,Coffe coloured coffee mug,,5,1778190615.0,notinteresting,2,1.0,False
1t6onmm,https://v.redd.it/9i4fb0xddszg1,I built an app for my 84 yr old father who is struggling with his memory,"Hi,

My dad is a lifelong learner, fitness enthusiast (and even an early meditator!) He began struggling with memory loss about five years ago, after his his 80th birthday. It was very hard for us to watch someone who had been so committed to their health and mental hygiene begin to struggle.

I had taught myself memory palace training which is a centuries old technique of improving memory (It is used by memory champions who can remember strings of numbers hundreds of digits long, was featured in the book *Moonwalking with Einstein*) it has also been scientifically proven to delay and offset some cognitive decline. 

I had used the technique myself to help with my own memory, so about a year ago, I mocked up a custom GPT for my dad. He loved it and he loved it! 

He asked me if there was a he could share it with his other friends but since they themselves didn't have GPT subscriptions he was frustrastred he couldn't forward it.

I’m a copywriter by trade and was working for a startup that used AI to train for sales. I asked a few coders to pitch in and give advice to help get the app off the ground and we began to build a demo and then they pointed me to tools like Claude and Replit (probably to get me to quit bugging them so much :)) 

***The Idea...***

I wanted to build what Duolingo did for language learning, but for memory and cognitive training.

We know we need to exercise our bodies, but let’s also encourage folks to train their minds. The science on this is solid: a recent AP article stated that brain and memory training is one of the biggest deterrents for cognitive decline and early-onset dementia. 

If we can just get folks spending 10 minutes a day while they have their coffee to also train their memory... 

We can make a huge difference.

***The Mission...***

I’d like to get this into at least 1,000 seniors' hands by the end of the summer. I’m also actively using the app to raise money for Alzheimer's and dementia charities, as well as Sanfilippo syndrome (which is a childhood-onset form of dementia). The app will automatically donate a percentage of profits and users will also have the choice to ""round up"" their membership to donate as well.

***The Other, Other Goal...***

To make this fun and user-friendly. Nobody will use an app if it’s hard or boring. It’s as important to me that our users feel pride in their accomplishments WHILE they learn the technique. 

I built a digital ""Memory Wizard"" to guides them the and offer support. I mean this isn’t studying for the GMAT or learning to become one those people with the organs thingies who land panes... It's a way for folks to have fun, learn a skill, and feel accomplished every day.

My mom tried it and texted her whole family the little story the app generates after each session using your answers! That was the moment I knew it was working!

Please feel free to ask me questions. This is something I am passionate about and excited to share.

Check it out at: [memoryamble.com](http://memoryamble.com)",1,1778190595.0,sideprojects,3,1.0,False
