id,url,title,text,score,created_utc,subreddit,num_comments,upvote_ratio,over_18
1ssapam,https://www.reddit.com/r/Dallas/comments/1ssapam/dfw_events_4222026_to_4262026/,DFW Events - 4/22/2026 to 4/26/2026,"Hello r/Dallas,

Here is another list of events for this week.

**r/Dallas user recommendations:**
* **Local band Adorn's album release on 4/25 at RBC**
* **Rising Stars of Dallas Comedy @ Backdoor Comedy Club in Richardson - Sunday 4/26***

These events are hosted at the following site with more upcoming events listed for your reference: [https://dfw.msondo.com/](https://dfw.msondo.com/).

If you would like to receive an email with a list of events happening in DFW, please [click here](https://218dc6fe666511f09acdfb999b1032ae.eo.page/hkg4m).

**Please also reach out here via a comment if you have an event you would like to list here. I'm happy to help feature events hosted by active members of the sub**

##Concerts
| Date | Event | Venue | City | Start Time | Description |
| :--- | :--- | :--- | :--- | :--- | :--- |
| 04/22 | JoJo & The Pockets and Black Therapy | The Free Man Cajun Cafe and Lounge | Dallas | 7:00 PM | Mid-week jam session with R&B and soul sounds. |
| 04/22 | Insane Clown Posse | The Factory in Deep Ellum | Dallas | 7:00 PM | High-energy hip-hop show with intense fan culture. |
| 04/22 | Hasan Raheem Dkp North America | House of Blues Dallas | Dallas | 7:00 PM | Pakistani singer performs lively pop-R&B-indie set. |
| 04/22 | Return to Dust | Trees | Dallas | 7:00 PM | LA trio blends heavy grunge and alt rock. |
| 04/22 | Twenty Hounds | Deep Ellum Art Co | Dallas | 8:00 PM | Dallas-based Grateful Dead tribute act jams live. |
| 04/22 | The Crane Wives - ACT I With special guest Lilith Max | The Echo Lounge & Music Hall | Dallas | 7:00 PM | Indie folk and rock with Texas native. |
| 04/22 | Erik Barnes Live | The Library Bar | Dallas | 6:00 PM | Soulful pianist plays romantic and pop tunes. |
| 04/22 | Karaoke with Snake | The Goat | Dallas | 10:00 PM | Sing popular tunes with friends every week. |
| 04/22 | Wednesday Night Karaoke | Lexus Box Garden at Legacy Hall | Plano | 5:00 PM | Local amateurs perform pop-rock-country hits outdoors. |
| 04/22 | Jim Milan's Bucket List Jazz Band | Tulips | Fort Worth | 7:30 PM | Lively traditional jazz performance by Texan bandleader. |
| 04/22 | CW Sturgeon | Magnolia Motor Lounge | Fort Worth | 9:00 PM | Live country music by Texas singer-songwriter. |
| 04/22 | Elite Jazz Jam | The Balcony Club | Dallas | 8:00 PM | Dallas jazz musician plays classic tunes weekly. |
| 04/23 | An Evening With PinkPantheress | South Side Ballroom | Dallas | 8:00 PM | UK-based singer-songwriter plays pop/alternative hits. |
| 04/23 | BROOKE O'BRIAN! | Opening Bell Coffee | Dallas | 7:00 PM | Texas native performs intimate acoustic pop-folk set. |
| 04/23 | Eric Johnson | House of Blues Dallas | Dallas | 7:00 PM | Austin-born guitarist plays iconic blues-rock set. |
| 04/23 | Junkyard Cat | Three Links | Dallas | Not specified | Alternative rock concert with live music. |
| 04/23 | NewDad | Club Dada | Dallas | 8:00 PM | Galway-born band plays atmospheric indie rock. |
| 04/23 | The LIMEWIRE Party | Shot Topic | Dallas | 8:00 PM | Nostalgic party with upbeat tunes and drinks. |
| 04/23 | Vampires Everywhere Live | Texas Tea Room | Dallas | 7:00 PM | Swedish heavy metal band offers intense guitar-driven show. |
| 04/23 | COBRAH - TORN TOUR | The Echo Lounge & Music Hall | Dallas | 7:00 PM | Swedish performer brings high-energy electronic music. |
| 04/23 | Soul Jazz Thursdays | Sandaga 813 | Dallas | 8:00 PM | Intimate jazz and soul performance by American musician. |
| 04/23 | Tyler Childers - Snipe Hunt | Dos Equis Pavilion | Dallas | 6:30 PM | Country concert with Texan singer-songwriter and friends. |
| 04/23 | Erik Barnes and Jeff Robbins Live | The Library Bar | Dallas | 6:30 PM | Pianist/vocalist plays pop & lounge standards. |
| 04/23 | ÆON:MODE | SILO Dallas | Dallas | TBA | Intimate ductwork show features high-energy EDM and visuals. |
| 04/23 | Branoofunck | Revelers Hall | Dallas | 10:00 PM | Funky tunes fuel all-night dance party. |
| 04/23 | Blues Jam Hosted by Pete Barbeck and Perry Jones | The Goat | Dallas | 9:00 PM | Dallas blues jam with local musicians. |
| 04/23 | 2026 Dallas Cowboys Draft Party presented by Miller Lite | Ford Center at the Star | Frisco | 6:00 PM | Football draft coverage with athlete appearances. |
| 04/23 | A Night of Duke Ellington & Thelonious Monk | Scat Jazz Lounge | Fort Worth | 8:00 PM | Tribute to jazz legends John Coltrane and Billie Holiday. |
| 04/23 | FREE SHOW - Playtown | Magnolia Motor Lounge | Fort Worth | 9:00 PM | Local singer-songwriter brings high-energy rock/country show. |
| 04/23 | Candle Lit Songwriter Showcase Open Mic | The Balcony Club | Dallas | 7:00 PM | Dallas singer-songwriter performs intimate, candlelit acoustic show. |
| 04/24 | Bilmuri - Kinda Hard Tour | South Side Ballroom | Dallas | 7:00 PM | Pulsating rock show with energetic guitar riffs. |
| 04/24 | ELLA DABNEY! Album Release Show! | Opening Bell Coffee | Dallas | 7:00 PM | Dallas-born singer performs neo-soul and pop. |
| 04/24 | fakemink: a Terrible Beauty | House of Blues Dallas | Dallas | 7:00 PM | Electronic pop duo delivers visual spectacle. |
| 04/24 | HAPPY LANDING Big Sun Tour | Three Links | Dallas | 8:00 PM | Southern-infused punk-folk fusion with energetic performance. |
| 04/24 | All Ye Everything | RBC | Dallas | 9:00 PM | Energetic hip-hop and rap DJing with classic hits. |
| 04/24 | Mt. Joy | Longhorn Ballroom | Dallas | Check official site | Indie folk-rock ensemble performs atmospheric, melodic set. |
| 04/24 | Club 90s Presents BTS Night - 18+ Event | The Echo Lounge & Music Hall | Dallas | 8:30 PM | South Korean DJ performs 18+ K-pop party. |
| 04/24 | Hip Hop and R&B DJ Night | Sandaga 813 | Dallas | 9:00 PM | High-energy party with hip-hop, rap, and R&B DJs. |
| 04/24 | Goga Live | The Library Bar | Dallas | 8:30 PM | Russian-born baritone brings opera-rock fusion to life. |
| 04/24 | Alesso | SILO Dallas | Dallas | 9:00 PM | Swedish DJ brings progressive house beats. |
| 04/24 | Stone Savage Band Live | Stoney's Wine Lounge | Dallas | 8:00 PM | Dallas-based bassist performs live jazz. |
| 04/24 | Michael King and the Icebreakers | The Goat | Dallas | 10:00 PM | Dallas blues-rock trio delivers energetic live performance. |
| 04/24 - 04/25 | JUKEBOX PREACHERS | Longhorn Icehouse | Dallas | 9:00 PM | Texas-based cover band plays lively music. |
| 04/24 | La Arrolladora | The Pavilion at Toyota Music Factory | Irving | Not listed | High-energy Mexican band plays lively brass-filled corridos. |
| 04/24 | La Arrolladora Banda El Limón | The Pavilion at Toyota Music Factory | Irving | 8:00 PM | Regional Mexican band from Mexico performs. |
| 04/24 | Plaza Live Music - Factory Fridays | Toyota Music Factory Plaza | Irving | 6:30 PM | Live music and drinks on the plaza. |
| 04/24 - 04/25 | Live Music: Ben Morris & Mike Ethan Messick | Texican Court | Irving | 7:00 PM | Texas duo brings Americana/country rock to the stage. |
| 04/24 | Chris Knight Live | Love and War in Texas | Plano | 8:00 PM | Vocalist trio blends country-folk in cozy setting. |
| 04/24 - 04/26 | Lone Star Smokeout 3-Day Pass | AT&T Stadium | Arlington | 3:00 PM | Country music and BBQ fest with top acts. |
| 04/24 | Lone Star Smokeout: Shaboozey & Max McNown - Friday | AT&T Stadium | Arlington | 3:00 PM | Country music fest kicks off with big names. |
| 04/24 | FREE CONCERT: Uncle Lucius w/ Jordan Nix | Levitt Pavilion | Arlington | 7:10 PM | Austin-based band plays free outdoor concert. |
| 04/24 | Paul Thorn | Lexus Box Garden at Legacy Hall | Plano | 6:00 PM | Soulful singer-songwriter blends blues, rock & roots. |
| 04/24 | Tom Bones Malone with Blues Brother Trib. Texas Bluesmen & Division 80 | The Revel Patio Grill | Frisco | 7:00 PM | Epic brass and soul tribute performance |
| 04/24 | Josh Grider | The Post at River East | Fort Worth | 8:00 PM | Intimate country concert with Texas artist. |
| 04/24 - 04/25 | CRASH THE COTTAGE: A BRATTY RIVALRY DANCE PARTY | Tulips | Fort Worth | 9:00 PM | High-energy electronic beats fuel 18+ dance party. |
| 04/24 | Ricki Derek & the Vegas Six | Scat Jazz Lounge | Fort Worth | 8:00 PM | Vegas-style jazz with a Texas touch. |
| 04/24 | Ricki Derek & the Vegas Six (Late Show) | Scat Jazz Lounge | Fort Worth | 10:00 PM | Lively jazz-swing set with Texan musician. |
| 04/24 | Ubbi Dubbi Festival 2026 Day 1 | Panther Island Pavilion | Fort Worth | 4:30 PM | Massive EDM fest kicks off with top DJs. |
| 04/24 | Michael Salgado | Billy Bob’s | Fort Worth | 10:00 PM | Tejano/Norteño music with Mexican-born US-raised artist. |
| 04/24 | THE DAMN QUAILS | Magnolia Motor Lounge | Fort Worth | 9:00 PM | Lively country-folk performance with red dirt vibes. |
| 04/24 | Black Pistol Fire: Flagrant Act of Bliss | Tannahill's Music Hall | Fort Worth | 8:30 PM | High-energy Canadian duo brings electrifying rock experience. |
| 04/24 | Corey Breedlove (Single Release Party) | The Balcony Club | Dallas | 10:00 PM | Dallas-born singer performs jazz-pop single release concert. |
| 04/24 | Rod Stewart Live | Lucas Oil Live at WinStar World Casino and Resort | Thackerville | 8:00 PM | British rock icon plays classic hits tonight. |
| 04/24 | The Brotherhood | The Balcony Club | Dallas | 6:30 PM | Local trio plays lively blues-rock classics. |
| 04/25 | RODGER DELANY BAND!! | Opening Bell Coffee | Dallas | 7:00 PM | Texas-based rockers play alternative and power pop. |
| 04/25 | Foxtide | Club Dada | Dallas | 8:00 PM | Southern California trio plays surf-rock fusion. |
| 04/25 | The Broken View Live | Texas Tea Room | Dallas | 7:00 PM | Alternative rock with melodic hooks and drive. |
| 04/25 | **Adorn: Album Release Show** | **RBC** | **Dallas** | **7:00 PM** | **Dallas-based band plays post-hardcore/alt-rock release show.** |
| 04/25 | Spyro Gyra | Longhorn Ballroom | Dallas | 8:00 PM | Legendary US group plays smooth jazz for 50+ years. |
| 04/25 | The Academy Is... - Almost Here. 20th Anniversary Tour | The Echo Lounge & Music Hall | Dallas | 7:00 PM | Chicago rockers celebrate 20-year album milestone. |
| 04/25 | 2nd Annual Spring Fling | Sandaga 813 | Dallas | 3:00 PM | Atlanta DJ spins tracks at lively party. |
| 04/25 | Soul Live Music by Local Bands | Sandaga 813 | Dallas | 9:00 PM | Dallas talent performs soulful R&B outdoors. |
| 04/25 | Hiroko Yamamura DJ Set | It'll Do Club | Dallas | 9:00 PM | Acclaimed producer delivers high-energy electronic DJ set. |
| 04/25 | Aubree-Anna Live | The Library Bar | Dallas | 9:00 PM | Award-winning Texan sings pop and jazz classics. |
| 04/25 | Cloonee | SILO Dallas | Dallas | 9:00 PM | UK-based DJ spins tech-house beats. |
| 04/25 | Chef Dee & The Taste Experience | Revelers Hall | Dallas | 8:00 PM | Vibrant R&B and soul concert from artist. |
| 04/25 | Linny Nance and The Network | Revelers Hall | Dallas | 5:00 PM | Smooth jazz and R&B from Los Angeles artist. |
| 04/25 - 04/26 | Revelers Hall Band | Revelers Hall | Dallas | 2:00 PM | New Orleans-style brass band plays upbeat jazz. |
| 04/25 | David Ramirez Live | The Texas Theatre | Dallas | 1:00 PM | Texas singer-songwriter plays intimate acoustic set. |
| 04/25 | FETISH BALL PRESENTS: SADISTIC SATURDAY | The Kessler Theater | Dallas | 8:00 PM | Energetic dance party with spinning wheel and vendors. |
| 04/25 | Remy Reilly Live | Stoney's Wine Lounge | Dallas | 8:00 PM | Dallas-based singer's soulful indie pop debut. |
| 04/25 | Snail Mail w/ Sharp Pins | Granada Theater | Dallas | 8:00 PM | Indie rock and pop with emotional flair. |
| 04/25 | Bandolero | The Goat | Dallas | 10:00 PM | Dallas-based blues-rock artists perform late-night show. |
| 04/25 - 04/26 | THE BIGGEST ARIES BADDIES OUTSIDE EDITION @ HEADQUARTERS DALLAS | Headquarters Dallas | Dallas | 9:00 PM | Energetic hip-hop party with live entertainment. |
| 04/25 - 04/26 | ART TIGERINA | Longhorn Icehouse | Dallas | 9:00 PM | Tejano musician from Texas performs live concert. |
| 04/25 | 2026 Dallas Blues Festival | Texas Trust CU Theatre at Grand Prairie | Grand Prairie | 7:00 PM | Celebrated blues artists perform soulful sets. |
| 04/25 | The 21st Annual Dallas Blues Festival | Texas Trust CU Theatre | Grand Prairie | 7:00 PM | Legendary soul and blues singers perform. |
| 04/25 | An Evening With Goose | The Pavilion at Toyota Music Factory | Irving | Not listed | Indie-groove jam session with energetic light displays. |
| 04/25 | Goose | The Pavilion at Toyota Music Factory | Irving | 7:00 PM | Indie-rock trio blends funk and jam sessions. |
| 04/25 | Plaza Live Music - Saturday Sips & Sounds | Toyota Music Factory Plaza | Irving | 6:30 PM | Free outdoor concert featuring a California artist. |
| 04/25 | ""Fast As You"" Live | Love and War in Texas | Plano | 8:00 PM | Country stars honor Texas honky-tonk classics. |
| 04/25 | Lone Star Smokeout: Koe Wetzel & Casey Donahew - Saturday | AT&T Stadium | Arlington | 1:00 PM | Country music fest with Texas artists performs. |
| 04/25 | Various Artists Showcase | GROWL Arlington | Arlington | 8:00 PM | Dallas-based rock and blues bands showcased. |
| 04/25 | FREE CONCERT: Jay Perez w/ Sabor Puro | Levitt Pavilion | Arlington | 7:10 PM | Free Tejano/Latin pop concert by San Antonio artist. |
| 04/25 | Bingo Loco | Lexus Box Garden at Legacy Hall | Plano | 6:00 PM | Retro-themed party with DJ spun classics & games. |
| 04/25 | Justin Mason Band at Art in the Square | Southlake Town Square | Southlake | 8:30 PM | Authentic country sounds by Texan lead singer. |
| 04/25 | Heart Tribute - Even It Up & Stevie Nicks Tribute - Dreams Unwind | The Revel Patio Grill | Frisco | 7:30 PM | Rock tribute performances bring 70s/80s classics to life. |
| 04/25 | Live at The Lawn™: Just Like P!nk | The Lakefront at Little Elm | Little Elm | 7:00 PM | Dallas-based artists pay tribute to a pop legend. |
| 04/25 | Mindy Smith | The Post at River East | Fort Worth | 8:00 PM | Singer-songwriter from Nashville performs folky country tracks. |
| 04/25 | La Santa Cecilia | Tulips | Fort Worth | 8:00 PM | Latin-infused indie rock fusion concert. |
| 04/25 | Matthew Banks Quintet | Scat Jazz Lounge | Fort Worth | 8:00 PM | Dallas-born musician leads swing and jazz quintet. |
| 04/25 | Ubbi Dubbi Festival 2026 Day 2 | Panther Island Pavilion | Fort Worth | 4:30 PM | International EDM stars close out festival. |
| 04/25 | Sara Evans | Billy Bob’s | Fort Worth | 10:00 PM | Country superstar from Nashville plays iconic honky-tonk. |
| 04/25 | LANY: Soft World Tour | Dickies Arena | Fort Worth | 7:30 PM | Indie-pop star from Australia performs high-energy show. |
| 04/25 | Four Day Weekend | Ridglea Room | Fort Worth | 9:30 PM | Improv comedy by Texan troupe known for wit. |
| 04/25 | COLBY ACUFF | Handmade Horsepower Tour | Magnolia Motor Lounge | Fort Worth | 9:00 PM | Rising country star from Nashville performs live. |
| 04/25 | Blake Shelton Live | Lucas Oil Live at WinStar World Casino and Resort | Thackerville | 8:00 PM | Country legend plays chart-topping hits. |
| 04/25 | Grungefest: Pearl Gem with The Chris Cornell Experience and Nērvana | Tannahill's Music Hall | Fort Worth | 7:30 PM | 90s grunge tribute concert features local artists. |
| 04/25 | Keith Nieto, Los Hnos Rodriguez and More | Plaza de Toros Malloy | Ferris | 6:00 PM | Regional Mexican/Norteño night with Texas sax legend. |
| 04/25 | Kwinton Gray Project | The Balcony Club | Dallas | 6:30 PM | Talented Dallas musician plays lively jazz fusion. |
| 04/26 | Laurie Berkner: The Greatest Hits Solo Tour | Majestic Theatre | Dallas | TBA | Acoustic solo show plays kids' music favorites. |
| 04/26 | Sunday Funday Nonstop Music | The Free Man Cajun Cafe and Lounge | Dallas | 2:00 PM | All-day blues, jazz, and swing festival in Ellum. |
| 04/26 | The BEST OF THE MIC Comedy Show | Will Call Bar | Dallas | 9:00 PM | Talented comedians bring laughter to Deep Ellum. |
| 04/26 | Dan Hubbard Presents: Letting Go Tour LIVE | Sons of Hermann Hall | Dallas | 6:00 PM | Soulful Americana singer-songwriter performs heartfelt acoustic set. |
| 04/26 | Karaoke with Javier | The Goat | Dallas | 9:30 PM | Sunday night karaoke with pop & rock hits. |
| 04/26 | Lone Star Smokeout: Riley Green & Sam Barber - Sunday | AT&T Stadium | Arlington | 1:00 PM | Country music fest concludes with hits and BBQ. |



##Theater
| Date | Event | Venue | City | Start Time | Description |
| :--- | :--- | :--- | :--- | :--- | :--- |
| 04/03 - 05/16 | The Legend of DeadEye Mary- a melodrama | Pocket Sandwich Theatre | Carrollton | Varies | Western action with guns, music, and flair. |
| 04/03 - 05/03 | The Play That Goes Wrong | Upright Theatre Company | Euless | Varies | Hopeless troupe causes chaotic comedy from Texas. |
| 04/09 - 05/03 | Dream Hou$e | Kitchen Dog Theater | Dallas | Varies | Latina sisters' reality TV house sale satire. |
| 04/10 - 05/03 | Over The River and Through The Woods | Richardson Theatre Centre | Richardson | Varies | Youth's move sparks meddling family's matchmaking effort. |
| 04/16 - 05/10 | The Murder of Roger Ackroyd | Theatre Three | Dallas | 8:00 PM | Belgian detective solves murder in small village. |
| 04/17 - 05/03 | Sweet Charity | Lyric Stage Studio | Dallas | 7:30 PM | Turbulent love story set in 1960s NYC. |
| 04/17 - 11/14 | Oil's Well That Ends Well - A Lone Star Murder Mystery | Texas Star Dinner Theater | Grapevine | 8:00 PM | Murder mystery dinner with comedic crime-solving. |
| 04/17 - 05/03 | The Guy Who Didn't Like Musicals | Art Centre Theatre | Plano | Varies | Average guy flees from deadly musical chaos. |
| 04/17 - 05/03 | The Guy Who Didn't Like Musicals | The Art Centre Theatre | Plano | 7:30 PM, 2:00 PM | Average guy flees deadly musical threat. |
| 04/20 - 04/30 | The Henriad | Samuell-Grand Amphitheater | Dallas | See website | Historical plays reimagined in modern verse. |
| 04/23 - 04/25 | Kinky Boots | Winspear Opera House | Dallas | 8:00 PM | Uplifting tale of a shoe factory's revival. |
| 04/23 - 04/25 | Snow White | Irving Arts Center - Dupree Theater | Irving | 7:00 PM | Texas-based troupe performs fairy tale ballet. |
| 04/23 - 04/26 | Curtain Up! The Best of Broadway | Granville Arts Center | Garland | 2:00 PM | Senior performers celebrate Broadway's golden years. |
| 04/23 - 04/26 | Test to Testimony: An Adaptation of God's Trombones | Jubilee Theatre | Fort Worth | 7:00 PM | African American storytellers bring gospel classics to life. |
| 04/23 - 05/16 | RENT | Circle Theatre | Fort Worth | 7:30 PM / 8:00 PM | Rock musical about struggling artists in NYC. |
| 04/23 - 04/26 | Cyrano | Outcry Theatre | Plano | 7:30 PM | Swordsman's unrequited love sparks poetic turmoil. |
| 04/23 - 05/02 | Alice in Wonderland | Actors Conservatory Theatre | Lewisville | - | Whimsical journey through fantasy and curiosity. |
| 04/24 | FLYINGHORSE 2026 | Montgomery Arts Theater | Dallas | TBD | Local arts students showcase vibrant performances. |
| 04/24 - 05/03 | Roald Dahl's Matilda The Musical JR. - Naughty Cast | Newlook Performing Arts Center | Grapevine | Varies | Little girl with superpowers seeks a better life. |
| 04/24 - 04/26 | Seussical Kids | Stand Performing Arts Ministry | Keller | Varies | Elephant finds tiny town on speck of dust. |
| 04/24 - 05/03 | The Great Impresario Boris Lermontov Would Like to Invite You to Dinner | Theatre Denton Annex | Denton | 7:30 PM, 2:30 PM | Two-actor show flips roles each night, explores ambition. |
| 04/24 - 04/25 | Love and Loss: A Musical Revue | Redbud Theater Complex | Denton | 7:30 PM, 2:00 PM | University students explore love, loss, and moving on. |
| 04/25 | Carnival of the Animals | Moody Performance Hall | Dallas | 2:00 PM | Whimsical ballet with live orchestra performance. |
| 04/25 - 04/26 | The Seasons | Moody Performance Hall | Dallas | Varies | Seasonal ballet with live orchestra. |
| 04/25 | Choreo Lab Informal Showing | Sammons Center for the Arts | Dallas | TBA | Dallas artists showcase DIY projects and discuss. |
| 04/25 | Season Finale – “Cirque Rocks” with Cirque de la Symphonie | Carpenter Hall | Irving | 7:30 PM | Vocalists and circus artists join forces. |
| 04/25 - 05/03 | Roald Dahl's Matilda The Musical JR. - Revolting Cast | Newlook Performing Arts Center | Grapevine | 2:30 PM | Extraordinary girl's wit inspires adult growth. |
| 04/25 | Annual Dia de los Niños y Libros Festival | Rose Marine Theater | Fort Worth | 1:00 PM | Latin-inspired fest for kids with music & art. |



##Comedy
| Date | Event | Venue | City | Start Time | Description |
| :--- | :--- | :--- | :--- | :--- | :--- |
| 04/22 | Free Improv Jam | Dallas Comedy Club | Dallas | 8:15 PM | Improvisational comedy with audience participation and laughter. |
| 04/22 | Improv Happy Hour | Dallas Comedy Club | Dallas | 7:15 PM | Comedic improv with a NYC native. |
| 04/22 | The DCC Open Mic | Dallas Comedy Club | Dallas | 7:00 PM | Local comedians test new material in a club. |
| 04/22 | Weekly Open Mic Night | TK’s Comedy Club | Dallas | 8:00 PM | Local comedians debut new jokes in intimate setting. |
| 04/22 | Angelia Walker Trial By Funny | The Addison Improv | Addison | 7:00 PM | Local comedian from [City] brings humor. |
| 04/22 | Comedy Allstars | Punch Line Comedy Club | Irving | 7:30 PM | Talented comedians from around the world perform. |
| 04/22 | KELLEN ERSKINE | Mic Drop Comedy Plano | Plano | 7:30 PM | Comedian shares relatable stories and witty observations. |
| 04/22 | Whiskey + Laughs Wednesdays | Big Laugh Comedy Club | Fort Worth | 8:00 PM | Laughter and drinks on a weeknight. |
| 04/22 | Wizop Wednesday's Open Mic Night | Big Laugh Comedy Club | Fort Worth | 9:30 PM | Emerging comedians share unfiltered humor in intimate setting. |
| 04/23 | Shark's Comedy Club Thursday Night 930PM | Shark's Comedy Club | Dallas | 9:30 PM | Energetic local comedians bring laughter to classic lounge. |
| 04/23 | Gareth Reynolds | Hyena's Comedy Nightclub Dallas | Dallas | - | Nationally touring comedian shares wry humor insights. |
| 04/23 | Backdoor Comedy Open Mic | Backdoor Comedy Club | Richardson | 8:00 PM | Intimate comedy showcase for emerging and veteran comedians. |
| 04/23 | Malik Elassal | Punch Line Comedy Club | Irving | 7:30 PM | Up-and-coming comedian from Chicago brings laughter. |
| 04/23 | Paws and Punchlines | The Addison Improv | Addison | - | Laughter-filled night with comedian from New York. |
| 04/24 | Nimesh Patel: With All Due Respect 2026 Tour | Majestic Theatre | Dallas | 8:00 PM | Comedian from [country] delivers sharp, unfiltered humor. |
| 04/24 | EARLY SHOW Peyton Ruddy | Dallas Comedy Club | Dallas | 7:00 PM | Rising comedian from Chicago performs stand-up. |
| 04/24 | Heavy Hitters | Dallas Comedy Club | Dallas | 6:45 PM | Comedy showcase with local talent delivers laughs. |
| 04/24 | LATE SHOW Peyton Ruddy | Dallas Comedy Club | Dallas | 9:00 PM | Comedian delivers viral humor and wit. |
| 04/24 | Primetime Friday Night Improv! | Dallas Comedy Club | Dallas | 8:15 PM | Improvisational comedy with audience-suggested scenes. |
| 04/24 | Roast Battle League DFW | Dallas Comedy Club | Dallas | 9:45 PM | Stand-ups trade barbs in a comedic showdown. |
| 04/24 | Student Showcase: Milo's Level Four and Hayden's Level Five Improv | Stomping Ground Comedy Theater | Dallas | 7:30 PM | Improvisational comedy by talented students from NYC. |
| 04/24 | Felipe Esparza: At My Leisure World Tour | Texas Trust CU Theatre | Grand Prairie | 7:00 PM | Laughter-filled show with L.A.-grown comedian's witty tales. |
| 04/24 - 04/25 | Four Day Weekend Improv Show | Four Day Weekend Theater | Dallas | 8:00 PM | Improvisational comedy with audience-driven storylines. |
| 04/24 | Sam Tripoli w / Eddie Bravo - SPECIAL EVENT | Hyena's Comedy Nightclub Dallas | Dallas | - | Comedic commentary on conspiracies and current events. |
| 04/24 - 04/25 | Christina P. | Punch Line Comedy Club | Irving | 7:00 PM | Comedic commentary on life's absurdities by American artist. |
| 04/24 - 04/25 | Christina P. Late Show | Punch Line Comedy Club | Irving | 9:15 PM | Comedian's irreverent take on modern life. |
| 04/24 - 04/26 | Godfrey | The Addison Improv | Addison | 7:00 PM | Vocal comedian's high-energy stand-up tour performance. |
| 04/24 - 04/25 | JAY LARSON | Mic Drop Comedy Plano | Plano | 7:00 PM | Veteran comedian shares humor and TV credits. |
| 04/25 | Anti-Thematic | Dallas Comedy Club | Dallas | 4:45 PM | Unconventional comedy with sketches and stand-up. |
| 04/25 | EARLY SHOW Keegan Tindall | Dallas Comedy Club | Dallas | 7:00 PM | New Yorker's goofy humor on display. |
| 04/25 | Improv Power Hour | Dallas Comedy Club | Dallas | 6:45 PM | High-energy improv show with rapid-fire humor. |
| 04/25 | LATE SHOW Keegan Tindall | Dallas Comedy Club | Dallas | 9:00 PM | Late-night comedian delivers witty observations and humor. |
| 04/25 | Magic: Unhinged | Dallas Comedy Club | Dallas | 4:45 PM | Comedy-magic show with unpredictable tricks and humor. |
| 04/25 | Primetime Saturday Night Improv! | Dallas Comedy Club | Dallas | 8:15 PM | Improvisational comedy fueled by audience suggestions. |
| 04/25 | The Comedy Gym | Dallas Comedy Club | Dallas | 9:45 PM | Experimental comedy debut with emerging artist. |
| 04/25 | Emo Philips | Hyena's Comedy Nightclub Dallas | Dallas | 7:00 PM & 9:30 PM | Renowned comedian's surreal humor and witty stage presence. |
| 04/25 | 90'S BRUNCH | Mic Drop Comedy Plano | Plano | 1:00 PM | Neon-themed comedy show with nostalgic laughs served. |
| 04/25 | Family Magic & Comedy For All Ages | The Addison Improv | Addison | 2:00 PM | Magician's magic and comedy for all ages. |
| 04/25 | Flo Hernandez + Homies | Big Laugh Comedy Club | Fort Worth | 7:30 PM | Comedian from [country] brings laughter with friends. |
| 04/25 | Giulio Gallarotti: Live In Fort Worth | Big Laugh Comedy Club | Fort Worth | 8:00 PM | Comedian with sharp wit tours nationwide. |
| 04/25 | ONCE UPON A MIC | Mic Drop Comedy Plano | Plano | 3:30 PM | Comedians share unfiltered humor with live audience. |
| 04/25 | Sahib Singh | The Addison Improv | Addison | 7:00 PM | Rising star comedian with mellow wit. |
| 04/26 | Take One Improv | Dallas Comedy Club | Dallas | 4:45 PM | Improvisational comedy with witty scene acting. |
| 04/26 | The DCC Sunday Open Mic | Dallas Comedy Club | Dallas | 4:00 PM | Laughter-filled afternoon for comedians of all levels. |
| 04/26 | Summer Improv Workshop Lab: Getting Unstuck! | Stomping Ground Comedy Theater | Dallas | 3:30 PM | Improv comedy class cultivates fearless, laugh-out-loud moments. |
| 04/26 | Dirty, Funny, Sexy Tour w / Billy Sorrells | Hyena's Comedy Nightclub Dallas | Dallas | - | Texas comedian brings energetic stand-up humor. |
| **04/26** | **Rising Stars of Dallas Comedy!** | **Backdoor Comedy Club** | **Richardson** | **6:00 PM** | **Emerging comedians bring fresh humor to stage.** |
| 04/26 | After Hours: Down & Funny [Late Sunday Edition] | Big Laugh Comedy Club | Fort Worth | 8:00 PM | Edgy comedian shares raw, boundary-pushing humor. |



##Performing Arts
| Date | Event | Venue | City | Start Time | Description |
| :--- | :--- | :--- | :--- | :--- | :--- |
| 04/23 | Celebrate Spain: Music in the Museum | Meadows Museum | Dallas | 5:00 PM | Vocalists perform 18th-19th century Spanish folk songs. |
| 04/23 - 04/25 | Snow White | Carpenter Hall (Irving Arts Center) | Irving | 7:00 PM | Fairy tale dance with love, jealousy themes. |
| 04/23 - 04/25 | Snow White | Dupree Theater, Irving Arts Center | Irving | 7:00 PM | Ballet performance tells tale of love and rivalry. |
| 04/24 | Spring Moves | Winspear Opera House | Dallas | 7:30 PM | Seasonal dance celebration features local talent. |
| 04/24 - 04/25 | West | Sons of Hermann Hall | Dallas | 7:30 PM | Immersive dance adventure follows Western characters. |
| 04/25 | Carnival of the Animals | Moody Performance Hall | Dallas | 2:00 PM | Whimsical ballet blends classic music and dance. |
| 04/25 - 04/26 | The Seasons | Moody Performance Hall | Dallas | 7:30 PM | Classical ballet with music by Glazunov. |
| 04/25 | Poetics for Peace: Celebrating Humanity through Global Music, Dance, and Poetry | Artstillery Spaces | Dallas | 6:30 PM | Global fusion festival featuring multicultural performances. |
| 04/25 | Season Finale – “Cirque Rocks” with Cirque de la Symphonie | Carpenter Hall, Irving Arts Center | Irving | 7:30 PM | Orchestral fusion with Texas-based symphony and circus. |
| 04/25 - 04/26 | Cinderella | Coppell Arts Center | Coppell | 1:00 PM | Enchanting ballet brings classic tale to life. |
| 04/25 | A5A Tap Showcase | Arts Fifth Avenue | Fort Worth | 8:00 PM | Energetic dance show with global rhythms. |
| 04/26 | International Dance Festival | Klyde Warren Park | Dallas | 2:00 PM | Global dance celebration with diverse performances. |



##Culture
| Date | Event | Venue | City | Start Time | Description |
| :--- | :--- | :--- | :--- | :--- | :--- |
| 04/20 - 04/24 | EarthX 2026 | Hilton Anatole | Dallas | 9:00 AM | Environmental summit discusses sustainability and resilience. |
| 04/20 - 04/22 | Earthx2026 Congress of Conferences | Hilton Anatole | Dallas | 8:00 AM | Environmental leaders present sustainable solutions globally. |
| 04/22 - 04/23 | Dallas Build Expo 2026 | Dallas Market Hall | Dallas | 9:30 AM | Regional builders' expo with 300+ exhibitors. |
| 04/23 | Community Engagement Day | Briscoe Carpenter Livestock Center at Fair Park | Dallas | 11:00 AM | Nonprofit summit with Olympic speaker. |
| 04/23 - 04/26 | Cask: Golden Opportunity w/ Strawberry & Rhubarb | Peticolas Brewing | Dallas | - | Fruit-infused cask beer debuts with tart twist. |
| 04/23 | German Beer Day | Peticolas Brewing | Dallas | 12:00 PM | Discounted drinks, pretzels, and festive vibes. |
| 04/24 | Lone Star Smokeout | Texas Live! | Arlington | 11:00 AM | BBQ and music in the South. |
| 04/24 - 04/26 | Lone Star Smokeout | AT&T Stadium | Arlington | 12:00 PM | Country music fest with top BBQ & stars. |
| 04/25 - 04/26 | Blossoms & Berries Festival | Dallas Farmers Market | Dallas | 10:00 AM | Springtime market with plant, flower, berry delights. |
| 04/25 | Texas Street Food Festival | Billy Bob's Texas | Fort Worth | 12:00 PM | Global cuisine fest with 70+ vendors under $10. |
| 04/26 | Cooking Class: Dumplings | Peticolas Brewing | Dallas | 3:00 PM | Asian cuisine cooking class with Japanese chef. |
| 04/26 | Fair Park Farmers Market | Fair Park | Dallas | 9:00 AM | Fresh produce, artisanal goods, local vendors. |
| 04/26 | The Great Indian Spring Festival | Grandscape | The Colony | 12:00 PM | Vibrant Holi-inspired festival features Indian dance, music. |



##Art and Museums
| Date | Event | Venue | City | Start Time | Description |
| :--- | :--- | :--- | :--- | :--- | :--- |
| 04/22 | Funk Family Upstander Speaker Series: Courage Behind Closed Doors - Jan Langbein | Dallas Holocaust and Human Rights Museum | Dallas | 7:00 PM | CEO shares domestic violence advocacy story. |
| 04/22 | Eye to Eye: Two Lives in Art, Daniel & Dennis Blagg | Modern Art Museum of Fort Worth | Fort Worth | 7:00 PM | Twin artists' 50-year legacy in music film. |
| 04/23 | Thursdays on Tap | Perot Museum | Dallas | 6:00 PM | North Texas artists play at after-hours museum bash. |
| 04/23 | Celebrate Spain 2026 | Meadows Museum | Dallas | 7:00 PM | Annual festival with market, food, and art. |
| 04/23 | Public Guided Tour | Meadows Museum | Dallas | 6:00 PM | Spanish art insights with expert guides. |
| 04/23 | Ed Schad Lecture: Visiting Artist & Scholar Program | Gallery at UTA | Arlington | 12:00 PM | Leading curator discusses contemporary art trends. |
| 04/23 | Women On the Verge of a Nervous Breakdown | Modern Art Museum of Fort Worth | Fort Worth | 6:30 PM | Classic film gets cinematic museum presentation. |
| 04/23 | Adulti-Verse: Groovy House | Meow Wolf Grapevine | Grapevine | 7:00 PM | Surreal art meets deep house electronica. |
| 04/24 - 04/26 | Art in the Square | Southlake Town Square | Southlake | 4:00 PM | Fine art festival with 150 renowned artists. |
| 04/24 | Antoine's Organ | Modern Art Museum of Fort Worth | Fort Worth | 5:30 PM | Artist from Brooklyn performs at a monument. |
| 04/24 | La Scala: The Force of Destiny | Modern Art Museum of Fort Worth | Fort Worth | 4:00 PM | Classical opera performance with international artists. |
| 04/24 | Spanish-Language Tour | Modern Art Museum of Fort Worth | Fort Worth | 6:00 PM | Guided tour of art in Spanish only. |
| 04/25 | Artist Talk with Nancy Cohen Israel | Craighead Green Gallery | Dallas | 2:00 PM | Artist shares creative process and inspirations. |
| 04/25 - 04/26 | 2026 South West Black Art Show | African American Museum of Dallas | Dallas | 11:00 AM | Southwest artists showcase African American culture. |
| 04/25 | Choreo Lab Informal Showing | Sammons Center for the Arts | Dallas | - | Improvisational dance pieces shared with audience discussion. |
| 04/25 | Call Me Dancer: Film Screening and Dance Performance | Crow Museum of Asian Art (UT Dallas Campus) | Richardson | 6:30 PM | Dreams-come-true doc followed by intimate concert. |
| 04/25 | Guatemala Worry Doll Workshop | Art on Main | Dallas | 2:00 PM | Hands-on crafting session inspired by Central America. |
| 04/26 | Open Studio | Meadows Museum | Dallas | 1:30 PM | Hands-on art exploration for all ages. |
| 04/26 | Sister Mary Frances Judge Opening Art Reception | Museum of Biblical Art | Dallas | 3:00 PM | Artist's debut exhibition bridges faith & modern art. |
| 04/26 | F.A.M. fun+art+music | Meow Wolf Grapevine | Grapevine | 3:00 PM | Interactive art and music experience with a Texan performer. |




##Sports
| Date | Event | Venue | City | Start Time | Description |
| :--- | :--- | :--- | :--- | :--- | :--- |
| 04/20 | Minnesota Wild vs. Dallas Stars: Round 1 Game 2 | American Airlines Center | Dallas | 8:30 PM | Postseason ice hockey with high stakes. |
| 04/21 - 04/23 | Pittsburgh Pirates vs. Texas Rangers | Globe Life Field | Arlington | 7:05 PM | Major League Baseball's early season showdown. |
| 04/21 - 04/26 | Tulsa Drillers vs. Frisco RoughRiders | Riders Field | Frisco | 12:05 PM | Double-A baseball with family-friendly fun. |
| 04/21 | Dallas Baptist Patriots at TCU Horned Frogs | Lupton Baseball Stadium | Fort Worth | 6:00 PM | Non-conference college baseball match between visitors and hosts. |
| 04/22 | Minnesota United FC at FC Dallas | Toyota Stadium | Frisco | 7:30 PM | Western Conference MLS regular season soccer match. |
| 04/23 | Football Draft Watch Party | Texas Live! | Arlington | 7:00 PM | Football draft viewing with snacks and refreshments. |
| 04/24 | WWE Friday Night Smackdown | Dickies Arena | Fort Worth | 6:30 PM | Fast-paced pro wrestling with top stars. |
| 04/24 - 04/26 | Athletics vs. Texas Rangers | Globe Life Field | Arlington | 7:05 PM | Major League Baseball regular season game. |
| 04/24 - 04/26 | Houston Cougars at TCU Horned Frogs | Lupton Baseball Stadium | Fort Worth | 6:00 PM | Conference rivals face off in season debut. |
| 04/25 | East Dallas Boozehounds vs. South Dallas Coyotes | Lake Cliff Park | Dallas | 2:00 PM | Local kids play sandlot baseball in relaxed setting. |
| 04/25 | FC Dallas vs. Seattle Sounders FC Watch Party | Peticolas Brewing | Dallas | 9:30 PM | Away team fan gathering and viewing party. |
| 04/25 | Velvet Hammer 5K | Peticolas Brewing | Dallas | 7:00 AM | Taproom hosts annual 5K footrace, begins ends there. |
| 04/25 | White Rock MudBugs vs. Dallas All Hats | Churchill Park | Dallas | 7:00 PM | Sandlot baseball with local teams plays on. |







",2,1776830857.0,Dallas,0,1.0,False
