id,url,title,text,score,created_utc,subreddit,num_comments,upvote_ratio,over_18
1td2hn7,https://www.meetup.com/meetup-group-xylobunl/events/314768702/,Coffee Hangout @ Beans and Leaves - Sunday 5/17,"Anyone want to hang out and grab a cup of coffee together Sunday morning?  We've got a small group going around trying all the coffee bars in town and using that as a way to meet new friends.  Drop us an RSVP to let us know you're coming.

  
[https://www.meetup.com/meetup-group-xylobunl/events/314768702/](https://www.meetup.com/meetup-group-xylobunl/events/314768702/)

No expectations, no fish.   ><(((º>",1,1778774325.0,memphis,0,1.0,False
1td2h6c,https://www.reddit.com/r/AgingParents/comments/1td2h6c/what_do_i_30f_owe_my_aging_mother_78_who_is_in/,What do I (30F) owe my aging mother (78) who is in the hospital?,"A little back story. I was adopted when I was 3 years old to a single mother. My adoptive mom was severely mentally ill when I was between 5-10 years old (stopped working, barley got out of bed, would harm harm herself, be quite verbally abusive, etc) which I know she didn’t mean but it happened. We also lived in poverty and filth. In high school, I was acting out (nothing that crazy) and so I would get kicked out of the house all the time and so we didn’t have a relationship then. At around 21 I tried my best to establish a relationship with her and things got better between us. We don’t have a normal relationship but it’s something. 

Fast forward, she had to get major spinal surgery. She asked a lot of favors for me before the surgery which I did without complaint. I helped her get to the hospital and everything else that has followed. I’m taking care of her cats which I’m allergic too and who are not trained at all so I’m not getting much sleep. She got discharged to a rehabilitation center last Friday and freaked out and basically guilt tripped me into helping her leave and was screaming at all the nurses. Somehow we got her to her apartment but of course she couldn’t take care of herself and I had to get a bunch of things for her and I tried to help her onto her bed, etc…it got so bad that night that she wetted herself 3 times, I found her on the floor, etc. the next morning I called an ambulance to take her back to the hospital which she begged and pleaded me not to. The whole thing was an emotional nightmare and I had to deep clean her apartment on Mother’s Day. I’ve also visited her at the hospital and when she got discharged to another rehab I was there to help her and make sure she stayed calm. 

I don’t have any siblings and she doesn’t have any family members that I know of. She has one friend but he lives in a different state. I don’t have any parental figures in my life to ask for advice or help. 

She keeps asking me to do her favors and errands. I don’t want to. I’m so tired both physically and emotionally. I’ve had a terrible month at work trying to juggle things and I haven’t been able to take care of myself either like see friends or go to the gym. She keeps guilt tripping me. Is it reasonable for me to stop doing these errands and stuff for her? What are appropriate boundaries for helping a parent out in this sorta one off situation? She hasn’t asked me how I’m doing or if she can do anything to help me (like even offer to order me a coffee or something). I’ve spent so much time and money on trying to help her. How much did you help your aging parent? ",2,1778774297.0,AgingParents,0,1.0,False
1td2g7e,https://www.reddit.com/r/Type1Diabetes/comments/1td2g7e/constant_lows_despite_no_changes/,Constant lows despite no changes...,"Been on Lantus (glargine) for years. Switched to tresiba few years ago and it was ok a few hiccups here and there but it got discontinued so had to go back on lantus. Was pretty much fine till couple of months ago when I started experiencing multiple low blood sugars in a day.  
Blood tests came back with ""borderline"" on kidney function - ultrasound done and said nothing wrong. Hba1c is 57 - would be much lower but it's counteracted by the short highs I'm having where I'm trying to stop a low by over eating because if I don't, I have another low an hour after I've already had one.  
Diabetes nurse doesn't seem to know what to do, gp is useless.  
Literally the only change I've made these last couple of months is drink a lot more water because it became quite apparent I wasn't drinking nowhere near enough, and when I was drinking it was coffee.  
What else could be causing this? I've had the odd cartridge that I've binned because I've been high all day like the insulin hasn't worked (I keep it in the fridge at all times) and that sorts it, so I'm wondering if there's a weird production issue going on and now I've got super strength insulin or something, but it just isn't adding up.",1,1778774240.0,Type1Diabetes,0,1.0,False
1td2ewd,https://www.reddit.com/r/confessions/comments/1td2ewd/no_one_loves_me/,No one loves me.,"No one loves me. Not my mom, not my sister, not my brothers, not my dad, not my friends. I’ve never even had a girlfriend, so after a while it stops feeling like insecurity and starts feeling like proof. Like maybe there’s just something wrong with me at the core.

I’m a huge fuck up. The kind of person people can tolerate for a while but never really choose. I spend my life behind a camera, smiling, capturing everyone else’s memories while never really existing in any of them. That’s the irony of being a photographer, I guess. I travel constantly, I see beautiful places, meet people, collect stories, but living like a transient leaves no room for roots. 

No room for anyone to stay. And I chose this life, so it feels like I’m not even allowed to complain about how empty it gets. I’m only 21 and already exhausted by it.  
My mom treats me like I’m just a vacation machine with a camera attached to it. I went home for Mother’s Day hoping maybe she’d actually want *me* there, and it felt like she barely cared. My dad has thought I was a fuck up ever since I became a photographer instead of whatever version of me he imagined. My sister thinks I abandoned the family. My older brother basically abandoned me first. My younger brother thinks I’m soft, like I don’t deserve the life I have.

I even managed to ruin the one friendship that mattered most to me. I chased my best friend away over something as small and stupid as asking her to get coffee. Even my cats barely seem to want anything to do with me.

So yeah, after enough years of this, it’s hard not to believe the obvious answer is that I’m just unlovable. Alone from the beginning to the end. Useful to people sometimes, interesting for a moment maybe, but never someone worth staying for.

And the worst part is I keep functioning anyway. I keep moving, keep traveling, keep shooting photos, keep joking around like I’m fine. I stay in control because control is the only thing I really have left. And if one day it all gets too heavy, I already know what the exit door looks like.  
But I probably won’t take it. Not because life is beautiful or because I secretly believe things will work out. Maybe just because I’m too much of a coward to disappear completely.",2,1778774164.0,confessions,0,1.0,False
1td2e5t,https://www.reddit.com/r/PakistaniTwenties/comments/1td2e5t/coffee_or_tea/,Coffee or Tea,"Have to pull a clutch performance through a nighter till Fajr, which is better, tea or coffee, to kill laziness and sleep? ",1,1778774121.0,PakistaniTwenties,14,1.0,False
1td2dxf,https://www.reddit.com/r/fragrance/comments/1td2dxf/beijando_braziletto_and_pau/,Beijando - Braziletto and Pau,"Full disclosure that I wore these and reviewed them without looking up the notes first, so I realized after the fact that they’re supposed to be from Beijando’s wedding collection for the groom! I’m a woman and had no idea, so suffice to say that they’re quite unisex (but that’s a plus in my book). Checking their website after testing them, Pau has no notes listed on their website but Braziletto’s listed notes are “sandalwood, vetiver, patchouli and saffron”. Pau is definitely my favorite of the two! 

Thank you to Beijando for sending me some free samples to test! 

Braziletto: 

This is a sexy woody warm patchouli. It reminds me a tiny bit of the Mugler DNA, but maybe that’s just the patchouli coming forward for me. It was a little sharp to my nose and not something I would wear everyday because of that, but it smelled nice on my boyfriend without any of the sharpness, so maybe that has more to do with my skin chemistry. He really liked it, and he usually isn’t into perfume so that’s high praise! Braziletto lasted about eight hours on my skin. 

Pau: 

Pau is also very spicy and sexy, but primarily very cinnamon-forward and woody. I loved this one! I get a delicious citrus note at first spray and then very woody and spicy on the drydown. Almost like the scented pinecones from a hobby store at Christmas, except sexy and alluring somehow? Pau is a little sweet and familiar, but too sexy to be nostalgic. Smells like it would entice a special someone in closer while dancing the night away. And it has great longevity, lasted about 10 hours on my skin (w/o lotion). My boyfriend, who usually isn’t a fan of perfumes, absolutely loved it! His favorite was the sillage when I left the room, he described it as smelling like “chocolate coffee”. If you get the chance to try this one, I absolutely would!",0,1778774109.0,fragrance,0,0.5,False
1td2dq3,https://www.reddit.com/gallery/1td2dq3,Week 18: Low Sugar - Almond Anise Biscotti,"Just a hint of sugar to enhance the anise seed flavor! We like to drizzle these with dark chocolate and store them in the freezer. Perfect with tea, coffee, or dessert wine.",2,1778774096.0,52weeksofbaking,0,1.0,False
1td2dh6,https://www.reddit.com/r/Seattle/comments/1td2dh6/top_pot_the_coffee/,Top Pot: The coffee,"Look: I love the debate around the best donuts in the city. (It means I get to find brand new places to check out.) I know there are lots of questions about freshness and quality of Top Pot’s donuts compared to some of these other mom and pop shops or boutique-y places in town, but one thing that I have found amazingly consistent there is the coffee. It’s fantastic.

Maybe it’s just my location, and there are obviously “fancier” places to get it, but the West Seattle Top Pot always has fresh delicious coffee. I’ve haven’t been disappointed yet.

That’s it.",2,1778774080.0,Seattle,1,0.75,False
1td2bwi,https://www.reddit.com/r/AppleWatch/comments/1td2bwi/apple_watch_and_tap/,Apple Watch and Tap,"Anyone else having issues with the tap function using the Apple Watch to pay for things.  I'm in Canada and I used to just tap my bank card to pay for things like coffee etc.

Was very convenient, since the latest update it has been acting up.

It would always say tap not accepted.  I've tried deleting and re-adding, signed out of iCloud and back in etc.  Now I would try tapping with my bank card, it says not accepted then I would switch to another card and it works.  The next day I would use the second card, get the same error, switch to the my first card and it works again.

Every morning now, I just alternate between the two cards.  It's a little annoying. 

 ",1,1778773990.0,AppleWatch,0,1.0,False
1td2but,https://www.reddit.com/r/relationship_advice/comments/1td2but/i_30f_am_helping_my_mother_78f_as_shes_recovering/,I (30F) am helping my mother (78F) as she’s recovering from spine surgery. What are reasonable boundaries to have?,"A little back story. I was adopted when I was 3 years old to a single mother. My adoptive mom was severely mentally ill when I was between 5-10 years old (stopped working, barley got out of bed, would harm harm herself, be quite verbally abusive, etc) which I know she didn’t mean but it happened. We also lived in poverty and filth. In high school, I was acting out (nothing that crazy) and so I would get kicked out of the house all the time and so we didn’t have a relationship then. At around 21 I tried my best to establish a relationship with her and things got better between us. We don’t have a normal relationship but it’s something. 

Fast forward, she had to get major spinal surgery. She asked a lot of favors for me before the surgery which I did without complaint. I helped her get to the hospital and everything else that has followed. I’m taking care of her cats which I’m allergic too and who are not trained at all so I’m not getting much sleep. She got discharged to a rehabilitation center last Friday and freaked out and basically guilt tripped me into helping her leave and was screaming at all the nurses. Somehow we got her to her apartment but of course she couldn’t take care of herself and I had to get a bunch of things for her and I tried to help her onto her bed, etc…it got so bad that night that she wetted herself 3 times, I found her on the floor, etc. the next morning I called an ambulance to take her back to the hospital which she begged and pleaded me not to. The whole thing was an emotional nightmare and I had to deep clean her apartment on Mother’s Day. I’ve also visited her at the hospital and when she got discharged to another rehab I was there to help her and make sure she stayed calm. 

I don’t have any siblings and she doesn’t have any family members that I know of. She has one friend but he lives in a different state. I don’t have any parental figures in my life to ask for advice or help. 

She keeps asking me to do her favors and errands. I don’t want to. I’m so tired both physically and emotionally. I’ve had a terrible month at work trying to juggle things and I haven’t been able to take care of myself either like see friends or go to the gym. She keeps guilt tripping me. Is it reasonable for me to stop doing these errands and stuff for her? What are appropriate boundaries for helping a parent out in this sorta one off situation? She hasn’t asked me how I’m doing or if she can do anything to help me (like even offer to order me a coffee or something). I’ve spent so much time and money on trying to help her. How much did you help your aging parent? ",2,1778773988.0,relationship_advice,2,1.0,False
1td2bhr,https://www.reddit.com/r/Brazil/comments/1td2bhr/advice_on_products_to_get/,Advice on products to get,"Hello everyone, I wanted advice on certain brands of items I should get while in my time in  Sao Paulo Brazil.

One of my goals for this trip was to come back with stuff since I don't know when my next time in Brazil will be.

* im looking for popular body care like body wash, lotion, body scrubs, and oil. I've heard a lot about it. An example would be natura, which I've heard a ton about
* . I truly love a fruity smell. I've heard about **O Boticário as a good spot for it.**
* Shoes. I love shoes. I've been trying to build a collection of Y2K-inspired sheets for the past year, and Brazil is such a big exporter of them. im mostly looking for heels, wedges, and flip flops. I do plan on getting Hawaiian products before I leave, as a must-have
* Natural hair products are one as well. I have type 4/ coily hair, and I've always enjoyed the natural hair culture in Brazil. I've seen a ton of brands like Skalaa and Lola Cosmetics Meu Cacho Minha
* for clothes im still unsure if I wanna get a lot or other than the standard Brazil shirt. Just because I usually thrift my clothing cuz kim really particular about the pieces I get and the price point. unless theres a clothing store I should be dying to go to. unless theres thrift places I should check out as a chronic thrifter.
* Coffee, I've really enjoyed the coffee here so far im thinking about taking some back for my mother. I'm not really a coffee snob, but I do enjoy a good cup of it 😄",2,1778773966.0,Brazil,0,1.0,False
1td2b3l,https://www.reddit.com/r/ForeverAloneDating/comments/1td2b3l/26m4f_italy_europe_i_miss_having_someone_to_talk/,"26[M4F] #Italy | Europe – I miss having someone to talk to.. that’s it, that’s the post :c","I’ve learned how to keep myself busy. I fill my time, I stay productive, I show up where I need to.

But I think, deep down, everyone wants a place or a person that feels like home.

For me, I just want to feel at home with someone. I’ve been able to stand on my own for a long time, but it gets lonely and tiring to always be alone…

Figured I’d post here instead.

I’m someone who tends to care deeply, show up fully, and notice the little things. I appreciate meaningful interactions and people who value sincerity and effort in how they connect with others.

I lean a bit old-school in general, loyalty, honesty, and small thoughtful gestures go a long way for me.

I enjoy conversations that go on longer than expected, the kind where you forget to check the time. I appreciate humor (especially the slightly weird kind), emotional awareness, and people who can be genuine without overthinking it.

I also believe in empathy and being there for people who matter, even if it’s just showing up to listen.

## A bit about me:

Physically, I’m on the taller side (5’11), slim build, dark straight hair, brown eyes, and usually have a short beard nothing rough. I’ve got a tanned, caramel-toned complexion and sometimes I wear glasses thanks to all years of screen time.

## Interests:

Music, books, philosophy, languages, writing, games, sports, art, and the occasional 2AM deep dive into random topics.

I also enjoy walks, good coffee, and shared laughter.

Cooking is something I enjoy too, especially when it’s for others. Though, like most people, I have my procrastination days.

I’m mostly here to connect with like-minded people who enjoy thoughtful conversations, mutual respect, and just… being real.

A connection that feels safe, but still exciting, where vulnerability isn’t awkward, but comes naturally with time. We grow individually, but also together.

If any of this resonates, feel free to say hi,just maybe bring a bit more than a one-word intro 🙂",1,1778773944.0,ForeverAloneDating,1,1.0,False
1td2b31,https://i.redd.it/1e1jylw8j41h1.jpeg,*NEW* MUM GROUP ~coming soon~,"making mum friends shouldn't be hard. a new space for mums to meet, make friends, and build their village. If you're a mum, new mum or soon to be mum in Galway, we'd love to have you join!

events - coffee - community - fun

\~ for the cool mums \~

**Follow us on instagram @** **dearmums.co** and look out for our first event!",0,1778773943.0,galway,3,0.33,False
1td2am3,https://i.redd.it/sczk3e0yj41h1.jpeg,Ironically on the circus related map update,A friend and I were playing last note and Lo' and behold a somewhat circus themed Easter egg name on the somewhat circus themed map! (Coffee world i think is what it was called?) ,4,1778773914.0,PhasmophobiaGame,2,1.0,False
