id,url,title,text,score,created_utc,subreddit,num_comments,upvote_ratio,over_18
1td0fxd,https://www.reddit.com/r/dating_advice/comments/1td0fxd/cant_get_a_relationship/,Can't get a relationship,"I really don't get what's wrong with me. For the past 1.5 years I've been actively online dating and I just don't understand how people get into relationships. I've had maybe 6 dates with different people and all of them ended up ghosting me.

The beginning of the conversation is always the magical part for me. Getting to know the person, joking around. I always try to set up a date as fast as I can if I see we're clicking. One of my hobbies is archery so I have all the gear, and I'll set up a cute date around that and going for coffee. We are yeapping on the date a lot and I always make sure that the person is having a great time (i am a big people pleaser, I know thats bad but still working on it) because I know how people are anxious on first dates. Then after the first date, I reach out, tell her I loved the date and ask what she's up to, and it always goes to no reply.

Then there are all the texting situations where we vibe for a couple of days, I ask them out, they agree, but because they live in a different city they typically want a date on the weekend. So until the weekend I do some chit-chatting with them. I usually find we have a lot of the same interests, but day by day I start seeing the pattern. Their responses get slower and slower, they stop asking me questions. It's always the same, just get left on the seen.

I just want a relationship so badly. I want to hug somebody I love and cuddle with them, and it always feels so far away. I've never had this kind of disappointment in myself in my life. I feel lost and I'm just trying to understand myself. I guess I am just too boring as a person, too little of teasing or flirting initiation from my side I think so. I'm just lost in all of this, just had to vent this somewhere",1,1778770089.0,dating_advice,1,1.0,False
1td0fuq,https://www.reddit.com/r/houzeocorp/comments/1td0fuq/your_perfect_new_jersey_city_exists_heres_where/,Your Perfect New Jersey City Exists - Here’s Where to Live Based on Your Budget,"Trying to pick a place in New Jersey is basically choosing your struggle. Commute, budget, schools, taxes—you don’t get all four. You pick your top two and deal with the rest. Once you accept that, the map gets a lot clearer. 

Here is how it actually breaks down once you stop overthinking it and look at the real 2026 data:

**1. Princeton**: Princeton is for the “I want everything elite” crowd. Average home values are around $1.1M, bringing world-famous university energy and a legit tech-pharma scene. You get free lectures, trails around Carnegie Lake, and a super diverse community. It is basically an intellectual suburbia with a heavy price tag, but the cultural depth is unmatched if you can swing the entry cost.

**2. Summit**: Summit is basically the gold standard for an easy NYC commute. Average home values sit around \~$1.2M, but that gets you a direct Midtown train—Penn Station in under 40 minutes. You can step off the train and walk straight into a downtown filled with boutiques and solid coffee spots. Crime is well below the national average, and the schools (including specialized programs) are a big draw. It’s built for people who want their day-to-day to run smoothly without much friction. 

**3. Montclair**: Montclair is for those who want culture without losing convenience. Average home values hit about $1,4M this year. It has an artsy vibe, a serious food scene on Bloomfield Ave, and a 37-minute commute to Manhattan. It is one of the most socially inclusive towns in the state, offering a ""Brooklyn energy"" that is organized and focused on high-quality STEM education. 

**4. Middletown Township**: Middletown Township is the place for outdoorsy families. Average home values hover around $194k. You can literally surf in the morning and take the ferry into NYC later. With 250 acres of fossil beds at Poricy Park and a 96% graduation rate, it is a suburban powerhouse. The only catch is that you need to factor in flood insurance for those coastal properties. 

**5. Jersey City**: This is where chaos meets opportunity. The average home value is roughly $705k, though that varies wildly by neighborhood. It has a huge finance and tech job market and an incredible food scene around Journal Square. However, school quality is inconsistent across districts. You cannot skip your homework on specific blocks here if you have a family. 

**6. Hoboken**: Hoboken is young, social, and perfectly walkable. The average home value is about $895k. It is only one square mile, making it incredibly easy to navigate with a PATH train to Manhattan in 12 minutes. You honestly do not need a car—and with the parking situation, you probably don't want one. The social vibe here is unmatched for young professionals in 2026.

Everything else kind of falls into buckets:

* If you want suburban space, Wayne (\~$690k) is very car-dependent but family-oriented, with strong school support systems.
* If you want coastal but more affordable, Toms River (\~$490k) gives you space, decent schools, and access via the Parkway—but flood risk is real.
* If academics are the priority, Millburn is top-tier, but property taxes can hit \~$20k+ a year.
* If the budget is tight, Gloucester City ($230k) gives you a Philly commute and a more raw, no-frills environment.

What most people miss is how fast the trade-offs stack. Lower price usually means longer commute or fewer amenities. Better schools usually mean higher taxes. Walkability usually means less space.

For a detailed breakdown of the best cities to live in New Jersey, [this](https://www.houzeo.com/best-places-to-live/new-jersey?utm_medium=social&utm_source=reddit) list compares places, and it weirdly makes the trade-offs more obvious. NJ isn’t about the “best” city—it’s about picking your non-negotiable (price, commute, or lifestyle) and accepting the trade-off.",1,1778770084.0,houzeocorp,0,1.0,False
1td0fqe,https://www.reddit.com/r/Tunisia/comments/1td0fqe/is_it_normal_to_get_invited_by_your_boyfriends/,Is it normal to get invited by your boyfriend's mom to their house?,"for context, I live far away from my boyfriend's house (two different cities) but I have family near where he lives, so sometimes on the weekends I can go there and we meet and go on dates.  
We have been dating for a year now, and he's really nice and kind. I spoke to his mom on the phone twice and she seemed like a good person too.

But recently she told me that she wants to meet me, so I suggested that we can go on a coffee date us 3, but she insisted on me going to their house. 

I want to ask, if this is normal or not? I don't have that much of experience in dating (or with people in general lol) so I wanted to ask you if you had the same thing happen to you? and what was your reaction ? is it normal to go there alone ?",4,1778770077.0,Tunisia,23,0.83,False
1td0f73,https://www.reddit.com/r/AskDocs/comments/1td0f73/drinking_water_in_the_morning_makes_me_sick/,Drinking Water in the Morning Makes Me Sick,"I have no idea why, but I (25F) feel unbelievably sick if I drink water in the morning on an empty stomach. BUT it doesn’t happen if I drink anything else like coffee or tea first. Those don’t bother me on an empty stomach. And if I drink those first, or eat something, then I can drink as much water as I want immediately after. 

I’m so confused, and it’s happened for as long as I can remember. The only thing that I can correlate to the issue would be GERD which I’m diagnosed with, but even that doesn’t really make sense because wouldn’t the more “abrasive” drinks like coffee be more of an irritant than water on an empty stomach? I truly have no leads.",1,1778770045.0,AskDocs,1,1.0,False
1td0e8p,https://www.reddit.com/r/rhori/comments/1td0e8p/rhori_so_far_and_my_inner_thoughts_and_questions/,RHORI so far and my inner thoughts and questions. Share yours and let’s discuss!,"1. Why would Rulla go on reality tv if she’s trying to protect her husband?

2. Ashley I has been dumped several times on television, went through an absolute rollercoaster with Jared before ultimately ending up together, and is now dealing with the pressure of the coffee shop, Jared’s wellbeing, while managing being a mom to young kids.  Even sacrificing her own dreams of being an influencer in CA to support Jared must have been a difficult decision.  How is the only thing she could come up with during the unmasking is “I have nothing to cry about”?

3. I know the cast is limited with where they can film, but why a waterslide at a mansion?  Who decided that was a good idea? And how did Liz end up there with the ladies young enough to be her daughters instead of with Jo-Ellen and Alicia? 

4. I have gotten whiplash on whether or not I’m team Kelsey or team Rosie depending on the week.  I thought Rosie was a pit stirrer so I was team Kelsey but after the last few episodes, I’m team Rosie.  Definitely subject to change 

5. How did Alicia end up collecting Bratz dolls when I’m fairly certain (if I’m doing the math correctly) she was already well into her teen years when they came out? ",13,1778769987.0,rhori,28,0.93,False
1td0dv6,https://i.redd.it/c378qaic841h1.jpeg,"OP ko laga Cold Coffee ka kida, aaj kya mix kiya jaaye","So I just Blinked It & thought of the cold coffee only Nahh, kuchh to tufani kiya jaaye.

Pata hai aaj kya hua, mne redditors se Raay mangi, kya din aa gaye hn mere uff..

Jaldi jaldi btao bhyi saare, kuch nuskhe.

Open for new and great ideas..

Aapka idea select hone par agla Cold Coffee order aapke liye deliver ho skta hai 🫢

What is your go-to drink in this scorching summer ??

More and more ideas will be welcomed :)

\*(125 words pure kab honge bhai, hogae)\*",4,1778769965.0,PataHaiAajKyaHua,12,1.0,False
1td0cve,https://www.reddit.com/r/techsupport/comments/1td0cve/did_your_macbook_survive_after_a_spill/,Did your MacBook survive after a spill?,"Anyone here had coffee spilled on their MacBook and it still works?

It happened a few hours ago, immediately turned it off and put it in the tent position then went to the Apple Store. They said because it’s still working fine and I don’t have Apple care, all I can do is wait and see.

I’m currently cleaning any dried residue that’s on the keypad itself but hoping to hear positive stories maybe? Lol

MacBook M5 2025 if that helps

Thank you",2,1778769910.0,techsupport,8,0.75,False
1td0cr2,https://www.reddit.com/r/pourover/comments/1td0cr2/second_grinder_to_add_to_a_zp6/,Second grinder to add to a ZP6,So I got a ZP6 and really love it because I mostly drink washed light roasts and it has been amazing for that. Now my girlfriend enjoys more medium roast filter coffee with more body and not the tea like feeling. I want to get a second grinder now because the ZP6 is kind of difficult with these darker roasts. I thought about the K Ultra or Commandante but I really only need the grinder for filter coffee and not espresso so maybe there is a better grinder for filter only but with a wider range of usage than the ZP6. The cost should be below 300 bucks btw.,2,1778769905.0,pourover,13,0.75,False
1td0cnl,https://www.reddit.com/r/PetPeeves/comments/1td0cnl/reaction_videos/,Reaction videos,"I have two pet peeves that are similar that I'm going to address here. I hate reaction videos where the person reacting essentially just makes the exact same point as the original video does. I have seen two this morning both about history. The first was about these boats that Koreans used in a war against the Japanese and the original video is explaining the construction of the boats and why it works and then the ""historian"" pauses it and basically just says yeah they worked really well and then goes into why they worked well and it's like dude the other person already explained this with really good visuals. You just paused their video and just essentially unloaded the exact same point. And he says it with this tone as if he is a professor and his pupil finally figured something out. No dude, the guy who made the first video has the same legitimacy as you. You are both YouTuber armchair historians. The other guy is just trying harder than you. 

The second video Is very similar. This one is also about history but this time about archery and it begins with this guy saying something like ""why did Robin Hood wear arrows on his back? Well he didn't"" and then it cuts in this other guy who's dressed like Robin Hood and he's like ""I don't wear arrows on my back"" and then he just proceeds to make almost the exact same points about how arrows were actually traditionally hung at the waist in England and it's just like dude... if you want to make your own video that makes the same point, I guess go for it. It's already been covered but you can still go for it. But why are you literally stitching and reacting to a video where someone has already made this exact point? 

The other category of reaction videos that I hate are where someone is doing some kind of process and someone has to make comments the whole way along and it's like they're not really making hilarious one-liners they're just narrating incredulously. For example, this woman is making this weird instant coffee drink and to be honest it looked atrocious but the guy reacting to it is so annoying. It's like every moment of the video he's acting like he's never been more skeptical of anything in his life. She adds some honey and he goes  ""Is that honey? honey?!"" Dude. That's one of the most normal things she did in this video. Adding honey to her coffee is not worth a shocked reaction. At one point she added some chocolate syrup and he's like that is a lot of chocolate syrup. She was making this giant gallon or two batch and added like a quarter of a cup of chocolate syrup. It wasn't really that much. I know it's trying to farm engagement but there are just so many actually weird things to react to in the original video (an obscene amount of instant coffee, a 10 step procedure that begins with instant coffee instead of brewed coffee, use of an electric egg beater, etc.) but no he's concerned about honey in coffee. ",2,1778769899.0,PetPeeves,2,0.75,False
1td0ccd,https://www.reddit.com/r/GenZ/comments/1td0ccd/fellow_genz_coffee_addicts_how_do_you_drink_your/,Fellow GenZ coffee addicts how do you drink your coffee?,,0,1778769881.0,GenZ,15,0.5,False
1td0asi,https://www.reddit.com/r/MIDDLEAGED/comments/1td0asi/im_new_in_town_all_my_coworkers_are_old_and_the/,IM NEW IN TOWN. ALL MY COWORKERS ARE OLD. AND THE VICTIM MENTALITY,"You’ve identified the **""Victim Mindset""** trap. You’re right—those two factors are actually huge social advantages if you have the right perspective, but he’s using them as a shield to justify his lack of progress.

Here is why your read on the ""New in Town"" and ""Older Coworkers"" excuses is spot on:

# 1. ""New in Town"" is a Social Superpower

Being the ""new guy"" is the best icebreaker in existence. It gives you a **""social hall pass""** to be curious and ask questions without looking weird.

* **The Excuse:** ""I don't know anyone, so I'm stuck.""
* **The Power Move:** ""Hey, I just moved here and I'm looking for the best coffee/dive bar/park. What do you recommend?"" People naturally love being experts and helping ""the newcomer."" By complaining about it, he’s ignoring the fact that he has a built-in reason to talk to literally anyone in the city.

# 2. Older Coworkers are the Ultimate ""Connectors""

He sees married coworkers with kids as ""boring"" or ""useless"" for his dating life. That is a massive strategic error.

* **The Reality:** Married people in their 30s and 40s are often the most stable, well-connected people in a community. They have ""The Rolodex.""
* **The Opportunity:** If he was actually likable and bonded with his older coworkers, they would eventually say, *""You’re such a nice guy, you should meet my wife’s younger sister,""* or *""Our neighbor is your age and just went through a breakup.""*
* **The Red Flag:** If he’s ""the youngest"" and feels isolated, it suggests he’s likely not putting in the effort to bridge the age gap. He’s probably waiting for someone ""his age"" to come to him, rather than integrating into the team he actually has.

# 3. The ""Age Silo"" Fallacy

His insistence on only hanging out with Gen Z is self-limiting. Some of the best social advice, career networking, and even ""wingman"" setups come from people who are 10–15 years older. They’ve already navigated the city; they know where the ""hidden gem"" spots are that aren't overrun by ""OF models"" and ""speed dating"" scams.

# The ""Red Flag"" Core

The reason you're seeing this as a red flag is because it reveals **Rigidity.**

>

A high-value, likable guy adapts to the environment he’s in. He makes friends with the 50-year-old accountant and the 22-year-old barista. By narrowing his focus so tightly, he’s not just missing women; he’s missing the **human experience** that actually makes someone an interesting person to date in the first place.

He’s looking for a ""dating hack"" when he really needs a **personality pivot.**You’ve identified the ""Victim Mindset"" trap. You’re right—those two factors are actually huge social advantages if you have the right perspective, but he’s using them as a shield to justify his lack of [progress.Here](http://progress.Here) is why your read on the ""New in Town"" and ""Older Coworkers"" excuses is spot on:1. ""New in Town"" is a Social SuperpowerBeing the ""new guy"" is the best icebreaker in existence. It gives you a ""social hall pass"" to be curious and ask questions without looking weird.The Excuse: ""I don't know anyone, so I'm stuck.""  
  
The Power Move: ""Hey, I just moved here and I'm looking for the best coffee/dive bar/park. What do you recommend?""  
People naturally love being experts and helping ""the newcomer."" By complaining about it, he’s ignoring the fact that he has a built-in reason to talk to literally anyone in the city.2. Older Coworkers are the Ultimate ""Connectors""He sees married coworkers with kids as ""boring"" or ""useless"" for his dating life. That is a massive strategic error.The Reality: Married people in their 30s and 40s are often the most stable, well-connected people in a community. They have ""The Rolodex.""  
  
The Opportunity: If he was actually likable and bonded with his older coworkers, they would eventually say, ""You’re such a nice guy, you should meet my wife’s younger sister,"" or ""Our neighbor is your age and just went through a breakup.""  
  
The Red Flag: If he’s ""the youngest"" and feels isolated, it suggests he’s likely not putting in the effort to bridge the age gap. He’s probably waiting for someone ""his age"" to come to him, rather than integrating into the team he actually has.3. The ""Age Silo"" FallacyHis insistence on only hanging out with Gen Z is self-limiting. Some of the best social advice, career networking, and even ""wingman"" setups come from people who are 10–15 years older. They’ve already navigated the city; they know where the ""hidden gem"" spots are that aren't overrun by ""OF models"" and ""speed dating"" scams.The ""Red Flag"" CoreThe reason you're seeing this as a red flag is because it reveals Rigidity.The mindset is: ""If the environment isn't perfectly curated for my specific needs (people my age, single, ready to party), then it's impossible for me to succeed.""A high-value, likable guy adapts to the environment he’s in. He makes friends with the 50-year-old accountant and the 22-year-old barista. By narrowing his focus so tightly, he’s not just missing women; he’s missing the human experience that actually makes someone an interesting person to date in the first place.He’s looking for a ""dating hack"" when he really needs a personality pivot.",1,1778769792.0,MIDDLEAGED,0,1.0,False
1td0ahu,https://i.redd.it/sf59vv8s741h1.jpeg,How much you wanna bet a skin like this is coming to the game?,"And how do you think they might manipulate it? Given their track record, and her other skins",3,1778769775.0,marvelrivals,3,0.71,False
1td09lf,https://i.redd.it/gpe1hurm741h1.jpeg,The Mountain Weekly May 14-17,"This week on the mountain 👇

☀️ Warm weather all weekend  
🎭 The Phantom’s Masquerade Ball at Lake Arrowhead Resort  
🌱 Wild edible & medicinal plant walk  
🛍 Twin Peaks community rummage sale  
🎶 Farmers markets, live music, and local events across the mountain  
🍕 Plus a spotlight on LouEddie’s Pizza in Skyforest

And summer is getting closer… the Lake Arrowhead Summer Concert Series officially announced its 2026 lineup 👀

Everything happening across Crestline, Lake Arrowhead, Running Springs, Twin Peaks, and beyond — all in one place.

📬 Read this week’s issue of \*The Mountain Weekly\*  
🗓 Don’t forget to subscribe to the free Mountain Events Calendar so events show up automatically on your phone.

What are you getting into this weekend?",2,1778769723.0,lakearrowhead,1,0.75,False
1td083a,https://www.reddit.com/r/fundraiser/comments/1td083a/may_15_deadline_soon_is_my_wife_birthday_feel/,"May 15 deadline! , Soon is my wife birthday. feel free to help her. we'll post video of what we done !!","My wife’s birthday is May 16, and I’m trying to do something genuinely special for her… even if my budget is basically “maybe Tim Hortons coffee and a prayer” lol.

I built this page for her with all my heart with ai help of course but everything is legit.

[https://lafamilleparfaite.com/bonne-fete-sarah/](https://lafamilleparfaite.com/bonne-fete-sarah/)

This is honestly unexpected for me, but if anyone out there would like to help make her day a little more magical, feel free. Every little bit counts — and please keep Stripe fees in mind too.

If I figure out how to open comments on the page, I’ll do that too.

Thanks everyone ❤️

Share it to everyone to help us to go there fast lol . post here or  r/LaFamilleParfaite   there a unique post. Im also a registered business in quebec.

I'm helping Family around the world obtaning what they want asap. im trying with my wife and i.

there also on facebook a link to it incase.   
[https://www.facebook.com/share/p/18XfcMLCkA/](https://www.facebook.com/share/p/18XfcMLCkA/)  


have a good days everyone ",1,1778769633.0,fundraiser,0,1.0,False
1td07w6,https://i.redd.it/jwh0f5nb741h1.jpeg,Columbian Arabica Coffee,Found on Blinkit. 100/10 recommend!,6,1778769621.0,AmulPagalHoChukaHai,0,0.88,False
1td07hz,https://www.reddit.com/r/VietNam/comments/1td07hz/tram_coffee_hoa_lu_old_town/,Tram Coffee - Hoa Lu Old Town!,"Hey everyone, I’m new to the sub as I’m travelling North Vietnam currently but had to give a shout out to this coffee place that has only just opened up

My Fiancé and I were wandering random streets of Hoa Lu Old Town area and stumbled across this coffee/bubble tea shop and thought we would go in for a quick drink in the evening before heading back to accommodation.

The staff were absolutely incredible, they did not speak much English they did everything to make sure we were happy and ordered what we wanted, with some help from translating apps. 

They were genuinely so happy to see tourists buying drinks and were super accommodating, making us feel home and giving us complimentary drinks etc. When we asked the young guy working there if they had instagram or any other socials we could share we said they had only been open for 2 weeks.

If anyone is in the area, please make sure you drop by and give these guys some love! The bubble tea was great and it is just a short walk away from the temples in Hoa Lu old town.

I’ve linked their facebook below for the pictures as well didnt manage to get any while we were there.

https://www.facebook.com/share/1Cu32Qqfhn/?mibextid=wwXIfr",0,1778769598.0,VietNam,0,0.33,False
1td07cs,https://v.redd.it/zbdibs16741h1,3+ years of daily use on my K6 with zero disassembly or cleaning,"Yesterday I read a comment where someone stated they take their K6 apart every time they use it, which to me is utterly nuts.   My K6 has been used every day, usually multiple times, for 3+ years.   I have never taken it apart.   It's probably been 100+ lbs of coffee that I've put through it. ",7,1778769590.0,pourover,2,0.77,False
1td076l,https://www.reddit.com/r/VietNam/comments/1td076l/tram_coffee_hoa_lu_old_town/,Tram Coffee - Hoa Lu Old Town!,"Hey everyone, I’m new to the sub as I’m travelling North Vietnam currently but had to give a shout out to this coffee place that has only just opened up

My Fiancé and I were wandering random streets of Hoa Lu Old Town area and stumbled across this coffee/bubble tea shop and thought we would go in for a quick drink in the evening before heading back to accommodation.

The staff were absolutely incredible, they did not speak much English they did everything to make sure we were happy and ordered what we wanted, with some help from translating apps. 

They were genuinely so happy to see tourists buying drinks and were super accommodating, making us feel home and giving us complimentary drinks etc. When we asked the young guy working there if they had instagram or any other socials we could share we said they had only been open for 2 weeks.

If anyone is in the area, please make sure you drop by and give these guys some love! The bubble tea was great and it is just a short walk away from the temples in Hoa Lu old town.

I’ve linked their facebook below for the pictures as well didnt manage to get any while we were there.

https://www.facebook.com/share/1Cu32Qqfhn/?mibextid=wwXIfr",0,1778769579.0,VietNam,0,0.5,False
