id,url,title,text,score,created_utc,subreddit,num_comments,upvote_ratio,over_18
1m3b1ma,https://www.reddit.com/r/crafts/comments/1m3b1ma/homemade_metallic_nail_polish/,Homemade metallic nail polish?,"Hi r/crafts! First post here... I have some nail polishes that look more metallic in the bottle than they are on my nails, and I want to fix this. I know that the metallic appearance is achieved with insanely fine-grade glitter, but I don't know that I can necessarily find that for purchase without shopping online, which I want to avoid for now. Is there a way to DIY making your glitter into a finer grit? I considered using a coffee grinder that I normally employ for spices, but I imagine that might produce shard-shaped grains and I will effectively be applying the nail polish equivalent of diatomaceous earth. 
Any suggestions are appreciated! ",1,1752865603.0,crafts,2,1.0,False
1m3azz7,https://i.redd.it/a67cegy1lodf1.jpeg,Friskies seems to have plastic,"Hi all,

Do you ever find these black shreds in Friskies cat food? It kinda looks like plastic, and I found it in two separate cans.

Thank you,
",1,1752865496.0,catfood,1,1.0,False
1m3azsp,https://www.reddit.com/r/BangaloreSocial/comments/1m3azsp/trying_something_new_after_agesss/,Trying something new after agesss!!,"Looking for a random platonic date or friend in South Bengaluru... To talk about random stuff, movies, share thoughts, if possible on a cup of coffee and blabber on random things that you find interesting... Offline or online doesn't matter...

-- just a regular IT guy",1,1752865483.0,BangaloreSocial,2,0.99,False
1m3azqs,https://www.stack3d.com/2025/07/caffeine-feel-in-liquid-death-energy-drink.html,Liquid Death wants the feel of its energy drink to be more like a cup of coffee,,1,1752865480.0,stack3dnews,0,1.0,False
1m3azg6,https://www.reddit.com/r/UnsentLetters/comments/1m3azg6/the_guy_with_no_middle_name/,The guy with no middle name;,"None of my exes take as much space in my thoughts post-breakup, the way that you do. 

I remember when you took me on our first date, to multiple locations within the city. You wanted to show me around and brought me to some really cool places. Outside of the coffee shop, we were approached by a woman who asked for bus money. I don’t remember her circumstances, but I do remember you giving her all of your cash and wishing her well. 

I remember being so impressed with how giving and loving you were. I still admire these qualities about you. 

The problem is, though we couldn’t work out because of our individual circumstances; I have so much respect for you and I wish good things to come your way. I wish I could tell you that myself, but I hurt you while dealing with my personal struggles and lost the privilege of having any sort of relationship with you.

I’ve written multiple letters here, and things are more complicated than they may seem. I get people who message me and ask why we aren’t together if I feel such a way, and I think it’s more about compatibility, difference in upbringing, and personal growth for us. 

I wish I had a family that was as caring and loving to me as yours is with you. I struggled fitting into your family, heightening my struggles and feelings with my own family dynamics. The cultural differences didn’t help, either. (I’m just a dumb American with uneducated hillbilly trauma) I appreciate the culture you come from and I pray for your country often, as I’ve continued educating myself on the continuous struggle that your people have endured.

I wish you the best in all that you do, and I hope you know that the way you treated me was never the problem; It was the way I was struggling and knowing you couldn’t fix my problems for me, even though it’s in your nature to help. 


",1,1752865457.0,UnsentLetters,2,0.99,False
1m3az8n,https://www.reddit.com/r/askportland/comments/1m3az8n/where_can_i_get_a_cup_of_good_coffee_and_have_a/,Where can I get a cup of good coffee and have a cigarette?,Any suggestions where it doesn’t feel inappropriate? I’m not a heavy smoker but I like having a cig and coffee sometimes but don’t want to feel like an asshole disturbing other people. ,10,1752865442.0,askportland,21,0.6,False
1m3ayh3,https://www.reddit.com/r/DIYTools/comments/1m3ayh3/uncover_the_maestri_house_mhmf03_milk_frother/,Uncover the Maestri House MHMF03 Milk Frother Review: Is It Worth Buying?,"The **Maestri House MHMF03 Rechargeable Milk Frother with Stepless Speed Control** initially caught my eye for its sleek design and promise of versatility. After using it every day for over a month (my mornings just aren't complete without coffee), I feel ready to share my comprehensive thoughts on this little gadget. This isn’t your average milk frother; it’s designed for those who appreciate precision and customization.

**Design and Build Quality**  
I immediately noticed the robust yet lightweight aluminum alloy body. It feels solid in your hand without being heavy, which is surprisingly rare in handheld frothers. There’s a stainless steel stand included that keeps it upright and organized, saving counter space and avoiding the dreaded frother rolling-around-on-the-counter situation. The stepless speed control dial is a game-changer—smooth to operate and intuitive. With such a design, mornings feel a tad more luxurious and fuss-free.

**Stepless Speed Control: A Useful Innovation**  
Fiddling with traditional milk frothers that only have on/off or preset speed options never felt satisfying. With this frother, I can fine-tune the speed from 4500RPM to 10000RPM with ease. Dial it up for thick, creamy froth perfect for cappuccinos, or keep it low for mildly emulsified drinks like matcha latte. It even manages to avoid the annoying splashes that cheaper frothers sometimes cause—thank goodness for that!

[Find the best price for Maestri House MHMF03 on Amazon.](https://toolhandle.com/p/b0d49m4zjj/)

**Battery Life That Doesn’t Disappoint**  
Its built-in 2000mAh rechargeable battery lasts up to three months on a single charge. One word: convenient. I’ve been using it almost daily, and it hasn’t needed recharging yet. The USB-C charging functionality is a modern touch I appreciated—goodbye to swapping batteries every few weeks. Just plug it in, and in about three hours, it’s fully charged.

**Performance That Exceeds Expectations**  
The first time I used it, I timed how long it took to froth milk—10 seconds flat. Those fast RPMs really deliver the creamy, café-style texture I'd hoped for. Whether it's for a classic latte or frothed hot chocolate, this thing delivers every time. It even blends protein powder into drinks like a champ, which means fewer clumps and better-tasting shakes for me post-workout.

**Advantages**  
- Unique stepless speed control feature for precise frothing  
- Long-lasting rechargeable battery (up to 3 months per charge)  
- Lightweight and durable aluminum construction  
- Easy-to-clean detachable whisk design  
- Versatile enough for coffee, matcha, protein shakes, and more  

**Negatives**  
- Rotary dial feels slightly delicate for daily heavy adjustments  
- Cleaning the area where the whisk attaches could be easier  
- Whisking rods are smaller compared to other frothers, limiting the volume for larger drinks  

**Cleaning and Maintenance**  
Cleaning is, thankfully, pretty quick. The detachable whisk design makes it easy to rinse under water. However, over time, the attachment area where the whisk locks in does need closer attention to prevent buildup. I chicken out sometimes and just wipe the body down with a damp cloth instead of using water. Knowing it’s waterproof gives some peace of mind, though, since occasional splashes are unavoidable.

**Competing Products**  
When compared with competitors like the Zulay Original Handheld Milk Frother or the PowerLix Handheld Milk Frother, this model shines for its custom speed control and portability. Others might offer similar battery life or whisking capabilities, but they often lack the adjustability that this product brings. However, the Zulay frother does come with a slightly more robust stand and storage, which kept it in contention. If price is a key factor, those might appear tempting, but they lack finesse in froth consistency that this one nails.

**Worth Every Penny**  
This frother sits slightly higher in price compared to ultra-basic models, yet the features and quality justify the cost. Features like the stepless speed control, aluminum body, and USB-C charging make it a long-term investment for any home-brew enthusiast. You’ll end up saving a bit on pricey café beverages while enjoying consistent results at home.

[Grab Maestri House MHMF03 at the best price on Amazon.](https://toolhandle.com/p/b0d49m4zjj/)",1,1752865388.0,DIYTools,0,1.0,False
1m3axr3,https://www.reddit.com/r/u_musiclyyyy/comments/1m3axr3/boundless_beauty/,Boundless Beauty,"Ollie first met Piper in the kind of place where people pretended not to notice each other — a cramped campus café, all humming espresso machines and rain-streaked windows. She was already in his seat, pink-highlighted hair tied back in a messy knot, hunched over a sketchbook. He didn’t say anything, just stood there a second too long until she finally looked up.

“You’re blocking the light,” she said, not unkindly, and he found himself sitting across from her without even asking.

⸻

The second time was a week later, under the campus clocktower at midnight. He’d been walking home when a blur of laughter and movement nearly knocked him over — Piper, earbuds tangled, hoodie drenched from the drizzle.

“Twice in one week?” she said, catching her breath. “You following me, or am I just that unlucky?”

He smirked. “Could be both.”

She rolled her eyes, but she didn’t walk away.

⸻

Their collisions became routine. Study sessions that turned into arguments over playlists. Walks back to the dorms where they’d linger under flickering streetlamps, talking about nothing in particular. Ollie learned that Piper hated the rain but loved the smell of it, that she could never remember where she left her keys, and that she carried herself like someone who’d learned to outrun the world long ago.

⸻

One night, after a particularly brutal round of midterms, they ended up on the roof of her apartment building. The city stretched out below, every street awash in neon. Piper leaned against the railing, sipping from a convenience store can of coffee.

“You ever think about just… leaving?” she asked. “No plan, no map. Just getting on a train and not looking back?”

“All the time,” Ollie admitted.

She tilted her head toward him, the pink streak in her hair catching the neon glow. “So why don’t you?”

“Maybe I’m waiting for a reason to stay.”

⸻

Piper stared at him for a moment too long. The air between them tightened, charged, until she finally turned away with a half-smile. “You’re going to have to try harder than that.”

⸻

Weeks passed, but that night stayed lodged in Ollie’s head. He noticed the little things now — how Piper bit her lip when she was thinking, how she always sat on the floor instead of a chair, how her laughter could cut through even his worst days.

One rainy evening, they found themselves walking home under a single umbrella. Piper’s hand brushed his as they adjusted it, the warmth of her fingers sending an unwelcome spike of adrenaline through him. She caught the way his breath hitched, smirked, and didn’t move away.

⸻

It came to a head during another rooftop night. Piper was sketching, pencil flying across the page, when she said, without looking up:

“Do you like me, Ollie?”

He froze, his heart tripping over itself. “Why are you asking?”

“Because I can feel it. And because…” She finally met his eyes, something unreadable flickering there. “…I’m trying to decide if I want you to admit it.”

Ollie swallowed hard. The city noise faded, leaving only the sound of his own pulse. He took a step closer, close enough to see the freckles scattered across her nose.

“Then decide,” he said softly.

⸻

For a moment, he thought she might close the distance. But Piper only smirked, standing and slipping past him, her shoulder brushing his.

“Not tonight,” she murmured, her voice barely audible over the wind.

⸻

Ollie watched her go, jacketless and heartbeat thrumming, more certain than ever that she’d already made her decision — and that he was hopelessly, irrevocably in too deep.",1,1752865344.0,u_musiclyyyy,0,1.0,False
1m3axf0,https://www.reddit.com/r/awakened/comments/1m3axf0/pranayama_is_fucking_peak_its_absoutely_amazing/,"Pranayama is FUCKING PEAK, ITS ABSOUTELY AMAZING","

If you aren't doing pranayama, there is only two possibilities, either you are retarded or you are ignorant about it and don't know it.

THIS SHIT IS FUCKING PEAK! THE GREATEST THING IN THE WORLD!

In just 6 days doing it everyday, 2 hours the first 2 days, 3 hours the third, 4 hours the fourth and fifth day and 5 hours the sixth, I HAVE BARELY EVEN BEGAN AND FEEL LIKE IM IN HEAVEN!

ZERO FUCKING THOUGHTS, they barely arise and when they arise, they are simple like drink water and things pertaining to the moment, and other types of thoughts, they are all like PURE WATER

I FEEL CLEAR, ABSOLUTELY CLEAR LIKE WATER

THERE IS NO WAY IN HELL YOU WOULDN'T WANT TO DO THIS!

Today I did 4h 40 min of Savitri and MUSIC WAS LIKE HEAVEN, THOUGHTS? NEARLY NONEXISTENT?

FEAR? NON-EXISTENT

EVEN JOY IS SOFT LIKE WATER, IT DOESN'T OVERWHELM AT ALL! IT CAN ONLY BE CALLED BLISS

EVEN INSIDE PROBLEMS, I AM CLEAR LIKE WATER

Today faced with a decision that would make or break my life? CLEAR LIKE PURE WATER, NOT ONE OUNCE OF FEAR!

If my life was a complete failure from society's perspective? it didn't even enter my mind!

Tell me again about how you don't need to do anything to get realisation? ABSOLUTE BULLSHIT

THE NON DUALITY SUBREDDIT HAS MISLED ME FOR YEARS!

PRANAYAMA IS GODHOOD ITSELF, I FEEL IF I JUST DO A BIT MORE, I WOULDN'T NEED ANYTHING IN LIFE! ANYTHING!

I FEEL LIKE BREATH IS GOD! AND ITS SO ADDICTIVE HOW CALMING IT IS!

IN JUST 6 DAYS! I did 21h 42 minutes in the Prana breath app, not even considering when I remove the app and just breathe!

MY NORMAL BREATH, WHEN NOT DOING ANY MEDITATION HAS COMPLETELY CHANGED! I NOW BREATH SO DEEPLY WITHOUT EFFORT!

BUT WHAT ABOUT ENERGY? DOING BHASTRIKA AND TUMMO GAVE ME MORE ENERGY THAN I EVER GOT WITH COFFEE OR ADDERAL WHILE IN COMPLETE CONTROL!

I FEEL SO NATURAL, LIKE THIS IS THE NORMAL STATE, ALL THE PREVIOUS FEARS AND HATRED WAS JUST BECAUSE MY BODY AND NERVOUS SYSTEM WERE WIRED WRONGLY!

THIS THING SHOULD BE TAUGHT IN SCHOOL! EVERY SINGLE HUMAN BEING SHOULD DO THIS!

I SWEAR TO YOU IF YOU JUST DO A LOT AND PERSEVERE, YOUR EFFORTS WILL BE PAID A MILLIONFOLD!

DO PRANAYAMA! LIKE RIGHT FUCKING NOW!

I CAN ONLY IMAGINE WHAT ONE MONTH IN WILL FEEL LIKE!",0,1752865323.0,awakened,18,0.43,False
1m3ax6w,https://www.reddit.com/r/Wawa/comments/1m3ax6w/go_to_orders/,Go To Orders,"Drop your go to foods/orders below! I typically get an iced coffee whether it’s some kind of caramel or mint and add in any of the caramel syrups, mint, or chocolate syrups. Sometimes vanilla coffee and syrup if I wanted vanilla. I’m looking for new combos/drink suggestions to try. For lunch/dinner foods, I typically get a tuna hoagie (just tuna and mayo since I’m low key picky lmao), a hot dog, mac n cheese, or a cheese quesadilla. If I get my breakfast there, it’s either a sweet cheese croissant or a pork roll egg and cheese bagel. Open to suggestions on what to try next! ",4,1752865310.0,Wawa,5,1.0,False
1m3auln,https://www.reddit.com/gallery/1m3auln,Williamsburg 1BD/1BA Apartment Move-In Aug 1st,"Looking to sublet my beautiful apartment on Kent Ave in Williamsburg starting August 1st. Rent is $4,999/month.

Lease goes until November 2025, at which you have the option to sign a new 12-month lease.

This is one of the premier waterfront buildings in Brooklyn, with awesome views, plenty of amenities, and a super safe and friendly neighborhood right outside your door.

Apartment Details:
•	1 bedroom, 1 bathroom
•	Modern open kitchen with high-end appliances
•	In-unit washer/dryer
•	Floor-to-ceiling windows with great views
•	Central A/C and heat
•	Tons of natural light

Building Amenities:
•	Full-time doorman and concierge
•	Rooftop terraces with panoramic city views
•	Fitness center with yoga room
•	Lounge and co-working spaces
•	Game room
•	Outdoor pool
•	Parking available
•	Pet-friendly

Close By:
•	5-minute walk to the South Williamsburg Ferry
•	10 minutes to the JMZ train
•	Easy access to Domino Park, bars, coffee shops, and restaurants

This is an ideal spot for someone who wants luxury, convenience, and a true NYC experience right by the water.

DM me for more info, videos, or to schedule a showing. Serious inquiries only.",1,1752865149.0,NYCapartments,0,1.0,False
