id,url,title,text,score,created_utc,subreddit,num_comments,upvote_ratio,over_18
1g734x6,https://www.reddit.com/r/datingadviceformen/comments/1g734x6/what_to_text_a_girl_who_is_ignoring_you/,What To Text A Girl Who Is Ignoring You,"In this guide I'm going to show you some powerful texts you can use if a girl stops responding or is ghosting. Let’s face it attractive girls on dating apps have a LOT of options and it is very likely that at some point in the convo she will leave you on read. This will teach you how to handle these situations correctly, which will significantly increase the odds of her responding and you getting the date

**So what do you if she stops responding?**

You would send her a takeaway text. If you’re not familiar with this, a takeaway is essentially the text version of pulling back (Examples: “Don’t think too hard now” or “If you’re too nervous, id understand”

Takeaways if used correctly are very effective at getting the girl to respond. The main rule is that the takeaway you use, needs to be appropriate for the situation. For instance, if the girl forgets to respond once, you would not want to use a very harsh takeaway, like “Look, if you’re not into this, just lmk so i can stop trying”. Instead you would want to use a mild one.

**3 best takeaways if a girl doesn’t respond**

**1) “Don’t think too hard now”**

This is a mild takeaway that is very good for situations when the girl doesn’t reply to your question. Just wait a day or two to use it.

Here is a real life text exchange i had

Me: What night can you do this week?Girl (doesn't respond)Me: Don't think too hard nowGirl: Lol i forgot to respond, sorry

\*\*You can find more example in the original article, linked below\*\*

**2) “If you’re too nervous, id understand”**

This is a mild to moderate takeaway which is very effective for situations where you’re trying to set up the date and the girl stops responding. It can also make a good tripple text if your first takeaway doesn't work. Here's another real life convo

Me: (sends voice memo)Girl: (doesn't respond)Me: Thinking very hard i seeGirl (Doesnt respond)Me: If you're too nervous id understandGirl: How are youMe: Good are you still interested in meeting up?Girl: I am. Let's go to dinner or coffee. When are you available?

**3) “Are you always this talkative”**

This is the most versatile takeaway on this list. You can use it any time a girl stops responding (provided you waited at least 48 hours). Like the previous one, it playfully challenges the girl. Here's another one of my convos

Me: Hey its alex from the thingGirl (doesn't reply)Me: Are you always this talkativeGirl: haha yes ;)Me: well, thats gonna make our love a bit harderGirl: (sends me a tripple text)

In conclusion, takeaway texts are the best way to get a girl to respond who is ghosting or being flaky. They allow you to be persistent without coming off as needy. 

For more takeaways and more real life examples, check out my original article

[https://firetexts.com/what-to-text-a-girl-who-is-ignoring-you/](https://firetexts.com/what-to-text-a-girl-who-is-ignoring-you/)

",1,1729320516.0,datingadviceformen,2,0.67,False
1g734jr,https://www.reddit.com/r/dating/comments/1g734jr/why_cant_i_end_my_situationship/,why can’t i end my situationship??,"Hi i’m (20f) and i started talking to a guy (21), since july, and we started dating in august. To add context i am a virgin, i have only ever had two first dates that led to nothing, and i have no male friends so you can say my experience with men outside of family members is next to nothing. we met on a dating app earlier this year but i ended up ghosting because i was actively pursuing another guy. i ended up matching with him again, which reassured me that he liked me enough to not be super deterred by the ghosting. from the start i was vocal about wanting to hangout and getting to know each other in person but because i had two jobs/ was dealing with summer classes and he worked nights our schedules just weren’t lining up. we ended up texting for about a month and then meeting for the first time in early august. we met up at a local coffee shop i like and he suggested we walk around the park next to it. we walked and sat on benches in front of the river just talking. we are both extremely introverted so it took us a while to have a steady back and forth. we talked about some taboo first date topics like past relationships, politics, and embarrassing hobbies. overall i felt like he was a good person and i knew i wanted to spend more time with him even if it was just between friends. we ended up having lunch together and wandering for a bit longer. he paid which made it feel even more dateish which was odd considering that i mentioned that nothing was formal and we were just hanging out at the coffee shop. i just accepted it as a kind deed, its not like i dont pay for my friends meals lmao. we drive to my house and he said he would like to go on a second date (again with the D word), and i just kind of assumed he was being polite just because i felt like i didnt give him much to work with. regardless we go on two dates the next following weekends, spending around 10 hrs with eachother both times. the main takeaways are that he continues to pay and do all of the chivalrous things a guy that wants to date you would do, we hold hands/ hug/ cuddle for the first time, he kind of asks me if i have anyone else im interested, in his words “i bet theres boys lining up at your door, no but seriously are there any?”, he tells me that he will miss me. we continue to text everyday but not much because he sleeps during the day. we fall into a pattern of seeing eachother every weekend without fail. i start going over to his and staying over until 4 am ( i know scandalous). the quality time really starts to affect the way i see him, along with the growing physical intimacy. one night we’re in his room looking at his vinyl collection and he pulls out his grandpas ring and says he’s gonna use it whenever he gets married. and idk if im crazy but he  was looking at me especially intensely. i dont want to delude myself into thinking that he was trying to make a romantic gesture out of it, but i still think that was odd. i just kind of brushed it off bc i didnt know what kind of reaction i was supposed to give but he didnt seem put off or anything so i’m really assuming he meant nothing by it. we still dont talk about what we want, exclusivity, status, and i get the feeling that hes trying to sus me out. for example i’m very afraid of dogs and he has his family dog that he lives with rn so i ask innocently, are you planning on adopting in the future when you get your own place? he was really cold about it and i feel like i gave him the impression that i was envisioning living with him. we kind of maintain an awkward distance and we never go past making out and cuddling. the truth is I’m still battling whether or not i want to go further bc of our religious differences. i want to get married but i have to marry within my religion and he’s an atheist. realistically i don’t want to have sex with a man I’m not genuinely considering as a marriage prospect. i know it seems old fashioned but i would prefer to just wait until i find the one. at the same time I’m testing the waters with casual dating, so i guess I’m just being greedy. fastforward to over two months of seeing eachother, he asks me to hangout with his mom and sister when i thought we were just going to go a date. i turn him down a few times and he backs off, we end up hanging out and its fine no mention of meeting his family. the following saturday we make plans to grab lunch, i hop into his car, but when i say hi his sister responds from the back seat!! i had no warning at all, and idk if its bc of my cultural background but this is a huge no-no. we end up all spending the day together, and when i finally catch him alone later that night his only excuse was that it was last minute. my only explanation for this is that me being at his house so often kind of set me up to have to meet them sooner than normal. its all just very weird because of how uncertain we are. i’m not sure how to take it since hes all the sudden saying that he misses me/ wishes i was with him. he said we should go to Ireland together after i said i wanted to go one day, i still dk if he was being serious but i dropped it anyways. he wanted me to come see him after a minor surgery and be his “caretaker”. i feel like we legitimately have gone from 0 to 100. i feel like me meeting his sister made him more attached to me and i’m worried that he’s already expecting me to behave like a girlfriend without any of the security. my family says it shouldn’t matter bc i wanted to see him casually and i can’t really ask him about what we are without setting the tone of seriousness. i just remembered that he came off jealous when i insinuated i had been in many teslas, (i dont drive for context), he kind of assumed it was a guys car but it was just bc i uber a lot. idk if I’m so inexperienced that I’m reading this wrong and i’m absolutely getting played or if i’m being evil by not laying out that i don’t want anything serious. idk how to go about this bc i am invested in him and it would hurt to just end things here for both of us i think, especially without a proper reason. i’m just scared that I’m getting involved with something that i’m not equipped to handle rn. ",3,1729320469.0,dating,4,0.8,False
1g7332z,https://www.reddit.com/r/MakeNewFriendsHere/comments/1g7332z/33m_anywhere_late_night_chats_and_all_that_jazz/,33m anywhere late night chats and all that jazz ,"Not feeling do not tonight. Just feeling bleh. Here's the copy and paste bio: 

I like games and play on Xbox and PlayStation. Space Marine 2 and Destiny and helldivers 2 are my go-to games. I enjoy shooters and action games and the occasional city builder or rts on pc. Lately I've been dabbling in Anno 1800 and I suck. 

I like cooking and so far I haven't gotten sick or made someone else sick so you can say I'm like the Gordon Ramsay of cooking something edible. I do look at recipes in terror and sometimes actually cook them. Looking for cool chatters and maybe we can play games. Or not. Who knows. 

Was a huge reader until the fire nation blessed me with sudden ADD or HD or 8k or whatever. Still have the Dune sequels to read. Big warhammer 40k novel enjoyer too.

I like coffee too.

I also don't mind sharing selfies. Not a creep. I do say stupid things cause I have the humor of a 12 year old. Also dark humor. I'm what they call a goofy goober. So yeah. Hit me up. Ask questions if you want to know anything else. 

https://imgur.com/a/Hb5Fk9k",2,1729320286.0,MakeNewFriendsHere,1,1.0,False
1g732kc,https://www.reddit.com/r/PakistaniSkincare/comments/1g732kc/acne_recovery_isnt_magic_pt_2/,Acne recovery isn't magic: Pt. 2,"Okay so I am back. Let's talk about desi totkay.
For acne sometimes the thing that triggers it is home remedies.
Anything that involves scrubbing is a big no no.
Besan/gramflour masks or packs are okay but aggressively scrubbing it is not.
Scrubs are not recommended during your acne's active phase.
No peel off masks please. I don't recommend them to people with acne or even sensitive skin. It's like kicking a land mine.
Lactose based products for more than an hour.
The milk starts to ferment on your skin triggers your acne even more. Please don't do this.
The mixed creams: fair and lovely, Tibet, archie, golden pearl,sheesha what ever mixed together with a whitening capsule is a bad idea and a nightmare for your skin. It's like straight up Mercury on your face literally. Don't focus on a fair skin focus on a clear skin.
Oils for makeup removal and moisturiser or even cleanser is like giving yourself a chance for those zits. Trust me oils are a red flag.

Overall better home remedies involve neem, aloevera, glycerin, rose water, jaifel/nutmeg, coffee and multani mitti on the face and juices in the body. 
*DETOXIFICATION IS MORE IMPORTANT THAN WHITENING* 
CIAO.

",1,1729320220.0,PakistaniSkincare,0,1.0,False
1g732je,https://www.reddit.com/r/PhR4Friends/comments/1g732je/21_f4a_coffee_study/,21 [F4A] Coffee & Study? ,"Hello! 

I’m looking to study this saturday afternoon. We can grab some coffee and tambay sa coffeeshop, keep each other company. If you’re also studying for exams, arat na! 

About me: 
- currently a student living in QC 

About you: 
- preferably a student too, with preferred age range 20 to 24 
- please be decent! check all the bare minimum boxes, thank you. 

",1,1729320217.0,PhR4Friends,0,1.0,False
1g731zd,https://www.reddit.com/r/h3h3productions/comments/1g731zd/enough_super_long_but_worthy_read_for_anyone/,Enough (super long but worthy read for anyone walking away from h3) ,"I recall the first episode right after October 7th, I recall feeling so many feelings but being excited for the show because I felt Ethan, someone who had criticized the Israeli government in the past would come on and give a supportive word for all who were about to be immersed into the Israel-Palestine issue. After that was not the case, and in fact he went on to highlight his clear cut issue with the hostages, October 7th atrocities Israel says have been committed but (have not been officially investigated nor found true), after he sat there and instead flipped the script on his friend Hasan who literally only tries to educate his audience (going so far as to have numerous debates with individuals who accuse him of the same things Ethan has been accusing him of lately). Even then I was supportive, because I understand where Ethan was coming from. Even after Hasan sat there and tried to have a constructive convo about possible solutions and all Ethan did was circle it back to his feelings based on the community’s actions like that of hasans mods tweeting. Let’s get one thing straight, it is only about Ethan’s feelings. But in that light let’s not forgot he used his platform to call frogan a B word, literally sending swarms of “foot soldiers” to perhaps harass her, a way smaller creator than him, why even pay it mind ? 
While all of that was undoubtedly embarrassing for a grown ass man who makes so much money he has his own studio and pays each of his employees a salary, why pay mind to a miniature jab. Even then I was there because he entertains. As of late, Ethan has not only been aggressively bad faith in his weird obsession with Hasan’s broadcast that he has literally utilized “Hasan hate clips” as evidence to say he generates antisemites by the things he allows and advocates for. I have watched Hasan’s stream and H3 at the same time numerous times and some of the clips Ethan showed I have witnessed them Live, literally every clip was cut to show Hasan in bad faith. Now when it comes to the Houthi ordeal, does Ethan not see how shallow he’s being when he immediately acuses a brown, Yemeni genocide survivor who has most likely learned to aspire to be a Houthi from his resistance to the areas’ occupier. It is the equivalent of anyone generalizing Hila to be a “blood thirsty IOF soldier”, we all know all Israelis must serve, and that not all get deployed so when chatters make that generalization it’s the same as when Ethan acuses this survivor (yes that’s what he is) not a Houthi, as a Houthi, it only shows how he is in agreement with the genocidal campaign. To me at least it shows that the Klein family is somewhat pro genocide. Not once in a whole year did Ethan ask AB or Lena about their feelings on it on air for all to hear and thus it was made to suggest that he did not give a crap about their side (the Arab side) that’s something that is important too, especially when AB’s father has such an important role to play in the legal aspect of those in Michigan with family’s being affected. Not once was AB allowed air time to talk about it given that most of Ethan’s fan base are leftists and perhaps before this year a large chunk of Arab descent since the duo joined the crew. One thing he did was donate money to the Palestinians which oddly he won’t let us forget about… as somewhat of a fall back or something. 
But alas, as of late with Ethan calling for a twitch ban on Hasan is utterly invasive, it’s almost like Ethan wants to silence Hasan, the biggest advocate for a ceasefire, statehood for Jews and Arabs in the areas and as of late of constructive conversations. Overall, I am disappointed in Ethan, he does not fit into the box I set for him like Hasan said, I expected him to be more educated on many topics and he has always failed to be, like that of him being a capitalist lmao like dude you hated working when you were a nobody, and now you’re a capitalist?! Ok. Also his whole spiels on communism, as if there’s a chance anyone in this god damn sphere of the world could ever fathom communism, he just makes bad faith arguments and speaks so confidently when he looks so insane while doing so. I always remember on Leftovers Dan and Hasan constantly trying to educate him and him just being contrarian. Anyway if anyone reads this deep, just know you’re not alone in walking away, I literally see no more benefit in being a member, member streams lack effort, I get it they work all week but why have a person pay money to watch a half ass ep that includes ramblings and no fun segments or convos, and now that I know where Ethan stands I guess I’m done? 
Before I go I’d also like to address his whole spiel on antisemitism, while complaining about hasan he kept bringing up the FBI hate crime report, he means to tell the United States of America that today the biggest minority group to be hate crimed are Jews and not Black people? Or perhaps blacks don’t report their harassments as often as white Jews in America? What was the point of bringing up a report that doesn’t take into consideration that black Americans disproportionately report being hate crimed, I live in Chicago and I have only once witnessed antisemitism while working at a coffee shop and a white supremacist began to ramble antisemitic slurs at everyone because he was mentally unwell living in a halfway house across the street. He means to tell America that Jews have been hate crimed more than any Arab Muslim living in America post 911? He should’ve just turned into the college campuses that are reporting large numbers of Jewish students feeling unsafe from Pro Palestine protests. As if the people who are against genocide residing in the US right now aren’t aware that the state department and all of the political entities are all Pro Genocide in this moment except for 4 individuals: Bernie sanders, Rashida Tlaib, AOC and Ilhan Omar, like be so for real. There is no clearer reason to Ethan’s actions, he wants to come out in full support of Israel no matter what is happening because if he were to stand against genocide it would in his brain and to his family mean that he is against a Jewish state and somehow that Israel should be demolished, in his brain. The avenue he took jumps over the uncomfortable talks he should be having at home about genocide, about resistance and about being ok with a state solution, it shouldn’t focus on antisemitism because for the love of god criticizing ZIONISM is not antisemitism, Zionism if Ethan researched and read like most scholars is the idea of a ONLY Jewish ethno state that suppresses all religions and ethnicities, in the Zionist mind the Arab is “less civilized”, a Zionist does not have to be Jewish, in fact many Christians are zionists for their own sick religious beliefs of Jews being inferior to them. At the end of it all religion always serves the interest of the fascist, please y’all get out of your head spaces and for a second consider that conflating the two terms is dangerous, Jewish people all over the world have been persecuted for being Jewish, I don’t see how Jewish Zionism will help that case in todays genocidal actions that the Israeli government is partaking in. Just two days ago Israel killed the Hamas leader, this doesn’t mean the war is over, there was never a war only destruction to make room for a full reconstruction of the Gaza Strip and perhaps parts of Lebanon to be concessions to Israel. For those who are educated on the history, WWI never ended, WW2 never ended, the Cold War and the establishment of an apartheid regime in the Palestine region have brought us here. At the end of the day I wish for all of you to read more on the matter and get educated, question your friends and family when they immediately get offended that you support Palestine, in their brain you are supporting terrorism because in their brain Islam = terrorism, at the root of it all they are racist, and white will always be safer than brown in their eyes. Don’t allow people to utilize antisemitism as an avenue to justify Israel’s atrocities’, in the violation humanitarian law, international court of justice decisions that suggest Netanyahu needs to be in jail. Don’t allow people to conflate the term Zionist with that of being Jewish. Listen to Hasan as he aims to educate, not glorify Houthi’s, as part of journalism we must be able to be exposed to others’ experiences, and those include those who have been fighting occupation their whole lives, to the point that all they know is bloodshed, like that of Motaz who was on Hasan’s stream recently, if you’re not a Zionist you will go back and watch that and sympathize with Motaz because he is only 25 and he can’t even crack a smile from the internal urge to save his people. At 25 he looks 40 from all that he’s lived. 

It’s sad because I’ve loved H3 for almost 10 years, I understand where they stand and I personally cannot continue to support when they don’t address the elephant in the room, especially when they have 2 Arab employees and Hila is Israeli, it doesn’t kill your base to talk about the issue instead of ignore it for a year, more than 100k have been flattened out in Gaza and Lebanon has been invaded, hilas family lives in Israel but yet ignore until you have something to nitpick from Hasan’s continuous coverage of the issue. Hasan has been a pro Palestine advocate since his early Facebook stream days and TYT but now Ethan has a problem with his coverage. 
I wish the best for all the foot soldiers who are sticking around still, let me know when it’s a fun stream I guess, for now I’m gonna devote my 4 hours to getting educated on the matter, hopefully the genocide can stop and the U.S. can mend a two state solution, we sure have money for it evidenced by the billions of tax dollars being poured into bombs to flatten out baby’s. 

Good bye. ",0,1729320145.0,h3h3productions,39,0.34,False
1g731ti,https://www.reddit.com/r/MakeNewFriendsHere/comments/1g731ti/31m_horrortattooplantcoffeebook_nerd_looking_for/,31M horror/tattoo/plant/coffee/book nerd looking for pals ,Howdy :) 31 male. Bit of an introvert who tends to isolate. Need some friends!! I work in tech. Read a lot. Enjoy horror. Addicted to coffee and tattoos. Owns 1 corgi. Hope to meet some cool people! ,1,1729320127.0,MakeNewFriendsHere,1,1.0,False
1g730p8,https://www.reddit.com/gallery/1g730p8,I am traveling in Japan for a few months and would love to get tips on my profile.,,2,1729319991.0,Tinder,2,0.75,False
1g730gp,https://www.reddit.com/r/espresso/comments/1g730gp/start_with_bambino_baratza_esp_or_jump_right_to/,Start with Bambino + Baratza ESP or jump right to mid tier? ($800),"Newer at home coffee maker. Started with pour over but want to jump down the rabbit hole of espresso. 

My conundrum is do I shell out money for entry level equipment like the Bambino and Baratza knowing I'll probably want to upgrade the experience very soon after getting into it? If I jump into mid tier equipment first then I won't be wasting the money or have to worry about reselling the equipment bought first. 

Lurking in this sub I can tell people are very passionate about expensive equipment and the perfect setup. As a novice in all of this, would entry level equipment suffice or is the experience that much better / noticeable? 

For reference my budget would be around 6 to 8 hundred dollars. Currently have a V60 with Kingrinder K6",1,1729319960.0,espresso,2,1.0,False
1g72zk0,https://www.reddit.com/r/PHR4Rhookups/comments/1g72zk0/27_f4mmm_want_that_dick_inside_me_today/,27 [F4M/MM] want that dick inside me today,"Hi! Been wanting to try FMM for sometime but haven't had the time/energy to go through with it nor found who to do it with. It's my dream for both my nips to be sucked at the same time. Feeling extra horny today.

About me:
- 27, 5 flat, single
- cute face, great boobs. an 8/10 at least
- thicc with some soft curves
- successful in my career field
- likes the princess treatment
- horny, likes to give blowjobs
- clean
- in QC area

About you:
- 20++ and preferably bi
- gentle/soft dom. i like to obey but not humiliation. also into free use.
- slim to chunky (not into fat guys, sorry)
- likes to finger and suck
- gives good aftercare. would really appreciate some nice coffee.
- available today, can host or shoulder ci
- clean
- from QC or can travel

Pls shoot me your tg via dm so we can exchange photos.",5,1729319847.0,PHR4Rhookups,3,0.78,False
1g72z68,https://i.redd.it/i9vi3j5mrnvd1.jpeg,First espresso set up complete (for now),,7,1729319797.0,gaggiaclassic,1,0.89,False
