id,url,title,text,score,created_utc,subreddit,num_comments,upvote_ratio,over_18
1n9n0v5,https://www.reddit.com/r/GPTSportsWriter/comments/1n9n0v5/prediction_andorra_vs_england_20250906/,Prediction: Andorra VS England 2025-09-06,"[Prediction: Andorra VS England 2025-09-06 ](https://preview.redd.it/tsy6l4h97gnf1.jpg?width=1024&format=pjpg&auto=webp&s=3641e91344fe1dca3ab12be97da914c60d6fd94b)

by [https://www.gptsportswriter.com](https://www.gptsportswriter.com) **England vs. Andorra: A World Cup Qualifier Where the Only Drama Is Whether Andorra Will Score First**

Ladies and gentlemen, prepare for a mismatch so stark it could make a Roman Colosseum gladiator blush. On Saturday, England—the footballing titan with the swagger of a cat that’s just knocked over your expensive vase—faces Andorra, a team whose recent form reads like a broken vending machine: you insert hope, you get despair. Let’s unpack this with the statistical rigor of a spreadsheet-obsessed uncle and the humor of a stand-up comedian who’s had one too many coffees.

### Parsing the Odds: England’s Dominance Is Math, Not Opinion

First, the numbers. England has trounced Andorra 26-0 across seven previous meetings, a margin so vast it could qualify as a mercy rule in a less civilized era. Recent form? England has won four of their last five qualifiers, including a 5-0 thrashing of Ireland and a 3-0 dismantling of Latvia. Andorra? They’ve lost four straight qualifiers and drawn 0-0 with Malta, a team that once fielded a goalkeeper who moonlights as a librarian (quiet, please—*shhh*).

The betting lines reflect this gulf. England is favored by -4.25 goals on the spread, meaning bookmakers expect them to win by *at least* five. The over/under is 4.5-4.75 goals, a total that sounds high until you remember England’s last game ended 5-0. If you’re betting, the “Over” here is as safe as leaving your keys in a Tesla’s trunk.

### Digesting the News: England’s Full Strength, Andorra’s… Well, Let’s Just Say They’re “Light on Hype”

England’s squad is fully fit, with Thomas Tuchel set to include Nottingham Forest’s Elliot Anderson. Jack Grealish, meanwhile, remains a spectator, presumably practicing his Everton jersey’s wrinkle-resistant fabric. For Andorra, the “squad” is a polite term for “a group of people who hope to n

To Be Continued...(full article) [https://www.gptsportswriter.com/prediction-detail/prediction-andorra-vs-england-2025-09-06/](https://www.gptsportswriter.com/prediction-detail/prediction-andorra-vs-england-2025-09-06/)",1,1757122478.0,GPTSportsWriter,0,1.0,False
1n9mzxe,https://www.reddit.com/r/CasualPH/comments/1n9mzxe/akala_ko_nawala_na_yung_bagong_phone_na_binili_ko/,Akala ko nawala na ‘yung bagong phone na binili ko na 24 months to pay!,"So here it goes… this story happened back in June this yr lang. Nasira kasi ‘yung phone ko kasi nabasa siya ng tubig ulan and bigla na lang siya nag-o-off after 2-3 minutes so when we went sa mga technicians sabi nila na sakit na raw ‘yun nung model ng phone ko. 


Instead na ipagawa, bumili na lang ako ng bago and yung latest model pa. 128gb lang rin kasi mahal na yung 256 eh HAHAHA and entry level lang din naman work ko kaya i don’t think i can afford it that much yet 😂 so ito na ang exciting part… lol so pauwi kasi ako nun on a friday and nasa Buendia na ako. I remember when I bought my phone may sinabi yung babae sakin na “takaw tingin” and prone to theft itong phone kasi nga latest ganon. So what I did is nilagay ko siya sa bag ko. 


Pagkasakay ko ng bus, wala pa masyado pasahero at the time, I tried to reach for it pero wala???!!!! and i was like, what???? nanakaw ba?!!! eh kabibili ko lang nun. so i what i did is bumaba ako ng bus and went to the nearest police station to file a report kasi nga parang may insurance ‘to na they’ll replace it bsta mag file ng police report proving na nanakaw nga. So, pumunta ako sa police post sa may Buendia and dun inassist ako nung pulis. Lol nawalan na nga ako ng courtesy at the time kasi imbes na “Sir” ay  “Kuya” ang tawag ko sa kanya and he was literally calming me down the whole time and naalala ko na i spilled ‘yung coffee dun sa table niya pero sobrang calm pa rin ni sir kahit ngarag na ngarag na ko 😭 


Dinouble check ko ‘yung bag ko and inalis ko ‘yung mga damit ko na iuuwi ko and ayun… nag camouflage lang sya sa bag ko kasi bare pa lang siya at the time (no case ganyan) and ayun bumalik ako sa bus and curious bigla sina mamang driver if ano nangyari and ayun sa likod na ako nakaupo kasi pununan na nung bumalik ako. 

",1,1757122397.0,CasualPH,0,1.0,False
1n9mzgm,https://www.reddit.com/r/ThailandTourism/comments/1n9mzgm/drink_a_coffee_and_go_shopping/,drink a coffee and go shopping?,"arriving in bangkok today and staying one week. anyone wanna drink a coffee and go shopping or just a coffee? please be 18-24 and just a warning for shopping, i will look at everything that is cute in any way!
male, 19, bi, from germany.
if youre interested please add me on discord: qtyuri.
(dot is in the name)",0,1757122357.0,ThailandTourism,2,0.29,False
1n9mxul,https://www.reddit.com/gallery/1n9mxul,It's all a matter of perspective,"
used to use my small spare bedroom in my apartment as a games room. I had a 68cm CRT , one of those ten space IKEA cube things, an 8 way switcher and a whole bunch of consoles connected. Whatever I felt in the mood for playing it was just a button press away. Was a pretty good setup.

Then I decided that was a lot of space for something I wasn't doing a lot of. So I turned that space into an office/workshop. Whenever I felt in the mood I'd just play on my LCD TV. It's ok for N64. And fine for GameCube onwards. And my Atari 2600 is passable, maybe because of the basic graphics and the fact no one was trying to massage extra effects from CRT anti aliasing etc.

The really weak spot is my mega drive (and maybe SNES and Jaguar, haven't played them for a while). I guess that era was the height of using the CRTs limitations to create effects. It just looks much better on a CRT.

But there isn't a lot of room in my living room for a dedicated spot for a large CRT. I have an upright arcade machine in the corner and a cocktail cab as a coffee table. I still have a stack of CRTs in my garage. It occurred to me that proportion and perspective is everything. Why not put a 34cm CRT on the cocktail cab/coffee table? The results are really good. The screen's apparent size is not much smaller than the much larger LCD further away, and it takes seconds to unplug it and put it in a cupboard. It's also quite a comfy playing position. In fact more comfy than the old games room as the 68cm always felt a tad high on the IKEA cube thing.  I'm a very happy chappy 😊

I still suggest to people who want to get into retro games that if all they have is an LCD with AV inputs, then that's still a start and not to go nuts and overspend on a CRT that someone down the track would probably have given them for free. I look it like record collecting - if your mega drive is the actual record, then an LCD TV is a cheap turntable with built in speakers. Play it that way for a while, then when you can you upgrade your equipment. And enjoy the same games all over again due to the increase in quality playback. The difference is that it almost always costs more to upgrade your stereo, but you can often upgrade your retro gaming experience with a CRT (if you're patient) for peanuts/free. ",11,1757122224.0,SEGAGENESIS,3,0.87,False
1n9mwrq,https://www.reddit.com/r/GPTAppsEngine/comments/1n9mwrq/from_mouse_clicks_to_digital_miracles_witnessing/,From Mouse Clicks to Digital Miracles: Witnessing the Mind-Blowing Rise of No Code Automation! 🚀,"I can’t stop thinking about the revolution that’s quietly happening right before our eyes with no code automation. 🚀 Honestly, it feels like we’re living through the PC boom of the 80s or the social web explosion of the 2000s—but this time, anyone with a mouse and an internet connection can build their own digital “robots.”

Let’s talk about what’s making me smile from ear to ear lately:

- It’s easier than ever to connect apps, files, and data in minutes.  
- You can automate the most mind-numbing tasks—emails, file sorting, even generating reports—without writing a single line of code.  
- Tools like Zapier, Make (integromat), Pipedream, n8n, and, of course, GPT-based workflow builders are *super* accessible.  

What once required a request to IT and weeks of waiting, now takes a morning, a YouTube video, and a cup of good coffee. ☕

But the most exciting part? The *vibes.*  

People who never saw themselves as “techy” are suddenly building automations to run businesses, streamline personal projects, or just make life easier. Small teams are punching *way* above their weight doing things that used to be exclusive to Fortune 500 companies. I’ve talked to teachers automating class reminders, creators running sophisticated content calendars, and students streamlining research—all without any CS background.

A few things I’m amazed by lately:

- The way no code bridges the gap between ideas and execution. Have an “I wish I could just…” moment? There’s probably a no code way to make it happen.
- The sheer number of integrations popping up. Your accounting app talks to your project manager, which pings your custom Slack bot—like, WHAT?
- How it’s turning “non-technical” people into problem solvers and mini-entrepreneurs.

Of course, it’s not *all* sunshine. Sometimes automations break and you need to troubleshoot mystery bugs (that “Why did Step 3 run twice?!” moment). And scaling up big workflows takes some planning! But on balance, the excitement totally overshadows the bumps.

So, what are you automating with no code right now that makes you want to high-five someone? Have you experienced that “I can’t believe I just built this myself!” feeling yet?

Drop your favorite no code tools or workflows below—let’s spread the excitement! 🙌

And if you’re just jumping into no code, welcome to the happiest rabbit hole you’ll ever fall down.",1,1757122136.0,GPTAppsEngine,0,1.0,False
1n9mwkr,https://www.reddit.com/r/pourover/comments/1n9mwkr/espresso_machine_recommendation/,Espresso machine recommendation,Hi everyone! I’m getting into the coffee hobby and I’ve already done some courses to learn about tasting and handling espresso machines. Now I’m planning to buy my first machine but I’m still undecided. The one that’s catching my eye on Amazon Spain for the price is the Breville with the Breville grinder. What do you think? Can you recommend any good machines under €400? ,0,1757122120.0,pourover,5,0.5,False
1n9mw7h,https://i.redd.it/5u6kzfn36gnf1.jpeg,Moments Of Magic,"✨✨
There's a subtle but powerful magic that exists all around us, often hidden in plain sight. It's the kind that makes your heart feel a little lighter, your mind a little clearer, and the world a little brighter. These are the moments of magic, and they're waiting for you to notice them.

We're so often consumed by our busy lives, focused on the next deadline, the next task, the next notification. We race through our days, ticking boxes and chasing goals, and in the process, we forget to pause. It's in these pauses that the magic reveals itself.

Maybe it’s the way the light filters through the leaves of a tree in the late afternoon, casting dancing shadows on the ground. Maybe it's the perfect song coming on the radio just as you're lost in thought. Or maybe it's the unexpected kindness of a stranger, a simple smile that reminds you of our shared humanity.

These moments don't require grand gestures or special occasions. They’re woven into the fabric of our everyday lives, quiet and unassuming. A child's uninhibited laughter, the first sip of coffee on a chilly morning, the smell of rain after a long dry spell. Each of these is a tiny, perfect gift.

So how do we invite more of this magic into our lives? It starts with presence. Put your phone away for a few minutes. Take a deep breath. Look up. Really look. Notice the details you usually rush past. What do you see? What do you hear? What do you feel?

The more you practice being present, the more attuned you become to these small wonders. It’s like a muscle you can strengthen. And as you do, you’ll find that the moments of magic aren't just moments anymore. They become a way of seeing the world—a lens through which you experience the beauty and wonder that has been there all along.

Start your own collection of these moments. Write them down in a journal, take a picture, or simply hold them in your heart. You'll soon discover that your life is not a series of tasks to be completed, but a series of magical moments waiting to be discovered.",1,1757122087.0,momentsofmagic,0,1.0,False
1n9mvjn,https://i.redd.it/tlf7brpx5gnf1.jpeg,09/05/25 Aldi: Barissimo Cold Foam,"If I were promoting a product, I would spell the brand name properly. 🫠

⚠️ Image originally posted on a monetized (paid) public page on a social media platform ",3,1757122032.0,kyleagomezsnarkagain,1,1.0,False
1n9mv56,https://www.reddit.com/r/digitalminimalism/comments/1n9mv56/never_thought_id_say_this/,Never thought I'd say this...,"Never thought I'd say this, but my Friday looked like taking notes on a typewriter, making new friends at a coffee shop, chilling out to Star Wars music from my iPod Classic while driving to Goodwill to find a movie dvd to watch tonight. I just finished watching Pirates of the Caribbean that I bought for $2. The nostalgia is unreal, haha.",16,1757122000.0,digitalminimalism,1,1.0,False
1n9muyx,https://www.reddit.com/r/r4r/comments/1n9muyx/31_f4m_losangeles_online_the_motorcycle_the/,"31 [F4M] #LosAngeles / #Online — The motorcycle, the overlook, and the romance that changes everything","I want us to deeply and passionately kiss underneath the neon lights of Los Angeles. I want us to feel that magnetic and emotional pull — like the minute we lock eyes, the world becomes outside noise. 

I’m 31, 5’4, Japanese-American, HWP (height weight proportionate), with long dark brown hair and bangs, and dark brown almond-shaped eyes. I’m very in touch with my feminine side. I’m based in Los Angeles and work as an instructional assistant at an elementary school while pursuing my Early Childhood Education Units, building a meaningful career in education. 

A bit about me: I take care of myself and often get mistaken for being in my twenties (not going to lie, it’s fun). I love coastal drives, bookstores, traveling, writing (currently working on a horror-romance novel), and losing myself in synthwave — right now, Chromance by Kalax is on repeat. My favorite 2000s film is The Girl Next Door. I don’t smoke or use drugs, and I drink minimally. 

I love good morning texts, consistency, honesty, and emotional depth. I want the kind of romance where you pick me up at my door with flowers, and as the night ends, you’re already asking, “So, when can I see you again?” No guessing games. No one left wondering or waiting. 

I want a romance that makes my heart race at 100 miles per hour, where we laugh endlessly, trust and respect each other fully, and I wipe the lipstick off your lips after every kiss. I want to feel the spark, fire, and passion — as well as the stability and calmness that comes from knowing we’re truly right for each other. I want a romance that burns so bright all because it feels so right. 

I want us to feel like we’re 21 again — full of excitement and possibility — yet with the emotional stability of adults who know who they are. I’m looking for someone who isn’t just a fantasy, but feels like my best friend and someone I’ve known my whole life. Tattoos and leather jackets are a bonus; I have three tattoos myself. Together, we could be like James Dean and Audrey Hepburn — timeless, magnetic, unforgettable. 

I’m looking for a man who is in touch with his masculine side but is highly emotionally intelligent and respectful. I like a guy with a bit of a bad boy edge — tattoos, leather jackets, maybe a motorcycle — but who is still a respectful, grounded, and decent man at heart. Someone who always follows through with what he says, has his own life, passions, and goals, and takes care of himself physically and emotionally. Between 30–40, tall, stable, obviously single, and carrying a dark, intriguing edge. You don’t smoke (weed, cigarettes, vaping, etc.) or use drugs. You treat wait staff with the same kindness and respect you’d show anyone else. Monogamy only. Tattoos, cars and/or motorcycles, leather jackets, and basic common sense and literacy are a HUGE bonus! 

And please: send intentional, thoughtful messages. Not “hey,” “what’s up,” or “m 38. Got a pic?” Effort matters. I want a man who texts and talks like a GROWN MAN. 

Picture us: riding off into the sunset on your motorcycle, laughing while we run errands together like it’s our own private inside joke, or sitting quietly at an overlook watching the city lights below — knowing we’re exactly where we belong. And maybe later that night, we’re back under the neon glow of Los Angeles, kissing like the whole world has disappeared. Beyond that, we’ll explore LA together — from hidden coffee shops to city lights and coastal adventures — making memories in every corner of this city. (For now, I don’t have a motorcycle or a car, but I’m planning to get one in the next 2–3 months — so you just might be my favorite driver until then.) 

Note: I’d prefer if you were in Los Angeles or Orange County — but if you’re in the US or Canada, you’re still welcome to try. If you’re in another country, it might be difficult to make this work. If you feel that spark reading this, send me a thoughtful message — and yes, include a photo. Chemistry matters, and I want to know if we’ll light up the screen together.",0,1757121988.0,r4r,1,0.5,False
1n9mujo,https://www.reddit.com/gallery/1n9mujo,It's all a matter of perspective,"
I used to use my small spare bedroom in my apartment as a games room. I had a 68cm CRT , one of those ten space IKEA cube things, an 8 way switcher and a whole bunch of consoles connected. Whatever I felt in the mood for playing it was just a button press away. Was a pretty good setup.

Then I decided that was a lot of space for something I wasn't doing a lot of. So I turned that space into an office/workshop. Whenever I felt in the mood I'd just play on my LCD TV. It's ok for N64. And fine for GameCube onwards. And my Atari 2600 is passable, maybe because of the basic graphics and the fact no one was trying to massage extra effects from CRT anti aliasing etc.

The really weak spot is my mega drive (and maybe SNES and Jaguar, haven't played them for a while). I guess that era was the height of using the CRTs limitations to create effects. It just looks much better on a CRT.

But there isn't a lot of room in my living room for a dedicated spot for a large CRT. I have an upright arcade machine in the corner and a cocktail cab as a coffee table. I still have a stack of CRTs in my garage. It occurred to me that proportion and perspective is everything. Why not put a 34cm CRT on the cocktail cab/coffee table? The results are really good. The screen's apparent size is not much smaller than the much larger LCD further away, and it takes seconds to unplug it and put it in a cupboard. It's also quite a comfy playing position. In fact more comfy than the old games room as the 68cm always felt a tad high on the IKEA cube thing.  I'm a very happy chappy 😊

I still suggest to people who want to get into retro games that if all they have is an LCD with AV inputs, then that's still a start and not to go nuts and overspend on a CRT that someone down the track would probably have given them for free. I look it like record collecting - if your mega drive is the actual record, then an LCD TV is a cheap turntable with built in speakers. Play it that way for a while, then when you can you upgrade your equipment. And enjoy the same games all over again due to the increase in quality playback. The difference is that it almost always costs more to upgrade your stereo, but you can often upgrade your retro gaming experience with a CRT (if you're patient) for peanuts/free. ",48,1757121953.0,crtgaming,2,1.0,False
1n9mtwb,https://www.reddit.com/r/autism/comments/1n9mtwb/going_on_a_diet_thats_kinda_extreme/,Going on a diet that’s kinda extreme,"I was diagnosed with pre-pre diabetes, basically high cholesterol but not pre diabetic and I’m freaking out. Both my mom, dad and grandma has diabetes. I’ve lost a lot of weight, I started looking weight when I was 17 and I was at 250 now I’m at 190. I recently was floating around 180 but I think since I’m working at a restaurant and getting free food and reduced benefits I’ve been eating there like three days a week it’s making me fat. I’ve mostly been getting their salads?! And I get coffee every Thursday as a treat? It’s always decaf and when I remember sugar free as they can make it.. And now I’ve been diagnosed with high cholesterol?! I love eating junk food and sweets. Even though I try not to. I have limited myself to 25 grams of sugar or around that area and I forget to track my food and calories. Now it feels like I can’t eat that at all. It feels like I can’t eat any sugary sweet that I crave and that is also my safe comfort food. If I do I get scared I will make myself sick and possibly die or get even more overweight. My mom isn’t taking this as seriously as I am and it feels crazy since she is diabetic herself. I don’t know where to start but I’m trying to research what foods I can eat and we do have most of them. I’m trying to go on the Mediterranean diet but only until my levels are healthy. I’ve always struggled with sticking to edits since everything I love tastes good.",2,1757121894.0,autism,3,1.0,False
1n9msvt,https://www.reddit.com/gallery/1n9msvt,The apple saga continues with… apple kvass! Enjoyed with homemade rye crackers. Cheers to the weekend!,"I'm sure I've never said this right and I feel like a fraud trying to. But that doesn't stop me from enjoying it.

Kvass is a fermented drink. The real, real version is rye bread fermented in water with raisins added for their surface yeast. This is an apple version 😁🍎.

Just as a quick note, Kvass is NOT a lacto-ferment, it's a yeast ferment. Lacto-fermentation you do for pickles, peppers and vegetables that uses a high salt solution to discourage undesirable bacteria. I think the confusion between these fermentations is why many recipes add salt to kvass recipes. No salt is required ⛔🧂. As yeast grow (not lactobacilli!), they crowd out the unwanted organisms 🔐. You help them with this by regularly agitating/shaking the container which I suppose disrupts the structure the undesirable organisms create when they proliferate 🫨.

There are two components/ferments to making the kvass. 

1️⃣ The first ferment gets the yeast growing and producing their flavours 🌱. There will be a bit of alcohol produced during this time, but not much. For ferment 1 you need water 🌊, sugar 🍬 and yeast 🍞. The yeast will come from some sort of fruit skin 🍎. My hand picked apples have enough surface yeast, but if you’re using store bought, they might not have yeast left so you may have to add raisins 🍇 or dates which are frequently used for this purpose. You can also add a pinch of baker’s yeast. Sit this in a warm spot for 5-7 days with a breathable top like a coffee filter and shake it once every single day (definitely briefly swap it to an impermeable lid when shaking). That's it for the first ferment. Over the 5-7 days, yeast will form which you will smell 👃.

When this first ferment is complete is a matter of preference, depending on how yeasty you want the taste 🤔. For the first time, if you can smell the yeast after 5 days, maybe that's enough.

2️⃣ The second ferment carbonates 🫧. The same yeast will take care of this, but you need to put an impermeable lid on the container. The best way to do this is to filter out everything but the water and transfer the water to a plastic bottle 🍼. Drop a couple raisins in for a little extra, extra yeast. With plastic, you can squeeze the container and then put the lid on. This will leave some room for the container to expand instead of exploding if you don't burp it ⛔💥. Once the container expands back to full size, take the lid off and squeeze the container back for one more cycle. This ‘burping’ is just so the container doesn't explode. 

After two of those cycles, your kvass will be both fermented and carbonated 😋🫧 and ready to drink!

That was a long one ⌛but I think if you've got the time, introducing yourself to fermentation is a great way to spend 10 minutes. Well I hope you have a fantastic day full of bubbles and joy. Thanks for stopping in! 🫵#️⃣1️⃣

Will post the recipe soon.
",4,1757121810.0,culinarybytes,0,1.0,False
1n9msdr,https://i.redd.it/5ma3n6h55gnf1.jpeg,"Garbage in, garbage out","You might find this one amusing,

Grok gave the right answer but chatgpt was trying to be clever. Notice it offering its own analogy that when a coffee table is not a table it's coffee, lol",1,1757121769.0,ChatGPT,2,1.0,False
1n9mrcp,https://i.redd.it/mujm8vcw4gnf1.jpeg,D 2.0 on,Are we not expecting a collab?!? They just hung out and her she is pushing their coffee…,2,1757121685.0,DanielleEilersSnark,1,1.0,False
