id,url,title,text,score,created_utc,subreddit,num_comments,upvote_ratio,over_18
1jc03my,https://www.reddit.com/r/ReligiousTrauma/comments/1jc03my/anyone_else_have_evangelical_trauma/,Anyone else have evangelical trauma?,"I (24f) grew up evangelical and I often feel like people don’t understand how it was traumatic. My church had a little store and even a coffee shop at one point. Most people were “nice”. However, being constantly told that I was born evil, that God knows all of my thoughts all the time, that me being a lesbian is a sin, that all my friends and family outside of the church are going to hell, and having all of my music and media consumption heavily controlled was very traumatizing for me and now I have a BPD diagnosis and am very triggered whenever I feel like I’m being controlled at all. It was extremely harmful for me to grow up that way. ",10,1742059154.0,ReligiousTrauma,3,1.0,False
1jc02sb,https://v.redd.it/zt2t7wz10woe1,Convenient discovery - Book stands make for optimal viewing on shorter surfaces.,"Using my fourteen inch set on the coffee table whilst sitting on the sofa & realized the viewing angle wasn't quite optimal.
After a bright idea & quick trip to my bookshelves, I've found a hefty book stand designed for large & heavy books doubles for a fantastic CRT stand if you need your set propped up.

The stand's surface features a raised lip at the bottom intended to simplify the act of reading heavy or large books, holding them in place & making the act of turning pages the reader's only task - this lip is being used to safely ensure the television remains in place while resting at an inclined angle, keeping the back of the set secure from sliding down and off of the stand. The screen itself now rests at the top of the stand where a book's top edge would naturally lie; it's an unintentionally perfect product for smaller sets atop shorter surfaces.


Set - Toshiba 14AF44
Game - Jak & Daxter: The Precursor Legacy",2,1742059093.0,crtgaming,0,1.0,False
1jc02bj,https://www.reddit.com/gallery/1jc02bj,Coffee cup falls to the floor,,21,1742059062.0,garfieldminusgarfield,1,1.0,False
1jc0151,https://www.reddit.com/r/CandyMakers/comments/1jc0151/exotic_marshmallow_flavors/,Exotic Marshmallow Flavors,I've been using the King Arthur recipe for homemade marshmallows and adore it. I've done a pretty good job with coffee and matcha flavors but want to start to try more exotic flavors. I've liked some of the great syrup flavors on the market made for coffee or mixed drinks. Any ideas on how to work those into the marshmallow recipe?,2,1742058976.0,CandyMakers,2,1.0,False
1jc011g,https://www.reddit.com/r/chimeboost/comments/1jc011g/bfb_i_have_3_left_coffeedoughnut01_ill_boost_back/,BFB I have 3 left $Coffee-Doughnut01 I’ll boost back asap,,2,1742058969.0,chimeboost,5,1.0,False
1jc00jf,https://i.redd.it/1lpzkpylzvoe1.jpeg,So true.,,6,1742058933.0,TheRealFriendsOver40,2,1.0,False
1jc009c,https://www.reddit.com/r/dating/comments/1jc009c/looking_for_some_second_date_advice/,Looking for some second date advice,"So I (20M) been talking to this girl (20F) for a week or so, and things have been going well. We met up for coffee for our first date, it was a really great time, and she suggested we should meet up again and get supper. We made plans for next Friday, and I had some questions before then. 

1. Should I offer to pick her up? It’s still pretty early on so I don’t want to make her uncomfortable by asking. 

2. We didn’t really have any physical contact after the first date. I do regret this and want to make sure I change it next time around should I try and kiss her at the end of the date, or should I just go for a hug. Obviously this is assuming it goes well, if I do end up picking her up holding hands is probably on the table as well. 

3. Should I plan something after supper as well, like getting a coffee? This would work a lot better if we drove there together, I’d imagine driving separately to different place wouldn’t be as good. 

Thanks!",2,1742058914.0,dating,13,1.0,False
1jc0029,https://i.redd.it/bvn067shzvoe1.jpeg,ordered an ice cappuccino and they forgot to put the coffee in it 👍👍👍👍👍👍,,19,1742058901.0,DunkinDonuts,14,0.91,False
1jbzzaz,https://i.redd.it/bo01mthazvoe1.jpeg,$5 local breakfast option,"$5 breakfast sammie and coffee from a local company in Mayfair mall. There's a location in Hillside too, can't confirm if this deal is there too. fk McDonald's. ",87,1742058844.0,VictoriaBC,15,0.95,False
1jbzz1g,https://i.redd.it/v6orn54azvoe1.jpeg,worst iced coffee,shittiest iced coffee experience dont go to tea toast co if u dont wanna waste money  ,5,1742058825.0,Sangli,0,1.0,False
1jbzyfm,https://www.reddit.com/gallery/1jbzyfm,Let’s close some sets!,Play MONOPOLY GO! with me! Download it here: https://mply.io/yWeOcalOJG4,1,1742058781.0,MonopolyGoTrading,0,1.0,False
1jbzy3p,https://www.reddit.com/r/RelationshipsOver35/comments/1jbzy3p/please_offer_insiht_on_dynamic_between_me_42f_and/,"Please offer insiht on dynamic between me (42F) and on-again, off-again partner (52M)","I hope you can help me shed light on the relationship dynamic I (42F) share with my on-again, off-again partner (52M).

We’ve been romantically in each other’s life for almost 8 years, the first few as a couple, then on-and-off again (as I broke up with him a couple of times… I will come back to that). We never stopped seeing each other regularly – at his place, my place, for dinner, a concert, a stand up, coffee, gaming, watching tv and hugging on the sofa... He’s always there for me if I need help painting my place, assembling furniture - you name it. He is simply there if I need him.

I’ve finally recognized that me, myself and I am to blame for most of the problems in this relationship and that I’ve treated and judged him unfairly. I recognize now that he’s an amazing, caring, loving person, but he does not see me as a relationship material any more because (quotes assambled from conversations):

>I like spending time with you, you’re a nice person. I like you more than a friend but less than relationship material. I can’t tell you if this can change. If you push too hard, I’ll just pull in the other direction. Can we just spend nice time together and do nice things and see how things go? Just relax, be yourself, stop living in the past.

I know now that he finds me unreliable as I broke up with him multiple times just to try and come back together, causing him much pain, but also because I would be loving and sweet one day and unpleasant the next (my explanation, not excuse, to this is that I felt like he was expecting 100% of me while not offering 100% back, which caused mutual cycle of pullback and me feeling very insecure and I didn’t deal with my own insecurities in the right way).

Sex is off the table by his decision: he says that it complicates things between us because I assume we’re more committed than he’d like to be “unilaterally” and he doesn’t want to “complicate things”. And I’d love for him to … my brains out. So I do not believe he keeps me just for sex, since sex aint there…

There’s obviously much mor to the dynamic, but how do I condense 8 years into a post you’d be willing to read?

My request is: I see where I went wrong. I appreciate him as a person more than ever and I would really like for us to again have a deeper relationship than we share now. My heart is telling me: there’s still something, I see it in the way he treats me, I see it in the fact that he keeps on inviting that unpleasant person to his place (and he's very protective of his personal space), I see it sometimes as a glimpse when we have a nice time – and he has other close friends he can spend nice time with. Everyone who I confide in tells me to “stop chasing someone who is not into me” and to leave this dynamic to protect my mental well being, but my heart tells me to give it a go. To follow his own advice: relax, be myself, stop pushing, enjoy nice things, forget about the past and just see how things go.

I’d love your perspective on what am I even dealing with, to best of your ability. Because I’m not sure if I am interpreting the signs correctly.

Do you have any advice for me?

Have you ever been in a situation like this, on a receiving end? What happened? What do you wish happened?

Any insight welcome.",2,1742058757.0,RelationshipsOver35,6,1.0,False
1jbzxzz,https://i.redd.it/5wuqq692zvoe1.jpeg,My coffee order serves the beam...,,46,1742058751.0,darktower,3,0.9,False
1jbzxvc,https://www.reddit.com/r/insomnia/comments/1jbzxvc/what_do_i_do/,What do I do?,"Up for around 30 hours now and I can’t go to sleep, I drank a coffee and had diet soda yesterday and I think it messed me all up. 

I close my eyes and nothing happens and anxiety rises a little due to lack of sleep. 

I’m relatively calm but if this goes on for longer no lie might start getting a panic attack. 

How bad is 30 hours? I feel like that’s an insane time to be awake. ",1,1742058740.0,insomnia,1,1.0,False
1jbzxuk,https://www.reddit.com/r/Market76/comments/1jbzxuk/h_enclave_mods_w_leaders_or_non_cap_offers/,H: Enclave Mods W: leaders or non cap offers,"Aligned Auto x2
Bruising Grip x2
Calibrated Capacitor x6 
Comfort Stock
Forceful Stock x2
Precise Stock x2
Reflex Sight
Stabilized Stock
Also have a Tradeable Vampires/Rapid/Vats Op (v2525) Enclave Plasma Flamer with all the right mods. aligned flamer, forceful stock, reflex and severe beta wave tuner

Open to offers but preferably leaders or BOS Jumpsuit. I'm maxed on caps so I can't take caps at the moment. Coffee, Nuka darks, btats, mags, other bobbleheads. Shoot me some offers. ",1,1742058739.0,Market76,10,1.0,False
1jbzwtk,https://www.reddit.com/r/pourover/comments/1jbzwtk/clever_cup_size_and_fav_recipies/,Clever cup size and fav recipies ?,"What's your perfect clever cup size ? As well fav recipies ? If you have one .

Got a clever last week and love it ! I've been brewing 425 grams of water and 30 to 32 grams of coffee.  It's been tasty ! 

However this morning I didn't want a full coffee cup . Found a recipie for 300 grams and 20 grams of coffee.   It was supper tasty ! 

So my question is do you find better tasting cups with smaller more traditional size of cups of coffee.  In the clever ? 

Any thoughts would be great.  ",1,1742058664.0,pourover,0,1.0,False
1jbzwip,https://www.reddit.com/gallery/1jbzwip,1:1 3⭐️trades,(Not looking to trade weird woods today) ,1,1742058643.0,monopolygo_fairtrade,6,1.0,False
1jbzutw,https://www.reddit.com/r/PhR4Friends/comments/1jbzutw/27_m4f_coffee_tomorrow/,27 [M4F] Coffee tomorrow?,"Tara coffee tomorrow? Around Cavite area and pwede naman dumayo ng Manila.
Gusto ko lang kakwentuhan while drinking coffee sa rest day ko. Wala kasi akong mayaya sa circle ko tom e",2,1742058522.0,PhR4Friends,0,1.0,False
1jbzurw,https://www.reddit.com/r/UnfuckYourHabitat/comments/1jbzurw/need_a_pep_talk_in_the_thick_of_it/,Need a pep talk. In the thick of it.,"We are moving from our house of 20 years. We are in the process of Unfucking, decluttering, cleaning, etc. I’m burnt the fuck out. I’m sick of stuff everywhere. Almost every closet has vomited all over. Every room you can barely walk in because of boxes. 

I drank coffee from a soup bowl yesterday because someone packed all but 2 coffee mugs and they were both dirty. 

I wish I could just start over. 

I was giving my kid a pep talk as we worked in his room today and I kept saying decluttering and cleaning is a muscle. Today we are building our muscles. Yesterday I spent 4 hours sorting Pokémon cards.  I fucking hate Pokémon. 





",15,1742058517.0,UnfuckYourHabitat,3,1.0,False
1jbztj7,https://www.reddit.com/r/italianlearning/comments/1jbztj7/subject_placement_with_piacere/,Subject placement with “piacere”,"I keep running into confusion on where to place the subject for piacere. Like, right now, I'm using Natulang and it has given me these two sentences:
""Mi piace molto il bar.""  (""I like the coffee shop a lot."")
""Lei mi piace troppo."" (""I like her too much."")

The first one I'm very used to - piacere is a weird verb where the subject ""il bar"" comes at the end. A reversal of a usual subject-verb structure, but ok. 

But then sometimes the subject comes first, as in the second sentence.  

I thought maybe it was just a pronoun thing, but when I put ""I like Anna a lot"" into DeepL, it gives me ""Anna mi piace molto.""

What's the logic?  When does the subject come before piacere and When does it come after?
",1,1742058425.0,italianlearning,4,1.0,False
1jbzs1m,https://twitter.com/Rowdy_Knights/status/1900956449238642862,Organic Instant Coffee with 6 Mushroom Blend https://t.co/hLQD6bsyfF,,1,1742058322.0,rowdyknightsclub,0,1.0,False
1jbzqu7,https://www.reddit.com/gallery/1jbzqu7,Showing off my book and bookmark,,0,1742058233.0,india,7,0.5,False
1jbzqi5,https://www.reddit.com/r/MilitiousCompliance/comments/1jbzqi5/when_they_said_by_the_book_i_didnt_realize_they/,"When They Said By The Book, I Didnt Realize They Meant Every Last Letter","You ever get hit with ""do it by the book"" and suddenly you’re the guy turning in a welfare package that wasn’t yours, filling out triplicate forms for a printer that’s never worked, and watching your chain of command actually go to war over a coffee machine? Yeah, well, it's definitely by the book... but it's gonna take me months to get through this paperwork first.",13,1742058210.0,MilitiousCompliance,1,0.84,False
1jbzpzc,https://www.reddit.com/r/ZenHabits/comments/1jbzpzc/how_do_you_manage_the_pressure_to_get_everything/,How Do you manage the pressure to get everything perfect?,"I’ve been thinking about how much time I waste on perfecting my thumbnails and scripts. I get so caught up in every detail, but it’s hard not to feel like everything has to be flawless to succeed. Then life happens, I spill coffee on my shirt right before a video call and end up having to rush. How do you juggle everything without losing your mind?",5,1742058175.0,ZenHabits,0,1.0,False
1jbzp7f,https://i.redd.it/692fjis6xvoe1.jpeg,Bake and Waking plus making some Farina and Coffee.,"Tastes like how my pops used to for me as a kid. Thanks to him teaching me how to make it, I’m able to have some taste of Nostalgia of my childhood. 💖💚💜💛🧡💙❤️🤎🖤🤍💕💓💝💘💗❤️‍🩹❣️❤️‍🔥

⚠️‼️𝐃𝐎𝐍𝐓 𝐖𝐎𝐑𝐑𝐘! 𝐈𝐌𝐌𝐀 𝐏𝐔𝐓 𝐂𝐑𝐄𝐀𝐌 𝐀𝐍𝐃 𝐒𝐔𝐆𝐀𝐑 𝐋𝐈𝐊𝐄 𝐀 𝐍𝐎𝐑𝐌𝐀𝐋 𝐏𝐄𝐑𝐒𝐎𝐍 𝐖𝐎𝐔𝐋𝐃!‼️⚠️",3,1742058120.0,stonerfood,0,1.0,False
1jbzov2,https://www.reddit.com/r/MakeNewFriendsHere/comments/1jbzov2/23m_from_nyc_and_down_to_talk/,23m from nyc and down to talk.,"Hey there! 23-year-old guy in NYC looking to connect with some cool people. I'm a big soccer fan, always down for a good chat, and I love exploring random interests. Hit me up if you're interested in grabbing coffee or just hanging out.",1,1742058096.0,MakeNewFriendsHere,1,1.0,False
1jbzou5,https://taphaps.com/marquest-hall-stabbed-coffee-25a/,"Teen Stabbed Man To Death For Spilling Coffee On Him, Gets Plea Deal",,1,1742058095.0,TapHaps,0,1.0,False
1jbzop2,https://www.cbsnews.com/losangeles/news/los-angeles-man-awarded-50-million-in-case-against-starbucks-after-suffering-permanent-injury-from-spilled-tea/,I'm gonna need a coffee here. Very hot! Boiling!,,1,1742058087.0,UnexpectedSeinfeld,0,0.67,False
1jbzob4,https://www.reddit.com/r/shortstories/comments/1jbzob4/th_the_third_lie_chapter_1_golden_mornings/,[TH]  The Third Lie -- Chapter 1 : GOLDEN MORNINGS,"\#Thriller  #DarkRomance  #TheThirdLie

✨ **The Third Lie** ✨ – *A Story of Love , Lies, and the Unforgivable*

A tale of intense love, betrayal, and dark secrets , where nothing is what it seems. What starts as an obsessive, magnetic romance spirals into a psychological thriller, twisting reality itself.

He isn’t who he says he is.

And the worst part ? Neither is she.

===============================================================

The morning stretched golden and slow, sunlight slipping through sheer curtains, casting long, dappled patterns across the tangled sheets. The air smelled of fresh coffee and something softer, something undeniably *him*.

Lena stirred, stretching under the warm weight beside her, the sheets cool against her skin. Even before she opened her eyes, she *felt* him watching her. Ryan always woke up first. Always stared like he had all the time in the world.

“You’re staring,” she mumbled, her voice thick with sleep.

Ryan didn’t even try to deny it. “Admiring.”

Lena cracked one eye open, meeting his gaze. His head rested on one arm, his hair still messy from sleep, his lips curved in that lazy smirk that drove her insane.

“There’s a difference?” she muttered, shifting onto her back.

Ryan reached out, brushing a thumb over her cheek, his fingers trailing absentminded circles on her bare stomach. “One sounds less obsessive.”

She snorted. “And which one are you?”

His eyes darkened slightly. He leaned in, lips barely grazing hers, his voice dropping to something low and teasing. “Take a wild guess.”

She didn’t need to. She *knew*.

Ryan kissed her like it was instinct, like he was making up for the hours he hadn’t been touching her. His lips moved against hers slow and deep, a familiar rhythm she knew by heart.

Lena sighed into him, her fingers sliding into his hair, pulling him closer. She would *never* get used to this, to the way he made the rest of the world feel *insignificant* when he was near.

When they finally pulled away, her breath was uneven, her mind foggy. Ryan grinned, looking entirely too pleased with himself.

“I made coffee,” he said, like that was *remotely* important right now.

She let out a breathless laugh. “And you’re telling me this *now*?”

“Just proving a point.”

Lena arched a brow. “That you’re obsessed?”

Ryan smirked. “That you’re mine.”

She scoffed, shoving at his chest, but he only laughed, catching her wrist and pulling her right back against him.

“Ryan,” she groaned. “I *have* to get up.”

He shook his head. “No, you *want* to get up. *Have* to? Not really.”

Lena sighed dramatically, playing along. “And what do you suggest, oh wise one?”

Ryan grinned like he’d been *waiting* for her to ask. In one smooth move, he rolled on top of her, pinning her against the mattress, his nose brushing against hers.

“I suggest,” he murmured, lips hovering just over hers, “that we stay right here. Forever. Just you, me, and a *very* neglected cup of coffee.”

Lena bit her lip, pretending to consider it. “Tempting.”

“I *am*.”

She smacked his arm. “I was talking about the coffee.”

Ryan laughed, low and warm, before pressing a lingering kiss to her cheek, then her jaw, then the sensitive spot just below her ear that made her shiver. “Mmm. Liar.”

Lena *tried* to roll her eyes, but he had that playful, teasing grin that always made her weak.

“Alright, get off me,” she groaned, pushing at him, though they both knew she didn’t *really* mean it.

Ryan huffed, flopping onto his back like a child denied dessert. “Fine. But I’m keeping your pillow hostage.”

Lena gasped as he *stole* her pillow, hugging it dramatically to his chest.

“You monster.”

“You knew this about me and still chose to love me.”

She grabbed at the pillow, but he turned away, shielding it like it was *his* now.

Lena narrowed her eyes, then without warning, she *bit* his shoulder.

Ryan yelped. “Did you just *bite* me?”

Lena grinned. “I *warned* you.”

Ryan stared at her for a moment before shaking his head in *mock* disappointment. “God, I married an actual *wild animal*.”

Lena smirked. “And you love it.”

Ryan sighed dramatically. “Unfortunately, I *do*.”

He tossed the pillow back to her in defeat. “Go on then, traitor. Enjoy your coffee.”

Lena giggled, sitting up and stretching, the blanket pooling around her waist. But before she could get out of bed, Ryan grabbed her wrist and pulled her back for one last kiss, slow, deep, and filled with something *more*.

When he pulled away, he rested his forehead against hers, his thumb brushing over her lips.

“I could kiss you forever,” he murmured.

Lena’s heart flipped. *This man.*

“Forever’s a long time,” she whispered, tracing her fingers along his jaw.

Ryan grinned. “Not long enough.”

For a moment, they just *looked* at each other, breathing the same air, soaking in the warmth of something too *big* to put into words.

A muffled buzz from the nightstand broke the moment.

Lena groaned, reaching blindly for her phone, but Ryan was faster. He snatched it before she could, turning the screen just out of her reach.

“Who’s texting you this early?” he teased, his grip playful but firm.

Lena huffed. “Give it.”

Ryan’s smirk deepened as he glanced at the screen. But then, something flickered across his face, so quick Lena almost missed it.

She frowned. “Ryan?”

He blinked, and just like that, whatever had been there was *gone*. His smirk returned, effortless and easy. He tossed the phone onto her pillow. “Nothing important.”

Lena rolled her eyes, taking it and glancing down.

The message was short. Simple.

*Did you forget again?*

Her brows knitted together, confusion prickling at the back of her mind.

“Who is it?” Ryan asked, voice light, casual.

She stared at the message a second longer before locking her screen and tossing the phone aside.

“Spam,” she muttered. “Probably nothing.”

Ryan smiled, leaning down to kiss her again. “Then stop thinking.”

Lena let herself melt back into the warmth of him, into the safety of their morning.

===============================================================

5 votes again for next part ... ",1,1742058064.0,shortstories,2,1.0,False
1jbzo5s,https://www.reddit.com/r/espresso/comments/1jbzo5s/wanted_to_take_a_crack_at_a_custom_modded/,Wanted to take a crack at a custom modded espresso machine!,"When dad and i moved we got a cafe Roma which is really nice but I know I’m gonna need to get my own grinder and start buying whole bean coffee instead of hoping the pre ground coffee is grinded to a grain my machine will take. 

Apart from that I would really like to take on a project where I mod my own espresso machine, like I’ve said I have a cafe Roma at my dads and my moms got a broken “jazzy espresso machine js-105” I think it’s something to do with the pressure but I’m thinking shi if I’m gonna go abouts trying to fix it I want to take on a different kind of project and mod it into one of the best machines I’ve got. How can I do this? ",0,1742058054.0,espresso,5,0.5,False
1jbzmtq,https://www.reddit.com/r/lamictal/comments/1jbzmtq/i_cant_handle_the_tiredness/,I can’t handle the tiredness,"I have to blame the medication for this because it started the morning after my first dose two weeks ago and has been an issue every morning since. I’m barely waking up on time for class and I’m 7 weeks away from graduating with my degree. I can’t fuck it up now. I’m just waking up now and it’s noon. I never sleep this late. Yesterday I drank two coffees and took a nap and was still exhausted. Mind you, I’m only on 25mg. I was supposed to increase to 50mg yesterday and didn’t because I’m concerned for increase tiredness. Of course my doc is on vacation so I haven’t been able to talk to him. ",1,1742057965.0,lamictal,4,1.0,False
1jbzma5,https://www.reddit.com/r/espresso/comments/1jbzma5/when_you_think_your_brand_new_turin_legato_v2_is/,"When you think your brand new Turin Legato V2 is broke, but you're just a complete idiot.","So, here I am, all proud of my shiny new Turin Legato V2, ready to pull some perfectly dialed shots. But instead, I decide to unscrew the OPV spring all the way because I thought it was the flow rate screw. 😬

I pulled about four shots, each more watery and disappointing than the last, getting progressively more frustrated, thinking I somehow broke my brand new espresso machine. I was *this close* to posting a desperate Reddit cry for help, when suddenly... **epiphany**.

It hit me like a ton of bricks—what I had done. I had basically turned the pressure down to 2 bar, thinking I was just adjusting flow rate. Oops. So yeah, that was my bad.

Quickly went and fixed the OPV, dialed it back in, and pulled my next shot.

BOOM. 44.2g in 28 seconds with a 17.5g dose.

It was *dialed* as hell, and the coffee? Absolutely perfect.

Moral of the story: Don’t panic and post to Reddit without checking if you’re just an idiot first. 😅

https://reddit.com/link/1jbzma5/video/kv73lwxhwvoe1/player",0,1742057922.0,espresso,0,0.33,False
1jbzm92,https://coffeexplore.com/are-coffee-wood-chews-safe-for-dogs/?feed_id=1355&_unique_id=67d5b1c06e742,Are Coffee Wood Chews Safe for Dogs? A Vet's Guide,,1,1742057920.0,CoffeeXplore,1,1.0,False
1jbzm8n,https://coffeexplore.com/will-coffee-grounds-keep-armadillos-away/?feed_id=1354&_unique_id=67d5b1bf86842,Coffee Grounds to Deter Armadillos: Fact or Fiction?,,1,1742057919.0,CoffeeXplore,1,1.0,False
1jbzlgx,https://coffeexplore.com/why-am-i-craving-coffee/?feed_id=1353&_unique_id=67d5b188425de,Craving Coffee? Here's Why and What You Can Do,,1,1742057864.0,CoffeeXplore,1,1.0,False
1jbzlgm,https://coffeexplore.com/which-type-of-coffee-has-the-most-caffeine/?feed_id=1352&_unique_id=67d5b1864a015,Which Coffee Has the Most Caffeine: Brew Guide,,1,1742057863.0,CoffeeXplore,1,1.0,False
