id,url,title,text,score,created_utc,subreddit,num_comments,upvote_ratio,over_18
1ia7f5j,https://www.reddit.com/r/FoodSanDiego/comments/1ia7f5j/wildland_carlsbad/,Wildland - Carlsbad,"I searched the sub and didn't find any mention of Wildland in Carlsbad. My wife and I swung by there for lunch. It a new ""casual"" spot with a lot of seating both inside and out. The line was out the door and onto the sidewalk, so we just went to Steady State next door for coffee. BTW - Steady State has had a major glow-up since I'd been there last. Completely remodeled and expanded. It's much nicer than it used to be.

Anyway, the woman at the counter @ SS said the line at Wildland moves pretty fast, so after our coffee, we wandered over. We decided to tough it out and ended up waiting on line for maybe 10 minutes total. We got a selection of things and it all was excellent. Large bowl of chicken soup (not chicken noodle), roast beef sandwich, roasted 1/4 chicken plate, and the pistachio tiramisu. My favorite was the chicken plate as it came with pickled veggies, a mini salad, hummus, and a big slice of focaccia. There were also a couple of dipping sauces: A tasteless chili oil (nothing but heat) and an amazing garlic toum that I'm going to dream about tonight.

During breakfast and lunch, you order at the counter and the bring the food out as it is prepared (this means tiramisu first!). We watched as other folk's food was paraded by and everything looked good, especially the pizzas. They also have a decent pastry selection. Service was good - there are a lot of employees running food and clearing tables. There is also a full bar. 

It's not cheap, especially for counter food - our stuff, along with two iced teas, came to $80. We could have easily skipped the dessert and sandwich, for around $50. Note: this is high-end, full-service-quality food in a casual setting, from the same folks who brought us Jeune et Jolie and Campfire. Knowing that, it almost feels like a bargain. We will definitely return to sample other menu items.",1,1737871486.0,FoodSanDiego,1,1.0,False
1ia7dkd,https://www.reddit.com/gallery/1ia7dkd,Elon's Role in Stealing the US Election - Explained,"This is a MUST-READ for everyone. 

While this may not be completely related to counting votes, it does explain how the votes may have been stolen and how Trump was able to ""win"" all swing states. 

This person has provided verifiable information on the sale of Tripp Lite (election security company) to ""far-right predatory billionaire Leonard Leo"" who then sold it to Eaton Corp who then entered into a partnership with Palantir which is owned by ""another far-right predatory billionaire Peter Thiel."" Yes, that Peter Thiel, Musk's PayPal co-founder. The purpose of this partnership, along with the American-PAC that Musk established just prior to the election which Harvey's voter info in the swing states, was to ensure the deletion of (now this is me extrapolating from the post) any evidence of fixing an election.


Please share far and wide. 

If you have any contacts who have the authority to take action, they need to have this information (if they don't already). Especially for those in swing states. 

Continues in comments",19,1737871310.0,somethingiswrong2024,14,1.0,False
1ia7ddw,https://www.reddit.com/r/Marriage/comments/1ia7ddw/32f_needs_advise_for_husband_m33/,32F needs advise for husband M33,"We have been together 11 years and it’s been hot and cold. We have a 3 year old together and I’m at the point I asked to separate but he begged me to stay. The reason I asked to separate was the list I kept over the last year. He promised to be better but can people change or should I go. I feel I deserve so much  better but I am scared. 

….
…..
…..

Feb 29 I’m a bad wife and mother
March 1 - your garbage - for playing a game
March 16 - I want to hit you 
May 12 - Fuck you - Mother’s Day
June 7 “I don’t like your belly” as I’m in a bathing suit - just overall has been very snippy with me
Gone all first weekend of June thurs - sun Sunday was useless golfing next weekend at 12 noon on Saturday
Made me make you breakfast while fasting for colonscopy
Laid around like a lazy loaf all day when it really should have been me who was allowed to lay around
June 15- hung out w his friends all night jnstead of me - it was our anniversary
June 18 - said my poppops services wasn’t important 
June 19 - caused a huge fight bc I wanted to go to the gym broke my sunglasses and threw my dinner on the ground a lot of mean names
July 13 - his mom invited him over for dinner, he said “absolutely fucking not”
July 23 - scared a bunny away me and T were looking at “it’s annoying”
- 2 minutes after being home was rude to me because I was telling T he needed to eat I had already been trying to get him to eat for 20 minutes
July 25 sat in hot tub on phone all night 
- took T with him to grab a cigar so I could clean up dinner - nice BUT when I came home and was just sitting and didn’t clean up dinner bc I’m exhausted he gave me shit 
July 30 - asked me to take the Tv and set it up on his way home in the middle of bed time - I have told him time and time again that I don’t like doing it alone - got pissy at me - got mad I didn’t have his dinner ready when he was home - I had just finished bed time 10 minutes earlier 
- “I don’t respect you”
- “Your a crybaby” 

8/3 - caused a fight bc I wanted to go visit Steph - didn’t come w me to Costco 
Slapped coffee out of my hand
I don’t love you - I haven’t for years - crybaby - stupid - don’t like you - get the fuck out 
8/9 - didn’t help get anything ready for Timothy’s party 
8/20 told him Steph was back in the hospital to have baby monitored and he said she was being dramatic 
8/28 - asked if I was attractive said motherhood was the only thing that made me attractive 
10/16 T asked to go the park - you said you didn’t want to - went and hid in your office
Bitched that I have to go to Stephanie’s Friday to watch the baby but stayed in your office until 11
10/30 - came home from a week of travel no hug no kiss - didn’t say anything about all
The work I did around the house 
11/1 day of surgery little to help no support - worked until 1am 

Told me if we get a divorce he will actively tell T to hate my family ",1,1737871294.0,Marriage,0,1.0,False
1ia7ck1,https://www.reddit.com/r/snapchat/comments/1ia7ck1/42m4f_ontario/,42[M4F] Ontario,"Single dad looking to make some new friends, chat streaks, let’s talk about anything. Doesn’t matter where you are from to make connections or conversations, but if you are someone close to my area, I’d be up for a drive if someone was interested in meeting in person and going for coffee etc. ",1,1737871223.0,snapchat,1,1.0,False
