id,url,title,text,score,created_utc,subreddit,num_comments,upvote_ratio,over_18
1h9lboo,https://www.reddit.com/r/PrakashamParakkatte/comments/1h9lboo/chapter_12_the_beautiful_freakout/,Chapter 12: The Beautiful Freak-Out,"For the first few days after I returned to work, everything felt normal enough. People asked for engagement pictures, and I showed them, smiling through the inevitable compliments and curious questions. It was as if I’d stepped into a stage scene where everyone knew their lines: “Oh, you both look adorable!” “Your dress is gorgeous!” Even I played along, dutifully nodding and offering practiced laughs. I sent David the photos too, almost as an afterthought, asking which one he liked best. He replied with a vague, “They’re all good,” and that was that. Nothing unusual, nothing dramatic—just a clean, neutral exchange in a neat little world.

It was in the following days that something shifted. The office hummed with its usual workload, and Vic and David were swamped—buried under tasks, barely coming up for air. I tried texting David to ask something trivial, but his replies were slow, delayed by incessant calls and meetings. When I finally found out he’d been speaking to someone from another team—a girl, someone who worked remotely—there was a little tug inside me. She was probably just a colleague he needed to coordinate with. Nothing to fuss over, right? I told myself that as I sipped my coffee, tapping my foot. It’s about work, calm down. Still, a tiny pinprick of jealousy needled me. Silly. I ignored it.

Then came Laya. She was from another floor, apparently some sort of eye-catching newcomer. David mentioned her in passing—he thought she was cute. That’s when my jealousy kicked into a higher gear. I hadn’t even laid eyes on her yet, but the idea that he found someone else at work interesting, someone close by, felt like a pebble in my shoe. I finally saw her one afternoon, strolling through the corridor. She was shorter than me, but perfectly proportioned, with a small, symmetrical face and long wavy hair that fell around her shoulders. Slim, fashionable, wearing clothes that screamed effortless style. She had that kind of look that makes you think she belongs in an ad for a trendy boutique. Instantly, I could see it: they’d look great together, Laya and David. The thought made my chest tighten unpleasantly.

That night, my uneasy feelings brewed into a dream that was equal parts comedy and horror. In it, David’s flat transformed into a sprawling treehouse high above a jungle. Monkeys chattered, parrots cawed, and I found myself surrounded by an odd mix of people—including Laya and several women who looked like they’d stepped off the set of Bigg Boss season two. While I struggled to get David’s attention, Laya waltzed right up to him, batting her lashes as if she’d invented flirting. Suddenly, she whisked him behind a bamboo curtain, leaving me outside, nose pressed against the leaves, feeling like a complete outsider. A strange tribal chief with a headdress of neon feathers tapped my shoulder, declaring, “It’s over! You must leave!” He shoved me off the treehouse, and I landed back in reality, sweaty and furious, my jealousy now supercharged thanks to that absurd nighttime spectacle.

When I got to the office the next day, Laya appeared in the flesh, heading toward the elevator. As if on cue, Naina, Vic, Damu, and even a few others crowded around David, urging him to “just say hi” or “make a move.” It was a circus of encouragement, voices layered and overlapping, pushing him toward her like a prize pony at an auction. The elevator doors dinged. David stood there, deer-in-the-headlights, and the tension in the hallway was suffocating. Andy, thank God, stepped in to bail him out with some excuse about urgent work at his desk, guiding David away from the frenzy. The crowd deflated, grumbling but backing off.

And what did I do? I just stood there, watching, heart pounding like a lunatic, wishing I could scream at everyone to leave him alone. Yet, I said nothing. Part of me was too jealous to speak up—if he talked to Laya and they hit it off, what then? Another part was just stunned by how uncomfortable he looked. Either way, I failed to defend him, to stand at his side. I hovered on the sidelines, letting the mob smother him with their expectations while I stewed in my own private jealousy.

In the days that followed, the big “David and Laya” project fizzled out. It turned out that once the initial excitement wore off, David didn’t feel any real connection. Laya, for all her good looks, was a surface-level infatuation that didn’t hold his interest. I should’ve been relieved—and I was. My jealousy receded a bit, my racing heart calmed. But in that quiet aftermath, a new feeling emerged: guilt.

Because after it all settled, I finally had a private talk with David. I brought up the situation, expecting him to laugh it off. Instead, he admitted how trapped he’d felt that day, how everyone’s prodding made him uncomfortable. He’d looked for me in that crowd, hoping I’d get it, that I’d say something, anything, to ease the pressure. He thought I understood him. But I’d done nothing. I could almost taste the disappointment in his voice.

That’s when I remembered the chess game from a few months ago. It started out as a relaxed match between David and me, a gentle dance of pawns and bishops. Then Vic and Damu hovered, backseat-driving my moves, making me tense and frustrated. David had noticed my discomfort without me saying a word. He’d acted bored, casually knocking over the pieces with a cheerful “Meh, let’s call it a day,” effectively ending the game and rescuing me from their meddling. He understood me so well then. He’d had my back without needing a single hint.

Now, when he needed a hint of understanding, I hadn’t stepped up. I’d been too tangled in my own feelings, too consumed by jealousy and fear, to come to his aid. The realization stung. Sure, my jealousy was human—it was rooted in fear of losing something precious. But that didn’t excuse my silence when he needed me.

As I stood there, I wanted to rewind time, to push through my insecurities and speak up for him like he once did for me. Instead, all I had were regrets and a growing sense of shame. I might have managed to keep David close by letting the Laya situation fade, but at what cost? I’d revealed that I couldn’t always understand him the way he understood me.

And that, more than any jealous pangs or wild dreams, left me feeling hollow and small.",2,1733672053.0,PrakashamParakkatte,0,1.0,False
1h9lbb3,https://www.reddit.com/gallery/1h9lbb3,Barista milk ... Just a water and milk powder... ,"They started to sell it, the price 2380,I think tunisian drink express more than Direct and Cappucin ,it's not a solution to control the milk distribution for coffee shops. I don't know how will be the coffe taste ,anyone have tried it? Is it a solution to decreese the milk consumption? ",3,1733672024.0,Tunisia,4,1.0,False
1h9lb9n,https://www.reddit.com/r/findommes/comments/1h9lb9n/your_profile_or_you_are_beautiful_still_no/,Your profile or you are beautiful.... Still no complimentary sends or tribute,"I get so many messages of people complimenting me, account, posts, comments... Whatever... You get the drift.

When you start saying if it is so wonderful as you claim it to be, I would accept coffee as thank you, their usual responses would be

- Apologies Goddess for approaching empty handed
- I do not have money
- Crickets. Silence of the lambs.
- The most epic of all that never gets old:



You guessed it!




 [deleted]



My thoughts before a cup of coffee 😅",1,1733672020.0,findommes,0,1.0,False
1h9lamm,https://www.reddit.com/r/hoodriver/comments/1h9lamm/driving_in_mountains_in_winter/,Driving in mountains in winter,"I'm not from the area and have never skied so forgive my ignorance. If I wanted to just drive to a mountain lodge or ski resort to look around and get lunch or coffee, how hard is that during the winter? Do I have to have chains and/or studded tires or do they keep the roads cleared most of the time? For the ski resorts, do you have to pay for parking and do they allow people in who aren't going to ski but just see the sights?",1,1733671970.0,hoodriver,2,1.0,False
1h9la6t,https://www.reddit.com/r/SantaMonica/comments/1h9la6t/weekend_dinners_coffee_new_friends_group/,"Weekend Dinners, Coffee, & New Friends Group","Hi all!   
  
I'm 28F and recently moved to the Santa Monica area.   
 Like many of you it seems, have struggled to connect with others/make new friends. (Especially others who enjoy doing more than drinking, hiking, running, going to the gym... which are not exactly my idea of ""fun."")

After reading several posts in this group expressing a similar dilemma, I decided to just go ahead and form something myself!

My idea of a fun weekend includes dinner out at a new/trendy restaurant (I also have a food/travel blog), hosting dinner parties, hanging out or playing board games at a coffee shop, going out for a cocktail, etc...

I'd love to start putting together a group and organizing weekend get-togethers.

Anyone interested?? :)",4,1733671933.0,SantaMonica,0,0.83,False
1h9l9l8,https://i.redd.it/roj2w6kl8n5e1.jpeg,Coffee mug ☕️,"It seems that the plant is the steam coming out of the coffee, do you like?",2,1733671888.0,plantsandpots,0,1.0,False
1h9l9kf,https://i.redd.it/45juky2m8n5e1.jpeg,How many times can she say she loves and enjoys the same thing in ONE post?,"And WHY does she talk like this? Just retypes the same sentences over and over again, just in a slightly different order. I can’t explain it but it PMO. 
Don’t even get me started on adding “do” to everything. Example: I “do” love and enjoy blah blah blah. The word do is overkill and feels like word vomit.

Also, the coffee shop 1-2 times PER DAY? Girlfriend wants to be out of debt but has a major over consumption problem. Just because you “donate” and “give to those in need” doesn’t justify spending money you don’t have to spend. I don’t typically involve myself with others finances but there’s no way she’s not in major debt. Such a hypocrite. ",9,1733671886.0,kyleagomezsnarkagain,7,1.0,False
1h9l8af,https://www.reddit.com/r/espresso/comments/1h9l8af/baratza_grinder_not_fine_enough_breville_barista/,"Baratza Grinder Not Fine Enough [Breville Barista Pro]
","Hello all. Recently made the plunge into espresso and picked up a Breville Barista Pro from Marshall's for $499. This is the model that has the upgraded Baratza grinder built in. I picked up a fresh bag of medium-dark beans from my local roaster (roasted about 3 days ago).

With all that said, I feel like the grinder isn't grinding well? Even when setting the internal burr to 1 and the external dial to 1, the coffee still tastes sour. I had better luck with Lavazza beans, but even those I had to grind at an internal burr setting of 1 and an external setting of 4 (out of 30). My extraction is within expected times/weights (18g in, 36g out in about 28s).

Is this normal? I read that after the upgrade, this machine should be capable of grinding up to medium roasts, and I have no interest in light roasts so I figured it would be good enough for my use case. However, it feels like I'm pushing it to it's grinding limit even with a medium dark.

Thank you for any advice!",1,1733671788.0,espresso,0,1.0,False
1h9l88i,https://www.reddit.com/r/AskHistorians/comments/1h9l88i/did_ancient_europe_the_mediterranean_region_have/,Did Ancient Europe / the Mediterranean region have an analogue to caffeine prior to the introduction of tea and coffee?,"As far as I know, depressants like alcohol and opioids were quite common. The Eleusinian Mysteries among others maybe involved psychedelics. Heroditus wrote about the Scythians hotboxing with cannabis… 

But I don’t recall ever hearing about **stimulants**, which seems like they would be extremely useful in a society where basically everything was the product of manual labor, from food production to textile manufacturing to scribes writing up tax records. 

Was there some sort of analogue to the daily coffee or tea in Ancient Western Eurasia or were millions of people, from slaves to aristocrats, just “rawdogging life” each morning?",6,1733671784.0,AskHistorians,2,1.0,False
1h9l6o5,https://www.reddit.com/r/Market76/comments/1h9l6o5/h_caps_w_coffeeill_pay_100_caps_each/,H: CAPS / W: Coffee(I'll Pay 100 Caps Each),Got 35k on me. ,1,1733671655.0,Market76,1,1.0,False
1h9l665,https://www.reddit.com/gallery/1h9l665,Suzhou Yangchang Lake,A cold and bright Sunday coffee ride.,4,1733671615.0,Brompton,0,1.0,False
1h9l56w,https://i.redd.it/1b9sdxok7n5e1.jpeg,First time plant owner ☺️ please don't judge me 😂,,8,1733671537.0,IndoorPlants,4,1.0,False
1h9l4pr,https://www.reddit.com/r/GenX/comments/1h9l4pr/christmas_time_is_here/,Christmas time is here ,"It’s a Sunday morning and I’m browsing Reddit , sipping coffee and I hear fire trucks horns blaring.. normally  people would wonder where the  fire is, but not NY .. like clockwork every year the fire dept drives around the town towing Santa’s sleigh  with a fire truck escort handing out candy canes, fire helmets and coloring books.. I remember being that kid running out there like it was the ice cream man .. did or does your local fd do something similar? ",3,1733671499.0,GenX,6,0.8,False
1h9l4fv,https://www.reddit.com/r/Anticonsumption/comments/1h9l4fv/black_rifle_coffee_company/,Black rifle coffee company ,"ve had an extremely disappointing experience with Black Rifle Coffee Company. I attempted to cancel my subscription twice, but the process has been unnecessarily complicated and frustrating. When signing up, the company requires you to select four different coffees, which are grouped together as a single subscription. However, when you try to cancel, they only cancel one of the four coffees, leaving the other three active—and you continue to be charged for them.

To make matters worse, their cancellation process is cumbersome and requires direct contact with customer service, rather than offering a straightforward option online. Despite reaching out to their customer service team twice via email to address this issue, I received no resolution. They refused to offer any refunds or returns for the unwanted charges.

This experience has been highly disappointing, and I would caution others about the lack of transparency and poor customer service practices.",7,1733671477.0,Anticonsumption,19,0.64,False
1h9l3zn,https://www.reddit.com/r/u_Constant_Base2127/comments/1h9l3zn/off_to_church/,Off to Church ,"Good Morning, My Beautiful 😇 

I know you're awake now, and had and enjoyed your morning coffee, (I'm actually sans coffee so far this morning so far).  I hope your morning is off to a awesome, amazing, and blessed start 😍🥰😘

I left Dunlap about 8:45 and my bus up to church just left.  Saw most of our Family down there, and I still am going to get in touch with our Mom and Sisters after writing you.  (This bus ride is even longer than you remember...I want to put an lol here but yeah...LOL)

What are you doing after church today?  We'll be pretty close to nap territory when I get back from church.  Might eat, have to call our Mom, and still run, exercise, music, and Lovely Melody later this afternoon!  

I miss you, so very much, Precious 🫶💐😍 and I'm proud of you, Babe 💚🩵🧡

Always be sure, please, My Love 💙🩷💛 to get enough sleep 🌹😇🌷

I love you, Landin 💖💍💒👨‍❤️‍👨🌷🩷

Forever and always, My Boo 💚😘🫶💐🔥🎆🧡

And beyond, My Love Superstar 🌠💚🌠💙🌠🩵🌠🧡🌠💛🌠🩷🌠💖🌠❤️🌠 

Your 🫅

-AW 
💚💍💒👨‍❤️‍👨🧡
🩵🌠🌈⭐💙
💖🌌💐😇🩷
🌷😍🥰😘🌹
🎡🔥❤️🫶🫅
👑🥺👬🌃🎆",1,1733671443.0,u_Constant_Base2127,0,1.0,False
1h9l3mx,https://www.reddit.com/r/Gastritis/comments/1h9l3mx/mild_gastritis_stomach_noises_and_health_anxiety/,Mild Gastritis - stomach noises and health anxiety,"Hey All,

41m. Diagnosed 9 months ago with mild gastritis and gerd via endoscopy. Went on 20mg of panto for 3 months and felt pretty solid until a few weeks ago.

My mom died from cancer in October and I coped with bad food, alcohol and coffee. Over the last two weeks I’ve had discomfort in my upper left stomach and back (on and off) and lots of stomach noises, lower ab tightness and IBS like issues.

Can’t stop thinking it’s something horrible like pancreatic cancer.

Any words are appreciated.",1,1733671415.0,Gastritis,2,1.0,False
1h9l3iz,https://www.reddit.com/r/prestigia/comments/1h9l3iz/hampton_inn_suites_las_vegas_airport/,Hampton Inn & Suites Las Vegas Airport,"![Hampton Inn & Suites Las Vegas Airport]()

Stay in one of 128 guestrooms featuring LCD televisions. Complimentary wired and wireless Internet access keeps you connected, and digital programming provides entertainment. Private bathrooms with bathtubs or showers feature complimentary toiletries and hair dryers. Conveniences include desks and coffee/tea makers, as well as phones with free local calls.Take advantage of recreation opportunities including an outdoor pool and a fitness center. This hotel also features complimentary wireless Internet access, a television in a common area, and a ballroom.",1,1733671407.0,prestigia,0,1.0,False
1h9l3b9,https://www.reddit.com/r/sahm/comments/1h9l3b9/car_therapy/,Car therapy …,"I’ve forgotten how much I miss this….and NEED it from time to time. 

But today, I went out for a coffee WITHOUT the toddler or anybody else. Just me alone in the car with MY choice of music at any desired volume I chose! 

And got my coffee and then I enjoyed aimlessly driving. Didn’t intend to aimlessly drive but it just happened whimsically. I eventually returned home. But it was sooo nice. 

It’s not about the destination, ITS THE JOURNEY. ",4,1733671389.0,sahm,3,1.0,False
1h9l36a,https://www.reddit.com/r/thebeachboys/comments/1h9l36a/they_were_playing_add_some_music_to_your_day_at/,"They were playing ""Add Some Music to Your Day"" at my local Starbucks!","Starbucks plays the most eclectic music whenever I go in to get my morning coffee. Genuinely shocked when ""Add Some Music to Your Day"" came on, which I never would have thought in a million years would be part of a corporate playlist. It was a pleasant surprise.",17,1733671379.0,thebeachboys,3,0.95,False
1h9l31u,https://i.redd.it/fdgcn4v27n5e1.jpeg,Cup of coffee in the Platinum League,Ranked high enough to play in the Platinum League...once. I'll be back though.,1,1733671370.0,TheTowerGame,0,1.0,False
1h9l2my,https://www.reddit.com/r/HomeImprovement/comments/1h9l2my/how_can_i_protect_the_top_of_a_coffee_cabinet/,How can I protect the top of a coffee cabinet?,"I got this awesome bar cabinet as a gift, and I’m planning to use it as a coffee cabinet to make espresso and pour over. But I’m worried about scratching the top, which is a beautiful black finish over solid mango wood.  
  
I thought about using tempered glass, but I’m open to other ideas. Do you have any suggestions?",1,1733671337.0,HomeImprovement,2,1.0,False
1h9l2li,https://www.reddit.com/r/PhR4Friends/comments/1h9l2li/26_f4a_lets_be_friends/,26 [F4A] let's be friends!,"About me:
- Working professional 
- Medyo madaldal if madaldal ka rin
- Into self-improvement shits
- G for chika over coffee/beer

About you:
- Must be same age as me or older
- working din
- yapper din
- single (para naman damay-damay)",2,1733671334.0,PhR4Friends,0,1.0,False
1h9l0xh,https://www.reddit.com/r/productivity/comments/1h9l0xh/i_feel_lazy_everytime_i_come_home/,I feel lazy everytime I come home,"Hi guys. so i dorm at a school an hour away from my parents and they want me to come home every weekend( and i also want to). but everytime i come home i get very very lazy. for example, i wanted to wake up at 6 am but woke up at 9 instead. it’s 10 right now and im drinking coffee while watching tv w my dad. i have exams in 2 weeks and am very stressed but my parents get upset when i go on my laptop for too long asking what was the point of me coming home. lmao what do i do",4,1733671206.0,productivity,3,1.0,False
1h9l0sc,https://i.redd.it/xdx35l1k6n5e1.jpeg,Need help with coffee table and rug ,Just moved in and got a really bulky leather couch which we really loved but the couch took up a lot of our living room. we need a coffee table that isn’t too bulky. I’m thinking maybe a round coffee table would work. I’m not sure. Would love to get some suggestions here for not only coffee table style but also rug color & pattern.  ,3,1733671195.0,interiordesignideas,3,1.0,False
1h9l0ai,https://www.reddit.com/r/d_rex1984snark/comments/1h9l0ai/nurse_hannah/,Nurse Hannah ,"I haven’t spent much time on TikTok so this morning I’ve decided to do a scroll fest while drinking my coffee.  My FYP is full of this Nurse Hannah, definitely some similar traits I see with this family.  I just don’t understand how people that have been blessed with children can treat them so badly.  They are the true gift of God and deserve so much better.  A child should never have to worry about receiving nutritious food. Being fed is one thing but being fed nutritious food is most important.  Allowing your child to be heard and not ignored.  I could go on and on.  Abuse doesn’t have to always be physical, the mental abuse is just as bad.  ",4,1733671158.0,d_rex1984snark,1,1.0,False
1h9l02l,https://www.reddit.com/r/bodylanguage/comments/1h9l02l/what_did_i_do_wrong_from_pleasant_to_disdain/,What did I do wrong? From pleasant to disdain?,"Hello all.  37m here.  Had an instance with a coworker (early 30s f) that we would regularly smile at when we passed by each other in the halls.  Then I noticed she would end up booking a desk in my vicinity. We started just random chatting about our days, little history and music etc.  Then we would be sitting next to each other most weeks. Then i didn't see her book next to me for a few weeks, which I didn't think much of. Then when booked by me again I was o hey I missed ya last few weeks.  Then I again she was booking regularly, and conversation started ramping up.  

She mentioned she loved Pistachios so said I'd bring her coffee next week she'd love (w/pistachio). Told her to take down my number and let me know if she wasn't gonna be in or something came up (which she didn't at first but then eventually asked me later for it). Was hoping she would use it to just spark up convo but she did not.  Took it as a sign she might not be interested but I think in person she was so sweet and nice and we had a good rapport I figured she might not like to make the first move. 

So one day I mentioned the song Texas sun (she loves country) and had never heard of it so told her to add it. Following Monday I see the band is in town and I grab a ticket for myself (had a rough year and started getting introverted, finally felt like getting back out but figured I'll try a solo concert for the first time). Then I thought hey why not ask her.  

I messaged her on work chat asking her if she liked the song.  She said she loved it and so I told her I just found out they were in town and grabbed a ticket,  can grab anther one if she'd like.  She saw but no response. 

Before I left I said hey no pressure,  I know it's last minute but if you can make it you have my number. 

Did not hear from her, but went and had a great time at the khurangbin show.  Next week in the office she isn't booked by me,  and when she walked by my desk she looked and quickly looked away with a rather displeased or awkward face.  It crushed me.  I thought I went about it the least pressure way possible, and honestly even if we just went as friends or coworkers I would've been fine with that.  But it def made her uncomfortable. 

So then for the following month it's just awkward.  No more smiles in the halls.  Haven't talked since.  Just cold towards me. And she was someone who really helped brighten my day when I came into work after a tough year so it especially made me feel bad.  Last thing I wanted to do was make her uncomfortable.  

So last week I sent one last message.  Telling her he was overdue but I'm sorry to put her in an uncomfortable position and that she should be able to come into work without being bothered.  And that I would leave her alone.  

She saw, but again no response.  

I'm gonna stick to it and leave her alone.  Just want to hear opinions on what I may have done wrong.  Or what is possibly going through her head.  

",4,1733671140.0,bodylanguage,11,1.0,False
1h9kzyc,https://www.reddit.com/gallery/1h9kzyc,Miles Davis - Four & More,"Recently scored this repress from sometime in the 70s, still has the original shrink, plays flawlessly. Might be too intense before having your first coffee but it’s hitting nicely right now. I guess I don’t always realize how much live material from Miles is out there until I see it in the wild.  ",3,1733671130.0,Vinyl_Jazz,0,1.0,False
