id,url,title,text,score,created_utc,subreddit,num_comments,upvote_ratio,over_18
1jc1av5,https://www.reddit.com/r/SeveranceAppleTVPlus/comments/1jc1av5/lumon_presence_in_206_countries/,Lumon Presence in 206 Countries,"I was doing my morning scroll through TikTok, which has become mostly Severance theories and analyses, and one of them got me thinking. In the Lumon claymation video earlier in s2, it says Lumon has presence in 206 countries, but a lot of fans point out that in the real world, there are only 195 countries. Now, I know that they’re lying to innies, and that a lot of info they tell them about the world outside their work is made up, but I also know that everything in this show is intentional. It got me thinking about the human skeleton, which has 206 bones. To me, it speaks more to Lumon trying to control people. There’s soooo many theories and analyses that are floating around, so I apologize if this bones theory has come up and been debunked already. It was just an idea I had before getting my coffee in this morning. ",1,1742062314.0,SeveranceAppleTVPlus,1,1.0,False
1jc19qt,https://www.reddit.com/r/scarystories/comments/1jc19qt/i_thought_i_saw_my_ex_in_the_window_but_it_wasnt/,I thought I saw my ex in the window. But it wasn't her,"I realised there was a ghost in my window after my ex moved out.  

I was slumped in my couch, alone, and then – you know how you feel when someone staring is at you, and look over and someone actually is? That happened. I could feel eyes on me, I looked around, and there she was, her reflection in our fifth-floor apartment window.  

I stood up, I might have cried out from fear- I don’t remember   

I went over to the window, which looked over a narrow alley and snowy roofs. Our apartment building was in a street mostly with townhouses.  

Anyway, the face in the window didn’t budge, or blink. Just stared. I stared back.  

I couldn’t tell if the face was outside the window, or in the window, if that makes sense. On impulse, pushing the limp curtains fully aside, I opened the window. Wind howled in from the street-lit darkness. I quickly pulled the window close again.  

Her face glimmered back into the glass, backlit from the streetlight.  

And then I noticed- I’m not a noticing sort, but I noticed her hair. It was all done up fancy, and there were lights- no, sparkles, like jewels in her hair, a trail of elaborate sparkles running from the tops of her ears towards the back.  

And then, as I stared and she stared back, tears running down her pale cheeks, it clicked.  

She was a bride. She was done up similar to girls at their weddings- we had been to a wedding a few months back, and I remember the hair and the sparkling jewels curving around the bride's forehead. Pretty.  

The girl opened her mouth and I remembered my living room was haunted. I reached my hand to the window. She also raised her hand, and through the ice touch of the glass I felt her fingers, warm and reassuring.  

The warmth of her fingers was the first thing that ignited actual fear in me. It blazed in me as my eyes stretched wide-open, and the blaze burned my fog of heartbreak and confusion and made me see clearly: The girl in the window wasn’t my ex- a silly fancy in my mind- in fact looked nothing like her- but a supernatural sad bridal creature, haunting me.   

I snatched my hand away and leapt back. The woman’s face shone brightly in the glass, and she smiled. Her painted lips moved.   

“Let me in Charles, I’m so cold.”  

I blinked. How could I – what did she mean? On impulse, I pulled the curtains, which had been hanging back, close together, and collapsed back on the couch.   

I realised I was sweating. And very soon after, a great wave of fatigue pulled me under, and I fell into the deepest slumber I have ever known.   

I forgot to think about my ex much the next day. Occasionally the bride’s face in the window swam into my mind. I didn’t feel much fear anymore, and towards the end of the day, I found myself wondering if she would still be there.    

She was.   

We stared at each other. Our fingers touched through the glass. “Let me in-” her words glided into my brain. “I can help you. I know how you feel.”   

My brain jerked. I snatched my fingers away, and let the curtains fall. How could she know how I felt? The huge fatigue welled up in me again, and the image of the face the last thing I saw before everything went black.  

The next day was Saturday. For the first time since the break up, I was happy it was a Saturday, and the day didn’t loom pointlessly in front of me. I went straight to the local library, which I hadn’t visit since childhood, and dove into the local archives.   

In an hour or so I had found what I needed to know. My building was built on the site of a large old house. About fifty years ago, a young bride had jumped out of a balcony to her death after the groom-to-be jilted her the morning of their wedding, a sensational local news story. I stared at the young sad face of the bride in the digitized old newspaper, the same face that looked at me from my window every night, asking to be let back in.  

But even if I wanted to, how could I? That evening, I flung the window open, hoping to be rid of her longing stare into my soul. And there was nothing, just the street night glare and icy rush of window. The moment I pulled the window shut, she shone into the glass. “Let me in Charles. I can help you, I know how you feel.”  

They say you get used to everything, and soon I got used to that sad sparkly face in the window, yearning to come in, claiming to help me. And even though I couldn’t bring her back in, I think maybe she was helping me. Because I seemed to be thinking about my ex and the break up less and less. I resumed my usual gym routine, and a few weeks after that visit to the library, I gave in to the insistence of my friends to set up a new dating profile. Very soon after that, I found myself going out on coffee dates, which then progressed to dinner dates, and from there to do-you-want-to-come-back-to-my-place dates with lovely Helen.   

As we settled on the couch, I turned and pulled Helen close to me, savouring this new romantic bliss.   

A shine caught my eyes and my eyelids fluttered opened. I glimpsed the face in the window over Helen’s shoulder, the sparkle and shine of her eyes and teeth and the jewels in her hair and the street lights dazzled me. I jerked away from Helen, and cried out. How could I have forgotten about her?   

Helen smiled politely at me. “What’s wrong Charles?”  

“The curtains-” I muttered and stood up and walked over to pull them close.   

The face came up so close I could feel the warmth of her skin. “Now Charles!” she begged. “Let me in now!”  

Without thinking, I pulled the window open. Icy air whooshed in.   

“Just want a breath of fresh air.” I heard myself explaining to Helen, who seemed quite motionless on the couch.   

I went back to the couch, and settled next to her. “Helen?” I placed my arms around her, pulling her towards me.   

And then I saw the sparkles in her hair, the jewels tucked in an elaborate and familiar pattern around her ears and curling back.   

I cried out in horror, reeling back. The face from the window was superimposed on Helen’s lively pretty features. “Oh Charles, it’s so warm here. Never let me back out.”  

“Helen!” I cried, horrified at what I had done. I grabbed her shoulders and started shaking her. “Helen, listen to me!” I shook her again, and she smiled at me, lying back on the couch, her face another’s.   

I took her by the hand, yanked her to her feet, dragged her to the window, and flung it open. “Out! Out!” I cried, and we tussled in the rush of cold black air. Her hands were strong on mine, pulling me through the window. All the lights and sparkles seemed to turn upside down, and suddenly I was dangling outside, with nothing beneath me. My hands gripped the railing, and I could feel a force greater than gravity pulling me down.   

“Charles!” screamed Helen. I looked up at her, and she bent towards me, her face her own. “Hold on” she gasped, and she pulled at me. I was able to climb up and crawl in, gripping her arms. I heard her cries of pain but she remained steady. Once in, I immediately slammed the window shut, and we collapsed, entwined and panting on the floor.    

After a while we got up. Helen said casually she’s going to put the kettle on for a cuppa. It sounded like a good idea, and I said I wanted one too. As I followed her into the kitchen, I looked back at the living room window, which was black, reflecting the normal glare of street lights. Helen was kind and gentle to me.    

I never saw the face in the window again.   

 ",1,1742062234.0,scarystories,0,1.0,False
1jc16j6,https://i.redd.it/zwibc1gp8woe1.jpeg,☘️💚,,5,1742061998.0,sanfrancisco,0,1.0,False
1jc15fc,https://www.reddit.com/r/EntrepreneurRideAlong/comments/1jc15fc/the_day_i_stopped_stalking_ctos_on_linkedin_and/,The day I stopped stalking CTOs on LinkedIn (and started booking demos),"Remember that feeling when you hit ""send"" on a cold email you spent an hour crafting... only to be met with deafening silence?

Three months ago, I was sitting in my apartment, surrounded by empty coffee cups, staring at a spreadsheet of potential leads for my HRMS software. I had exactly zero demos booked that week, despite spending 20+ hours researching prospects.

I remember thinking, ""I didn't become a developer to spend my life doing *this*.""

That night, I made a decision that changed everything: What if I could engineer my way out of this problem?

# The experiment

I'm a technical founder, not a sales person. So I approached outreach like I would approach a coding problem:

1. I identified the pattern: Most ""personalized"" cold emails aren't actually personal - they're just mail-merged flattery
2. I built a system to truly understand prospect contexts: their tech stack, recent challenges, team structure
3. I created an AI model that could learn how *I* write when I'm genuinely interested in someone's work

The first message I sent using this system got a response in 7 minutes. Not an auto-reply—an actual conversation.

# The results

Within a month, I booked 7 demos without writing a single outreach message from scratch. The prospects didn't just reply—they were *prepared* for the calls. One CTO even said, ""This is the first cold email I've responded to in years.""

The difference wasn't ""growth hacking"" or ""sales techniques"" - it was simply making each interaction genuinely relevant to that specific person.

# Why I'm sharing this:

I've built this system into a tool called [SalesNode](https://salesnode.tech/) \- specifically for technical founders who'd rather be building products than crafting ""the perfect cold email.""

But here's where I need your input. Before I go deeper into development, I want to know:

1. Is this a ""shut up and take my money"" solution or just another ""AI toy"" in your eyes?
2. What's the most soul-crushing part of your sales process right now?
3. If you could automate one aspect of customer outreach, what would it be?

I'm not here to pitch—I'm here to build something that actually solves a problem for people like us. If this resonates with you, I'd love to hear your thoughts.

And if it doesn't? Well, my IDE is always waiting for me.",2,1742061917.0,EntrepreneurRideAlong,0,1.0,False
1jc154f,https://www.reddit.com/r/Market76/comments/1jc154f/h_10k_berry_mentats_10k_canned_coffee_w_tfj/,H: 10k berry mentats + 10k canned coffee W: TFJ,,0,1742061895.0,Market76,1,0.5,False
1jc12jb,https://www.reddit.com/r/Scotland/comments/1jc12jb/what_am_i_doing_wrong/,What am I doing wrong?,"Please indulge me in a bit of a wanky moan here, internet pals.

Why the fuck is it so impossible to meet new pals??? Surely its not just me that this is happening to? 

We are repeatedly told what to do. Reach out. Show interest. Make the first move, show interest. I do all of these things, maybe meet up for a wee walk/coffee a couple of times. Then….nothing. This happens all the time. Not reciprocated.

Start a new group? Ok, ill do that. Over 50 folk joined a local walking group I set up. Tried 4/5 times maybe to organise a small first walk. Not ONE person wanted to. Why join a walking group if you don’t want to do it?!

I am so fucking jaded with it all. It is so, so exhausting. People say all the time that they are lonely, or want to make new pals but when push comes to shove no one wants to put themselves out a wee bit, or make any consistant effort. 

Honestly, where am I going wrong?",1,1742061712.0,Scotland,0,1.0,False
1jc11yl,https://youtu.be/_fb9nOZnsQI?si=tq0yM3NXuLWNiz1q,"Sex, Coffee and a Cinnamon Roll (2021) - follows a jaded, nonchalant Man as he becomes rudely entangled in a plot to retrieve his stolen wallet from a 10 year-old boy.",,1,1742061674.0,Shortfilmsuk,0,1.0,False
1jc11fo,https://www.reddit.com/r/confession/comments/1jc11fo/i_switched_my_coworkers_coffee_to_decaf_for_a/,"I switched my coworker’s coffee to decaf for a month, and he has no idea.","

I work with a guy who constantly brags about how “he can’t function without his coffee” and how he needs “at least three cups of strong black coffee” to get through the day. He also has this habit of mocking people who drink decaf, calling them “weak” and “fake coffee drinkers.”

So, as a little experiment, I started secretly making his coffee with decaf. It’s been a month now, and he hasn’t noticed at all. He still complains in the mornings about how he “needs caffeine to survive” while sipping on what is essentially flavored water.

I don’t even feel bad. If anything, I feel validated. Maybe I’ll tell him one day… or maybe I’ll just let him keep living the lie.
",23,1742061640.0,confession,13,0.77,False
1jc0zt9,https://www.reddit.com/gallery/1jc0zt9,LF Whodunnit?(5) or any other 1:1 trade (include set #),,2,1742061526.0,Monopoly_GO,13,1.0,False
1jc0xmc,https://www.reddit.com/r/Narcolepsy/comments/1jc0xmc/sleep_doctor_stated_i_have_poor_sleep_hygiene/,Sleep doctor stated I have poor sleep hygiene,"
I went to my sleep consult yesterday and the sleep doctor was incredibly dismissive and talked over me to the point I left almost in tears. I’ve been having trouble sleeping ever since I was a young teen like 14, and I’m 23 now. Over the years doctors dismissed it as lack of vitamin D, being a teenager and also a college student but recently I ran a bunch of tests for thyroid disorders, ANA, hemoglobin, Mono and more and they all came back normal. 

I had a primary care provider referral to a sleep clinic as she suggested I may have narcolepsy or insomnia as I told her symptoms of falling asleep/ getting intense sleep attacks whenever I am sitting down and listening to a lecture or meeting or speech. I also told her about how I nap everyday 2-6 hours, and how I have trouble falling asleep some nights. I’ve written scribbles for notes due to sleep attacks, and I drink up to 800mg of coffee at one point to even function though I have now dropped it down to less than 500mg. I also mentioned how when I laugh incredibly hard, my hands go weak and I drop my phone and won’t be able to write anything for a minute or so ever since I was a child. I thought this was normal until recently when I started asking my classmates. I also lean forward when I laugh, and slur my speech due to it becoming a bit harder to speak but that also could be just due to lack of oxygen from laughing so hard and trying to catch my breath again.

When I went to the sleep clinic, I was met with a pulmonologist who dismissed everything I said as being due to poor sleep hygiene and sleep deprivation. I basically had to beg her to even let me take the MSLT and Polysomnography which they finally stated they would once I fix my sleep hygiene. I tried to explain to them that it doesn’t matter how good my sleep hygiene is as I’ve had periods where it’s been great, but I’m still tired. She then stated that I wasn’t doing it consistently, and that is the reason. I don’t know if I’m overreacting and maybe she is right that this could just be sleep deprivation and poor hygiene, but at the same time I feel unheard and every symptom I listed such as the weak hands, sleep paralysis, brain fog, insomnia, dreaming even during short naps was all dismissed as poor sleep hygiene.",3,1742061357.0,Narcolepsy,2,1.0,False
1jc0vwb,https://www.reddit.com/r/kingdomcome/comments/1jc0vwb/i_just_met_luke_dale_kcd2_kcd1/,I just met luke dale [kcd2] [kcd1],"Honestly what an encounter I was at a Costa having a coffee and I saw him I had to look him up just to be sure. But once I knew it was him I shouted ""hello hans"" and all I've gotta say is he's got to be one of the most genuine people I've ever met. Such a nice guy. I didn't want to bother him but I couldn't let the opportunity pass me by. The motion capture department done an amazing job he looks part for part how he does in real life ",4,1742061227.0,kingdomcome,2,0.83,False
1jc0sl1,https://www.reddit.com/r/whole30/comments/1jc0sl1/milk_recommendations_that_do_not_contain_nuts_or/,Milk Recommendations (That do not contain nuts or coconut)/ Coffee Recipes,"I plan on doing a modified whole30 protocol at the recommendation and/or support of my PCP, dietitian, and naturopath. One of the modifications is the exclusion of nuts as it ***may*** be causing some digestive issues for me. I also do not like coconut-anything. One of my favourite things in the morning is a nice creamy iced coffee. I generally make it using lactose-free whole milk or light cream. Obviously, I will not be having dairy during the protocol. All the recommendations for whole30 milks I am finding are nut milks.

Anyone try any other whole30 milks (hemp, flax, etc)? Any tips to replicate the creaminess in an iced coffee? I've seen some recipes that recommended adding tahini ... but I'm open to anything ... ",2,1742060983.0,whole30,0,1.0,False
1jc0pa1,https://www.reddit.com/r/CarnivalCruiseFans/comments/1jc0pa1/currently_cruising_in_the_gulf_of_america_not_the/,Currently cruising in the Gulf of America…. Not the most joyful ride,"We are heading back to our port, Carnaval dream. Winds are 35 ml per hour and gusts are 51. Everyone is barely able to keep the balance, my husband burned his hand carrying coffee. I know the captain is doing his best, and the ship is seaworthy, but we are all motion sick. Not a fun day at sea; 8 more hours of these winds. ",0,1742060734.0,CarnivalCruiseFans,11,0.18,False
1jc0no0,https://www.reddit.com/r/askCardiology/comments/1jc0no0/tachycardia_after_hospitalization/,Tachycardia after hospitalization," Hello! I (19M) was told to go to the ER on Thursday by my clinic doc (I don’t have a PCP). They kept me for 11 hours and ran standard tests (Ultrasound, CT, ECG) and everything came back normal except that I had high Sinus Tachycardia that wasn’t keeping a stable beat (around 180-200 which they were able to bring down to 90-100). I was given a lot of IV fluids and sent home because there was no PE or structural abnormalities.

 My heart rate keeps up at this high rate (though not as high as during my hospitalization). I don’t drink coffee or alcohol. I’m not a smoker, and I work out everyday/walk everywhere since I don’t have a car. Is there anything that would bring this down? I’ve had this issue for a few years (saw Cardio at 16 and was told the tach would probably go away as I grew up) and it seems to only be getting worse. However since I have no structural abnormalities or underlying conditions, is there any lifestyle changes that would be recommended for someone in my situation? Thanks! 

Note: I’m 19, 145lbs/5”9, swimming twice a week, cycling and weight training on the other days ",2,1742060612.0,askCardiology,0,1.0,False
1jc0m5b,https://www.reddit.com/r/WeightLossAdvice/comments/1jc0m5b/why_am_i_not_losing_weight/,Why am I not losing weight?,"So last week, due to some serious stuff I was going through in life, I didn't really have an appetite, but I still did a dance workout for 30 minutes (YT: Fitness Marshall) and was losing 1lb a day pretty much. This week, I started off at 241lbs and figured I could aim to lose 2-4lbs this week. I've resumed eating, but I know for a fact I'm not overeating. I eat a banana for breakfast, then later drink coffee to help wake me up for workout, then I ate another banana. And finally for dinner, I ate meal prepped Taco Salad with measured out portions. It was 475-500 calories. 90 cal Breyers Chocolate Ice Cream Cup for dessert and that's it. So like I said, I know I'm not over eating. Regarding my workout, I switched to my Echelon bike for my workouts this week. I do 15 minutes to rock music, 5-10 minute break, then another 15 minutes to my favorite pop songs. By the end, the app says I burned 320ish calories. And I've done that every day this week. Yet somehow, I have not gone done in weight at all! I'm fact, I've slowly been gaining like .3 or .5 lbs a day. I don't know what I'm doing wrong 😭😭😭 Can someone help me please? Is there something else I should be doing, or even stop doing? I really need to lose weight",1,1742060500.0,WeightLossAdvice,3,1.0,False
1jc0lyu,https://www.reddit.com/r/PhR4Friends/comments/1jc0lyu/26_f4a_lets_be_virtual_friends/,26 [F4A] let's be virtual friends?,"As someone who's experiencing a lot of thinking lately, it's nice to have someone to talk to about it haha. I tried to reaching out to my circle but it seems that they are also dealing with their own shits too which I understand. 

So, yeah! HMU if there's something you want to talk about,
and if it's okay with you to listen to mine also. 

about me:
- i liek cats, coffee & morning walks
- i love supporting artists in any way i can
- i'm into r&b lately, so if u can reco some good underrated songs/artist (i love u already haha)
- i love learning new stuff 
- lastly, just recently, im starting to do journaling ✨

~ (⁠；⁠^⁠ω⁠^⁠）",5,1742060487.0,PhR4Friends,0,1.0,False
1jc0l25,https://www.reddit.com/gallery/1jc0l25,"Sam and Sprout :3, order: Sam’s skin, Sprout’s Skin, Sam’s hair, Sprout’s Hair, Sam’s clothes, Sprout’s “sprout”. (I made these ocs in a pause challenge by @YourLocalCoffeeDrinker.",,3,1742060419.0,OriginalCharacter,0,1.0,False
1jc0kj8,https://www.reddit.com/r/cocktails/comments/1jc0kj8/how_much_five_farms_cream_to_add/,How much Five Farms cream to add,"Good morning I bought some five farms a couple of days ago and decided to start my weekend off right. I normally drink my coffee black, but am unsure how much to add. Also I see that most recipes use whiskey along with it. Is it necessary? ",0,1742060384.0,cocktails,1,0.33,False
1jc0kav,https://www.reddit.com/r/decaf/comments/1jc0kav/5_days_without_coffee/,5 days without coffee,"I have been drinking coffee for 18 years but the last year I have been drinking so much coffee I basically stopped counting how many a day. 
I have been wanting to quit for some time now but didn’t seem to find the strenght.

Well I got a really bad stomach flu this week and now 5 days have passed without having any coffee (or a lot of food lol)

I feel really bad but honestly I don’t think it’s because of the flu, but purely withdrawal from caffeine. I’m super tired and irritated and lots of headaches throughout the day.

But I’m grateful, this stomach flu feels like some kind of reset for my body that I desperately needed. Not only for coffee, but also for my sugar intake and unhealthy eating habits.

So wish me luck! I hope this is the beginning of my decaf life.",1,1742060367.0,decaf,0,1.0,False
1jc0k94,https://www.reddit.com/gallery/1jc0k94,LF these two and I have these to offer.,,1,1742060364.0,Monopoly_GO,1,1.0,False
1jc0jkc,https://www.reddit.com/r/blackgirls/comments/1jc0jkc/whats_a_random_niche_thing_you_were_into_for_a_bit/,What's a random niche thing you were into for a bit?,I was really into espresso machines and cafes last year. It started off watching tiktoks and YouTube shorts where ppl would use their fancy espresso machines or old fashioned coffee machines. Then I would watch povs of a guy working in his cafe. It was really soothing lol idk. I even considered buying an espresso machine at one point 💀 I like coffee and all that but it would've been such a waste of money lol,4,1742060312.0,blackgirls,0,1.0,False
1jc0im6,https://www.anarchistfederation.net/blue-bottle-coffee-workers-fight-nestle-for-a-first-contract-with-international-support/,Blue Bottle Coffee Workers fight Nestle for a first contract—with international support,,4,1742060244.0,FuckNestle,0,1.0,False
