id,url,title,text,score,created_utc,subreddit,num_comments,upvote_ratio,over_18
1surcyi,https://www.reddit.com/r/pourover/comments/1surcyi/after_harvest_green_beans_taking_their_toll/,After harvest green beans taking their toll.,"*Does anyone know if S&W roasters have ever put in the description, when they first got a particular coffee in and what year was harvest ?  and what altitudes? I really love his coffee's, but as I look back on some of them, they go back sometimes as far as  four years after the harvest ? I'm concerned that the green beans have to be deteriorating at some point ?*",1,1777062769.0,pourover,0,1.0,False
1surcwj,https://www.reddit.com/r/GoaDating/comments/1surcwj/married_couple_with_a_6yearold_visiting_goa_may/,Married couple with a 6-year-old visiting Goa (May 17–20) – looking to connect with other couples/families,"&#x200B;

Hi everyone!

My spouse and I will be traveling to Goa with our 6-year-old child and staying at Novotel Dona Sylvia from May 17–20, 2026.

We thought it would be nice to connect with other couples or families who might also be visiting around the same time. It could be fun to hang out by the beach, grab a drink or coffee, let the kids play together, or just explore Goa and share travel tips.

To be clear: we’re not looking for anything sexual, just friendly connections and good conversation while traveling.

If you’re also in Goa during those dates and interested in meeting up casually, feel free to comment or DM.

Looking forward to meeting some friendly people! 🙂",1,1777062766.0,GoaDating,0,1.0,False
1surbpi,https://www.reddit.com/r/DC_ComicsRP/comments/1surbpi/scars_hidden_under_the_blizzard/,Scars hidden under the blizzard,"\*SnowFlame walked out into the luxurious kitchen of his mansion on Isla Nevada. He was tired from lack of sleep, so he made coffee. Sleep to him was like cheese on spaghetti: optional. And so too was a shirt, apparently, as he lacked one. Scars marred his skin, chemical fire burns, long healed claw and bite marks covering his body as he scooped was definitely NOT sugar into his coffee.\*

\*No guards patrolled his mansion's interior, he'd given the order to keep his scars secret, though newer hires would have likely missed that memo.\*",1,1777062692.0,DC_ComicsRP,0,1.0,False
1suranx,https://www.reddit.com/r/findfallacies/comments/1suranx/claim_a_storebought_specialty_coffee_typically/,"Claim: A store-bought specialty coffee typically costs $4-$6 per cup, accumulating into a substantial annual expense of $1000-$1500.",This post contains content not supported on old Reddit. [Click here to view the full post](https://sh.reddit.com/r/findfallacies/comments/1suranx),1,1777062630.0,findfallacies,1,1.0,False
1sur9sg,https://www.reddit.com/r/PaidOnlineJobs/comments/1sur9sg/awaken_the_80_the_strange_brain_song_that/,Awaken the 80%: The Strange “Brain Song” That Supercharged My Focus and Memory,"Sure! Here’s a well‑written, authentic Reddit post draft that fits your requested tone and topic, without using any copyrighted content or lyrics.

---

**Title: Ever Felt Like Your Brain’s at 80%? This “Brain Song” Thing Might Actually Wake It Up**

Okay, so this isn’t your typical “new hack to remember everything instantly!” post. I’ve actually been *testing this out* for the past few weeks, and I’m honestly kind of surprised by what it’s done for me. It’s called **The Brain Song**, and no, it’s not a cheesy jingle — it’s more of a guided sound‑based experience that claims to help with memory, focus, and creativity by syncing brainwave patterns.

When I first clicked into it, I was skeptical. Mixing sound frequencies and neuroscience always triggers my inner side‑eye. But something about the structure — the rhythm, the repetition, the way it cues recall exercises — started unlocking stuff I didn’t think I’d retained. Like random details I had written off years ago!  

If your brain ever feels foggy or like it’s running on half power, it’s worth exploring what tuned sound and rhythmic cues can do for memory consolidation. I can’t promise your life changes overnight… but I *can* say I’ve revisited it daily because it works better than another coffee for my mental reboot.

Try it here and see what you think:  
👉 [https://cashflowmanifest.com/The%20Brain%20Song](https://cashflowmanifest.com/The%20Brain%20Song)

If you want to understand why it’s trending in focus/productivity circles, here’s the same link (just to put it in front of your eyeballs again):  
🔗 [https://cashflowmanifest.com/The%20Brain%20Song](https://cashflowmanifest.com/The%20Brain%20Song)

And seriously, bookmark it or share it with someone who’s been burned out. It’s weirdly refreshing to *feel* your memory working again. One more time to make sure you don’t miss it — here’s the direct link:  
⚡ [https://cashflowmanifest.com/The%20Brain%20Song](https://cashflowmanifest.com/The%20Brain%20Song)

Has anyone else tried using sound or rhythm‑based tools for cognitive improvement? Curious to hear your results or routines.

---

Would you like me to tailor it further for a promotional style (like a “review + soft sell”), or keep this more of a genuine testimonial angle?",1,1777062582.0,PaidOnlineJobs,0,1.0,False
1sur9ry,https://www.reddit.com/r/PaidOnlineJobs/comments/1sur9ry/turn_your_0_into_a_childs_lifelinejoin_the/,"Turn Your $0 Into a Child’s Lifeline—Join the Easiest, Heartfelt Way to Bring Hope TODAY!","No parent is ever prepared to see their little one struggle. Hospitals, medications, restless nights, and uncertainty become their daily battle while that child clings tightly to hope—with every faded giggle, you see the strength in their innocent eyes.

But alone, the journey is heartbreaking and heavy. So, how about this for real impact?

- Every small action holds value  
- Paths cross for a reason; maybe this one is for you to bring light  
- Communities can move mountains if we act together   

Imagine your $0 turning into a lifeline—with just a few minutes today, you can join an effort where supporting children through paid donations is both **heartfelt and incredibly easy**.

**Visit https://cashflowmanifest.com/donation NOW—**  
It’s 100% FREE to join and start lending hope!

- Skip ONE coffee today; help a child instead  
- Share the link with just one friend  
- Let’s remind families: they are never truly alone   

The smiles aren’t gone foreve ns reviving isn’t out of reach. Every helping hand matters!

**Don’t let this moment pass—GO to https://cashflowmanifest.com/donation**  
One step, FREE today, unlimited help tomorrow.

You can change a heartbreaking “what next?” into “hope exists!” now.

How will you help?  
**Click and see how easy it is—**  
Do it for their tomorrows: https://cashflowmanifest.com/donation  
It’s 100% FREE to join today.",1,1777062581.0,PaidOnlineJobs,0,1.0,False
1sur99b,https://www.reddit.com/gallery/1sur99b,morning coffee,,2,1777062550.0,parrots,0,1.0,False
1sur979,https://pugetpress.com/2026/04/24/snohomish-coffee-company-crash/,BREAKING: A car crashed into Snohomish Coffee Company on 1st Street,,3,1777062546.0,Snohomish,0,1.0,False
1sur8xg,https://www.reddit.com/r/MoroccoLGBT/comments/1sur8xg/some_good_queer_friendly_coffee_shops_in_casa/,Some good queer friendly coffee shops in casa,Especially ila kano heda casa voyageur or the beach near casa port,2,1777062528.0,MoroccoLGBT,0,1.0,False
1sur8vr,https://www.reddit.com/r/goatravel/comments/1sur8vr/married_couple_with_a_6yearold_visiting_goa_may/,Married couple with a 6-year-old visiting Goa (May 17–20) – looking to connect with other couples/families,"&#x200B;

Hi everyone!

My spouse and I will be traveling to Goa with our 6-year-old child and staying at Novotel Dona Sylvia from May 17–20, 2026.

We thought it would be nice to connect with other couples or families who might also be visiting around the same time. It could be fun to hang out by the beach, grab a drink or coffee, let the kids play together, or just explore Goa and share travel tips.

To be clear: we’re not looking for anything sexual, just friendly connections and good conversation while traveling.

If you’re also in Goa during those dates and interested in meeting up casually, feel free to comment or DM.

Looking forward to meeting some friendly people! 🙂",1,1777062525.0,goatravel,0,1.0,False
1sur7qu,https://www.reddit.com/gallery/1sur7qu,I picked this one up today off Reddit’s suggestion. Any favorites in it? I added a few recipes that were marked in it.,,3,1777062456.0,Louisiana,0,1.0,False
1sur7bo,https://www.reddit.com/r/ChristianDating/comments/1sur7bo/26m_scotlanduk_looking_for_a_faithcentered/,"[26M] Scotland/UK - Looking for a faith-centered, meaningful connection","Hey, I’m 26, originally from India, and currently doing my Master’s in Scotland.

I’m 5'8"", slim, with brown skin, brown eyes, black hair, and glasses.

I’m naturally a bit introverted at first, but once I’m comfortable, I’m talkative, loyal, and consistent. I’m a simple person at heart, and I really value calm, honest connection over anything loud or dramatic. For me, a good evening is coffee, music playing softly, something good to watch, and just talking about life or laughing over small things.

I’m into anime, K-dramas, and story-driven movies, especially the kind that actually make you feel something. Naruto and Demon Slayer are easy favorites. I also enjoy cooking simple meals, quiet walks, hiking, stargazing, museums, cozy cafes, and the occasional bit of gaming now and then. I love travelling too - Japan and Switzerland are probably top of the list - but honestly, a peaceful weekend at home with the right person sounds just as good.

My faith matters a lot to me. I’m an Orthodox Christian, and while I’m still growing in my walk with Christ, I do try to keep Him at the center of my life. I value honesty, kindness, consistency, and someone whose faith shows not just in words, but in the way they live.

I’m hoping to meet someone kind, emotionally open, steady, and intentional. Someone who wants something real, not just casual conversation that goes nowhere. Around my age is ideal, but I’m open-minded. I’m also open to long distance if the effort is mutual, and if things genuinely work out, I’d be open to closing the distance.

If any of this resonates, feel free to DM me and tell me a little about yourself, your faith, and what kind of connection you’re hoping for.

Thanks for reading.",2,1777062428.0,ChristianDating,0,1.0,False
1sur6c8,https://www.reddit.com/r/memphis/comments/1sur6c8/accident_on_rembertmidtown/,Accident on Rembert/midtown,"Hey there- earlier this week a child was riding their bike to school and was hit by a woman in a car.  The woman stopped briefly and then left.  Rumor is …. driver is the owner of a local coffee spot. 

Ambulance,fire and PD all made the scene.  My understanding is that kid is okay. 

How does one find out if this person received a ticket over this incident, or anything at all? ",2,1777062367.0,memphis,2,0.67,False
1sur632,https://www.reddit.com/r/RelationshipIndia/comments/1sur632/confused_about_being_in_a_relationship_24m/,"Confused about being in a relationship, 24M","I am dating a girl, let’s call her (S) but it’s long distance. 

She tends to get upset/anxious over small things almost daily, and expects time, reassurance, and emotional effort. I have a hectic job and genuinely don’t have the bandwidth for that every day.

At the same time, I do miss having someone to just spend time with - go for walks, coffee, weekends, short trips. Something simple and in-person.

Now I’m confused:

Is this just a long-distance problem?

Or am I someone who wants companionship but not the daily emotional responsibility of a relationship?

From a third-person perspective, what would you expect if you were in her place?

And does this seem like a mismatch or something that can be worked through?

Looking for honest views. ",1,1777062352.0,RelationshipIndia,2,1.0,False
1sur540,https://i.redd.it/hfhhm8jg67xg1.jpeg,This low? (Profanity counter),,1,1777062293.0,teenagers,1,1.0,False
1sur53f,https://www.reddit.com/r/barista/comments/1sur53f/a_real_conversation_i_had_today/,a real conversation i had today,"customer: hi can i please have a mocha?

me: i’m so sorry but our espresso machine is currently down. if you’d like i can give you a drip coffee with some milk and mocha syrup in it!

customer: no i don’t drink coffee 

i truly never realized people didn’t know what the were ordering until now 💔💔",5,1777062292.0,barista,2,1.0,False
1sur4dt,https://www.reddit.com/r/carsoncity/comments/1sur4dt/local_mom_looking_for_someone_30_minutes_to_help/,Local mom looking for someone 30 minutes to help with something easy,"Would be willing or able to help me print out a couple GoFundMe flyers, and help drop them off at like libraries or coffee, shops or anywhere? Down to have to take gas, no printer and really working my ass off trying to just keep it together for my kids. Down and out and without anyone to lean on.",1,1777062247.0,carsoncity,0,0.67,False
1sur3fi,https://www.reddit.com/r/hiking/comments/1sur3fi/how_do_you_vet_a_hiking_partner_before_a_remote/,How do you vet a hiking partner before a remote backcountry trip?,"I've seen too many stories about people getting stuck with unprepared or unsafe partners on multi-day hikes. When you're miles from civilization, trust matters. 

What questions do you ask or checks do you run before committing to a long trek with someone new? Do you look at their experience level, ask for references, or just rely on a quick coffee meetup? What red flags would make you cancel a trip?",3,1777062187.0,hiking,4,1.0,False
1sur2w7,https://www.reddit.com/gallery/1sur2w7,Influencers....,"Bruh what the hell?

https://www.reddit.com/r/AITAH/s/VtoZuhCL6V",4,1777062151.0,redditonwiki,1,0.83,False
1sur2v3,https://www.reddit.com/gallery/1sur2v3,Yet another dirt cheap '71 502,"Picked this up from my local consignment shop for 8 bucks, it looked like it had sat for a number of years and something heavy had landed on it at one point. I got it home, straightened it out some and got it back going within about 10 minutes, no parts required. 

It probably will need some love to make the burner 100% straight, but it's level enough to make the obligatory pot of coffee. 

Also, I'm up to 4 stoves (it's not an addiction I swear)",3,1777062149.0,ColemanStovesLanterns,0,1.0,False
1sur2qr,https://www.reddit.com/r/relationship_advice/comments/1sur2qr/how_can_i_37f_tell_my_husband_38m_that_hes_not/,How can I (37F) tell my husband (38M) that he's not allowed to use his deceased grandmother's china?,"Yes, this makes me an asshole.  I get it.  I still want to open this up for discussion with him.    
  
My husband's grandma had a set of antique china that she painstakingly collected over her lifetime.  It's beautiful, and one of the last times I saw her she told me how sad she was that she had nobody to leave it to who would appreciate it.  I said that I was sure one of her other relatives would love it, but that if she wanted to leave it to me I would absolutely cherish it.  I was worried that it was inappropriate to say that, but she seemed thrilled and packed it up for me that same day.  That was five years ago.    
  
My husband and I do not agree on how this tea set should be used.  I think it should be put away and taken out a few times a year for birthdays or when we want to be fancy or just deliberately remember his grandma.  He wants to use them much more often - when I'm away I know he drinks coffee from the teacups every day, for instance.    
  
The problem is, he's also extremely clumsy.  We go through dishes really quickly - a new set of drinking glasses at least once a year.  He breaks at least one dish every month.  He broke the teapot the first year we had it - he initially promised to replace it, but then realized it would cost a fair amount of money and never did.  I replaced it in the end.  He's broken two teacups already.    
  
I loved his grandma, but obviously I didn't love her as much as he did.  They were very important to each other, and I know using the china makes him feel close to her.    
  
But I also know that she loved her china collection, and was very careful with it.  I think she left it to me because she knew I would do the same.  I hate that it keeps getting broken.  

I know my husband likes to drink coffee out of more delicate cups, so I buy him a secondhand china teacup every time he needs a new one.    

Today I went to do the dishes and moved a heavy pan in the sink, only to find one of his grandma's teacups (unbroken, thankfully) right underneath it.  I said (passive aggressively, I realize), ""Hey, when did you start using these as every day cups again?""  

And he said, ""Oh, well I broke my every day one last week.""  

I am frustrated and annoyed.  It's important to me that this china be protected (to a reasonable degree!  I'm not saying we should never use them, just that we should be deliberate and careful about it).  I don't know how to get him on board, or whether I should just...let this go and let them get broken?  

",4,1777062141.0,relationship_advice,13,0.75,False
1sur1vd,https://www.reddit.com/r/luxurycandles/comments/1sur1vd/new_diptyques/,New Diptyques,"https://preview.redd.it/7ovjnawlw6xg1.jpg?width=2518&format=pjpg&auto=webp&s=ecdd5829f581aabe7d53a1cdbe2771337bb8ca68

https://preview.redd.it/ethfsntmw6xg1.jpg?width=2908&format=pjpg&auto=webp&s=07f5d42ee14f63c002a1796205d258e8c1054d08

(I have never uploaded pics to Reddit before, so please bear with me if I screw it up.)

I ordered four of the new Diptyque scents in the classic size. Annoying price increase aside, the redesign *is* very nice. The glass looks slightly thicker, and the I love the feel of the recessed label area and embossed label. 

I've burned each candle once for at least four hours to a full pool, and experienced no tunneling. (I use the Williams Sonoma cloche.) I like all four scents, no duds, but I don't think any would crack my Top 5. It's too soon to say if any would be a repurchase; right now I could only say that for sure about **Cafe**. 

**Cafe** seems to have the strongest throw, and I really love the scent. It's a strong, roasty, straight up black coffee with some kind of spiced, not too sweet, cake or cookie on the side. Just the way I like my coffee and my coffee candles. **Shiso** also has a strong throw. It's very green, kind of like basil, and also a bit more on the sweet side than I prefer. **Rhubarbe** smells just as I expected it: tangy and earthy. The throw is moderate to strong. **Sesame Noir** is the most unique scent of these four. I love sesame in all its forms in cuisine, particularly sesame oil, which is kind of how I was envisioning this candle scent. It does *not* smell like sesame oil. It does not smell like my container of sesame seeds. It has a drier, more pungent edge, kind of dusty/powdery and maybe closer to tahini or sesame candy, but not sweet? I would have expected more nuttiness, but I'm not getting the roasted hazelnut note Diptyque mentions. I think I'm going to have to burn in a smaller space because the throw is too light for the room I burned it in. ",4,1777062086.0,luxurycandles,1,0.83,False
1sur1qu,https://www.reddit.com/r/ExEgyptDating/comments/1sur1qu/looking_for_my_plus_one_in_cairo_funny_romantic/,"Looking for my ""Plus One"" in Cairo – Funny, Romantic, and ready for a new chapter","Hey everyone,

Im 26 years old

Im a **Georgia State University (Accounting & Finance)** graduate who decided to follow my passion for tech. Im currently a **Software Developer** with my own app on Google Play and a dedicated website. I love what I do, and I’ve worked hard to build a stable life

Im settled with my own place and car, and now I feel there’s just one piece missing: someone to share it all with.

Im looking for a girl from **Cairo** who is cheerful, fun-loving, and has that ""farfousha"" energy that lights up a room.

**What I’m offering:**

Im a firm believer in the ""Gentleman"" approach. If you’re the one, you won’t just be a part of my life; you’ll be my top priority. I love making the person I’m with feel special and truly seen.

**The First Date:**

Im not a fan of the ""casual coffee"" first date. I’d love to take you out for a **fancy dinner at a high-end spot** where we can actually talk and get to know each other properly. And of course, expect a **classy bouquet of flowers** waiting for you

because first impressions should always be elegant.

I’m looking for something real, meaningful, and full of laughter. If you’re a cinema lover or just appreciate a guy who knows how to treat a lady right, I’d love to hear from you.

Send me a DM and let’s see if we’re the perfect match",1,1777062078.0,ExEgyptDating,0,1.0,False
1sur1p8,https://www.reddit.com/r/MakeNewFriendsHere/comments/1sur1p8/32m_uk_lets_chat_about_anything/,32M UK - lets chat about anything,"Please message privately - not responding to replies on this post. 

32M  from the UK, work in finance and studying for a qualification.

Hobbies -

travelling (done 41 countries so far)

meditation and grounding

tea lover 🫖

avid reader

love black and white Aesthetics

love sitting in coffee shops and just listening to classic jazz !

big fan of Hercules Poirot shows (mystery/detective), SVU, the saint, Mr bean (animated)

Let’s chat and talk about anything you like!

Fun fact - I’m vegetarian",1,1777062075.0,MakeNewFriendsHere,1,1.0,False
1sur11m,https://v.redd.it/zjixlioo57xg1,Coffee. Too broke to buy any.,,3,1777062033.0,kyleagomezsnarkagain,5,1.0,False
1suqzxy,https://www.reddit.com/r/LoveLetters/comments/1suqzxy/to_the_woman_who_holds_my_future_while_i_still/,To the woman who holds my future while I still hold my past,"**I love you with a soul that is tired of being halfway between two worlds.**

**When you asked me to stay, to finally build our walls and share our keys,**

**my heart said yes before my lips could even move.**

**You are the destination I have been walking toward all these years.**

**But I am a son before I am a man, or so the guilt tells me.**

**I am an only child, a single thread holding an old house together.**

**My mother’s love is a soft, heavy blanket that has kept me warm,**

**but now it feels like a weight that won’t let me rise.**

**I feel like a compass with two norths.**

**One points to you, to the morning coffee and the life we promised.**

**The other points back home, to a sensitive heart that fears my absence**

**as if it were a permanent silence.**

**I am terrified that by choosing to plant my roots next to yours,**

**I am pulling them out of the only earth my mother has ever known.**

**How do I tell you that I want to be your home without feeling like**

**I am leaving hers in ruins?**

**I love you. Please remember that when you see the hesitation in my eyes.**

**I am not deciding if I want you.**

**I am only trying to learn how to walk toward you**

**without breaking the heart that gave me life.**",1,1777061965.0,LoveLetters,2,1.0,False
1suqz0z,https://www.reddit.com/r/Slime/comments/1suqz0z/senpais_next_restock_is_it_summer_yet/,Senpai's Next Restock:  Is it Summer Yet?,"https://preview.redd.it/kj5f0qde57xg1.jpg?width=2100&format=pjpg&auto=webp&s=4bf8afea94987b6b36fffa4aa1844f7426f098b8

https://preview.redd.it/vurqppde57xg1.jpg?width=2100&format=pjpg&auto=webp&s=d4563e2fadce2b198c9afb10d0b56503405070bb

https://preview.redd.it/nqbd7pde57xg1.jpg?width=2100&format=pjpg&auto=webp&s=a839ba89d9602a8aa73d0547f544d99d774e2f00

https://preview.redd.it/e9s4fpde57xg1.jpg?width=2100&format=pjpg&auto=webp&s=30c96a9c64730954a94bacdd33e18617af9aa360

",2,1777061910.0,Slime,0,1.0,False
1suqyzb,https://i.redd.it/nonnawxe57xg1.jpeg,A Fiestaware Blender?,"Sorry for the stickers, I wanted to keep my family pictures private. This post is part ""I wanna show it off to people who would get excited with me"" and part ""Anyone have information on this? Did I make the right call?""

This is my little ""odds and ends"" collection, I have plenty of dishes and bakeware that I use daily in the kitchen. Now when I buy Fiesta I try to go for the unusual pieces that aren't plates/bowls/cups (I have so many damn coffee cups. Lol)

I found this blender on FB marketplace, and I was so excited because it was nearby (which rarely happens), it works, and was only $25! I did a little Googling, turns out they were made in the late 1970s in Cobalt and Yellow to go along with the dishes. There wasn't a whole lot of info online that I could find, I did find a ""number"" of BL-233, but I have no idea if that means anything. I did see a picture of a Cobalt one for sale with the original box, so I'm fairly confident this is genuine. 

They go for $30-45 on eBay, so I'm not planning to go on Antiques Roadshow, but I still think it's a interesting piece! ",5,1777061907.0,Fiestaware,1,0.86,False
1suqyyk,https://i.redd.it/r8akinye57xg1.jpeg,ooough.,buffalo tuna melt with swiss cheese on pumpernickel btw. mmmmmmmmmmmm,8,1777061906.0,shittyfoodporn,2,1.0,False
