id,url,title,text,score,created_utc,subreddit,num_comments,upvote_ratio,over_18
1i8cehq,https://www.reddit.com/r/ForeverAloneDating/comments/1i8cehq/30_m4f_onlineusaanywhere_seeking_a_connection/,"30 [M4F] #Online/USA/Anywhere Seeking a Connection Filled with Adventure, Laughter, and Meaningful Moments","


Hi there! I’m Danny, a 30-year-old marketing professional who’s equal parts creative, curious, and driven. I’m here looking for someone special to share life’s little joys, big adventures, and everything in between. If you enjoy witty banter, meaningful conversations, and laughing until your cheeks hurt, we might just click.

What It’s Like Dating Me
	•	The Fun Factor: Whether it’s spontaneous day trips, movie marathons, or a hilariously intense board game night, I’ll keep life interesting.
	•	Master of Chill Plans: Cozy evenings with good food and even better company are my specialty.
	•	Storytime Pro: My life has been full of amusing, absurd, and downright ridiculous moments—I can’t wait to share them.
	•	Life’s Little Perks: Whether it’s discovering hidden gems, unexpected surprises, or just knowing the best restaurants, being with me means life feels a bit brighter.
	•	Your Steady Companion: I’m calm under pressure, dependable, and will always have your back (or your favorite snack).

A Bit About Me
I’m a blend of creativity and curiosity, with a knack for finding beauty in the ordinary. I’m happiest when I’m exploring a new city, diving into an engrossing book, or losing track of time in a great conversation.

Travel is a huge part of my life—I’ve visited Canada, the USA, Colombia, the Bahamas, and Mexico, and my wanderlust isn’t slowing down. Bonus: I speak Spanish, so we can plan trips to some incredible destinations!

When I’m not traveling, I’m immersing myself in art, music, and storytelling. Whether it’s swapping favorite songs, checking out an art gallery, or discussing life’s big questions over coffee, I’m all about connecting on a deeper level.

What I’m Looking For
I’m open to connecting with women from all walks of life—what matters most is that we bring out the best in each other. Here’s what I value:
	•	Laughter and Fun: A great sense of humor and a willingness to laugh at life’s quirks.
	•	Kind and Open-Minded: Someone who’s genuine, grounded, and ready to embrace new experiences.
	•	Emotionally Intelligent: Communication, empathy, and loyalty are the foundation of meaningful connections.
	•	A Little Playful: Life’s too short to take too seriously—let’s have some fun!

Why You Should Message Me
If you’re looking for someone who sees life as an adventure, values deep connections, and brings positivity to every moment, I might just be your guy. I’ll keep you laughing, surprise you with thoughtful gestures, and make even the mundane feel special.

Whether we’re discovering a new favorite spot, enjoying a lazy Sunday morning, or plotting a spontaneous getaway, I’m all in for making memories together.

Let’s Make Memories
I believe the best relationships are built on shared experiences, meaningful conversations, and a lot of laughter. Whether it’s exploring quirky art exhibits, hitting the road for a last-minute trip, or cozying up for a movie night, I’m looking for someone who’s as excited about the journey as I am.

Final Thoughts
Distance doesn’t scare me if we vibe—it’s all about building something meaningful. If you’re in your twenties or beyond, adventurous, grounded, and ready for something real, let’s chat. Tell me your favorite story, dream destination, or the last thing that made you laugh—I’d love to hear it.

Life’s too short for “what ifs”—let’s start something amazing.

This version aims to be warm, confident, and engaging, while highlighting your strengths and inviting connection. Let me know what you think!",1,1737662301.0,ForeverAloneDating,1,1.0,False
1i8cedf,https://i.redd.it/dg6lu625usee1.jpeg,Jackpot,"Love the brand, haven't tried most of these. ",2,1737662292.0,hotsauce,0,1.0,False
1i8ce8k,https://www.reddit.com/r/molecularbiology/comments/1i8ce8k/struggling_to_find_work_open_to_suggestions/,Struggling to Find Work - Open to Suggestions,"Hey all! 

I graduated last year with a Master of Science in Pathobiology. Before that, I earned an undergraduate degree in Molecular Biology and conducted over two years of post-baccalaureate research at the NIH. In total, I have 5+ years of molecular research experience, along with lecture and lab teaching experience. Throughout my research career, I gained expertise in a variety of molecular techniques and specialized in flow cytometry.

About two months before I graduated, I began my job search. I applied to over 100 positions for which I was qualified and/or overqualified, along with a few “dream job” applications where I was slightly underqualified but still felt within a reasonable grasp. Out of those 100+ applications, I received about five interviews. For one of those opportunities, I advanced to the final stage of a two-month application process, only to be rejected after the final round of interviews.

From what I can tell, my CV is strong, and I’ve tried nearly everything I can think of. I’ve reached out to recruiters and principal investigators (PIs) directly, created customized cover letters for every position, and even offered to meet with prospective employers for coffee to discuss their research. Despite these efforts, I keep coming up short.

After about four months of job searching, I needed to work and ended up taking a position in an unrelated field—food service. I was quickly promoted to a corporate role, which has provided financial stability for the time being. However, I’m incredibly discouraged, as my passion lies in working within the biological sciences. While I’ve been able to apply some of my research background to my current position (e.g., assisting with the acquisition of FDA licensure for my company), I feel lost when it comes to re-entering the field. I want to either elevate or make a lateral salary transition, but I’ve now been out of the biomedical field for over a year, and I worry that the longer this continues, the harder it will be to merge back in.

**My questions for everyone out there are:**

1. Are others experiencing similar struggles finding employment in their field of research?
2. Are there pathways I might be missing to re-enter the field? Recently, I’ve been applying to Field Application Scientist positions through Thermo Fisher, but despite tailoring my CV and cover letters and reaching out to recruiters, I feel like I’m getting nowhere.
3. What methods have you used to make connections outside of academia that have helped open doors?

Thank you for taking the time to read this. I look forward to hearing your stories and advice. While I haven’t given up hope on finding a good career path, this year-long search is definitely starting to take a toll on me.",1,1737662282.0,molecularbiology,0,1.0,False
1i8ce32,https://www.reddit.com/gallery/1i8ce32,LilShit,"Super attached and clingy garage cat.

Likes to

A: ride in my onesie or cathartt hood.

B: sleep in my onesie zipped up while I drink coffee/do my little morning thing

C: ride around in the front flap of my coveralls like a baby Bjorn.

Comes out in spring and summer and climbs me while I work on stuff.",8,1737662272.0,yesmycat,1,1.0,False
1i8cdf5,https://www.reddit.com/r/Heartpalpitations/comments/1i8cdf5/please_tell_me_your_experience_with_heart/,"Please tell me your experience with heart palpitations, mine are kinda scaring me.","I can't go see a doctor rn but yesterday I started having what I think are heart palpitations. My heart pounds harder and I think faster too for a few seconds at a time. It happens randomly, well most of the time at least. I noticed today that it happens when I bend over or get up, or even take a deep breath sometimes, other times they're just random and happen while I'm not doing anything. I could go 2h without getting one and then get several ones in 2min. 

For context, I'm 19, I don't drink coffee nor alcohol. I don't feel particularly stressed out unless subconsciously so I'm not sure it's caused by stress. 

Some reasons I thought of that could cause them are my lack of exercise in the past month. From mid December to this Monday I was on winter break. December exams messed me up so bad I was basically rotting the entire break.
Classes started again this Monday and I do a 2h commute and walk a lot, plus my college has hills and weird paths and whatnot so I thought it might be the lifestyle change with no transition. I've also slept terribly this past week so probably that too. To top it all off, it's the week before my period so I wouldn't be surprised if this is what's causing them. 

I started taking magnesium and vitamin D today so I'm hoping they go away once these starts having longer term effects or once I get my period. 
But in the meantime they're so disturbing even though it says everywhere that it's not a source of concern if not accompanied by any other symptoms. I didn't worry much yesterday and this morning. But I've had them at least 40 times today from 6am to 9pm and it's kinda scaring me cuz I don't know how frequently people who experienced them had them.",2,1737662223.0,Heartpalpitations,0,1.0,False
1i8cb00,https://www.reddit.com/r/Wawa/comments/1i8cb00/stores_still_taking_away_multiuse_coupons/,Stores still taking away multi-use coupons?,"Someone close to me that does not have a proper phone for the app is apparently still having their ***clearly-marked*** multi-use paper coupons (the 1-2-3 promo) taken from them at at least one store (should I tell you which one?)

This is BS. I tend to use the hot-coffee one at the self-checkouts, now that they can scan the rewards keytag, and haven't had to worry about coupon takeaway.

Are there still regional mgrs who think takeaway of MUPCs is a good thing?",0,1737662050.0,Wawa,4,0.5,False
1i8cakn,https://www.reddit.com/r/paolocroshop/comments/1i8cakn/java_burn_natural_fatburning_coffee_supplement/,"""Java Burn: Natural Fat-Burning Coffee Supplement for Energy & Weight Lo...","""Transform your morning coffee into a powerful fat-burning and energy-boosting drink with Java Burn. This natural supplement enhances metabolism, helps burn fat, and boosts energy without crashes. Simply add to your coffee and enjoy the benefits of a healthier, more active lifestyle. Perfect for anyone looking to lose weight and stay energized throughout the day!""

BUY NOW A SAVE

[https://lc.cx/u3Q\_Mj](https://lc.cx/u3Q_Mj)",1,1737662019.0,paolocroshop,0,1.0,False
1i8c9vi,https://www.reddit.com/r/Fantasy/comments/1i8c9vi/what_helped_grow_your_love_of_fantasy/,What helped grow your love of Fantasy?,"When I was young and living in Lubbock, Tx where I went to school, we had a Half Priced Bookstore one street over from me. Super nice guy by the name of Layne owned and ran it. Always well stocked with paperbacks at good prices. It was such a comfortable place and esp rainy days I'd go pick up a few books. Thats where I started learning the authors and artists. Always remember that place and the nice guy who owned it. That was years ago and its gone now. But nothing like a rainy day, a good book, and a cup of coffee.",2,1737661969.0,Fantasy,4,1.0,False
1i8c9uj,https://www.reddit.com/r/Parenting/comments/1i8c9uj/indoor_party_ideas_places_for_a_4yo_who_loves/,Indoor party ideas (places) for a 4yo who loves spiderman!,"I thought I'd rent a room in  a coffee shop or some event space - with a small playground and hire a character artist (dress up as spiderman and do some fun activities for an hour). The party will be in early March (March 1st or 2nd). 

All the coffee shops near by seem to either not take reservations or mostly don't have a playground that kids go and play. The restaurants seem to be expensive or need too many people (25+). I'm inviting kids (with parents) from daycare and expecting that a maximum of 10 kids will show up (and maybe 10-15 adults). 

I found 1-2 cute places that don't have a playground. But I'm worried that kids will be bored with nothing to do - after the 1 hour that the spiderman entertains. 

I did a indoor playground party last year and want to do something different this year. We are in Austin suburbs and I have been advised to find something indoor because weather can be unpredictable. 

I can't do it at my house because I don't have much space and frankly don't think I can handle 4 year olds running around wild in my house. 

I'm looking for ideas! Thanks! ",1,1737661967.0,Parenting,0,1.0,False
1i8c9j6,https://www.reddit.com/r/Market76/comments/1i8c9j6/ps4_h_240_coffee_w_pin_pointers_mod/,"(Ps4) H: 240 Coffee, W: Pin Pointers mod",,1,1737661943.0,Market76,4,1.0,False
1i8c8qh,https://i.redd.it/oszqs62ussee1.jpeg,Morning coffee watching QFA108 headed to AYPY,,4,1737661885.0,flightsim,0,1.0,False
1i8c815,https://www.reddit.com/r/r4r/comments/1i8c815/26m4f_turkey_eu_anywhere_rainy_nights_coffee/,"26[M4F] #Turkey #EU #Anywhere / Rainy nights, coffee, blankets and us?","Hello there stranger o/ I'm trying to find my one and only, maybe you're the one!? or not? Who knows?

I'll write my biggest deal breaker first so you don't have to keep reading if you're not interested.

Having lots of relationship history with intimacy. Personally I don't have ANY intimacy experience on purpose and I don't want someone with LOTS of experience/relationship history. Also if you broke up recently that's also a big no for me. No one is an aid band duh.

I'm 6.1 - 185cm muscular build, (not too shredded) wide shoulders, white skin, black hair, eyes and beard ( I don't like having a long beard so I keep it short or shave ) . You can see me from the link below.

I'm from Turkey and my ethnicity is Caucasian.

My personality type is INFP-A , I don't believe horoscopes or to any religion.

I'm a Concept/2D Artist. I draw character designs, potraits, any stuff I like.

I'm loyal, empathetic, protective, dependable and love to share every thought I have with my partner and also expect the same thing.

I love melancholy in general, I have couple of sad song playlists on Spotify.

My main hobbies are drawing, powerlifting and gaming. I also do some other stuff like playing electric guitar sometimes but who cares.

I like getting and giving attention in equal terms.

I'm also an open book, I don't hide anything.

Also, I do care about physical attraction, I'm adding my photos first so you don't have to send a message if you don't find me attractive enough. In the end everyone has a different taste.

[https://imgur.com/a/JXc3tac](https://imgur.com/a/JXc3tac)

Well if you're interested, please send me a DM with an introduction and if possible a selfie of yourself. Thank you for reading this far!",1,1737661836.0,r4r,1,0.99,False
1i8c7f8,https://www.reddit.com/r/relationships/comments/1i8c7f8/i_24f_feel_like_a_failure_a_string_of_failed/,"I 24F, feel like a failure a string of failed relationship that led to nowhere. Now I'm wondering if I will even meet someone that shares the same principles and values as me.","I know that I'm still young, and I truly believe that love is out there but honestly, with my experiences with it, I feel like I am not so sure anymore. I didn't really date anyone during school or college (during my diploma) as I was too busy grinding for good grades.  I wanted to pursue my passion of becoming a chef, so I focused on that. Ended up being successful both academically and career wise as I had the chance to work with multiple great chefs in multiple different establishments and now at one of the best restaurants in my city. However, I kind of realized I somewhat screwed up as I didn't have the chance to meet my partner during those times, and had to resort to using dating apps, which unfortunately were awful (bad dates, ghosting, people only wanting to hook up with me for my looks). I got incredibly lonely till I met my first ex unexpectedly, it was love at first sight and we loved each other, I gave her everything, took care of her and met all her needs, however she had her own grocery list of mental health issues and over two years, she tormented me mentally by constant abuse, blaming it on her depression and bipolar, I was calm and patient with her despite her constantly breaking up and coming back to me.  Her using TikTok or her psychology studies as reasoning to breakup with me, or saying she wants her 'freedom era' or 'situationship' or 'no label relationship'. I got anxious since we both met each other's parents, and my parents were initially happy with her as my partner. One day, she threw away and burnt all my things I gave her and posted it publicly, as well as cheated on me, then bragging about it to me, only for her the next same week to apologize and blame it on her mental health issues and 'emotions'. After that all i got was a 'sorry' and then I was blocked to oblivion. It was harsh but I accepted it for what it was.

That was, a year ago, I have since moved on and done a lot of things such as focusing on my passion, faith, career as well as disciplining myself to workout daily, in addition to taking care of my family and pets. I finally finished my two degrees and have received my first promotion at work. I was starting to see people and going on dates again, however I realized that most of these people only wanted situationships or hooking up, which still frustrates me. The actual times I do meet someone that wants a relationship, I get initially love bombed and then I get ghosted and blocked or saying they are afraid of 'commitment', and that they want all the benefits of a relationship without actually being in one. Honestly, its kind of disappointing and quite sad and I'm starting to wonder if It is too late to find the right person that still wants to date to marry in this era. I'm focusing on myself now, but sometimes I feel quite left out and lonely when I see all my friends, classmates and family members around my age in long term happy relationships, with most getting engaged soon, meanwhile I'm still trying to pick up the pieces and figuring out if I still have the chance for love in this lifetime. I just wanted someone that can accept me despite my flaws, for the person I am, a person I can take care off, that will be there for me, to cherish life during both our ups and downs. I miss being able to cook and make coffee for my partner too.

tl;dr , I felt like I focused too much on my career, passion and studies that I didn't had the time to find that someone, while I did met someone, that person whom I thought would love me, left me in broken pieces, While I have moved on and have a lot of self-growth now, focusing on myself as well as going out there and meeting new people, the modern dating landscape makes everything difficult for a hopeless romantic like me that just genuinely wants to date to marry now. Seeing my friends, family and former classmates getting engaged, makes me feel super lonely and failure at love, with me being the last single person in their circle doesn't help also when I'm constantly bombarded with questions of who,why, when, where and what? Do I still have a chance?",1,1737661794.0,relationships,0,1.0,False
1i8c79w,https://www.reddit.com/r/ContentMarketing/comments/1i8c79w/quitting_my_job_to_sell_plants_in_pubs_the_wild/,Quitting My Job to Sell Plants in Pubs - The Wild Ride to a $200K Payday,"Back in 2011 I hated my job so much, I quit, to sell pot plants in pub car parks. My Mum was very embarrassed.

“Dan, you went to a private school for god sake!”

My Dad said nothing. But later told me, he was secretly proud as punch. He knew I was going to be OK…

… because I didnt give a F$CK what other people thought.

Why did he tell me later though?

Lol…

Because I FAILED miserably, and had to go back to the 9-5.

In 2013, I started an SEO company. It was totally ‘black hat’, I didn’t put the work in. I was looking for a ‘get rich quick’ biz. Guess what, that failed too when Google spanked me badly.

Naughty boy Danny!

Back to the engineering job designing poo plants (long story)

Man… I struggled.

My mates nicknamed me “Dreamworld Wardrope”. To be honest, I am just like YOU! I would say my superpower, if anything, is simply getting up and going again.

In 2016, I found Pay Per Lead.

And made good money…

…but

… in 2023 I figured out how to get people to:

* Lend me their databases
* Let me sell THEIR product or service using AI and SMS
* Let me keep up to 50% 

Then, I became as free as a bird. Both financially and ‘in my head’. It’s a brand new AGENCY model.

For some, even a side hustle. I never thought it would work. But it did. In 2025, it’s even easier now and AI is in such HOT demand…

Yet…

NOBODY except folks who got [the Instant AI agency](https://honeysyed.com/aiagency) book are doing it.

Like this ROYA man…

He just raked in…

$200K run rate in 3 weeks.

[200K run rate](https://preview.redd.it/7mapbew1ssee1.png?width=512&format=png&auto=webp&s=8ec55d79944f9b8bfea90dc831ea8aa9fe456c9f)

Not his Database. Not his Product or Service. No Facebook Ads. No Google Ads. No Landing Pages. No Sales Team. No Commission Only Appointment setters.

But he’s getting 50% of every dollar brought in.

Again…

NOBODY is doing an AGENCY or SIDE HUSTLE the way we do it. Give it a try.",0,1737661784.0,ContentMarketing,0,0.33,False
1i8c74a,https://i.redd.it/1js9o1clssee1.jpeg,Soup Stroll this Saturday 1/25 11-4! $1 per sample at 32 different locations!,,10,1737661774.0,schenectady,2,1.0,False
1i8c6bi,https://www.reddit.com/r/Market76/comments/1i8c6bi/h_random_food_w_offers/,H: Random Food W: Offers,"5 Canned Meat Stew

100 Coffee

41 Nuka Cranberry

43 Salt ",1,1737661716.0,Market76,1,1.0,False
1i8c5i4,https://v.redd.it/tz5u9cx8ssee1,Void Barista,Morrissey tries to bury any coffee I drink ,0,1737661659.0,blackcats,0,0.5,False
1i8c5i1,https://www.reddit.com/r/bigbangtheory/comments/1i8c5i1/the_wildebeest_implementation_episode_not_cool/,The Wildebeest Implementation episode not cool after MeToo Movement,"The Wildebeest Implementation episode not cool after MeToo Movement 

This episode would never fly after METOO movement. Raj tries the experimental drug that will help him talk to chicks so him and Sheldon go to a coffee shop to test it out. Raj has he courage to talk to a cute girl Angela and even says some nice smooth things about her name, then he blows everything by stripping naked for no reason at all. He even says she never got to see his penis. 

This episode would not FLY after the METOO movement. Also although implied the show never fully explains why Raj even did that. We the audience assume it was the experimental drug that caused him to do this but no one on the show confirms this. Also would any drug actually make you strip down and expose your penis in real life? Would a drug like Molly or extc??? I don't think so. I don't do drugs but for those of you who have experimented would any drugs actually cause you to do what Raj did in public too?

",0,1737661659.0,bigbangtheory,4,0.29,False
1i8c4t7,https://www.reddit.com/r/EDAnonymous/comments/1i8c4t7/obnoxious_attention_seeking_friendship/,obnoxious attention seeking “friendship”,so this coworker of mine is always seeking me out telling me things about her life that I never asked it’s basically the basis of our relationship for years it’s all about her never seems to care or notice that I don’t give a shit and have no interest in knowing what “her mom said she should do” or what “her boyfriend said yesterday” but I grit my teeth and bare it cuz we’re direct coworkers and I’d rather be polite than have bad blood. Yesterday she’s like let’s go to a coffee shop for lunch break. Ok sounds good. She gets a large smoothie. Later that day I have to hear all about how “she told her boyfriend ‘all I had for lunch today was a smoothie!’” And her boyfriend said ‘wow are you ok you’re not eating much!’ And then she proceeded to giggle so fucking much for like a minute straight after telling that lame pathetic story. She directly does stuff like this all the time just to get a reaction out of people like that. She’s had a few of these phases before where all she does is send me snapchats of how many miles she walked on the tread mill today and how healthy she’s eating now ( and it will be like a giant plate of potatoes and gravy and meatballs?) she normally eats a large Big Mac meal with a Coke almost everyday for lunch. it makes me fucking feral because I never asked to know any of this information I couldn’t give a fuck less what you do or eat. Today im not even at work and she texts me “hey do u wanna eat lunch together today i just packed my own lunch today something small and light that’s all i really need” GET OUT OF MY FACE OMG I wish i was joking. I keep leaving all her treadmill pics and any mentions of food like that on read and I don’t think she gets the picture. It’s honestly so bad because it’s somehow making me wanna get worse again just out of spite of how pathetic her attempts for attention are. I’ve been semi recovered the past 20 days or so but idk ,1,1737661609.0,EDAnonymous,0,1.0,False
