id,url,title,text,score,created_utc,subreddit,num_comments,upvote_ratio,over_18
1jupdpq,https://www.reddit.com/r/askgaybros/comments/1jupdpq/whats_something_you_love_doing_alone_in_your_own/,What’s something you love doing alone in your own city?,"I’m trying to romanticize solo time more — not just big trips, but the little local adventures. Whether it’s hitting up a museum, grabbing coffee with a book, going to the movies, or just wandering around new neighborhoods, I feel like there’s something special about enjoying your own company.

So I’m curious — what’s your go-to solo activity where you live? Or something you’ve always wanted to do but haven’t yet?",1,1744148405.0,askgaybros,1,1.0,False
1jupd00,https://www.reddit.com/r/ScientificNutrition/comments/1jupd00/brain_boosting_supplements/,Brain boosting supplements,"Hello,


My diet is rather good. I mostly eat home made meals , with the occasional snack or two. Pretty active as well.


My sleep has not been the best, but I feel rested after just 5 hours of sleep. I drink 3 to 5 coffees a day.


I study a lot and I want to remember as much as possible and I would like to keep my brain sharp as long as possible. I know, that sleeping is essential, but 5 hours is just as good as 8 (tested it for me).


I would like to boost my brain even further.


What would your recommendations be for supplements? Thank you in advance.",1,1744148355.0,ScientificNutrition,0,1.0,False
1jupcgq,https://i.redd.it/ocdh2kzekote1.jpeg,holy fucking shit,,2,1744148316.0,profanitycounter,0,1.0,False
1jupbuv,https://www.reddit.com/r/robotics/comments/1jupbuv/robot_arm_for_automated_espresso_machine/,Robot arm for automated espresso machine,"Hello i am a software dev and i have this stupid idea. 

I want make my own IPhone app that is connected to a robot arm. 

I want to Press a button on my phone. And then i want a robot arm to take my porta filter Press it Down on my grinder.

Then insert into machine, then grab coffee cup and then Press start on my machine. 

I was thinking of buying a robot arm with a budget of around 1k usd, is this viable with my budget and if so does anyone have any recommendations on what/which robot arm to buy? 
",4,1744148271.0,robotics,1,1.0,False
1jupbma,https://www.reddit.com/r/nosleep/comments/1jupbma/the_job_was_simple_monitor_the_woman_in_room_6/,The job was simple: Monitor the woman in Room 6. She’s been asleep for 42 days.,"I took the job because I needed quiet.

I had just moved back into the city after a really bad year - breakup, job loss, a fire that took half of what I owned. I was couch surfing when I saw the listing. Overnight shift. Private sleep study. No experience necessary, just basic data entry and the ability to stay awake. I figured I’d get some peace, maybe save up enough to afford rent somewhere that didn’t smell like damp carpet and stale weed.

The company was called SomnoTech. I Googled them. Not much came up. One old article in a university medical journal talking about “experimental treatments in chronic sleep disorder recovery,” and a barebones website with a contact form. The building I was sent to looked more like an office for defunct insurance than a lab. Beige, windowless, buzzed me in through two locked doors. Everything inside was silent and clean. No logos. Just halls that didn’t echo.

They gave me a laminated badge and walked me to Observation Room 6. It had one long window, a chair, three monitors, and a clipboard. That was it. Beyond the glass: a white-walled room, padded corners, one hospital-style bed with a woman laying perfectly still on it. Wires across her scalp. Pulse oximeter. Blood pressure cuff. Breathing tubes. The usual. The kind of image you’d see in a medical drama.

Her name was Marla. That’s all they told me.

“She’s not in a coma,” the lead technician - Dr. Ellis - said. “She’s asleep.”

I asked how long.

He said, “Forty-two days.”

That was when I almost walked out. But the pay was too good, and I told myself it was harmless. Just keep a log. Note her REM cycles. Don’t go in the room.

They emphasized that. Over and over.

**Never enter the room.**

I asked what would happen if she woke up.

Dr. Ellis paused for too long before he answered,

“That’s… not expected.”

That first night, nothing happened.

She lay still, vitals normal. Every couple hours her eyes flickered beneath the lids. Standard REM activity. Once, around 2:30 a.m., her hand twitched. I logged everything. I didn’t sleep, didn’t even look away much. Just sat and stared, drank vending machine coffee, and listened to the soft beep of monitors that never changed.

It wasn’t until the third shift that she moved.

Not much. Just shifted in bed. Rolled slightly. Her breathing deepened. That’s when I noticed something strange - the audio feed picked up sound from her room, but it was... too clean. No background noise. No rustle of sheets. Just her breathing.

Then she said something. A whisper.

I hit replay.

She’d said a name.

My name.

My full name.

No one else at SomnoTech knew it. I’d used an alias on the application, something I did out of habit after a few years of gig jobs. But what she said - what she mouthed - was my real name.

The one I haven’t used since I left home.

I showed the recording to Dr. Ellis.

He watched it, twice, without expression.

“It’s likely a coincidence,” he said. “The dreaming brain replays fragments of memory. She may have seen you on the way in.”

“She’s been asleep for six weeks.”

“She’s responding. That’s good. Keep documenting.”

He walked out before I could ask anything else.

The next few nights, I tried to convince myself it was nothing. I told myself it was a coincidence. That it didn’t mean anything. But she kept saying it.

Night after night. Just my name. Sometimes fast, sometimes slow. No sound - just the shape of it, over and over. Her mouth moving in that same rhythm. I stopped drinking the coffee. Started staying stone-cold sober for every shift.

On the 23rd day, everything changed.

At exactly 3:07 a.m., Marla sat up in bed. Her eyes were still closed. She turned her head, slowly, toward the camera in the top corner of the ceiling. And then, without hesitation, she pointed at it. At me.

I didn’t move. Didn’t breathe. Just stared as she pointed, waited five long seconds, then laid back down. 

I radioed it in.

“She’s dreaming about you,” the tech on call said. “That means it’s working.”

“What’s working?”

No response.

When I arrived the next night, I was given a new form to sign. It was labeled ‘**Phase Two Observation Protocol**.’

Most of it was boilerplate NDA language, but two lines stuck out:

*Observer must not leave the premises until Phase Two is complete.*

*Observer must report all subjective experiences, including dreams, during or between shifts.*

They were asking me to log my own sleep. When I pointed out that I wasn’t supposed to be sleeping on shift, the night tech said,

“You’ll understand soon.”

Marla began crying on Day 31. At first, it was soft. Then sobs - raw, broken, painful. Her vitals didn’t spike. Brain activity remained stable. But the sound of her grief came through the speaker like it was close. Not recorded. Not filtered. Like she was in the room with me.

I started sleeping in two-hour blocks. I couldn’t stay awake anymore. My body was shutting down. 

And then the dreams came.

First night: I’m standing in the hallway of the lab. Only it’s longer. The walls are too narrow, the ceiling too low. At the end of the hallway, there’s a door. Behind it, whispering.

Second night: Marla is sitting in the chair I use. Writing something. Every time I try to speak, she looks up and smiles. Her eyes are still closed.

Third night: I’m in the observation room, but the monitors show me, sleeping. Marla’s bed is empty.

I started documenting the dreams. Every detail. I showed them to Dr. Ellis. He didn’t even blink.

“You’re syncing,” he said.

“Syncing with what?”

He just said, “The bridge needs a guide.”

I stopped asking questions. I stopped pushing. I didn’t have much choice.

I started working double shifts. Eighteen hours on, six off. I slept at the facility. They put me in a bunkroom in a hallway I’d never seen. I thought it was just exhaustion, but when I tried to leave the building after that shift, my badge was deactivated. The front doors stayed locked. I went back to the observation room.

Marla was sitting up in bed, hands on her face, still crying. She’d been crying for nine days straight.

I didn’t eat. Didn’t sleep. I started taking the pills they left by the coffee machine. They didn’t help. My vision blurred. My hands shook. Every time I looked in the mirror, I saw bags under my eyes, my face pale and gaunt.

I wasn’t there anymore. I was just in the room. Staring. Always staring.

And then Marla opened her eyes. Just for a moment, just a fraction of an inch, but they were open. Not white, not rolled back. She was looking at me. Her pupils were there. Focused. She held my gaze for a breath, then closed them.

I tried to call Dr. Ellis. My radio didn’t work anymore. The lights went out. The only thing left was the audio feed. Her soft crying. And then, she said my name again.

That’s when I noticed.

My clipboard was empty. Every log, every note, every dream I’d written down - gone. I grabbed for the stack of old forms from the drawer under the monitor. They weren’t there. Not even the signature pages. Just hundreds of blank sheets.

I looked up at the monitors. The leftmost screen was blank. I hadn’t noticed it. Was it always like that? It was dark. No vitals. No video. Just a black screen with a single white label - my name.

Marla pointed at it. The crying stopped.

She stood up and walked to the window. I felt cold. My blood slowed. My heart pounded in my ears. Then she reached out and touched the glass. And for the first time, the audio picked up more than her breath. It picked up mine.

I backed away. But there was nowhere to go. The door was locked. Marla stared at me through the window, and her expression changed. Her brow furrowed. Her mouth opened. I watched the shape of a question form on her lips.

Suddenly, I was in the room. Not the observation room. Her room.

My hand touched the bed. Cold sheets. The air smelled sterile. There was one window. No monitors. I was on the other side of the glass. I was in the bed.

I looked over the edge of the mattress and saw myself. I was sitting in the observation chair. Writing on a clipboard. My eyes were open but blank. The rightmost monitor showed vitals, but they weren’t Marla’s. They were mine. My breathing, my heart rate.

And on the leftmost monitor, just darkness. 

Marla stood in front of the window in the observation room and pointed at me. She mouthed something over and over again. Not my name. Not this time. I couldn’t understand it. I tried to get up. To reach for her. But I couldn’t move.

She took one step back and turned toward the door. I heard it open. Someone walked in, someone I couldn’t see. Marla said something else and then walked out. The audio feed stayed active. I heard footsteps. A new set of footsteps, heavier, slower, dragging. And then a new voice. It wasn’t Marla’s. It was mine. 

I tried to scream. The audio feed went dead.

The next time I woke up, the observation room was dark. The silence was too deep. It felt like the building had been abandoned for years.

I pulled the blanket off me. My legs were weak. My mouth tasted of copper. I stood up, slowly. The air was freezing. My breath came out in clouds. The window was dark. All the lights were off.

But when I looked at the ground, I saw I wasn’t standing on the floor. I was standing on glass. 

And on the other side - a new girl in the chair. 

Only, she wasn’t looking up at me.

She was looking *at* me - straight on - as if her world tilted at a different angle. As if she were seated upright in a room that existed sideways beneath mine. Her gaze didn’t drift. Her neck didn’t crane. She met my eyes like we were sitting across from each other, not separated by gravity and glass. 

I dropped to my knees, pressing my hands to the pane. 

She watched me. Pale, shaking, eyes wide with fear. She looked like she’d been crying. Like she’d seen something she didn’t understand.

I recognized myself in her face, but it wasn’t me. It couldn’t be.

Because behind her, on the far side of the darkened room, there was a figure standing in the corner.

It was me. The other me. The one that sat in the chair. Its eyes were open, and it was smiling. And on its lap: an empty clipboard, waiting to be filled. 

\*\*\*\*\*\*\*\*\*\*\*\*\*\*\*\*\*\*\*\*\*\*\*\*\*\*\*\*\*\*\*\*\*\*\*\*\*\*\*\*\*\*\*\*\*\*\*\*\*\*\*\*\*\*\*\*\*\*\*\*\*\*\*\*\*\*\*\*\*\*\*\*\*\*\*\*\*\*\*\*

It’s been four months since I arrived at SomnoTech. I haven’t slept in three. I’ve written all of this down. I’m not sure how many times. I don’t know how much is real.

The girl in the chair doesn’t look at me anymore. She stopped crying. She stopped moving. She’s becoming like the other one. The smiling one. The one in the dark. The one who’s waiting for its turn.

I don’t want to know what comes next. I don’t think anyone does. But it doesn’t matter what we want. All that matters is what it wants. And it’s getting closer. I can hear it in the walls. I can feel it in my skin. I can see it in the reflection.

And once that happens, there’s only one thing left. One final step. One last phase.

This isn’t a dream. It’s not even a nightmare.

It’s the thing waiting *after.*

And we’re already in it.

We’re all already asleep.

And we don’t even know it yet.",5,1744148254.0,nosleep,0,0.86,False
1jupbex,https://www.reddit.com/r/TinnitusTalk/comments/1jupbex/how_long_does_caffeine_spike_your_tinnitus_for/,How long does caffeine spike your tinnitus for?,"I have only had tinnitus for the last couple of months. It was brought on by a medication taper and then I had three very full balloons pop while I was holding them which made it worse. I absolutely love coffee and I’ve drunk it since I was a teenager but I have noticed that it sadly flares my tinnitus. I love coffee so much that I’m considering just waiting out the spikes that it causes every day, but I’m aware that that’s not the best idea. If you still drink coffee, how long do your spikes last after drinking a cup? ",1,1744148237.0,TinnitusTalk,1,1.0,False
1jupbd8,https://www.reddit.com/gallery/1jupbd8,Scratches on my 14k gold engagement ring,"I noticed the large scratch today and wonder, is this normal for 14k gold? I've had my engagement ring since January 2024, so it's only been a little over a year. It was custom made by a reputable company.

I only wear it to work and special outtings. I have a desk job but I do on occassion hit it on my desk because it's a high setting. 

I do not wear it: in the evenings at home, while showering, while doing dishes (with the exception of my coffee mug at work), while sleeping, while exercising, while grocery shopping (unless we go straight from work), etc. It mainly sits in the ring box it came in on my bedside table.

So why is the band so scratched?",1,1744148234.0,EngagementRings,1,1.0,False
1jupb7s,https://www.reddit.com/gallery/1jupb7s,Last *5s. Let's trade.,Make it happen. ,1,1744148223.0,Monopoly_GO,7,1.0,False
1jupb2x,https://www.reddit.com/r/childfree/comments/1jupb2x/parents_with_kids_always_nap_at_family_gatherings/,Parents with kids always nap at family gatherings,"In wondering if this is common. One particular family with kids always take a nap at family gatherings while we or other family members play with or watch the kids. 

The parents will eat and hang out for a bit. Then run away to go nap. We could be at their home or another relatives home. It happens almost every single time. 

Recently at a small gathering, that wife wanted to go get coffee with me, leaving the kids with her husband, my husband, and two other family members. The minute her husband found out she was also leaving he ran away to go nap upstairs.

I totally get it! They need to take care of themselves and take advantage of times they can rest. I just find it rude to do this at every single gathering. It’s also kind of entitled to expect other people to watch your kids. 

I remember a lot of family gatherings growing up. I don’t think my relatives did this type of thing back then. ",6,1744148213.0,childfree,2,1.0,False
1jupaoh,https://www.reddit.com/gallery/1jupaoh,Need and have,Help ,1,1744148186.0,Monopoly_GO,1,1.0,False
1jupakd,https://www.reddit.com/r/AskMenAdvice/comments/1jupakd/in_need_advice_for_a_girl_at_work_m19/,In Need advice for a girl at work (M19),"So I started my job about 2 and a half weeks ago. My mom worked there before I did and she teaches and there’s a girl that also works in the same classroom as her. My shift ends at 2pm but the girl, my mother, and the main teacher don’t leave till 2:30 (being the TA’s and the teacher) so I go in and hangout and talk with them till 2:30. I talked to the girl the first day being there and thought she was rlly nice and pretty. Since then I’ve seen her almost everyday and we talk when we can but I actually rlly like talking to her and find her to be one of the prettiest girls I’ve ever met. She’s 2 years older than me in case that matters with details. I’m a big believer in the saying “don’t shit where you eat” but I would love to get to know her better outside of work. Like taking her to lunch someday or grabbing coffee or even going for a walk would be awesome. I rlly wanna get to know her and spend time with her but if it goes wrong then it’s an awkward moment for both of us in the workplace. Any advice is much appreciated🙏",1,1744148177.0,AskMenAdvice,1,1.0,False
1jupaj9,https://www.reddit.com/r/tinnitus/comments/1jupaj9/how_long_does_caffeine_spike_your_tinnitus_for/,How long does caffeine spike your tinnitus for?,"I have only had tinnitus for the last couple of months. It was brought on by a medication taper and then I had three very full balloons pop while I was holding them which made it worse. I absolutely love coffee and I’ve drunk it since I was a teenager but I have noticed that it sadly flares my tinnitus. I love coffee so much that I’m considering just waiting out the spikes that it causes every day, but I’m aware that that’s not the best idea. If you still drink coffee, how long do your spikes last after drinking a cup? ",1,1744148175.0,tinnitus,3,1.0,False
1jup8p4,https://www.reddit.com/r/FemFragLab/comments/1jup8p4/fake_replica_coffee_break/,Fake Replica Coffee Break,"I just received a bottle from eBay and it’s got to be a fake because the label has a misspelling 🤦‍♀️ 

Just contacted the seller, but wondering if anyone else has ever filed an eBay claim for this ? ",2,1744148045.0,FemFragLab,0,1.0,False
1jup8n2,https://i.redd.it/efmhyodljote1.jpeg,Offering 5x3⭐️ for Inspired By,,1,1744148040.0,MonopolyGoTrading,0,1.0,False
1jup81d,https://www.reddit.com/r/ForeverAloneDating/comments/1jup81d/35_m4f_san_jose_california_my_next_chapter/,"35 [m4F] #san Jose #california, my next chapter","


35 male from San Jose, Seperated looking to start dating again. Have kids, but not full time. Looking for a normal mature woman for a little physical and emotional connection. Plus if you have kids so you can relate to me. 

I’m educated and work in a field with majority males ( don’t worry, not a tech bro) so I don’t interface women often. I’m 5’8, full head of hair and told that I’m handsome often. I’m weight and height proportional, muscular but not a total gym rat. Don’t have a body type but do require weight and height proportionate, slightly chubby is fine. I am a sucker for super pretty faces. Any height is fine including taller.

I’m a nerdy gear head that loves machines as well as food and coffee. I’m a man’s man but very emotionally intelligent. I also love to be in the kitchen, whether it’s cooking or baking. Also coffee, I love coffee and matcha. 


Hoping to take it slow and swap pics, and if there’s a connection, meet for coffee. 

Let me know more about you!
",1,1744147994.0,ForeverAloneDating,1,1.0,False
1jup7sm,https://youtu.be/nFtw9XlTv8s,"Coffee Maker -- Arturia Microfreak, EP-133 KO II, and PO-28 Robot (storyjam)",,1,1744147977.0,Arturia_users,1,1.0,False
1jup72o,https://www.reddit.com/gallery/1jup72o,Lf standing ovation,,2,1744147925.0,MonopolyGoTrading,4,1.0,False
1jup6ya,https://www.reddit.com/r/dating_advice/comments/1jup6ya/i_m30_want_to_ask_out_a_girl_f25_in_university/,I (m30) want to ask out a girl (f25) in university but I fear rejection would make it weird between us in class,"So I'm in my last semester in my master studies and I got to know this girl in university, which I get along pretty well with. We write regularly and she sends me voice messages. It is still pretty new and we just get to know each other but I feel like there is a chance of asking her out casually.

I could be wrong but she might be interested, too. She laughs at some of my jokes and the writing/voice messages feel like as if she wouldn't be opposed if I ask her out. It is still a thin line between her just being nice and her being genuinely interested. She also could be open in a friendship or even be in a relationship. I didn't ask because there wasn't an opportunity really but a part of me thinks, she would have told me by now, if she would've a boyfriend.

So we're right now at a point in our messages, where I could ask her out for a coffee. That would also not really indicate what my intentions are but if I ask her out, my fear is that she might reject me and then it will get weird between us in class. I do not want that but waiting until the semester ends also feels weird if you know what I mean.

I feel like if I wait I could miss my chance and/or she will lose interest. Idk man. Can't think clearly that is why I write here and need some input honestly.",0,1744147916.0,dating_advice,3,0.5,False
1jup6mi,https://www.reddit.com/gallery/1jup6mi,Looking to trade 1:1,,3,1744147891.0,Monopoly_GO,4,1.0,False
1jup6bl,https://www.reddit.com/r/stopdrinking/comments/1jup6bl/day_2_still/,Day 2 still…,"This is my second post today. Day 2 is hitting me hard: brain fog, fatigue, anxiety… Deep down I know I just need to survive today, then tomorrow, then the day after. But thinking about tomorrow gives me chills.

I’ve got B-complex, magnesium, milk thistle, and ashwagandha (recommended by AI), but so far, it doesn’t seem to help.

I’ll try to go to bed earlier tonight. I’ve rescheduled all my appointments for tomorrow (my usual routine after hangover hell). Somehow, despite heavy drinking, I’ve managed to grow my business — still a mystery to me.

The biggest fear? Tomorrow I have to drive 60–80 miles, install commercial oven parts, and talk to customers.
And every time I leave the house lately, I feel like I’m dying — high heart rate, tachycardia, etc.

So here’s my plan for tomorrow:
	•	No rushing. Do everything slowly and smoothly.
	•	Take my ashwagandha (for cortisol), B-complex, and milk thistle (for liver support).
	•	No coffee or energy drinks.
	•	Light breakfast.
	•	Listen to an audiobook while driving.

And most importantly: IWNDWYT — or any other day.

Thank you for letting me share this. It really helps.",5,1744147868.0,stopdrinking,5,1.0,False
1jup52p,https://www.reddit.com/r/AskDocs/comments/1jup52p/cardiologist_told_me_i_was_fine_5_days_later_i/,"Cardiologist told me I was fine, 5 days later I almost died of heart attack","Location: Florida, USA.

I have little experience with the US medical and legal system as I didn't grow up here. I want to understand if this is a case I can pursue and sue the hospital/doctor (?).

I had been having episodes of high blood pressure and chest pain/discomfort. I was traveling to another country and went to ER, they ran an EKG and said it was normal. Told me to go to the cardiologist.

Back to the US I went to see a cardiologist for the first time in my life (40M). I reported my symptoms (visit summary shows: ""high blood pressure, chest pain, abnormal EKG"") and they ran an EKG which the doctor said there was a ""little thing"" but nothing worrisome. She asked me for an echocardiogram and a stress test (one month out).

Fast forwards only 5 days, I start having high blood pressure and chest pain again, this time stronger than ever. I didn't sleep a whole night. I sent the doctor a message about the blood pressure and pain, she told me to do ""some breathing exercises and avoid phone, TV, alchohol, and coffee"".

In the morning I couldn't stand it anymore and went to ER. The EKG was horrible, they rushed me into catheterism, removed a blood clot from one of the main arteries of the heart (AKA the widow maker) and put a stent in it. It was full blockage, a massive heart attack.

If it wasn't for me listening to my body (and not this doctor), I'd be dead now.

Can I do something about it or these cases are usually rejected with the idea that ""health isn't an exact science"" or that ""there were no signs, so we couldn't tell""?",23,1744147778.0,AskDocs,8,0.9,False
