id,url,title,text,score,created_utc,subreddit,num_comments,upvote_ratio,over_18
1ij958f,https://www.reddit.com/r/AITAH/comments/1ij958f/aitah_for_being_mad_that_my_partner_left_gum/,AITAH for being mad that my partner left gum under the coffee table like we live in a bar?,"that’s it really. According to him, it’s just my opinion that that is wrong and not acceptable to do in one’s home. ",2,1738865530.0,AITAH,2,1.0,False
1ij94rj,https://v.redd.it/5god5bov7khe1,Star Wars Mug and Coffee Set,,1,1738865497.0,Bestfindsforu,1,1.0,False
1ij93ji,https://www.reddit.com/r/chapelhill/comments/1ij93ji/whats_going_on_at_wholefoods/,What's going on at WholeFoods???,"Yesterday, I had a business meeting at Whole Foods in Chapel Hill. Some important people were coming to Chapel Hill to meet with me, so I picked the spot. I chose WF. What a mistake. There was no coffee. I asked the manager where the coffee was at their coffee bar, and she said, ""Oh, we don't start serving coffee until 11. We had a hard time staffing that position, so we just changed it.""  WTF??? I let her know that for years, I have been going out of my way to grab a coffee at WF. Unflinching, she responded, ""Yep, well, you can get a coffee after 11."" 

This feels like country club-level complaining, but at the same time, they've stopped selling their overpriced breakfast burritos/tacos and other hot bar breakfast things, their sandwich operations are non-existent during lunch times, their pizza has gone completely downhill, their sushi is now $18, and they're consistently out of stock on typical green produce. I have always been a WF fanboy and have spent tens of thousands of dollars with the brand over the years, but holy shit, have they disappointed me and my expectations over the past several months. Is anyone else noticing this, or is it just me? 

I no longer have a reason to go there. ",0,1738865413.0,chapelhill,1,0.5,False
1ij939w,https://i.redd.it/okbtogzk7khe1.jpeg,Let's have a cup of coffee ☕,,1,1738865396.0,AiAnimeArt,0,1.0,False
1ij92ff,https://www.reddit.com/r/energydrinks/comments/1ij92ff/top_3_bang_flavors/,Top 3 Bang flavors?,"I’ve tried every flavor since I was 14. Here are my top 3, and keep in mind you might have a different opinion than me, which I can respect.

1: Cotton Candy

2: Radical Skadattle

3: Purple Haze

Honorable mentions include Lemon Drop, Black Cherry Vanilla, Birthday Cake Bash, Star Blast, Sour Heads, Champagne, and Rainbow Unicorn.

My least favorite flavors were the keto coffees and Power Punch.",1,1738865336.0,energydrinks,1,1.0,False
1ij91my,https://i.redd.it/1v0s5ol87khe1.jpeg,Any clones? Anything Similar please,,1,1738865280.0,fragranceclones,1,1.0,False
1ij91kz,https://www.reddit.com/r/CERN/comments/1ij91kz/cern_interns_when_you_ask_about_free_coffee/,CERN Interns When You Ask About Free Coffee,"You ask about the coffee machine, and suddenly you’re hit with a 30-minute lecture on the quantum mechanics of caffeine extraction. Meanwhile, a ""CERN-Only"" coffee cup remains a mystery, like some elusive particle. Outsiders? They get the basic Keurig treatment. Us? We’re negotiating with a Higgs boson for that perfect espresso.",1,1738865276.0,CERN,0,1.0,False
1ij9169,https://i.redd.it/oosl8ha57khe1.jpeg,Sarah Michelle Gellar’s post about the in development Buffy reboot,,2,1738865249.0,Fauxmoi,1,1.0,False
1ij8zyp,https://www.reddit.com/r/PuertoRicoTravel/comments/1ij8zyp/rate_this_6_day_trip_itinerary_from_chat_gpt/,Rate this 6 day trip itinerary from Chat GPT,"Thoughts on this itinerary?  


I'm thinking of cutting out the plan for day 4 in favor of another day in Rincon.  


Is there decent surf close to San Juan? Would like to get another session in before my flight.  
\---  
  
Here's a **6-day active itinerary** for your trip to **Puerto Rico (Feb 13–19)**, balancing **surfing in Rincón** with **outdoor adventures across the island**. You'll land in **San Juan** late on Feb 13, so the real adventure starts the next morning.

# Day 1 – Feb 14: Drive to Rincón & Surf 🌊

* **Morning:** Pick up your rental car and drive **2.5 hours west** to **Rincón**, the island’s surfing capital.
* **Brunch:** **Coconut Ice Cream** at **The English Rose** or a smoothie bowl at **The Beach House**.
* **Afternoon:** First surf session at **Domes Beach** (good for all levels).
* **Evening:** Sunset at **Steps Beach**, grab fish tacos at **La Cambija**.
* **Stay:** In Rincón (options: **Casa Verde Hotel, Rincon Surf Resort, Airbnb near the beach**).

# Day 2 – Feb 15: Surf & Explore Rincón 🏄

* **Morning:** Surf at **Maria’s Beach** (good for intermediate surfers, mellow waves).
* **Brunch:** **Tamboo** for oceanfront dining.
* **Afternoon:** Hike to **Gozalandia Waterfalls** (1-hour drive, freshwater swimming & cliff jumping).
* **Evening:** Sunset session at **Sandy Beach**, followed by dinner at **Pool Bar Sushi**.

# Day 3 – Feb 16: More Surfing & Bioluminescent Bay 🌌

* **Morning:** Surf at **Tres Palmas** (big waves, reef break).
* **Brunch:** **Jack’s Shack** for a post-surf meal.
* **Afternoon:** Drive **1.5 hours east** to **La Parguera**.
* **Evening:** Take a **bioluminescent bay tour**—kayak or boat through glowing waters.
* **Stay:** Near La Parguera or head back to Rincón.

# Day 4 – Feb 17: Drive Back to San Juan via Adventure Stops 🚙

* **Morning:** Early surf session at **Domes Beach**, then check out.
* **Midday:** Drive back towards San Juan, stopping at **Cueva Ventana** (cave hike with an epic valley view).
* **Evening:** Arrive in **San Juan**, dinner in **Old San Juan** (try **Marmalade** or **Casita Miramar**).
* **Stay:** In **Old San Juan or Condado**.

# Day 5 – Feb 18: El Yunque Rainforest & Beach Hopping 🌿🏝️

* **Morning:** Drive to **El Yunque National Forest** (hike to waterfalls, natural slides, and scenic lookouts).
* **Lunch:** Stop at **Luquillo Kiosks** (local eats by the beach).
* **Afternoon:** Beach hop—**Playa Escondida** or **Playa La Pared** (if you want more surf).
* **Evening:** Return to San Juan, check out nightlife in **La Placita de Santurce**.

# Day 6 – Feb 19: Final Adventure & Departure ✈️

* **Morning:** Explore Old San Juan (Castillo San Felipe del Morro, colorful streets, coffee at **Café Cuatro Sombras**).
* **Brunch:** Try **Pinky’s** or **Caficultura**.
* **Afternoon:** Relax at **Condado Beach** before heading to the airport for your **4pm flight**.",1,1738865169.0,PuertoRicoTravel,0,1.0,False
1ij8zwy,https://www.reddit.com/r/u_IcyMasterpiece8501/comments/1ij8zwy/how_i_made_my_first_100k/,How I made my first $100k…,"It was a crisp spring morning in 2015 when I sat at my desk, staring blankly at my computer screen. I had been working tirelessly for months, pouring my heart and soul into my business. As a young entrepreneur, I had always dreamed of making a name for myself and achieving financial success.
I had started my company, a small marketing firm, just a year ago with a handful of clients and a lot of determination. I had spent countless hours networking, pitching, and hustling to grow my business. And it was finally starting to pay off:
As I sipped my coffee and checked my email, I saw a notification from my accountant. My heart skipped a beat as I opened the message and saw the words ""Congratulations, you've reached a milestone!"" My eyes widened as I read on, and my jaw dropped when I saw the number: $100,000.
I couldn't believe it. I had done it. I had made my first $100,000. Tears of joy and relief welled up in my eyes as I thought about all the hard work and sacrifices I had made to get to this point.
I immediately called my best friend and business partner, Rachel, to share the news.
She
screamed with excitement
on the other end of the line, and we both burst out laughing. we had been through so much together, and this moment was a testament to our dedication and perseverance.
I spent the rest of the day in a daze, feeling like I was walking on cloud nine. I took a walk outside, enjoying the sunshine and the feeling of accomplishment that came with it. I thought about all the people who had supported me on my journey, from my family to my mentors, and I felt grateful for their love and encouragement.
As the day went on, I started to think about what this milestone meant for my business. It meant that I could finally take a breath and enjoy the fruits of my labor. It meant that I could invest in new projects and hire more staff to help me grow. It meant that I could finally start to build a life outside of my business, one that included travel, hobbies, and time with loved ones.
That evening, I celebrated with Rachel and a few close friends at a fancy restaunant raised a glass.of champagne and toasted to my success. As I looked around the table, I knew that this was just the beginning. I had worked hard to get to this point, but I was ready for the next challenge.
The feeling of making my first $100,000 was indescribable. It was a mix of emotions - excitement, relief, gratitude, and pride. It was a reminder that all the hard work and sacrifices had paid off, and that I was capable of achieving anything I set my mind to.
As - looked back on that moment, I knew that it was a turning point in my life. It was a reminder that success is not just about the money, but about the journey, the people you meet, and the lessons you learn along the way. And it was a reminder that with determination, hard work, and a bit of luck, anything is possible.",1,1738865166.0,u_IcyMasterpiece8501,0,1.0,False
1ij8zhs,https://www.reddit.com/r/Agoraphobia/comments/1ij8zhs/do_you_ever_get_frustrated_with_how_long_it_takes/,Do you ever get frustrated with how long it takes to heal? Do you ever get back to 100% normalcy?,"I think I just need to rant 🥲. I have a long history of anxiety and even panic attacks. Agoraphobia was never an issue until March of 2023.. I guess hindsight I can see how it started to spiral from the summer of 2022. I had stopped driving at that point and then slowly started again through the fall and winter and then in February 2023 had my worst panic attack to date and completely stopped. March 2023 I was completely housebound. I’ve been in therapy for a little over a year and it helps. I’m not housebound but I struggle.. 

I guess I see how therapy works and it gets easier but I’m also just SO frustrated. I used to travel solo and would do anything to not be home and not I’m like panicked to stand in a line at the coffee shop etc. Do you ever just get to a point where you can go do things and not have to think about it?! 

I miss my friend saying hey want to go to target and just hopping in the car and going for no reason without a care in the world. Now I’m like ugh I guess I should go it’ll be good for me and panic the whole way through. 

I want to feel relaxed and “normal” again. I want to start a family with my husband. I feel so trapped and defeated by my own brain. ",1,1738865139.0,Agoraphobia,0,1.0,False
1ij8z3i,https://v.redd.it/api6jgzp6khe1,Delonghi magnifica S repair - not working,"Hi everyone! I am trying to repair a Delonghi Magnifica S for my mother, but I have run into a problem that I cannot fix myself. I am hoping you can help me! 
This machine was sold to me as, not working, probably something wrong with the sensor for the coffee tray. So I thought, well, I can fix that. When opening up the machine, I saw that the microswitch there was indeed a bit burned, so I replaced the sensor and put the wires back the exact way that I took them off. 
However, the machine seems to be behaving in a way that should not be expected, so I'm wondering if I've got some wires crossed. When I push in the switch (and the coffee tray would hit the sensor), it says that the coffee tray is missing. And when I release the switch, it says I should put in the watertank. When I do that, the missing coffee tray signal is just constantly on, no matter whether I push in the switch or release it. What could be going on here? I'll put some pictures of the wires and board in the comments. ",1,1738865112.0,Appliances,1,1.0,False
1ij8yvi,https://i.redd.it/b71lzugo6khe1.png,Infographic for all dishes (new desserts v2.5.0),,1,1738865097.0,PokemonSleep,0,1.0,False
1ij8ye1,https://campusnutrition.ca/news/coffee-chats-are-scary-heres-where-to-have-them-on-ubc-campus,Coffee chats are scary — here’s where to have them on UBC campus,,3,1738865066.0,UBC,0,1.0,False
1ij8xqn,https://www.reddit.com/r/UGCcreators/comments/1ij8xqn/had_anyone_made_the_leap_from_content_creator_to/,Had anyone made the leap from Content Creator to selling your own products?,I have never been concerned about numbers as I am not an influencer but a creator but I want to consider selling my own Beauty products.  It's scary though. Bonus if you live in the tampa bay area and can grab coffee.  Any thoughts on making the content creator to your own brand leap?,1,1738865022.0,UGCcreators,0,1.0,False
1ij8x7r,https://i.redd.it/3hflaptc6khe1.png,Classy Epoxy Table,ONLY $1350?! ,2,1738864986.0,CrackheadCraigslist,4,1.0,False
1ij8x0d,https://www.reddit.com/r/IndiaCoffee/comments/1ij8x0d/umakshually/,Um...Akshually 🤓,"This is how i imagine aeropress purists going through this sub, finding all the kaldipress, agaro press, etc posts and trying to MORAL POLICE people. It's a moral dilemma to buy other companies' presses as they're copying aeropress?
Then answer me this. Out of all the equipment that you use, how many of them belong to the company/person who actually invented them? Your moka pot? your french press? your grinder??
When asked about recommendations for these equipments, these purists will list out top 3 companies which they love, yet when someone asks about kaldipress, suddenly its a moral dilemma. why?

Now the concerns about plastic quality are still valid. Though there is a lot of pseudoscience going around in this sub regarding that too. 
Pouring hot water in plastic (even bpa free plastic) does result in accelerated leaching of chemicals into the liquid. 
Notice the word ""accelerated""? Yeah news flash. these chemicals still leach in cold water, albeit much more slowly. So that water you drink from bisleri bottles packaged 6 months ago is gonna have way more chemicals into it.
Oh and have you ever drunk hot tea or coffee from disposable cups? they're lined by an extremely thin layer of PLASTIC yet we show no hesitations in drinking from them. 
So no. the amount of plastic chemical leaching from keeping hot water for 2-5 minutes in a kaldipress is not going to significantly harm you even if you drink coffee from it 10 times in a day (atleast in your lifetime)
If you want to avoid plastics, avoid using ALL plastics and then maybe you'll see a health benefit, if any at all.

Not everyone has the money to buy expensive equipment.

TLDR - OP is tired of seeing all ""Buying kaldipress is a moral dilemma"" comments",5,1738864971.0,IndiaCoffee,0,0.78,False
1ij8wkc,https://www.reddit.com/gallery/1ij8wkc,The Truth Is Out There.......,My Favorite Coffee Mug,9,1738864947.0,XFiles,0,1.0,False
1ij8vdi,https://www.reddit.com/r/datingoverforty/comments/1ij8vdi/seeing_a_new_guy_wondering_what_am_i_dealing_with/,Seeing a new guy. Wondering what am I dealing with. Any thoughts or advice welcome.,"Hi everyone!

I would love to have your impressions or thoughts on my story.

I am in my 40s and he's 50. I met him on a dating app, however I was not in his country and just ""exploring"" the dating field there.

I had not been dating for a few years, since my last relationship with an avoidant man traumatised me. I have been working on myself since then. And being on my guard.

So in December, this guy matches with me and comes on really strong, his first message was jokingly asking me to be his last girlfriend. I explained I was just exploring and changed my location out of curiosity. He nevertheless kept messaging me showing a lot of interest in me.I made it clear I only wanted a relationship and he asked me if in the eventuality we would be right for each other if I would move to his country. I responded that was a possibility but would take time to get there.

He is a single dad of 2 teens and was never married. He has had a series of relationships since he separated from their mother, between 1 to 3 years each. We both had a relationship with an avoidant partner, but when I discovered his last attempt with his ex was a few months ago last summer, I felt turned off and told him he was not ready. He insisted and convinced me he already had rebounds and that he wanted someone that would make him happy and not miserable like the avoidant ex.

He said he wanted to come visit me in France soon, he is in Denmark. In the meantime, since we had so much time to get to know one another, I asked questions about what he wanted, his personality type etc. He said he also has an anxious preoccupied attachment style, like me, and tended to be too ""dependent"" in the past. I asked if he has had therapy. There were a few clashes after I expressed that I don't want a partner with female friends, meeting one on one.

This came up after he tried to bring the conversation to more sexual topic and I denied it, to which he responded his female friends talk about everything. This made me uncomfortable and I wondered if he was a player. He also said he had a lot of needs for closeness. After lots of arguing and proving his point, I felt turned off by the tug of war, but he agreed he would respect my preference if we were in a relationship.

We started having long phone calls and got to know each other more for many weeks. He was very invested daily, either call or texting. Very sweet and thoughtful. He booked his ticket to fly to Paris and a hotel.

Finally he came visit last week, for 5 days. We were both nervous to meet. The connection felt so good on the phone that I was afraid everything would be different if the chemistry was not there in person.

  
The first coffee date was lovely and he rapidly kissed me. I felt attracted to him too. He took me on nice dinner dates and it felt good. We became physically intimate. Maybe that was too fast.

There was a weird moment when I realised I don't know his name so I asked him. He was tired in bed and he started joking about being Mr Tired something for a few minutes, I felt suspicious. After that he said he said his name but I kept feeling triggered and asked for his passport (I know that sounds extreme). He wanted to sleep and not talk. I turned the lights back on and he said he didn't want to give it to me because he was afraid I would stalk him online.

This made me upset and outraged, I confronted the fact that despite we had had sex he was no longer talking about being girlfriend / boyfriend. He said we were dating and not a couple yet. I said I was not on trial period and he must have had bad intentions towards me if he was suspicious about giving me his full name. It became messy and I told him to go back to his hotel.

The next day, he texted me he wanted to see me and talk. I agreed and we met. He said he should not have said that. BUT also felt like I crossed his boundaries and he let it slide (with the opposite sex friends). He said I was unreasonable. I responded that my feelings were valid and part of me, so if he invalided my feelings, instead of finding a resolution, it was a judgment and not helpful for the relationship. I have felt like he is very stubborn and wants to win the argument and can't see my point of view. As if he lacks empathy. And he said he felt criticised by me. Which is true.

We fell back into each other's arms. We spent the last days holding hands, having great sex, going out and he treated me well. I was affectionate and sweet, maybe too much. On the last day, he suggested I would visit him in Copenhagen. I agreed.

The same night, back home, we texted briefly but I felt immediately a shift in the communication. No goodnight text no call. I felt like it's ok maybe he needs to process his feelings after being close and meeting the real me. The following day, I only received a text in the evening ""How was your day""; I responded and he took more than 40 minutes to say he was glad to hear that. I asked about his day. NO response. The following morning still nothing. He left me on read. This was never the case before.

He texted at night an emoji 😘. No explanation as to why he left me on read the previous day. No phone call anymore, I decided to ignore that low effort communication.

So now it is 3 days he has left and I feel like I have lost the sweet guy he was before. The communication has changed. It feels like breadcrumbs. I don't feel like chasing, I feel betrayed and disappointed. Is he another avoidant man? A player that got what he wanted?

Any thoughts or advice are welcome! Thank you for reading me.

  
",2,1738864870.0,datingoverforty,1,0.75,False
