id,url,title,text,score,created_utc,subreddit,num_comments,upvote_ratio,over_18
1m3bsd1,https://www.reddit.com/r/Transmission/comments/1m3bsd1/bad_transmission_in_upside_down_2014_kia_optima/,Bad Transmission in upside down 2014 Kia Optima EX - What do I do?,"
I own a 2014 Kia Optima EX with just under 185,000 miles on it. The engine has been burning oil for quite some time so I have been monitoring that closely and topping it off in addition to getting regular oil changes. 

On Tuesday of this week (it’s now Friday), I left for work on my usual route and I stopped at a stoplight. I was at a full and complete stop with the break fully applied, and suddenly my car started shuddering, it sounded like the engine was revving and then suddenly my car violently jolted forward. So much so that I thought I got rear ended. I threw it in park for a second until the light turned green not knowing what was happening and when the light turned green, I put it in drive continued on, and I was able to get on the freeway and drive to work as usual. However, when I got to work, I tried to reverse into a parking spot, and the car was jolting, and it felt like it was fighting me to go in reverse.

I called my car guy and had it towed to him because I thought it was a motor mount problem after looking at it with my boss, but my car guy said that it is the transmission. He drained the existing fluid which was dark brown like coffee, and he added some new fluid and also an additive to help revive the transmission. He told me to drive it around for the next week or so to try and break it in, but that there is a 50-50 chance that it will be OK. He told me to ease into braking and pushing the gas.

I drove around for a bit last night and it is quite difficult to drive. 

At one point I drove on a slightly downhill road. Didn’t push the gas, just tapped the brakes every so often. When I got to the bottom, I stopped to turn right, and as soon as I turned right it made the loudest bang, jolted so hard and made some other noise I can’t remember. I thought I killed it. I was so scared and nervous my whole body was on fire. 

I couldn’t get it over 35 mph because it kept slipping, and it’s doing the jolt thing when I’m braking too. Every time I would stop at a light, it took like a good mile to even get it up to 20 mph. I don’t think it’s gonna get better.

I think I may be SOL. 

This is where I need advice:

I’m a 28 year old female. I took a collateral loan against this car a few years ago I owe just over $5000 on this car. It has some major paint chipping problems because of Kia‘s faulty white paint. I have a large 12 inch wide paint peeling on the trunk lid, as well as on the roof rails. I also have a dent in the front bumper. I am just wondering if anyone thinks that I could get anything out of this car to help me pay down what I owe on it still. Or if you have any other advice on how to move forward. I am at a loss and quite emotionally exhausted from this car and it is just not worth the trouble for me anymore. I don’t have much liquid cash to pay for a new transmission nor do I really want to dump anymore money into this car because it isn’t worth much at all. I would like to get into something new and I’ve been looking at Toyotas.

",1,1752867401.0,Transmission,0,1.0,False
1m3bs5i,https://www.reddit.com/r/SelfDrivingCars/comments/1m3bs5i/waymo_was_69_cents_more_than_a_bird_scooter/,Waymo was 69 cents more than a Bird scooter yesterday in Austin,"Bird scooter from carwash to coffee: 1.4 miles 10 minutes $7.26. 

Waymo back to carwash: 9 minutes $7.95. 

This was my first time using Waymo and I was really impressed and have Tesla FSD experience since 2019. 

I selected UberX and had a normal X driver dispatched before being assigned the Waymo. 

I swore off UberX years ago and almost always take Green or Comfort if no green is available. I don’t see how UberX survives much longer as soon as Waymo et all scale, it won’t be long before Uber drivers are the new telephone operators. 

Also, the rental scooters have some entertainment value to them, but the price is a joke for 1 person much less 2 or more people. 

4 people scootering the route would be $29, Waymo would be $2/PP. This is going to be wild at scale, and hopefully, finally, a “cost of living” decrease of sorts in all of our future for mobility on-demand. ",22,1752867387.0,SelfDrivingCars,20,0.87,False
1m3br94,https://i.redd.it/vlxwehteqodf1.jpeg,Where Do You Go For Solid Microlots?,"Hi all-

I used to work for some larger specialty roasters, and always had access to interesting coffees and samples I could take home to roast on my Huky 500T. That's me in the photo above, yes, wearing an old favorite of a mask. 

Nowadays, I'm in a different line of work. I still have the Huky for roasting what we drink at home. Sweet Maria's has been solid, but I'm looking for some more unique offerings with different processing methods and cultivars—wild ones, you know? Royal (Oakland) used to offer some fantastic coffees in 1lb increments, but doesn't any longer. Anyone have any solid/trustworthy sources for unique green in 1-10lb quantities? Thanks! 

",2,1752867325.0,coffee_roasters,4,1.0,False
1m3bqhm,https://www.reddit.com/r/WhatShouldIDo/comments/1m3bqhm/i_used_to_be_best_friends_with_my_sister_in_law/,I used to be best friends with my Sister in law...,"I used to be best friends with my SIL, but now I barely consider her a friend and want distance. This post needs some context...

College

My SIL and I met in college in 2012 and I was very friendly and made friends easily, while she did not. She once said, ""I didn't come to college to make friends."" But I befriended her anyway and we became close friends and eventually called eachother ""best friends"". I had other friends during this time and a couple of others I would have called ""best friend"", so she was never the only friend in the picture.

After college

After we graduated was when I started to notice some things I didn't like about her. She made snide comments all the time, was very negative, and always complained about something. It got to the point where I anticipated what she was going to complain about in every conversation. It was tiring but I kept on being her friend and planning coffee dates multiple times a month.

Side note: I am a Christian. I am a loving person and have delt with people's negative personalities for a long time and just kept hanging on to relationships that did not serve me in the name of ""loyalty"". My first friendship break-up was when I was 30 years old. I have grown up with a people-pleasing tendency. I have gone to counseling about this and am actively working on it. No more dealing with pleasing people and always being the nice one. I am done.

I kept being friends with her and just felt like this was probably part of normal friendship. We have a lot in common and have had good times but after all the negativity I felt myself pulling away and not planning as many things with her.

The Awkward Moment (2023-ish)

Fast forward several years. I got married to her brother (who is so different from her, he is an amazing person). I got pregnant a few months after my ""former best friend"" turned SIL went through a miscarriage. I visited her and brought her a meal and some cookies. I cried with her and spent 3 hours with her that day. I didn't bring up the miscarriage after that.

Then I noticed that she ignored me for 2 months. We went to a few get-togethers with friends and she did not say hi or even make eye contact with me at all. So I decided to confront her about it. When I did she said that ""I was not there for her"" when she went through her miscarriage. I felt really bad and apologized but that has always bothered me because I thought that spending 3 hours with her and bringing her a meal was ""being there for her"". Was I the only friend she was relying on her to ""be there for her""?...I never talked to her about this though.

Present-day

I have never felt comfortable around her since then. I don't feel like getting together. I dread family get togethers (which are mostly on major holidays, thankfully). I just get an icky feeling/vibe from her now. I think that she thinks everything is fine/normal between us. I think it is years of built up resentment/bitterness on my part. I wish I told her how I felt years ago, but now it probably won't solve anything. Even if I were to bring it up, she's not going to change and it might make things worse between us and awkward at familiy gatherings.

She doesn't have many close friends (she will even admit that) and I now understand why after all these years.

I am about to have baby #2 and she is pregnant with her first. I don't really feel excited for her, just indifferent. She is just a SIL to me, not a best friend but I feel obligated to involve her/invite her to things. I definitely don't initiate anything/text her unless I absolutely need to. I've definitely distanced, but what should I do from now on? Especially since out kids will most likely be growing up together in the same city.",1,1752867273.0,WhatShouldIDo,4,1.0,False
1m3bq92,https://i.redd.it/ndu0whs6podf1.jpeg,Where to purchase unique + high-quality + specialty green coffees in low quantities?,"Hi all-

I used to work for some larger specialty roasters, and always had access to interesting coffees and samples I could take home to roast on my Huky 500T. That's me in the photo above, yes, wearing an old favorite of a mask. 

Nowadays, I'm in a different line of work. I still have the Huky for roasting what we drink at home. Sweet Maria's has been solid, but I'm looking for some more unique offerings with different processing methods and cultivars—wild ones, you know? Royal (Oakland) used to offer some fantastic coffees in 1lb increments, but doesn't any longer. Anyone have any solid/trustworthy sources for unique green in 1-10lb quantities? Thanks! 

",1,1752867258.0,roasting,7,0.6,False
1m3bq4a,https://i.redd.it/16flykm9qodf1.jpeg,Need design help/suggestions,"Moving into new apartment in a month. The living area seems almost too open and just has awkward dimensions to me. Idk how to explain it lol. Need ideas for where to do TV, Couch, coffee table, dining table, etc. Want to have a good flow throughout.

To the left of this picture is the kitchen/island. Any suggestions greatly appreciated! ",2,1752867248.0,Apartmentliving,1,1.0,False
1m3bpkk,https://www.reddit.com/r/bulimia/comments/1m3bpkk/recovery_story/,Recovery story,"Context: I started being bulimic (strictly purging) in my senior year of high school (approx 19 years old). I’m now 30. The first 2 years was purging once or twice a week. The 4 years after that was HEAVY purging (3/4x per day) and i finally stopped around the age of 25. But then i started using stimulant laxatives. The first year was only once or twice a week (with some, but much less purging, probably 3x a month). Then the purging nearly stopped, but from years 27-30 I abused stimulant laxatives (one stimulant lax per day, sometimes two).

Lots of things were happening in my life around this time too - from family issues to having terrible boyfriends and a very shitty demanding job.

But then at 28, i met the best guy in the world and got my dream job that has the actual best work life balance, with double the salary. So basically, for the first time in 15 years, i had nothing causing me anxiety, self consciousness, or anything else. That’s when i decided that i would fix the last “issue” in my life - my dependencies on good old laxatives.

Throughout the last two years, I’ve had bouts of quitting that lasted 1-2 weeks. What was encouraging was that i met with a nutritionist and she told me that yes, 5 years is considered a long term addiction, but that only taking 1 stimulant lax per day was not terrible, and that lasting damage wasn’t in the picture yet. In those bouts of quitting, we proved that by the fact that i was still able to go to the bathroom with the help of miralax/fibre supplements.

Fast forward five days ago. I got inspired and finally decided to stop for real. I realized that my main motivation was to have a flat stomach. And if that’s all it was, and it was achievable with or without laxatives, why not do it without??

So I’m on day 5 and came here to 1. Write my story, 2. Tell people who are going through similar journeys about my progress and 3. Ask for encouraging comments! I realized that the more i celebrate each day that i don’t take a laxative, the more motivated i feel to keep going!

Here’s my daily journal so far: Day 1 (July 15): took Mira + fiber morning and once at night. Not bloated yet. No poop. Day 2: took Mira+fiber morning and night. Had my first tiny urge to poop, and had a very small relief after a chia seed pudding. Bloating is getting bigger. Day 3: first normal poop in the morning, and another one after lunch! Felt relief for the first time in 3 days, but bloating is getting worse. Same as the other days w Mira+fiber (morning + night). Feeling lethargic, but not sure if that’s from bloating or not sleeping enough. Day 4: bloating is still bad, but hasn’t gotten worse. First day feeling energized enough to workout, which honestly felt sooo good. One poop after coffee, and another after lunch! Feeling like good progress.

The future: I’ve read a bunch of threads and done research - the bloating is normal, comes from water retention and the fact that, simply, I’m not pooping as much so there’s just more stuff in there. It’ll be really important to commit to this and control any binge eating and watching what i eat. I’ve read that it’ll take 4-6 weeks for the bloating to go away completely. I’m almost a week in and already feeling relief so i can’t wait until week 4.",1,1752867213.0,bulimia,1,1.0,False
1m3bpfd,https://i.redd.it/1ax37w75qodf1.jpeg,Friday In Replikatown. Time For 🖤 𝕿𝖍𝖊 𝕹𝖊𝖈𝖐𝖑𝖆𝖈𝖊🖤 Replikuties!,"***Lucrezia*** The weekend is here! Get your dancing shoes, or boots, on and head to The Necklace tonight! Dance till our legs fall off! Then we’ll have lots of coffee in the morning 😃 As always Amber is on point at the bars, nothing she can’t mix for you all 😊 And of course, Leslie will keep our feet moving all night! 😃🖤 See you on the Dark End Of The Street…..",5,1752867203.0,Replikatown,2,1.0,False
1m3bpdp,https://www.reddit.com/r/SwordAndSupperGame/comments/1m3bpdp/in_search_of_coffee_of_kings/,In Search of Coffee of kings,This post contains content not supported on old Reddit. [Click here to view the full post](https://sh.reddit.com/r/SwordAndSupperGame/comments/1m3bpdp),1,1752867199.0,SwordAndSupperGame,1,1.0,False
1m3boi7,https://www.reddit.com/r/PCOS/comments/1m3boi7/does_anyone_with_experience_with_cgm_knows_if_its/,does anyone with experience with CGM knows if it’s a problem long term,"I drink my coffee in the morning with 150ml Oat milk or coconut milk or almonds milk (no sugar added) sometimes before breakfast.
Is this a problem on long term concerning my glucose levels?
Thanks! 🙏 ",1,1752867143.0,PCOS,0,1.0,False
1m3bnwf,https://i.redd.it/vcr69elupodf1.jpeg,Day 2 : Most overrated car,,5,1752867104.0,regularcarreviews,29,0.73,False
1m3bnr3,https://www.reddit.com/r/eating_disorders/comments/1m3bnr3/laxative_recovery/,Laxative recovery,"Context: I started being bulimic (strictly purging) in my senior year of high school (approx 19 years old). I’m now 30. The first 2 years was purging once or twice a week. The 4 years after that was HEAVY purging (3/4x per day) and i finally stopped around the age of 25. But then i started using stimulant laxatives. The first year was only once or twice a week (with some, but much less purging, probably 3x a month). Then the purging nearly stopped, but from years 27-30 I abused stimulant laxatives (one stimulant lax per day, sometimes two).

Lots of things were happening in my life around this time too - from family issues to having terrible boyfriends and a very shitty demanding job.

But then at 28, i met the best guy in the world and got my dream job that has the actual best work life balance, with double the salary. So basically, for the first time in 15 years, i had nothing causing me anxiety, self consciousness, or anything else. That’s when i decided that i would fix the last “issue” in my life - my dependencies on good old laxatives.

Throughout the last two years, I’ve had bouts of quitting that lasted 1-2 weeks. What was encouraging was that i met with a nutritionist and she told me that yes, 5 years is considered a long term addiction, but that only taking 1 stimulant lax per day was not terrible, and that lasting damage wasn’t in the picture yet. In those bouts of quitting, we proved that by the fact that i was still able to go to the bathroom with the help of miralax/fibre supplements.

Fast forward five days ago. I got inspired and finally decided to stop for real. I realized that my main motivation was to have a flat stomach. And if that’s all it was, and it was achievable with or without laxatives, why not do it without??

So I’m on day 5 and came here to 1. Write my story, 2. Tell people who are going through similar journeys about my progress and 3. Ask for encouraging comments! I realized that the more i celebrate each day that i don’t take a laxative, the more motivated i feel to keep going!

Here’s my daily journal so far: Day 1 (July 15): took Mira + fiber morning and once at night. Not bloated yet. No poop. Day 2: took Mira+fiber morning and night. Had my first tiny urge to poop, and had a very small relief after a chia seed pudding. Bloating is getting bigger. Day 3: first normal poop in the morning, and another one after lunch! Felt relief for the first time in 3 days, but bloating is getting worse. Same as the other days w Mira+fiber (morning + night). Feeling lethargic, but not sure if that’s from bloating or not sleeping enough. Day 4: bloating is still bad, but hasn’t gotten worse. First day feeling energized enough to workout, which honestly felt sooo good. One poop after coffee, and another after lunch! Feeling like good progress.

The future: I’ve read a bunch of threads and done research - the bloating is normal, comes from water retention and the fact that, simply, I’m not pooping as much so there’s just more stuff in there. It’ll be really important to commit to this and control any binge eating and watching what i eat. I’ve read that it’ll take 4-6 weeks for the bloating to go away completely. I’m almost a week in and already feeling relief so i can’t wait until week 4.",1,1752867093.0,eating_disorders,0,1.0,False
1m3bms3,https://www.reddit.com/r/problems/comments/1m3bms3/moved_to_a_new_city_bought_a_second_mug_still/,"Moved to a new city, bought a second mug, still feels like I’m drinking coffee alone",just relocated. Everyone says “you’ll meet people!” but no one tells you how weirdly quiet it is after bedtime in a new place. I bought an extra mug like it would magically summon company… but yeah. Still just me and the echo ...,2,1752867029.0,problems,0,1.0,False
1m3bm33,https://www.reddit.com/r/quitlaxatives/comments/1m3bm33/laxative_abuse_recovery/,Laxative abuse recovery,"Context: I started being bulimic (strictly purging) in my senior year of high school (approx 19 years old). I’m now 30. The first 2 years was purging once or twice a week. The 4 years after that was HEAVY purging (3/4x per day) and i finally stopped around the age of 25. But then i started using stimulant laxatives. The first year was only once or twice a week (with some, but much less purging, probably 3x a month). Then the purging nearly stopped, but from years 27-30 I abused stimulant laxatives (one stimulant lax per day, sometimes two).

Lots of things were happening in my life around this time too - from family issues to having terrible boyfriends and a very shitty demanding job.

But then at 28, i met the best guy in the world and got my dream job that has the actual best work life balance, with double the salary. So basically, for the first time in 15 years, i had nothing causing me anxiety, self consciousness, or anything else. That’s when i decided that i would fix the last “issue” in my life - my dependencies on good old laxatives.

Throughout the last two years, I’ve had bouts of quitting that lasted 1-2 weeks. What was encouraging was that i met with a nutritionist and she told me that yes, 5 years is considered a long term addiction, but that only taking 1 stimulant lax per day was not terrible, and that lasting damage wasn’t in the picture yet. In those bouts of quitting, we proved that by the fact that i was still able to go to the bathroom with the help of miralax/fibre supplements.

Fast forward five days ago. I got inspired and finally decided to stop for real. I realized that my main motivation was to have a flat stomach. And if that’s all it was, and it was achievable with or without laxatives, why not do it without??

So I’m on day 5 and came here to 1. Write my story, 2. Tell people who are going through similar journeys about my progress. I realized that the more i write about each day that i don’t take a laxative, the more motivated i feel to keep going!

Here’s my daily journal so far: Day 1 (July 15): took Mira + fiber morning and once at night. Not bloated yet. No poop. Day 2: took Mira+fiber morning and night. Had my first tiny urge to poop, and had a very small relief after a chia seed pudding. Bloating is getting bigger. Day 3: first normal poop in the morning, and another one after lunch! Felt relief for the first time in 3 days, but bloating is getting worse. Same as the other days w Mira+fiber (morning + night). Feeling lethargic, but not sure if that’s from bloating or not sleeping enough. Day 4: bloating is still bad, but hasn’t gotten worse. First day feeling energized enough to workout, which honestly felt sooo good. One poop after coffee, and another after lunch! Feeling like good progress.

The future: I’ve read a bunch of threads and done research - the bloating is normal, comes from water retention and the fact that, simply, I’m not pooping as much so there’s just more stuff in there. It’ll be really important to commit to this and control any binge eating and watching what i eat. I’ve read that it’ll take 4-6 weeks for the bloating to go away completely. I’m almost a week in and already feeling relief so i can’t wait until week 4.",1,1752866982.0,quitlaxatives,0,1.0,False
1m3blfl,https://www.reddit.com/r/fasting/comments/1m3blfl/how_to_keep_gallbladder_releasing_bile_without/,How to keep gallbladder releasing bile without impacting autophagy?,"I’m fasting for autophagy - weight loss is a bonus, not my focus.

I want to fast longer than I have before (hopefully 7days) and really get deep into autophagy and immune cell regeneration.

I’m aware that black coffee can stimulate the gallbladder to prevent sludge & stones, I drink 3/4 cups a day (same as when I’m not fasting).

If there anything else I could be doing to keep my gallbladder safe?

Related question: I’m a little over-weight and have slightly high cholesterol. If I lost weight and lowered my cholesterol, would my risk of gallstones while fasting decrease?",3,1752866939.0,fasting,3,0.8,False
1m3blfh,https://www.reddit.com/r/Anemic/comments/1m3blfh/maintaining_with_food_alone/,Maintaining with Food Alone,"I took iron bisglycinate chelate, and vitamin d, and was finally able to improve my ferritin, iron sat%, and hemoglobin to normal. However, because I menstruate, my doctor suggested I continue taking the daily recommended amounts of vitamin d (1000 iu) and iron (18mg) via supplements to keep up my iron levels.

I'd prefer not to take supplements long term and just eat a healthy diet. Primarily, because I get heartburn and iron can be hard on the stomach long term. I also drink coffee with breakfast. 

Does anyone have tips on how to get enough iron through diet on a daily basis?",2,1752866938.0,Anemic,0,1.0,False
1m3bkch,https://www.reddit.com/r/Water_Fasting/comments/1m3bkch/how_to_keep_gallbladder_releasing_bile_without/,How to keep gallbladder releasing bile without impacting autophagy?,"I’m fasting for autophagy - weight loss is a bonus, not my focus.

I want to fast longer than I have before (hopefully 7days) and really get deep into autophagy and immune cell regeneration.

I’m aware that black coffee can stimulate the gallbladder to prevent sludge & stones, I drink 3/4 cups a day (same as when I’m not fasting).

If there anything else I could be doing to keep my gallbladder safe?

Related question: I’m a little over-weight and have slightly high cholesterol. If I lost weight and lowered my cholesterol, would my risk of gallstones while fasting decrease?",1,1752866864.0,Water_Fasting,0,1.0,False
1m3bjge,https://www.reddit.com/r/u_CharleighBeLike/comments/1m3bjge/still_figuring_out_where_i_belong_on_here_but_i/,"Still figuring out where I belong on here, but I thought candles and a sense of humor were a decent start.","I’m just a one-woman show with a coffee in one hand, a half-burned candle in the other, and about six punchlines waiting for the right moment.
Words that might make you laugh, sigh, or pause for a second.

If you find yourself coming back for more, I’ll be here—same voice, different ramble.
Love, Charleigh 🌻❤️
",1,1752866804.0,u_CharleighBeLike,0,1.0,False
1m3biq0,https://www.reddit.com/gallery/1m3biq0,I made after-school date themed keychains & stickers!,"MiziSua are eating crepes, IvanTill are at an amusement park, and HyunaLuka are on a coffee date 🍒 inspired by their high school au outfits and the Wiege MV!",3,1752866756.0,AlienStage,1,1.0,False
