id,url,title,text,score,created_utc,subreddit,num_comments,upvote_ratio,over_18
1g8o9lx,https://www.reddit.com/r/MahindraUniversity/comments/1g8o9lx/why_does_the_coffee_taste_weird_lately/,Why does the coffee taste weird lately ,Title,1,1729513048.0,MahindraUniversity,1,1.0,False
1g8o8gj,https://www.reddit.com/r/AncientCoins/comments/1g8o8gj/need_help_identifying_roman_coins/,Need help identifying Roman coins. ,"Hello Reddit,   
I've been a long-time coin collector and have recently gotten into ancient coins (I'm a massive history nerd for Classical Antiquity) ! 

  
A while back I had purchased some Roman coins (or at least I hope they're legitimate). The first I think I've identified as a coin from Emperor Postumus from the breakaway state of the Gallic Empire (260-269), a fitting coin since I live in a city that belongs to this state. (First image), this coin weighs between 3.2 and 3.3 grams and is about 2.1 cm in diameter. 

https://preview.redd.it/lwtooor9o3wd1.png?width=433&format=png&auto=webp&s=2ebd8ea25ed42b03ce1d161d462c419b15bdee68

https://preview.redd.it/r1ao3z0bo3wd1.png?width=433&format=png&auto=webp&s=937a87d407ad5d572c53e3f1ca2b91ebd233ba59

The second coin poses more of a problem. I believe it belongs to a Gordian, which one is the problem (there's 3). The coin weights 4.1 grams and has a diameter of roughly 2.2 cm. 

https://preview.redd.it/25yv90dto3wd1.png?width=433&format=png&auto=webp&s=a7106eb52326571d954bffadafff058543e96f01

https://preview.redd.it/he1zz62uo3wd1.png?width=433&format=png&auto=webp&s=3bed2078adaf5f56b80b74ea9d2fe59972e55381

As to the metal content of these coins, its clearly not bronze or gold (I wish haha). I'm guessing since they seem to date from the 3rd century that they're not pure silver as Rome debased their currency substantially by this point in the Empire. I'm guessing billon? 

  
I really apologize for the poor quality of these images, I own an Android and drank too much coffee this morning.... 

I'm curious as to their denomination, rough dates of minting and if possible the location where they were minted. I doubt they're ""Antoninianus"" since those are heavier...",1,1729512951.0,AncientCoins,0,1.0,False
1g8o7dh,https://www.reddit.com/r/CozyGamers/comments/1g8o7dh/books_and_games_and_games_and_book/,Books and Games and Games and Book ,"Wondering what everyone listens to when they game if they play with the sound on or if they watch TV in the background 

I personally love a good audiobook or podcast while I game. 

And if anyone is into audiobooks or podcasts I totally recommend  starting the SJM universe if you have not yet and lpotl is my top favorite podcast but I listen to so many different types that its hard to choose a second fave. 

OK I'm gonna pack a cone and hop on the sims for now while i listen to fourth wing And enjoy my Starbucks caramel coffee that I make at home because they cannot make it right when I go to the Starbucks I've just decided it myself lol 

Hope everyone has a beautiful day ! ",1,1729512856.0,CozyGamers,0,1.0,False
1g8o7ct,https://www.reddit.com/r/referralcodes/comments/1g8o7ct/atlas_earth/,Atlas earth,"It's an okay game where you can buy Landa and make money over time. The longer the play the more you make. Just posting referral here on case anyone Google and is on the fence about joining. Gives you 2 free lands when you get your tenth, and me 10 AB whenever you buy one up to the tenth. So it's a win win where you get more value. 

Might not make you rich, but it might buy you a coffee now and again after you really get going. 

https://r.atlasearth.com/QRyXwjdtRNb or use UUQLJP


Edit: YOU MUST USE THIS CODE BEFORE BUYING YOUR SECOND PLOT OF LAND. Otherwise you won't get the benefits. ",1,1729512854.0,referralcodes,0,1.0,False
1g8o6zk,https://www.reddit.com/r/CasualIreland/comments/1g8o6zk/hospitality_smes/,Hospitality SMEs,"Hi all, my daughter is in 6th year and has developed a short survey as part of her economics project. It’s aimed as small business owners in the hospitality industry. If there are any coffee shop / restaurant owners on this sub, who wouldn’t mind contributing please send me a message and I’ll share the link. Thanks so much ",1,1729512820.0,CasualIreland,0,1.0,False
1g8o6wn,https://www.reddit.com/r/CasualConversation/comments/1g8o6wn/the_best_day/,The best day!,"I had the best day yesterday, but I also did absolutely nothing of any importance or consequence. 
The morning was spent reading Sunday papers with a pot of strong coffee, the afternoon drifted past with visits from friends, light conversation and homemade biscuits. The evening resulted in a pleasant stroll to my local pub for a few drinks with familiar faces. 
That's all. Nothing happened. It was just a perfect day. 
Does this sort of day appeal to you or does it sound unbearably dull? ",1,1729512813.0,CasualConversation,0,1.0,False
1g8o6tv,https://i.redd.it/6its4mjip3wd1.jpeg,Tim please ? You can’t even top up my coffee ? This has happened for days in a rows now. Maybe it’s time for a switch,"Blah blah blah, fill my cup to the top. This is ridiculous I order my coffee black , why are you leaving room ? ",1,1729512806.0,TimHortons,0,1.0,False
1g8o5l1,https://www.reddit.com/r/espresso/comments/1g8o5l1/porta_filter_turns_itself_loose_delonghi_dedica/,Porta filter turns itself loose [Delonghi Dedica],"Hello, I have the following problem:

With my DeLonghi Dedica espresso machine, the portafilter turns itself loose when pulling a shot of coffee. I have already cleaned everything and also replaced the rubber gasket that comes into contact with the portafilter.

Here’s a short GIF where you can briefly see it happening before I quickly hold the portafilter in a panic, so that another cup doesn't break:

https://i.redd.it/wc2f141po3wd1.gif

Does anyone have any ideas? Suddenly my cheap machine feels .. really cheap.

Thank you in advance",1,1729512691.0,espresso,0,1.0,False
1g8o5fb,https://www.reddit.com/r/Constipation/comments/1g8o5fb/how_i_treatcured_my_chronic_constipation_naturally/,How I treat/cured my chronic constipation naturally ,"I thought this may help some people out here! 
I have had chronic constipation my whole life. I’ve tried every different way of eating and drinking, gone to a pelvic floor PT, GI, taken laxatives and nothing seemed to work. But recently I was determined to fix it naturally and tried many different things. I’d love to share what worked as it’s really simple. I don’t know if it’ll work for you, but who knows! 

The main thing that helped:
Taking this amazing supplement. One before I go to bed and one first thing when I wake up(both on an empty stomach). 
It’s called Tri-magnesium by Integrative therapeutics. 
I tried many other magnesium supplements over the years and this is the only one that helped with my constipation! 

I also try to drink a cup of organic pure prune juice around 5 days a week. 

Most mornings I get a coffee with espresso(drip coffee does nothing for me) and I put MCT oil in it. But sometimes I just drink the MCT oil with water if I can’t put it in coffee. I use the bulletproof brand. 

If I’m really desperate on rare occasions I’ll drink some salt water first thing in the morning followed by lots of regular water. 

About my diet- I noticed over eating foods like bread and chips really back me up. So I try to stay away! 

With all this, I’m never constipated anymore. I hope any of this was helpful for people, I know how hopeless it can feel. Reddit has helped me so much I thought I’d give something back! ",1,1729512678.0,Constipation,0,1.0,False
1g8o4un,https://www.reddit.com/r/SturgillSimpson/comments/1g8o4un/is_one_for_the_road_a_prequel_to_jupiters_faerie/,Is One For The Road a prequel to Jupiter's Faerie? ,"I know it's often a thing in literature to change up the order of events, I wonder if that's happening here.  One For The Road sounds like it could have been the breakup that leads to the events of Jupiter's Faerie.  He tells her he's not the man she thinks he is, looking for some sympathy, but gets nothing but goodbye in a way that becomes mutual in the moment, but leaves regret in the long run which leads to trying to re-connect ten years or more later.....just some early morning pre-coffee thoughts I had while listening to this record.",1,1729512625.0,SturgillSimpson,0,0.67,False
1g8o414,https://www.reddit.com/r/PhobiesGame/comments/1g8o414/what_pack_to_buy/,What pack to buy?,"I just opened my first dreadful Pack and got the kitty cannon, but now I'm wondering how to spend my next coffee. Save up for 2000 again or buy perhaps 2 800's or 6 300's? ",1,1729512552.0,PhobiesGame,0,1.0,False
1g8o3zx,https://www.reddit.com/r/discordfriends/comments/1g8o3zx/23_year_old_irish_guy_looking_for_peeps_to_talk_to/,23 year old Irish guy looking for peeps to talk to !!,"






























































































































Salutations everyone !
How are we all ? 
We better be good !!

Here’s my discord : wigwamlad


I’m here today on the look for friends!  (short term / long term) 
Here’s some interesting stuff about me !

Well I’m from Ireland and I’m in uni ! And I’m 23
I’m nerdy, heavily enjoy fantasy and grimdark settings, so massive LOTR, elder scrolls, GOT/HOTD and Warhammer fan.
I play on PC (total war, arma 3, Hoi4, stellaris and many more ) and ps5 (Elden ring, battlefield) 
Im also big into history, specifically military history!! 

I’m a pagan, and I believe in ghosts and the supernatural!
Have had a few Creepy encounters

My fav food is a toastie and I love coffee n tea! 

I hope to hear from someone soon and if you have read this far, no hey, hi or hellos, write an introduction!",1,1729512550.0,discordfriends,0,1.0,False
1g8o3z7,https://www.reddit.com/r/airplanechefs/comments/1g8o3z7/airplane_chefs_choosing_your_locations_and/,Airplane Chefs: Choosing your locations and upgrades,"As of October 2024, there are 14 playable locations in Airplane Chefs. They are

* Cape Town
* Denver
* London
* Mexico City
* ~~Moscow~~ (Currently undergoing reworks and unavailable for those who have not unlocked it previously)
* Mumbai
* Naples
* New York
* Paris
* Rio de Janeiro
* Sapporo
* Singapore
* Sydney
* Tokyo

Each location has different mechanics, as well as different ways to prepare food, and it varies in difficulty in terms of upgrade costs and level difficulty. In this guide, I will be giving you a guide on each location, how difficult it is, and what upgrades do you need most.

Bear in mind that locations which are italicised are those where you would need to prioritise your trash compactor and bag more than others

**Cape Town**

Cape Town airport has very unique mechanic, where players use a grill instead of a traditional oven. There is also a dish (roosterkoek) where players have to prepare the sausages first, before they place it in the roosterkoek and then the grill again. It is of utmost importance that the grill be prioritised over any other equipment

Upgrade difficulty: High (roosterkoek costs a lot to upgrade in particular)  
Level difficulty: Moderate

Equipment to upgrade: Grill and Billtong Slicer  
Food item to upgrade: Boerewors, Chakalaka (costs no gems) and Hertzoggie (cheaper than most other desserts)

**Denver**

The first airport that everyone unlocks by default, expect things to be rather easy here. You will learn the basic mechanics of the game. Also, you do not have to worry at all about trash compactors being unavailable,

Upgrade difficulty: Very Low  
Level difficulty: Very Easy (Newer players may struggle but don't worry, you'll get used to it)

Equipment to upgrade: Main and Quick Ovens  
Food item to upgrade: All the items are pretty cheap, so upgrade as you wish

**London**

Upgrade Difficulty: Low  
Level Difficulty: Moderate

Equipment to upgrade: Quick Oven and Apple Juice Dispenser  
Food item to upgrade: Biscuits (costs no gems), Earl Grey Tea and Apple Juice

***Mexico City***

Mexico City is a pretty complex location, meant for more experienced players. First, you have to cook beef in a pan and sometimes you have to place cheese on it before using a quesadilla pan (where you have to flip halfway). There is also a blender to make licuados, which is important

Upgrade Difficulty: Moderate  
Level Difficulty: Hard

Equipment to upgrade: Quesadilla Pan, Beef Pan and Quick Oven (Blender is important but these 3 are much more important)  
Food item to upgrade: Beef, Tortilla Chips and Taco Toppings

***Moscow***

(Moscow is currently unavailable for all players who have not unlocked it previously. Players who unlocked it previously can access it)

Upgrade Difficulty: Very High (most expensive location in gem cost)  
Level Difficulty: Hard

Equipment to upgrade: Kvass and Lemonade Dispensers, Main Oven  
Food item to upgrade: Zefir, Caviar (costs no gems) and Sour Cream

***Mumbai***

This is easily the hardest location to play in game. Do not play it unless you are skilled and experienced enough.

Upgrade Difficulty: High  
Level Difficulty: Extreme

Equipment to upgrade: Curry Pan and Paneer Cutter  
Food item to upgrade: Paneer Cheese, Jamun Chutney and Rice

**Naples**

This is in my opinion, the easiest location to play besides the first 2 airports (Denver and Sydney)

Upgrade Difficulty: Moderate  
Level Difficulty: Easy

Equipment to upgrade: Pizza Oven and Meat Slicer  
Food item to upgrade: Pizza dough, Prosciutto Ham and Caprese Salad

***New York***

(You will need to upgrade your trash bag a lot because you will be preparing a lot of flat whites)

Upgrade Difficulty: High  
Level Difficulty: Hard

Equipment to upgrade: Coffee, Milk and Cream Soda Dispensers (believe it or not, your drinks are most important here)  
Food item to upgrade: Half Moon Cookie, Cheesecake and Cream Soda (all 3 items are very frequently ordered and are way cheaper than pastrami ham)

**Paris**

Upgrade Difficulty: Moderate  
Level Difficulty: Hard

Equipment to upgrade: Crepe Oven and Baguette Slicer (seriously, these 2 are lifesavers)  
Food item to upgrade: Crepes, Eclairs, and Cafe Au Lait 

**Rio de Janeiro**

There are no first class seats to upgrade, just like Denver

Upgrade Difficulty: Moderste  
Level Difficulty: Easy

Equipment to upgrade: Waffle Maker, Mixer and Ice Cream DIspenser  
Food item to upgrade: Quindim, Fruit Salad, Chimichurri Sauce, Ice Cream

**Sapporo**

(Remember to add the rice to the nigiri maker regularly)

Upgrade Difficulty: Moderate  
Level Difficulty: Extreme

Equipment to upgrade: Rice Cooker, Nigiri Maker and Trays (Salmon and Tuna)  
Food item to upgrade: Rice, Sencha and Soy Sauce (costs no gems)

**Singapore**

This is the location which gives you the best return of investment. You generally earn the most smiles here, especially at levels 44, 45, 47 and 49

Upgrade Difficulty: High  
Level Difficulty: Hard

Equipment to upgrade: Yoghurt Machine, Coffee and Tea Heaters  
Food item to upgrade: Rice, Salad and Asian Flank Steak

**Sydney**

This is the second location you will play in game. Upgrades here are still cheaper than average, although levels get a little harder

Upgrade Difficulty: Low  
Level Difficulty: Easy

Equipment to upgrade: All 3 ovens and ginger lemonade dispenser  
Food item to upgrade: Vegetables, Steak and Balmain Bug

**Tokyo**

Upgrade Difficulty: Very High  
Level Difficulty: Hard

Equipment to Upgrade: Rice Cooker, Onigiri Maker and Kakigori Machine  
Food item to upgrade: Miso Soup, Rice and Soy Sauce (costs no gems)

**General upgrading tips**

- You can live without warmers, freezers and cup holders. They wiill definitely help but are not a requirement  
- Pantry stocks help as well, but there is no urgency in upgrading them  
- Besides the above mentioned locations, you just have to upgrade your trash compactors and bags only around once or twice each. They have been italicised because they produce a lot more trash than the others.  
- You do not need a lot of trays, one or two upgrades should do the trick

My upgrade suggestions DO NOT MEAN that you should not purchase any of your other upgrades, just that these are those which you should prioritise and they will also make your life easier as well..

I hope that this guide has helped you. Have fun playing and all the best!",1,1729512548.0,airplanechefs,0,1.0,False
1g8o3pc,https://www.reddit.com/r/MakeNewFriendsHere/comments/1g8o3pc/just_looking_for_friends_f25/,Just Looking for Friends (F25),"I’m hoping to connect with some cool people. I love spending time outdoors, whether it's hiking or just exploring new spots around the city. I’m also into yoga and trying out different cafes there’s nothing like a good cup of coffee!

If you share similar interests or just want to chat and make new friends, feel free to reach out. I’d love to hear about your favorite hiking trails or cafe recommendations!",1,1729512521.0,MakeNewFriendsHere,1,1.0,False
1g8o3oi,https://www.reddit.com/r/InternetFriends/comments/1g8o3oi/im_looking_to_make_some_new_friends/, I'm looking to make some new friends,"Hey everyone,

I'm a 23-year-old living in Bangalore working in a startup and I'm looking to make some new friends and maybe even find a special someone. I'm passionate about reading, cricket, business

I'm open to chatting about anything and everything, from current events to personal experiences. I'd love to meet up for coffee, a movie, or just to hang out.

If you're interested, please feel free to send me a message! Let's connect and see where it goes.",2,1729512519.0,InternetFriends,0,1.0,False
1g8o37f,https://www.reddit.com/r/MakeNewFriendsHere/comments/1g8o37f/hey_you_im_a_23m_from_ireland_looking_for_cool/,"HEY YOU, I’m a 23m from Ireland looking for cool and sweet people to chat to!! Come message meeeeeee! Whats everyone’s fav Dinosaur","









































































































































































































































































































































































































































































































































































































































































































































































































































































































































































































































































 






















 









































































































































































































































































































































Salutations everyone !
How are we all ? 
We better be good !!

I’m here today on the look for friends!  (short term / long term) 
Here’s some interesting stuff about me !

Well I’m from Ireland and I’m in uni ! And I’m 23
I’m nerdy, heavily enjoy fantasy and grimdark settings, so massive LOTR, elder scrolls, GOT/HOTD and Warhammer fan.
I play on PC (total war, arma 3, Hoi4, stellaris and many more ) and ps5 (Elden ring, battlefield) 


Im also big into history, specifically military history!! I’m a history student in fact , my areas of study are Roman/Greek, military, Irish and archaeology! 
I’m a pagan, Norse pagan 

My fav food is a toastie and I love coffee n tea! 

I hope to hear from someone soon and if you have read this far, no hey, hi or hellos, write an introduction!!",1,1729512475.0,MakeNewFriendsHere,1,1.0,False
1g8o363,https://www.reddit.com/r/SFWr4rIndia/comments/1g8o363/28m4f_gurgaondelhi_something_long_term/,28[M4F] Gurgaon/Delhi - Something Long term,"28 M and pretty late to the party. At an age right now where having a plus 1 to bookshops, museums, or a cup of coffee is something I really crave for. Tell me about your day, how was it. Talk nonsense with me. I am all ears. Let's know each other better, talk mundane stuffs about each other, let's go on trips, or bike rides, lemme get you flowers and jhumkas.",1,1729512471.0,SFWr4rIndia,0,1.0,False
1g8o1pq,https://www.reddit.com/r/PHR4Rhookups/comments/1g8o1pq/31_m4f_lf_constant_momol_buddy/,31 [M4F] LF constant momol buddy,"Hello, looking for a constant momol person and preferably momol lang (kissing, cuddling, oral) no penetration.

Anyway, about me, 31, 5'11"", dad bod, average looking, introvert, working professional, loves coffee kahit acidic na, living in Bulacan.

About you 23+, around my age, single, slim to chubby, loves kissing and cuddling, kalog, madaldal, also my best priority is someone really close to me and who likes to ride on motorcycles

Thank you, dm me lang. Take care",0,1729512335.0,PHR4Rhookups,0,0.5,False
1g8o1eo,https://themockupsisters.etsy.com/listing/1399202011,"16oz Libbey Mockup, Frosted Glass Tumbler Mock Up, UV DTF Mockup, Coffee Cup Mock Ups, Beer Glass Can Mockup, 16 Oz Libbey Glass Template",,1,1729512309.0,TheMockupSisters,0,1.0,False
1g8o14u,https://www.reddit.com/r/keurig/comments/1g8o14u/coffee_maker_recs/,Coffee maker recs ,"Hi - a member of my family uses a keurig and it’s broken after about 2.5 years of regular use. I’m hoping to get them a new one for the holidays, but I’m not sure which to get. Any recommendations?

Currently they have the K-supreme plus SMART coffee maker (https://www.keurig.com/K-Supreme-Plus%C2%AE-SMART-Single-Serve-Coffee-Maker/p/K-Supreme-Plus-SMART-Coffee-Maker#Stainless%20Steel_color)

Thanks in advance",1,1729512284.0,keurig,1,1.0,False
1g8o0vf,https://www.reddit.com/r/misophonia/comments/1g8o0vf/im_a_creature_of_habit_my_mispohonia_vs_my/,"“I’m a creature of habit.” My mispohonia, vs. my father’s attitude","I went on a trip with my family a little while ago,  and we all stayed in the same house together. 

We like to drink French press coffee, so you need to boil water. They have a little teapot. At home, I just use a regular pot.

I leave the spout stuck open, so I don’t have to listen to it screaming. I know when it’s boiling, I can see it, and I can even hear the difference in the teapot itself. 

I’ve always had some misophonia, not super-crippling, but the last 6-7 years have been much worse for me.

After a botched procedure, I now have a permanent 7-year-long-earache, and extreme hypersensitivity, so some noises cause me great pain, as well as the anxiety. Like the teapot, or squeaky shoes in the house. 

Anyway, I’d start my water, for my OWN coffee, and my dad would sneak in behind me and flip the spout down, so it could whistle.

He did this like 4-5 times, even after explaining to him, very nicely, over and over, that my ear really hurts, and that this sound bothers me.

I finally asked him, “My darling father! **WHY are you doing this?** The sound REALLY hurts my ear; it doesn’t affect you, or the quality of the water I’m boiling; so, what’s up?”

All he can say is, “I am a creature of habit.” 

Meaning, while MY bones and lungs want to explode from anxiety and pain at certain sounds, I guess HIS bones and lungs wanna explode, from the anxiety of not letting the teapot scream. The world is NOT right if that spout is stuck open. I think he has some mild, undiagnosed OCD, or something similar.

I am very quiet about his many other ‘sounds’, that I won’t get into. He would take it very personally, if I said something, and we don’t live together - so for a few days, I can live with him… and his *noises.* 

But this isn’t remotely personal! it is a fucking TEAPOT!

I don’t even try to explain Misophonia to them. Even if I did not grow up with Misophonia, the teapot whistle **would still hurt my ear** because of the bad surgery. 

It's just so strange, how people perceive our misophonia, and seem to universally think we are over-dramatic assholes.  

My very genuine reaction, of holding my ear and yelling, desperately trying to get to the teapot to stop the noise, is not put-on, it is PAIN! And I can’t help it!

Do the people you live with have disrespectful little quirks like this? 

I actually thought he was messing with me, after the 2nd or 3rd time, but I don’t think so.

",1,1729512258.0,misophonia,0,1.0,False
