id,url,title,text,score,created_utc,subreddit,num_comments,upvote_ratio,over_18
1pz91d2,https://www.reddit.com/r/betatests/comments/1pz91d2/ios_built_a_finance_app_with_no_transaction/,[iOS] Built a finance app with no transaction tracking—looking for feedback,"Hey Beta Testers!

I've been frustrated with personal finance apps for years. They're either so detailed you drown in data, or they lack the flexibility you need when real life happens. So I built **Pfynn**, a new kind of finance app for those looking for a calmer alternative.

**What is Pfynn?**

Pfynn believes day-to-day financial calm comes from answering two questions simultaneously:

1. How much money will I have left at the end of *this month*?
2. How much money will I have left at the end of *next month*?

Everything else (transaction details, spending categories, budgets, etc.) is noise.

To give you that clarity, Pfynn does three things:

* **Centers you on two numbers:** After each weekly review, you see *This Month's Leftover* and *Next Month's Projection*. Those numbers account for your income, your known obligations (rent, car, utilities, subscriptions, loans), credit card payments due now (and then), and what cash is rolling over into next month.
* **Skips transaction tracking entirely:** During onboarding, you list your 15–25 main monthly obligations, the recurring expenses that actually shape your financial life. Pfynn connects to your accounts via Plaid and updates your two numbers automatically. No need to categorize every coffee or one-off purchase.
* **Built for households natively:** Partners can share a complete financial view, so you're making decisions together, not guessing. Of course solo households can use Pfynn just as easily!

**Why am I posting?**

I'm looking for real-world feedback from anyone willing to give Pfynn a shot:

* Is onboarding clear or confusing?
* Any bugs when connecting accounts?
* Are there painful or unclear parts of the UI/UX?
* Does focusing on just two numbers actually help you feel calmer about your finances?

**Who's it for?**

Anyone who wants to feel ""in control, not overwhelmed."" If you want a finance app you can actually stick with, giving you peace of mind in just a few minutes a week, Pfynn is for you.

**How to join:**

* Open to all iOS users (TestFlight): [https://testflight.apple.com/join/htUHss2A](https://testflight.apple.com/join/htUHss2A)
   * (If you don't already have TestFlight, you'll need to download it from the App Store first.)
* No hard deadline. Just try it out and share honest feedback!

If this sounds interesting, please download and enjoy. Happy to answer any questions in the comments or DMs, and really appreciate any feedback—big or small!",1,1767070630.0,betatests,1,1.0,False
1pz8zp8,https://www.reddit.com/r/onlineservicesPH/comments/1pz8zp8/espressobarista_classes/,Espresso/barista classes,"Hi! I am looking for  Barista tutor.

I have a Fellow Opus espresso grinder and a Breville Bambino Plus espresso maker. I’ve tried my best to learn through youtube videos but my coffee always comes out too fast, watery, and sputters. DM me if you’re a coffee connoisseur / barista open to teaching, we can discuss payment via Gcash/BPI transfer",1,1767070492.0,onlineservicesPH,1,1.0,False
1pz8zoq,https://www.reddit.com/r/triathlon/comments/1pz8zoq/i_made_my_own_version_of_trainingpeaksfor_free/,I made my own version of TrainingPeaks...for free,"Coming off some injuries recently, and was debating if I should renew my TrainingPeaks subscription.

Then wondered if I could create something similar. Yes, yes I can. This is *100% Claude Code*, made in a morning. Spent about 3 hours getting this coded up and deployed on Firebase, with authentication (email/password or Google). Note that I am not a programmer or developer. At all. If there's interest I'll make this available for free (I might put up a 'buy me a coffee' link). It does everything I want from a training app - no more, no less - and only cost me half a morning while I drank some coffee.











Still working out some bugs, but seriously - it's crazy how easy this was to build.

https://preview.redd.it/m9h9ivkiv9ag1.png?width=2222&format=png&auto=webp&s=1c94ec109e9fe827516acec6a0e86303e4dfae9a

https://preview.redd.it/9j8udz7jv9ag1.png?width=2232&format=png&auto=webp&s=21dfcd261b7ab4efdbaf1e76cbd723066032f314

https://preview.redd.it/ou79opzjv9ag1.png?width=2160&format=png&auto=webp&s=fe6f114a7ea900945c3e63fa590ec51d970de696

https://preview.redd.it/1t62y8jkv9ag1.png?width=2045&format=png&auto=webp&s=ff083731ea91cecc857e6f3a1fce25df61f20eea

https://preview.redd.it/x9i8t64lv9ag1.png?width=2144&format=png&auto=webp&s=27ee3b1025f39a0da0e18dfae76aa4315c501b52

https://preview.redd.it/uz25v5rlv9ag1.png?width=1960&format=png&auto=webp&s=e5b0b1f8853cc7aceeef247ef40874e49da2cd35

https://preview.redd.it/8fll0i7mv9ag1.png?width=2142&format=png&auto=webp&s=df70edeb08541b519ac7507c7ca183f3c5b3f74c",8,1767070491.0,triathlon,6,0.75,False
1pz8z2u,https://www.reddit.com/r/productivity/comments/1pz8z2u/im_only_productive_when_someones_watching_and_i/,I’m only productive when someone’s watching and I don’t know how to change that,"I’ve realized something uncomfortable about how I work: I’m only productive when there’s an audience. Coworking spaces, coffee shops, body doubling on video calls I get things done. The moment I’m alone at home with no one observing? Total paralysis.

It’s not about distractions. I can sit in silence for hours and still do nothing. But put me somewhere public or on a call where someone can see me working and suddenly my brain turns on. Tasks feel doable. Time moves.

That’s when it hit me my productivity isn’t internally driven. It’s performative. I’m motivated by being seen as productive not by the work itself. Without external accountability, my brain just stops initiating.

What frustrates me is that most productivity advice assumes motivation comes from inside. Discipline, goals, passion, willpower. But for me none of that works without some form of social presence even passive.

How do people actually motivate themselves from an internal source? Is this something you can build or do some brains just need external structure to function?

I’m trying to figure out whether this is a flaw I need to fix or just a reality I need to design my life around.",54,1767070441.0,productivity,8,0.97,False
1pz8xuq,https://www.reddit.com/r/StLouis/comments/1pz8xuq/best_neighborhoods_for_early_30s_couple/,Best neighborhoods for early 30s couple?,"I’m moving to St. Louis from NYC with my husband and we’re trying to decide on a safe but not too off the beaten path neighborhood to live in. We’d love to be in or near a somewhat walkable area if possible with some coffee shops, restaurants, etc. nearby. Not too familiar with the area, so any info would help!",1,1767070338.0,StLouis,12,0.67,False
1pz8xng,https://www.reddit.com/r/offmychest/comments/1pz8xng/death_of_estranged_mother_2yrs_on/,Death of estranged mother- 2yrs on,"

TW

I'm sorry, this post is a bit rambling and I dont know what I'm looking for. It's my first time writing about any of this part of my life.

My (36f) mother (56f) died suddenly and unexpectedly almost 2 years ago. It's a complicated situation I guess. 

Background: 
My mother was violent, aggressive, physically and emotionally abusive to me and my siblings when I was growing up. When I was 12, out of nowhere (or so it appeared to me at the time) she left. I remember hearing a voicemail from her declaring she had no kids and no husband to never contact her again. So...I didn't. None of us did. My dad continued to raise myself and my siblings as a single parent. 
Actually I lie, I reached out shortly before I got married because I guess I was feeling somewhat emotional missing out on the mother/daughter aspects of planning a wedding. That was met with name calling and further abusive behaviours so I never reached out again. (oh the reappearance repressed trauma! What was I thinking?) It instilled such fear and anxiety in me that I hired security for my wedding just in case she found out the details and turned up 

Anyway, between that exchange and ger death, zero contact. 

I received a call from father one day almost 2 years ago who told me she had died. Her brother contacted my father who in turn was the messenger. I froze, I couldn't breathe. I was relieved, upset, worried, afraid, confused, relieved again, then felt guilty for feeling all of those. Then it got worse...
Her family decided since we were her children and my father was still technically married to her, it fell on us to provide a funeral. 

My brother took on the task, against all of our wishes. Then somehow we all, one by one, got drawn in. For me personally, if my name was going to be associated with this person, I wanted to control how. Things got out of hand though, her family completely abandoned her and us during the planning process, then turned up and the funeral and refreshments afterwards. 100% of all costs and duties fell to us. My dad blanked, he stepped out, he couldn't believe we were doing this. Neither could I, but in hindsight, man, grief makes a person do strange things. 

Anyway, thanks to my brother being a ""yes man"" with the funeral director, and taking the lead in making plans without telling the rest of us siblings, I and my siblings were side-swiped wgen we were taskrd last minute with carrying her coffin and and out of the church for the funeral. Wtf... how did that happen. I wasn't going to make a scene in a church, in front of my father, my friends, my work colleagues who had come to support me. I had to just go along with it. 

Later same day, after the refreshments, which my husband and I paid for (teas, coffees, sandwiches), my mother's brother asked the staff for a copy of the receipt, and spent the next few weeks parading it around claiming he paid for the whole thing. Again, wtf...

For some context, my mother's family are all slightly aggressive, do their own thing, very sensitive people, who likely have mental health issues, alcoholism, and like to be centre stage without putting in the work. She had met another man, a long term partner, who also stepped back and let us take all of this on. Birds of a feather eh...

I dont really know where I'm going with this. I guess, it's 2 years on, it's Christmas, I'm still affected by the whole thing. The way the funeral went, the sudden-ness, the sheer confusion of this new kind of grief. I found out my mother had some mental health disorders I was previously unaware of, namely munchausens/fictitious disorder imposed on self, as well as borderline personality disorder. It resolves and explains so much for me knowing this. 

But I still grieve...I grieve the mother she was in little good moments in my childhood, I grieve the loss of any chance of a future relationship - not that I wanted one at the time of her death. I grieve the concept of a mother. Something I needed so so many times in adolescence and adulthood but never had, not even close. I feel guilty for feeling free, but I feel sad. 

Anyway, I think I'm rambling now. I guess I'm wondering how a person who caused so much trauma in my younger years, continues to invade moments like christmasses and birthdays and turn them sad. I wish there was a timeline on this. 

Also, I conclude that I definitely need therapy!

",2,1767070320.0,offmychest,1,1.0,False
