id,url,title,text,score,created_utc,subreddit,num_comments,upvote_ratio,over_18
1pj5wni,https://www.reddit.com/r/IndieExchange/comments/1pj5wni/sell_us_to_us_perfume_lip_hair_wax_astrid_bpal/,"[SELL] [US to US] [Perfume, Lip, Hair, Wax] Astrid, BPAL, Briix, CJ Scents, LunarLife, Maison des Animaux, Moonalisa, NAVA, Nui Cobalt, Odette, Particle Goods, Phlur, Poesie, Siren Song Elixirs, Smoky Mountain Scents, Sorce, Tarrife Attar, Wylde Ivy, Epically Epic, Wick Wish, Willow Waxcraft","Hi all! Selling some scents that didn’t work out for me.

Paypal. Shipping is $6 for perfume and $7 for hair/wax.

New this week: Briix Fragrances, Odette Parfum Co.

Bundles: Take all Particle Goods for $18.

Please don’t ghost, if you change your mind, please just let me know!

**Perfume**

**Free With Purchase (Notes Below)**

BPAL: O Beautiful White Mother Death, Sybaris

Pylies: Is it Fall Yet?

Stereoplasm – Lovesick Lake

**Astrid**

Five of Cups – White musk, charred amber, vanilla, wood ash, blue chamomile, violet, and grey musk: Arae Decant 0.5 – 4.00

Shadowself - Tonka bean, skin milk, sweet tobacco, vetiver, and anise: Arae Decant 0.5 – 4.00

**BPAL**

Agrat-Bat-Mahlat – Amber, cream accord, white honey, apple blossom, skin musk, caramel, and teak: Ajevie Slink – 7.00

Bastard-Amber Dragon: Its scales shimmer like tawny celluloid: aldehyde klieg lights illuminate golden resins, husky with toasted brown sugar: Arae Decant 1mL – 7.00

Black Butterfly Moon: Vanilla and Tobacco Flower – Vanilla and tobacco flower: Arae Decant 0.35 – 4.00

Blóðughadda – Crushed Baltic amber, golden fig, oud wood, red patchouli, white clove, and saffron: Ajevie Slink – 7.00

Boney Moon: Pinon and Blackened Lavender: Pinon and blackened lavender: Ajevie Slink – 6.00

Brandied Pumpkin – Roasted pumpkin soaked in golden brandy, clove, nutmeg, and vanilla absolute: Arae Decant 0.35 – 5.00

The Death of Autumn - Dark amber, dead leaves, khus, saffron, bitter clove, chrysanthemum, camellia, galangal, and a drop of oud: Arae Decant 0.35 – 5.00

Every Day is Halloween - Skin-warmed sandalwood and toasted pumpkin settle into a gentle blend suitable for all 365 days of Halloween: Arae Decant 0.35 – 5.00

Gamboge Dragon Atmos Spray – It’s scales are the color of old gold, translucent frankincense tears, saffron sap, and fossilized amber: Arae Decant 10mL – 7.00

Hal - Saffron-infused bourbon vanilla, blackened honey, Kashmir wood, Atlas cedar, ambrette seed, hay, and Egyptian jasmine absolute: Arae Decant 0.35 – 5.00

Idle Moon: Vanilla Husk and a Bundle of Twigs – Vanilla husk and a bundle of twigs: Arae decant 0.5mL – 6.00

Inez – Golden amber, vanilla musk, myrrh, cedar, carnation, and red sandalwood: Ajevie Slink – 7.00

Is She, You Know – Sweet 13-year aged patchouli, peru balsam, white oakmoss, spikenard, bourbon vanilla, sugar cane, and a sprig of lilac: Arae Decant 0.35 – 5.00

Luke 10:25-37: Go and do likewise: golden amber and saffron, white sandalwood, and clove: Arae Decant 0.35 – 5.00

Mars and Venus – A stolen moment preserved for eternity in a gleaming amber jewel, entombed in malachite swirls of oakmoss and velvet: Ajevie Slink – 7.00

Mictecacihuatl - Copal, precious woods, warm spices, agave nectar, cigar tobacco, and roses: Arae Decant 0.35 – 5.00

O Beautiful White Mother Death – The lily grows pale in thy sight; the rose, through the long summer night, sighs its life out in fragrance to thee: Ajevie Slink - Freebie

October 2025 - Dry, cold autumn wind. A rustle of red leaves, a touch of smoke and sap in the air: Arae Decant 0.35 – 5.00

On Crime and Punishment - Oman frankincense, Peru balsam, cardamom, and smoked amber: Arae decant 0.5mL – 6.00

Onnagata Making Love at a Tea House as Mane’emon Watches While Holding a Kite – Orange blossom, caramel, yellow tobacco flower, and sugared patchouli: Ajevie Slink – 7.00

Portrait of Magdaleine Pinceloup de la Grange nee de Parseval – An aristocratic 18^(th) century French perfume dabbed on lilac velvet, gently purring with soft grey amber and feline musk, and tinkling with tiny golden bells.  Grasse jasmine and rose otto nestled in ambergris accord, frankincense, white sandalwood, bourbon vanilla, cardamom, amber, coriander, and galbanum: Ajevie Slink – 4.00

Sybaris - Bright violet with sweet clove, Mediterranean incense notes and tonka bean: Imp - Freebie

They Shut Me Up In Prose - Loosed from the satin-pale corset, emerging from a gilded cage, that prison of silence: sweet bourbon vanilla, pale sandalwood, mallow flower, osmanthus, and shards of frankincense: Arae Decant 0.35 – 5.00

The Witches - Pumpkin cream, honey, vanilla sugar, and smoked vanilla bean: Arae Decant 0.35 – 5.00

**Briix Fragrances**

Sleepy Hallow - Coffee CO2, Espresso shot, Steamed Milk, Pumpkin Spice, Salted Caramel drizzle, with a hint of Sweet Orange EO, Ambrette Seed, Iso E Super: 2mL sprayer ¾ full – 4.00

**CJ Scents**

Persian Ice Cream – Vanilla ice cream, pistachio, vanilla custard, saffron, rose water: 2mL sprayer – 5.00

Vanilla Indulgence – A blend of 10 vanillas (vanilla extract, burnt sugar vanilla, vanilla custard, vanillin, vanilla musk, and much more): 2mL sprayer – 5.00

White Rabbit – Vanilla bean, marshmallow, white chocolate, vanillin, and white amber- soft, fluffy comfort: 2mL sprayer – 5.00

**LunarLife Apothecary**

Ancient Oud – A deep, warm and smoky scent with notes of oud, incense, citrus, frankincense, myrrh and palo santo: 1mL – 4.00

Angels Embrace You – Cinnamon and vanilla, a heart full of tonka bean and cognac while sandalwood rounds out a base of light oak barrels: 1mL – 4.00

Literary Snob – Top: peach, plum, paper Heart: violet, perfumed librarian Base: patchouli, leather, vanilla: 1mL – 4.00

Sleeping In – Top: aldehyde, rose.  Mid: violet accord.  Base: clean sheets: 1mL – 4.00

**Maison des Animaux**

Closer – Top: tropical fruit, bourbon vanilla Base: fruity tobacco, velvety musk, a leather club chair in an elegant tropical setting: 2mL sprayer used 3x – 2.00

Sirius – Top: cardamom, fig, vanilla, pink pepper, elemi Middle: Osmanthus, black tea Base: Mysore sandalwood, tonka, vetiver, benzoin, olibanum: 2mL sprayer used 3x – 2.00

**Moonalisa**

Pumpkin Sumptin – Notes of lightly spiced pumpkin puree with warm ginger, nutmeg, and cinnamon, hot buttered rum and condensed milk, brown sugar and vanilla crystals: Slink – 2.00

**Nocturne Alchemy**

Bastet’s Ice Cream Bourbon Butter - Bourbon Vanilla Whiskey (non-alcoholic) Accord, Caramelized Vanilla Sugar, Pink Salt, Oak Wood Accord, Studio Limited Bourbon Vanille Absolute, Vanilla Crystalline Cream, Butter accord, Caramel Accord, French Vanilla Bean Absolute, Vanilla Milk accord, Vanilla Orchid, Crystalline Absolute and Vanilla Sugar: Arae decant 0.35mL – 6.00

Black Vanilla Woods HONEY - Black Vanilla, Vanilla Bean Absolute, Tonka Bean Absolute, Labdanum Absolute, Virginia Cedarwood E/O, Palo Santo Wood, Sandalwood, Black Cedar Essence, Studio Limited Black Honey Absolute Accord, and Orange Blossom Honey Accord: Arae Decant 0.35mL – 5.00

Blue Marshmallow Sun - Vanilla Marshmallow Accord, Mallow Musk, Cane Sugar, Vanilla Crème Accord, Tonka Bean, White Amber, eNVie saphir (Egyptian Amber & Musk Resin purified into natural notes of blue balsamic amber, sweet papyrus oil from Cairo, and Siam benzoin), Bastet’s Amber, Jasmine, White Sandalwood, and Dark Patchouli: Arae decant 0.5mL – 6.00

Bourbon Vanille Musk - Studio Limited Originals Bourbon Vanille Absolute (Bourbon Vanille with touches of almond, pistachio, gold sweet tobacco, and white musk.  Aged Madagascar Bourbon Vanilla Beans.  A drop of aged Crystalline in an Oak wood barrel), Vanilla Oleoresin (extracted), White Clove, Bastet’s Musk Absolute (A sensual skin musk made from soft white floral blends of Tuberose, Mallow, Angelica, Musk Flower, and White Lily): Arae decant 0.5mL – 7.00

FaBOOlous – Toasted coconut crème brulee, caramelized sugar, brown sugar, rum infused sugar, vanilla bean fleck, vanilla musk, Crystalline vanilla musk absolute, tonka bean, vanilla cordial, French vanilla, Bastet’s Musk absolute, jasmine essence, patchouli essence, cardamom absolute, cardamom seed extract, vanilla caramel custard, amber sugar, and amber musk: 2mL – 8.00

Holiday Polar – Caramel cake accord with spices of cinnamon/clove/cardamom with orange zest, vanilla rum accord, caramelized tonka bean, brown sugar accord, candy cane accord (peppermint, spearmint, vanilla sugar), Bastet’s Musk, and vanilla bean: CO Slink – 5.00

Holiday Spice Honey – Studio Limited Black Honey Absolute Accord, orange blossom honey accord, clove bud, orange zest, Oxymandias amber absolute, and amber accord: CO Slink – 5.00

Masquerade Khnum – Ylang ylang absolute, Bastet’s Amber, resin of royal sweet frankincense, languid amber, and Studio Limited Original Crystalline absolute (vanilla musk): CO Slink – 4.00

Vanilla Kahk - White Cake Accord, Tahitian Vanilla Bean, Bastet’s Musk, Vanilla Crème, Caramelized Buttercream Accord, Bourbon infused Vanilla Bean, Vanilla Cake Accord, Madagascar Vanilla, and Bastet’s Ice Cream Accord (Vanilla Crystalline Cream, Butter accord, Caramel Accord, French Vanilla Bean Absolute, Vanilla Milk accord, Vanilla Orchid, Crystalline Absolute and Vanilla Sugar): Arae decant 0.5mL – 6.00

**Nui Cobalt**

Black Sheep – Clean lamb’s wool accord, myrrh resin, black seed, ambrette, and barely a whisper of oudh: 1mL – 3.00

Divine Feminine – Madagascar vanilla bean, coconut water, white amber, myrrh, cubeb, sacred benzoin, and a glimmer of cardamom: 1mL – 3.00

Thriving – Opening with cardamom and wild violet, it reveals a heart of Australian sandalwood and Himalayan cedar, then simmers down into molten gold amber and suede: 1mL – 3.00

**Odette Parfum Co.**

Coup de Pied – Mimosa, Île Flottante, blonde musk, olibanum, tolu balsam, vanilla, sandalwood, amber resin, honey incense: house sample: 5.00

Pas de Chat – Madeleine cake, pink pepper, kitten fur, amber, vanilla bean, ambrette musk, tonka bean: house sample – 5.00

Petit Gateau – Honey marzipan, Chantilly cream, brown butter, toasted tonka bean, bruleed vanilla: house sample – 5.00

**Particle Goods**

Ash – Birchwood, oud, Roman basilicas, myrrh, frankincense, cinder: 1mL – 4.00

Ember  - Vintage leather, cognac, thyme, oak, cedarwood: 1mL – 4.00

Lumen – Saffron, tonka bean, cashmere, santal, tobacco: 1mL – 3.00

Nova – Dark plum, cedar, bergamot, black tea, dry hay: 1mL – 3.00

Smoke – Balsam pine, smoked cedar, damp moss, sap: 1mL – 4.00

Spark – Pink pepper, saffron, tonka bean, clove, vetiver: 1mL – 4.00

**Phlur**

Golden Rule – Top: Mandarin Splash, Pink Pepper, Golden Pear Heart: Orange Flower Water, Jasmine Blossom, Coconut Milk Base: Benzoin, Sandalwood, Vanilla Cream: 2mL sprayer – 4.00

Mood Ring – Top: Pitaya Pulp, Sweet Orange, Fruit Gummies Heart: Orange Flower, Jasmine Sambac, Marigold Bloom Base: Patchouli Prisma, Glazed Musks, Sheer Amber: 2mL sprayer – 4.00

Soft Spot – Top: Bergamot Peel, Mandarin, Freesia Heart: Jasmine Petals, Waterlily, Vanilla Orchid Base: Amber, Sandalwood, Musk: 2mL sprayer – 4.00

Strawberry Letter - Top: Cassis Leaves, Strawberry Gariguette, Plum Nectar Heart: Wild Lily, Red Poppy, Apple Blossom Base: Earthy Woods, Tonka Bean, Sugared Amber: 2mL sprayer – 4.00

**Poesie**

Hades – Smooth white musk, warm skin, white patchouli, the sunlit path into an ominous dark forest: 1.15mL x2 – 3.00

**Pylies**

Is It Fall Yet? - Pumpkin incense, stale gingerbread, a drop of honey: Pylie Slink - Freebie

**Siren Song Elixirs**

Ser Jaime – Golden amber, white amber, tonka bean, vetiver, golden sandalwood, ivory oud, cashmere musk: 1.5mL sample – 3.00

**Smoky Mountain Scents**

Le Conte Forte – The top notes burst open with tart grapefruit and gingers beautiful spice.  Very quickly the woody accord that forms the backbone of this scent makes itself known with a gorgeous blend of complex vetiver, earthy patchouli, warm cedar, and dru driftwood.  Accents of gorgeous ambergris and pepper give this powerhouse dimension: 2.5mL sprayer – 6.00

**Sorce**

Witchery - Blackberries, wild violets, galbanum, green stems and thorns, oak moss, benzoin, tree moss, wet stone, mountain mist: 1mL – 4.00

**Tarrifé Attär**

Vanilla Sands - Top Notes: Musk, Middle Notes: Vanilla, Caramel, Base Notes: Musk, Woody Notes: I think it’s the 6mL size; can send pics! – 20.00

**Wylde Ivy**

A Midnight Dreary – Scattered coffee grounds, cedar smoke, rum, well aged leather, black vanilla, singed tonka, dripping wax, with a touch of spiced amber and fireplace embers: 2.5mL sprayer – 4.00

Moonlight Like Mist – Wild heliotrope kissed by moonlight, blonde woods, and white amber all wrapped in a sheer misty musk: 2.5mL sprayer – 4.00

The Owl – Notes of: crystalized wildflower honey, smoked vanilla beans, raw amber, and kindled birch wood: 2.5mL sprayer – 4.00

**Bath & Body**

**Epically Epic**

Green Tea & Mint Lip Balm – Brand New, Never Used – 3.00

**Moonalisa**

Leave In Hair Detangler: Elspeth: A magical and sweet blend of French vanilla, marshmallows, romantic ambers, and smoldering embers: Brand New, Never Used – 8.00  
  


**Wax**

**Wick Wish Candle Co**

Bride of Frankenstein – Top: bergamot, cinnamon leaf Middle: cypress, tonka bean Base: cedar, vanilla, oud, amber: New Clamshell – 5.00

Dead Poet’s Society – Top: teakwood, dried leaves, cashmere Middle: leather, cedar, ozone, amber Bottom: sandalwood, dark musk, patchouli: New Clamshell – 5.00

Mystical Iced Wine – No notes: 0.9 oz bundt pan shape – 1.00

Sweet Cinnamon Pumpkin – No notes: 1.3 oz pumpkin shape – 1.00

Winter Gourd – No Notes: 1.4 oz pumpkin shape – 1.00

**Willow Waxcraft**

P.D. Selkie’s Herbal Emporium – An apothecary cottage full of hanging bundles of dried flowers and herbs, eucalyptus wreaths, vials of crushed lavender buds, sage, white cedar, sandalwood, and soft spearmint: New Clamshell – 6.00

Say No More Mon Amour – A sultry blend of rose, heady jasmine, cashmere musk, vanilla, sandalwood, patchouli and soft nag champa: New Clamshell – 6.00",1,1765381581.0,IndieExchange,1,1.0,False
1pj5wki,https://www.reddit.com/r/Poems/comments/1pj5wki/morning_has_broken/,Morning has broken,"Morning has broken 

It’s a beautiful sound 

Hearing all the sights and sounds. 

The fragrance of the coffee ad it pours 

Sliding down my throat in its creamy velvet . 

Spreading cheer through my entire being. 

The Rooster crowing in the adjacent yard. 

Still not satisfied . 

Making sure everyone hears his morning call. 

There’s a slight chill in the air. 

Though everything is fresh and new . 

Shaking off the feelings of the early morning weariness. 

Strange how these feelings also comfort me though . 

They wrap around me like a warm blanket 

Carrying me through the day. 

I’m sure the mood will change by the afternoon . 

This early morning feeling I wouldn’t trade for the world ",3,1765381576.0,Poems,0,1.0,False
1pj5vg7,https://i.redd.it/pz9vui4lde6g1.jpeg,How is frozen cherry coffee,I came across this today via its email. Read about the process of freezing coffee before processing. Before purchasing it wanted to know if someone has already tried it. Please share your experience/thoughts.,2,1765381509.0,IndiaCoffee,1,1.0,False
1pj5ufe,https://i.redd.it/ybhtg2hede6g1.jpeg,What's the point of the Jack'd Up Sodas?,"I got two to try out of curiosity a dirty coke and blue Lagoon to share with a friend out of curiosity to see what they are about.

They just tasted like regular soft drinks but slightly more syrupy with creamer in it. Not really worth the price of a small stand alone burger in my books.

Obviously I get it they were made and released to make money but who were they made for? What demographic wants expensive medium syrupy sodas with coffee creamer in it? Why did they even come up with such an asinine concept?

Has anyone else even bought one no one on the subject seems to be talking about thrm so I take it they are flopping.",2,1765381444.0,hungryjacks,3,1.0,False
1pj5ud8,https://i.redd.it/watzma5ede6g1.jpeg,Can we anyone explain this flash sale?,When it's says 2 items does that mean 2 per customer order or only 2 items things Will be the £9.99.. very confusing ,0,1765381441.0,Honor,6,0.5,False
1pj5sok,https://www.reddit.com/r/ConstructionManagers/comments/1pj5sok/um_assistant_here_dk_where_else_to_post_is_my/,"Um, assistant here- dk where else to post. Is my boss super weird or is it normal for a $20/hr assistant to handle fleet, repairs, wellness, auctions, janitorial, events, dispatch, timelines, safety checkins, and now ""Can you sneak onto (weird employee)'s property and grab our truck? He won't return","So the folk here at ""Super Large Construction Consultancy"" swear this is normal... My sibling, an engineer, says its both not and is; he agrees that an assistant is effectively the office bish, but that they're taking it to an extreme. 

I don't mind learning, and 90% of the staff are super appreciative of me. The PMs have given me bonuses and sent compliments to corporate, taught me stuff about project management, training me on various field and lab work... 

 Corporate fleet liasons likewise have said I've done a great job, as when I got here in August, 11 company vehicles ordered in 2024 had been waiting for pickup since June, and 43 cars had last been registered in 2022. 

My direct boss, though, acts as if I'm their personal serf and writes angry emails constantly, and is always adding more job titles to mine then focusing on random stuff. Like last 1 on 1 took me to task for ""low coffee pods"", ""you had to be told to stock toilet paper."", but we had three trucks die on lot when the cofree pods had ran low, so I figured fixing the trucks took priority. 

Sometimes she'll report me to corporate then get angry with me when they side with me. Stuff like ""___ has been sending schedules at 3:30, which is late.""- boss ""Well, ____, the contract is they must be sent by 5:00, preferably 3:30. He is right on time, actually""- corporate. 

Trying to send me to retrieve a truck is the latest weird moment. Because four PMs and a field supe just turned to look at her nearly in unison. That makes me really feel my direct is acting out, cause these guys have been in construction before I was born. 

I'm just... I know Rochester NY is a bad spot, the job markets been awful since I got my BS in communications/environ studies in '23 (stacked on top of  an A.a.S in wood tech, smh).. i keep trying to find a better career path, but am hoping this can turn into something good, yk? I just can't tell. ",1,1765381330.0,ConstructionManagers,0,1.0,False
1pj5shb,https://www.reddit.com/r/u_CookingwithDebs/comments/1pj5shb/guinness_gingerbread_cookies_no_molasses_needed/,Guinness Gingerbread Cookies: No Molasses Needed,"**Guinness Gingerbread Cookies**

These cookies are slightly chewy, warmly spiced, and deeply flavored, all without using molasses.

Every family has that one cookie that feels like Christmas, and for my mother, it was gingerbread. One year, she asked if I would bake some for the holidays. The only problem was that I have never liked molasses, so gingerbread simply was not something I made. Still, when your mother asks for something at Christmas, you find a way. 

So I began experimenting.

I already loved cooking and baking with Guinness, and reducing it reveals a deep, warm, caramel-like richness that echoes molasses without the sharp bitterness. It turned out to be the perfect foundation for a gingerbread cookie I could actually enjoy.

These cookies hold their shape well and have a perfect ginger kick. And even though I never liked traditional gingerbread, this version became a favorite. Best of all, my mother loved them.

 

**Ingredients** 

**Cookies**

1 bottle Guinness stout, 11.2 ounces (330 ml)

2 and 1/2 cups all-purpose flour (300 g)

1 teaspoon baking soda

1 tablespoon ground ginger

1 teaspoon cinnamon

1/2 teaspoon cloves

1/2 teaspoon salt

1/2 cup unsalted butter, softened (113 g)

1/2 cup granulated sugar (100 g)

1/2 cup light brown sugar, packed (110 g)

1 large egg

1 teaspoon vanilla extract

2 teaspoons freshly grated ginger (4 g)

2 tablespoons crystallized (candied) ginger (20 g)

 

**Optional Irish Cream Icing**

1 cup powdered sugar (120 g)

1-2 tablespoons Irish cream

 

**Method**

 

**Reduce the Guinness** 

Pour the full 11.2-ounce bottle of Guinness into a small saucepan.

Simmer gently until you have 2 ounces, which equals 4 tablespoons (60 ml). This usually takes about 15–20 minutes, depending on your stove and pan.

Keep an eye on it while it simmers so it does not reduce too far or burn. You do not need to stir it.

If you are unsure whether it has reduced enough, carefully pour it into a heatproof measuring cup, such as Pyrex, to check the volume.

If you have more than 2 ounces, return it to the saucepan and continue reducing.

If it over-reduces and becomes thick or sticky, stir in 1-2 teaspoons of hot water until it becomes a smooth, pourable syrup again. A small amount of water will not weaken the flavor.

The reduction will thicken slightly as it cools; measure by volume rather than appearance.

Let the reduction cool completely before using.

 

**Make the dough**

  
Very finely mince the crystallized (candied) ginger and set aside.  
In a medium bowl, whisk together the flour, baking soda, ground ginger, cinnamon, cloves, and salt.  
In a large bowl, cream the softened butter with the granulated sugar and light brown sugar until light and fluffy.  
Beat in the egg and vanilla.  
Add the cooled Guinness reduction, the freshly grated ginger, and the crystallized (candied) ginger. Mix just until combined.  
Add the dry ingredients in two portions, and mix just until the dough comes together.

 

**Chill** 

Gather the dough into a disk, wrap it well, and refrigerate. Chilling the dough overnight gives the best flavor and easiest rolling. If you are baking the same day, chill for at least 2 hours.

Longer chilling improves flavor, firms the dough, and helps the cookies keep their shape during cutting and baking.

 

**Roll and Cut**

Preheat the oven to 350°F (175 °C).

Lightly flour your surface and rolling pin, then roll the dough to about ¼-inch thickness. This is roughly the height of two stacked quarters.

Re-flour lightly as needed if the dough starts to stick. Avoid using too much flour, as it can change the cookie’s texture.

Cut into shapes or rounds. An inverted glass works well for rounds.

Transfer the cutouts to a parchment-lined baking sheet and chill them for about 10 minutes before baking. This helps prevent spreading while keeping the edges clean and sharp.

 

**Bake** 

Bake 8-10 minutes for slightly chewy cookies. The edges should look set, and the centers may still look slightly soft.

For crisp or structural cookies, bake 2-3 minutes longer. Do not exceed this, or the cookies may overbrown and become bitter.

Let the cookies cool on the baking sheet for 2 minutes, then transfer them to a rack to cool completely before icing.

The cookies will feel soft when they come out of the oven, but will firm up as they cool.

 

**Irish Cream Icing** 

The cookies are delicious on their own, but the Irish cream icing is a nice optional addition for a holiday touch. 

Sift the powdered sugar into a small bowl so the icing is smooth and free of lumps.  
Whisk the sifted powdered sugar with 1-2 tablespoons of Irish cream until smooth.

Add more Irish cream for a thinner icing that drizzles easily, or add a little extra powdered sugar for a thicker consistency that holds its shape for piping.

Any leftover icing is great in coffee. It’s also wonderful drizzled on pancakes or French toast.

Ice the cookies only when they are completely cooled, or the icing will melt off.

 

**Storage**

 Store the cookies in an airtight container for up to one week.  
Baked cookies can be frozen, with or without icing, for 3-4 months.  
The dough can also be frozen for 3-4 months. Wrap it well, and thaw it in the refrigerator before rolling.

 

**Note** 

**Why three gingers?**

  
Using ground, fresh, and crystallized ginger gives these cookies layers of flavor. The ground ginger adds warmth, the fresh ginger adds brightness, and the crystallized ginger adds tiny, chewy pops of sweetness. I first learned about using ginger in multiple forms from chef Lorraine Pascale on one of the holiday baking shows, and it completely changed the way I approach ginger cookies. It creates a balanced and deeper ginger flavor without overwhelming the cookie.",1,1765381317.0,u_CookingwithDebs,0,1.0,False
