id,url,title,text,score,created_utc,subreddit,num_comments,upvote_ratio,over_18
1m3cpk7,https://www.reddit.com/r/NoStupidQuestions/comments/1m3cpk7/havent_heard_from_match_in_a_day_should_i_cut/,"havent heard from match in a day, should i cut?","first day we matched on hinge we taLKed the whole day. i almost lost her because she didnt do coffee dates and i thought dinner was too premature for a first date, but i got her back and she eventually asked if i'm on IG. i told her to follow me and she did, later that night she said ""message me on IG""i sent a gif and a reaction to her story. she even asked if i like tall girls. but she hasnt sent any messages since, on hinge or ig. i know she was busy yesterday since she posted a reel showing what she did, but still nothing. should i just wait or cut the loss?",1,1752869628.0,NoStupidQuestions,0,1.0,False
1m3copj,https://www.reddit.com/r/family/comments/1m3copj/need_advice_on_how_to_proceed_with_my_parents/,Need advice on how to proceed with my parents. Feeling guilty.,"I (40f) really need advice with how to proceed with my family (parents mid-60s). This has been going on for years and I’m reaching a breaking point. 

My husband and I got engaged in December 2022. My parents were so happy for us, and cried tears of joy as I had gone through a divorce years prior and they were happy to see me happy again and in a healthy relationship. They also loved my boyfriend. 

Over the next couple weeks, my fiancé and I decided to have a destination wedding as we had both done the church and big wedding thing in both of our previous marriages, and wanted something more simple and fun. We decided Mexico would be the place and picked a date for January 2024 (13 months away). We made this announcement to our families. My husband (fiancé at the time) has children in their early 20s, whom were very excited about this. My parents…not so much. Their first excuse, in what would be a series of excuses, was they weren’t sure if they could get time off work. My mom is a hairstylist and owns her own salon, and my dad had been with his company for 25 years at that point. Not to mention, this was over a year’s notice. I was kind of taken a back by it. I briefly considered it may be an issue with finances, but they had recently paid off their house and had mentioned then, that it was nice to have the extra money each month. 

A few weeks go by and my fiancé and I are at my parent’s house visiting and we bring up the wedding. My mom gets all serious and says she’s not sure she’ll be able to go, she has developed a debilitating fear of flying. I’m shocked by this, as she had recently gotten back from a trip to AZ with her sisters in which she had to fly. Never once mentioned it when I had asked her how her trip was. This is feeling like another excuse, but I try to be sympathetic and suggest talking to her doctor about this, maybe he can prescribe medication or we can look into meditation. I offered to help figure something out as we have lots of time. Then, later that evening, my dad suggests getting married in Hawaii. I looked at him with utter shock, informing him mom would still have to fly there. I’m getting a sense that Mexico is the issue. This is confirmed as the weeks go on and they explain to me that they don’t feel safe going to Mexico. My parents don’t do a lot of traveling outside of their little bubble. So, to me, this is a valid concern, especially with how Mexico can be made to look in the media. So, we have them over and go over where we are going, a nice resort town and gated resort. Explained safety of this area vs traveling to other areas in the US that can be just as bad, but aren’t perceived this way as it’s in the US. I need to point out now, that my parents are very conservative Christian (Christian Reformed) and MAGA. And not just MAGA, they are QAnon. I am none of those. So, explaining to them the safety of where we are going while they are getting conflicting info from Trump and the media is proving to be difficult. At one point in a separate conversation with my dad, me mentions they are “afraid of the people”. 

We are now a few months from the wedding. It’s fall 2023. My parents have actually agreed to go and booked their plane tickets and put down a deposit with the travel agent I had been using for all of this (travel agent confirmed this to me). But in all of this time, there has been no excitement on their part about the wedding. No questions asked about how wedding planning is going, what we are doing for this or that. But, I’m trying not to let it bother me. 

A few weeks later, I brought my mom along to my wedding dress fitting where she will be seeing me in my dress for the first time and the only comment out of her mouth was how I “better not put on any weight”. What was supposed to be a meaningful moment has been ruined. I’m quiet on the ride back to drop her off at home. 

At this point, I’ve had enough and I send a text to my parents explaining how I’m feeling and that it feels like they don’t want to go. They respond with “we see the world differently”, how it’s a dangerous place and “WWIII Russian Sleeper Cells are waiting” blah blah blah. I tell them they need to decide why to do, that I’m done begging them to go. A few weeks go by and it’s been radio silence. I text them asking if they made a decision. My dad’s text 6 weeks before we are supposed to leave: 

“I have to inform you that we will not be going to Mexico.  We do not need any reimbursement for anything. I will call travel agent tomorrow.”

I never responded. I was devastated. My fiancé texted them asking week later asking them not to contact me, that I was heartbroken. He told them we’d reach out sometime after the wedding. I blocked them, so I don’t know if they ever attempted to contact me. 

The wedding and trip was AMAZING. They missed out on something very beautiful and special. About 2 months after we get back, I unblocked them and ask if they want to come over and visit about things. My goal in this was to figure out the exact reason they didn’t want to go. I heard so many excuses and I was so lost. They told me it’s because they were so torn, they visited with their “therapist” aka pastor and he told them not to go. What?! Shocked again. I couldn’t even look at them during this visit. We sat around our dining table and I just looked at my husband or down at my coffee. I couldn’t bear looking in their eyes. I never got the sense that they regretted it. I feel like they regretted the outcome, but to me that’s different than regretting their actions. This visit made them feel like our relationship is good again and they started reaching out. Just mundane stuff, sending cute videos or telling me about so and so. I wouldn’t respond as I wasn’t ready. They’d notice the silence after a while and then ask what’s wrong. I’d explain I’m having a hard time moving on. They’d say nothing. This has been going on for months now. And in this time, we’ve had some extended daily issues that brought us all together. I feel like my presence during this gave them the feeling of “she’s back, we’re a family again” but it wasn’t like that for me, I was being supportive to the rest of my extended family. The cycle would then repeat. 

I finally texted them and asked them what did they think would happen when they decided not to go to the wedding. My mom says:

“I never dreamt in a million years that it would cause such a heartache for you. To be absolutely honest I don’t think I ever thought past the not going.”

I responded saying that was shocking that she didn’t think of the results of her actions. Radio silence. Haven’t heard anything from her since May 6. My dad has texted randomly about unrelated stuff. 

I don’t know how to move on. I am feeling incredibly guilty not having them in my life and missing out on little milestones or events in my and my new families lives. Not to mention what’s  going on in theirs. But I’m still so incredibly hurt by what they did. Clearly they just want to sweep things under the rug and pretend it didn’t happen and move on, but I can’t and I don’t want a surface level relationship with them. What do I do?!

TLDR: parents made excuse after excuse not to come to my wedding, not shocked that I’m having a hard time having a relationship with them. Feeling guilty about it and need advice. ",1,1752869570.0,family,1,1.0,False
1m3cokk,https://v.redd.it/ecu205q4xodf1,New beans,"Dialed in new coffee beans (Barista Essentials -Cuba, four weeks old) on my Rocket Mozzafiato Fast R. 
18,7g in, aimed for 44g out in 29 seconds. I’m blown away by the taste and can highly recommend them. ",1,1752869560.0,espresso,1,1.0,False
1m3cmlt,https://www.reddit.com/gallery/1m3cmlt,"1BD AUG 1 in 5BD, 3BA House in NE Portland","ONE BEDROOM AVAILABLE in 5 bed, 3 bath house in NE Portland. 

4 roomies, 3 cats, 1 part time dog
(We can't take any more pets, sorry!)

$747/mo + $100/mo for all utilities billed through management company (gas/water/sewer/electric/garbage/internet) 

WE ARE SEEKING ONE ROOMATE who is communicative, honest and responsible, to be a part of our new queer community. We would prefer sapphic (no cis men), queer and neurodivergent folx. Ideally someone 25-45 years old with reliable income and ability to pay rent/utilities on time. We want to have monthly house hangs and be a community, not just roommates. No cigarette smokers, no party animals, 2 roomies are sober from alcohol, so we would prefer mild or non drinkers. This is a sex positive household.

THE ROOM: Available room is at the top of the stairs on the second floor (about 14 steps). About 12' × 10' with huge closet and secret door to attic space storage, room has a built in air conditioning unit. Also some storage in basement. Rest of house is central A/C & heat. Full shared baths on three floors, tubs on main and 2nd floor, 1 shower on basement level. 2 large and 1 medium common spaces on main floor, 1 small common space in basement. Two sets of washer/dryers, one on 2nd floor and one in basement. Lots of built in shelving and large windows. We are in need of more common space furniture (dining table/chairs/breakfast table, book ladder). Large fenced in backyard and full herb and veggie garden.

THE ROOMMATES: 
J(xe/xem) 28, enby, Librarian, queer, alt, disabled, neurodivergent, stoner, has 1 ESA cat, xyr bedroom is on 2nd floor.

S(they/them) 39, enby, Nurse, queer, alt, disabled, neurodivergent, 1 ESA Dog that lives here every other week. Sensitive to smoke so any cannabis use must be only in your room or outside, their bedroom is in the basement.

E(they/she) 26, enby, SWer, queer, neurodivergent, outdoorsy, their bedroom is on main floor.

C(they/she) 25, enby, Caregiver, queer, neurodivergent, disabled, has 2 cats but only one is free to roam, their bedroom is on 2nd floor.

There is an ADU on the property with access to the yard and driveway. We only split utilities with the occupant, J(he/him) who is a very helpful hand when we need.

Everyone will be moving in on Aug 1st, except S, who already lives here.

4 min walk to Grant Park and off-leash dog area, 8 min walk to 70 & 75 bus lines, 15 min walk to Hollywood area, restaurants, coffee shops, Hollywood Theater, Trader Joes, Whole Foods, Grocery Outlet, 24hr vet hospital and Portland Urgent Care. 22 min walk or 12 min bus to MAX Hollywood/NE 42nd stop for green/red/blue lines.

No lease, credit check or background check. 1 year minimum stay, photo ID, proof of income, and signing housing agreement required. No security deposit or last month. First month ($747) due upon move in 8/1/25.",1,1752869427.0,PDX,0,1.0,False
1m3clxb,https://i.redd.it/v7ok809mwodf1.jpeg,Rancilio Silvia print,"I got my first Rancilio Silvia earlier this year and I’m loving it.

So to keep affording my home coffee setup, I decided to make a posters of it to my fellow coffee lovers.

https://rodrigofortes.etsy.com/listing/4337712063

Thank you!",1,1752869380.0,Illustration,0,1.0,False
1m3clv5,https://www.reddit.com/r/WillAndGrace/comments/1m3clv5/sean_laughing_in_the_background/,Sean laughing in the background,"In “Went to a Garden Potty” (4.20) in the scene where Jack is talking to Zandra in the coffee shop, I never noticed before that you can just barely make out Sean laughing as Zandra says “you go back to this brainless fart . . . And you beg like a gypsy in an airport” 

It’s all out of focus on the back of his head but you can totally see him shaking with laughter 🤣",1,1752869375.0,WillAndGrace,0,1.0,False
1m3ckpy,https://www.reddit.com/r/ItalyTravel/comments/1m3ckpy/best_snacks_to_bring_back/,Best Snacks to bring back?,"Hi there! My mom is leaving for Italy on Monday and I'm putting together a list of things I want her to try and bring back to me. So far I have ringo, pocket coffee, pan goccioli, grisbi, pan di stelle, krumiri, freeky fries, and gocciole. I'm trying to get things that dont exist here in the US. I love sweets( obviously), fruit flavors, spicy, caramel, and drinks (teas, juices, coffee). Thanks for any recommendations!",0,1752869299.0,ItalyTravel,1,0.5,False
1m3cjwi,https://www.reddit.com/r/CAMI_BOCCI/comments/1m3cjwi/tommaso_contanti/,tommaso contanti,"Mi amore, mi amore  
Espresso macchiato, macchiato, macchiato  
Por favore, por favore  
Espresso macchiato corneoMi amore, mi amore  
Espresso macchiato, macchiato, macchiato  
Por favore, por favore  
Espresso macchiato  
Espresso macchiatoAh-ah  
Ah-ah  
Ah-ahCiao bella, I'm Tommaso  
Addicted to tobacco  
Mi like mi coffee, very importante  
No time to talk e scusi  
My days are very busy  
And I just own this little ristorante  
Life may give you lemons  
When dancing with the demons  
No stresso, no stresso  
No need to be depressoMi amore, mi amore  
Espresso macchiato, macchiato, macchiato  
Por favore, por favore  
Espresso macchiato corneoMi amore, mi amore  
Espresso macchiato, macchiato, macchiato  
Por favore, por favore  
Espresso macchiato  
Espresso macchiatoMi like to fly privati with 24 carati  
Also mi casa very grandioso  
Mi money numeroso  
I work around the clocko  
That's why I'm sweating like a mafioso  
Life is like spaghetti  
It's hard until you make it  
No stresso, no stresso  
It's gonna be espressoMi amore, mi amore  
Espresso macchiato, macchiato, macchiato  
Por favore, por favore  
Espresso macchiato  
Espresso macchiatoLa-la-la-la  
La-la-la-la  
La-la-la la-la-la la-la la-la la-la-la-la  
La-la-la la-la  
La-la-la-la  
Espresso macchiato  
Espresso macchiato",1,1752869242.0,CAMI_BOCCI,0,1.0,False
1m3cih8,https://i.redd.it/pfs2uoaxvodf1.jpeg,Gratitude Day 283 • Flower of Life,"I am so grateful this morning, because I made it. I’m here, as I said I would be, as my intention fully manifested. The Dream I dared to dream.. posting gratitude IN THE AM of my day 💕🌞🙏✨

I am happy and excited for the open vessel of my souls that has the capacity to be filled with a multitude of things to be grateful for — right now, I am so grateful to be HERE, in conscious expectation, trust and faith that there will be much to give pause and praise — and that I will carry this with me all day.

This quote from ‘The Pivot Year’ book by Brianna Wiest for Day 48 really connected with me when I read it during my morning coffee- because I love flowers so much -and because it’s time for me to walk outside, and start looking for flowers ✨🌸🥰❤️‍🔥 Maybe I will start small, a 5-day goal. This seems reasonable 🌟🌟🌟🌟🌟

Really excited to begin, wish me luck 🍀🤞🤗

",1,1752869150.0,gratitude,0,1.0,False
1m3ci8t,https://i.redd.it/zjztej8vvodf1.jpeg,The wackywatch.com updated!,,0,1752869136.0,TheDigitalCircus,1,0.5,False
1m3cgrh,https://www.reddit.com/r/NoStupidQuestions/comments/1m3cgrh/does_brewed_coffee_have_more_sugar_than_instant/,Does brewed coffee have more sugar than instant coffee?,"I'll admit that instant coffee doesn't taste the same as brewed, but with a tiny bit of sugar, about a quarter of a teaspoon, it tastes pretty close to brewed coffee.

  
I'll add that I use an intant coffee that is made of arabica beans, not robusta beans which is common for instant and it makes a very nasty coffee.",1,1752869036.0,NoStupidQuestions,3,1.0,False
1m3cglo,https://www.reddit.com/r/OCPoetryFree/comments/1m3cglo/refugesus_the_holy_hitchhiker/,Refugesus (The Holy Hitchhiker),"Refujesus came strolling one fine desert morn,  
With a pack made of socks and a halo well-worn.  
His robe was all wrinkled, his sandals were shot,  
And his holy beard tangled in knots he forgot.

He knocked on a door with a sign that said “NO,”  
So he scribbled *“Just checking!”* and gave it a go.  
The guard said, “Your paperwork’s centuries late.”  
He shrugged, “Well, I *did* rise again—give or take.”

At customs they asked him, “What’s your intent?”  
He said, “Mostly kindness, and maybe a tent.”  
They searched through his bag full of loaves and old fish,  
And muttered, “This fellow is oddly delish.”

He wandered through cities where rich people dined,  
And offered free hugs, which they all declined.  
He juggled some figs for a small caravan,  
And healed a man’s rash with a big frying pan.

He taught a stray goat how to moonwalk on cue,  
Turned mud into coffee and socks into stew.  
He crashed at a hostel (they charged him in prayers),  
And bartered his sandals for two folding chairs.

He shouted, “Rejoice!” at a laundromat crowd,  
Then tripped on a mop and proclaimed it out loud.  
He baptized a duck by mistake in a sink,  
Then gave it a name: “Little Savior, I think.”

He passed by a wall that was ten stories tall,  
He climbed it with grace and a pink rubber ball.  
When questioned by guards if he *had* a real visa,  
He whispered, “I *am* the divine… Refujesus.”

So next time you see someone weird and divine,  
With grapes in his pockets and shoes made of twine,  
Offer a snack and a laugh or a song—  
You might host the Messiah just tagging along.",1,1752869025.0,OCPoetryFree,0,1.0,False
1m3cg76,https://i.redd.it/ym83345fvodf1.jpeg,The wackywatch.com updated!,,2,1752868998.0,theamazingdigitalciru,0,1.0,False
1m3cg2n,https://www.reddit.com/r/SaaS/comments/1m3cg2n/im_doing_everything_i_can_but_still_no_traction/,"I’m doing everything I can, but still no traction.","I don’t even know where to post this anymore. I’ve built something I truly believe in — [go-publicly.com](https://go-publicly.com) — a simple place where makers can launch their products and maybe, just maybe, get some visibility.

I’m not sitting in some coworking space sipping coffee with a team of devs. I’m literally working from a tiny rented room, building this between support shifts at night and sleep days.

I write every line of code myself. I reply to every email. I write the blog posts, fix bugs, tweet, DM, cold reach — all of it. Every single launch I treat like it’s special. Because I know what it feels like to shout into the void and hear nothing back.

But... no traction. Not much attention. Most days, barely a few visits. It's been months. And yeah, I’m tired. Not quitting, just... tired.

If you’re a builder like me, maybe just take a look. Maybe launch something there. Even a dead side project. Maybe tell a friend.

I'm not trying to guilt anyone. Just sharing my reality. And hoping someone somewhere sees me.

Thanks for reading. Really. 🙏  
— Sathish",0,1752868990.0,SaaS,0,0.5,False
1m3cfbt,https://www.reddit.com/r/DiaryOfARedditor/comments/1m3cfbt/real_71824_progress_and_promise/,[Real] (7/18/24) Progress and Promise,"First quiet weekend in a while, and it's still not that quiet.

The in laws will be here next weekend. I feel like I've made peace with a lot of that. They'll never treat me the way I want. I will always be subhuman to them. I don't care, I'm not here to be their friend. My job is to raise my daughter, love my husband and build a good life. I feel like we are accomplishing that.

Fridays are weird. Summer hours mean a short day. I had to buy coffee this morning. Passed a ghost along the way, and felt nothing. Sad to realize I feel nothing, but nothing is the correct thing to feel. Ended up going out to husband's work after I got out of work, he had my Costco card. Now I get to wander Costco all by myself. It's a great feeling. It's cool enough I might be able to go grocery shopping too, but we will see. Can't have my stuff melting in the trunk.

Husband already started a list of things to do this weekend. My responsibility is going to be the inside of the house. Laundry, bathrooms, ect.

I get to go spin this weekend too. Im excited to see how that goes. Im looking forward to making friends hopefully.

Better get a move on I suppose.",1,1752868939.0,DiaryOfARedditor,0,1.0,False
1m3cdl3,https://www.reddit.com/r/workfromhome/comments/1m3cdl3/are_there_any_decent_portable_laptop_extension/,Are there any decent portable laptop extension monitors that are less than $100,"As the title says, I am looking for something to take with me to a coffee shop or library when I work out of the house that would serve as a second monitor.  I don't do video editing - it would mainly be for spreadsheets, docs and web.  Any suggestions would be helpful - thanks

",1,1752868830.0,workfromhome,0,1.0,False
